x1,x2,label,lang,texts
0.005561127339642828,-0.0017216336813597908,1,sk,"Bush prezidentoval počas dvoch vojen, aj iracká, aj afganská bola súčasťou vojny proti terorizmu, ktorá sa naplno začala po útokoch z 11. septembra 2001."
0.00021776755255959967,0.0022206383927367095,1,sk,"Kedze nie som medzi finalistami,lebo ma tam nechceli LUDIA,zopar detskych klinik a detske domovi prisli o peniaze,planoval som totiz polovicu vyhry dat na charitu."
0.0006804488051373432,0.0012154474368702977,1,sk,"S láskou a úctou spomínajú mama, sestra, dcéry a vnučka Alicka „Bez teba hviezdy nesvietia, len bolesť padá z neba, kamkoľvek nám oči padnú, vidíme len teba."
7.995808577953569,-0.22380140914118013,2,es-ES,"Con una hija de dos años, sin formación académica y tras doce meses de búsqueda de trabajo sin éxito, esta joven santanderina necesitaba encontrar la calma necesaria para empezar desde cero. Por eso acudió a los servicios sociales del Ayuntamiento de Santander. Itziar no lo sabía, pero en ese momento se estaba poniendo en marcha un proyecto, llamado 'Enlace', que parecía diseñado para ella. El objetivo de este plan, gestado por el Consistorio y la asociación Nuevo Futuro, es ofrecer viviendas a madres o mujeres embarazadas sin recursos económicos de forma temporal hasta que salgan adelante."
0.000599715622201442,0.007373817255096696,1,sk,"Mapujú úroveň intelektových schopností. Niekoľko subtestov sa zameriava na verbálne nadanie, matematické a technické schopnosti, aj na krátkodobú pamäť. Výsledkom je profi l študenta, presné pomenovanie jeho silnejších i slabších stránok. Na základe toho mu psychológ dokáže odporučiť možné alternatívy štúdia, respektíve uplatnenia v praxi. Avšak nie vždy sú zistené predpoklady totožné so záujmami či očakávaniami klienta od štúdia. V niektorých prípadoch majú klienti nereálne očakávania od štúdia či povolania."
10.411337069689997,1.8816258461977062,2,es-ES,"Por último, y preguntados por los jugadores rivales más a seguir, el cuerpo técnico del Ampo Ordizia alababa sobre todo las virtudes del ocho de El Salvador, el jugador samoano Joe Mamea, al que calificaban de jugador físicamente muy fuerte y con mucho rugby. Además, destacan la incorporación, este año, del medio melé titular de la selección española, Pablo Feijóo, como director de orquesta en la delantera del 'Chami', y por lo que dicen, del recién llegado medio de apertura samoano Uale Mai, que aterrizó en la entidad vallisoletana tras el descarte del anterior fichaje para el puesto de diez."
4.7634525959632885,1.3884491195753386,2,es-ES,"El almacén con más títulos editoriales de todo el mundo, que alcanzará entre 200.000 y 250.000 referencias a partir del próximo enero, fue inaugurado ayer en Málaga por la librería Agapea.com, especializada en la venta de libros por Internet y en su entrega urgente. Desde aquí parten pedidos a todo el mundo."
3.2735519672126627,0.9846335031732708,2,es-ES,"El organismo supervisor apunta que la financiación obtenida tanto por los hogares como por las sociedades ha seguido avanzando a una tasa interanual prácticamente nula, al tiempo que la deuda de las Administraciones Públicas continúa creciendo a un ritmo elevado."
0.0032458495828648183,0.008009305954257091,1,sk,"Start na historickom Karlovom moste Vo stvrtok 22. marca sa Miroslav Haninec zucastnil na Trnavskej polhodinke na drahe, kde spomedzi 70 pretekarov v kategorii do 40 rokov zvitazil a zabehol 9 kilometrov."
3.948585368943608,-1.1953048281733072,2,es-ES,¿Qué te parece rodar fuera de España? Me gusta porque tiene un punto de aventura y de inmediatez. Me pone un poco el estar de repente en un desierto o en una selva.
0.009592505758368251,0.013553412877583645,1,sk,"Ak chce, potom sa tam objavujú veľmi zaujímavé, nové momenty, ktoré si po prvom prečítaní ani nemusíte všimnúť,"" hovorí o Malých manželských zločinoch Lasica."
0.0006250624034831565,0.003223005692695318,1,sk,"Viliam Šulek a Karol Holuby zohrali jedinečnú úlohu v prvej etape Slovenského povstania, ktoré sa začalo 22. septembra 1848 bitkou pri Brezovej pod Bradlom."
0.00013088702763035663,0.0019463976917927946,1,sk,"Záverom oslavy sa I. Klauszová Fúziková poďakovala organizátorom oslavy, gymnazistke B. Erdeiovej a speváckemu zboru za umelecký zážitok a všetkým prítomným, ktorých bolo okolo sto, za ich účasť."
0.0005834219290937772,0.008270265389113565,1,sk,"Kruh akoby sa uzavrel. Je na nás, aby sme sa rozhodli, či v deň lásky na Valentína sa budeme venovať síce paradoxnej, ale predsa obohacujúcej láske, alebo podľahneme absolútnym hľadiskám príťažlivosti, ktoré sa nám zdajú veľmi reálne, v skutočnosti sú však simulákrami."
0.00031928338792677877,0.004489844066889989,1,sk,"Súčasťou celkového dojmu z lokality nie je len príjazd, ale aj statická doprava, teda parkovanie. Dlhé diely sú známe najmä stovkami áut, lemujúcimi dlhú stúpajúcu cestu pomedzi novopostavené bytovky a staré paneláky. Koráliky áut na lákavosti nepridávajú. „Záujem o Dlhé diely ochabuje,“ hovorí šéfka spoločnosti Bond Reality Daniela Rážová a dodáva, že okrem dopravných problémov je to najmä pre neustály stavebný ruch."
7.164319957560307,0.0684656065857054,2,es-ES,"El delegado de participación ciudadana de la Policía Nacional, Manel González, explicó que el hombre ya realizó una acción similar el pasado año en la zona del Edificio Las Moreras, sede de la Cámara de Comercio. González confirmó que el ciudadano de origen marroquí estaba recibiendo tratamiento médico por posibles desequilibrios psíquicos."
0.0041692736556019966,0.002789143589722655,1,sk,"Slovenská metropola bola 44. najdrahšou kancelárskou lokalitou v roku 2008 na svete, čo značí pokles o šesť miest oproti predošlému roku. Najvyššie priemerné nájomné dnes podľa firmy dosahuje 25 eur/m2/mesiac. „Slovensko aj naďalej zostáva medzi lacnejšími lokalitami, čo sa týka kancelárskych priestorov, obzvlášť v regióne strednej a východnej Európy,“ hovorí Andrew Thompson, výkonný riaditeľ bratislavskej kancelárie Cushman & Wakefield."
8.104609047703,-3.5800875249774045,2,es-ES,"Desde la formación de izquierdas recuerdan que el pasado mes de febrero la Consellería de Medio Ambiente sometió a información pública la autorización ambiental integrada (AAI) solicitada por INUSA para ampliar la planta de residuos de Fontcalent con un nuevo vaso de vertido con capacidad para 1,8 millones de toneladas de basuras."
11.538397933119366,-3.125552082954753,2,es-ES,"También ingresó en la tarde de ayer en la prisión de Soto del Real el abogado Txema Matanzas, que había acudido a visitar a su compañera sentimental a esa cárcel. De regreso al País Vasco fue detenido por la Guardia Civil, que había recibido la orden de la Sección Tercera de la Sala de lo Penal de la Audiencia Nacional. Según los datos que han trascendido, ha sido condenado a 14 años por ser uno de los dirigentes de ETA."
6.339278217761577,-2.2113861497469784,2,es-ES,"La fase cuatro, que está en ejecución, busca la recuperación y conservación de la masa forestal en la ladera sur de la Peña, con la eliminación de especies autóctonas invasoras y la plantación de arbolado autóctono."
6.945592550068888,-0.694131725190658,2,es-ES,"Durante algo más de una hora, 48 músicos dirigidos por Juan José Ocón, 12 cantantes y 10 bailarines se unirán para representar 'Gernika, danza sobre lienzo', un espectáculo de Aukeran basado en una partitura del músico Aitor Amezaga que narra lo ocurrido en abril de 1937 en la villa vizcaína y que se complementará con la interpretación de la Marcha fúnebre de Pablo Sorozabal."
10.126717645989512,-3.2700264682912787,2,es-ES,". Indudablemente, los médicos de las enfermerías de las plazas de toros han de ser auténticos aficionados a la fiesta, aunque ello les reporte pasar malos tragos cuando han de intervenir, máxime si son, como casi siempre ocurre, amigos personales de los que se visten de luces. Sin embargo, el amor a la profesión y la propia vocación de estos facultativos se impone para que no les tiemble el pulso a la hora de coger pinzas y bisturí para curar una cornada."
0.006757351333182533,-0.007261565759220435,1,sk,"Najvyšší prírastok nominálnej mzdy v druhom štvrťroku tohto roku zaznamenali v dodávke elektriny a plynu, a to o 14,9 %. Vo finančných a poisťovacích činnostiach rástla o 11,6 %, v ťažbe a dobývaní o 9,1 % a v informačných a komunikačných činnostiach o 8,3 %. Mzda sa znížila len vo verejnej správe, obrane a sociálnom zabezpečení o 3,4 %."
3.703196931902588,0.9791668484060281,2,es-ES,"Por provincias, el 2010 fue peor para el empleo en Soria, con un 13,70% (644 desempleados más), y en Ávila, con un 13,26 (1.754 parados más), los dos mayores incrementos anuales provinciales de toda España sólo superados por el 18,70 de Melilla."
0.0003584613118073938,0.004375870843781075,1,sk,"Podľa nich nebol na Slovensku v dobrých časoch plne využitý potenciál na konsolidáciu, záväzky vyplývajúce z Paktu stability a rastu sú nedostatočné a sklony k deficitnému hospodáreniu majú všetky vlády bez ohľadu na orientáciu."
0.0002870213452408966,0.0039020921633517846,1,sk,"Fúzne zariadenia má niekoľko desiatok laboratórií, ale žiadnemu sa nepodarilo udržať plazmu, t.j. rozpálenú zmes vodíkových iónov, v magnetickom poli tak dlho, aby sa fúzna reakcia dala komerčne využiť na výrobu elektrickej energie."
0.0001702583519852622,0.0031010260941440114,1,sk,"Je to čisto akademický spor, pretože je jasné, že máte možnosť dostať sa k serióznym informáciám, z ktorých Vám musí byť jasné, že pani Hedviga Malinová neklame."
9.228298999722012,0.07063435944681362,2,es-ES,"En esa sesión de Pleno el PSOE se mostró crítico, ya que recordó que después de cuatro años en el gobierno municipal y 16 años al frente de la Generalitat, que es la que tiene las competencias en la materia de depuración de las aguas residuales urbanas, «Bernabé, del Partido Popular, intentara echar las culpas de la situación actual a los anteriores responsables socialistas»."
5.728293812319348,2.192483093630481,2,es-ES,"A su juicio, ""la intensidad del crecimiento futuro va a depender de las medidas de política económica que tomemos"" y en este sentido, aseguró que las decisiones adoptadas por el Gobierno central ""pueden llevarnos a la famosa 'L', es decir, que dejemos de caer pero que apenas crezcamos durante bastantes años; que no crezcamos lo suficiente para generar empleo""."
7.745075169350164,-0.4313042036994076,2,es-ES,"MADRID. «No nos movemos de casa por si suena el teléfono y nos dannoticias de nuestra hija. Con cada timbrazo el estómago y el corazón nos da un vuelco». Así están siendo los días de Luis y Mariola, una joven pareja peruana que está viviendo los peores momentos de su vida. Llevan 18 días de angustia e incertidumbre, los mismos que hace que falta de su domicilio su hija mayor, de 15 años, Andy Lisset."
5.003194753906383,5.860480960748979,2,es-ES,"A todos estos problemas se le suma el deterioro del suelo, que es de tierra, y que con el paso del tiempo, se ha erosionado, lo que ha causado que se agriete y que se hunda en algún tramo por debajo del nivel del alcantarillado, lo que puede ocasionar caídas a los viandantes."
0.003044280319723694,0.00793753170828933,1,sk,"Informácie o realitných projektoch uvedených na tejto stránke majú komerčný charakter. Sú prevzaté z prílohy EXTRA REALITY týždenníka TREND, ktorá vyšla 4. októbra 2007. Cieľom je poskytnúť čitateľovi prehľad pripravovaných a realizovaných novostavieb v jednotnej obsahovej a grafickej úprave. Ďalšie vydanie prílohy EXTRA REALITY pripravujeme na jar 2008."
3.3718898891036577,1.6808043998954534,2,es-ES,"El entrenador alicantino no ha desvelado quien acompañará a Sergio Pelegrín en el eje de la defensa y, en ese sentido, ha dicho que confía tanto en Samuel Llorca como en Héctor Verdés para sustituir a Etxeita."
0.009998534868100963,0.018246599200217137,1,sk,"Pri príprave chleba sa na prvý pohľad zdalo, že výsledky sú v porovnaní s konvenčným pečením identické. Bochník pripravený tradičnou cestou bol však mokrejší a na druhý deň bola jeho kvalita znateľne nižšia ako pri tom, ktorý sme pripravili v špeciálnom režime. Pre tých, čo si život bez pizze, osúchov a domácecho chleba nevedia predstaviť ide o praktickú funkciu."
3.064145391236326,2.3184793253643097,2,es-ES,"El presidente del Congreso de los Diputados, José Bono, ha destacado que ""contra ETA, lo mejor es Rubalcaba y Guardia Civil, mucha Guardia Civil y mucha Policía"". ""Eso es lo que necesitan y cuando estén con los brazos en alto y pidan rendición, entonces ya negociaremos en qué cárcel van a cumplir su pena"", ha remarcado"
5.121990669099008,-0.32118532193594196,2,es-ES,"Según informó a Efe un portavoz de la Delegación del Gobierno, entre los manifestantes solamente se han registrado heridos «de carácter leve» y un herido de cierta consideración, un policía que recibió el impacto de una piedra en el rostro."
6.1637136859101584,1.0286823711328952,2,es-ES,"Además de la exposición, Francisco Ruiz Peinado impartió una charla en la que explicó tanto la historia como la técnica del pirograbado bajo el título 'El pirograbado también es arte', después de lo cual ofreció a aquellas personas interesadas unas clases particulares acerca del manejo del equipo pirograbador para posteriormente realizar algunos trabajos de esta técnica que Ruiz Peinado ha popularizado en Melilla."
5.1261832580261455,0.1765082666857348,2,es-ES,"En paralelo, y según respondieron los propios adolescentes a través de una encuesta anónima repartida en los colegios, se redujeron las salidas con los amigos durante la semana (sobre todo en EEUU, Israel, Finlandia o Eslovenia). Aunque también en esto detectaron diferencias entre países. Así, mientras los portugueses no salen más que un día, españoles, estonios, escoceses, ucranianos y rusos encabezan la lista de los más 'callejeros' con tres salidas semanales."
4.338159648978082,2.373261994537558,2,es-ES,En la sentencia se pone de manifiesto que la declaración que realizó la joven «es permanente en el tiempo y además creíble y queda reforzada por detalles que cuenta que sólo así ocurriendo los hechos podía saber».
9.208013701975576,-3.259393288823965,2,es-ES,"Ajenos a esos movimientos, agentes de la Unidad de Delitos Violentos (Udev) de la comisaría provincial ya habían 'pinchado' con el amparo de una orden judicial el teléfono de la novia de uno de los ladrones, una línea de investigación que desembocó en el arresto de todos ellos."
8.881132391107823,3.2056549276419117,2,es-ES,"A su juicio, la eliminación de la publicidad en TVE va a ""obligar"" a las cadenas privadas a ""programar de otra manera"" sus cortes publicitarios y a modificar la ""venta"" de los anuncios, por lo que ha considerado que esta nueva normativa será ""muy beneficiosa para todos"". No obstante, Corral ha avisado que TVE tiene que ""contratar"" los espacios publicitarios que ""habitualmente contrata en estas fechas"" para evitar que se ""hagan trampas"" antes de que se aplique la ley como, por ejemplo, ""contratar ahora mucha publicidad para el resto del año""."
6.121349490464445,-0.4954665219471957,2,es-ES,"El Ayuntamiento de Madrid informó ayer de que el número de heridos en accidentes de motocicletas en la capital se reducirá este año entre un 20 y un 25%, según apuntan los datos obtenidos hasta el pasado 21 de noviembre."
4.814522291135133,-0.32025213392356244,2,es-ES,"A última hora del miércoles, la agencia informó no obstante a la petrolera que disponía de 24 horas para elegir disolventes menos tóxicos y que debía usarlos 72 horas después de haber sometido la lista de sustancias alternativas a la EPA, según el Washington Post."
0.009936763814901876,0.017569060118695332,1,sk,"A asi každý reálne zmýšľajúci človek musí byť pripravený na to, že si na istú dobu sadne na istú stoličku a po čase je potrebné z úplne prirodzených dôvodov ju zmeniť."
0.0039029388290429613,-0.004651297115780129,1,sk,"Študijná skupina číslo 16 Medzinárodnej telekomunikačnej únie (MTÚ), technického štandardizačného orgánu Organizácie Spojených národov so sídlom vo švajčiarskej Ženeve, sa technológiou 56K zaoberá od marca 1997."
9.077117711481748e-05,0.001803676855443252,1,sk,"K svojej hrdinke sa opäť vracia v roku 1999, nakrúcanie však musí byť byť o niekoľko rokov prerušené po záhadnej smrti Marcelinej dcéry Ivany."
0.06044506401252404,0.030528829768013462,1,sk,"Totiz ked si zvolis povinne nabozenstvo tak nemozes si povedat ake, ale dostanes od statneho zriadenca statnej skoly zoznam len tych ktore su zaregistrovane, takze i vtom je rodic diskriminovani, a nema slobodnu volbu svojho nabozenstva."
0.0001563460201078342,0.002127550276823345,1,sk,"""Chcel by som zdôrazniť, že portugalská vláda a Portugalsko nepožiada o žiadnu pomoc alebo finančnú podporu z jednoduchého dôvodu, že to nie je potrebné,"" vyhlásil Socrates."
0.009574938179107572,0.01338434028013906,1,sk,"Uvedomujem si, v akom stave sú verejné financie, ale zároveň, ak by to SNG nekúpila, tak majiteľka mala možnosť vyviezť obraz do zahraničia a tam ho predať."
0.0031358713727479676,0.006461704127067386,1,sk,"Ked sa na prvy polrok pozrieme z hladiska plnenia vyrobnych uloh mozeme konstatovat, ze stanovene zamery vo vyrobe tovaru a tvorbe zisku boli zrealizovane a tym bol naplneny zamer prveho polroku 2005."
0.00040239404022832684,0.0042374925913832235,1,sk,"Na úplnom začiatku medzinárodnej bitky, ktorá sa dostala až na stôl Európskeho parlamentu, bol malicherný spor o tamojší Slovenský dom, kde viac ako o národnosť išlo o osobné ambície a samoľúbosť starostu obce."
0.0002181409945328154,0.0028348797065308813,1,sk,"Cize aj ked dnes je Northwest sucastou Delty (kde NW=Delta North, DL=Delta South), tak ja neviem povedat, ako sa vyformuje firemna kultura, ktora vznikne spojenim Delta North a Delta South a tak neviem povedat, ci s nimi budem spokojny."
0.0007217934639395634,0.005295762249111658,1,sk,"Výmenu letných pneumatík za zimné vám netreba pripomínať, tie zimné majú lepší záber na snehu a ľade, auto je vďaka nim v zákrutách stabilnejšie a má podstatne kratšiu brzdnú dráhu."
6.453842651266727,0.6900507492380449,2,es-ES,Sobre los datos económicos que deja esta edición de la Feria ha dicho que se ha conseguido reducir el gasto en un millón de euros y que se plantean continuar con la reducción de un día mientras dure la crisis. No obstante se ha mostrado abierto a cualquier tipo de sugerencia.
4.343166977582619,1.1037376088927358,2,es-ES,"Gasol ha pulverizado todos las marcas de galardones individuales esta temporada. Ha sido el jugador más valorado (11 MVP), el máximo reboteador y el líder en porcentaje de tiros de 2 puntos, el que más faltas recibe y más minutos disputa por encuentro."
4.160441437257908,-1.253310510694133,2,es-ES,"Más matinal, Karl Lagerfeld abrió la jornada con una hermosa colección recibida y despedida en los jardines de las Tullerías por una severa protesta contra el uso de la piel y las matanzas inútiles de animales indefensos."
0.0003053184902157788,0.004256878491335585,1,sk,"Komisia poverila Európsku agentúru pre bezpečnosť letectva, aby uskutočnila sériu misií technickej pomoci na podporu príslušných orgánov v niekoľkých štátoch v ich úsilí zvýšiť bezpečnosť a reagovať na niektoré obavy týkajúce sa bezpečnosti."
2.470496229463394,-0.424483835980375,2,es-ES,"Sobre sus próximos proyectos, contó que cuando vuelva a Buenos Aires empezará a preparar un nuevo disco ""totalmente distinto"" al último. Será un homenaje a su padre, Francisco Amor, una figura ""fundacional"" de la música folklórica argentina, además de actor y cantante reconocido."
7.388311367584055,-2.9395563354198897,2,es-ES,"El Centro de Congresos y Exposiciones Lienzo Norte albergará por primera vez esta muestra, con 45 expositores, 200 empresas representadas y multitud de productos para el estómago y paladar de los participantes, será, en definitiva, la principal carta de presentación de la XIII Muestra Internacional del Vino y Productos de la Tierra de Ávila."
0.009748928937110995,0.015843785412222276,1,sk,"Ďalšie razy sa to polícii už nepodarilo a obyvatelia Sučian si aj napriek výmene názorov so svojím starostom, ktorý bol s políciou dohodnutý na prerušovanej blokáde, vydobyli svoju polhodinku blokády."
6.878157698742248,-0.6064748681732657,2,es-ES,"Ahora, el Plan debe ser aprobado inicialmente por la gerencia de Urbanismo, elaborándose posteriormente el informe de la delegación provincial de la Ordenación del Territorio, tras lo que será aprobado definitivamente por el pleno de la Corporación sobre el mes de diciembre."
0.00022636469302719057,0.0030777787965004222,1,sk,"Keď vlastník pozemku nesúhlasí, môže sa obrátiť na súd, ktorý s definitívnou platnosťou určí, či je vyvlastnenie skutočne vecou verejného záujmu s primeranou náhradou."
0.00010083479594300381,0.0008386221539153809,1,sk,"To je oblasť zmeniek, niektorých bankových operácií vyslovene nevýhodných pre ŽSR, rozvinutie neodôvodnenej investičnej činnosti, ignorovanie alebo neuplatňovanie zákona o obstarávaní, predaj pohľadávok a obchodovanie s nimi."
0.00023132441946839422,0.002523910109433296,1,sk,""" Na druhú stranu nový chicagský štvrtý útok nie je vôbec do počtu, keďže produktivita jeho členov výrazne prevyšuje klasické &quotudržiavacie"" formácie umožňujúce krátky oddych pre elitných útočníkov."
0.00025412496734202755,0.0033569952127539236,1,sk,"""Vždy platí, že záujem spoločnosti na objasnení trestného činu úkladnej vraždy musí prevyšovať nad záujmom na trestnom stíhaní takéhoto spolupracujúceho obvineného, pričom posúdiť túto otázku musia orgány činné v trestnom konaní v každom prípade zvlášť."
5.966721375885384,2.550982659930224,2,es-ES,"Entonces lo entiendo todo. La prensa no tiene razón. No estamos en guerra, ni falta que hace. Esta especie de bronca continua es una ilusión, una imagen grotesca que proyectan los medios, pero no es real. Por el amor de Dios, que no os pase como a mí, que meriendo paellas de orfidales todos los días. En ocasiones veo Truebas, sí, pero mis amigos me ponen en mi sitio. No nos dejemos engañar."
0.005132597430006442,0.0007765211957572503,1,sk,"Hemendex Filmová premiéra týždňa 19.03.2010 The Lovely Bones / Pevné puto Dráma o tragickej smrti 14 ročného dievčaťa a jej pohľadu na to, čo sa dialo potom.."
0.009632242584809544,0.01351456731777505,1,sk,"""Ako sme už niekoľkokrát povedali, MMF podporuje súčasný postoj gréckej vlády, ktorý nepočíta s reštrukturalizáciou a zároveň jej úsilie splniť si všetky záväzky v oblasti štátneho dlhu,"" uviedla hovorkyňa MMF pre agentúru Reuters."
6.00614137494339,-1.3496206626194314,2,es-ES,"Aparte de las fotos que él ha hecho, ha adquirido otras muchas antiguas en rastros, en anticuarios y a coleccionistas. Otras se las han dado y algunas las ha encontrado tiradas en la calle. Entre placas de cristal, diapositivas, postales y latas de películas tiene más de millón y medio de imágenes. «En mi casa no cabe nada»."
0.0002262898929648359,0.003280081801603289,1,sk,"Obrazu tretieho sektora škodí časté vystupovanie v mé­diách, novinári sa pýtajú na banality, chcú, aby treťosektorové celebrity za nich povedali to, čo oni sami nesmú."
0.009115812133903277,0.0078122898932353815,1,sk,Slovenská republika v zastúpení ministerstvom dopravy podpísala 15. apríla 2009 koncesnú zmluvu so spoločnosťou Slovenské diaľnice na výstavbu a prevádzku piatich úsekov diaľnice D1 medzi Martinom a Prešovom.
0.0011593334292133493,0.0004143669414478523,1,sk,"Jedenásť umelcov bude mať počas tradičného podujatia, ktoré usporadúvajú už po 33. raz, k dispozícii reštaurátorskú i grafickú dielňu Mestského múzea, ktoré po skončení workshopu pripravuje výstavu diel účastníkov podujatia."
0.0010742397632185026,0.008839932323569047,1,sk,"Milan Galanda zo Združenia na podporu lokálnej demokracie sa vracia ešte ďalej do histórie, ale najprv zdôrazňuje, že treba prijať zákony, ktoré budú znamenať stabilizáciu ""toho, čo ja nazývam úradnícky stav."
2.4938463318576005,1.09954930024629,2,es-ES,"Allí, Luis Alberto Fernando y el cántabro Javier Crespo imprimieron un fuerte ritmo para iniciar la ascensión con tramos que en algunos momentos superaban el 30 % de desnivel."
0.009518356353479841,0.012436090298131126,1,sk,"Ruský veľvyslanec v Indii Alexander Kadakin zdôraznil, že Moskva si vysoko cení Adámkovej dlhodobú činnosť v oblasti ochrany neoceniteľného intelektuálneho a umeleckého dedičstva jedinečnej ruskej rodiny Roerichovcov."
4.065379405076458,0.9522496931107505,2,es-ES,"Asimismo, Zapatero incidió en que hay que estar ""con las alertas puestas"" ante las tensiones financieras, ""que no han desaparecido"", y añadió que todas las medidas de transparencia, de gestión y de reformas son imprescindibles."
3.693063117422286,0.3948328718854837,2,es-ES,"A última hora de ayer su estado era estable, salvo complicaciones, por lo que permanecía ingresado en espera de comprobar su evolución. Fuentes del centro hospitalario han señalado que gracias a las costillas la herida producida por la radial no afectó a ningún órgano vital."
