x1,x2,label,lang,texts
7.962012549503405,0.35202086718924364,2,es-ES,"Otro de los retos, dijo Atiénzar, es el desarrollo del reglamento que permite al propietario de un vehículo realizar su mantenimiento «en su taller de confianza sin perder la garantía», una posibilidad que beneficia a un sector afectado por el descenso en las ventas de vehículos nuevos y por la disminución del presupuesto que las familias destinan a la puesta a punto de su coche."
6.725698013216828,-2.136501410433837,2,es-ES,"Las partes manifiestan también su voluntad de configurar en el proceso de negociación un marco general de las relaciones laborales en la sociedad central que asuma actividades actualmente desarrolladas por las cajas, así como las condiciones generales de la transferencia de personal entre las cajas y las cajas y la sociedad central."
8.705571605178815,-3.5155222385802363,2,es-ES,"El secretario regional de los populares, Antonio Clemente, exigió al líder de los socialistas valencianos, Jorge Alarte, que explique «las dudas en la gestión» de la alcaldesa de Quart de Poblet. Clemente acusó a Alarte de «esconder la cabeza cuando se investiga a cargos de su partido. Esa es la doble vara de medir del PSPV»."
0.0012124256096762219,0.003988492001250794,1,sk,V elektrotechnickom priemysle boli výnimkou z poklesu iba dva rozbiehajúce sa závody vo Voderadoch pri Trnave – Samsung Electronics LCD Slovakia a jeho dodávateľ Hansol LCD Slovakia.
0.000260010645978191,0.003755485222583728,1,sk,Najvyšší sud SR zrušil rozhodnutie licenčnej rady o odňatí frekvencií televízií pre potreby digitalizácie. Dal tak za pravdu Markíze v boji s licenčnou radou. Proces digitalizácie sa opäť spomalí. Člen rady Peter Abrahám upozorňuje aj na hrozby žalôb.
9.103547562208782,-2.2350208893993937,2,es-ES,"Entre los productos retirados se encuentran más de siete millones de triciclos para niños de dos a cinco años fabricados en México, que se han estado vendiendo en Estados Unidos y Canadá desde 1997. Las entidades reguladoras de ambos países habían recibido denuncias de que algunos componentes de los triciclos Fisher Price Trike y Tough Trike sobresalen y producen cortaduras profundas, que en el caso de seis niñas de entre dos y tres años requirieron de atención médica."
7.561201572144997,-2.9644428668986844,2,es-ES,"Estados Unidos, según ha indicado el teniente general Keen, se ha hecho cargo de uno de los cuatro puntos de distribución ue el Gobierno de Haití ha designado para repartir la asistencia humanitaria. Los otros tres están en manos de la Misión de Pacificación de la ONU."
0.010712822279700992,0.015038923156186532,1,sk,"Tak sme si užívali do tretej, štvrtej a potom sme išli cez hroznú fujavicu k jednej kamarátke do jej bytu a tá mi už vôbec nelichotila."
7.662652884929719,-0.2527409107367981,2,es-ES,"Está previsto que los detenidos, entre ellos, el ex gerente del Consorcio Turismo Joven, Damià Amengual, continúen declarando esta tarde en las dependencias de la Jefatura Provincial de Policía, en Palma, para pasar mañana a disposición judicial. Asimismo, la Jefatura Superior de la Policía de Baleares ha advertido de que la investigación continúa abierta, por lo que no se descartan más detenciones."
5.769894322163489,1.5478504109097229,2,es-ES,"La Asociación de Comerciantes La Ribera Centro Abierto nació en noviembre del 2008 con muchos proyectos a corto y medio plazo en mente. Desde entonces ha llevado a cabo distintas iniciativas. La más importante, el mercado Outlet que organizó en Semana Santa con la participación de 40 comercios y por el que pasaron 20.000 personas en cuatro días."
0.06912221167936046,0.09196398371133453,1,sk,"Vďaka tomu ma zvolili aj za ministra hospodárstva nášho tábora, no vzápätí ma aj odvolali, lebo som hodnoverne nedokázal vysvetliť, ako som splatil sto melónov."
2.5597118314061786,0.2271410151099124,2,es-ES,"Y el ejemplo más claro es el tramo entre Castellón y Tarragona, con una única vía de ancho ibérico entre Vandellós y la capital catalana. Como si la frontera entre las dos regiones fuera física."
4.293288590468784,0.8411305048290435,2,es-ES,"Atendiendo a los datos que aportó este edil, las previsiones de ingresos se estiman en 25.258.000 euros, debido principalmente a la caída de la actividad económica que se está viviendo y que repercute directamente en los ayuntamientos."
5.0895071438192225,1.9765564954625736,2,es-ES,"El segundo apartado será una plantilla para dar a conocer todo el patrimonio inmobiliario en el la que habrá que especificar el municipio, la superficie, la fecha de adquisición y el porcentaje de participación."
0.00019764655673356547,0.002020423384768807,1,sk,"Od oscarového úspechu filmu Kolja pracoval Zdenek Svěrák na Tmavomodrom svete, ba dokonca odmietol aj niekoľko žiadostí o réžiu výborných amerických filmov (Dobrý Will Hunting, Zásady Muštárne)."
9.597004321836322e-05,0.0016065978335975466,1,sk,"Narodil sa v Borši v okrese Trebišov, pochovaný je spolu so svojou matkou Helenou Zrínskou v krypte národnej kultúrnej pamiatky Dómu svätej Alžbety v Košiciach."
5.355811272741113,0.5203444896503211,2,es-ES,"Este proceso de colocación del suelo comenzará entre el 15 de septiembre y el 15 de octubre. Y le tocará de nuevo esperar, tal y como ha hecho hasta ahora. Porque la intención es que no cumpla su nueva función hasta que las obras del paseo fluvial, en plena faena, estén rematadas."
0.00017103961374729016,0.002697454567272808,1,sk,"Agentúra AFP pôvodne uviedla, že sa nebezpečné bahno vlialo už priamo do Dunaja, agentúry MTI a Reuters informáciu upresnili, že išlo o jeho rameno Mošonský Dunaj."
10.454800227561032,-1.8406333063976374,2,es-ES,"Apenas hubo asientos libres en el auditorio Millán Picazo. Las primeras filas estaban ocupadas por las autoridades, entre las que se encontraban el alcalde, Diego Sánchez Rull; el subdelegado del Gobierno andaluz en la comarca, Tomás Herrera; el ministro gibraltareño de Familia, Juventud y Asuntos Comunitarios, Joseph Netto; y el presidente de la Autoridad Portuaria Bahía de Algeciras, Manuel Morón. También asistieron numerosos concejales, miembros de las formaciones políticas más destacadas de la ciudad, de los sindicatos y de colectivos vecinales de la ciudad."
0.03278451135972604,0.050711716642261574,1,sk,"Na druhom mieste sa umiestnil velky talent zenskych sipiek, vekom este juniorka Michala Jackuliakova a body za tretie miesto si do celoslovenskych tabuliek pripise Zlatica Miterova z Lucenca."
0.00625775108247147,-0.003916189765754476,1,sk,Ďalšiu časť múzea tvoria Goralské lazy ako dokumenty najmladších dedín vznikajúcich v 17. storočí a na začiatku 18. storočia na oravskom území Slovenských Beskýd.
10.454897193546978,5.597061994649612,2,es-ES,"Sobre el hecho de que el estado de alarma se prolongue durante 15 días, Conde Pumpido ha recordado que es el plazo que establece la Carta Magna. ""La ley orgánica competente ha establecido que en estos casos se pueda contemplar la movilización de aquellos que tendrían que atender el servicio y no lo están haciendo. El código penal militar dice que a las personas movilizadas se les aplica la jurisdicción militar, por lo tanto, los hechos que pudieran cometerse a partir de las 13.00 horas del sábado serían enjuiciados por la ley militar"", ha advertido."
1.5260632803287435,-0.01572769905906495,2,es-ES,"""Si se cometieron hechos execrables los condeno, pero no fueron orden de quien habla. Yo por eso señor presidente, ¡rechazo los cargos totalmente! ¡Soy inocente! y no acepto esta acusación fiscal"", ha declarado Fujimori, dirigiéndose al juez."
5.872225764244091,1.1898686361393462,2,es-ES,"Aunque comenzó hablando se esas dos muertes que le golpearon, 'Azul serenidad' se fue ""abriendo"" a todos las personas que ya no están junto a él en el proceso de escritura y es también una reivindicación de la ""ejemplaridad"" de los seres queridos en una sociedad ""fascinante"" donde ""todos las injusticias son posibles"" y que ofrece pocos ejemplos en la vida pública."
5.6981260081524745,-1.1771528356894114,2,es-ES,"«Tratamos de limitar la información para proteger a los niños», afirmó el fiscal luego de indicar que los presuntos hijos incestuosos tienen 19, 17, 16, 12, 11, 6 y 2 años de edad. «El acusado se abstuvo de declarar», quedó arrestado en un centro transitorio de detención y mañana será enviado a una cárcel provincial, apuntó."
7.894789999718409,0.46567170669516417,2,es-ES,"Al Congreso se incorporan Encarnación Naharro y Héctor Esteve, por el PP, y los socialistas Siro Torres y Pilar López y entran a la Cámara Alta los populares Sixto González, María del Rosario Casado y Antonio Serrano y por el PSOE Antonio Callado. En septiembre, el torbellino de la Feria anula todos los ecos adyacentes. La inauguración del Museo de Cuchillería es sin duda el acontecimiento más destacado del certamen. Se abre con una exposición temporal de los cuchilleros de Taramundi,Asturias, y otra permanente, con 500 piezas, algunas del siglo XVII, cedidas por la CCM."
2.4385686891960825,1.716216912286366,2,es-ES,"Para este nuevo compromiso, el técnico vasco no podrá contar con el defensa Paco Peña ni con el centrocampista Bruno Herrero, ambos sancionados por acumulación de tarjetas, ni con el defensa Juan Cruz Ochoa, quien arrastra molestias fisicas."
8.538547009424871e-05,0.00028142454711004375,1,sk,"Skúsenosť z najvyššej slovenskej súťaže zas má trojica Peter Lizák, Július Dúha a Jozef Miháľ, ktorí v sedemdesiatych rokoch hrali za dolnokubínsky dorast v 1. lige."
8.446401007999605e-05,0.00073803631750017,1,sk,"K dispozícii nebude Čarnoká, ktorá má problémy s achilovkou, ostatné sú zdravotne v poriadku a pripravené urobiť maximum pre vytúžený postup,"" prezradil po prvom utorňajšom tréningu tréner Košičaniek Vladimír Karnay."
2.2223509411057707,0.3084731240321864,2,es-ES,"En cualquier caso, las negociaciones entre el Barcelona y Samuel Eto'o siguen abiertas y ambas partes podrían ponerse de nuevo en contacto en las próximas horas para intentar llegar a un acuerdo."
0.0006692856165342938,0.002632112882507123,1,sk,"Zvýhodnené volanie do zahraničia, bezplatný príjem hovorov v 90 krajinách sveta. S takouto nezvyčajnou ponukou prichádza na trh firma National Geographic, ktorá na pulty predajní v USA uvedie mobilný telefón so špeciálnym cestovateľským paušálom."
6.412730471215424,3.887158529512608,2,es-ES,"Pero no se confunda el lector, Vida y destino es una novela por demás extensa, prolija, cominera, trabajosa, cuya lectura exige mucho tiempo, constancia y dedicación. Se ha dicho de ella que es la Guerra y paz de la II Guerra Mundial. Como reclamo publicitario es un indudable acierto, pero la comparación, como casi todas las comparaciones... Diríase que en Guerra y paz brilla el genio, mientras que en Vida y destino es más que evidente el talento. Pero Tolstoi es otra cosa."
11.996666360796715,4.58176448406122,2,es-ES,"El Partido Estepona (PES) presentó ayer el modelo de alegaciones que ha puesto a disposición de los vecinos que no hayan pagado la tasa de basura y con el que podrán alegar que ésta es ilegal, según explicó el concejal del PES, Manuel Reina. El escrito se debe presentar en el Registro de Entrada del Ayuntamiento. Asimismo, el concejal avanzó que van a preparar otro escrito para los ciudadanos que ya hayan pagado la tasa de basura, con el fin de que puedan solicitar la devolución de este impuesto."
0.00806024067204768,-0.008709040591927463,1,sk,"Vo svojom piatom štarte v letnej sezóne oslávil stredajšie narodenie syna Georgija zlepšením svojho tohtosezónneho maxima z mítingu vo francúzskom Montreuile o 14 cm na 17,18 cm."
9.589308278038082,-3.8732057596364378,2,es-ES,"Por ejemplo, para quienes participaron en la supuesta modificación irregular del Plan General se piden siete años de inhabilitación; otros nueve para quienes intervinieron en el proceso de aprobación del estudio de detalle de la unidad 1.34; diez años más a los imputados por la tramitación del proyecto de reparcelación; y nueve meses por la concesión de licencias. Además, quienes aprobaron las licencias de la unidad 1.34 deberán pagar multas de 18.000 euros."
0.0007603612256978202,0.0011377807435870124,1,sk,"2007 / Lukáš Kočišek Z týždenníka Markíza odchádza vedenie Podľa informácií Mediálne.sk je dôvodom Urbaníkovej odchodu snaha vydavateľstva TV Tip profilovať titul viac ako bulvár, vedeniu sa totiž nepáči prekryv s jeho novým titulom Žurnál."
5.7599206393814015e-05,0.0010794148080666601,1,sk,"Iránske ministerstvo zahraničných vecí malo podporiť žiadosť o nigérijské vízum pre jedného z dvoch Iráncov organizujúcich dodávku s tým, že pracuje pre iránske veľvyslanectvo."
5.408316796600062,0.06697437396616122,2,es-ES,"Peláez, a pesar de que su patrocinado no estaba en la cárcel, participó en esos encuentros para preparar la estrategia de defensa conjunta de los imputados y, además, es el demandante en la querella ahora aceptada por el Supremo."
0.38954799452148475,-0.1336215652798285,1,sk,"Na svojom konte má viac ako 60 filmov, medzi jeho najznámejšie snímky patria I soliti ignoti (1958), Moji priatelia (1975) alebo La grande guerra (1959)."
8.2317019253082,-2.9450745147870836,2,es-ES,"Justo la víspera, el día 29, sobre las 6 de la tarde, de regreso de unos días de visita a la familia en tierras sorianas, los moradores de un tercer piso de la calle Okorro (periferia del municipio), en Altamira, se llevaban el susto de su vida al encontrarse su casa desvalijada."
0.0017040549032358214,0.004669097873888749,1,sk,"Závin z mletého mäsa 600 g hovädzieho mäsa zo stehna 70 g paradajkového pretlaku 3 zrnká celého čierneho korenia 2 na tvrdo uvarené vajcia 2 zrnká nového korenia soľ, mleté čierne korenie, karí korenie, olej Mäso umyjeme, pokrájame a pomelieme."
0.00036316492934274254,0.004645320327004671,1,sk,"Ľudia podľa neho ostávajú aj v dedinách. Obce poskytujú obyvateľom pozemky na nové domy za symbolickú sumu. Z mesta na vidiek odchádzajú skôr bohatí ľudia. „Chudobnejší zasa idú do mesta za robotou,“ tvrdí M. Bačík."
5.2520161531767915,-0.20775714007801413,2,es-ES,"Con Triángulo de Amor Bizarro nos pasó como con esas películas que todo el mundo te pone por las nubes y llegas al cine con las expectativas tan altas que sales un poco chafado. Oscuros e intensos, su efectiva mezcla de My Bloody Valentine, New Order y los Sonic Youth menos snobs tuvo momentos mágicos. Echamos de menos esa otra propuesta suya ramoniana, la de no parar entre canciones, para otorgarle más estrellas a su crítica."
6.62647296589244,-0.07508253159406876,2,es-ES,"Como Ibai, otros siete niños esperan en La Paz una oportunidad similar. El padre de Ibai, emocionado, exultante, repetía el jueves a televisiones, radios y periódicos su agradecimiento a la familia portuguesa. ""Es algo muy bonito salvar la vida de un niño, aunque tengas la desgracia de perder al tuyo. Esos padres pueden estar orgullosos. Y nosotros estamos muy, muy agradecidos"". El regalo llegó a tiempo. ""Parte de milagro sí es que surgiera un donante en ese momento"", concede López Santamaría entre risas."
8.745907002927941,-1.9197631287842174,2,es-ES,"Los dos viajaron anoche de vuelta a Madrid en una avioneta que fletó Repsol para recogerles. Les acompañaba un hermano de Alejandro. Otros 17 españoles sorprendidos en Bombay por la cadena de atentados tenían previsto viajar anoche en un avión fletado por la presidencia francesa de la UE, que les llevará a París y de allí a Madrid. ""Nos han tratado como a ciudadanos de segunda clase"", se quejaba Elsa Miguel, una turista de 50 años, cuyo hotel se encontraba enfrente del Taj Mahal, principal foco del ataque."
4.232634470293002,0.6725971522251017,2,es-ES,"Por otra parte, cabe destacar el carácter ecoeficiente del supermercado que incorpora un conjunto de medidas (instalaciones de recuperadores de calor, iluminación más eficiente, temporizadores, puertas automáticas y techos más bajos para mantener la temperatura,.) que reducen hasta un 20% el consumo energético."
2.0708399552701526,0.06667565977550025,2,es-ES,"Para este encuentro se podrán adquirir las entradas desde las 19.30 horas en el estadio, aunque tendrán pase gratuito los menores de 12 años y los socios 'premium'."
4.238374564268078,-0.6496314656335348,2,es-ES,"Su ascenso en el mundo del fútbol ha sido meteórico. Pedro recuerda como, hace apenas tres años, su máxima ilusión era jugar en los campos de tierra de su ciudad natal. Después pasó a las categorías inferiores del Atlético de Madrid, desde donde fue reclamado por la Sampdoria."
8.491286187787907e-05,0.000524922095544052,1,sk,"Príčinou personálnej rošády je podľa Orbána narušenie dôvery medzi ministrom Ferencom Ligetvárim a Nezávislou maloroľníckou stranou (FKGP), ktorej v rámci koalície patrí ministerstvo ekológie."
0.00037007301648411497,0.005266160724625462,1,sk,"Odborníci však pripomínajú, že v skutočnosti je to dvojnásobok, pretože mnohí sa ani neobrátia na políciu, či už kvôli nízkej sume alebo preto, že sa hanbia."
0.0012723250702087914,0.004270921157324159,1,sk,"2007 / Lukáš Kočišek,Radoslav Augustín Joj sa nepodarilo spustiť nový portál Nový portál bol spustený podľa plánu večer o 22. hodine, po nejakom čase došlo k hardvérovej poruche na webserveri, povedala dnes ráno hovorkyňa Joj Tatiana Tóthová."
2.044144262056937,0.6919781548020063,2,es-ES,"El escolta estrella de los Lakers también aportó ocho asistencias para ser el líder del equipo en ese apartado, capturó siete rebotes y recuperó un balón."
0.0014599182204351937,0.007003989071804756,1,sk,"Vyraďovanie sa nieslo v znamení dilemy, či vypadne Michal Šeps, alebo nie. Porotcovia totiž mali úplne jasno v tom, koho chcú vidieť v závere megašou. Diváci mali rovnaký názor a šoumenovi zrazu udelili stopku, hoci dovtedy na jeho úkor vypadlo hneď niekoľko dobrých spevákov. Michal tak skončil tesne pred finále na bronzovej priečke."
4.424684266498467,-0.9912058188159425,2,es-ES,"A juicio de la concejala socialista Mayte Carbajo, el reclamo traspasa «todas las líneas rojas» y su intención de llamar la atención del viandante no puede justificar todo, más cuando todas las administraciones están luchando desde hace años contra el machismo y la violencia de género."
3.139288064305176e-05,0.0006655315140673924,1,sk,"Podľa Ruska sú názory členskej základne zámerne podsúvané, sú iné, než v skutočnosti sú, a takto im ich predkladajú niektorí funkcionári ANO v Prešovskom kraji."
6.26180706087895,0.05725047544351245,2,es-ES,"Don Juan Carlos fue informado esta mañana de las circunstancias del accidente por la ministra de Defensa, Carme Chacón, quien se desplazó a la base aérea de Los Llanos, en Albacete, para trasladar sus condolencias a las familias de los pilotos, que pertenecían al Ala 14 del Ejército del Aire y realizaban dos vuelos rutinarios cuando, por causas que se investigan, ocurrió el accidente."
3.3544838195651976,0.21254557395413057,2,es-ES,"Una vez descontada la retención del 18 por ciento con la que Hacienda grava este tipo de retribución al accionista, el importe neto del dividendo será de 0,045 euros."
0.00030203910495397405,0.004188754935119149,1,sk,"""Chcem apelovať na politických predstaviteľov a lídrov zo sveta biznisu, aby sme spoločne prekonali tieto ťažké časy,"" povedal pápež pútnikom, ktorí sa zhromaždili na Námestí sv."
6.814999091783728,-3.130998788299233,2,es-ES,Los inspectores de Consumo solicitarán al establecimiento inspeccionado ejemplares firmados de cada uno de los tipos de contrato que se oferten por parte de dicha empresa y en ellos se prestará especial atención a la inclusión de cláusulas abusivas y la utilización de prácticas desleales.
8.773866644466315,-0.7657542891615312,2,es-ES,"Diferentes conceptos han agrupado este año a los 'Ego' de la pasarela Cibeles. Entre ellos ha destacado Urkía, que ha creado una 'Selva de asfalto' en un concepto de safari creando una colección urbana que combina piezas oversize y su represión con prendas más ajustadas. Por su parte Montolo se ha inspirado en algunas películas mexicanas para crear referencias iconográficas interpretadas en claves de humor, utilizando piel y punto tricot, una vez más la estrella de la colección, y a la que se suman linos y viscosas de acabados ligeramente brillantes."
7.160529056193173,1.0282850875873168,2,es-ES,"Aunque, según ha apuntado, la sanidad española posee un buen nivel de recepción contra esta enfermedad que se asemeja a países de la Unión Europea, Moral ha indicado que en España ""falta un plus"" para que las mujeres ""reciban el mejor tratamiento posible"". Así, ha propuesto la creación de ""unidades integradas de mama"" en todos los hospitales públicos para evitar que ""a las mujeres les vea cada vez un médico distinto""."
0.0004885917707527174,0.006793717885704974,1,sk,"Tým sa rozširuje zameranie knihy nielen na samých obchodníkov, ale aj na zákazníkov, ktorí by mali vedieť, ako sa zbytočne nedať vmanévrovať do situácií, z ktorých vybŕdnuť je neskôr zložité."
5.64146004450266,-0.6786085776088038,2,es-ES,"Después de que el Tribunal Constitucional rechazara en septiembre de 2006 el recurso de amparo, la demandante acudió a Estrasburgo en marzo de 2007, representada por el abogado de Murcia Pedro López Graña."
3.9592006140041467,1.9620055625126225,2,es-ES,"El Numancia, sin Nagore en la medular, se dejó comer el terreno y se encomendó al sufrimiento. Lafuente le sacó con el pie un disparo a Linares, en otra prueba de que algo fallaba en la defensa numantina."
0.003043398639057689,0.005587023333511181,1,sk,"Kaczynski sa v roku 2005 stal tretím demokraticky zvoleným prezidentom od pádu komunizmu v roku 1989, po známom lídrovi nezávislých odborov Solidarita Lechovi Walesovi a Aleksandrovi Kwasniewskom."
7.33872973911799,-0.873591027084967,2,es-ES,"El técnico, que llegó en 2005 y ha conseguido cinco títulos en apenas dos años (dos Copas de la UEFA, una del Rey, una Supercopa de Europa y otra de España), negoció a comienzos de verano la ampliación de su contrato, pero no se llegó a un acuerdo económico. Sin embargo, Ramos aseguró que cumpliría su compromiso y no se iría hasta final de temporada."
0.00011201044672813591,0.001987907150825765,1,sk,"""Hlavné je, aby sa tento balík nestal hračkou v rukách finančných špekulantov, čo by negatívne ovplyvnilo celý trh akcií spoločnosti Gazpromu,"" vyhlásil S. Ježov."
11.223147568296346,-2.7678213443187856,2,es-ES,"El concurso, dotado de premios en metálico, tiene un presupuesto de 20.000 euros, de los cuales 8.000 destinados a premiar las mejores reses de cada una de las secciones de las que consta el certamen, dicinueve en total. Está considerado como uno de los mejores morfológicos de carácter regional de cuantos se celebran en Cantabria durante la temporada. Nació hace quince años por iniciativa precisamente de Angel Duque, a más en cada edición, aunque el año pasado quedó en blanco, no se celebró."
0.00010992361092626295,0.0020507648198381263,1,sk,"Okrem desiatich aktivnych sportovcov sa rozhodol mestsky sportovy klub odmenit i sest funkcionarov klubu MSK, ktori sa pricinili o propagaciu a vakonnosty rast sportu v meste."
5.240368336835915,-1.3222786285263093,2,es-ES,"Para Pavón, «sorprende bastante» que personal de la Conselleria de Medio Ambiente «no haya podido entrar en los embalses de El Hondo» con la finalidad de «controlar la mortandad y tomar las decisiones necesarias»."
0.00010203862864242135,0.000839777423743421,1,sk,"Eurovea je i v stredoeurópskom ponímaní hodnotená veľmi vysoko, tvrdí Miroslav Barnáš, riaditeľ slovenského zastúpenia King Sturge. Podľa jeho slov kancelárske priestory ocenia predovšetkým právnické, farmaceutické a poradenské firmy a spoločnosti pôsobiace v oblasti telekomunikácií a informačných technológií."
4.570847709014423,0.39752386933017364,2,es-ES,"En 2002 fue consejero especial de la ONU y posteriormente nombrado ministros de Finanzas. En 2005, Ghani fundó el Instituto de Efectividad del Estado, en Estados Unidos, que busca promover gobiernos efectivos. El candidato reside normalmente en Estados Unidos."
0.00016840369696062186,0.0021036654538468297,1,sk,"Dôležité je, aby sme vyhrali a na žiadne oslavy nemyslíme,"" nezaprel v sebe profesionála bývalý hráč Slovana Bratislava, 1. FC Norimberg a OSC Lille."
0.004595919655462468,0.017419577968128135,1,sk,"Vstup do novej sezóny sa absolútne nevydaril úradujúcej šampiónke domácej Emme Moffattovej, ktorá dobehla do cieľa až na 13. pozícii o jeden a pol minúty za víťazkou."
0.0001431608721021046,0.001857423785507766,1,sk,"Pohyb vo svete finančných trhov mu uľahčuje tak, ako to robia podielové fondy, kde sa nemusí starať o zloženie majetku z desiatok cenných papierov."
3.7920484050443645e-05,0.0006527227914256397,1,sk,"Podľa komerčného riaditeľa firmy Mariána Šinkoviča slabšia kúpyschopnosť obyvateľstva v minulom roku AB Kozmetiku skôr zvýhodnila, pretože zákazníci uprednostňovali jej výrobky pred drahšími zahraničnými."
0.000160484434410903,0.0032035276098113913,1,sk,"Postupne sa všetci rozchádzajú, síce unavení, ale spokojní, plní nových dojmov a zážitkov, s vierou očiach, že o rok o tomto čase, sa opäť všetci pri rovnakej príležitostí opäť stretnú."
