x1,x2,label,lang,texts
3.713376193966004,-0.9400737276252247,2,es-ES,"Según la plataforma, que adjunta la traducción ""no oficial"" del comunicado de Vestas, se trata de ""una prueba más de las muchas irregularidades y falsedades entorno a este proyecto""."
3.669040199499008e-05,0.0004861162146796465,1,sk,"Žena utrpela ťažké zranenia (zlomeninu kľúčnej kosti, zlomeninu spodiny lebečnej s krvácaním do mozgu a pomliaždenie pľúc) s dobou liečenia 3 až 6 mesiacov."
5.778906053987324,0.807277060063407,2,es-ES,"Lomana salió adelante, vendió su preciosa casa de Fuenterrabía y empezó a acudir a cenas y reuniones del brazo de buenos amigos como el joyero Arsenio Díaz, quien desgraciadamente murió hace pocas semanas cuando fue encontrado sin vida en una zanja de la calle Serrano tras la noche de moda que organizó «Vogue». Dicen que fue un infarto y también que hay amigos abogados que están investigando."
5.933745017372861,0.9290399347507299,2,es-ES,"Asimismo, ha declarado que ""por la vía de la represión no hay solución"" porque, a juicio de Olano, ""es necesario respetar la decisión de Euskal Herría a través del diálogo y la negociación"". Olano se ha preguntado por qué a los ciudadanos vascos no se les consulta ""qué es lo que quieren"" y ha asegurado que desde Gestoras han intentado ""llevar este mensaje"" a los gobiernos español y francés."
4.626775978722076,-1.208725065787674,2,es-ES,"La embarcación lleva a bordo once personas, entre ellas la premio Nobel de la Paz irlandesa Mairead Maguire y a un ex vicesecretario general de Naciones Unidas, Denis Halliday, y hará una parada en un puerto griego para abastecerse, repostar y coger a más pasajeros. En concreto, el barco transporta materiales de construcción, así como equipos médicos (como un tomógrafo) papel y juguetes."
4.365006846910806,-0.8173887099283118,2,es-ES,"Según el protocolo de accesibilidad universal de los servicios ferroviarios, las estaciones Adif permitirán en 2012 ""la plena autonomía en el acceso a los servicios ferroviarios al 90% de los viajeros"", han anunciado las citadas fuentes."
0.0014736317092518003,-0.00013778763362924277,1,sk,"Pracovnici Inspektoratu Slovenskej obchodnej inspekcie pre Banskobystricky kraj v 48. a 49. tyzdni dovedna skontrolovali 132 prevadzkovych jednotiek, v ktorych vykonali 72 kontrolnych nakupov."
6.389757000350007,-0.249914669614461,2,es-ES,"Es la segunda mujer que fallece en los últimos 15 días en una clínica barcelonesa tras someterse a una operación gástrica. El pasado 11 de enero Laura R. M., de 19 años, murió en la Clínica CIMA después de que le implantasen una banda gástrica vía endoscópica. Su caso ya está siendo investigado por un juzgado de la capital catalana."
6.264499548467263,8.222872075312937,2,es-ES,"«No hemos estado acertados con el balón, lo que es fundamental, y es muy importante que nuestros jugadores del centro del campo busquen un regate, una conducción, y eso no ha pasado», era el análisis del partido que realizaba el preparador 'groguet'. Solo en el último tramo del duelo se abrieron más espacios con el Valencia volcado en busca del gol que lo adelantara en la eliminatoria, lo que vino bien al Villarreal. «Al final hemos equilibrado el juego», continuó Garrido."
3.3852295463935116,2.906662507532607,2,es-ES,"Por su parte, Izquierda Unida presentó una moción en el pleno, que se hizo institucional, para solicitar al Gobierno central que modifique el decreto que cambia para acceder al subsidio por desempleo de 35 peonadas agrarias trabajadas a 20 «porque es un decreto insuficiente y con poca sensibilidad social»."
4.913722036350626,1.175211091859405,2,es-ES,"Por provincias, el porcentaje más alto de recetas en las que se indica el nombre de un principio activo ha sido prescrito en Sevilla, alcanzando el 81,31 por ciento de las recetas. Le siguen Cádiz y Granada, con un 77,75 y un 77,13 por ciento, respectivamente; Córdoba (76,59%); Huelva (75,85%); Málaga (74,21%); Almería (73,94%), y Jaén (69,07%)."
3.862581185782321e-05,0.0006655821347217166,1,sk,"Z hľadiska náročnosti terénu a hodnoty územia prirovnal súčasný požiar k tomu, ktorý vypukol v druhej polovici októbra v roku 2000 v lokalite Tri kopce v Slovenskom raji."
3.684880016801626,-0.5859423205575592,2,es-ES,"Arqueólogos israelíes han descubierto una casa de baños romana, de hace 1.800 años, probablemente utilizada por los soldados de la Décima Legión, que tomaron Jerusalén en el siglo II d.C."
3.25253825509657,0.4150247078972618,2,es-ES,"En el caso particular de los móviles iPhone, Diariovasco.com ha creado una innovadora aplicación que posibilita el acceso a toda la información sin necesidad de conexión a Internet."
3.255753510900948,-0.33367461805736043,2,es-ES,"El matrimonio permaneció seis días con él. «Se mostró como un hombre muy cercano, como si le hubiésemos conocido de toda la vida. Estuvo tremendamente cariñoso, entrañable y muy generoso. Durante nuestra estancia tuvimos siempre un coche en la puerta, chófer a nuestra disposición, nos trató de manera increíble»."
0.0015476946191677208,0.012825289689508428,1,sk,"Na prvý pohľad nič nenasvedčuje tomu, že by sa mal stroj na peniaze z amerického Redmondu v dohľadnom čase čo i len spomaliť, nieto ešte zastaviť."
3.774013875667574,-0.4452835875296604,2,es-ES,"Así, en lo que va de año se encontraron 30 delfines en esta situación en la costa malagueña y ninguno de ellos sobrevivió más de 24 horas."
0.000212934624146832,0.002302435862344961,1,sk,"Estónsko a Maďarsko pripravujú zintenzívnenie vzájomnej obchodnej výmeny a cestovného ruchu, ako aj zjednodušenie vízového režimu a posilnenie spolupráce vo vojenskej oblasti, odznelo na tlačovej konferencii oboch štátnikov."
7.532519600446096,-0.8341437811537549,2,es-ES,"No. La ley de protección frente al tabaquismo está consiguiendo sus frutos en muchas comunidades. De los tres millones de personas que han intentado dejar de fumar, un millón lo ha conseguido. En comunidades donde se cumple la ley, como Cataluña, se ha detectado una disminución en la incidencia del infarto de miocardio... pero en otras comunidades no se está cumpliendo y por tanto hemos acudido a los tribunales, donde hemos ganado."
0.009599947344702577,0.012776328180622104,1,sk,"Pri neplnení si povinnosti nepeňažnej povahy, ktorá vyplýva z tohto zákona alebo osobitného predpisu, môže správca dane opakovane uložiť pokutu až do výšky jedného milióna korún."
5.851390262528516,0.4450228665792531,2,es-ES,"Además, el portavoz de todos los sindicatos que se oponen al acuerdo laboral firmado el pasado día 2 (Sicam, UGT, CGT, Alta y Vietnamita), Manuel Navarro Bracho, del mayoritario Sicam, tiene previsto leer hoy un manifiesto contra el pacto laboral que prevé no sólo eliminar mil puestos de trabajo fijos de la Caja alicantina, sino fijar las condiciones laborales de la futura entidad fusionada o banco SIP."
0.0004990112591414828,0.0001492459413976151,1,sk,"Stránka YouTube má získať konkurenciu Spoločnosti News Corp. a NBC Universal vo štvrtok oznámili, že od leta plánujú spoločne spustiť novú internetovú videostránku, ktorá bude obsahovať celé filmy a televízne relácie."
5.181656338828945e-05,0.0006447620057701454,1,sk,"Samozrejme, firmy, čo už mali drvivú väčšinu výnosov i nákladov v eurách, nemusia poklesy v domácej mene spôsobené jej výrazným zhodnotením v predchádzajúcich rokoch trápiť."
0.06853713864086663,0.09228304696713302,1,sk,"Na pomoc jej vyrazilo 5 záchranárov HZS, no už v tom čase ju jej priateľ transportoval bližšie k neďalekej obci, kde sa stretli so záchranármi."
0.00014284609608916396,0.0013020057809722439,1,sk,Slovensko malo pritom o tento úrad eminentný záujem a za jeho sídlo v krajine lobovali aj premiér Robert Fico či minister hospodárstva Ľubomír Jahnátek.
4.514362268220652,-0.14558195116027012,2,es-ES,"Christopher Tierney, el principal acróbata del espectáculo, fue trasladado a un hospital cercano tras caer de una alta plataforma cuando solo faltaban siete minutos para el final de la actuación, dijo en un comunicado el portavoz de la obra Rick Miramontez."
0.010526958462464828,0.014387892378395847,1,sk,"V tomto roku očakávame prírastok v podobe Rádia Prešov a otvorená je aj existencia ružomberského Rádia Ruža, ktoré si už našlo frekvenciu, ale zatiaľ nepožiadalo o licenciu."
5.372960171502572,3.3472992982443217,2,es-ES,"Según señala el auto del TSJ, cuando la concesionaria contrató en 2005 con el Ayuntamiento, ""aceptó un régimen retributivo en el que se incluía el transporte y tratamiento de una porción de aguas cuyo origen era el freático y que por el mismo empezó a percibir unas retribuciones pactadas y fijadas""."
0.009772198896382695,0.014777642982085552,1,sk,"Takisto bolo akceptovateľné, že USA podporovali šacha (aj s jeho brutálnou tajnou políciou, ktorá držala na obojku islamistov) ako nechať Iráncov ""demokraticky"" si nastoliť vládu Ajatoláha Chomejního."
0.019760755377131064,0.026602204635077988,1,sk,ST. PAUL. Najvyššie draftovaným slovenským hokejistom je pre rok 2011 podľa očakávania útočník St. Johnu Sea Dogs Tomáš Jurčo. Čerstvého držiteľa v zámorí ceneného Memorial Cupu si vybral Detroit Red Wings v 2. kole z celkovo 35. miesta.
0.0001433214375746672,0.0024975415623091474,1,sk,"Prejaviť by sa už mali aj výsledky súvisiace s reštrukturalizáciou úverov po vstupe zahraničného partnera, ktoré kvôli vyšším poplatkom bankám jednorazovo zvýšili finančné náklady."
0.00010542365445807693,0.0009332250679788415,1,sk,"Možno za nejakou kurvou stojí keď ju nadrapuje, alebo pod tým stolom mu cicka stojí a preto ani nevie čo kecá, respektíve erekcia mu zapchá uši."
8.165442510818181,0.7825510504167627,2,es-ES,"En el norte, también hay preocupación en Limbé y en Pilate, donde se han presentado ""muchos casos"" de la mortal enfermedad, ha manifestado el director general de MSPP. Sin embargo, en los primeros focos de cólera detectados en Artibonite y en el este no se han registrado muertos en los últimos días, ha subrayado. En todas las regiones donde los casos se han multiplicado ""hay problemas de higiene"", ha agregado, y ha llamado a ""reforzar la sensibilización"" para enfrentar un ""problema nacional""."
0.009527802702850832,0.012287554768048386,1,sk,"Gyurcsány si dal tajným hlasovaním v parlamente potvrdiť súhlas s rozsiahlymi ekonomickými reformami, akými je zníženie obrovského rozpočtového deficitu a transformácia neefektívneho verejného sektora."
3.8391122346709995e-06,0.00010552820369953656,1,sk,"Z kryštálového cukru a sójového mlieka uvaríme sirup, ku ktorému pridáme orechy s makom a spolu s vanilkovými cukrami a hrozienkami plnku ešte chvíľu povaríme."
12.088316887865217,-3.8611670483144898,2,es-ES,"En la playa de Eraclea, en Venecia están prohibidos los agujeros y los castillos de arena, porque obstaculizan el paso. En varios puntos de la costa no se puede dejar la toalla para coger sitio, con el riesgo de hasta mil euros de multa. En los parques públicos de Novara no pueden estar juntas más de dos personas a partir de las once y media de la noche, y en Voghera no se puede uno sentar en un banco después de las once."
4.495111023936812,4.617709082127978,2,es-ES,"«El club nos trasladó que se iba a solucionar y estamos a la espera de ese aval que ya está concedido y a ver cuando se soluciona». Bordalás reconoció que «todos necesitamos cobrar y se están haciendo gestiones en ese sentido. Es normal que hay cierta preocupación, pero hay que estar tranquilos y centrados en lo deportivo para que se solucione este tema»."
5.2676806615729825,-3.0112979456650186,2,es-ES,La Real Federación Española de Fútbol (RFEF) anunció hoy la renovación del contrato de Vicente Del Bosque como seleccionador nacional español hasta la conclusión de la Eurocopa de Polonia y Ucrania de 2012.
0.00012537576459936803,0.0015375318751612327,1,sk,"1. Zvýšená konkurencia najmä zo strany nových výrobcov obalových materiálov v krajinách strednej a východnej Európy diktuje požiadavky na vysokú kvalitu, krátke dodacie lehoty a dlhé lehoty splatnosti."
10.405088677915133,-0.07281117814161939,2,es-ES,"Al parecer el coro madrileño recibió, con gran sorpresa, el pasado 15 de abril una carta remitida por la Orquesta Sinfónica de Madrid, de la que depende, informándole que suprimía sus servicios durante los meses de abril, mayo y junio, ya que la Fundación Teatro Real había contratado a otra agrupación. Dicha agrupación, Intermezzo, es la que se hará cargo de las dieciocho representaciones de la ópera verdiana. «Es una empresa de cantantes, que hacen refuerzos, no es un coro», aseguraba ayer la misma fuente."
0.00022296217318253604,0.0027366548257134996,1,sk,"Na podnet primátora mesta Prešov, Pavla Hagyariho, sa tento týždeň uskutočnilo prvé z rokovaní, ktorých výsledkom by malo byť premávanie rýchleho vlakového spoja medzi Prešovom a hlavným mestom."
0.00018757581895456756,0.002053322625184485,1,sk,"Gang Róberta O. zavraždil Estóka zato, že im konkuroval Vraždu Jozefa Estóka, ktorú má na svedomí podľa obžaloby zločinecká skupina Róberta O., pripravovali páchatelia niekoľko týždňov."
0.009796562459978836,0.0158260075347822,1,sk,"Na webe si môžete overiť, v ktorej zdravotnej poisťovni ste Overiť poistné vzťahy poistencov aj nové kódy lekárov a poskytovateľov zdravotnej starostlivosti možno na internetovom portáli Úradu pre dohľad nad zdravotnou starostlivosťou (ÚDZS)."
8.782301249257282,5.157961445793266,2,es-ES,"La suerte no estuvo en esta ocasión de parte del Lazio, que en el minuto 42 veía cómo el árbitro no sólo no le concedía el penalti sino que pitaba uno a favor del el Roma, esta vez transformado por Mirko Vucinic, por una falta de André Dias sobre Julio Baptista. Tras un inicio fácil para el Milan, que se aventajó en el marcador en el minuto 4 con un gol de Massimo Ambrosini ante el Bari, los 'rossoneri' acabaron sufriendo para asegurarse la victoria."
0.0008263749590607434,0.001621548290295052,1,sk,"""Za nejakých sto dní bude euro v našich vreckách, stane sa našimi peniazmi,"" povedal pri príležitosti uvedenia novej meny prezident ECB Willem E. Duisenberg."
8.88414802766818e-05,0.0015105206755032883,1,sk,"Napriklad ak by EU bola v sucasnosti spickova vyskumna VS, pri ostatnych podmienkach nezmenenych tak nie len pre slovenskeho studenta by to malo minimalne dve zasadne vyhody."
9.875506851736622,0.9441945315044042,2,es-ES,"El ex portavoz de Batasuna Arnaldo Otegi ha ""desmentido rotundamente"" que él o algún otro dirigente de la izquierda abertzale hablaran con el PSE después de las elecciones vascas del 1 de marzo, como ha asegurado el PNV. En una entrevista en ETB, Otegi ha criticado que el presidente del PNV, Iñigo Urkullu, hiciera ver la existencia de ""algo oculto"", bien sea ""cálculo electoralista"" a más largo plazo en el Estado u otras comunidades autónomas, o bien relacionado con ""el mundo de Batasuna"" de cara a las próximas elecciones municipales y forales."
3.7153069732218014,2.534363836899616,2,es-ES,"Afortunadamente, cuenta con el pasaporte y el visado en regla por lo que no habrá ningún tipo de problemas para que llegue a tiempo y no se repita la misma historia del año pasado cuando tardó un mes más en incorporarse al trabajo."
0.0001789300591380271,0.002777581768551349,1,sk,"Slovenská verejnosť by podľa Greenpeace mala vedieť, že za plánovanou výstavbou ropovodu nie je len záujem rakúskej firmy OMV, ale aj slovenskej spoločnosti Transpetrol, ktorú kontroluje štát prostredníctvom Ministerstva hospodárstva SR."
5.203289507221663,-1.5874402949243314,2,es-ES,"La regata está organizada por el Área de Turismo y Deporte del Ayuntamiento y la Obra Social de Unicaja, con la organización técnica de Cobarja. Colaboran la Federación Andaluza de Remo y Vela, el Club Mediterráneo y Cruz Roja."
0.009562055719132526,0.012323855581067848,1,sk,"Hoci mnoho firiem už využíva pevné linky alebo mikrovlnné spojenia, podľa obchodného a marketingového riaditeľa poskytovateľa internetu EuroWeb Slovakia, a.s., Bratislava Jána Jaša si technológia FWA určitý trhový podiel získa."
8.854406903366017e-05,0.0012462993906401613,1,sk,"V tejto latinskoamerickej krajine existuje aj jeden veľmi starý zvyk, pri ktorom ulicami miest a dedín prechádzajú trubači zvaní chirimias, ktorí za zvuku fláut spievajú tradičné koledy."
0.00012075324918211666,0.0017071980603363514,1,sk,"Vyhnaný prezident Haiti Aristide sa plánuje vrátiť Hovorkyňa haitskej vlády Alice Blanchetová ešte v utorok informovala, že Aristidovi a jeho právnikovi úrady v Haiti vystavili diplomatické pasy."
0.009956802586887439,0.015657969250684283,1,sk,"Markušovi Matičiari neveria, predsedom je Tkáč Vo vašom prehliadači chýba flash player, ktorý treba k prehratiu videa kliknite a nainštalujte si ho Ďalšie videá nájdete na tv."
10.858609346175546,0.6800287120222115,2,es-ES,"El sindicato CGT, la asociación de trabajadores españoles en Gibraltar Ascteg y el colectivo Parados Linenses se concentrarán el próximo 17 de septiembre en la frontera con Gibraltar contra la implantación de una tasa a los visitantes del Peñón Los convocantes rechazan la medida que el Ayuntamiento de La Línea de la Concepción quiere poner en marcha el próximo de octubre y que afectaría a los visitantes que accedan a Gibraltar en sus vehículos."
4.891984017364675,-2.7060478494528093,2,es-ES,La organización la lleva a cabo la Asociación de Informadores de Elche y está patrocinado por la CAM y la concejalía de Deportes del Ayuntamiento de Elche.
3.9405807378713504,-0.040374714498841044,2,es-ES,"Cabo ha acusado a las Fuerzas de Seguridad del Estado de «acoso» y ha precisado que las citaciones provocaron «cuatro ataques de ansiedad». «Hubo que restringir sectores porque la gente no estaba en condiciones», ha agregado."
7.471792651521424,-4.47524278110402,2,es-ES,"Además, contempla la reserva de terrenos para equipamientos sanitarios; suelo para los nuevos juzgados y para la Comisaría de Policía, así como la reserva estratégica de suelo y una mejora sustancial de las comunicaciones del municipio, a través de la creación de viales estructurantes y la ampliación de otros ya existentes."
0.012253359124641955,-0.002501690679616956,1,sk,Dalsiu noc – z nedele na pondelok 19. marca ktosi poskodil sklenu vypln autobusu nezistenym predmetom priamo v areali SAD v Brezne a pripravil tento podnik o 30 000 korun.
6.985154273970201e-05,0.0011198732135332043,1,sk,"Je to film o ľúbostnom štvoruholníku Eriky Marozsánovej a troch mužov, ktorí ju ľúbia a ktorí budú musieť pre ňu zomrieť, hoci jeden z nich umrie prineskoro a dvaja nepochybne privčas."
0.010404291560909964,0.016806038433384077,1,sk,"Hosťujúci súbor z Poľska Teatrzyk miNiaTuRa, ktorý vystúpi nesúťažne, poteší divákov hrou ´Prawo jazdy´ (Vodičský preukaz) na motívy Z. Wójcikovej v réžii H. Wichniewicza. Divadielko Krosnenského Domu kultúry bolo založené v roku 2003. Cvičenia a skúšky súboru sú realizované formou hry na divadlo, ktorá umožňuje osvojenie si živého slova, voľnú scénickú tvorbu, ide o princíp tvorivej dielne. Hra zapája do deja aktívne i diváka."
3.9864309472715265,0.5327901115727591,2,es-ES,La reconstrucción del hotel Sardinero es una obligación que impone la ficha urbanística y la normativa municipal santanderina. El edificio forma parte del Plan Especial de Protección del Conjunto Histórico Artístico de El Sardinero (1996).
9.17420066138418,-0.24435270936391615,2,es-ES,"Aún así, tan sólo tan sólo 44 personas se han interesado por adquirir una de las plazas que el Consistorio ha sacado a la venta en concesión de 50 años por un importe de 9.000 euros. «El Ayuntamiento suprimió la limitación por la cual sólo los residentes de las calles colindantes podían acceder a una plaza pero aún así los vecinos se quejan de que no sea una venta en propiedad sino tan sólo una concesión», ha explicado el edil de Hacienda, Salvador Domínguez."
8.321653713571735,0.85691464383454,2,es-ES,"En el Dakar todo es posible y los imprevistos están a la orden del día. La ventaja de cinco minutos sería suficiente en cualquier competición, pero no en el desierto de Atacama. Sin embargo, el recorrido que resta hasta llegar a Buenos Aires es más corto y menos propenso a las sorpresas. La etapa de este viernes, de 368 kilómetros, terminará en Santa Rosa. El sábado se disputará el último tramo de 206 kilómetros."
0.0007305998786941981,0.0034916908803602543,1,sk,"Trénerovi Benitézovi nebude k dispozícii potrestaný Javier Mascherano, koučovi Chelsea Guusovi Hiddinkovi spôsobuje vrásky na čele zranenie útočníka Didiera Drogbu, ktorý vynechal pre problémy s členkom sobotňajší ligový duel s Newcastlom."
5.010627033675001,-1.3001068631049995,2,es-ES,"De hecho explicó que los datos eran similares a los del año pasado. «La estadística de delincuencia de enero a agosto es similar a la del año pasado, aunque existe un repunte en los meses de verano»."
0.00030205114341080657,0.0035592846577913854,1,sk,"Je hviezdou nielen jazzovej, klasickej a worldmusic scény, ale je zároveň aj prvým hudobníkom, ktorý akordeón ako hudobný nástroj priniesol na významné jazzové festivaly a do noblesných koncertných sál."
0.00029232922666601346,0.003944216695621056,1,sk,"Aj vďaka ich úspechu sa reklama postupne mení z niečoho čo otravuje, na niečo čo zabáva, pomáha, jednoducho to, čo má pre spotrebiteľa hodnotu."
9.905130672419801,5.291160777799291,2,es-ES,"La octava corrida del abono tiene el atractivo especial del arte del rejoneo, un festejo con muy fuerte tirón taquillero hasta el punto de que es un espectáculo que desde que se anuncia tiene una máxima expectación con independencia del cartel que año tras año tiene nuevas orientaciones como consecuencia de que cada vez están saliendo y componiendo el escalafón un mayor número de toreros a caballo con más nivel desde que Pablo Hermoso de Mendoza, que toreo y triunfó en la corrida mixta del pasado día nueve volviera a colocar el arte del rejoneo en cotas de máximo interés."
3.9390084850043046,0.7570112737833926,2,es-ES,"Javier Cremades, uno de los principales miembros del despacho de abogados Cremades&Calvo Sotelo, que representa a esta Plataforma integrada por más de 5.000 afectados, indicó que se va a reclamar por vía administrativa a AENA esa cifra y que este trámite va a tener lugar en enero."
6.6305986962140535,-0.15015249733504096,2,es-ES,"La condena fue dictada por el juez Víctor Danilkin, quien el lunes ya había declarado culpable al fundador de Yukos y a su socio Platón Lébedev. Ambos cumplen una sentencia anterior de ocho años de prisión por evasión de impuestos. La resolución judicial provocó una airada protesta internacional encabezada por EE UU. El Departamento de Estado sugirió incluso que el castigo a Jodorkovski constituye «un uso abusivo del sistema legal con fines deshonestos»."
2.33457426096302e-05,0.00036407061636787317,1,sk,Hlavná stránka Zaregistruj psíka Ceny pre víťazov Najkrajšie šteniatko Najelegantnejší psík Naj komik Naj psie oči Najmenší psík Najväčší psík Najpodobnejší s pánom Naj miláčik roka Naj psie kúsky Naj psík z útulku Veľká radosť z kúska sololitu..
6.172746088945899,1.6718849275408398,2,es-ES,"En cuanto a Lerma, su ausencia fue de las más destacadas, puesto que es ahora el máximo representante de los socialistas valencianos. El presidente de la gestora no podía acudir porque tenía trabajo en el Senado, aunque desde dentro del partido hay incluso quien dice que no tenía demasiado interés en participar en la campaña."
0.0002372894956799162,0.004010633369617396,1,sk,"Postarajú sa napríklad o to, aby sme vedeli, či sú skutočné talenty, či im ich zdravie dovolí, aby sa plne rozvíjali, aj keď prekročia pubertu?"
12.042364641001841,-0.8260087801759579,2,es-ES,"Explicó que estas alegaciones se refieren, entre otros temas, a la ""no coincidencia"" de las empresas adjudicatarias con la empresa solicitante de la licencia de instalación y apertura, ya que la redacción del proyecto, construcción y explotación del aparcamiento recayó en SIEC y ACTIUM, pero la solicitante de la licencia, Aparcamientos Mendicouague, se ha creado después de la adjudicación con el capital ""mínimo exigible"", por lo que ""no ofrece garantías de solvencia frente a los posibles daños y perjuicios que pudieran causarse en la ejecución de la obra o en las viviendas colindantes""."
9.441641283221925,-0.14304489611402676,2,es-ES,"«Esperando verte» es el título del nuevo trabajo que la cantante gaditana Niña Pastori escenificará en el Colón el 27 de febrero, un día después de la representación de la obra «7 contos capitais», una serie de historias en las que la avaricia, lujuria, pereza, envidia, gula, soberbia o ira de los personajes se van entrelazando ofreciendo una visión satírica y grotesca de éstos y con la que reflexiona sobre las miserias y debilidades humanas."
0.0001288818352352241,0.0016235696379166675,1,sk,"Pomerné zastúpenie troch bývalých krajov nevykazuje v žiadnom zo sledovaných ukazovateľov výraznú odchýlku, hoci v absolútnych číslach sú na prvom mieste bývalý Západoslovenský kraj a Bratislava."
