x1,x2,label,lang,texts
10.043249086573223,-0.33724373430293,2,es-ES,"Así mismo, se ha dado el visto bueno a una subvención de 5.000 euros al ayuntamiento de Fortuna para el desarrollo de actividades en el centro ocupacional de la ciudad, y otras dos de 6.000 euros a la Asociación para la Intervención Integral del Desarrollo Infantil y la Atención Temprana (Asinter) y al Centro de desarrollo infantil y atención temprana (Adamur) para el desarrollo de programas que den respuesta a la situación psicofamiliar de personas con discapacidad."
0.06284632976958482,0.5644243019875246,1,sr,"Narednih 12 meseci biće kritično za BiH i sve prepreke koje sprečavaju njen napredak ka integraciji moraju nestati, upozorili su Solana i Lajčak."
7.772651085167251,0.25917743551124967,2,es-ES,"La cantante Alanis Morissette ha contraído matrimonio con el rapero Souleye, en una ceremonia íntima celebrada en su residencia de Los Ángeles, según ha confirmado la edición digital de la revista People. La artista canadiense se ha casado con Souleye, de 30 años y cuyo nombre real es Mario Treadway, ante la única presencia de los familiares de ambos. Se trata del primer enlace matrimonial para los dos artistas."
3.8342296908809717,-0.22086211871359648,2,es-ES,"Juan de Dios Román ha sido elegido hoy presidente de la Federación Española de Balonmano para los próximos cuatro años y sustituirá en el cargo a Jesús López Ricondo, quien ha ocupado la presidencia durante 14 años."
0.12397234913863223,0.6304035958859692,1,sr,"Kipar ima šesti najveći registar brodova na svetu, ako se gleda ukupna tonaža registrovanih brodova, čime sporazum dodatno dobija na značaju."
6.840470232803764,0.09228388895877342,2,es-ES,Los inspectores de Consumo solicitarán al establecimiento inspeccionado ejemplares firmados de cada uno de los tipos de contrato que se oferten por parte de dicha empresa y en ellos se prestará especial atención a la inclusión de cláusulas abusivas y la utilización de prácticas desleales.
9.13721291510963,0.47163361987819064,2,es-ES,"Sin embargo, la información sobre el presunto uso privado de los fondos y medios públicos por parte del director del CNI siguió apareciendo, entre otras, noticias que apuntaban que se estaba sirviendo de su posición para colocar a familiares o amigos en el CNI, a agentes para limpiar su piscina o incluso que el centro compraba la cosecha de patatas de un familiar. También se conoció que estaba utilizando la prueba del polígrafo con algunos agentes del CNI para tratar de averiguar quién estaba realizando las filtraciones a la prensa."
8.219344590317357,0.38077043253541665,2,es-ES,"En la actualidad hay cerca de 200 personas que perciben ayudas del Gobierno central, aunque se trata de grandes dependientes –catalogados en el grado tres y los niveles 2 o 1–. En el último Consejo de Ministros se determinaron las cuantías de revalorización de las prestaciones de los cuidadores no profesionales con respecto a 2007 y se establecieron las correspondientes al nuevo grado de catalogación."
0.1381780705280288,3.0730052484558588,1,sr,"«Naš prioritet je da iskoristimo domaće izvore koliko je to moguće», rekao je turski ministar za energetiku i prirodne resurse Hilmi Guler obraćajući se učesnicima kongresa."
0.00589692971371464,0.8668514721160931,1,sr,Premijer Bosne i Hercegovine (BiH) Adnan Terzić (levo) na konferenciji za štampu sa komesarom za proširenje EU Olijem Renom posle njihovog sastanka u ponedeljak (21. marta). [AFP]
0.20490654489092305,2.4753582800767893,1,sr,"Rom Daut Čilandžiju, čiji dvanaestogodišnji sin pohađa osnovnu školu Mustafa Bakiju u Prizrenu, kaže da se ne seća da su ga u školi bilo šta učili o tome da na Kosovu žive različiti narodi."
6.80433640688172,-0.43602791858292,2,es-ES,"El resto de los asuntos contemplados en el orden del día de la sesión de ayer de la Junta de Gobierno Local, relativos a las áreas de Hacienda y Personal, Protección Ciudadana y Participación Ciudadana, han sido considerados de mero trámite."
5.211249493418781,0.28075070425232973,2,es-ES,"Martín no compra las Barbies, sino que éstas son donadas, encargándose de su arreglo si es necesario para ""darles una nueva vida"". Los trajes se elaboran con telas reutilizadas y están modelados con silicona caliente, ya que, como reconoció el propio autor, ""no me gusta coser"". En cuanto al resto de materiales, utiliza cajas de madera para vino, corcho o, incluso, palos que recoge en el campo."
0.19781865365181692,2.725758120846771,1,sr,"Drugi predlozi da se predsedniku daju još veća ovlašćenja, kao, na primer, da imenuje i smenjuje šefa obaveštajne agencije i guvernera centralne banke, nisu prošli. Njihovi protivnici tvrdili su da bi na taj način predsednik potpuno dominirao kosovskim sistemom."
0.006107684221015854,1.1379430043062322,1,sr,"Sporazum je parafiran u novembru, ali nije finalizovan zato što Beograd nije pokazao potpunu saradnju sa Međunarodnim krivičnim tribunalom za bivšu Jugoslaviju."
0.007515026895223154,1.4043310122826373,1,sr,"Na dnevnom redu je bilo važno glasanje o gasovodu ”Južni tok” i bezbednosnim službama, pa je poslanica naprednjaka stegla zube i sela u klupu."
0.022723865017473803,3.40571054040125,1,sr,"Odlazeći predsednik sindikata železničkih radnika Nikos Kiucukis u sredu je ponovio osvoju optužbu da grčka vlada želi da pretvori OSE u ""zabavni park… otvoren samo vikendom. Ona želi da pretvori železnicu u minijaturu, svodeći je sa sadašnjih 2.600km na 800km""."
0.33210637612210303,2.989828876273721,1,sr,"Neki od zahteva koje Beograd nije ispunio upućeni su pre 20 meseci, rekla je del Ponte. «Najbolje rezultate i fer rezultate u značajnim krivičnim postupcima kao što su ovi u Hagu moguće je postići samo ako su najbolji mogući dokumenti pravovremeno dati na raspolaganje», dodala je ona, navodeći kao primer suđenje Slobodanu Miloševiću."
6.040446652450294,0.4419163518460453,2,es-ES,"Con la misión casi cumplida, Quique retiró del campo al ""Kun"" Agüero a un cuarto de hora del final y sacó a Cleber para fortalecer el centro del campo. Bergantiños lo intentó desde la frontal en el 82, pero su empalme se encontró con Asenjo, que desvió a córner. El Atlético se quedó con uno menos por expulsión de Domínguez a falta de cinco minutos, pero el Xerez no tuvo ocasiones."
5.692665578078799,-0.038119890622859656,2,es-ES,"A su juicio, ""la intensidad del crecimiento futuro va a depender de las medidas de política económica que tomemos"" y en este sentido, aseguró que las decisiones adoptadas por el Gobierno central ""pueden llevarnos a la famosa 'L', es decir, que dejemos de caer pero que apenas crezcamos durante bastantes años; que no crezcamos lo suficiente para generar empleo""."
4.027853286641268,0.4085816547286714,2,es-ES,"Tampoco se encuentra en buen estado el tejado. «Los canalones están para caerse, un vecino de arriba tuvo que irse, porque se le estaba hundiendo el techo y nadie quería arreglar el tejado. Sólo nos pusimos de acuerdo él y yo, porque los vecinos que había antes no querían»."
9.243160054797452,-0.1862943064898129,2,es-ES,"Los afectados, que en junio se manifestaron para exigir la retirada de esta instalación, han vuelto a pedir al Consistorio que «cumpla con sus promesas» y han recordado que en noviembre de 2009 el equipo de gobierno del Ayuntamiento veleño, de quien dependen la Cortijada, ya anunció que instaría a la operadora responsable de la antena a que la retirase por carecer de licencia."
2.527341688513958,-0.1154224061054761,2,es-ES,La institución regional destinó durante 2009 un total de 272.201 euros a indemnizaciones por 703 ataques de lobos que afectaron a 2.151 reses y autorizó abatir cinco ejemplares al Norte del Duero y otros ocho al Sur.
5.81527077755845,0.25140117795240774,2,es-ES,"También Luis Saiz se refirió a la cantidad de trabas legales y, en particular, a las numerosas evaluaciones sectoriales que se demandan. «Nos hemos pasado tres pueblos, no sólo en Cantabria sino en España, sobre todo en el tema de la evaluación ambiental. Las evaluaciones de impacto ambiental necesitan mucha menos yuxtaposición de normas y mucho más sentido común»."
4.46815340589752,0.6436070497306227,2,es-ES,La próxima jornada el Inec Zamora se enfrenta en casa frente al Basquet Siria buscando una de las 6 plazas que da el pase a la siguiente fase por la lucha en el ascenso a la LEB bronce.
0.18342726896061168,0.6165166939154022,1,sr,"Ministri unutrašnjih poslova zemalja jugoistočne Evrope okupili su se u četvrtak (12. oktobra) na dvodnevnom sastanku u Budvi, u Crnoj Gori."
5.8120059243156685,0.02560180637654811,2,es-ES,"Tras visitar la tenencia de alcaldía, donde fueron recibidos por el alcalde, Alberto Fabra, se dirigieron al colegio Obispo Climent, donde comenzaron una vistosa cabalgata en la que no faltaron siete toneladas de caramelos y espectaculares carrozas. Entre los personajes que más gustaron a los pequeños, destacaron Bob Esponja y Patricio, personajes de dibujos animados que compartieron protagonismo con el tradicional Piolín y el gatoSilvestre."
8.258315123268135,-0.4668798833088877,2,es-ES,"Luego, el presidente sigue llenando el cajón en el que el Ejecutivo guarda sus fortines. «Sin renunciar a ninguno de nuestros retos y a pesar de la escasez de recursos, hemos hecho fuertes los servicios públicos esenciales y estamos en condiciones de garantizar que la educación, la sanidad y la atención a la dependencia van a seguir siendo el nuevo año servicios de excelencia»."
0.01747319653057233,1.9083978607750542,1,sr,"Grčko ministarstvo odbrane saopštilo je u sredu (12. novembra) da će formirati specijalnu jedinicu sa 200 pripadnika, koja će biti zadužena za otklanjanje nuklearnih, hemijskih i bioloških pretnji tokom Letnjih olimpijskih igara u Atini 2004. godine."
6.12344315843208,0.2717508341413104,2,es-ES,"Sí, la razón pública. Mira que esto no había pasado antes. En el feudalismo eso no existía, y en el Renacimiento eran cuatro desgraciados. Fueron la revolución francesa y la americana las que instauraron el uso público de la razón en el parlamento, donde se razona y se distribuye. Y estamos aprendiendo que la discusión pública resuelve problemas."
0.6807041890683181,2.096865955267837,1,sr,Generalni sekretar NATO-a Jap de Hop Shefer u ponedeljak (9. januara) je izrazio nadu da će Bosna i Hercegovina (BiH) i Srbija i Crna Gora ove godine biti u stanju da počnu izgradnju bliskijih veza sa Alijansom.
0.0574970891075363,0.36985244917179594,1,sr,"Šefovi država ili vlada zemalja Procesa saradnje jugoistočne Evrope (PSJE) u četvrtak (4. maj) su izrazili svoju posvećenost evroatlantskoj integraciji, unapređivanju odnosa sa EU i jačanju sveukupne regionalne saradnje."
0.020694028567123695,3.294087104814189,1,sr,"Na ceremoniji potpisivanja u Sarajevu, šef diplomatije BiH Mladen Ivanić izjavio je da je švajcarska finansijska pomoć bosanskoj ekonomiji dostigla 195 miliona evra i da je uložena u vodosnadbevanje, uklanjanje mina i posleratnu obnovu."
12.093413837336378,-0.10224340844313005,2,es-ES,"Explicó que estas alegaciones se refieren, entre otros temas, a la ""no coincidencia"" de las empresas adjudicatarias con la empresa solicitante de la licencia de instalación y apertura, ya que la redacción del proyecto, construcción y explotación del aparcamiento recayó en SIEC y ACTIUM, pero la solicitante de la licencia, Aparcamientos Mendicouague, se ha creado después de la adjudicación con el capital ""mínimo exigible"", por lo que ""no ofrece garantías de solvencia frente a los posibles daños y perjuicios que pudieran causarse en la ejecución de la obra o en las viviendas colindantes""."
0.006202806636937639,0.8609871646169633,1,sr,"Na osnovu zaključaka eksperata biće doneta odluka o isplati preostalih 1,2 milijarde evra kredita koliko Srbija može da dobije u ovoj godini."
0.0059868706619466555,1.1059485057010567,1,sr,"""Ne treba nam ničiji savet o severnom Iraku i operaciji koja će tamo biti izvedena"", izjavio je on na stranačkom skupu u Istanbulu održanom tokom vikenda."
0.25355202428116796,1.9918127428843504,1,sr,"U saopštenju Agencije se ističe da se, iako je višestruka korist od diklofenaka, koji proizvodi nekoliko kompanija, kod nekih pacijenata bi ipak trebalo preduzeti mere predostrožnosti."
0.02194875249243916,3.2953996502044,1,sr,"«On je izložio viziju i pružio jasne, jasne smernice”, rekao je Jesen Petersen. «Uz jedinstvo, mislim da će svi raditi zajedno da bi pokušali da obezbede ostvarenje njegovog sna.»"
0.017011832737203567,2.9014335018160837,1,sr,"Nova vlada će učiniti sve što je u njenoj moći da okonča saradnju sa Haškim tribunalom ""što je pre moguće"", rekao je Koštunica."
0.00500384585908339,0.926738865333057,1,sr,Drugi koraci koje je preduzela Karamanlisova vlada uključuju odlaganje produženja prigradske železničke linije i odbacivanje predloženih izmena putanje staze za maraton.
0.22142156120530984,2.0422122100545783,1,sr,"Iako to nije formalno definisano kao uslov, praksa je i da se za predsedavajućeg nikada ne bira predstavnik neke od pet stalnih članica Saveta bezbednosti UN (Rusija, SAD, Velika Britanija, Francuska i Kina)."
4.55330296608122,-0.14597193975300168,2,es-ES,"Por destino económico de los productos, todos los segmentos registraron avances mensuales, en especial la energía (3,2%) y los bienes intermedios (0,6%), mientras que los que menos crecieron fueron los bienes de equipo (0,1%) y los bienes de consumo no duradero (0,2%)."
0.05800093498881701,0.3962500072379904,1,sr,"Ranije ove godine rumunska vlada i Vrhovni savet odbrane odobrili su stvaranje dva nacionalna energetska holdinga, koja će nadzirati ministarstvo ekonomije."
0.14155479756722994,3.4130997562877137,1,sr,"«Uveren sam da će u posmatračkom izveštaju u oktobru 2005. godine biti prikazan napredak koji je Rumunija ostvarila u proteklih osam meseci», rekao je Ungureanu, koji je član Nacionalno liberalne stranke (PNL), u svom obraćanju polaznicima letnje škole za mlade liberale koja se održava u crnomorskom odmaralištu."
3.2279765860674603,-0.03219901751555122,2,es-ES,"""El problema que tenemos es que hay grupos poderosos porque tienen secuestrados a los ciudadanos, que pueden ser los controladores o los conductores de Metro, que pueden paralizar una ciudad y tomar como rehenes a los ciudadanos. Eso no puede ser"", ha afirmado."
0.014849256676996051,2.057336855237988,1,sr,"Uzeti 15 odsto teritorije jedne države -- moguće je samo ako je demokratija pogažena», izjavio je premijer srpskim novinarima u Vašingtonu posle sastanka sa Rajsovom."
0.1424481332250664,3.052442460443024,1,sr,"On je takođe ukazao da bi Turska ""mogla da nametne neke sankcije u pogledu određene robe koju izvozi u Irak"", ali nije iznosio detalje o tome koja bi to specifična roba mogla da se nađe pod embargom."
3.7446932401337154,-0.05312614083749293,2,es-ES,"Por su parte, la estación de Javalambre celebrará el sábado, la primera edición del 'Jamón Style', en la que participarán 80 riders procedentes de Valencia, Castellón, Alicante, Teruel y Madrid."
7.399938359945833,0.11608781626642355,2,es-ES,"Preguntado por lo que se persigue con ese nuevo impulso a la política educativa de Melilla de cara al próximo curso escolar, se limitó a decir que el interés del Ejecutivo de Zapatero es continuar «con la mejora de las instalaciones y de los procedimientos, reforzar ese proyecto de lucha contra el fracaso y el absentismo escolar»."
0.06507428303543643,1.4880667567477566,1,sr,"Mediji koji prate suđenje Čoviću izvestili su da je on posle izricanja presude uputio dva pisma, jedno svojoj porodici, a drugo članovima HDZ-a."
0.026835465050572212,4.389403931186529,1,sr,"Odlučila je da garderobu koju je povremeno nosila na nastupima i one haljine koje joj više nisu potrebne stavi na onlajn ""prodaju. Pojedine stvari nudi svojim koleginicama, jer, kako kaže, zna da ima dosta samohranih majki, a i ona je jedna od njih, pa zna koliko im je teško."
6.084770314652023,-0.33331948050505467,2,es-ES,"Cotino tuvo la oportunidad de ver sobre el terreno la gravedad del problema en El Hondo, pero de momento lo único que tienen los regantes es el compromiso de retomar la situación el próximo mes de septiembre."
3.1110824110583994,0.22971432837355374,2,es-ES,"Los impulsores del proyecto, germinado en los años ochenta durante una charla entre amigos, decidieron que su intención primaría proteger esa especial forma de hacer humor de los autores gallegos, por eso contactaron con distintos artistas para solicitar su ayuda."
6.222380558082614,-0.34510997112008557,2,es-ES,"Asimismo, la Guardia Civil al incautar los efectos en el vehículo y los billetes tanto de curso legal como los supuestamente falsificados, empleados generalmente para cometer la estafa conocida como 'timo del negativo', procedió a la detención de estas dos personas como presuntos autores de los delitos de falsificación de moneda y estafa."
0.13618056501149498,2.302737546804521,1,sr,"Da bi potvrdio obećanje da će njegova zemlja ispuniti sve potrebne obaveze, Sanader je prošlog meseca posetio sedište NATO i obratio se Severnoatlantskom savetu."
0.1810742053146875,0.846852756620226,1,sr,"PREMA rečima Vojkana Nikodijevića iz „Soko info“, ove sezone se očekuje i veliki broj Rusa u Sokobanji, koji su kako kaže, sasvim slučajno otkrili i zavoleli ovo turističko mesto i u njemu pronašli svoj kutak za odmor."
0.1305911855239218,1.5960302416256287,1,sr,"Prema rezultatima novog istraživanja javnog mnjenja, 51 procenat Makedonaca smatra da je nezaposlenost najveći problem sa kojim se zemlja suočava. [AFP]"
6.4557546383276385,-0.27108950104135915,2,es-ES,"Hay veces, como por ejemplo en el caso de Xavi Hernández y sus problemas en el tendón de Aquiles, en las que no llegamos a ser consicentes de lo duro que es convertirse y ejercer de deportista de élite y el riesgo que corren estos jóvenes atletas cuando compiten al máximo nivel."
0.4742211503445365,0.006699797777857667,2,es-ES,"Los visistantes podrán encontrar en Ecocultura desde frutas y verduras, miel, lácteos, pan, harinas, vino, jamón y embutido, conservas, ropa, calzado, complemementos o cosméticos."
0.01172599894163251,1.882057849353979,1,sr,"Bez obzira na to, ako Hrvatska želi da drži korak sa drugim, razvijenijim zemljama -- posebno sa članicama EU -- konačna zabrana pušenja na svim javnim mestima je nesporna."
0.007513406552771288,1.4272081568858648,1,sr,"Nemačka KfW banka odobrila je Hrvatskoj banci kreditnu liniju od 37,5 milona evra za obnovu i razvoj infrastrukture za snabdevanje vodom u blizini letovališta na Jadranskoj obali."
4.615847316089003,-0.06726661471528259,2,es-ES,"Acabó su intervención diciendo, que puede ser la última que hace como concejal, con una poesía, recordando otras ediciones y la importancia que tiene la muestra, los días 17, 18 y 19 de este mes en la Plaza de Toros."
0.13138409598364587,1.6842613751721025,1,sr,Istraživanje koje je uradio Acevski sugeriše da mnogi odobravaju međuetničke emotivne odnose -- sve dok se to ne dešava u njihovoj porodici.
6.422985775811201,0.2185525399163504,2,es-ES,"Los ediles abertzales también criticaron que en mayo de 2010 se acordó elaborar un Plan de Saneamiento, «que se aprobará cuando ya está a punto de concluir la actual legislatura y que al ser a tres años vista condicionará a la nueva Corproación que entre tras las elecciones de mayo de 2011»."
0.1278934949187324,1.0679534127046306,1,sr,Evropski pokret u Srbiji preporučuje da Beograd uspostavi bolju saradnju sa centralnom vladom Bosne i Hercegovine kako bi se rešila otvorena pitanja.
5.7106931195101724,-0.08529304702550533,2,es-ES,"La tarifa dos que se aplica todos los días laborables de noche de 22.00 a 06.00 horas, y los sábados, domingo y festivos durante todo el día supone una bajada de bandera de 3.2124 euros, el kilómetro cubierto a 1,6050 euros y la hora de espera a 30,2114 euros."
0.06831988708157133,2.097668629049575,1,sr,"""Sjedinjenje Države su od početka podržavale pravo Kosova da postoji kao suverena nezavisna država unutar svojih postojećih granica"", izjavila je Klintonova na konferenciji za novinare posle sastanka sa premijerom Hašimom Tačijem."
0.18938727483741816,3.5884475656297066,1,sr,"Iz istih razloga zaposleni su štrajkovali polovinom decembra, ali su protest zamrzli, nakon što su kontrolori Agencija za privatizaciju naložili vlasnicima da ispune preuzete obaveze. Međutim, tadašnji direktor Miljko Kragović podneo je ostavku. Za novog direktora izabran je Denis Poljak, kome radnici juče nisu dozvolili da prvi put uđe u fabriku."
0.11903962221925324,1.1598473816815504,1,sr,"Umesto toga, njena meta su ilegalni imigranti, narkomani, prostitutke, prodavci falsifikovane robe i ulični prodavci bez dozvole, od kojih su mnogi siromašni ljudi koji pokušavaju da prežive, a ne ovejani kriminalci."
0.0668485680297241,1.9931199105826052,1,sr,"Policija je nedavno privela G.C. iz Beograda koji je proizvodio i prodavao veliku količinu piratskog softvera za dijagnozu štete na vozilima, kao što su Honda, Fijat, Ford, Dajmler Krajsler i Tojota."
0.43698705188487363,3.0265263807994587,1,sr,"Lideri su se takođe saglasili oko potrebe institucionalnog jačanja PSJE kako bi mogao da bude u stanju da preuzme neke odgovornosti Pakta za stabilnost, bavi se pitanjima koja se direktno odnose i utiču na region i unapredi njegove izglede vezane za EU."
0.06918317113008195,2.119898946596797,1,sr,"Direktorka Slobodanka Simić Novčić kaže da im je Opština pomogla i pre pet godina, kada je adaptirala i podrumske prostorije, koje su pretvorene u svlačionice i baletske sale."
2.782174878988714,-0.0683166293301029,2,es-ES,"Ha vencido en la final el polaco Piotr Malachowski, 27 años, subcampeón olímpico y mundial, con un lanzamiento de 68.87, en un mano a mano con el alemán Harting (68.47), y bronce del húngaro Fazekas (66.43)."
4.333308850750524,0.5092148133941022,2,es-ES,"Porque aunque cada vez son más las personas que deciden vender su oro, sigue habiendo muchos ciudadanos que prefieren acudir a los Montes de Piedad, una opción por la que se recibe menos dinero, pero con la ventaja de que ese oro se puede recuperar más adelante."
0.00926343700792385,1.48936999782659,1,sr,"Evropska investiciona banka odobrila je makedonskoj nacionalnoj kompaniji za električnu energiju, ESM, kredit u iznosu od 13 miliona evra koji će biti upotrebljen za obnovu i modernizaciju eletrične prenosne mreže u zemlji."
6.9477969395890975,0.19939567232741667,2,es-ES,"Durante algo más de una hora, 48 músicos dirigidos por Juan José Ocón, 12 cantantes y 10 bailarines se unirán para representar 'Gernika, danza sobre lienzo', un espectáculo de Aukeran basado en una partitura del músico Aitor Amezaga que narra lo ocurrido en abril de 1937 en la villa vizcaína y que se complementará con la interpretación de la Marcha fúnebre de Pablo Sorozabal."
0.07120100206845466,1.2077997536829206,1,sr,"Šnajder i Enste koristili su dva različita izvora podataka da bi izračunali prosečan odnos od 20,9 i 31,6 procenata za tranzicione ekonomije centralne i istočne Evrope."
0.020085236196938548,2.9857128188712982,1,sr,"Portparol alijanse Mark Lejti izjavio je da je Srbiji i Crnoj Gori mesto unutar Partnerstva za mir i da datum pristupanja zemlje vojno-političkoj organizaciji koja broji 46 članica, i koja predstavlja integralni deo alijanse, zavisi od ispunjenja preostalih uslova."
4.106066126229661,0.10047484859077463,2,es-ES,La San Silvestre de Ontinyent se ha convertido en todo un clásico de los acontecimientos deportivos en la ciudad y son cada vez más los ciudadanos que desean despedir el año con esta carrera popular.
9.755649937902929,-0.001854092559339338,2,es-ES,"«Yo lo conocí por medio de un amigo mío en Valladolid cuando tenía 20 años. Él era un hombre afable y muy sencillo», aseguró Benito Marcos, quien junto con su mujer Socorro San Pedro aplaudieron la decisión del regidor y del equipo de gobierno local de perpetuar el nombre de Miguel Delibes para «que no se pierda y para que los chicos de hoy en día sepan quien fue y reconozcan la labor divulgativa tan importante que hizo de la Castilla profunda», como señaló Eusebio Paniagua Zapatero quien lamentó que «no le dieran el Nobel de Literatura»."
0.22462043081994015,2.383833188576487,1,sr,"Zato verujem da Grčka ima potencijal da se razvije u solidnu i konsolidovanu destinaciju“, rekla je Isabel Garana, regionalna direktorka Svetske turističke organizacije UN u izjavi za SETimes."
4.939161370086189,-0.1211400914112377,2,es-ES,"El partido opositor insistió en que el embajador español en Venezuela debería haber sido llamado a consultas. «Es de libro», afirmó la dirigente popular Ana Pastor. El PP también sostiene que el Gobierno debería haber actuado con más dureza con el representante diplomático bolivariano en Madrid por haber insinuados que los etarras confesaron bajo tortura, aunque después matizase sus palabras."
0.01299385174206025,2.144467967844653,1,sr,"U svom poslednjem obraćanju zakonodavcima pre isteka njegovog mandata, Švarc-Šiling je rekao da je BiH u ozbiljnoj političkoj krizi zbog nenapretka u reformama, sve manjeg poverenja u političare i negativne retorike od strane javnih ličnosti."
4.27516311925333,0.10917389686733127,2,es-ES,"El objetivo de los organizadores consiste en fomentar la vela oceánica, para lo que esta regata se celebrará cada dos años con veleros monocasco de la clase IMOCA Open 60, unas embarcaciones preparadas para navegar en solitario o a dos, aunque en esta prueba cada barco llevará cinco navegantes."
