x1,x2,label,lang,texts
0.2061296340972078,4.189122011910043,1,sr,"Brzina oporavka industrije znači da su “rezerve” rumunske ekonomije još uvek prilično velike i da može da se adekvatno izbori sa šokovima, pod uslovom da je menadžment dobar i da postoji zadovoljavajući transfer novih tehnologija."
0.25148064939039394,1.578573987931252,1,sr,Njegova izjava može se razumeti kao najava da će se protesti širiti kako većina u parlamentu bude odugovlačila sa odgovorom na ponudu socijalista.
1.8058342273001748,-0.05060409166649257,2,es-ES,"Es más, el propio Gobierno Vasco, no tardó en invitar a la Kutxa a sumarse a este nuevo proyecto tras constatar el consenso político que existe hacia esta nueva fórmula."
1.755439617528513,0.23442605935612668,2,es-ES,"Arellano concluye pidiendo al alcalde, Tomás Herrera ,«cordura y atención» a los problemas que generan las obras que se están haciendo en la ciudad."
9.63442120287727,-0.28218323626984615,2,es-ES,"Por ejemplo, para quienes participaron en la supuesta modificación irregular del Plan General se piden siete años de inhabilitación; otros nueve para quienes intervinieron en el proceso de aprobación del estudio de detalle de la unidad 1.34; diez años más a los imputados por la tramitación del proyecto de reparcelación; y nueve meses por la concesión de licencias. Además, quienes aprobaron las licencias de la unidad 1.34 deberán pagar multas de 18.000 euros."
0.12940868371292655,0.9841339012773439,1,sr,"Broj obolelih povećao se za 16 odsto od 2002. do 2006. godine, upozorava ta asocijacija, citirajući istraživanje Odeljenja za dijabetes Opšte bolnice Nikaija u Pireju."
0.0045931943447812115,0.8526484028768763,1,sr,"""Zahvaljujući iskrenoj ljubavi prema ovom sportu i jedinstvu koje negujemo među igračima i upravom, klub će ostati poslednji bastion sportskog ponašanja i čistote u sportu"", rekao je Gajić."
2.3332893795607452,-0.08066551739982955,2,es-ES,Esta ganadería ya sufrió hace dos años la lengua azul y hubo que sacrificar 18 ovejas. Rafael Chico espera que esta vez no sea necesario el sacrificio de los animales.
0.009921815432758408,1.85175218142885,1,sr,"Po svemu sudeći, kratak spoj na električnim instalacijama uzrok je požara u kojem je poginulo pet novorođenčadi, a povređeno još pet, na odeljenju za intenzivnu negu u državnom porodilištu Giulesti."
5.027018200229912,0.38443946254518035,2,es-ES,"El Hyundai ix35 llega al segmento más competido del mercado en su categoría y tendrá duros rivales con los que competirá con excelentes cualidades. Su precio parte desde 22.900 euros en la versión diesel de 136 cv que está por debajo de 150 gr/km de emisiones y, por lo tanto, se puede acoger al Plan 2000E."
10.445973201248828,-0.6366906038178844,2,es-ES,"La Guardia Civil de la Comandancia de Zamora detuvo a siete personas, seis de nacionalidad colombiana y una de nacionalidad española, de edades comprendidas entre los 22 y los 31 años de edad, en el marco de la Operación ‘Encina’, que ha permitido desmantelar una red de tráfico de cocaína que operaba en las comarcas de Benavente, Villalpando y La Bañeza (León)."
0.005203703685704718,0.9188743115520009,1,sr,"Hrvatska ekonomija rasla je brže od proseka rasta u zemljama članicama EU, ali broj ljudi koji žive u siromaštvu ostaje isti, pokazuju vladini podaci."
6.1332484743512445,-0.248017485608289,2,es-ES,"El presupuesto del proyecto Trenta IV es de 208.397 euros, de los que 132.935 son financiados por la Unión Europea y 75.461 por el Ayuntamiento. Los interesados pueden ponerse en contacto con la Agencia de Desarrollo, Villaflorida (calle de Magallanes, número 30) o en el teléfono 942 20 30 30."
0.0664102020587256,1.48344012035107,1,sr,"Stanovnici opštine Dragaš sretni su zbog planova, ali sela Opoje, Ćolopek i Breznes brinu da bi njihove kuće i imanja mogla da budu poplavljena akumuliranjem jezerske vode."
3.8586967310803177,0.14036759818896172,2,es-ES,"AI pidió al gobierno del presidente Felipe Calderón que se establezca un equipo de trabajo de autoridades federales del más alto nivel para coordinar acciones encaminadas a proteger a los migrantes y sancionar a los responsables de los abusos que sufren, como extorsiones, asaltos, secuestros y violación sexual."
7.539451469745841,-0.5346237809177848,2,es-ES,"Además de este homenaje póstumo, el Consejo Social Rural de la Zona Norte reconoció también la labor que el concejal de Melgar de Arriba, presidente de Adri y de Cococea, José Andrés García Moro, ha desarrollado a favor de la Tierra de Campos."
0.006234199878281801,1.179880705672938,1,sr,"«Ozbiljno razmišljamo o razvijanju domaćeg aviosaobraćaja, što vidimo kao mogućnost za podsticanje razvoja ekonomije u ovim delovima zemlje, ne samo poslovnim aktivnostima, nego i kulturnim turizmom», rekao je albanski ministar saobraćaja Spartak Poci."
0.14784998379621325,3.6058197963803065,1,sr,"Pored pozivanja sedam istočnoevropskih zemalja da pristupe alijansi, NATO je takođe usvojio paket mera sa ciljem da se obezbedi da alijansa bude u stanju da adekvatno odgovori na pretnje i bezbednosne izazove 21. veka."
0.25324222321129775,1.9958853259381562,1,sr,"""Između naših naroda postoji prijateljstvo koje se neće okončati, nego će se nastaviti u vremenu i istoriji"", dodao je on, ističući da pola miliona Izraelaca dolazi iz Rumunije."
0.19177428200655997,2.3391852554470587,1,sr,"NATO saveznici odlučni su u nameri da pomognu Bosni i Hercegovini da se i dalje razvija, prosperira i krene ka evroatlantskim standardima"", rekao je jedan analitičar NATO krajem marta."
6.854738805948486,-0.42378506818002176,2,es-ES,"Ahora, el Plan debe ser aprobado inicialmente por la gerencia de Urbanismo, elaborándose posteriormente el informe de la delegación provincial de la Ordenación del Territorio, tras lo que será aprobado definitivamente por el pleno de la Corporación sobre el mes de diciembre."
3.320416711559124,0.27232365867176966,2,es-ES,"La Corte Suprema determinó ayer que sólo habrá un resultado oficial después de que el Alto Tribunal se pronuncie sobre las peticiones presentadas por los opositores de Musharraf, quienes consideran anticonstitucional su candidatura."
0.003863008839479086,0.732232195935055,1,sr,"Pored dela sa životinjama, zoološki vrt nudi i oblasti za rekreaciju -- cvećnjake, prostor za šetnju, jezerca sa pticama i igralište koje uključuje električne vozove i automobile, tobogane, ljuljaške i vrteške."
0.00837111510267541,0.8688400808124228,1,sr,"Banu Guven, televizijska novinarka NTV sa 14 godina iskustva, dala je otkaz ovog meseca zbog nečega što smatra preteranom cenzurom, kao i samocenzurom, u turskim medijima."
0.2195554646944957,3.2348645553414785,1,sr,"«Sve dok Gotovina ne bude pronađen, da li u Hrvatskoj ili izvan nje, i prebačen u Hag, to će značati da su mreže koje štite ratne zločince jače od onog dela vlade koji stvarno želi da u potpunosti sarađuje sa tribunalom», rekla je del Ponte."
2.6712267273027996,-0.040159398474194086,2,es-ES,"Abundó en que el Deportivo consiguió estar en Europa gracias a jugar «muy concentrados y metidos. Ahora no es que tengamos mala actitud, pero hemos dejado de hacer cosas que nos ha dado ese plus», alegó."
5.843007879776869,-0.15238347927618004,2,es-ES,"Acerca de la baja de Palop, el entrenador comentó que el Sevilla es ""un gran equipo"" y que seguro que no tiene tan solo un buen portero, ""sino varios"". Y aprovechó para romper una lanza en favor de los segundos porteros y defender a Pinto. ""Es un jugador reconocido en el vestuario, siempre ha estado a un buen nivel dentro del campo y aporta valores intangibles fuera"", comentó."
0.13037970824208178,1.7686798608997334,1,sr,"Folk pevačica Radmila Manojlović još jednom se dokazala kao veliki profesionalac i pravi kolega. Iako je bila bolesna, ona je došla na promociju novog albuma Dare Bubamare."
0.15663763742914485,4.3355942271750045,1,sr,"""Oni državu neće moći da slome nikada. Imam hrabrosti više nego svi oni zajedno! To se ogleda u ljubavi prema Srbiji, ne mogu da mi zaprete ničim, to može samo da me boli i da mi je teško zbog toga"", rekao je Vučić."
4.196761901731338,0.0043007988956427655,2,es-ES,"La tónica de la primera mitad se rompió pasada la media hora, ya que tras un par de aproximaciones del conjunto manchego, el equipo de Pepe Murcia consiguió marcar."
0.07568118956423947,3.206422210115111,1,sr,"Objašnjavajući razloge pada dinara, NBS je ocenila da su pritiske na slabljenje dinara pokrenule ""loše vesti"" u pogledu stanja u javnim finansijama, kao i neizvesnost u vezi sa dinamikom i dubinom reformi na planu fiskalne konsolidacije, zbog čega je neophodno da vlada u što kraćem roku usvoji konkretne mere u pravcu smanjenja budžetskog deficita."
5.562446914704379,-0.1874335895293157,2,es-ES,"En segundo lugar quedó el Tea Party, el movimiento estadounidense de corte conservador y que tiene entre sus exponentes a la ex candidata a la vicepresidencia Sarah Palin. Terceró quedó Assange, quien sin embargo había sido elegido como persona del año por los lectores de la revista. A este respecto, Stengel ha subrayado que ""Assange ganó nuestro sondeo por un amplio margen, pero, por supuesto, en segundo lugar quedó Lady Gaga. Nosotros tomamos todo eso en cuenta""."
4.17366156642075,0.13198043314547567,2,es-ES,"Para evitar problemas a las embarcaciones por el deshielo de la Antártida, con la presencia hielos flotantes (icebergs) en las zonas del Indico y Pacífico Sur, se han establecido ocho puertas de paso obligatorio (entre las latitudes 46º y 52º Sur) para impedir un descenso que resulte peligroso para las tripulaciones."
0.00972069358430562,1.803669140965388,1,sr,"Pre nego što je odveden u pritvor, Savatijević je već nekoliko meseci bio u kućnom pritvoru na osnovu sumnje za fiktivnu izgradnju zaobilaznica oko Požarevca i Smedereva."
0.1928979263970857,2.8298420487456863,1,sr,Turska se uzdržala od toga da pozove sirijskog predsednika Bašara Al Asada da podnese ostavku i samo je pozvala režim da sprovede reforme i tranziciju u višestranačku demokratiju.
6.194140003168192,-0.06843744410937215,2,es-ES,"En cuanto a Lerma, su ausencia fue de las más destacadas, puesto que es ahora el máximo representante de los socialistas valencianos. El presidente de la gestora no podía acudir porque tenía trabajo en el Senado, aunque desde dentro del partido hay incluso quien dice que no tenía demasiado interés en participar en la campaña."
0.008928153266592636,1.3635849108996798,1,sr,"„Ovaj istorijski predmet pripada Grčkoj i komitet će preduzeti sve neophodne korake da sačuva ovaj komad našeg nacionalnog nasleđa“, dodao je Patulidu."
5.918793030912786,-0.02473303102442989,2,es-ES,"Según recoge Mashable, el dispositivo será presentado esta semana en el CES de Las Vegas y por el momento no tiene nombre. Aún no está listo para ser fabricado, a la espera de la nueva versión de Android, 'Honeycomb', que se cree que estára optimizada para este tipo de dispositivos."
5.438494361611319,0.06402876122776124,2,es-ES,"«El objetivo es crear un edificio con una imagen fuerte, potente, pero que no se convierta en un objeto de lujo. Al contrario, en el proyecto queremos trasladar la idea de industria creadora de cultura, por eso queremos que también sea un espacio muy funcional, porque allí van a trabajar 150 personas», aclara la arquitecta malagueña."
2.4151519256330904,0.213491095423165,2,es-ES,"El secretario de Coordinación del PSRM, Francisco Javier Oñate, reprochó a Sánchez que «las verdades a medias que utiliza son las peores y más grandes mentiras que se pueden decir, y él lo sabe»."
0.009305421908052211,1.7440063793964922,1,sr,Portparol EU optužio je vladu za samovoljno odustajanje od propisa koje je zemlja usvojila u okviru svog procesa integracije u EU.
0.06173404023706981,0.9742790699843649,1,sr,"Projektom su obezbeđeni pomoć u iznosu od 4,4 miliona evra za zaštitu reke Neretve i kredit u iznosu od 1,8 miliona evra za sprovođenje programa odlaganja čvrstog otpada."
0.17901147774753567,0.5668797826805282,1,sr,"Sada kada su izbori završeni, vlada se suočava sa nizom izazova u pregrejanoj turskoj ekonomiji, uključujući porast deficita tekućih transakcija, inflacije i visoku stopu nezaposlenosti."
7.7106510745860986,-0.11206118335895777,2,es-ES,"Esa línea de prioridades pasa, según el Gabinete de Zapatero, por involucrar en la misión a los agentes sociales y a ministerios como Educación, Trabajo o Ciencia y Tecnología. Como apuntó Rubalcaba, el Gobierno quiere abordar también reformas educativas «porque un euro en educación son puntos de PIB en el futuro». Como también se presenta esencial la innovación y la colaboración entre universidad y empresa ya que, añadió, «no podemos tener el mismo sistema de ciencia y tecnología de hace 15 o 20 años»."
8.113399389019365,0.4195447771611102,2,es-ES,"Sus fotografías más recientes fueron realizadas en un antiguo sanatorio para tuberculosos situado en un bosque de pinos en las afueras de Berlín (Alemania). Las razones de su elección son numerosas. Ante todo, Carrasco explica que a partir del norte de Francia se aprecia un respeto por las ruinas difícil de encontrar al sur de Europa. «Son mansiones, castillos, hospitales, que se convierten en sitios conmovedores en los que parece haberse detenido el tiempo», dice."
0.13070122837049358,1.052219457712997,1,sr,U sklopu svog ekonomskog programa makedonska vlada se priprema da pusti u opticaj svoje prve državne evrobondove u ukupnom iznosu od 150 miliona evra.
8.341329384258238,0.23659076341327023,2,es-ES,"La misma empresa demoscópica había informado en mayo de que Rousseff estaba apenas dos puntos por encima de Serra, un porcentaje que coincidía con el margen de error de la investigación. Por lo tanto, se los consideraba empatados. Ahora, la candidata le saca diez de ventaja a su oponente antes de que la campaña se instale en televisión."
9.620574601557168,-0.09348453416822507,2,es-ES,"Aunque no hay estadísticas oficiales, más de 125 personas pierden la vida cada año como consecuencia de estos accidentes domésticos y miles resultan envenenadas. El malogrado Ataúlfo Argenta, pianista y director de orquesta nacido en Castro Urdiales en 1913, falleció hace cincuenta años cuando se encontraba en su coche dentro del garaje. Fue una tragedia nacional. En España, es la segunda causa de muerte por intoxicación, por detrás del abuso de drogas. En Estados Unidos, sin embargo, la inhalación de monóxido de carbono ha desbancado a las sobredosis como motivo más frecuente de fallecimiento por tóxicos."
12.700489683930435,-0.33898481271389874,2,es-ES,"El pequeño Ibai, vecino de la localidad bilbaína de Zaratamo, tuvo la fortuna de encontrar un donante de características similares el 28 de diciembre, Día de los Inocentes, como recordó su padre visiblemente emocionado. Tras la extracción de los órganos del niño fallecido, que pesaba 16 kilos, comenzó la intervención en La Paz a las 23,30 horas de ese mismo día y, transcurridas poco más de seis, el equipo de Santamaría había consiguió salvar la vida al enfermo, que se encuentra aislado en la UCI, con ventilación mecánica y bajo pronóstico reservado."
0.07147349479774424,1.5584505027856885,1,sr,"U 2005. godini prihodi u EU10 porasli su sa 44 procenta od proseka EU15 u 1997. godini na 50 procenata, ali je stopa nezaposlenosti od 13,4 procenta u novim zemljama članicama EU još uvek 5,5 odsto veća od one u starim članicama Unije."
7.094557297428481,0.10814405032197444,2,es-ES,"En este sentido, González lamentó que la mejora del servicio para los viajeros que toman el tren en Málaga y la optimización de la jornada laboral que persigue este cambio perjudique a los que parten desde Antequera, que ya no contarán con ese servicio tan temprano sino que se verán obligados a tomar el de las 9,30 horas, que llega a Madrid a las doce del mediodía."
0.011921586378608398,1.9628466794936255,1,sr,"Posle dva kruga neuspelih izbora, jedino izvesno je to da je predsednica srpskog parlamenta, Nataša Mičić, postala vršilac dužnosti srpskog predsednika i prva žena šef države u istoriji Srbije."
9.323713472172795,0.034077343509566524,2,es-ES,"El gerente de la Compañía Española de Petróleos S.A. (CEPSA) en Panamá recibió al menos un balazo por parte de dos individuos que se dieron a la fuga en el automóvil del empresario español, según testigos oculares. La Policía panameña investiga el móvil del asesinato, que podría tratarse de un hecho de violencia común. Según los testigos, un automóvil interceptó a Machín cuando iba a abordar su propio vehículo todoterreno, con el que los agresores huyeron tras dejarlo herido en la calle."
0.6534933299722151,6.25404836255104,1,sr,"""Što se mene tiče, neće da bude zaštićen niko. Nema nijednog klana koji može da bude jači od države i mi smo tu da to odradimo do kraja, tako da ko god se kako zvao, nije ni bitno, ako je u delu, biće procesuiran, tako da, apsolutno, znači, radiće se sve, ispitaće se sve, proveravaće se sve"", objasnio je Grekulović."
0.004791741941737757,0.8677338647291601,1,sr,"Pojedinačne reakcije na bezbednosne pretnje biće puno skuplje u ovo vreme ekonomske krize, rekla je državna sekretarka Mınistarstva odbrane Srbije Tanja Miščević. [Nikola Barbutov/SETimes]"
9.308596362100133,-0.1800522809014588,2,es-ES,"El órgano de la parroquia Santa María ha vuelto a sonar en 2010. Tras más de dos años de arduo y exigente trabajo, coordinado por el experto francés Denis Lacorre, el magnífico instrumento original de 1885 acaba de 'inaugurarse'. Atrás ha quedado una reforma que ha costado 420.000 euros, y que ha sido sufragada por la Diputación al 50%, por la Kutxa y el Ayuntamiento en un 25%, mientras que el 25% restante se ha ido cubriendo con aportaciones de particulares."
0.07310932385366353,2.4157647501187616,1,sr,"Znam da će ti ljudi postići mnogo u oblastima za koje su stručni, ali mislim da oni svi jednostavno žele da odu u inostranstvo i tamo dobiju bolje uslove."
8.04411312736625,0.17277878118089404,2,es-ES,"Coma supo gestionar su ventaja en los más de 2.000 kilómetros de los que se compone el rally, 1.245 de ellos cronometrados por las dunas del duro desierto de los Emiratos Árabes, para conseguir el triunfo en un escenario en el que ya subió a lo más alto del podio el año pasado, además de en 2006 y en 2007."
0.13653002107535314,2.387498317354595,1,sr,"Vekarić je rekao da će od sredine januara početi da se sprovodi Zakonik o krivičnom postupku, koji u velikoj meri olakšava istražni postupak."
10.53909906833479,-0.3071460509335719,2,es-ES,"El pasado octubre, la chica desapareció, según consta en la denuncia presentada por su madre en la comisaría del distrito de Chamartín. Era la 14ª denuncia que cursaba por el mismo motivo en el último año. Dos meses después fue rescatada en Arroyo de San Serván, un municipio de 4.300 habitantes situado a una veintena de kilómetros de Mérida. Estaba en una casa a la que había sido trasladada por un novio rumano de 22 años, al que conoció en Madrid."
0.18200552001954662,1.1116889551912155,1,sr,Sejdiu je u Prištini odlikovao Mesića Zlatnom medaljom nezavisnosti koja se dodeljuje osobama koje su dale poseban doprinos slobodi i nezavisnosti Kosova.
0.0714561359332799,2.4019859134761288,1,sr,"On je međutim upozorio da, uprkos očiglednom napretku zemlje, nema mesta za samozadovoljstvo, s obzirom da su sve članice EU, uključujući Bugarsku i Rumuniju, i dalje ispred Hrvatske."
6.09718912976099,-0.38080962303780513,2,es-ES,Esta actividad está organizada por el departamento de Promoción Lingüística de la Universidad de Valencia y la Universidad Politécnica de Valencia con el objetivo de acercar a los universitarios el cine en la lengua autóctona.
5.214628988008098,0.10720864820025787,2,es-ES,"Con Triángulo de Amor Bizarro nos pasó como con esas películas que todo el mundo te pone por las nubes y llegas al cine con las expectativas tan altas que sales un poco chafado. Oscuros e intensos, su efectiva mezcla de My Bloody Valentine, New Order y los Sonic Youth menos snobs tuvo momentos mágicos. Echamos de menos esa otra propuesta suya ramoniana, la de no parar entre canciones, para otorgarle más estrellas a su crítica."
8.064731542519883,-0.5225711036728691,2,es-ES,"Desde la formación de izquierdas recuerdan que el pasado mes de febrero la Consellería de Medio Ambiente sometió a información pública la autorización ambiental integrada (AAI) solicitada por INUSA para ampliar la planta de residuos de Fontcalent con un nuevo vaso de vertido con capacidad para 1,8 millones de toneladas de basuras."
0.18850843056009212,1.7190578634298248,1,sr,"Tokom prošlonedeljne važne posete Atini komandanta turske obalne straže, admirala Kana Erenoglua, Atina i Ankara dogovorile su se da pokrenu nove mehanizme komunikacije između njihovih obalnih straža, u pokušaju da zaustave ilegalnu imigraciju koja pogađa obe zemlje."
0.011499721702469996,1.8826769991159307,1,sr,Mađarski predsednik Laslo Šoljom obećao je podršku integraciji Makedonije u EU i NATO i rekao da njegova zemlja ne bi dozvolila nametanje dodatnih uslova za proces liberalizacije viznog režima sa EU.
0.24626292542802228,0.8089832883430197,1,sr,"""Za stvaranje klime trajnog mira, stabilnosti i dobrosusedskih odnosa, mora se razviti zajednička vizija prema kojoj naše zemlje mogu živeti u miroljubivoj koegzistenciji i harmoniji"", navodi se u deklaraciji."
5.2115525981778035,-0.35206778596029736,2,es-ES,"La regata está organizada por el Área de Turismo y Deporte del Ayuntamiento y la Obra Social de Unicaja, con la organización técnica de Cobarja. Colaboran la Federación Andaluza de Remo y Vela, el Club Mediterráneo y Cruz Roja."
6.691039320373802,-0.3403505884925235,2,es-ES,"Pedro Martínez Victorio, responsable de los servicios médicos del Efesé, dice que la reconstruccion de los ligamentos del tobillo derecho, dañados tras la entrada de Verdú, y la fijación de la fractura del hueso le ha dejado «muy buenas sensaciones». La intervención quirúrgica fue un éxito. A Jordi Pablo le operó en Valencia el doctor del Villarreal CF, Enrique Gastaldi."
5.570517635308845,-0.3461636582934267,2,es-ES,"Por tanto a partir de la próxima semana, coincidiendo con el comienzo del mes de julio, serán muchas las tiendas que luzcan pegatinas y carteles de la campaña de abonos 2009/10 de la Balona."
8.56711607756427,-0.2741280302394733,2,es-ES,"Según explicó la Comisaría de La Línea de la Concepción (Cádiz), la operación arrancó tras tener conocimiento de que un individuo de la localidad al que apodaban 'el Ballenato' se estaba dedicando a la venta de cocaína en la vía pública y en establecimientos de ocio."
0.008879543908370246,0.41002997990088025,1,sr,Grčki premijer Kostas Simitis će predsedavati u petak (20. juna) jednim od najvažnijih evropskih samita još od potpisivanja sporazuma u Mastrihtu 1992. godine.
3.811538888608617,0.3044756721475737,2,es-ES,"El tanto visitante abrió heridas recientes, pero los futbolistas blanquiazules se resistieron a dejar el terreno de juego de esa manera. Tres minutos más tarde, casi al límite del descanso, lograron igualar. Envió José Luis un centro al área y Kijera, en una acción poco afortunada, marcó en su portería. No era el gol soñado, pero sirvió igualmente para hacer justicia."
0.06954330480373347,2.3531810159475137,1,sr,"Vladajući Savez nezavisnih socijaldemokrata (SNSD) odlučio je da predloži člana srpske opozicione stranke za mesto u tročlanom predsedništvu parlamenta -- što je korak kojim su Hrvati, kako kažu, isključeni."
4.225576026540767,-0.1969084548146772,2,es-ES,"Gasol ha pulverizado todos las marcas de galardones individuales esta temporada. Ha sido el jugador más valorado (11 MVP), el máximo reboteador y el líder en porcentaje de tiros de 2 puntos, el que más faltas recibe y más minutos disputa por encuentro."
4.41786576437583,0.2237728147690293,2,es-ES,"Por otra parte, y centrándose en el aspecto deportivo ha asegurado que está viendo al equipo “genial, en una dinámica positiva. Estamos empalmando triunfos con empates fuera de casa y eso hace que en estos momentos estemos cuartos con toda la ilusión del mundo”. En lo personal, también ha confirmado se siente “bien y fuerte. He estado jugando estos tres partidos, no en mi posición, pero aquí he venido a ayudar al equipo”."
0.025402389275770678,3.4008179432195957,1,sr,Policijski general Mladen Kuribak rekao je beogradskom dnevniku Press da je policija proglasila rat huliganima i da pravi bazu podataka o osobama umešanim u nerede na sportskim događajima. „Od 5. maja počeli smo da evidentiramo ekstremne navijače.
0.011262184813496,2.152948588764844,1,sr,"Savet EU za ekonomske i finansijske poslove odobrio je u utorak (5. maja) paket pomoći za Rumuniju u iznosu 5 milijardi evra za podršku u prevazilaženju efekata ""oštrog pada priliva kapitala koji je rezultat međunarodne finansijske krize""."
0.3798130243305189,2.487539612585705,1,sr,"Svim izbeglicama i raseljenim licima koja žele da se vrate na Kosovo mora se omogućiti da to učine bezbedno i dostojanstveno», navodi se u Planu implementacije standarda za Kosovo objavljenom 31. marta 2004."
0.0052694549849454046,0.9462811433819492,1,sr,"Prvu posetu inostranstvu od kada je počeo drugi mandat Buš će okončati u četvrtak u Bratislavi, susretom sa ruskim predsednikom Vladimirom Putinom."
