x1,x2,label,lang,texts
5.864962355617659,-0.011311818083847885,2,es-ES,"A los mandos del Fórmula BMW 06 International, Aarón no defraudó y Drivex decidió que en 2010 sería su piloto en la clase Copa, donde compiten pilotos que no tienen recursos económicos y que son menores de 18 años. Corren con el resto que luchan por el European F3 Open, aunque con coches muy inferiores a los de ellos. De hecho durante años está categoría fue denominada Junior."
7.600742050292775,-0.11770662258522181,2,es-ES,"El hallazgo se produjo sobre las seis y media de la tarde en un arroyo situado en el paraje de Venta Baja, dentro del término municipal de la mencionada localidad axárquica. Los obreros estaban trabajando en la limpieza del cauce cuando descubrieron lo que parecía ser parte de la pierna de una persona."
0.45247077863930396,5.153654085186552,1,sr,"„Bukurešt je u poslednje vreme bio vrlo nestrpljiv da se reši MCV-a, ali poslednji izveštaj EK o pravosuđu pokazuje da su izgledi da se dođe do te tačke mali, s obzirom da se u dokumentu dosta kritikuje učinak Rumunije na polju pravosuđa“, izjavio je za SETimes urednik pravosudne rubrike u listu Romania libera Kristijan Kuperka."
6.280567321927085,-0.2824832487820155,2,es-ES,"La red captaba a sus víctimas en Brasil y les facilitaba el billete de avión a España, que era comprado con tarjetas 'clonadas'. Una vez en el país, el líder de la trama, con residencia en Palma de Mallorca, les distribuía por las diferentes casas de citas ubicadas en Palma, Madrid, Barcelona, Alicante y León."
9.093481160798715,-0.14376205066258696,2,es-ES,"El técnico del Algeciras, Pablo Sánchez, quería ver el empate desde el lado positivo «en lugar de haber perdido puntos hay que sentir que se han ganado dos», asegurando que «fue peor la sensación de la pasada jornada, frente al Sanluqueño, sobre todo por el penalti que fallamos en el último instante». Si Sanchez calificó de anécdota el hecho de estar de líder, tampoco le importa mucho haber perdido esta privilegiada situación. «Lo importante es seguir sumando hasta conseguir los puntos necesarios para la salvación, después podremos ver otras cosas», indicó."
0.007690302028370098,1.417236454581232,1,sr,Prema izvorima Oslobođenja nekoliko automobila ukradenih u Bosni i Hercegovini (BiH) pronađeno je kasnije sa novim registarskim tablicima koje je izdala policija u Crnoj Gori.
0.1267526051952566,1.1705847056285983,1,sr,"Prema mišljenju Beograda, bezbednosna situacija na Kosovu još uvek je loša, a etničke manjine -- posebno Srbi -- suočavaju se sa rizicima."
3.7262857674185335,0.20323263784397497,2,es-ES,"Por otra parte, el Papa denunció ayer que en la sociedad actual el matrimonio aparece como un «contrato temporal que se puede romper» y defendió que el matrimonio es entre un hombre y una mujer y que el verdadero amor es «fiel»."
0.009460836103175206,1.5212363290644015,1,sr,"Prosečna plata iznosi 290 evra mesečno. Poređenja radi, u Srbiji je prosečna plata 330 evra, 380 evra je u Albaniji i Makedoniji, 390 evra u Bugarskoj, 450 evra u Bosni i Hercegovini, 480 evra u Rumuniji, 530 evra u Crnoj Gori i 800 evra u Hrvatskoj."
0.012929500324787936,2.1706986303159304,1,sr,"""Učinićemo sve što je potrebno da sprovedemo reforme i steknemo članstvo [u EU]"", rekao je Mesić posle sastanka sa svojim nemačkim kolegom."
0.1182923129658407,1.0578288377007097,1,sr,Druge hrvatske firme -- kao što su proizvođač prehrambenih proizvoda Podravka i farmaceutska kompanija Pliva -- takođe su želele da iskoriste veliku prepoznatljivost svoje robe među potrošačima u drugim oblastima bivše Jugoslavije.
3.113482452020219,0.10731960353175143,2,es-ES,"El presidente del Congreso de los Diputados, José Bono, ha destacado que ""contra ETA, lo mejor es Rubalcaba y Guardia Civil, mucha Guardia Civil y mucha Policía"". ""Eso es lo que necesitan y cuando estén con los brazos en alto y pidan rendición, entonces ya negociaremos en qué cárcel van a cumplir su pena"", ha remarcado"
5.680679668746107,-0.02794349790160065,2,es-ES,"«Tratamos de limitar la información para proteger a los niños», afirmó el fiscal luego de indicar que los presuntos hijos incestuosos tienen 19, 17, 16, 12, 11, 6 y 2 años de edad. «El acusado se abstuvo de declarar», quedó arrestado en un centro transitorio de detención y mañana será enviado a una cárcel provincial, apuntó."
0.13625115257753942,2.3244110262564415,1,sr,"U izveštaju EK navodi se da je Hrvatska znatno napredovala na mnogim poljima, uključujući vladavinu zakona, ali da joj ostaje još posla."
0.06240600536343431,1.263886765510386,1,sr,"Program obnove i oporavka za period 1999-2003, koji su donatori prihvatili na prvoj konferenciji o Kosovu ušao je sada u treću godinu implementacije."
9.402730066390273,-0.21470010145041893,2,es-ES,"«Esperando verte» es el título del nuevo trabajo que la cantante gaditana Niña Pastori escenificará en el Colón el 27 de febrero, un día después de la representación de la obra «7 contos capitais», una serie de historias en las que la avaricia, lujuria, pereza, envidia, gula, soberbia o ira de los personajes se van entrelazando ofreciendo una visión satírica y grotesca de éstos y con la que reflexiona sobre las miserias y debilidades humanas."
3.05909498446532,-0.012062697778672058,2,es-ES,"Por otro lado, la primera plantilla al completo ha sacado su abono para esta temporada y ha contribuido de esta manera a aumentar la cifra de seguidores murcianistas, que ronda los ocho mil."
4.2067594294835065,0.09386544942504092,2,es-ES,"Méndez ha abundado en que el citado plan ""es una pescadilla que se muerde la cola"" al no responder a la vía que tiene mayor eficacia redistributiva para disminuir el gasto, como es la subida de impuestos."
0.011448142747766465,1.839533019593033,1,sr,Tokom razgovora bilo je jasno da saradnja sa Međunarodnim krivičnim sudom za bivšu Jugoslaviju (MKSJ) ostaje najozbiljnije pitanje koje utiče na odnose između Srbije i međunarodne zajednice.
0.12337045310253236,2.0400037184484927,1,sr,"Oni [mogu] da smatraju Kosovo delom Srbije, ali administrativne granice koje su postojale ranije i sada uglavnom su ispravne sa obe strane“, izjavio je Redžepi za SETimes."
4.7025556843530625,0.004998427931501553,2,es-ES,"La verdadera novedad estriba en la presentación por parte de la firma murciana de este café ecológico en monodosis, ya que hasta el momento se comercializaban monodosis de café descafeinado y café no ecológico."
0.07056384832514676,2.192279830988355,1,sr,"Smatrali su da bi im to omogućilo da sruše vlast i zamene je ljudima lojalnim Miloševiću, koji bi sprečili dalja izručenja Hagu."
0.06426952388111008,1.3066390419056972,1,sr,"Na glasanje za Evropski parlament u junu, što su bili poslednji izbori organizovani u Rumuniji, izašlo je samo 27 odsto birača."
5.856535552778507,0.3056202326831704,2,es-ES,"Aunque comenzó hablando se esas dos muertes que le golpearon, 'Azul serenidad' se fue ""abriendo"" a todos las personas que ya no están junto a él en el proceso de escritura y es también una reivindicación de la ""ejemplaridad"" de los seres queridos en una sociedad ""fascinante"" donde ""todos las injusticias son posibles"" y que ofrece pocos ejemplos en la vida pública."
0.0011554922363390995,0.19380679965154962,1,sr,"S&P ostaje oprezna zbog fiskalne politike nove vlade. Nova vlada još uvek nema program smanjenja inflacije, što dovodi do daljeg porasta efektivne kursne liste."
1.5503467867688907,0.21703657201551427,2,es-ES,"""Si se cometieron hechos execrables los condeno, pero no fueron orden de quien habla. Yo por eso señor presidente, ¡rechazo los cargos totalmente! ¡Soy inocente! y no acepto esta acusación fiscal"", ha declarado Fujimori, dirigiéndose al juez."
3.6886089638585897,-0.167049575417984,2,es-ES,"Dentro de las simulaciones de delito las más frecuentes son las relacionadas con telefonía móvil, aparatos como viodeoconsolas portátiles y tarjetas de crédito cuyo contrato generalmente conlleva un seguro que no cubre la pérdida pero sí el robo con violencia o intimidación."
7.371101420533227,0.4342518956965603,2,es-ES,"Los peores pronósticos se confirman. En plena crisis económica, con los ingresos familiares seriamente tocados, el recibo de la luz se puede encarecer entre el 4% y el 5% el próximo 1 de julio para los 27 millones de hogares, comercios y pequeñas empresas a quienes todavía se aplica la 'Tarifa de Último Recurso' (TUR) por el suministro eléctrico. En enero, la factura ya registró un incremento del 2,6%."
8.788741096429606,0.1167607729014388,2,es-ES,"Los dos viajaron anoche de vuelta a Madrid en una avioneta que fletó Repsol para recogerles. Les acompañaba un hermano de Alejandro. Otros 17 españoles sorprendidos en Bombay por la cadena de atentados tenían previsto viajar anoche en un avión fletado por la presidencia francesa de la UE, que les llevará a París y de allí a Madrid. ""Nos han tratado como a ciudadanos de segunda clase"", se quejaba Elsa Miguel, una turista de 50 años, cuyo hotel se encontraba enfrente del Taj Mahal, principal foco del ataque."
8.633714215026934,-0.0686402837995377,2,es-ES,"Por fortuna, lo habitual es que no te atragantes. Ni siquiera con el vestuario de los presentadores. Ya sea un trikini o la inefable capa de ‘Ramontxu’, una feliz idea del estilista de TVE. «Si se le llega a ocurrir ponerme un austriaco, ¡hago famoso el austriaco!», asegura divertido. La prenda cayó en gracia y el primero en celebrarlo fue el propio interesado. Este periodista socarrón es un animal de costumbres y le gustan las cosas atadas y bien atadas. «¿Que si cometí errores? Hombre, quizás alguno de dicción....», reconoce tras hacer un poquito de memoria ."
0.06691880966953725,1.8431669173725895,1,sr,"Račanova smrt predstavljala je šok za njegovu stranku i njene pristalice, koje su stajale u redu ispred sedišta SDP-a da polože cveće ili zapale sveću u znak sećanja na njega."
0.19516372987976438,2.800687013953369,1,sr,"Učenici su protestovali 42 dana, odbijajući da prisustvuju časovima, jer je Ministarstvo obrazovanja i nauke poništilo odluku lokalnog odbora za obrazovanje od jula da se Đurišiću poveri još jedan jednogodišnji mandat na mestu direktora."
0.13550798385142768,2.379321172865372,1,sr,"Agron je radio kao učitelj pre nego što se zaposlio kao inženjer u privatnoj firmi, ali je izgubio posao 2006. kada je firma propala."
0.12376461642953007,0.5580041610108946,1,sr,"Prizrenci preporučuju lokal koji se nalazi preko puta jednog od dva najveća mosta, u kome služe vrući i ukusni burek sa mesom, kupusom ili sirom."
0.17677621355639145,9.565463208299546,1,sr,"Jelko Kacin, izvestilac Evropskog parlamenta za Srbiju, rekao je da Brisel zanima da li će izbori koje je Beograd raspisao za teritoriju Kosova biti i održani. On je u izjavi je za Radio Slobodna Evropa naveo da je „sve dok se izbori na Kosovu ne budu održavali, neće biti razloga da sumnjamo u posvećenost Srbije svom putu ka EU. „Srbija će delima u roku od dva meseca pokazati koliko je posvećena traženju datuma za početak pregovora za svoj put ka i u EU“, rekao je Kacin."
5.713980599376179,0.18966855044559683,2,es-ES,"Pero esta situación ha durado poco, dado que, de inmediato, el granadino Francisco José Martínez ha ahondado en el desconcierto en las proximidades de Zaratán con un ataque solitario. Ha intentado aprovecharse de los pronunciados toboganes para tomar ventaja, pero Alejandro Valverde no ha dado tregua y ha anulado junto a su equipo la escapada. Todo se ha decidido en la última subida."
0.1361480674105422,2.6151180137873395,1,sr,Predsednik i osnivač MediaSinda Kristi Godinac govorio je za SETimes o izazovima koje je donela ekonomska kriza i kako će njegova organizacija sa njima da se uhvati u koštac.
0.038162998159698466,4.187077131463943,1,sr,"On je Sarajlije digao na noge. Bukvalno. Blizu 15.000 njegovih fanova došlo je na koncert koji je pre dve večeri priredio u dvorani Zetra. Aco je bio prezadovoljan odzivom publike, a bilo je primetno da ga lome emocije."
5.731982178994768,0.09190422736978872,2,es-ES,"Esto dependerá por completo del documento que debe presentar el Valencia, según indicaron fuentes conocedoras de la reunión con Alarte. Lo que está claro es el deseo del PSPV de que no se asocie al partido con cierto sentimiento antivalencianista, lo que no ha quedado claro del todo a pesar de los intentos reiterados del grupo municipal."
8.978721751338426,0.008709021101468104,2,es-ES,"Fue en el mes de mayo, cuando los cicloturistas mendarotarras se desplazaron hasta Asturias para tomar parte en la Clásica de los Lagos de Enol. Un mes más tarde, a finales de junio, se realizó la excursión a Jaca, en donde recorrieron íntegramente la ruta de la archifamosa prueba cicloturista Quebrantahuesos. En esta prueba ningún cicloturista de Mendaro tuvo la oportunidad de participar."
0.13068982572839102,1.557571686072693,1,sr,"Odeljenje koje se unutar Državnog suda BiH bavi pitanjima organizovanog kriminala, ekonomskog kriminala i korupcije, počelo je velikom brzinom da pokreće postupke u slučajevima trgovine ljudima, bankarskih prevara i slučajevima sumnjivog političkog uticaja."
0.15843567047347762,2.741823786519645,1,sr,"Glavni tužilac Haškog suda Karla del Ponte isticala je da je Mladić, koji je u bekstvu od 1996, pronašao utočište u Srbiji, ali zvaničnici u Beogradu i dalje to poriču."
0.034542714041548656,4.792792772243718,1,sr,"Istraživanje pokazuje da šest od deset osoba veruje da je potrebno više verskih činjenica nego nauke, 61 odsto smatra da je nošenje kupaćeg kostima greh, a skoro polovina ispitanika (44 odsto) misli da restorani treba da budu zatvoreni tokom perioda posta za vreme Ramazana."
0.23467315470913747,0.6149792265897938,1,sr,"Neprestano su zajedno, ljubakaju se, a Dan zaljubljenih Ružica ga nije puštala iz sobe pa su u stilu Džona Lenona i Joko Ono proveli u krevetu."
6.823444702220584,-0.10015284800801505,2,es-ES,"2. En mi vida personal y profesional estoy dando testimonio de mi rechazo a la guerra contra Irak, a través de ser portador de una etiqueta con la inscripción «no a la guerra» y sumándome a escritos y manifestaciones públicas. No acepto esta guerra y sus consecuencias sobre seres humanos inocentes, esté o no «legitimada» por la ONU. Y me temo que esa «legitimación» no estará, si se produce, exenta de hipocresía. Por encima de todo yo digo «no a la guerra»."
3.947828534588379,0.09745737206635494,2,es-ES,"Un dato para el optimismo. España es el quinto país de la Unión Europea con menor índice de delincuencia, con 60 robos por cada 1.000 habitantes, si bien en la provincia este dato se supera en unas décimas."
6.723388646521194,-0.2804006391305833,2,es-ES,"El PSC ""sale"" a esas elecciones con la vocación de liderar un proyecto progresista y con la ""conciencia tranquila"" de que el Gobierno central ha sido el que ""más ha cumplido con Cataluña, el que más inversiones ha puesto encima de la mesa y el que mejor ha entendido a los ciudadanos catalanes""."
5.7168026424182814e-05,0.012100956269963327,1,sr,"""Rano učešće međunarodnih finansijskih institucija pružiće podršku Nabuku u ispunjavanju najviših standarda u proceni ekološkog i socijalnog rizika i u nabavkama""."
0.13231860865245143,3.731281767053879,1,sr,"Čak i pre sankcija, „Iran je već razvio mrežu za proliferaciju ... a do pravog razvoja je došlo kada su Sjedinjene Države uspele da dobiju podršku zemalja oko Irana, kao što su Ujedinjeni Arapski Emirati i Turska, za sprovođenje tih sankcija”, kaže za SETimes Gaukar Muhačanova, istraživač saradnik i specijalista za Iran u Centru za studije neproliferacije."
0.005737801943790414,1.0991001081683276,1,sr,Politička natezanja i dalje blokiraju usvajanje novog Ustava Srbije -- što je ključni uslov za potpisivanje Sporazuma o stabilizaciji i pridruživanju sa EU.
2.0611219698163716,0.07348696362637076,2,es-ES,"El auditorio tendrá una plantilla aproximada de 56 empleados, entre fijos y eventuales y algunos servicios, como limpieza o seguridad, podrían ser subcontratados. Algunas empresas ya han mostrado su interés en participar en el concurso."
2.881433578190551,0.6690528883655101,2,es-ES,"Un festival literario y multicultural que este año se desarrollará con menos presupuesto y con los autores del cono sur empujando a los nórdicos, tan de moda en los últimos tiempos. Como advirtió su director, Paco Ignacio Taibo, se trata del único certamen literario del verano «sin escritores nórdicos ni vampiros enamorados»."
8.013547359559352,-0.35976301548189177,2,es-ES,"Los decretos del Gobierno valenciano recuerdan que la ley de Presupuestos de la Generalitat para el ejercicio 2010 establece que la Generalitat podrá prestar avales durante ese ejercicio para las operaciones de crédito que concierten las entidades o empresas públicas hasta un límite de 650 millones de euros, y que los avales autorizados en estos decretos están dentro de ese límite."
8.524699518335963,-0.3355870637379099,2,es-ES,"A la Academia de Ciencias pertenecen algunos de los mejores científicos de la Región. Su misión es promover la ciencia y la tecnología mediante actividades variadas. Desde la organización de conferencias y seminarios, a la convocatoria de premios para fomentar las vocaciones científicas en los jóvenes estudiantes. En otras actividades, somos un complemento, ayudando a las Olimpiadas científicas y en aquellas iniciativas que acercan la ciencia a la sociedad."
0.9030562802517191,0.011032069134409486,2,es-ES,"Por grupos, los más inflacionistas fueron Ocio y cultura (1,6 por ciento), Alimentos y bebidas no alcohólicas (0,5 por ciento), Hoteles, cafés y restaurantes (0,4 por ciento), Otros (0,3 por ciento) y Medicina (0,1 por ciento)."
7.373572676394795,0.6765508028858433,2,es-ES,"Así, aclaró a los vecinos afectados que la única vía legal para tramitar la documentación es a través de la Junta, denunciando además que de las solicitudes que se han tramitado a través del Ayuntamiento «en Obras Públicas no saben nada. No tenemos constancia ni de donde se encuentran, por lo que se demuestra que su interés no es que el vecino acceda a la vivienda»."
5.773554564937011,-0.14534735993302345,2,es-ES,"Preguntado sobre si ve al Valencia como alternativa al Real Madrid y al Barcelona, Emery ha respondido que ""lo hay que hacer es pensar en lo que nosotros seamos capaces de hacer y en los objetivos a corto plazo. El Madrid y el Barcelona siguen llevando un nivel muy alto de puntos, pero nosotros en otras temporadas con estos puntos podríamos estar en el liderato o cerca de él""."
0.20238266191271187,1.996332753462346,1,sr,"""Državnih para nema na pretek i treba ih koristiti samo za finansiranje istraživanja kada se steknu uslovi da ta istraživanja urode plodom"", naglasio je glavni autor studije Jicak Goldberg. [Svetska banka]"
2.7036572750898813,0.39737048771286043,2,es-ES,"Un mes después, esta misma persona llamó a la sala del 091 para informar que había localizado su coche en un aparcamiento público, hecho que fue comprobado por una dotación policial que se desplazó hasta el estacionamiento."
0.014132205599871626,2.6804951113556204,1,sr,"""To je Nejmarova zasluga. On je veoma posvećen učenik. Imali smo malo vremena, ali on je imao veoma dobar izgovor reči. Učinio je to veoma dobro""."
6.34169484522357,0.40353339260331395,2,es-ES,"Las acciones de Apple subieron 2,76% en las operaciones electrónicas que se realizaron después del cierre del mercado, lo que se suma al avance del 2,57% que ya registraron durante la sesión regular de ayer. En lo que va de año estas acciones han subido 19,53%, con lo que acumulan un incremento del 64,73% en los últimos doce meses."
3.444307378322833,-0.10536040179089913,2,es-ES,"Los tonos rojos y los corazones inundan ya los escaparates de una capital que responde al eslogan de ""ciudad del amor"", a la que viajan muchas parejas en estas fechas."
0.019212182787495796,2.85040214022935,1,sr,"""Nije bilo svežine, zbog toga je i pala koncentracija u jednom trenutku. Očekivao sam da će posle jakih treninga doći do toga. Igrači imaju slobodno posle podne i verujem da ćemo od sutra biti osveženi"", kazao je selektor Dejan Savić."
0.012983090057371164,1.7980996965735785,1,sr,"„Imam troje unučadi i kada porastu, želim da o problemima Srbije i Kosova uče samo iz istorije, da žive bezbedno kao i njihovi vršnjaci u Evropi, bez straha od sukoba i rata“, kaže penzionisani profesor Gordan Đurđević za SETimes."
9.350068844854002,0.2178256368575261,2,es-ES,"""En esos momentos todo el mundo trata de ayudar"", ha señalado este jefe de bomberos, que no ha querido revelar si hubo fallos en las tareas de rescate. Por su parte, el jefe de sala del 112 ha comentado que la primera llamada que se recibió fue la de un obrero que trabajaba en Paracuellos, que les alertó a las 14.25 horas, cinco minutos antes de que los bomberos lanzaran su primera dotación hacia Barajas."
0.08223250672575046,2.486161504331549,1,sr,"Zvanični podaci objavljeni ranije ovog meseca pokazali su da je prethodna vlada potrošila preko 430 miliona evra da pripremi izgradnju drugog nuklearnog reaktora od 2.000 megavata na reci Dunav, oko 100km istočno od postojeće elektrane Kozloduj."
9.599573329131214,-0.20022319974682715,2,es-ES,"Su tortura acabó el pasado sábado, cuando Pedro José, un policía local en segunda actividad, que había hecho unos días atrás sus averiguaciones después de que algún «confidente» le hablara de que en la calle La Sierra había una 'inquilina' muy especial. «Utilicé los contactos que tengo y cuando tuve la certeza de que estaba en esa casa, no me lo pensé. Fui y conminé a un rumano que la vigilaba a que me la entregara», relata el policía local, quien actuó desarmado porque carece del permiso de la Alcaldía para llevar pistola."
9.391124441600827,-0.5696649929466697,2,es-ES,"Un total de nueve heridos, uno de ellos de carácter grave, es el balance de los siete accidentes de circulación ocurridos durante el pasado fin de semana; esto es, desde las 15.00 horas del pasado viernes hasta las 00.00 horas del domingo, en las carreteras de la Región de Murcia, según informaron a Europa Press fuentes de la Jefatura de Tráfico."
0.013669825109996574,2.2513619081651055,1,sr,"„U periodu svetske ekonomske krize, koja je po prirodi dužnička i koju karakterišu ogroman javni dug i slabe javne finansije, za očekivati je da će agencije snižavati rejtinge banaka i zemalja."
0.0029404935086799282,0.5427185753659881,1,sr,"Pored pravljenja uporednih baza podataka o ratnim dešavanjima, organizacije koje učestvuju u projektu takođe nadgledaju suđenja za ratne zločine u Srbiji i Crnoj Gori i nude direktnu pomoć žrtvama i svedocima na tim suđenjima."
0.018266955750288652,2.8562335645334036,1,sr,"Komesar za proširenje EU Oli Ren objasnio je da EK nije predložila datum za početak pregovora, jer to zavisi od mogućnosti Makedonije da sprovede kriterijume za članstvo."
0.18183630789896835,1.0166546001103758,1,sr,"Razgovori su, kako se izveštava, bili fokusirani na konkretne aktivnosti na međusobnoj granici, kao i na jačanje bezbednosti u odmaralištima dve zemlje."
7.07283773269419,-0.12307811729452622,2,es-ES,"Al igual que sucedió en Pekín durante los Juegos Olímpicos, a Shanghai le cuesta más adecuar los usos de su población a los estándares internacionales que levantar gigantescos pabellones. En esta ocasión, será la 'patrulla pijama' la que vele por la exquisitez indumentaria de cada barrio. Y, aunque la medida no es obligatoria, estos voluntarios tratarán convencer a la población de que sus prendas no conjugan bien con los rascacielos."
7.00394917200961,-0.3457751978674087,2,es-ES,"También destacó Martínez Argüelles que en Mercaplana habrá más de 150 actividades diferentes, con la participación de más de cuarenta instituciones, asociaciones y empresas, entre ellas, además del Ayuntamiento, Cogersa, Cajastur, el Principado de Asturias o el servicio de emergencias del 112. Además, el concejal reseñó que en Mercaplana trabajarán más de 300 personas (empleos directos)."
0.13559867015850985,2.1130064372756467,1,sr,"Subvencije za lignit i za rude koje sadrže i ne sadrže gvožđe do tada će biti potpuno ukinute, dok će se subvencije za mrki ugalj postepeno eliminisati do 2010. godine», izjavio je Jonel Mantog, sekretar ministarstva ekonomije i trgovine, a prenosi poslovni nedeljnik Kapital."
3.9187229546218574,-0.21651163363828674,2,es-ES,"Por otra parte, las otras dos opciones, Diarra y Sneijder, tampoco han fallado. El malí es casi intocable (hasta que llegue la Copa de África) y el holandés comienza a ser el de comienzo de temporada."
0.3116054013337031,2.5134688392160665,1,sr,"Dvanaest stranaka i koalicija imalo je pravo da se takmiči za dvadeset mesta u kosovskom parlamentu koja su određena za predstavnike manjina, navodi se u saopštenju OEBS-a od srede."
6.343920388352552,-0.3488930373213169,2,es-ES,"La idea de prometer préstamos de emergencia a Grecia, en caso de ser necesarios, es para convencer a los mercados de que es seguro prestarle dinero a Atenas, de modo que reduzcan la prima de riesgo que imponen a Grecia."
0.006426965310887182,1.1872386904512706,1,sr,"EK je takođe kritikovala ono što opisuje kao nedostatak komunikacije sa opozicijom, a posebno sa Demokratskom partijom za integraciju (DUI) Alija Ahmetija."
0.008223606547285312,1.2148053409781718,1,sr,"Međuministarska grupa ministarstva inostranih poslova radi na identifikaciji državne imovine u inostranstvu, sa namerom da na kraju ostvari pravo na nju."
