x1,x2,label,lang,texts
0.005641287470805137,1.0724670663486051,1,sr,Ministar je obelodanio pojedinosti projekta namenjenog poljoprivrednom sektoru i investiciju srpske vlade vrednu 93 hiljade evra za poboljšanje života stanovnika na tom području.
8.18747796347208,-0.19879524611538135,2,es-ES,"Fuera del ámbito económico, el barómetro constata que el terrorismo sigue siendo un fenómeno que sigue preocupando a los españoles, pero menos que antes del verano. Ahora ocupa el cuarto lugar, mencionado por el 18,6% de los encuestados, 2,3 puntos menos que en julio, cuando figuraba en quinto puesto de la relación. Lo mismo ha sucedido con la vivienda, que ahora inquieta al 18,4% de los ciudadanos, cuando en el anterior barómetro esta cifra era del 21,5%."
5.9021348327302805,-0.287443723694247,2,es-ES,"Cela critica que la presión a la que Aena somete a los controladores compromete la seguridad de la operación aérea en España, al tiempo que «pone en peligro a uno de los sectores clave de la economía»."
7.315535671022126,0.022104576513529435,2,es-ES,"Al Mallorca , sólo con el camerunés Pierre Webó arriba, le costó desembarazarse de la tupida red tejida por su rival, pero cuando encontró espacios su juego mejoró de forma exponencial, al igual que sus ocasiones de gol. Con grandes dosis de paciencia, el Mallorca de Michael Laudrup logró imponer sus argumentos, hasta el punto de encerrar al Deportivo atrás, al parecer muy cómodo en su papel de improvisado frontón."
0.12206224964163512,1.543444448365178,1,sr,"Hrvatska premijerka Jadranka Kosor i članovi vladajuće Hrvatske demokratske zajednice (HDZ) odmah su napali tu izjavu, a Kosorova je ukazala da su te reči predstavljale kršenje Ustava Hrvatske."
1.1096828836233061,0.26375948980696784,2,es-ES,"La Comunitat Valenciana se sitúa a continuación con un crecimiento del 6,3% hasta noviembre, Andalucía, un 3,4%, Cataluña, un 2,3% y Baleares, un 2,2%."
3.155355515629565,0.06868601863119433,2,es-ES,"La última aparición estelar de Aguilé se produjo hace dos años, cuando grabó un tema para promocionar la provincia de Castellón en la Fitur."
6.6474681252665,-0.21263023693140806,2,es-ES,"Como Ibai, otros siete niños esperan en La Paz una oportunidad similar. El padre de Ibai, emocionado, exultante, repetía el jueves a televisiones, radios y periódicos su agradecimiento a la familia portuguesa. ""Es algo muy bonito salvar la vida de un niño, aunque tengas la desgracia de perder al tuyo. Esos padres pueden estar orgullosos. Y nosotros estamos muy, muy agradecidos"". El regalo llegó a tiempo. ""Parte de milagro sí es que surgiera un donante en ese momento"", concede López Santamaría entre risas."
6.423604651262566,-0.129366843779315,2,es-ES,"Es la segunda mujer que fallece en los últimos 15 días en una clínica barcelonesa tras someterse a una operación gástrica. El pasado 11 de enero Laura R. M., de 19 años, murió en la Clínica CIMA después de que le implantasen una banda gástrica vía endoscópica. Su caso ya está siendo investigado por un juzgado de la capital catalana."
8.717861927467203,-0.13663720919694103,2,es-ES,"El secretario regional de los populares, Antonio Clemente, exigió al líder de los socialistas valencianos, Jorge Alarte, que explique «las dudas en la gestión» de la alcaldesa de Quart de Poblet. Clemente acusó a Alarte de «esconder la cabeza cuando se investiga a cargos de su partido. Esa es la doble vara de medir del PSPV»."
7.865140191477001,-0.21912922272634106,2,es-ES,"El Umbracle de la Ciudad de las Artes y las Ciencias acoge hasta el próximo 30 de marzo una exposición de 20 esculturas en gran formato de la nueva colección del artista castellonense Juan Ripollés , creadas entre los años 2006 y 2009 y que consolidan la figuración en su lenguaje artístico tras algunas obras en años anteriores con un mayor grado de abstracción."
7.294189530479076,0.7410490698865735,2,es-ES,Uno de los guardias controlaba las cámaras de seguridad pudo ver a través de los monitores cómo la furgoneta era estacionada con la parte trasera orientada hacia la Casa Cuartel. Seguidamente vio a un encapuchado que se apeaba del vehículo y se subía a un segundo turismo que circulaba por la carretera y que se detuvo para recogerlo. Antes de que pudieran reaccionar los agentes se produjo una potente explosión.
0.19269729060054874,3.020220247327333,1,sr,"Na kraju, u noći kada je postignut dogovor, drugi sud je poništio naloge za hapšenje 102 oficira, što su mnogi posmatrači protumačili kao kompromis koji je ponudila vlada kako bi se došlo do sporazuma."
2.854277057442189,0.06908132895502238,2,es-ES,"Alabama Choir es una de las experiencias gospel con más trayectoria internacional, acumula una larga lista de giras, actúa asiduamente en televisión y cuenta en su haber con numerosos recitales en escenarios emblemáticos y ante personalidades del mundo."
2.8549204125933345,0.32102671344267203,2,es-ES,"En el segundo, las jugadoras de Alcázar empezaron a hilvanar alguna jugada e hicieron su mejor cuarto mientras las jugadoras exteriores de CABA seguían dándose un festín premio a un gran trabajo y las interiores se imponían con abrumadora superioridad bajo los dos aros."
0.005842863129646896,0.8010031471679792,1,sr,"Berns je u sredu razgovarao sa mnogim liderima zemlje, uključujući članove Predsedništva BiH Sulejmana Tihića i Borislava Paravca, premijera BiH Adnana Terzića i ministra inostranih poslova Mladena Ivanića, predsednika RS Dragana Čavića, lidera Saveza nezavisnih socijaldemokrata Milorada Dodika i visokog predstavnika Pedija Ešdauna."
0.014002464225712333,1.6063379032673977,1,sr,Rumunski premijer Kalin Popesku Taričeanu pozvao je u nedelju (15. maja) članove svog kabineta da uslove za prijem u EU postave kao svoj glavni prioritet.
0.010775281581035514,0.8516203522894112,1,sr,"Ne treba zaboraviti ni Nenada Miljenovića iz kragujevačkog Radničkog, potom Danila Anđušića i Nemanju Jaramaza, koji sada igraju u Italiji, a koje je Ivković ranije pozivao."
0.1898612599795283,1.2021289187544246,1,sr,"Predstavnici ministarstva unutrašnjih poslova odbili su da upute svoјe predstavnike na јednu ekspertsku fokus grupu o tom pitanju, a ni predstavnici tužilaštva se nisu poјavili."
11.129391211869205,-0.2760088101804947,2,es-ES,"Por otro lado, el sondeo revela que el 20% de los encuestados no pedirá este nuevo año un aumento de sueldo pero sí que cuentan con la expectativa de la subida que se produce normalmente cada año. Sin embargo, más del 42% de los trabajadores españoles parece haber adoptado una postura con la coyuntura económica actual y no pedirá ese aumento ""tan esperado"" por el simple hecho de ser conscientes de la situación por la que atraviesan la mayoría de las empresas hoy en España."
4.6769190543745625,-0.1869749496681527,2,es-ES,"""Un libro que recoge los 21 años del festival, todos sus homenajeados, toda la presencia de actores, que patrocinó íntegramente la Diputación de Alicante y que ha dado un salto de calidad al certamen"", según el alcalde."
8.992355183499026,-0.13720712234633756,2,es-ES,"Jordi González conducirá una nueva edición del reality en la que Carmen Lomana analizará junto al profesorado los avances conseguidos por los diez participantes en una velada en la que cuatro de ellos intentarán sortear la temida nominación. Dos de ellos serán salvados por los profesores de la escuela, mientras que los dos restantes competirán entre sí en una prueba que mostrará su nivel de conocimiento y que dará a conocer el nombre del nuevo expulsado del programa."
3.157626089817876,0.18607153549451116,2,es-ES,Minuto 2. Gol del Elche. Gol de Jesús Perera. El delantero se encuentra un rechace en el área tras un centro por la derecha y sólo tiene que chutar a bocajarro ante Alberto que nada puede hacer
4.624135538764043,-0.3171460408615154,2,es-ES,"La postura de Moody muestra el recelo de la escena teatral australiana a la designación de Blanchett, la primera directora artística elegida sin concurso y también la primera sin experiencia en ese campo. / EFE"
3.7673609148520164,-0.13254532836535599,2,es-ES,"Además, García aseguró que la Comunidad «ejercitará en el momento procesal oportuno las acciones judiciales que correspondan para exigir el cumplimiento íntegro de las obligaciones legales en materia de financiación autonómica»."
0.007578763437896002,0.930883512931355,1,sr,"Zajedno sa projektom povezivanja baltičkih zemalja i mediteranskim prstenom, taj nacrt bi trebalo da postane ""jedan od kamena temeljaca buduće evropske supermreže"", smatra EK."
8.754527075193483,-0.025038850285268192,2,es-ES,"Una ciudad asolada por el agua. Ríos desbordados, calles anegadas y daños cuantiosos. La catástrofe del año 1989 dejó a miles de ciudadanos aislados y lo que es peor, seis personas perdieron la vida en aquel trágico suceso. Dos décadas después del terrible desastre natural, un grupo de expertos, periodistas y políticos reflexionan y hacen balance de las cuatro grandes inundaciones de Málaga dentro del popular ciclo de conferencias 'Torrijos y la libertad', que como novedad en su decimoquinta edición se ha trasladado del Museo Municipal a la Sala Ámbito Cultural de El Corte Inglés."
0.01424880459053493,0.44285638739970146,1,sr,"Dakle, nestanak srednje klase će svakako ostaviti velike posledice na ekonomiju, iz prostog razloga jer bez nje neće biti ni potražnje, a bez potražnje nema ni proizvodnje."
5.773422482387831,0.10918410858890183,2,es-ES,"Un tanteador ya insuperable para la selección, que pese a todo, no se rindió y siguió buscando hasta el final la portería rival, un empeño, que al menos sirvió para que Borja (m.84) sumase un nuevo gol, que permite al delantero del Atlético de Madrid seguir en la pelea por el título de máximo goleador del campeonato."
2.4659927670670796,-0.10504131706682973,2,es-ES,"En cualquier caso, «queremos darles la oportunidad de rectificar», porque antes del Pleno habrá Comisión de Hacienda para contestar a las alegaciones. «Hasta ese día, vamos a darles un pequeño margen»."
4.441253469585318,0.08561180187208321,2,es-ES,"Esta petición viene justificada según señala el presidente de la Hermandad, Antonio Alijo, ante la situación producida en el Ayuntamiento con motivo de los problemas judiciales existentes en referencia al canon ingresado por Ascán, «lo cual supone que no se va a hacer uso del mismo», aseguran."
9.076775992537263,0.11679824317885595,2,es-ES,"Aún así, tan sólo tan sólo 44 personas se han interesado por adquirir una de las plazas que el Consistorio ha sacado a la venta en concesión de 50 años por un importe de 9.000 euros. «El Ayuntamiento suprimió la limitación por la cual sólo los residentes de las calles colindantes podían acceder a una plaza pero aún así los vecinos se quejan de que no sea una venta en propiedad sino tan sólo una concesión», ha explicado el edil de Hacienda, Salvador Domínguez."
0.017460123677638557,1.4168558134345373,1,sr,"Gotovo 30 crkava i manastira, 800 domova i više od 150 vozila je oštećeno ili uništeno. Oko 3.600 kosovskih Srba napustilo je svoje domove."
0.01431624701428329,2.059061169769914,1,sr,"Zato činjenica da smo došli do tačke na kojoj uopšte možemo da razgovaramo o tome predstavlja izvanredan napredak», dodao je Terzić."
0.0008903503709084489,0.20759342033616138,1,sr,On trenutno boravi u Beogradu gde u četvrtak (24. novembra) ima razgovore sa predsednikom Vlade Srbije Vojislavom Koštunicom i ministrom inostranih poslova Srbije i Crne Gore Vukom Draškovićem.
0.01271760936373444,2.052318568684564,1,sr,"Koalicija Za evropsku Srbiju na čelu sa Tadićevom Demokratskom strankom (DS), osvojila je 39 odsto glasova i imaće 102 od 250 mandata u parlamentu. Međutim, ona nije uspela da dobije većinu od 126 poslaničkih mesta."
0.1280476795537622,0.9476273381258201,1,sr,Kompanija za razvoj projekta (PDC) imaće 2.100 deonica čija se pojedinačna vrednost procenjuje na 100 britanskih funti (oko 125 evra) i koje će biti jednako raspodeljene između tri zemlje.
4.204492099015419,-0.1910144774921265,2,es-ES,"El club rojiblanco madrileño tuvo que hacer una contratación de 'urgencia' en el caso de Juanito, ex del Real Betis. Los 'colchoneros' no tenían al principio de temporada esos ocho canteranos exigidos por la UEFA."
2.507544906054523,0.1949026692015975,2,es-ES,"Previamente habían entrado por la Puerta Santa los últimos peregrinos, que estos días formaron grandes colas para acceder por ella al templo. El último fue Constantino Gómez Taboada, que llegó desde La Coruña y se manifestó emocionado y sorprendido por esta circunstancia."
2.675987545001727,0.14880464811002234,2,es-ES,"Lo que se dice una delicia de concierto, con habaneras y conocidas canciones que deleitaron a la nutrida concurrencia que abarrotaba la sala."
8.372451820733108,-0.1529377889538587,2,es-ES,"Asimismo, 'Pamplona en Clave de Música' arrancó ayer en el Palacio del Condestable enfocada al mundo de la ópera, con el fin de ofrecer a los jóvenes músicos un nuevo camino de especialización y una alternativa dentro de la carrera profesional de músicos y cantantes. Además, en el Fringe Festival también podrán participar otros instrumentos que no se hayan impartido en la academia,"
0.06908661468063661,2.1891054124630154,1,sr,"Libija je rekla da neće popustiti pod pritiskom EU koji ima za cilj prevremeno puštanje na slobodu pet bugarskih medicinskih sestara i palestinskog doktora, koji su osuđeni na smrt u kontroverznom slučaju zaraze HIV-a."
5.426712226075595,0.23026297024676265,2,es-ES,"Además, ha asegurado que la aplicación de este plan ha permitido eliminar el riesgo de inundación en 10.000 hectáreas en los últimos años y ha dicho que su departamento ve bien que se complementen los datos de los que disponen."
0.2106397101116865,2.712923486942564,1,sr,"Opšte podobni usvojitelji najčešće su ljudi starosti od 45 do 50 godina koji po zakonskom kriterijumu ne mogu da usvoje bebu ili dete mlađe od 5 godina. Pored malog broja dece opšte podobnosti, problem stvara i činjenica da se broj romske dece u regisitru za dve godine od 30 odsto povećao na 50."
0.0663678237540562,1.3430284965517145,1,sr,"Nove mere usvojene su dan pre važnog sastanka zvaničnika EU i Rusije, i u svetlu nedavne pretnje Moskve da će zabraniti sav uvoz mesa iz Unije posle ulaska Bugarske i Rumunije, navodeći kao razlog loše zdravstvene standarde za stoku u te dve balkanske zemlje."
7.544920309887599,-0.33114715624172225,2,es-ES,"El líder de los populares vascos abogó por que la lengua vasca «crezca con normalidad», desde la «pluralidad» en la que está enraizada, y desde la premisa de que no es cierto que el euskera «sea enemiga» del castellano. «Los vascos tienen la gran suerte de tener dos lenguas, y para fortalecer una no podemos desacreditar la otra», defendió."
0.06888835978243442,1.9560030316677997,1,sr,Oni su takođe ukazali da bi zemlja trebalo da sprovede mere za bolju kontrolu inflacije i reforme neophodne za evropsku integraciju.
0.1357943414325762,1.8783191159035066,1,sr,"Ne očekuje se da će taj program u iznosu od 440 milijarde evra odmah biti sproveden, jer treba prvo formalno da ga odobre šefovi vlada i nacionalni parlamenti svake države učesnice."
6.046125509388974,-0.16462863150483306,2,es-ES,"Vicente Farnós, director ejecutivo de Castelló Cultural, manifestó que ésta «es la Nit de la consolidación. Una simbiosis de fiesta en la calle, música y galerías. Hoy todos somos protagonistas». Por su parte, la organizadora del evento, Yvonne Bacas, dijo que «hoy Castellón está en la calle, Castellón por el arte y Castellón brazos abiertos»."
5.32160390992217,0.14221713527873164,2,es-ES,"Los teloneros animan la campaña. La víspera de la gran cita en la carrera hacia la Generalitat, el duelo que protagonizarán hoy José Luis Rodríguez Zapatero y Mariano Rajoy, los números dos del PSOE y PP se encargaron ayer de animar una alicaída campaña que toca a su fin."
0.014969792376736391,2.134889140082491,1,sr,"Profesor Beogradskog univerziteta i saradnik Instituta društvenih nauka Dejan Vuk Stanković izjavio je za SETimes da je, prilikom donošenja te odluke, Tadić imao u vidu i državne i stranačke interese."
5.523749931051558,0.17556151596153693,2,es-ES,"Las acciones de AMR, la compañía matriz de American Airlines, se depreciaban hoy con fuerza en la Bolsa de Nueva York y antes de llegarse a la media sesión bajaban más de un 8% respecto del día anterior y se negociaban a 9,46 dólares."
0.12738143066023574,0.8015127879053079,1,sr,"Broj presađivanja organa u Grčkoj povećao se za 110 odsto od početka ove godine, u poređenju sa prošlom godinom, sudeći po statističkim podacima objavljenim u utorak (19. avgust) u grčkim medijima."
8.407123211573653,0.07014161045409925,2,es-ES,"Según Seltsovski, «en condiciones normales la media de decesos diarios en Moscú se sitúa entre los 360 y los 380, pero ahora estamos alrededor de los 700». El funcionario municipal advirtió que ya están ocupadas 1.300 de las 1.500 plazas existentes en los depósitos de cadáveres de la ciudad, dando a entender que habrá que darse prisa en enterrar a los muertos antes de saturar su capacidad."
3.840614213586995,-0.19776223521030048,2,es-ES,"Cada empleado tienen una tarjeta con código de barras que les identifica. Para acceder a la obra deben pasarla por unos lectores en la zona de control, vigilada permanentemente por agentes de seguridad."
0.008609674608666048,1.5543335991724514,1,sr,"""Proces evroatlantske integracije ne bi trebalo smatrati završenim bez potpunog uključivanja svih zemalja zapadnog Balkana i Ukrajine u NATO savez i EU"", izjavio je makedonski predsednik Branko Crvenkovski, koji je bio domaćin sastanka."
0.14872792746897606,3.8903167940006997,1,sr,"Uprkos strahovanjima da bi Nikica mogla da izazove međunarodni pogranični incident ako pređe u Albaniju koja deli Skadarsko jezero sa Crnom Gorom i nalazi se samo 15 kilometara od odmarališta Plavnica, ona je pronađena kako leškari pored bazena pre nego što je pala noć, u danu kada je i pobegla."
1.8907819330134934,0.1626645066811675,2,es-ES,"El equipo se ejercitó ayer y hoy descansará. Mañana miércoles la plantilla regresa al trabajo en el Rico Pérez, donde entrenará toda la semana, y pasará unas pruebas analíticas."
0.058662685896977124,0.5842332221986671,1,sr,"Vremenski uslovi sa mnogo padavina i uz visoke temperature pogoduju razmnožavanju rečnih i takozvanih kućnih komaraca, čija su legla na kanalima, barama i drugim manjim vodenim površinama na celoj teritoriji grada i prigradskih naselja, piše portal ''24 sata''."
3.509485133418244,0.29929281302763744,2,es-ES,"De todos modos, Johny se muestra confiado en el equipo y desea una pronta recuperación a su compañero para que el que juegue, lo haga ganándose el puesto y no por la lesión del otro."
0.13001412368888432,1.7625674088194891,1,sr,Američki farmaceutski gigant Fajzer potpisao je sa hrvatskom biotehnološkom kompanijom Genera Risrč ugovor o kupovini prava na patent za lek koji se koristi za borbu sa bolestima bubrega.
8.05597316564127,0.43102612923807876,2,es-ES,"Tanto para el Partido Popular (PP) como para Izquierda Unida (IU), el retraso de la edad de jubilación es una auténtica «barbaridad». El diputado del PP Tomás Burgos remarcó que se trata de la iniciativa «más dura e impopular de todas cuantas se han aprobado en relación con nuestro sistema de pensiones». «Creemos que no conseguirá convencer a los grupos políticos ni a los sindicatos para que se apruebe la propuesta», añadió."
0.015433023411614635,1.771448296020308,1,sr,"Vrhovni tužilac Turske zatražio je od Ustavnog suda da van zakona stavi Partiju pravde i razvoja (AKP), favorita na prevremenim opštim izborima zakazanim za 3. novembar."
0.014485803097021101,1.2617109203621066,1,sr,"""Patnje Srba u Srebrenici i okolini tokom te tri godine ni na koji način nisu manje značajne"", dodao je Dodik, reagujući na nedavno oslobađanje bivšeg bošnjačkog vojnog komandanta Nasera Orića od strane Haškog tribunala."
5.190534872907543,-0.2665403529089918,2,es-ES,"Y es que como el propio título de la canción indica 'Shame' (Pena), eso es justamente lo que deben sentir los dos artistas después de llevar 15 años sin dirigirse la palabra. Pero el videoclip es el fiel reflejo de la reconciliación real entre Robbie y Gary."
0.12889773767374751,1.4197626620085524,1,sr,"Predstavnici zajednica koji će se nalaziti u veću biće izabrani od strane samih zajednica, izjavio je portparol predsedništva Džavit Bećiri za Southeast European Times."
0.8922805081404638,5.9652135702475135,1,sr,"Uobičajeno popodne 1954. godine u kući En Hodžis u Alabami prekinuo je meteorit koji je upao kroz plafon, odbio se o radio i udario je u bok, ostavljajući veliki otok. Iako je bila povređena i u šoku, En je preživela i upisana je u istoriju kao jedina Amerikanka koju je ikada udario meteorit. Ona je preminula 1972. godine, kada su joj otkazali bubrezi, a meteorit se čuva u Istorijskom muzeju Alabame."
6.694541849840039,-0.25024610877414283,2,es-ES,"El número de centros docentes de la provincia que este año concurren al proceso electoral de los consejos escolares es de 80. De los cuales 9 van a tener una renovación total de su consejo, 69 una renovación parcial y 2 concurren por primera vez a este proceso, estos son los CEOs de Prádena y Villacastín."
5.546097746906107,0.027359126065102445,2,es-ES,"Se tratará de un duelo entre un portero en racha ante un delantero que precisamente recuperó la fortuna de cara a la portería en el triangular que disputó con el combinado andaluz la pasada semana, con José Miguel de testigo."
4.110436734930087,0.041487201494498374,2,es-ES,"Las acciones propuestas se realizarán fuera del horario lectivo del alumnado, pero inmediatamente antes o después de él, de modo que podrán llevarse a cabo ampliando el horario de mañana o el de tarde."
0.02545724259331521,3.0848631439545233,1,sr,"Nekoliko sati pre nego što je Borisov saopštio imena kandidata, agencija za istraživanje javnog mnjenja MBMD navela je Plevnelijeva kao glavnog favorita u predsedničkoj trci, citirajući svoju najnoviju aketu. Agencija je međutim ukazala da će novi predsednik Bugarske verovatno biti izabran u drugom krugu 30. oktobra."
0.061418013692431925,0.9369422187226623,1,sr,"Ta deca su uglavnom lokalni Romi, ali i Albanci koji žive u siromaštvu, ali broj Roma iz Albanije je u porastu."
0.01295991467711244,1.785064013043842,1,sr,"Stručnjaci kažu da to predstavlja ozbiljan ispit za srpsko pravosuđe, koje do sada nije uspelo da odgovori na optužbe o ilegalnim privatizacijama."
6.1371630500973495,-0.20916797240629575,2,es-ES,"""Estados Unidos no ha abierto ni una sola investigación sobre los casos denunciados, a diferencia de otros países, como el Reino Unido y Dinamarca, que han anunciado investigaciones"" de algunos casos que les afectan, ha dicho Assange. ""En cambio, Washington lleva a cabo una investigación agresiva de nuestra organización, con amenazas públicas, y la petición, que no hemos aceptado, de que destruyamos todos los documentos que tenemos"", ha señalado."
0.012031470059831023,2.2094958899639834,1,sr,"""Prema svim informacijama koje sam prikupio kao novinar, optuženi je bio šef delegacije bosanskih Srba i sve je od njega zavisilo"", rekao je Zafirović govoreći o pregovorima u Ženevi."
8.007196228964986,-0.1560196351349784,2,es-ES,"La actual normativa, que vino precedida asimismo de una suspensión provisional de licencias, sólo autoriza la apertura de establecimientos de tres, cuatro y cinco estrellas, siempre y cuando estos se ubiquen en fincas que el 1 de enero del 2005 no tenían uso residencial. Antes, en el año 2000, Ciutat Vella ya había vetado con carácter general los hoteles de menos de tres estrellas."
0.1857873461993024,1.5519758830252057,1,sr,"Specijalni izaslanik UN-a Marti Ahtisari planira da zatraži od kosovskih lidera konkretna objašnjenja o tome kako će pokrajina steći nezavisnost, rekao je šef međunarodne administracije UN."
0.06024406480614498,0.8917040738893384,1,sr,Visoki predstavnik Valentin Incko intervenisao je nakon što radna grupa koju su imenovale lokalne vlasti u Bosni i Hercegovini nije ostvarila napredak.
0.015126741376211346,2.292431973732162,1,sr,"Nova strategija bi takođe trebalo da utvrdi ""konkretan datum za pristupanje Turske EU, pod pretpostavkom, naravno, da države članice i Turska ratifikuju potrebne dokumente,"" dodao je on."
0.01324401190010959,1.8399851256935056,1,sr,"«Doći će do nesmetane tranzicije sa SFOR-a na EUFOR i mi ćemo nastaviti da gradimo na uspesima SFOR-a», rekao je Liki."
0.18236862467282153,1.1580658398140202,1,sr,"Kreditni rejting zemlje kretao se uzlaznom putanjom, dok su analitičari govorili o «ekonomskom čudu» u zemlji koja je pre samo pola decenije bila u krizi."
0.2553732192225847,2.3398037377448846,1,sr,"Nema političkih prepreka koje bi mogle zaustaviti Hrvatsku da se pridruži EU jednom kada ispuni uslove Unije za članstvo, rekao je britanski premijer Toni Bler u utorak svom hrvatskom kolegi Ivi Sanaderu koji se nalazi u svojoj prvoj zvaničnoj poseti Londonu."
0.19394556418607298,2.74487607924371,1,sr,"Oni će pokazati da je moguće, kroz svoje rasprave i razgovore, da se vodi kultivisani i tolerantni dijalog o pitanjima koja su od vitalnog značaja za interese Makedonije."
5.572193304697014,-0.24637827738992546,2,es-ES,"El medio centenar de mineros encerrados en un yacimiento de Velilla del Río Carrión (Palencia) han cumplido 22 días de protesta, cuatro más que los trabajadores que permanecen en el pozo de Tremor de Arriba (León)."
