x1,x2,label,lang,texts
1.089011505426966,4.113174939093928,2,sr,"On je Sarajlije digao na noge. Bukvalno. Blizu 15.000 njegovih fanova došlo je na koncert koji je pre dve večeri priredio u dvorani Zetra. Aco je bio prezadovoljan odzivom publike, a bilo je primetno da ga lome emocije."
0.7798540043949657,2.8115925558511505,2,sr,"En Hatavej je nedavno izjavila da joj je Suzan bila inspiracija za izvođenje u ""Jadnicima"". En igra lik Fantine i izvodi čuvenu numeru ""I dreamed a dream"", koju je Suzan Bojl izvodila na britanskom takmičenju ""Ja imam talenat""."
0.8841542169786729,2.932805591780906,2,sr,"On je takođe ponovio spremnost Ankare da unapredi odnose sa iračkim Kurdima, koje je okrivila za pružanje podrške pobunjenicima PKK stacioniranim na severu zemlje koji koriste za pokretanje prekograničnih napada na Tursku."
0.7040119256485374,-0.2116056112190852,1,pt-PT,"Assim, por exemplo, “as verbas destinadas a projectos que não sejam efectivamente utilizadas no prazo definido poderão passar a ser reafectadas a novos projectos”."
1.44361223517067,-0.35378107031772127,1,pt-PT,"Uma das novidades são os serviços online, já que, em colaboração com a Google, a Audi conseguiu que o novo modelo tenha Internet a bordo através do telefone Bluetooth online."
0.5985088680434061,1.8061306192203455,2,sr,"U zamenu za otpis duga prema Pariskom klubu poverilaca u iznosu od 700 miliona dolara, Beograd se složio da počne velike reforme -- preciznije restrukturiranje javnih preduzeća i privatizaciju (ili zatvaranje) onoga što je ostalo u neefikasnom društvenom sektoru."
1.7068860091335365,-0.5689965736672102,1,pt-PT,"O TC recomenda à EMEL que ""repondere"" a sua relação contratual com a Street Park para eliminar as ilegalidades apontadas, ""em particular as respeitantes à transferência de responsabilidades pela exploração dos estacionamentos""."
2.5673382373126215,0.020427642958430796,1,pt-PT,"Os subscritores da Moviemail enviaram os seus nomeados por correio electrónico e os cinco melhores de cada categoria passaram à ronda final, na qual milhares de pessoas elegeram os seus favoritos."
1.5024632447547077,0.7527083366166138,1,pt-PT,"Os Bispos, com o seu exemplo, poderão guiar não só aqueles que, na Igreja, foram chamados a seguir Cristo na vida consagrada, mas também os presbíteros, a quem é proposta igualmente a radicalidade da santidade segundo o espírito dos conselhos evangélicos."
1.8925969298351442,-0.3798461541570604,1,pt-PT,"Segundo o empresário, também se notou um acréscimo de turistas vindos do Benelux (Bélgica, Holanda e Luxemburgo) e uma mudança no perfil do turista provocada pelo aumento dos voos low cost para a região."
3.1840019352711755,-0.9991874438777175,1,pt-PT,"No documento, a AIE perspectiva que o preço do barril deve atingir os 113 dólares nos próximos 25 anos, com a procura de petróleo a chegar aos 99 milhões de barris por dia em 2035, 15 milhões acima do registado em 2009."
0.9287698668045697,2.900637965977053,2,sr,"Mudiz je, međutim, upozorio da program koji je najavila EU „podrazumeva znatne gubitke“ za privatne poverioce i da postavlja negativan presedan za poverioce i ostale prezadužene članice evrozone."
2.3522798549029744,-0.8411943868655151,1,pt-PT,"O curso, ministrado por enfermeiros, tem por objetivo ensinar aos pais com filhos até aos oito anos de idade quais os procedimentos a realizar em caso de afogamento, explicam os responsáveis pelo curso."
0.7312857419436776,1.3012164128657298,2,sr,"Takav porez verovatno će narednih godina biti važniji za BiH nego carinski prihodi, s obzirom da će regionalni trgovinski sporazumi dovesti do smanjenja sume koja se prikuplja od carinskih dažbina."
2.9381386864780774,-0.3119866297575675,1,pt-PT,"Os cadáveres foram encontrados no final de agosto graças às informações prestadas pelo sobrevivente, que assinalou o cartel de Los Zetas, um dos grupos mais violentos do México, como o autor da matança."
2.130346096351764,-0.6806090268763147,1,pt-PT,"“No entanto, não podemos dizer, de uma forma geral, que existe um sentimento comum em relação à celebração do Santo Cristo no seio dos açorianos, só por serem emigrantes."
3.350854398320449,-0.3918357362559548,1,pt-PT,"""De todas as candidaturas aos PO's regionais do Alentejo ao SI Inovação que foram aprovadas só 26 por cento são da Lezíria"", percentagem que baixa para 22 por cento em termos de incentivos, acrescenta."
2.5552116089020496,-0.253096514449001,1,pt-PT,"Os valores da transferência não foram revelados até ao momento, mas a imprensa argentina diz que o passe custará cerca de 3,2 milhões de euros."
2.430993073358102,-0.786164366076127,1,pt-PT,"As receitas revertem para a construção do Berço, Centro de Dia, sede do Agrupamento de Escuteiros, salas para a Catequese e nova igreja paroquial, com oitocentos lugares sentados."
2.7148983677876743,-1.0553004419317369,1,pt-PT,"No entanto, podemos observar a recuperação de alguns fundos de tesouraria e taxa indexada bem como outros fundos de obrigações com dívida governamental e corporate com comportamento muito positivo nos últimos 3 a 12 meses."
1.4973542891343548,2.895380270889259,2,sr,Sada je na tribunalu da odluči da li su ove garancije dovoljne da Ljube Boškovski i Johan Tarčulovski budu privremeno pušteni na slobodu do početka suđenja.
0.16309045324426358,0.8696878739740547,2,sr,"Prvu posetu inostranstvu od kada je počeo drugi mandat Buš će okončati u četvrtak u Bratislavi, susretom sa ruskim predsednikom Vladimirom Putinom."
1.168057773228764,2.6850746349233585,2,sr,"Međutim, Maliki je izjavio da nije u njegovoj moći da obaveže Bagdad na takav dogovor, a da ga prvo ne predstavi parlamentu i svojoj vladi."
0.7763044182635962,2.016223055793052,2,sr,"""Važnije od zakonskih normi je učiniti vlasnike životinja odgovornijim, kako bi se sprečili slučajevi da se ljudi zasite psa posle malo zabave i igre sa njim i izbace ga na ulicu."""
1.7259912706405105,0.3595631526151209,1,pt-PT,"Na área da música, a temporada 2008/09 do CCB tem previstos três concertos de Maria João Pires, um concerto ""carta branca"" com Camané, e peças encomendadas aos compositores Alexandre Delgado e António Pinho Vargas."
0.48773880689908833,1.5624824612535206,2,sr,Marovićeva poseta Britaniji usledila je nekoliko dana nakon odluke Vašingtona da uskrati 10 miliona dolara planirane pomoći srpskoj vladi za 2005. godinu zbog njene nesaradnje sa MKSJ.
2.037184009975189,-0.6776821837549,1,pt-PT,"Expliquem lá isso antes que alguém venha dizer que é mais um tacho oferecido a troco de qualquer outra coisa, nem que seja um favor."
2.1837506372019195,-0.8032539385257473,1,pt-PT,Mas os sindicatos e associações representativas das duas forças mantém as críticas às mudanças e há até quem ameace com um dia de luta no dia 21 de Abril.
3.4160719983376087,-0.9620294691562238,1,pt-PT,"Os seguranças à porta, o corrupio de descapotáveis, a luz natural filtrada por obras de arte não dirão muito aos habitues do alojamento de luxo, mas preconizam uma mudança na hotelaria algarvia e são já um ensaio para as seis estrelas."
3.572609511843699,0.09414117614035881,1,pt-PT,Feira do Fumeiro de Vieira é das mais rentáveis da região A Feira do Fumeiro de Vieira do Minho é um dos eventos gastronómicos «mais rentáveis» que se realizam na região do Minho.
0.5248273715654602,1.3814845936176814,2,sr,"Politika RTK je da novinari svih jezičkih informativnih redakcija rade zajedno na televiziji i u radijskim redakcijama, deleći informacije i opremu."
1.69254277894236,1.2688831565547292,1,pt-PT,"Para o historiador, esta é uma lógica histórica, não interpretada da mesma forma por outros sectores da sociedade, dos quais fazem parte ""estruturas clássicas e tradicionais na sociedade portuguesa, que se mantêm poderosas""."
1.909447062076774,-0.5903317855792112,1,pt-PT,"Em vez disso, o cerco aos cidadãos americanos está mais apertado, a liberdade de imprensa menor do que nunca, a guerra continua não no Iraque mas sim no Afeganistão, a economia penhorada aos Chineses.."
1.4806031182292767,-0.31951858882804185,1,pt-PT,"Enquanto a crise política se resolve, sublinha o jornal, “os investidores deverão aumentar a sua pressão sobre Portugal para que solicite fundos de emergência”."
0.44680339831377647,0.952136723243896,2,sr,Lideri država zapadnog Balkana -- svi osim jogunaste Srbije -- sastali su se u u subotu (20. marta) u Sloveniji da razgovaraju o značaju članstva u EU.
0.24073257484571894,1.3354834086347194,2,sr,Prema izvorima Oslobođenja nekoliko automobila ukradenih u Bosni i Hercegovini (BiH) pronađeno je kasnije sa novim registarskim tablicima koje je izdala policija u Crnoj Gori.
3.55858853751748,-1.0886216540835558,1,pt-PT,"""a maioria dos licenciados não tem vontade nenhuma de andar por aí a cantarolar esta música, pela simples razão de que ganham duas vezes mais do que a média, e 80% mais do que quem tem o ensino secundário ou um curso profissional."
0.8266818212442982,2.623937291391547,2,sr,"Opozicija se oštro usprotivila vladinom paketu od 17 zakona koji je bio usmeren na reforme koje zemlja mora sprovesti da bi ušla u EU 2007. godine, kao što je planirano."
2.7615721813330927,-0.5363902526882072,1,pt-PT,"Sua filha, genro e netos na impossibilidade de o fazerem pessoalmente como era seu desejo, vêm por este meio agradecer a todas as pessoas que se incorporaram no seu funeral ou que de algum modo manifestaram o seu pesar."
0.3578389469972802,0.8311547446953358,2,sr,"„Kosovo nema pozitivan imidž uglavnom zato što (mediji opisuju) kako Srbi žive u getima ... dok NATO pomaže Albancima da rasele Srbe sa Kosova“, ukazuje Čukov."
2.729436655462535,-0.5980629320537356,1,pt-PT,"""Poderá haver uma confusão inicial, até que se perceba que se deve recorrer ao médico de família ou às unidades de Saúde Familiar, em situações menos urgentes ou emergentes"", comenta (ler artigo)."
1.8683732700866795,-0.42875907796487467,1,pt-PT,"O treinador referiu que a época tem sido fértil em peripécias, e apesar de todas as condicionantes, o grupo que se mantém merece todos os elogios."
0.3900491811944432,1.7520946032229119,2,sr,Na jednoj slici prikazan je Partenon pre nego što je eksplodirala topovska granata za vreme mletačke opsade jednog turskog garnizona 1687. godine
0.6528138820095022,1.7595058507292767,2,sr,"U saopštenju Agencije se ističe da se, iako je višestruka korist od diklofenaka, koji proizvodi nekoliko kompanija, kod nekih pacijenata bi ipak trebalo preduzeti mere predostrožnosti."
0.5436555645318614,1.5139168905856095,2,sr,"Incko je otvoreno izjavio u ponedeljak da bi ""svaki entitetski referendum kojim se osporavaju ovlašćenja Dejtonskog sporazuma ili visokog predstavnika ... bio nezakonit i ugrozio entitet, jer entiteti nose svoju legitimnost iz samog sporazuma""."
0.5536862777047704,-0.1236280192389367,1,pt-PT,"O recente desafio do Alberto João para apoiar qualquer moção contra o governo,deve ter dado a Louçã ãnimo para tentar conquistar apoio à direita."
3.0675431824963337,-0.9449588760833216,1,pt-PT,"Por exemplo, o México cortou as taxas de juro de forma substancial à medida que as expectativas de inflação se foram moderando, mas os diferenciais permanecem relativamente altos."
0.8473269584674343,2.460013032327839,2,sr,"Prošle nedelje, bosanski list Dnevni avaz preneo je izjavu glavnog opozicionog lidera u RS Milorada Dodika da je Karadžić odneo novac u proleće 1997. godine i da postoji dokumentacija koja to dokazuje."
0.3003778964774815,0.8177581736051617,2,sr,"Sud u Hagu još uvek insistira na izručenju četvorice ratnih zločinaca iz sukoba na Balkanu devedestih godina koji su u bekstvu, uključujući lidera bosanskih Srba iz vremena rata Radovana Karadžića i njegovog vojnog komandanta Ratka Mladića."
1.3190446705535857,3.914046779456376,2,sr,"""Uveren sam da ćemo dobiti datum, ja ću biti kriv građanima Srbije ako to ne dobijemo i neko će morati da objasni zbog čega nismo dobili. Mislim da je Srbija uradila mnogo više nego što je bilo ko u Evropi očekivao"", kazao je Vučić."
0.2764830807470132,1.1031254501062022,2,sr,"Bukureštanska kulturna fondacija Ideea Europeana (Evropska ideja) tražila je sredstva za učešće na Evropskom festivalu novele u Grčkoj, ali nije dobila ni cent."
2.5789740236842458,0.5686684233964246,1,pt-PT,"O presidente da associação do sector afirmou que ""o parque automóvel português é dos mais renovados da Europa"", o que ""também tem a ver com a actividade de inspecção automóvel""."
0.5166833501948368,1.3850115964888219,2,sr,"Odeljenje koje se unutar Državnog suda BiH bavi pitanjima organizovanog kriminala, ekonomskog kriminala i korupcije, počelo je velikom brzinom da pokreće postupke u slučajevima trgovine ljudima, bankarskih prevara i slučajevima sumnjivog političkog uticaja."
1.8789122345758882,0.18093578110349098,1,pt-PT,"Fernando Medina, que estava acompanhado do presidente da Câmara, Inácio Ribeiro (PSD), garantiu que o Governo está “fortemente empenhado no apoio às empresas para que as exportações continuem a crescer”."
1.8664618813728424,-0.4711047922103164,1,pt-PT,"Embora não seja possível fazer o ""puzzle"" completo, alguns motivos do frescos, que deverão ser de final do século XV/início do século XVI, são identificáveis."
1.2692878125969207,0.35328303107465214,1,pt-PT,"Os trilhos e veredas, adequados a esta modalidade, estabelecem o resto do contacto com a natureza, em que o património rústico será o ponto forte da iniciativa."
0.24714331596715397,0.9532335646240391,2,sr,"«Prvi prioritet biće veća angažovanost, veća decentralizacija i veća transparentnost», rekao je Papandreu odgovarajući na pitanje šta bi bili njegovi prioriteti ako postane premijer."
1.8515441279958482,-0.6134916842077603,1,pt-PT,"A campanha foi outro mau exemplo para o país, cheia de lugares comuns, pouca política (e os debates televisivos passaram a ser tão disciplinados que ninguém discutiu ideias ou projectos), sem nada que mostrasse génio nos candidatos ou nos partidos."
0.598761824287309,2.20611801047446,2,sr,"""Takođe, srećan sam što smo kao Opština u mogućnosti da tradicionalno darujemo decu štićenike Sigurne kuće i barem malo im ulepšamo stvarnost koja je za njih bila, a mnogima još uvek jeste surova"", kazao je Miličković."
3.1865995889713403,-1.1292583435790775,1,pt-PT,"""Sem Rede"" tem atraído milhares de pessoas, e durante o fim de semana, apesar de o sol ter brilhado em Lisboa, os visitantes aguardaram em longas filas no interior do museu para poder ver a exposição."
0.3434501671563739,1.0169866690992948,2,sr,"U Kragujevcu, Smederevskoj Palanci, Sjenici, Kraljevu, Kuršumliji, Kruševcu i Leskovcu izmereno je 30, Požegi, Dimitrovgradu i Vranju 29, na Crnom Vrhu 26, a na Zlatiboru 25 stepeni."
3.723745746069963,-1.3310026563375574,1,pt-PT,"Bancos têm de publicitar o que cobram O Banco de Portugal vai obrigar os bancos e outras instituições financeiras a divulgar as suas comissões com destaque e em vários canais, para além de proibir cobranças que não estejam incluídas no preçário."
1.851031153077962,0.19384368813110647,1,pt-PT,"Jorge Lacão deixou, ainda, fortes críticas ao PSD “que, supostamente, deveria fazer parte do lado da responsabilidade e que, no entanto, tem mantido uma posição inflexível, o que é incompreensível”."
2.6864757234321828,-1.0260189092325467,1,pt-PT,"Em vez de serem emitidos por objectos brilhantes ou quentes, os raios gama têm origem nas colisões entre partículas de matéria ou de luz."
1.7901076248595185,0.037681676745116396,1,pt-PT,"Por isso, assim que tiver um dinheirito, faça um favor aos nossos filhos e netos, tire aquele betão da praia e deixe a praia como ela era antes, de calhau bonito e redondinho."
0.1109051599425761,0.5352918082642789,2,sr,"Most, koji će biti dug 1,5 kilometara, koštaće 170 miliona evra, od čega će 85 odsto sredstava biti pozajmljeno od kineske Eksim banke."
0.8912454255687164,2.3125950933387354,2,sr,"Evropska komisija (EK) je u oktobru preporučila da se Srbiji da status kandidata, ali odluka o određivanju datuma za početak razgovora o članstvu zavisi od pregovora između Beograda i Prištine."
0.9553457048757568,0.36691018378893026,1,pt-PT,"O atum é, porém, o campeão da valorização em lota, com o preço médio à descarga a aumentar quase 28 por cento, para 3,96 euros por cada quilo."
0.738870360120454,-0.229304064572118,1,pt-PT,Marisa Ferreira e JP com a filha Deixe aqui o seu comentário (obrigatório) Email (obrigatório) Pretendo receber a newsletter Destak.pt Para poder comentar terá que inserir um email válido.
0.6696406934143891,1.4800646686122525,2,sr,Dve zemlje se bore da se kvalifikuju za Evropsko fudbalsko prvenstvo 2012. godine i dva kluba iz svake od njih suočiće se u Evropskoj ligi UEFA.
0.6329130186553531,1.606696293025317,2,sr,"Kada se otprilike 300 muslimana vehabija okupilo ispred zgrade parlamenta prošlog meseca u Sarajevu, tražeći da pritvorene osobe afričko-azijskog porekla budu puštene iz Imigracionog centra na Lukavici, vlada je brzo reagovala."
0.19428426287994635,0.6323744284044661,2,sr,"Razgovori su bili fokusirani na hrvatska evroatlantska nastojanja, zastoj u naporima za ponovno ujedinjenje Kipra i regionalna pitanja, uključujući budući status Kosova."
0.5080915746619065,0.524429789936357,1,pt-PT,"A Assembleia Legislativa da Região Autónoma dos Açores foi asfixiada e menorizada pela forma como o PS, nomeadamente o poder executivo, exerceu o poder."
0.751322134371629,1.8718214678347191,2,sr,Oni su takođe ukazali da bi zemlja trebalo da sprovede mere za bolju kontrolu inflacije i reforme neophodne za evropsku integraciju.
0.3955457811597981,0.951183162470311,2,sr,"Trgovinska razmena između Turske i Iraka dostići će 10 milijardi dolara do kraja 2011, kaže Rifat Hisardžiklioglu, predsedavajući turskog Saveza komora i robne razmene, koji je saopštio taj cilj u junu, posle sastanka sa predsednikom Federacije trgovinskih komora Iraka Džafar Rasol Džafar El Hamdanijem u Istanbulu."
2.4090336293216774,-0.10806298723699682,1,pt-PT,"» revela Cristina Bárbara directora do Serviço de Pneumologia do Hospital Pulido Valente, em Lisboa, professora da Faculdade de Ciências Médicas e responsável pelo coordenação deste projeto."
0.1639567446542014,0.886473296804274,2,sr,"Ipak, poslednjih godina, hrvatski film je oživeo sa serijom osvežavajućih novih ostvarenja koja su privukla međunarodnu pažnju i dobila prestižna priznanja."
0.48183501721516103,1.5165051101347615,2,sr,"To je, u biti, logika Kejnzijanske ekonomije, po kojoj vlade moraju da igraju ulogu u makroekonomskoj politici pomoću instrumenata kao što su monetarni kurs i budžetska politika."
3.962555264728532,-1.465609006267033,1,pt-PT,"De acordo com dados do BA, a campanha realizada no sábado e no domingo em 1.119 superfícies comerciais representou um aumento de 19% em relação à iniciativa de Dezembro de 2007."
3.1014691664421985,-0.29496735825842735,1,pt-PT,"Sobre a possibilidade de voltar ao país de Muammar Khadaffi, Joaquim Simões da Silva diz que se houvessem “condições mínimas de segurança” regressava “já amanhã”."
0.8610591247239806,2.149094889177482,2,sr,"NATO saveznici odlučni su u nameri da pomognu Bosni i Hercegovini da se i dalje razvija, prosperira i krene ka evroatlantskim standardima"", rekao je jedan analitičar NATO krajem marta."
0.9455483271844561,2.101099889013051,2,sr,"“EK se nada da će četiri poglavlja biti otvorena do kraja nemačkog predsedavanja”, izjavila je Kristina Nađi, portparol EK za proširenje na dnevnom brifingu za novinare u petak."
4.262157222432704,0.6179993924885985,1,pt-PT,"A EDP anulou a realização de prévia de sondagens arqueológicas e levantamentos arquitectónicos da zona que será inundada com a barragem do Baixo Sabor, adiando estes trabalhos para a fase de obra, noticia o jornal Público. A intenção, refere o diário, será evitar o atraso do início da construção da estrutura."
0.31778526931455237,0.6347048831515776,2,sr,"Guler kaže da sadašnje energetske potrebe Turske iznose 88 miliona tona goriva, a 72 odsto tih potreba trenutno zadovoljavaju strani dobavljači."
2.213609969804409,-0.07147933301369104,1,pt-PT,"E, em alusão implícita ao processo Freeport, apelou ao Conselho Superior para que ""providencie pelo restabelecimento de condições para o exercício autónomo da acção penal pelos magistrados em funções no DCIAP""."
1.248490792828232,0.22633600168193077,1,pt-PT,"O pilar da acção de quem tem responsabilidades públicas só pode ser o Bem Comum, agradando ou desagradando aos eleitores, eles próprios responsáveis primeiros pela vida pública."
0.3285919494841118,1.37658528877941,2,sr,"Nemačka KfW banka odobrila je Hrvatskoj banci kreditnu liniju od 37,5 milona evra za obnovu i razvoj infrastrukture za snabdevanje vodom u blizini letovališta na Jadranskoj obali."
3.902756505267253,-1.4154872691790634,1,pt-PT,"Durante 2007 e no início de 2008, quando me bati pelo não aumento de 2% das quotas a partir de 1 de Abril passado, porque entendia que tal representava o início do desmantelamento, não fui compreendido."
1.242088617113628,0.9777243543400695,1,pt-PT,"Porém, é difícil contabilizar quantas pessoas existem empregadas no sector da solidariedade e da segurança social e que estejam interessadas em fazer parte desta associação»."
1.3050876254867834,-0.41977755518203974,1,pt-PT,"“Violações, agressões sexuais e perseguições são uma praga no Exército dos EUA”, diz Anuradha Bhagwati, directora executiva do grupo de direitos humanos Service Women’s Action Network (SWAN)."
2.2258419898824777,-0.6275481538274196,1,pt-PT,"Quando o grupo de Bancos que assinou os Princípios de Equador se organizou, nós, neste caso, até a nível corporativo, estudámos a iniciativa com muito interesse."
0.3701069035987187,0.8270609972649375,2,sr,"Najveći hrvatski investitor u inostranstvu tokom desetogodišnjeg perioda, od 1993. godine do kraja prvog kvartala ove godine, bio je farmaceutski proizvođač Pliva."
1.1933567287058073,2.8036632125451364,2,sr,"Nije ovo vaš dan, bar za većinu predstavnika vašeg znaka, naročito ne za one koji su u podznaku vazdušni ili vatreni znak. Imate utisak da vam partner nešto prigovara, možda pomalo tera kontru i pokušava da vam dokaže da ste se po nekim pitanjima o njega ogrešili. Imajte poverenja u Vagu."
0.83006401245444,2.6701077824789334,2,sr,"Savetodavna grupa od sedam država -- Australija, Britanija, Francuska, Nemačka, Španija, Izrael i Sjedinjene Države -- koja je pomagala Grčkoj da se pripremi za ovu prvu Olimpijadu od terorističkih napada na Sjedinjene Države 11. septembra 2001, odobrila je takav potez."
1.4530868800575718,0.3438337232513263,1,pt-PT,"«Portugal acompanhou o exigente ritmo de aprofundamento da integração, revelando não só vontade política, mas também efectiva capacidade reformista para se adaptar às mudanças», sustentou."
0.2908700860757699,0.7955026129037729,2,sr,Kompanija za razvoj projekta (PDC) imaće 2.100 deonica čija se pojedinačna vrednost procenjuje na 100 britanskih funti (oko 125 evra) i koje će biti jednako raspodeljene između tri zemlje.
0.17506641554512925,0.927564252806214,2,sr,"Ta deca su uglavnom lokalni Romi, ali i Albanci koji žive u siromaštvu, ali broj Roma iz Albanije je u porastu."
0.6414750099576121,1.7054174793139854,2,sr,"""Između naših naroda postoji prijateljstvo koje se neće okončati, nego će se nastaviti u vremenu i istoriji"", dodao je on, ističući da pola miliona Izraelaca dolazi iz Rumunije."
0.178808753171586,0.5923040995719157,2,sr,"Međutim, u izveštaju koji su u ponedeljak (4. aprila) objavile banjalučke Nezavisne novine takođe se postavlja pitanje pronevere i prenosi izjava bivšeg ministra pravosuđa RS Momčila Mandića od prošlog novembra."
2.9243231746254743,-0.8554550607132855,1,pt-PT,Temos feito isso quando colaboramos com órgãos de comunicação social e fazemos isto quando colaboramos com empresas na criação de prémios de excelência para os alunos.
0.15338856844522095,0.4471217943874927,2,sr,"Mada tri nemuslimanske turske manjine -- Jevreji, Jermeni i Grci -- uživaju jednaka prava po Ustavu Turske, oni su se suočavali sa periodičnom diskriminacijom."
2.511873927311822,0.07412047320339021,1,pt-PT,"A última prova, a quarta das seis da actual época desportiva, decorreu em Viana do Castelo, a 6 de Junho, na pista de Chafé, e Júlio Tendeiro foi sexto classificado, somando 47 pontos para a geral."
0.09588656533398886,0.49337160995913126,2,sr,"Podržavamo pronalaženje rešenja što pre, rešenja koje će biti prihvatljivo za obe zemlje (Makedoniju i Grčku), putem bilateralnih pregovora pod okriljem UN."
4.159490471029371,-0.010952781423617185,1,pt-PT,"O Ministério da Saúde lançou também uma nova ferramenta de avaliação do risco de epidemia nas cidades brasileiras – o Risco Dengue –, que vai indicar os pontos do país com maiores possibilidades de sofrerem com surtos da doença."
0.474539397836952,2.2346661520992175,2,sr,"Ubrzo nakon što je nestao, Gotovina je uvršten na Interpolovu listu najtraženijih osoba i objavljena je globalna međunarodna poternica za njim."
1.891976421924909,-0.4753541945055231,1,pt-PT,"Um simples fato pode custar entre 600 e 700 euros, um aparelho respiratório 1.250 euros, exemplificou, acrescentando que é neste sentido que todas as campanhas de solidariedade se tornam vitais."
