x1,x2,label,lang,texts
2.574972516465197,-0.9954652563734661,1,pt-PT,"Segundo o CDOS, prestaram socorro ao acidente sete bombeiros das corporações de Arraiolos e Évora, apoiados por quatro viaturas, e também uma viatura médica de emergência e reanimação (VMER) de Évora."
0.5013686628510281,1.617496669614339,2,sr,"Erikson je rekao da će mu ta kupovina doneti veću konkurentnost u pružanju rešenja poslovnim pomoćnim sistemima za određivanje cena, naplatu i odnose sa korisnicima."
0.42822825343572135,1.2431917349217465,2,sr,"„Ovaj istorijski predmet pripada Grčkoj i komitet će preduzeti sve neophodne korake da sačuva ovaj komad našeg nacionalnog nasleđa“, dodao je Patulidu."
1.5078983064467237,3.7749161876185955,2,sr,"On je izrazio uverenje da se rupa u budžetu može zatvoriti i dobrom fiskalnom politikom, poreskim zahvatanjem svih korisnika i suzbijanjem sive ekonomije. Na opasku da MMF i Fiskalni savet insistiraju na zamrzavanju ili smanjenjenju plata u javnom sektoru i penzija, on je istakao da Fiskalni savet ""nije vlada, nije skupština, nije partija""."
0.03621850718198627,0.18137786873810144,2,sr,"Među njima su iskorenjivanje ekstremnog siromaštva i gladi, ostvarivanje univerzalnog osnovnog obrazovanja, smanjenje stope smrtnosti kod dece, osiguravanje jednakosti polova i ženskih prava, borba protiv zaraznih bolesti i podsticanje održive sredine."
0.22719072526086656,1.1769685594731332,2,sr,"Ekonomski rast takođe je odigrao ulogu, kao i nova državna subvencija od 1.000 evra za one koji zamene automobile stare 12 ili više godina."
2.0932454952147492,0.26168280149347234,1,pt-PT,"Do esforço colectivo resultará uma maior eficácia na resposta aos problemas, a fruição da cidade pelos seus habitantes e forasteiros, uma imagem de organização e eficiência, um cartaz turístico que a neve ajuda a enriquecer."
1.2805467891412878,3.3033750502323262,2,sr,"Odlazeći predsednik sindikata železničkih radnika Nikos Kiucukis u sredu je ponovio osvoju optužbu da grčka vlada želi da pretvori OSE u ""zabavni park… otvoren samo vikendom. Ona želi da pretvori železnicu u minijaturu, svodeći je sa sadašnjih 2.600km na 800km""."
0.4027833365900445,1.8014432004093794,2,sr,"„Ekstremizam je fenomen koji traži saradnju između kriminalističkih službi i obaveštajnih agencija – ne samo širom regiona, nego i sa kolegama u EU i na međunarodnom planu“, rekao je on."
5.365402939037221,-2.053626482918563,1,pt-PT,José Francisco Gandarez fazia parte de um escritório de advogados de onde terá saído uma carta com um pedido de quatro milhões de libras para o licenciamento do outlet de Alcochete.
0.21250758681923382,0.7161683081948479,2,sr,"Ovakve tvrdnje naučnici iz jednog istraživačkog centra u Kaliforniji zasnivaju na istraživanju u kojem su učestvovale 2.264 žena, a koje su pitali o njihovom odnosu sa partnerima, prijateljima i rodbinom."
1.1037748605105338,0.6137218867265399,1,pt-PT,"A sexta maior fortuna portuguesa pertence a Alexandre Soares dos Santos, da Sociedade F. Manuel dos Santos, que também subiu três posições na lista dos mais ricos."
3.3715913162262665,0.4226684817240533,1,pt-PT,"A marcar a sessão de hoje está a suspensão em bolsa dos títulos da PT, com a Euronext Lisbon a aguardar por esclarecimentos da empresa liderada por Zeinal Bava, que deverá estar perto de um acordo para vender à Telefónica a sua posição na brasileira Vivo."
0.6688187161736208,1.4202765134815718,2,sr,"Stanovnici opštine Dragaš sretni su zbog planova, ali sela Opoje, Ćolopek i Breznes brinu da bi njihove kuće i imanja mogla da budu poplavljena akumuliranjem jezerske vode."
3.498148682138214,-1.218396511244244,1,pt-PT,"Com cinco elementos integrados nos trabalhos de várias selecções nacionais, o técnico do Olhanense, Jorge Costa, fez jogar alguns dos menos utilizados, que viram o Farense abrir o marcador à meia hora de jogo, num livre directo de Della Pasqua, que antes já tinha rematado ao poste."
7.674284947698335,-3.040997739469533,1,pt-PT,"O segundo empréstimo no valor de 5,83 milhões de euros, também de médio e longo prazo, será contraído ao Banco Português de Investimentos (BPI), por um prazo de cinco anos, com uma taxa de juro de Euribor a seis meses acrescida de um Spread de 1,375%."
0.19487360930791212,0.686968292257254,2,sr,"Među drugim mogućim opcijama su izgradnja novih podzemnih rezervoara kako bi se udvostručili kapaciteti zemlje za skladištenje gasa, kao i izgradnja novih gasovoda."
2.522674851955923,-0.13327387628718673,1,pt-PT,"Liedson falou aos jornalistas no centro comercial Almada Forum, em Almada, à margem do lançamento da bola oficial de jogo do Mundial de 2010, a Adidas Jabulani."
3.1656848959699997,-1.153895697443476,1,pt-PT,"“Não tivemos qualquer contacto directo com o navio, mas a informação que obtivemos indica que a embarcação estava, a 12 ou 13 de Agosto, a cerca de 400 milhas de Cabo Verde”."
0.15552012734871767,-0.04827725523156689,1,pt-PT,"Carlos Miguel jogou com Francisco Lopes (Gonçalo Pinheiro), Tiago Cabral, Jorge Ribeiro, Leonardo Abrantes, Diogo Amaro, Luís Carlos, José Ramos, Rui Fernandes, Gonçalo José, Ricardo Moreira e Flávio Rodrigues."
1.6793504560650923,-0.39008514321328885,1,pt-PT,"O SEF sublinha que a ocorrência, à época, se caracterizou por ser uma «acção de imigração ilegal», não existindo referência a quaisquer mandados nacionais ou internacionais, à qual foi aplicado o procedimento determinado pela legislação em vigor."
0.590857026714075,1.7429435736358465,2,sr,"Upitani da li gaje veliku nadu u budućnost svoje zemlje, preko polovine (53%) je odgovorilo pozitivno ili vrlo pozitivno, u poređenju sa 24,7 odsto ispitanika koji se ne slažu sa tim."
1.9470088099251595,0.7204438446243381,1,pt-PT,"Neste ambiente, a verdade foi ditada de cima para baixo, não raro com a face oculta sob o véu contrafeito da virtude e do serviço da grei."
0.9130195497155743,2.0372904410297443,2,sr,"Grupa radnika ovog preduzeća obratila se medijima za pomoć, jer više od mesec dana štrajkuju pokušavajući da od rukovodstva firme izdejstvuju zaostale plate, bez ikakvog rezultata i nade da će se naći rešenje."
1.104681858851612,3.102457819728839,2,sr,"Predsednik Popisne komisije Rifat Blaku rekao je za SETimes da „procenjuje da je popis bio uspešan, na osnovu međunarodne procene, sa čime se slažu i međunarodni stručnjaci“."
0.5501940880755096,1.8612876963659684,2,sr,"Ona je istakla da su neke od žrtava bile privučene lažnim obećanjima u vezi sa zapošljavanjem, dok su druge kidnapovane, a postoje i slučajevi u kojima su ih prodavale majke."
2.6087229082297907,-0.6813114201702511,1,pt-PT,"A pesquisa realizada demonstra ainda que vários alimentos foram acrescentados à refeição abençoada. Na Bíblia, apenas o pão e o vinho são mencionados nas passagens referentes à Última Ceia, no entanto, nas representações actuais surgem vários alimentos, como «taças de fruta ou bolo de cenoura», revelou Brian Wansik, um dos responsáveis pela pesquisa, em declarações à agência AP."
4.675365551423614,-1.8116783081353927,1,pt-PT,"Com cerca de 200 trabalhadores, esta unidade atingiu em 2010 um volume de negócios de 16 milhões de euros, um crescimento de 6,5 por cento em relação ao ano anterior."
3.1793698561242314,-0.9895416394516171,1,pt-PT,Ele foi a imensa participação de muitos cidadãos e de tantas boas vontades que se foram desenvolvendo e tornaram possível organizar e cumprir o vasto leque de iniciativas e actividades que deram um enriquecido sabor às nossas Festas.
3.807491768498352,-1.4314201570756062,1,pt-PT,"À excepção dos locais que o fazem de forma clandestina, todas as unidades de alojamento estão obrigadas por Lei a enviar para o Serviço de Estrangeiros e Fronteiras (SEF) o registo de entrada e saída dos hóspedes estrangeiros."
1.4009612280530048,0.1578080331140528,1,pt-PT,"“Dada a importância económica da China nos nossos dias, este é um passo importante em vários domínios bancários, como pagamentos e aberturas de contas”, afirmou Ulrich."
2.3984515694406197,-0.08149966708689872,1,pt-PT,"Ainda assim, a presidente da confederação sublinha que ""os pais continuam a ser os grandes educadores"" e, por isso, devem estar atentos para evitar que os filhos sejam vítimas de qualquer abuso profissional."
3.591020958158917,-1.3878503425985003,1,pt-PT,"Novos projectos para reabilitação de cais No passado, a utilização dos esteiros e canais para transporte de pessoas, gado e mercadorias implicou a construção de múltiplos cais de acostagem junto dos principais núcleos populacionais."
0.7396059761836489,1.779550021103788,2,sr,"Međutim, mediji u Beogradu izvestili su nedavno da sporazumi nisu usvojeni jednoglasno, jer su neki članovi vlade rekli da su delovi sporazuma u suprotnosti sa zakonima Srbije."
1.074266225258829,-0.28413274914028985,1,pt-PT,"“Os bancos vão emprestar mais dinheiro, especialmente aos negócios mais pequenos, pagarão mais impostos e menores bónus, serão mais transparentes quanto aos prémios que pagam e farão uma maior contribuição para a nossa economia”, disse."
2.131742329826876,-0.4528800014947494,1,pt-PT,Em dúvida para o encontro com o Sporting está o médio Emerson que prossegue tratamento ao traumatismo na grade costal que o tem impedido de trabalhar com o plantel.
1.5833625927091526,0.2083606819796592,1,pt-PT,"”Há pessoas que não vêem este modelo com bons olhos, porque pensam que o centro da Zibreira vai ficar com a gestão, mas avançar com este modelo é não correr riscos."
1.5712680955913885,-0.3350238055678609,1,pt-PT,A nova associação surge numa altura em que se assinalam 100 anos de turismo em Portimão e reúne desde as micro às grandes empresas.
2.1191999052204107,0.6670700276718333,1,pt-PT,"No sector desportivo, a aposta vai ainda no sentido de fazer «no mínimo» seis marchas anuais em diferentes locais da região, do país e da Galiza."
7.195101719533641,-1.4211458150519103,1,pt-PT,"O Governo austríaco concedeu recentemente uma ajuda de 200 milhões de euros à Austrian Airways, prévia ao negócio de venda da companhia austríaca ao gigante alemão Lufthansa. No entanto, Bruxelas levantou ""dúvidas"" sobre a medida adoptada pelo Governo austríaco de assumir 500 milhões de euros de dívidas da Austrian, que no total tem um passivo de 1,5 mil milhões."
0.01018840304228246,0.04435550737754,2,sr,Češki predsednik Vaclav Klaus (levo) i hrvatski predsednik Stipe Mesić vrše smotru počasne garde u ponedeljak (13. novembra) u Praškom dvorcu. [Geti Imidžis]
1.2534044109989297,-0.1597933927677477,1,pt-PT,"A floresta é uma das fontes que mais riqueza gera no concelho, e queremos que os mais jovens se apercebam disso"", disse a mesma responsável."
3.0968460061237897,-1.2180476219191814,1,pt-PT,"Ao contrário dos bancos franceses, no Reino Unido a menor exposição era precisamente ao sector público (2,6 mil milhões de dólares) seguida dos bancos (6,2 mil milhões), sendo a maior às empresas, no valor de 16,5 mil milhões de dólares."
1.6491262550489563,-0.5572112615362775,1,pt-PT,"Edifício Foz Diogo Botelho tem andar modelo A CB Richard Ellis (CBRE) anunciou a disponibilização em Março de um andar modelo do Edifício Foz Diogo Botelho, um empreendimento com vista para o rio Douro."
0.29791114445478695,1.207322141216378,2,sr,"Prema saopštenju EU, na osnovu informacija koje je pružila Hrvatska i znatnog napretka postignutog u pripremama u svim relevantnim oblastima, Unija ne vidi potrebu za daljim pregovorima o ta dva poglavlja."
0.009690127281008295,0.048570893953322765,2,sr,«Komunitarne propise o životnoj sredini nije lako sprovesti i ostvarivanje standarda u toj oblasti zahteva visoke troškove javne administracije i privatnih kompanija».
3.6218293725896666,-0.5746299816476282,1,pt-PT,"Os seguros PPR, que perderam parte do benefício fiscal, são a mais popular O Governo está a trabalhar com o Banco de Portugal para aumentar a oferta de produtos de poupança da banca."
0.1428368107321426,0.7744598236356252,2,sr,"Sve izraženiji nedostatak radne snage vidljiv je u raznim sektorima, u kombinaciji sa znatno višim stopama rasta BDP-a (u poređenju sa “Starom Evropom”)."
4.005906919213708,-1.5018010799374357,1,pt-PT,"No ano passado, as receitas do grupo de telecomunicações atingiram os 60,74 mil milhões de euros, mais 7,1%, tendo o resultado operativo antes de amortizações (OIBDA) aumentado 14% para 25,78 mil milhões de euros."
3.8554894235828026,-0.7097832675497283,1,pt-PT,"Em Dezembro, as quedas acentuadas registadas nas dormidas da hotelaria nacional reflectem principalmente o comportamento negativo dos não residentes, com um decréscimo de 14,4 por cento face a igual mês de 2007, já que a redução junto dos residentes foi de 4,5 por cento."
1.5624428890984825,-0.48810005492533154,1,pt-PT,"“Alguns, quando falam do mar, hoje, não é para o seu aproveitamento ao serviço dos interesses nacionais, é porque vêm nele mais uma área de negócios”, sustentou."
2.4049433385304133,0.1909917617600551,1,pt-PT,"Esta previsão de retoma ""modesta"" e ""frágil"" resulta da forte aceleração do comércio mundial, que deverá estimular as exportações europeias. Este é igualmente o indicador que está na base no modesto crescimento em Portugal."
0.7057724917852655,-0.19856643468658727,1,pt-PT,"Autores como Ware, Sacco ou Clowes estão entre os novíssimos influentes, enquanto que novos talentos como Tom Hart, Craig Thompson, Brian Ralph ou James Kochalka merecem uma atenção especial."
0.9206085923679406,2.409594342785596,2,sr,"Kako prenose mediji na Apeninima, da bi ubedili crnogorskog asa, spremni su da mu ponude i legendarni dres sa brojem 10, koji je slobodan posle odlaska Alesandra Del Pjera."
2.206995043400388,1.0258546115531728,1,pt-PT,O arranque desta iniciativa municipal de sensibilização para a preservação florestal teve lugar na data em que se celebra o Dia da Árvore e o Dia Mundial da Floresta.
3.665263931603598,-0.4519846601286992,1,pt-PT,"Quando, há uma dezena de anos, se realizou o referendo sobre a regionalização, muitos temeram que o resultado negativo que se verificou fosse o fim de qualquer reforma do Estado ou, pelo menos, o seu adiamento sine die. Como se vê, não se enganaram os que assim pensavam. Entretanto, o Mundo não esperou e mudou. E mudou muito."
1.546988692032188,4.403174917685555,2,sr,"Posle sastanka 15. juna između Gordona i srpskog ministra inostranih poslova Vuka Jeremića, Beograd je objavio zvanično saopštenje u kojem se navodi da je u razgovorima naglašeno da su bilateralni odnosi popravljeni i da je Jeremić obavestio Gordona o zahtevu Srbije za sprovođenje međunarodne istrage povodom tvrdnji Dika Martija o trgovini ljudskim organima na Kosovu."
0.7876325953012893,3.134285406518963,2,sr,"Čonevski navodi još jedan faktor koji smatra ključnim za uspeh. „Vizna liberalizacija veoma je važna za sve nas, to je ogroman i veoma pozitivan korak.“ Statistike iz 2011, najsvežije koje postoje, pokazuju da je granice u regionu uskoro više neće biti faktor u smislu turizma."
3.2005523669745926,-0.9291811884133772,1,pt-PT,"O presidente do IGEPE, Hipólito Hamela, diz que a decisão de o Estado moçambicano se retirar das empresas visa ""melhorar a capacidade de controlo das participações estatais, bem como das empresas participadas pelo Estado, de modo a serem mais lucrativas""."
0.22148621756952444,0.4447990872632294,2,sr,"Ključnim predlogom poziva se na uspostavljanje zone slobodne trgovine koja uključuje Albaniju, Bosnu i Hercegovinu (BiH), Hrvatsku, Makedoniju i Srbiju i Crnu Goru, uključujući Kosovo."
0.8480308525338139,2.0702002404054496,2,sr,"U svom poslednjem izveštaju, ministarstvo je utvrdilo da 11 od 72 plaže ne ispunjava standarde i savetuje ljude da se klone tih plaža."
1.4784058355315186,-0.33398445355398765,1,pt-PT,"Com todas essas apreensões policiais e investigações, não é de admirar que o país tenha chegado onde chegou, só não percebo porquê só agora se desencadearam todos esses processos."
1.9013965141734217,5.415379310851918,2,sr,"Međutim, Meta -- koji je takođe bio premijer od 1999. do 2002. godine, a sada je na čelu malog Socijalističkog pokreta za integracije (SMI), koji je deo albanske vladajuće koalicije -- uveren je da je „traženjem detaljne presude u ovom slučaju postavio nove standarde demokratskog ponašanja u Albaniji, preko [moje] momentalne ostavke, odricanja od poslaničkog imuniteta i kroz rešenost da idem do kraja sa svim optužbama koje su podnete protiv mene“."
2.5026130376994105,-0.8012721736273094,1,pt-PT,"Aqui está matéria que deveria merecer a preocupação séria do Governo e, por maioria de razões, do seu representante no distrito, o Sr. Governador Civil de Braga."
0.35761594798739316,1.983157859931331,2,sr,"Bivši premijer Ivan Kostov, koji je osnovao DSB krajem maja, optužio je vladajući Nacionalni pokret za Simeona II (NMS) i njegovog manjeg partnera, Pokret za prava i slobode (MRF), za slabljenje Bugarske i neispunjavanje predizbornih obećanja."
1.0548509463905729,-0.38813212396286173,1,pt-PT,"Foram ainda editados discos de GNR, Laurie Anderson, Lady Antebellum, David Guetta, em colaboração com a sua mulher Cathy, Horse Feathers, The Acorn e Mountain Man."
0.6664488986839644,2.161183556738946,2,sr,Turski ministar inostranih poslova Abdulah Gul rekao je da je uspostavljena veza između bombaških napada na dve istanbulske sinagoge u subotu i organizacije sa sedištem u Avganistanu.
0.4755065551749928,1.4901454563998682,2,sr,"Hrvatska premijerka Jadranka Kosor i članovi vladajuće Hrvatske demokratske zajednice (HDZ) odmah su napali tu izjavu, a Kosorova je ukazala da su te reči predstavljale kršenje Ustava Hrvatske."
4.557737597042996,-0.32395663872191705,1,pt-PT,"Maria José, uma professora de 48 anos, foi uma das voluntárias que despendeu cinco horas da tarde de sábado para estar presente no palco gigante da Praça Marquês de Pombal e dar forma aos muitos quilos de ingredientes."
0.43607516887557923,0.9176500869811152,2,sr,"Jadanaest zemalja centralne i istočne Evrope (CEE) složilo se u sredu (24. februara) da uspostavi gasni sistem sever-jug-istok, koji bi pomogao diverisfikaciju izvora snabdevanja i puteva i ojačao energetsku bezbednost u regionu."
3.4524582971596454,-0.3585420510124292,1,pt-PT,"O programa inclui uma prova sensorial das Tortas de Guimarães, a decorrer na tarde de sábado, no Salão Nobre da Câmara Municipal e animação musical com os Famaquarteto, o grupo Música Canto Vocal, no sábado e o Grupo de Fados Cidade Berço, no domingo."
0.5643295738591724,2.0161187064741877,2,sr,"Profesor Beogradskog univerziteta i saradnik Instituta društvenih nauka Dejan Vuk Stanković izjavio je za SETimes da je, prilikom donošenja te odluke, Tadić imao u vidu i državne i stranačke interese."
1.9693760400281006,-0.0007674072202635343,1,pt-PT,"Com a deterioração da actividade económica, a taxa de desemprego deve ter subido no primeiro trimestre para 8,4%, mais 0,6 pontos percentuais que no trimestre anterior."
0.29349021576380746,0.8129906162676356,2,sr,Dokumentom -- zasnovanim na planu bivšeg specijalnog izaslanika UN Martija Ahtisarija o nezavisnosti pokrajine pod nadzorom EU -- određuje se rok od 120 dana za nove razgovore između lidera Srbije i kosovskih Albanaca.
1.900771862831555,-0.2941336696681584,1,pt-PT,"Os concertos na sala principal do Teatro Virgínia têm o preço de 5 euros, ficando apenas 15 euros, no caso do bilhete para todos os espectáculos."
1.1279222515504992,-0.3112499221334089,1,pt-PT,"Foi o segundo destes ""skiffs"", que rumava a noroeste, com seis suspeitos, que a fragata portuguesa conseguiu interceptar, já em plena noite, conforme o relato telefónico hoje feito ao PÚBLICO pelo comandante Santos Fernandes."
0.7230866596421697,1.709299596924523,2,sr,"I dok ""paralelne strukture"" koje uživaju podršku Beograda mogu da obavljaju neke birokratske i pravosudne poslove, ne predstavljaju stvarnu, svakodnevnu vlast i ne mogu da reše neke male probleme vezane za privredu, izdavanje građevinskih dozvola, nadzor trgovine ili izgradnju škola, kaže Repić."
1.1861618705636983,3.2010016651794175,2,sr,"""Naša je greška što mi u DSB nismo pokušali da ubedimo UDF da nastavi da radi zajedno sa nama posle predsedničkih izbora prošle godine"", rekao je Kostov."
1.437062571520356,-0.45253067314097084,1,pt-PT,"""As operações de política monetária em questão foram executadas em nome do Eurosistema por três bancos centrais nacionais, nomeadamente, Deutsche Bundesbank, Banque centrale du Luxembourg e Nederlandsche Bank""."
2.6394184527329516,0.4564207217579697,1,pt-PT,"A mostra ""500 anos ao serviço da vida"" pretende contar a história da instituição bracarense, recorrendo a algumas personagens do passado e utilizando mais de uma centena de peças, entre imagens, quadros, pinturas, utensílios e mobiliário."
0.17188417224206423,0.5079458304630193,2,sr,"Ovaj pametni telefon sadrži dvojezgarni Texas Instruments procesor od 1,5 GHz, uz dodatni grafički procesor PoverVR SGX540 i radi na Android 4.0.3 platformi. Kamera od 8 megapiksela ima mogućnost 1080p snimanja, kao i opcioni 3D interfejs."
2.465930218209457,0.4345550228869241,1,pt-PT,"Os empregadores Espanhóis tinham entre si 28 por cento de pessoas com formação superior, face a 27 por cento na UE. E, também neste caso, o peso dos menos qualificados era quase o dobro do que na média da UE."
0.019021479708235894,0.1008403807440993,2,sr,"Pored stalne postavke dela međunarodnih i hrvatskih savremenih umetnika koja datiraju iz pedesetih godina, biće postavljene i privremene izložbe, poput filmova, pozorišnih predstava i koncerata."
4.681717440718168,-1.06988057500188,1,pt-PT,"“Sempre dissemos que a questão se resolvia aqui, em sede de Comissão Parlamentar, e estivemos à espera de propostas. Não vale a pena atirar areia para os olhos das pessoas”, afirmou o deputado, sublinhando que o PSD sempre se mostrou pela universalidade na cobrança de portagens, mas com “medidas de discriminação positiva”."
3.9411652503627743,-1.4676424321252388,1,pt-PT,De acordo com a comissão há indicadores que levam a interpretar que a curto prazo o número de clínicos no Centro de Saúde de Torres Novas vai ser reduzido.
4.407419662384384,-0.8292262257432297,1,pt-PT,Ao longo deste Meeting foram batidos noves recordes e teve uma participação brilhante com 443 nadadores. Colectivamente venceu a equipa italiana da Lombardia seguido do FC Porto. A prova foi organiza pela Associação de Natação do Norte de Portugal e Câmara Municipal. Aliás esta foi a primeira grande competição em piscina de 50 metros sem fatos de poliuretano.
0.2184386654795534,1.2278614251069169,2,sr,"Podsetimo, uhapšeni Kostić je u novogodišnjoj noći izbo Dejana V. i njegovog druga Lazara I., a prilikom bekstva izbo je još petoro ljudi i to dvojicu Tunišana, Slovenca i državljanina Bosne i Hercegovine."
0.5044723255370861,2.4332697447584932,2,sr,"Dizajnirao ga je Mimar Koča Sinan (1489-1588), koji se smatra najboljim arhitektom Otomanskog carstva, i jedan je od šest mostova koje je on gradio i koji su očuvani."
1.1386861321865027,-0.1353932561399968,1,pt-PT,"Naturalmente, se mantivermos os que lá estão, continuaremos a ser dos piores, para mudarmos esta situação é preciso que o Partido Socialista ganhe estas eleições autárquicas."
3.9397595159676073,0.21118478201263316,1,pt-PT,"Ainda na freguesia de Lapas, a comitiva visitou a Quinta da Silvã e aí os campos de ténis mereceram a primeira observaçã encerrados que estão, fica impedida a prática da modalidade às muitas dezenas de tenistas que, em Torres Novas, a praticavam."
2.6593518344523908,-0.24717308341300348,1,pt-PT,"A economia paralela anda da ""mãos dadas"" com a fraude, que representa entre 1,5 e 2,0% do PIB, ou seja, entre 2.745 milhões de dólares e 3.660 milhões de dólares, refere o estudo."
2.6611979529719534,0.6913347318967099,1,pt-PT,"""Penso que os deputados ficariam mais esclarecidos se quem conduziu o processo de negociação pudesse prestar esses esclarecimentos"", afirmou, acrescentando que ao presidente da SATA caberia esclarecer os deputados sobre questões relacionadas com ""a gestão da empresa""."
0.5787143718252209,2.0749572418914304,2,sr,"Potpredsednik vlade Abdulatif Sener izjavio je da ova poslovna grupa duguje SDIF-u ukupno 1,6 milijardi dolara u dugovima vezanim za Iktisat Bankaši, ali je otplatila samo 75 miliona."
3.0669593093917222,-0.8029522661540534,1,pt-PT,"Entre os projectos do novo director estão a sua reclassificação como museu nacional, pois considera que se trata de “um equipamento cultural incontornável no contexto do nosso país e com um enorme potencial de expressão internacional”, disse à Gazeta das Caldas."
3.392563639442616,-1.219105736180935,1,pt-PT,Os próprios técnicos que elaboraram o Estudo de Impacto Ambiental (EIA) admitem que precisavam de mais tempo para monitorizar o terreno e de um suporte geomorfológico mais actualizado.
3.637258901715079,-0.717856144934069,1,pt-PT,"“Estou bastante satisfeito. Como todos ouviram, esta atribuição de mais uma partida é a demonstração da capacidade de organização de grandes eventos por parte de Portugal”, considerou."
0.5817855318378489,-0.1759338774357925,1,pt-PT,"Esta indecisão sobre com quem vai ficar a protagonista é essencial no enredo, mas não tem o suspense necessário para prender o espectador neste ponto."
