x1,x2,label,lang,texts
0.02389390153429221,1.6989833185051306,2,cz,"A potom jsem přijel domů a otevřel jsem si Internet a zjistil jsem, že tady zuří diskuse mezi mluvčím, jedním z mluvčích nebo zástupcem mluvčího na Hradě Petra Hájka, který napadl evolucionisty a řekl, že nepochází z opice."
0.4983049009731888,0.01023319775741806,1,my,Sebanyak 32 peratus pula menjangkakan peperangan mengambil masa sebulan hingga tiga bulan manakala 13 peratus menjangkakan ia akan berakhir dalam dua hingga empat minggu.
1.5831526134379863,-0.019344580362487297,1,my,Beliau juga mempersendakan dakwaan AS bahawa tentera bersekutu akan disambut dengan tepuk sorak oleh rakyat Iraq yang gembira kerana tentera AS telah datang untuk `membebaskan' mereka daripada Saddam.
1.751875816872519,-0.012073491873814176,1,my,"Pengerusi persatuan ini, Mustafa Ab. Rahman berkata, pihaknya akan mengedar dan menampal 5,000 poster Sharlinie di sekitar kawasan perhentian bas, teksi, pasar raya serta kawasan tumpuan umum di Kuala Terengganu mulai pukul 2 petang esok."
0.456239963749697,-0.003264890587176198,1,my,"Berkat dapat izin sebelum mengail PETUA kaki pancing Terengganu, Alwi Ali, 52, iaitu pastikan setiap kali keluar rumah untuk memancing ialah beritahu isteri atau keluarga, begitu juga majikan."
0.12863140038362364,0.017414995011179615,1,my,Iya mansutka jaku nya ;ebuh ditanya pasal niat Parti Keadilan Rakyat (PKR) enggau Parti Kebangsaan Sarawak (SNAP) ti deka ngeletakka pengari sida betanding ngelaban pengari BN ba sitak engkilili ba atur bepilih nengeri ti deka datai.
0.005895514027633708,0.45495963049353855,2,cz,"Z průzkumu, který firma Ernst & Young vypracovala mezi finalisty prvních tří ročníků Podnikatele roku, vyplynulo, že 70 procent z nich získalo účastí v soutěži zajímavé kontakty."
2.20669211760871,-0.02257031200129858,1,my,Tidak setuju kerana dalam menjalin hubungan tidak perlu timbul isu ini. Seorang lelaki perlu mempunyai hati yang ikhlas dalam menjalinkan hubungan. Setiap keburukan yang kita lakukan pasti akan mendapat balasannya kelak.
1.8443863047047457,-0.023024527139471885,1,my,"``Tidak lama selepas berehat sehari, tentera bersekutu menyerang stesen utama Iraq dan pusat telekomunikasi utama dan satelit komunikasi bagi menjejaskan kemampuan pemerintahan rejim itu mengawal negaranya,'' kata seorang pegawai AS di Washington."
0.004872841670860952,0.616275597668188,2,cz,"Příjmy stouply o čtvrtinu na 2,76 miliardy dolaru, protože více lidí využívalo služeb PayPal i eBay.com. Tržby internetových obchodů, které zahrnují mimo jiné stránky eBay."
1.0809438905888644,0.008097576055502353,1,my,"2. Lebih banyak dialami bayi pramatang iaitu lapan orang bagi setiap 1,000 kelahiran 3. Ia turut berlaku di kalangan bayi cukup bulan iaitu nisbah dua orang bagi setiap 1,000 kelahiran 4. Lebih banyak dialami bayi perempuan berbanding lelaki."
0.46051959973375806,-0.007673644048695482,1,my,"Dalam bidang kokurikulum Mohamad berkata, tahun lepas SMK Sibu Jaya telah menempa beberapa kejayaan termasuk muncul juara Kejohanan Hoki Majlis Sukan Sekolah Menengah (MSSM) Peringkat Sibu."
0.012179285029153277,0.4406909506063864,2,cz,"Od dostavění této čtyřproudové silniční tepny si slibujeme příliv investorů do dalších koutů kraje, rozvoj realitních příležitostí a zlepšení života pro obyvatele,“ dodává hejtman kraje Lubomír Franc."
0.008514704810179335,1.1987334729238628,2,cz,"Odškodnění se vyplácí z pojistek odpovědnosti Traktorista v západních Čechách při parkování doma špatně traktor zabrzdil, ten se rozjel a svojí tíhou zbořil kus nemovitosti vedle stojícího domu."
1.5561343126239597,-0.015884273588584536,1,my,"``Kadangkala pentadbiran Bush tidak mengetahui apa yang dikatakan, kami menyatakan tolong buktikan,'' kata Farouq pada sidang akhbar bersama dengan Menteri Luar Perancis, Dominique de Villepin di sini."
0.7577700878282646,-0.008840070506643006,1,my,"''Mungkin kami memerlukan lebih motivasi untuk berdepan Jerman, namun saya tidak kisah siapa kami akan jumpa pada perlawanan berikutnya,'' kata pemain pertahanan Laurent Blanc."
1.9024351767811325,-0.021121860676286054,1,my,"Lee berkata, walaupun perbuatan merosakkan harta awam di Malaysia tidak seteruk seperti di kebanyakan negara Barat, namun ia tetap merupakan masalah serius yang perlu ditangani secara berkesan."
0.008200780333744615,1.0988038919293424,2,cz,"Do oka na sítnici mu byla voperována sada drobných elektrod, která tenkým kabelem přijímá elektrické impulsy z procesoru, umístěného na obrubě speciálních brýlí s minikamerou."
0.04366152622497458,1.1791898406427226,2,cz,"Diskuze je k tomu, aby tu každý mohl vyjádřit svůj názor, tak nevím proč si myslíte že si tu nadávám od plic bez přemýšlení."
0.03113534418413647,2.9910931315551563,2,cz,"Představme si, že babička čte nebo maminka čte dítěti pohádku,kde skutečně se rozlišuje to dobro a zlo, krása a ošklivost, a pak se to dítě posadí před televizi, kde má ""pohádku"" o tom, jak šel tunel na procházku k pětiúhelníku a přejely ho povidla."
0.01062595600572655,1.2811562952881084,2,cz,"Jedna kontrola na podzim 2000, zaměřená přímo na úvěry spřízněným osobám, zjistila, že banka obchází limity úvěrové angažovanosti a porušuje Opatření ČNB o klasifikaci pohledávek."
1.447890499014635,-0.017010964969699328,1,my,"Selepas itu, Timbalan Perdana Menteri dijadual bertemu masyarakat Lawas pada majlis Pemimpin Bersama Rakyat di Stadium Tertutup Lawas sebelum berangkat meninjau pembangunan bandar Lawas dan Hotel Seri Malaysia."
4.005002941917544,-0.0376157068378392,1,my,"Jalur ini juga menggambarkan satu haluan yang lurus, hala tuju yang sama dan arah yang sama yang dipegang oleh rakyat negara ini dalam menuju kegemilangan bangsa dan negara."
0.03334161935692379,2.6190573722307007,2,cz,"Špičky ODS, veřejné i skryté, se za každou cenu snaží zmanipulovat veřejné mínění tak, aby se jejich stranický problém stal i problémem Věcí veřejných. A to především jejich předsedy Radka Johna, který měl o manipulaci na SFŽP údajně vědět ještě dříve než premiér Petr Nečas."
1.386907907466424,-0.014248040821049487,1,my,"``Malah dulupun banyak yang beranggapan orang Melayu tidak mampu menjadi Menteri Kewangan setelah Tun Tan Siew Sin, tetapi kini orang Melayu dapat membuktikan tanggungjawab itu dapat dipenuhi dengan cemerlang,'' ujarnya."
1.3614872657796964,-0.017326369108075706,1,my,BN menurunkan muka baru Malcolm Mussen Lamoh untuk berhadapan dengan ahli politik veteran Jawah Gerang dari PKR dalam pilihan raya kecil yang diadakan ekoran kematian penyandang Datuk Dublin Unting Ingkot pada 24 Feb lepas.
0.8287051590303302,-0.009714437895201936,1,my,"""Banyak bekas pelumba dan pelumba Formula 1 sekarang memulakan kerjaya mereka dengan memandu go kart, termasuk juara dunia tujuh kali Micheal Schumacher, Ayrton Senna, Alain Prost, Fernando Alonso,"" katanya."
0.009464068479600315,1.2630579686135253,2,cz,To všechno spolu s desítkami dalších ztracených a nalezených věcí odpočívá v krabicích na informačních centrech a městských úřadech měst a obcí na Vyškovsku.
1.865208106606066,-0.024631295727299864,1,my,"Ini kerana katanya, polisi membuli yang melampaui batasan kedaulatan negara oleh kuasa besar telah dialami sendiri oleh Vanuatu hingga menyebabkan sistem percukaian dan politik republik itu terjejas."
1.5834216192916886,-0.010018601272227815,1,my,"Syarikatnya menyediakan khidmat kargo bagi barangan umum seperti elektronik, peralatan kapal dan kapal terbang, serta mesin ke pelbagai negara di dunia termasuk Afrika Selatan, Canada dan Perancis."
1.9036577174262788,-0.026332407490227798,1,my,"""Bukan kedudukan saja yang penting, tapi yang paling penting ialah kekuatan otot pelvik seseorang. Bagaimanapun, kemungkinannya lebih besar (bagi sesuatu objek dikeluarkan dari tubuh) jika seseorang itu mencangkung. Ketuk ketampi akan hanya menghapuskan keberkesanan mencangkung,"" katanya."
0.9922955651240037,-0.012919502068889165,1,my,"'Saya begitu gemarkan sukan bola sepak. Cara pasukan bermain, keghairahan menyumbat gol... ia sukar digambarkan. Hanya peminat bola sepak akan memahaminya,' ujarnya, yang juga Presiden Persatuan Bola Sepak Singapura (FAS)."
2.765918558054722,-0.03412687310312329,1,my,"Oleh itu, untuk anda yang ingin mempunyai tubuh dan kulit muka yang sihat, simpan sebotol atau secangkir air di atas meja atau berhampiran dengan anda setiap masa."
0.01305773606949291,1.785109482758574,2,cz,"Inkluzivní vzdělávání tedy znamená, že se handicapovaní žáci, děti cizinců nebo příslušníků jiného etnika neposílají do speciálních škol, ale vzdělávají se spolu s ostatními dětmi v klasické základní škole."
2.389363294785846,-0.03000014888734086,1,my,Konvensyen Geneva mengatakan negara penakluk tidak boleh menggunakan hasil pendapatan negara yang ditakluk untuk pembangunan semula tetapi hanya untuk sesuatu yang bermanfaat kepada rakyat negara itu sendiri.
1.1515415510642613,-0.01522841695244902,1,my,"""Falsafah Pendidikan Kebangsaan juga yang mahu para pelajar serba boleh turut akan dapat dicapai, termasuk hasrat kerajaan untuk memiliki modal insan bertaraf dunia,"" katanya."
1.526226247602199,-0.018264453702493334,1,my,"Kemenangan DAP semalam membolehkan parti itu menambah kerusi Parlimennya di Sarawak kepada dua, selepas menang di Parlimen Bandar Kuching pada pilihan raya umum lalu."
1.7494331696786687,-0.020886950811886507,1,my,Kamaruddin dijangka tidak menghadapi masalah untuk mengutip pingat emas pertama negara berdasarkan kepada pencapaiannya di peringkat antarabangsa termasuk muncul juara Kejohanan Ekuestrian FEI Terbuka Australia yang berlangsung pada bulan April lalu.
1.1606483616404941,-0.015184024536533714,1,my,"Salah satu daripada tuntutan dalam ibadah haji bagi jemaah yang berkemampuan adalah melakukan korban dengan menyembelih haiwan ternakan seperti kambing, lembu atau unta sebagai tanda kesyukuran."
0.01645000710418548,2.229709963817992,2,cz,"Soutěží nejen pro malé chlapce se může stát také závodění na autodráze, od jednoduchých dřevěných typů nebo koberců s kresbou města a cest, kde je nutné autíčko ručně vést, po závodní dráhu na dálkové ovladače aut."
0.007373940267085642,0.9606562305325678,2,cz,"Už v minulosti přitom vědci dokázali, že muži, kteří po posilování vypijí dvě sklenice mléka, zhubnou výrazně rychleji tuk a přitom rychleji přibývají na svalové hmotě."
0.47270537614519653,-0.004035009578938369,1,my,"Sebagai rekod, Hup Wei kini menduduki ranking ketujuh dunia dalam acara lompat tinggi selepas dia melakukan lompatan setinggi 2.27 meter pada Grand Prix (GP) India, Julai lalu."
1.3822412915382718,-0.015777600503277457,1,my,"The Star difahamkan, Khalid Ibrahim telah melantik Setiausaha Politiknya, Nik Nazmi Nik Ahmad yang juga Adun Seri Setia untuk menguruskan peruntukkan pembangunan bagi Dun Pelabuhan Klang sejak tersebarnya cerita kononnya Badrul tidak sihat untuk melaksanakan tugas sebagai wakil rakyat."
0.009175141228464795,1.2359858954435943,2,cz,"Summit v Nanjingu by měl přinést další posun v těchto jednáních a očekává se, že by finální podobu dokumentu mohly obě strany podepsat příští rok."
0.02456457787550537,3.3498443835559186,2,cz,"Řidičovým pocitům také prospělo opuštění pevného středu volantu, který sice zlepšoval bezpečnost, ale ovládání jinak spíše komplikoval. Místa je vpředu hojný dostatek u obou verzí, specialitou pětidveřové je obří čelní okno, sahající až nad hlavy posádky. Lze jej zastínit výsuvnou roletkou, nebo se kochat panoramaty, ať už přírodními, či městskými. Nedocenitelné to je také při stání hned pod semafory. Vzadu se dá také překvapivě dobře sedět, avšak pod střechou je poněkud stísněně."
2.283335701324501,-0.03183444923762272,1,my,"Katanya sejak mencetak dokumen dan menyerahkannya kepada polis, tiada sesiapapun dari syarikat Cyber Sequrity menghubunginya berkenaan isi kandungan maklumat itu dan beliau hanya menyedari perbezaan di dalam dokumen itu semalam ketika disoal balas oleh Kuldeep."
0.010559099363817787,1.4335422490205403,2,cz,"Ta by měla podle komisaře plodinových burz Jiřího Baumrukera především umožnit derivátové obchody bez finančního vyrovnání, které tvoří všude na světě více než tři čtvrtiny veškerých obchodů se zemědělskými surovinami."
0.023636343334113706,1.6416563921438099,2,cz,"Analytici si myslí, že nabízená cena 100,75 zlotého (627 korun) za akcii, což je 13 procent nad pondělní závěrečnou cenou na varšavské burze, je příliš nízká."
0.018009133042304906,1.974535034717802,2,cz,Brněnské dny pro zdraví se zaměřují zejména na pohyb Od 25. září do 4. října se koná jubilejní 15. ročník Brněnských dnů pro zdraví.
0.012648685921899857,0.9354014500276513,2,cz,"Úterý 6. 9. 2011, svátek má Boleslav Ze sprosté Kočí je šlágr Blonďatá bestie. Klasnovou rozesmál Kontroverzní rozhovor poslankyně Kristýny Kočí se členem Věcí veřejných Lukášem Víchem nenechal lhostejnými divadelní umělce."
0.5978857581687594,-0.007725176437619459,1,my,"c) Bagi Y.B. Dato Marsum bin Paing (ADUN Dengkil), penggantungan daripada perkhidmatan Dewan selama enam (6) bulan dan dipotong semua elaun serta kemudahan bulanan selama enam (6) bulan."
1.584802615702321,-0.008240772318677824,1,my,"Penahanan mereka yang berusia antara 20 hingga 40 tahun itu turut melibatkan dua pemandu syarikat minyak swasta, seorang pemilik tangki minyak haram dan seorang pekerjanya."
0.13157633364431892,-0.0010376800442618,1,my,Kontroversi pemilihan Hadiah Nobel KENAPA gerangan Hadiah Keamanan Nobel kadang kala mencetuskan kontroversi berpanjangan seperti berlaku kini setelah Liu Xiaobo dari China dipilih menerimanya.
0.0121218851187853,1.5444373467018262,2,cz,"Prostořeká textařka se totiž sbalila a na měsíc zmizela z Česka, aby načerpala síly před prvními živými přenosy. Společnost jí ale podle všeho nedělá manžel, hudebník Ondřej Soukup (59), ale její bulharský milenec Mirek Mirčev (31)."
0.012103526483867205,1.61843812385391,2,cz,"Jednou mi na Svazarmu (tehdejší polovojenská organizace řídící u nás mimo jiné motoristický sport – pozn. redakce) řekli, že jsem moc mladý a do ciziny se ještě najezdím."
0.005492981606912943,0.47783931399626306,2,cz,"Právě ona – za Kaddáfího vdaná již čtyřicet let – teď ale podle britské vlády nejspíše funguje jako ""sponzorka"" bitev libyjského vůdce, jehož konta jsou zablokována."
0.009304999771416906,1.2511439006442637,2,cz,"Podle Asociace českých cestovních kanceláří a agentur se ale nyní ukazuje, že důvodem byla spíše jejich cenová výhodnost vzhledem k naší nízké životní úrovni, nikoliv skutečný zájem o tento způsob trávení dovolené."
0.009007051648614553,1.182453212332428,2,cz,"Obyčejně se říká, že ho objevil britský badatel Arthur Evans, ale hliněný kopec nad roklí začal jako první rozhrabávat jistý Minos Kalokerinos z Heráklionu."
0.02068145694437393,0.9361027099215447,2,cz,"Tato varianta vyžaduje minimální náklady jak finanční a personální, tak zejména legislativní, neboť by se jednalo pouze o rozšíření současných deliktů v rámci zákona o zadávání veřejných zakázek."
0.020689231649460408,1.9345005462327627,2,cz,"Richard HINDLS, rektor Vysoké školy ekonomické v Praze Já jsem 10 let nebyl potom ve škole, ale celou dobu jsem učil, měl jsem externí úvazek, nějaké hodiny na dohodu, jak se tomu dneska říká, takže jsem vlastně nikdy učit nepřestal."
3.117872879291916,-0.040814163341922824,1,my,"""Penyertaan mereka dalam pameran ini telah membantu untuk mengembangkan aspirasi yang lebih besar dan pemahaman tentang realiti Indonesia hari ini khususnya seni dan budaya,"" katanya pada sidang media Pameran Seni Indonesia 'Simfoni Indonesia' di sini pada Khamis."
2.6249885144722835,-0.028197204476854767,1,my,"Jadi, mereka kena cetuskan sesuatu dan berharap akan berlaku sesuatu supaya boleh menuduh kerajaan zalim kepada rakyat, katanya pada sidang akhbar selepas merasmikan Festival Gasing dan Tamu Besar Sipitang 2011 dan Esplanad Sipitang di sini, hari ini."
1.1177824148597704,-0.004607311916789197,1,my,"Katanya lagi, CIMB dengan kerjasama Persatuan Skuasy Malaysia (MSA) akan memilih pemain terbaik bagi mewakili negara ke kejohanan bertaraf antarabangsa seperti Terbuka British dan Terbuka Hong Kong."
3.1849372702148155,-0.03254280876339932,1,my,"""Kami juga menyasarkan untuk membuka lapan hingga 10 stesen minyak setiap tahun di negara ini. BHPetrol juga bercadang meluaskan rangkaiannya di Sabah dan Sarawak, tetapi bukan dalam masa terdekat,"" katanya selepas melancarkan minyak pelincir enjin keluaran syarikat itu, Trans Super 7L di sini hari ini."
1.7609653909444536,-0.02063047106603572,1,my,"Beliau, yang merupakan Pengarah Eksekutif syarikat buku dan majalah, Telaga Biru Sdn Bhd, itu bukan sahaja menjalankan perniagaan menerusi Internet bahkan aktif di Facebook."
1.8324325644514532,-0.02060579276901441,1,my,Episod akhir Raja Lawak tahun lalu turut terpilih sebagai program komedi yang dicalonkan untuk bertanding di Anugerah Televisyen Asia di Singapura pada 9 Disember lalu.
0.003342273776346752,0.4159029088059429,2,cz,"Proti vyhodnocení technické části výběrového řízení podal Bombardier jako jeden z poražených námitku u čínské NDRC (Národní rozvojové a reformní komise), výsledek by mohl být znám do dvou týdnů, řekla mluvčí mateřské Škody Transportation Lubomíra Černá."
0.04703109098179131,3.2586600323423776,2,cz,"Ohromně to se studenty uměl, taky se studentkami a byl to starý pán, který, potom už, který ty své historicky dovedl báječně vyprávět, když potom jsme byli na nějakém kongresu, večer jsme si sedli u sklenice vína, tak to bylo prostě báječné."
0.7150338982185462,0.2506700260674028,1,my,"Pada pandangan saya BAM tak perlu ambil jurulatih dari negara luar, jurulatih kita pun semuanya berkemampuan. pandang juga dari segi ekonomi, wang tak mengalir keluar negara."
3.4003863253344644,-0.03930947518569704,1,my,"“Tempoh yang selebihnya bagi mereka yang tidak mempunyai dokumen, kita akan berusaha untuk menyelesaikan masalah ini bagi mereka yang berkelayakkan sahaja dan akan kenal pasti punca masalah mereka,” katanya."
0.024607333778725766,3.3611380217982796,2,cz,"Podle vládou aktualizované verze Konvergenčního programu, který je základním dokumentem země pro přijetí eura, by měl deficit veřejných financí postupně klesat pod tři procenta hrubého domácího produktu v roce 2014. To by podle ministra financí Eduarda Janoty znamenalo přijetí eura v roce 2017. ""Ale ty kroky lze i urychlit a dostat se pod tři procenta již v roce 2013, to ale bude záležet na další vládě,"" uvedl v pondělí Janota."
0.01394076117117754,0.6484455177283412,2,cz,"Řádný obchodník si před krámem zamete Zastánci novinky jsou přesvědčeni, že majitel domu nebude čekat, až odpoledne dorazí technické služby, aby odklidily sníh a on mohl vyjet z garáže."
0.0961720968308977,0.026399654733228556,1,my,"Kitai pan bisi lagu moden baka bansa bukai iya nya bansa Melayu, English enggau sida bukai,” ku iya ke udah ngerikod 8 buah album berindik ari taun 2002 ngagai diatu."
1.3422532665950857,-0.0035874294910614632,1,my,"""Ia turut melibatkan 19 pelajar warga negara asing yang ditahan sepanjang 2008 berbanding 40 orang pada tahun lepas. Ini menunjukkan peningkatan 21 orang atau 68 peratus, katanya."
2.120822207306291,-0.02431859488780868,1,my,"'Saya berpendapat Korea Utara menyedari bahawa mereka telah bertindak terlalu negatif terhadap rundingan dan mereka mahu bergerak pada haluan yang betul,' kata Encik Richardson kepada pemberita di lapangan terbang Beijing, sejurus tiba dari Pyongyang."
0.5075422034479453,-0.005542790547980864,1,my,"SERING tampil membawakan watak sebagai seorang ustaz atau jejaka alim menerusi drama mahupun filem sulung lakonannya, Aku Masih Dara, lewat kebelakangan ini, Ashraf Muslim mengaku perkara tersebut serasi dengan personaliti dirinya."
1.832044581195746,-0.015340265023643428,1,my,"Menurut beliau, rakyat Pulau Pinang merasa begitu bertuah dan berbangga di atas lawatan Almarhum dan Raja Permaisuri Agong ke negeri itu pada Ogos lalu."
1.7578424723457513,-0.023683851831669843,1,my,"Walaupun rambut beruban sesuatu yang tidak boleh diatasi, Kwong Teck percaya tekanan hidup yang melampau atau banyak berfikir sebagai salah satu punca masalah itu menyerang orang muda selain sebab keturunan."
0.006920993555888755,0.8835899521547829,2,cz,Premiér je ochoten jednat o dílčích změnách Ještě před jednáním předáků byl v pondělí šéf ČMKOS a šéfka zdravotnických odborů Dagmar Žitníková na neformální schůzce u premiéra Petra Nečase (ODS).
0.038256756340454896,1.0291395371563006,2,cz,"Umělé maso by mohlo naopak svět nakrmit, protože podle propočtů, které provedli výzkumníci na univerzitě v Utrechtu, je možné z jednoho vzorku kmenových buněk získat během dvou měsíců 50 tisíc tun masa."
1.2066323571096722,-0.007408944234738838,1,my,"Dalam kes Karpal, seorang pegawai polis, Inspektor Bhupinder Singh pernah dipanggil untuk menasihatkan Karpal meninggalkan bangunan Dewan tetapi wakil rakyat itu masuk juga ke lobi dan mengadakan sidang akhbar."
0.9233220004205778,0.009857976362781953,1,my,"Tertuduh, Muhammad Safiuddin Mohd. Zahari, 19, bersama kekasihnya, seorang pesalah juvana berumur 15 tahun dituduh melakukan perbuatan itu di tepi sungai Taman Melaka Baru pada 12 Mei lalu."
0.007577956383805745,0.9530077382106926,2,cz,"Jsou mezi nimi třeba lidé na první pohled odlišní jako Somálci a takoví, které nerozeznáte, jako třeba Poláci, jichž přišlo do Norska hodně za prací."
1.693861683527696,-0.01954404075565457,1,my,Menteri Belia dan Sukan Datuk Ahmad Shabery Cheek ketika ditanya Bernama di Jakarta berkata penyokong Malaysia tetap ada namun dijangka tidak seramai penyokong Indonesia semasa perlawanan di Bukit Jalil.
0.007566035644303406,0.9997837303327073,2,cz,"Mám tam účet a nevím zda vše převést jinam, jinde účet ale nemám a nevím jak na tom jsou jiné banky kamarádi z práce tam mají taky účty a nevím zda jim o tom říkat."
1.9145031188777086,-0.025243360610540878,1,my,"Jika dibandingkan kejayaan dan populariti yang dimiliki aktor berusia 28 tahun itu dengan aktor seangkatan dengannya, langkah Remy dilihat lebih jauh dan lebih lincah."
0.009733711481961475,1.0320171280763852,2,cz,"Nová vláda v roce 2004 oznámila, že spoléhá právě na vysílatele veřejné služby TVE a komerční vysílatele Antena 3, Tele 5 a Canal plus, včetně provozovatelů sítí při vytváření podmínek pro obnovení digitálního vysílání v roce 2005."
0.011743382966291606,1.6012999724154557,2,cz,Vzestup zemědělství a moderních měst na bázi ekonomické specializace umožnil těm nejchytřejším lidem zaměřit se jen na své snažení v různých vědách a uměních.
0.010246863153965169,1.3391221749055484,2,cz,"Ne byl to chvalozpěv na náš výkon, ale spíše ocenění toho, že studenti k nám přistupovali korektně a profesionálně, bez předsudků a antikomunistických emocí, a byli ochotni o našich slovech uvažovat."
0.6574197878494578,-0.001953815652173692,1,my,"Artis Malaysia iaitu Alif Satar One In A Million, Daniel Lee Malaysian Idol dan Hou Ren Astro Talent Quest 2008 turut menjayakan persembahan pembuka konsert ini."
0.0038092344741711237,0.4868515007734054,2,cz,"D. (Univerzita Mateja Bela v Banském Bystrici) na téma „Problematika pravicového extremismu v kontextu působení, činnosti a postavení pravicových extremistických politických stran v politických systémech německy.."
0.013413486052381244,0.36760328937191894,2,cz,"Od pondělního jednání K9 si klub VV slibuje jednotný přístup koaličních partnerů a garanci pro druhou část jednání sociálního výboru,“ uvedl předseda strany Radek John."
2.711190842741888,-0.035152891729054905,1,my,"Sementara itu, Nanta berkata bagi penerima yang belum dapat membawa balik jentera yang diagihkan kepada mereka pada hari tersebut, mereka akan mendapatnya dalam masa terdekat kerana kebanyakan jentera itu masih dalam proses penghantaran."
0.03857135701187863,2.072117259771351,2,cz,"Úterý 6. 9. 2011, svátek má Boleslav Německý důchodce chtěl postavit zeď, zazdil se ale sám Německý důchodce ve snaze zazdít vstup do svého sklepa zazdil sám sebe. Z pasti se dostal tím, že zboural zeď sousedů, s nimiž si nerozumí."
0.018451087520128504,1.3002288324006785,2,cz,"V Boskovicích se vosy rojily na sloupu elektrického vedení, v Holštejně si zase hasiči museli poradit za jediný den s jedním sršním a dvěma vosími hnízdy."
0.00877275355545146,0.34352197920859234,2,cz,Zpřesnění údajů HDP za první čtvrtletí bylo podle statistiků důsledkem využití komplexnějších informací o vývoji podnikatelského a vládního sektoru a částečně i dílčích zpřesnění ukazatelů za jednotlivá čtvrtletí roku 2010.
1.850488167829909,-0.024872861023141193,1,my,"Atas kelebihannya yang boleh berbahasa Cina, Nubhan telah merakamkan lagu Ai Mei Cuo untuk dimuatkan dalam album sulungnya yang bakal muncul pada pertengahan Februari ini."
0.7487006247258036,0.0037078374446586192,1,my,"Mujur pasangan itu membuat persiapan awal kerana akhir tahun lalu, apabila mereka melakukan tinjauan, harga bagi sesetengah khidmat pengantin untuk tarikh 10 Oktober 2010 mula meningkat."
