x1,x2,label,lang,texts
1.6332438379364853,-0.01705950539887226,1,my,"Beberapa jam sebelum hilang pada 9 Januari lalu ketika dalam perjalanan pulang bermain bersama kakaknya, Sharliena, 8, dari padang permainan tidak jauh dari rumah mereka di Taman Medan di sini, Sharlinie juga meminta dibelikan telefon bimbit mainan."
3.2653963202491845,-0.03598085752932015,1,my,Saya terkejut ada kalangan di AS dan United Kingdom (UK) yang gusar dengan kaedah limited war dan surgical strike yang digunakan di Iraq bagi mengelak lebih ramai orang awam terkorban.
2.5405279582021785,0.125485122284968,1,my,"Si mati yang diuruskan tidak hanya sendirian tanpa waris, malah ada juga yang tidak diketahui identiti menyebabkan pengkebumian mereka dilakukan di kawasan lapang seperti di tanah perkuburan Jalan Karak."
0.005836325071423335,0.759690489497425,2,cz,"Biopaliva jsou pro přírodu pohromou, tvrdí studie, která kritizuje cíle Bruselu O 81 až 167 procent horší dopad na životní prostředí než využití klasických fosilních paliv."
0.03213515527208672,2.4484020466466805,2,cz,"Mimochodem i tam se nám stalo, že nám tam někdo vlezl a zas ho vyrušili sousedi, takže oni v tom úprku tam nechali naopak madonku nějakou, nebyla moc drahá, ale nám se povedlo, že místo aby nás vykradli, tak nám přinesli madonku."
1.7705904923373714,-0.025300978154572145,1,my,"Itu luahan hati Setiausaha Kerajaan Negeri (SUK) Selangor yang baru, Datuk Mohamad Khusrin Munawi (gambar) mengenai kemelut pelantikannya yang tidak direstui kerajaan pimpinan Menteri Besar Selangor, Tan Sri Abdul Khalid Ibrahim."
0.051834546283810214,1.683289852552885,2,cz,"Pokud mluvíte o tom, že tiramisu už 5 let není v módě, tak metrořezy jsou vyšlé z módy tak 20 let (ale toto Vaše dělení na módní a nemódní je absolutně mimo mísu."
2.3512555453296122,-0.028388887807263653,1,my,"Kerajaan dan BN perlu mengambil iktibar daripada kesilapan strategi kempen di Hulu Selangor ketika mendekati pengundi Cina di Sibu nanti, bagi memastikan hati mereka tidak terguris oleh tindakan yang silap."
0.00236227048948663,0.32495669724169096,2,cz,"Vodní chrlič vám nabídne příjemnou relaxační atmosféru spojenou s uklidňujícím zvukem tekoucí vody, ale zároveň bude působit jako zajímavý dekorační prvek nebo účinné masážní zařízení, pečující o vaši šíji, ramena a oblast zad."
0.016110023403807322,2.2153983537223993,2,cz,"Na Suka, o jehož úmrtí se dozvěděl ráno, vzpomíná s největší úctou jako na houslistu i člověka, s nímž měl možnost blíže se seznámit."
0.010364680505634325,1.3144519399812236,2,cz,"Pokud by postupovali v intencích doporučení regionu a výkonné rady, pak by oslovili všechny členy ODS do roku 2005, zastupitele a členy vnitrostranických orgánů a pozvali by je na ustanovující sněm."
0.009320596159187245,1.236209791822674,2,cz,"A právě toho mnozí řidiči zneužívají a své kolegy přivádějí do někdy složitých situací, protože co uděláte, když na křižovatce přeskočí zelená na žlutou?"
1.877780518486329,-0.007224825651061705,1,my,"Nasib Saddam dan dua anak lelakinya, Uday dan Qusay masih menjadi misteri selepas pihak penceroboh menggugurkan bom ke atas dua buah lokasi yang dipercayai sebagai tempat persembunyian mereka."
1.1888003371127014,-0.015178676658449982,1,my,"Seseorang dalam negara kita sentiasa dalam kerisauan atau ketakutan untuk berjalan bersendirian, atau membawa barangan berharga, atau memiliki harta mewah, sehingga menggalas beg di bahu boleh mengancam nyawa."
0.0074806041251199796,0.24871014543906833,2,cz,"Úterý 6. 9. 2011, svátek má Boleslav Kvitová zůstala po Cincinnati šestá, Berdych devátý Wimbledonská vítězka Petra Kvitová drží týden před startem grandslamového US Open životní šestou příčku ve světovém tenisovém žebříčku."
0.00607034476872279,0.7814993066779351,2,cz,"Spravit tuhle cestu, postavit támhle na kilometru dva mosty, protože jsou jejich zemědělci holt zvyklí jezdit po jednom mostě tam a po druhém zpátky."
0.07038130597255066,1.142415087282288,2,cz,"""Ke konci roku to bylo 13,7 roku, v Evropské unii je průměr osobních automobilů zhruba 8,2 roku,"" popsal průměrné stáří aut na českých silnicích ředitel Sdružení automobilového průmyslu Antonín Šípek."
0.01168478666644103,1.5701364285298733,2,cz,"A na mě se vyser já už mám vyděláno víc než ty a dělat už nemusím až do smrti, narozdíl od tebe, ty trotle!"
3.1681968979572015,-0.04251987270497327,1,my,"Di samping itu, beliau berharap agar usaha itu akan memberi sumbangan yang signifikan dalam membangunkan modal insan dan menyemai semangat kesukarelaan di kalangan belia di negeri ini."
0.03621502043163065,1.7590457861155577,2,cz,"Asi je to důkaz, že to dělají dobře Označit příspěvek jako nevhodný A navíc, pokud k tomuto trestnému činu, tak si jeden z nich nechal věc po tři roky pro sebe."
0.01057170767560977,1.4162572883871383,2,cz,"Z některého z venkovních bazénů se můžete kochat pohledem na zasněžené hory přírodního parku Nockberge, sauny bývají prázdné a do restaurace je vstup v plavkách."
0.019272364446766475,1.5796750153054657,2,cz,Mimochodem kupni sila v roce 2008 v eurech pro CR byla 6 412 a pro Řecko 12 973. Na druhou stranu naše západní civilizace je po druhé světové válce založena na solidárně založené společnosti.
1.3133128261502007,-0.01463228555075654,1,my,"Sidang itu membentangkan lima penceramah utama. Tiga penceramah lain adalah Profesor Dato' Dr Ibrahim Ahmad, pengasas program Millionaire Mind Power di Malaysia; Ustaz Haron Hassan Akhtar, anggota Lembaga Penasihat Islam HSBC Insurance; dan Encik Kevin Xayaraj Tay, Ketua Pegawai Eksekutif (CEO) Sabana Reit."
1.5686396989169007,0.11080208448197335,1,my,"Alahai... Nenek berdoa siang malam agar tidak jadi orang tua yang tak sedar diri. Malu... bukan diri sendiri saja yang malu, keluarga pun akan mendapat malu."
0.012208650434348831,0.9970750821286395,2,cz,"V dubnu 1999 dva osmnáctiletí mladíci postříleli na střední škole Columbine na denverském předměstí Littleton 12 studentů a profesora, 23 dalších zranili a následně spáchali sebevraždu."
0.04015538195329123,0.7106530227756951,2,cz,"Značka Lee Cooper byla založena v Anglii v roce 1908 Morrisem Cooperem a sama se představila jako ""The Original European Denim Company (Originální evropskou denim společnost)."
2.373588907892348,-0.0290522318812174,1,my,Program RTW menumpukan pemulihan fizikal dan vokasional menerusi konsep pengurusan kes yang disediakan Perkeso secara percuma untuk pekerja yang mencarum sekali gus membolehkan mereka kembali semula bekerja secara selamat dan secepat mungkin.
0.0024245310120356344,0.3259557026144986,2,cz,"Do funkce jej dosadil ministr Jan Kubice, který s ním spolupracoval již v době svého působení v čele Útvaru pro odhalování organizovaného zločinu (ÚOOZ)."
0.016923113719505275,1.5226531425508678,2,cz,"Myslím, že je to dobou,třeba za pár let bude všechno jinak jake eroticke sluzby poskytujete nejcasteji a jaky nazor mate na sm sluzby(radek) nejčastěji klasický sex."
0.007928707260634866,0.13095759926497288,2,cz,Zatím poslední album SWINGING BRIDGE vyšlo v roce 2006 ve francouzské produkci a vedle skvělých aranží přineslo i hodně zpráv o stavu našeho světa a doporučení kudy dál.
1.5207293176118812,-0.019644314584669687,1,my,"Penolong Bendahari Puteri UMNO, Raja Emylia Raja Lope Ahmad berkata, untuk mencapai matlamat tersebut pergerakan itu akan memastikan setiap program yang dianjurkan oleh mereka memberi kesan seperti mana dikehendaki oleh pucuk pimpinan."
0.9607793748381008,-0.011477677858272447,1,my,"Sebelum temasya bermula, Malaysia meletakkan sasaran tinggi untuk mengumpul enam pingat emas _ empat menerusi acara trek dan dua lagi dalam acara lebuh raya."
0.014096211783223922,1.7993551615975352,2,cz,"Označit příspěvek jako nevhodný co jim hovada která je zvolila povolují Označit příspěvek jako nevhodný Vážená paní,že nedáte dopustit na syčáka,který by klidně vzal úplatek a ne malý je vaše věc."
0.03992191400603259,1.5812590422588002,2,cz,"""Všichni, i ti, kteří nás třeba nemusí mít rádi, tak vidí, jaký kus práce se udělal za tak krátké období a jak dostali náckové na zadek,"" řekl Komorous."
0.0028999912704608553,0.2964212779831534,2,cz,"V celé Unii činila 9,6 procenta, o 0,1 procentního bodu více… Kellner koupil akcie Generali za více než dvě miliardy Nejbohatší Čech Petr Kellner koupil akcie italské pojišťovny Generali v objemu 83,5 milionu eur (přibližně 2,1 miliardy korun)…."
0.005534972687372833,0.6901260520793334,2,cz,"Dagmara jí naznačuje, že Krátký není pro ni ten pravý, ale Helena prosí sestru i matku, aby ho měly rády a daly mu šanci.."
2.1609363281610148,-0.014066882335473492,1,my,"""Dua asas penting ialah abang saya sangat komited dengan agama dan mengajar agama sama ada di dalam hutan atau di luar hutan semasa beliau terlibat dalam gerakan kemerdekaan negara."
1.1592334445079908,-0.0005181494207483954,1,my,"Beliau memberitahu, pembinaan kelas sementara itu membabitkan empat blok bangunan diperbuat daripada fiber komposit yang mempunyai lapan buah bilik kelas, tambahan kepada 12 bilik kelas sekarang."
0.012615384411547442,1.5842785149427676,2,cz,"Ekonomové odhadují, že základní úrok bude v USA rekordně nízko asi po zbytek tohoto roku, i když ještě před projevem se množily hlasy, že k růstu základních sazeb dojde již ve 3.čtvrtletí letošního roku."
0.04091385292350136,3.6519193479831507,2,cz,"Poocházel od hubeného pána s batohem na zádech, který vešel, bloudil po místnosti, nechal se vyhodit od okýnka pro Thajce, byl to očividně smrdutý Evropan, pak se pokusil předběhnout frontu, taky byl zapuzen, tak se postavil na konec a tam úporně smrděl."
0.631693384915312,0.005629330381770696,1,my,"Menurutnya lagi, sokongan moral ibu bapa turut memainkan peranan penting dalam memastikan matlamat 40 peratus daripada setiap kohort pelajar Melayu/Islam melanjutkan pelajaran ke institusi pengajian tinggi dalam masa sedekad, dapat dicapai."
0.011225690536445988,1.4262078490486154,2,cz,"To vše lze provést okamžitě, aby bylo zajištěno pohodlí a úspora energie a na rozdíl od ostatních stínících technologií bez toho, že by byl někomu blokován výhled."
1.474266532717334,-0.02075706502989896,1,my,"Bagaimanapun, beliau menjelaskan bahawa keputusannya adalah bagi mengelak tanggapan di kalangan anggota parti bahawa beliau dan ayahnya cuba membentuk ‘Dinasti Lim’ dalam parti itu."
0.016153431544896353,2.2032526025388988,2,cz,"Dobrý den, chtěl bych se zeptat jestli je vhodná doba na nákup zlata, také by mě zajímalo co se stane s penězi v bankách např(ČS)když nastane bankrot Řecka?"
0.017023387181201027,0.8523207531286432,2,cz,"Zatímco Bush navazoval na rozpočtově střídmého Clintona a mohl si tedy dovolit snižovat daně, Špidla zdědil rozvrácené rozpočty po Zemanovi (a po sobě), takže daně musí zvyšovat."
0.02203231340529984,1.0623094761812018,2,cz,"Po smrti nejbližších vystal obrovský problém. Rodina byla v tak špatné finanční situaci, že neměli ani na pohřeb. S pomocí příbuzných a TV Markíza však potřebné peníze získali. Maminku a brášku pochovali 6. listopadu."
0.012784260719598392,1.7207054349606696,2,cz,"Protože se z něj může vyklubat pracovník loajální, produktivní a cenný, který je schopen pracovat v kolektivu,“ říká Zachar, který se s podobnými případy setkal i ve své firmě."
0.9731561256366194,-0.013249743845001395,1,my,"Menteri Penerangan, Tan Sri Khalil Yaakob berkata misi kumpulan itu akan tetap diteruskan walaupun terdapat ancaman serangan daripada tentera Amerika Syarikat dan sekutunya terhadap pejabat media asing."
2.4001126059422244,-0.033286764725504354,1,my,"Contohnya, sekiranya umur pesakit sudah meningkat dan tubuhnya kini lebih berisi, implan yang telah dimasukkan dulu boleh dikeluarkan dan ditukar kepada saiz yang lebih besar, katanya."
1.82887419158681,-0.02496544167929047,1,my,"Sehubungan itu, Pemuda MCA menggesa Kementerian Pengajian Tinggi membuat pembetulan secepat mungkin dan menjemput pengkaji sejarah yang berbilang kaum untuk memeriksa isi kandungan dan fakta sejarah."
2.675575164258028,-0.033625542904370954,1,my,"Pembantu Menteri Belia dan Sukan Sabah, Datuk Jahid Jahim berkata ramai golongan belia di Sabah menghubungi beliau yang mengadu tersinggung dengan pihak media yang sering merujuk pasukan Malaysia dengan gelaran Harimau Malaya atau Singa Malaya."
0.030692285352497958,1.2444525425801545,2,cz,"To všechno má zásluhu na tom, že letos počet poskytnutých hypotečních úvěrů vzrostl meziročně o 50 % a jejich celkový počet možná přesáhl 100 000. Podobně optimisticky vyhlížejí i výsledky stavebních spořitelen."
1.20084814576044,-0.016315330898349602,1,my,"Bagi mendayakan kembali pelaburan swasta, Najib berkata Yayasan Amanah Hartanah Bumiputera akan memberi peluang kepada pemilikan Bumiputera dalam sektor hartanah komersil utama di bandar utama dalam negara."
0.007832541418338506,0.91942507777165,2,cz,Reknu ti jen ze to bude trvat i delsi dobu a Francie nebo Italie ma uz sectene kolik ziskaji z Libyjske ropy takze nemaji duvod necomurychlit Označit příspěvek jako nevhodný Můžou za to ilumináti!
0.004595515197003888,0.5300936260670939,2,cz,"Z tradičních opor mu bude totiž chybět pouze útočník CSKA Moskva Tomáš Necid, který je po operaci kolena a jeho rekonvalescence potrvá přibližně půl roku."
0.016886566388382002,2.2467517371757717,2,cz,"Vzhledem k tomu, že landys se snaží ""trhnout"" to nejlepší v co možná nejkratší době, možná že se dočkáme v co nejbližším termínu jeho srdečných pozdravů z onoho ""království nebeského""."
1.2209999633702422,-0.014886749358321663,1,my,"Benar, bermain di Black Box Studio bukan bererti anda terperuk atau para pelakonnya tidak berbakat. Black Box merupakan jenis teater yang unik sepadan teater arena."
0.02451746750477472,2.128274227378808,2,cz,"Věnuje se také empatii Ježíše k problémům žen a všímá si, že Ježíš měl soucit s dětmi i jejich rodiči – a tvrdil, že dobré vztahy v rodině se odvíjejí od poslušnosti vůči Bohu."
1.9241766682020622,-0.0252492370813818,1,my,"Namun, apa yang ingin saya ketengahkan dalam ruangan kali ini ialah kesukaran para peniaga setempat kita, terutamanya pemilik gerai, kedai dan restoran makanan dan minuman (F&B) mendapatkan pekerja pembantu."
0.018851619636372094,1.716192244002807,2,cz,"Už na počátku roku 2010 narazili policisté z Chorvatska na informaci, že jejich krajané řídí výkonný drogový gang a že mají základnu v Praze."
0.034064137184896336,2.111721538293601,2,cz,"A není, já si myslím alespoň, že není dost dobře možné si představovat, že bez těchto znalostí někdo někdy přijde na skutečnou takovou léčbu, která by vůbec vyléčila veškeré ty typy rakoviny, nehledě k tomu, že mají různé příčiny."
0.14057069253043347,0.027317625300046805,1,my,Iya madah JPN udah ngatur pengawa sida iya bekait enggau ngatur pelin ke nyentuk agi awakka semua rayat menua tu bempu dokumen pengelala ke nitihka atur.
1.5213696312989402,-0.0015844468698115732,1,my,"Sehingga petang ini, masih tidak dapat ditentukan sama ada tentera AS itu adalah dari unit operasi khas atau sebahagian daripada pasukan utama yang bergerak ke utara dari Karbala."
0.004428041718322337,0.576052453939014,2,cz,"Poprvé musíte pouze nastavit svoji hmotnost, aby přístroj mohl přibližně počítat úbytek kalorií. Výrobce doporučuje přístroj kvůli přesnosti měření zkalibrovat. Nejlépe na běžeckém oválu."
0.008017831709998162,0.688375257070076,2,cz,V březnu se zúčastnil křtu knihy Otakar Vávra – 100 let V úvodu o něm píše držitel Oscara Jiří Menzel jako o svém učiteli.
0.006980012156666533,0.9009265992002564,2,cz,"Považuje se za něj totiž i pracovní místo, které zřídil samotný uchazeč o zaměstnání po dohodě s úřadem práce za účelem výkonu samostatné výdělečné činnosti."
1.8839736932753528,-0.009451747550161595,1,my,"Setelah tamat bon lima tahun dengan Persatuan Muhammdiyah Singapura yang membiayai kos pendidikannya itu, beliau membuat keputusan kembali ke universiti yang sama bulan ini."
2.6854369998494563,-0.029451434971444593,1,my,"Kemuncak lawatan itu ialah mesyuarat pelancaran Majlis Penasihat Sains dan Inovasi Global untuk Malaysia (GSIAC) di Akademi Sains New York (NYAS), yang akan dilancarkan oleh Najib pada 17 Mei, menurut kenyataan Kementerian Luar di sini."
0.023746899651081295,1.193576658113849,2,cz,Souboj gigantů nabízí i program nedělní. Manchester United přijede do Londýna na stadión Arsenalu. Vzhledem k mládí nového stánku Emirates Stadium se zde představí poprvé v historii vzájemných soubojů.
0.01584541703876205,2.132945175925127,2,cz,"Firma zjistila, že se jedná o napadení nedostatečně zabezpečeného počítače virem, který se na českém internetu objevil už v roce 2007 pod označením Trojan."
0.009228917468971434,1.260210177149801,2,cz,"Bohužel jsme to nemohli natočit, ale kdybychom v té chvíli řekli něco špatně, udělali špatný pohyb nebo se pokusili utéct, byli bychom ve skutečném nebezpečí – ten člověk byl šílený."
0.568913714776449,0.019714178851789218,1,my,Program begulai enggau bala rayat ke diatur Opis Pemansang Mensia Mayuh (KEMAS) Parlimen Lubok Antu tu udah mujur endar diatur ba Rumah Dancon anak Jandong di Kampung Bua ditu.
0.02000344155879402,1.0471322343516123,2,cz,Článek je převzatý ze serveru Patria Online Uložte si či sdílejte článek v sociální síti (po registraci zdarma) Je to nestydatost a značná chyba.
1.321034931791619,-0.017718421421767345,1,my,Beliau terdahulu mendengar kes aduan daripada Kolej Masterskill mengenai masalah mendapatkan tanah kolej bersama pegawai daripada Jabatan Tanah dan Survei yang mewakili Unit Perancangan Negeri.
0.016133027900669596,2.1790650535347615,2,cz,"Podle běloruského opozičního serveru Naviny.by nelze vyloučit, že se skandál rozšíří i na některé další evropské státy, které se angažují v podpoře běloruského disentu."
0.01648450048216927,1.5548364480691252,2,cz,"Také vstup Gazpromu do RWE by mohl podle SZ v Berlíně narazit na odpor, neboť by zvýšil energetickou závislost Němců na Rusku, odkud už nyní dovážejí 40 procent plynu."
2.1761026418564464,-0.02870832077298724,1,my,"Sebab itu, entiti yang membunuh rakyat Palestin bukannya bangsa dan penganut agama Yahudi atau fahaman Zionisme, tetapi adalah negara Israel, termasuk kerajaan serta rakyat yang memilihnya."
0.021140483295390946,1.2904236073209625,2,cz,"Hrají J. Canela, G. Espinová, M. Varoni a další (42 min) (Premiéra) Nejlepší jsou cyklisti (Climb Every Mountain Biker) Kartářka Belle předpověděla, že si buď do roka vezme některého ze svých bývalých, nebo se nikdy neprovdá."
0.01389325240810941,0.6721377205077826,2,cz,"Přílohy může vždy vhodně doplnit mladá blanšírovaná nebo dušená zelenina. Vedle toho, že zvýší estetiku servírovaného jídla, také více zasytí, proto si vystačíme s menší porcí přílohy."
0.009669438616616738,1.271163034507762,2,cz,"Musím se opravdu smát jak byli lidé při letošních volbách naivní a věřili,že nově vzniklá pravicová odnož TOP09 to s obyčejným lidem myslí dobře."
2.4178980276233917,-0.028667966701622444,1,my,Hembusan bayu dari laut pula menjadikan suasana terasa segar dan nyaman. Di situ juga terdapat medan selera yang menjual pelbagai hidangan terkenal di Pulau Pinang seperti nasi kandar dan pasembur.
1.9590135515795526,-0.02266561831045548,1,my,"Rancang mereka juga, album ini bakal dilancarkan pada bulan hadapan di Hard Rock Cafe, Pulau Pinang sebelum diikuti siri jelajah Malaysia, khas untuk merapati kembali peminat yang sudah tiga tahun mereka tinggalkan tanpa material baru."
0.7503895360541519,0.0031846989980973952,1,my,Wartawan Kosmo! menaiki bas RapidBET1 yang menuju ke Kota Damansara menerusi Penchala Link pukul 5.40 petang. Namun ia hanya mula bergerak tepat pukul 6 petang.
1.3739125007366138,-0.016066656866663292,1,my,"Ahmad Lai menambah, pengguna jalan raya bukan sahaja perlu memikirkan keselamatan dirinya sendiri tetapi juga keselamatan penduduk kampung, terutamanya pejalan kaki yang sering berulang alik di jalan raya berkenaan."
0.0007789181365766088,0.09266254962255838,2,cz,"Zcizili sedm pánských a dámských jízdních kol, nepohrdli dětským kolem či koloběžkou, bez povšimnutí nenechal ani dvě cyklistické přilby, dvacet lahví archivního bílého vína a další drobnosti."
0.02520402910723615,1.4272181764070677,2,cz,"Vlastně nebylo zbytí. Vzhledem k tomu, že mí rodiče a bratr jsou angličtináři, tak jsem ani neuvažovala nad tím, že bych šla studovat jadernou fyziku. Bylo to dané, nijak jsem nad tím nešpekulovala."
1.4961404590213563,-0.011396381567987415,1,my,"“Kita kena menjaga kebajikan jangka panjang bagi membolehkan Mohd Azizulhasni menumpukan sepenuh tenaga dan usahanya ke arah impian meraih emas itu,” katanya kepada pemberita di sini semalam."
0.003215972282624708,0.4360810358704397,2,cz,"Argentina v Santa Fe brzy prohrávala po gólu Diega Péreze, ale stejně rychle už krátce po čtvrthodině zápasu vyrovnal po Messiho přihrávce Gonzalo Higuaín."
0.016546791452641138,2.2233896857056057,2,cz,"Ostatně, já to ještě rozšířím, mě přijde, že něco podobného se odehrálo i při pohřbu pana Kočky, že taky se zavřela část Prahy a tam prostě normální lidí nemohli."
0.09234616329256543,3.0302533710412622,2,cz,"Když si nevypneš Caps Lock, tak si tu za blbce Pokud je Domenicco bohatý tak,jak dává na odiv, tak si myslím, že by pro něj neměl být problém se postavit k všci jako chlap."
0.01780477374032804,1.19266973729868,2,cz,"Pokud při zvýšení nájmů pronajímatel nabídne uzavření zcela nové smlouvy a nájemník na to přistoupí, měl by si text důkladně prostudovat a srovnat ho pečlivě s dosavadní smlouvou."
0.012087199597401085,1.6577494138574607,2,cz,"V případě neudělení plné moci České poště může zákazník využít deklarantských služeb jiné společnosti, popřípadě se celního řízení osobně zúčastní na celním úřadu, kde podá celní prohlášení na předmětnou zásilku."
0.021760691435939568,0.8634263126235233,2,cz,"""V roce 2012 bude předložen návrh státního rozpočtu tak, aby jeho schodek dosahoval maximálně tři procenta hrubého domácího produktu,"" slíbil kandidát ODS na ministra financí Martin Kocourek."
0.006311833892981091,0.12622142605660885,2,cz,"ČEZ hodlá proinvestovat během pěti let 300 miliard Energetická společnost ČEZ plánuje investovat v příštích pěti letech celkem 300 miliard korun, z toho většinu v tuzemsku."
0.01128284116710014,1.4974500157734383,2,cz,"Fakt je dojemne jak na CT a NOVE hlasatele hlasi a div se pritom nerozplynou jakou ty financni trhy rostou hmmm Označit příspěvek jako nevhodný Thyronxi,pomozte prosím."
0.012435362002652535,1.7286396855800545,2,cz,"Až o pětinu Prazdroji meziročně vzrostly například prodeje plechovkového piva, o více než pět procent se zatím zvyšuje také prodej nealkoholického piva Birell. „Nicméně stále přetrvává vliv loňského skokového zvýšení spotřební daně, z toho se český pivař ještě úplně nevzpamatoval,“ mírní optimismus Mareček. Právě zvýšení spotřební daně loni v lednu a následné nucené zdražení zlatavého moku bylo podle pivovarníků hlavním důvodem výrazného loňského poklesu jejich prodejů."
1.8698055931899598,-0.021223102971823646,1,my,"Antara tawaran yang besar termasuklah pembabitannya dalam filem Inggeris, Prince Of The City, berlakon di samping aktor Michael Madsen, yang popular dari filem Hollywood, Kill Bill."
1.1203405414649208,-0.013330416071198127,1,my,"'' Ini kerana, katanya, beliau tidak percaya Iraq mahu memberikannya kepada Syria sebaliknya berpendapat mereka mahu mengeluarkan bekalan itu dari wilayah Iraq supaya boleh mengelakkan daripada diperiksa pasukan pemeriksa PBB."
0.01281490343051611,1.542661351904991,2,cz,"Ford současně od srpna zvýšil ceníkovou cenu nejprodávanějších zahraničních modelů Ford Fusion, vyrobených po 3. srpnu letošního roku, o deset tisíc na 308 100 korun. ""Za tuto sumu se ale vozy neprodávají."
2.310459598574203,-0.028032270182259934,1,my,"Sementara itu, anak didiknya, pengacara terkenal di Malaysia, Encik Mahadzir Lokman, berkata tokoh itu merupakan seorang yang tegas mengajar terutama dalam bidang kewartawanan semasa Allahyarham menjadi Penasihat Editorial di TV3 satu ketika dulu."
1.226014824578299,-0.01596979439375414,1,my,"Gangguan ini menjejas 2 peratus masyarakat umum dan lebih kerap dialami wanita. Kebanyakan pesakit mempunyai sejarah penderaan secara jasmani dan seksual, ditinggalkan ibu bapa atau terlalu dikawal semasa kecil."
2.5812741076475105,-0.022849526149294863,1,my,"""Semasa saya nampak mereka sampai, saya telah membawa Azilah balik ke kawasan menghampiri kenderaan saya di kawasan lapang itu dan melihat ASP Tonny dan pasukannya menjalankan siasatan di tempat itu."
2.345504860499902,-0.029045712566794425,1,my,"Saya komited memastikan kepimpinan terus berdiri teguh bagi menghadapi krisis ekonomi yang kini melanda seluruh dunia termasuk di negara kita. Saya akan tetap berpegang kepada iltizam untuk memenuhi keperluan, kepentingan dan aspirasi setiap warga Malaysia."
