x1,x2,label,lang,texts
5.107413089269747,-0.06984748944447564,1,my,"Muslim yang sebenar menjadikan perjalanan hidupnya seimbang antara tumpuan kepada persoalan ibadah yang ritual dan tumpuan kepada pembangunan umat sebagai tanggungjawab kekhalifan atas muka bumi. Tumpuan kepada ibadah yang ritual itu merangkumi pembaikian jiwa dari sudut keikhlasan dan kesungguhan, demikian sentiasa memastikan bertepatan dengan contoh asal yang ditunjukkan oleh Nabi s.a.w. tanpa melakukan tokok tambah yang tidak diajar oleh sunah."
0.009232762011153427,1.1939401594951942,2,cz,"Deník se o tom dozvěděl ze zdrojů ABL a získal i kopii těchto výpisů, z nichž je zřejmé, že s nimi pracovala detektivní divize firmy."
0.0302783948566536,2.1823557114473204,2,cz,"Situace se obrátí ku prospěchu majitele, když se na aukci objeví třeba jen dva vášniví sběratelé, z nichž je aspoň jeden připraven tak dlouho navyšovat, až koupí."
0.010056465657891388,1.2459630040020764,2,cz,"Ta je v Praze z toho důvodu, že Cirqueon, centrum pro nový cirkus a pořadatel tohoto setkání, je členem Circostrada Network, což je síť, která sdružuje profesionály v oblasti nového cirkusu,“ říká Šárka Maršíková, manažerka Cirqueonu."
1.399847709219505,-0.017407132351503894,1,my,Tambahan pula negara seperti China yang banyak membeli Bil Perbendaharaan Amerika Syarikat merasa bimbang mengenai penurunan nilai dolar dan menyarankan penggunaan mata wang alternatif untuk perdagangan.
0.0327424941493892,2.5734393630589687,2,cz,"Více než sto lidí se v pátek v osmnáct hodin sešlo na pietním místě před vchodem do ZŠ Jubilejní v Novém Jičíně. Uctili tak památku třináctiletého hocha a pětačtyřicetileté učitelky, kteří se ve čtvrtek utopili na školním výletě v Olomouci."
1.8129626946592154,-0.022222036811851018,1,my,"Ketika ditanya Idham mengenai hubungannya dengan tiga lagi anggota peronda polis yang turut mengejar kereta itu semasa hari kejadian, Jenain berkata hubungan mereka sangat rapat walaupun dia kini menghadapi tuduhan di mahkamah."
6.365823539336829,-0.06685467840359528,1,my,"Minggu ini, laporan muka hadapan Mingguan mStar menyajikan laporan yang agak berlainan sedikit mengenai sambutan raya. Kami memaparkan tiga kisah menarik bagaimana mereka yang tidak mempunyai kampung halaman (orang bandar) beraya tanpa mengamalkan budaya pulang ke kampung yang menjadi amalan berjuta warga kota setiap kali tibanya musim raya, kisah kedua mengenai mereka yang hendak pulang beraya tetapi tidak dapat berbuat demikian kerana komitmen kerja dan peristiwa ketiga ialah bagaimana terdapatnya segelintir keluarga dan individu yang memilih untuk menyambut hari raya dengan pergi bercuti di luar negara."
2.7553526141129203,-0.03600785318970252,1,my,"""Angka tersebut telah meletakkan negeri Terengganu di kedudukan yang kedua tercorot dalam negara selepas Sabah dalam kadar kematian bayi selepas lahir hidup,"" katanya selepas menyampaikan sumbangan kepada 120 pesakit di Hospital Daerah Besut di sini."
1.4364811318391095,-0.01681350454683161,1,my,"""Sebenarnya, keberkesanan sari kata yang dihasilkan seringkali disokong oleh tahap keintelektualan penyari kata, pengetahuan mereka tentang bahan cerita, pengetahuan am, kemahiran membuat rujukan, kebiasaan dengan budaya asing dan kecekapan berbahasa."
0.018890450280432326,2.460772571728513,2,cz,"A já jsem k svému úžasu zjistil, že na té výstavě se to prodává za naprosto dumpingovou cenu 700 korun. Je to opravdu jedna z nejhezčích knih, jaké tady v posledních letech člověk mohl vidět."
0.01671816154146598,1.0420206623890396,2,cz,Kuřáky si nejspíš musíme hýčkat Co přinese reforma malým a středním firmám Malé a střední podniky nahlíží na daňovou reformu s výhradami Současná vládní daňová reforma je podle Unie malých a středních podniků (SME) krok správným směrem….
0.008118724966593938,0.0875932651013156,2,cz,"Hrají H. M. Combsová, A. Milanová, R. McGowanová, D. Gregory, J. McMahon a další (41 min) (Premiéra) Barbarská sublimace (Barbarian Sublimation, The) Penny propadá zoufalství nad svým životem a nad rozdíly v zámkových vložkách."
0.01523741364063961,0.8345101727556314,2,cz,"Ale možná při této „předběžné sondě“ zjistíte, že si zákazník ve frontě chce třeba jen jednoduše a rychle koupit nějakou drobnost, kterou můžete vyřídit během půl minuty."
0.0031724558012131616,0.0963931762713639,2,cz,"Táhne i Jesus Christ Superstar II Kamil Střihavka a Bára Basiková budou od 11. listopadu vystupovat v hlavních rolích rockové opery Jesus Christ Superstar, kterou uvede Hudební divadlo Karlín (HDK)."
2.3000517440555632,-0.026934654613970318,1,my,"“Saya minta supaya Ketua Pemuda negeri adakan mesyuarat secepat mungkin serta merangka strategi yang berterusan untuk memberi lebih penumpuan dan penekanan kepada persiapan pilihan raya umum nanti,” katanya dalam UMNO Online di sini, semalam."
0.8189401309273789,0.004063227270600957,1,my,Sementara kejohanan peringkat zon utara dengan kerjasama Pejabat Pelajaran Bahagian Miri akan bermula dari 8 hingga 14 Julai. Manakala kejohanan bagi peringkat zon tengah dengan kerjasama Pejabat Pelajaran Bahagian Sibu dijangka diadakan pada 15 hingga 21 Julai.
0.008734337948518819,1.117922803316742,2,cz,"Josef hraje závodně šipky, ČR reprezentoval i na MS ve Španělsku, trénuje fotbalové mužstvo dorostu Podlesí a říká o sobě, že je manuálně docela zručný."
0.015916153455482498,1.5959025834710885,2,cz,"V následujících třech letech lze očekávat další rozšíření center sdílených služeb, tento vývoj však nebude rovnoměrný ve všech oblastech. Největší posun se očekává v oblasti IT, financí a účetnictví a call center. Jiné oblasti budou naopak stagnovat. Zároveň je třeba dodat, že kromě oblasti IT infrastruktury jen velmi málo respondentů očekává úplnou centralizaci, resp. integraci (viz také obr. 2)."
0.009887909038714787,1.273798523012352,2,cz,"Ty ukazují, že bez dostatečné osobní angažovanosti každého jednotlivce v produktivním věku na vytváření osobních zdrojů pro důchodový příjem je velmi ohrožena jejich celková životní úroveň v důchodovém věku."
0.009097455378995877,1.2094018432975784,2,cz,"US Tresuries poklesly potom, co FED ohlásil, že by měl začít s prodejem aktiv, aby se zbavil dluhových cenných papírů, které nakupil v rámci podpůrných balíčků."
1.6508107268806065,-0.020486552629177382,1,my,"Penasihat DAP, Lim Kit Siang turut mendendangkan lagu lama dengan dakwaan kononnya kekayaan sumber asli Sarawak seperti kayu balak dan petroleum lebih menguntungkan pihak tertentu di negeri ini, manakala rakyatnya tidak menikmati kekayaan itu."
0.0076100958224618554,1.0116701371590624,2,cz,"Třeba vidíte ve filmu, že někdo veme železnou tyč a přetáhne druhého přes záda a on se otřepe a bojuje s ním dál, jo."
0.07570099175652434,0.8895575957344215,2,cz,"I proto se v Uherském Hradišti hnal k balónu, aby si ho postavil ke exekuci penalty. Druhé, protože první pokutový kop brilantně proměnil. Parádním obloučkem doprostřed brány."
0.005102540797553984,0.491074441630932,2,cz,"Takze, ja budu ta 3. Hele mladej, kdysi jeden moudry clovek prohlasil, ze je treba oddelit zrno od plevele a ty jsi jen jedna cast toho plevele."
0.014242092478129579,1.8830387845929228,2,cz,"Už dlouho se mojí rodiče chcou pustit do rekonstrukce kuchyně ale neví jak na to,letos v červenci oslaví 30 výročí svatby a chtěla bych jim touto cestou,za vaší pomoci alespoň splnit jeden sen,rekonstrukci kuchyně."
0.015697735678324682,2.0568898227317614,2,cz,"Netvrdím, že tací neexistovali, ale pokud ano, pak jen na lokální úrovni a dál se nedostali, protože my ostatní jsme je nedokázali nejen prosadit, ale ani podpořit!"
0.017753074116351065,1.2223595728625611,2,cz,"I Indie zaznamenala pomalejší nárůst objemu výroby, přesto si však zachovala nezanedbatelné tempo růstu, zdaleka nejvyšší na všech rozvíjejících se trzích sledovaných v průzkumu."
1.6911333855602448,-0.0036820900626515418,1,my,Syarat supaya 70 peratus daripada perolehan digunakan di Malaysia telah diganti dengan syarat pemohon dikehendaki membuktikan faedahnya kepada Malaysia jika lebih 50 peratus hasil penyenaraian digunakan di luar negara ini.
0.876862731792096,-0.008660738960104023,1,my,Jumlah premium baru tahunan di Singapura meningkat 46 peratus mencapai AS$120 juta ($144.5 juta) bagi enam bulan berakhir 31 Mei tahun ini berbanding AS$62 juta setahun lalu.
0.03390413566225314,2.6690705507763575,2,cz,"Vzhledem k tom, že je vázaný na člověka, není riziko úletu tak velké, ale na druhou stranu foukal silný vítr, mohl se dostat do neznámého prostředí nebo ho mohlo něco ulovit."
1.3829159662725101,-0.01899341676692628,1,my,"“Adalah amat penting untuk setiap pasangan mengekalkan kasih sayang dan cinta sepanjang hayat,” katanya ketika ditemui membeli bunga dan coklat sebagai hadiah untuk isterinya."
0.18953419347176123,-0.0018822501924437465,1,my,"Parti komponen BN ia nya Parti Pesaka Bumiputera Bersatu Sarawak (PBB), Gerempung Sa’ati Rayat Sarawak (SUPP), Parti Rak­yat Sarawak (PRS) enggau Parti Progresif Demokratik Sarawak (SPDP)."
0.011338545964286496,1.4948028880735431,2,cz,"Ty se odkazují na ministerstvo dopravy, které tvrdí, že první krátké úseky budoucí vysokorychlostní tratě budou v Česku vybudovány v rámci modernizace třetího tranzitního železničního koridoru mezi Prahou a Plzní."
4.450509809809582,0.30894787744501967,1,my,"Rumahnya, kata Lamah, ada tiga bilik tidur. Bilik pertama digunakan anak sulungnya dengan isteri dan dua anak mereka. Bilik kedua pun dipenuhi anak keduanya dengan suaminya dan tiga anak. Bilik ketiga sepatutnya untuk Lamah dan suami, tetapi kerana dia mempunyai dua anak dara, jadi si anak dara tidur di bilik ketiga kerana Lamah tidak mahu dua anak daranya tidur di hall, sebab ada abang ipar yang tinggal serumah. Tak manis dipandang."
0.009550316677203968,1.3001745027597682,2,cz,"Rozpočet se může ještě vyřešit i přes obavy z dvouciferného fiskálního deficitu, který USA naposledy zažily na konci druhé světové války, když F. D. Roosevelt již umíral."
2.109619761865129,-0.027274568377226086,1,my,"Menurut Ahmad yang juga dikenali dengan panggilan Mat London, selepas pihaknya meneliti, terdapat beberapa pengarah yang harus menghadiri kursus pengarahan bagi meningkatkan pengalaman dan ilmu dalam bidang pengarahan."
1.0223589805295628,-0.011013490295578446,1,my,"Ahamd Tajudin berkata, perubahan bukan satu pilihan sebaliknya mesti dilakukan memandangkan negara ini agak ketinggalan berbanding negara jiran seperti Indonesia, Thailand dan Singapura dari segi vokasional."
2.320389865524823,-0.026674975776297058,1,my,"Jabatan Perangkaan Negeri Kelantan melantik 1,393 petugas sambilan bagi menjalankan operasi membanci penduduk dan perumahan di seluruh negeri ini yang bermula serentak di seluruh negara semalam hingga 22 Ogos."
0.0067463340677209145,0.5655688010774721,2,cz,"Místní kluci, ze kterých třeba za několik let vyrostou fotbalové ikony typu Pelého, Ronaldinha či Kaka, kopou mičudou do kostelní zdi a její slavná minulost je nechává v poledním žáru zcela chladnými."
1.4603348656685993,-0.01580468391679805,1,my,"Arau Bekrek, 22, pula berkata, usaha Kumpulan Emkay untuk memulihara alam sekitar termasuk ikan di Tasik Temenggor adalah sangat baik kerana ramai Orang Asli bergantung kepada hasil hutan dan tangkapan ikan sebagai punca pendapatan."
0.005576530692770205,0.7489892107673329,2,cz,"Dokonce má spoiler s třetím brzdovým světlem, a když ji zatáhnete, nad předním oknem se automaticky vysune větrná clona, odvádějící proudy vzduchu od kabiny."
0.010434829980114734,1.418161368895838,2,cz,"Vít Bárta byl se schůzí spokojen, i když se nestihly projednat personální změny Dvě a půl hodiny věnovali ve středu lídři stran vládní koalice diskusi o personálních otázkách ve vládě."
0.37777488435426654,-0.0014800851384627997,1,my,"PERSATUAN Badminton Malaysia (BAM) mahu mendengar penjelasan dari mulut Datuk Misbun Sidek sendiri berhubung peletakan jawatannya sebagai jurulatih perseorangan badminton negara, kata Pengurus Besar, Kenny Goh."
0.8718412273601206,-0.011294717566841004,1,my,"Ketika wakil lelaki menghampiri juru andam untuk meminta izin pasangan mempelai disandingkan di atas pelamin, sudah menjadi lazimnya, syarat 'buka kipas' untuk mak andam harus disediakan."
1.3556681572316382,-0.008052241954534984,1,my,"“Kami mengambil perhatian serius perkara ini kerana kami perlu bertindak cepat bagi menangani sebarang bentuk kebakaran yang berlaku antaranya sampai ke tempat kejadian dengan cepat melalui pemantauan Petunjuk Prestasi Utama (KPI) apabila talian kecemasan dihubungi,” katanya kelmarin."
1.4053893933489972,-0.015838450411077655,1,my,"""Pada suatu masa, Barbie terlalu bernilai memandangkan ia hanya dihasilkan untuk tujuan eksport. Lagipun, kami tidak mampu untuk memiliki patung yang kosnya lebih tinggi daripada gaji kami,"" kata Chou."
0.02507511196582398,-0.00043161514503758084,1,my,Bhd Dato’ Hj Othman b Abd Razak Datin Habsah bte Yusoff Kisham @ Khairul b Dato Hj Othman Khazila bt Dato’ Hj Othman Mustafa Trading Sdn.
0.02696313386047014,1.3465455655106096,2,cz,"Přízeň jen 27 procent lidí je druhá nejnižší podpora voličů ve srovnání se šesti předchozími guvernéry Kalifornie. Hůře než Schwarzenegger si vedl jen demokrat Gray Davis v roce 2003, když mu vyjádřilo podporu 22 procent Kaliforňanů."
0.7131263188735482,-0.009572896436526502,1,my,Timbalan Menteri Pengajian Tinggi Datuk Saifuddin Abdullah berkata walaupun aktiviti tersebut merupakan satu daripada lapan teras kokurikulum di IPT namun ianya paling kurang mendapat sambutan.
0.008135968352092848,1.1427062135412163,2,cz,"Obvykle se charakterizuje nadprůměrnou schopností slova, mluveného i psaného, snahou o originalitu, jistou nezávislostí a kritičností, ochotou vyjadřovat se o závažných otázkách srozumitelně a hlavně přitažlivě."
0.19224688306494533,0.015065955162714207,1,my,"Bekau kaban Parti Rakyat Sarawak (PRS), Larry Sng, ti nadai parti diatu tang mengkang nyadi Menteri Muda ba Opis Kepala Menteri,sama bela bisi datai ngulu pengerami nya."
0.06354818344368197,0.38937939352247336,2,cz,"""Porušení zákona bude v tomto případě řešeno formou zkráceného přípravného řízení, muž je podezřelý ze spáchání přečinu ohrožení pod vlivem návykové látky,"" doplnila Viačková ke druhému provinilci."
0.02786406335954503,1.6228957421735144,2,cz,""" kam se tedy ztrácí původní rockový Čtverec, tak jak ho znají tisíce posluchačů, které se za 23 let jeho trvání vystřídaly pod jeho pódiem?"
1.6213508949070183,-0.010485830006122777,1,my,"Semuanya berkemungkinan berlaku apabila lebih 3,000 penonton yang gagal mendapatkan tiket untuk Konsert Double Trouble pada 1 Mei lalu terpaksa berputih mata menunggu di luar pagar tempat berlangsungnya konsert ini."
0.010690542045733619,1.3503222285976686,2,cz,"Podnikatel, který musí mít jasno, na co má a jak peníze použije, těžko uvěří, že programové prohlášení je něčím víc než prázdným slohovým cvičením."
0.02355832059171111,0.6264653292657643,2,cz,"Stát tak chce ušetřit 12 miliard korun. Ředitelka Asociace malých a středních podniků Eva Svobodová říká, že tímto krokem budou zaměstnavatelé suplovat stát a chce proto s ministerstvem ještě jednat."
0.004437476465903899,0.5396036339879589,2,cz,"Tyto rušičky jsou velkou hrozbou proto, že při nízkých vývojových i výrobních nákladech výrazně snižují efektivnost neporovnatelně drahých zbraňových systémů, jako jsou například křídlaté řízené střely, průzkumná opancéřovaná vozidla a pod."
0.01067841689424855,1.0832162640216552,2,cz,"Pro dlouhodobý vývoj naší debaty stojí mimochodem za pozornost, že Čína je bohatě citována k textu ""Otravná licitace"", k jejímuž momentálnímu stavu John konstatoval, že Věci veřejné vyjednaly věcné věci."
1.7773888999582657,-0.024266724881791726,1,my,Namun kelesuan di peringkat bahagian yang sudah berakhir menyebabkan tumpuan kini kepada pemilihan pada peringkat pusat. Semakin hari semakin menarik perhatian walaupun 'pergolakan' parti politik kini diambil alih oleh rakan MIC dalam komponen Barisan Nasional (BN) iaitu Parti Progresif Penduduk (PPP).
3.2118205041933856,-0.042466059901547545,1,my,"Menyedari tempat yang agak terhad itu, Atilia yang mempunyai alasannya yang tersendiri memberitahu, dia sengaja memilih tempat tersebut kerana ingin menampilkan konsep yang berbeza untuk konsert pada malam itu."
0.02173284821542308,0.7333411796507938,2,cz,The Times si na první stranu vybraly záběr z překvapivého okamžiku svatebního dne – jízdy novomanželů po obědě z Buckinghamského paláce v kabrioletu Aston Martin.
1.4492724182716314,-0.01617317860617754,1,my,"“Dua lagi jurutera, seorang peguam, enam bekas pensyarah, dua aktivis masyarakat. Di samping yang dipilih ini, Perlembagaan PAS memperuntukkan kuasa boleh melantik enam Ahli Jawatankuasa PAS Pusat,” katanya."
0.01732410801684174,1.039852733196697,2,cz,"Nejsem v žádné partaji stejně jako jsem nebyl před 20 lety, dvacet let makám jak šroub, takže nedřu bídu z nouzí a rozhodně se mám líp, než za komunistů."
0.2961243228023776,0.04761869217861696,1,my,Penemu tu dibantai laban berindik ari penyarut ke bisi nyadi lebuh bisi gerembung kunsi ke deka ngemansangka tanah pendam nya pun taun tu tadi ke deka digaga sekeda bagi ari tanah pendam nyadi palan engkah kerita.
2.0997620076789314,-0.02670040973834678,1,my,"Beliau yang juga mantan setiausaha MDL pada tahun 1989, menyarankan agar MDL turun padang, menjalin hubungan kemasyarakatan dengan rakyat dan mengurangkan birokrasi yang boleh membantutkan perancangan pembangunan."
1.6031113902503087,0.016722620895463364,1,my,"Antara lain termasuk filem seram The Exorcist, drama politik All the President’s Men, Saturday Night Fever (1977) dan dokumentari perang arahan John Huston, Let There Be Light, yang dilarang tayangannya di Amerika selama 35 tahun."
0.07146775567626117,0.2627669789218484,2,cz,"Už dříve odzvonilo prezidentským ambicím zmíněnému Paroubkovi či Miloši Zemanovi, prohrou v senátním okrsku Český Krumlov si opětovnou cestu ke slávě zřejmě definitivně uzavřel bývalý premiér a eurokomisař Vladimír Špidla."
0.02350148515907475,1.315907513844367,2,cz,"Na domácí scéně pořad mapuje jak zajímavé počiny v oblasti country, bluegrassu, folku a dalších příbuzných žánrů, tak i projekty, které se svým autorům, jemně řečeno, příliš nepovedly."
2.0918211383084824,-0.029834990734498558,1,my,"Menteri Perdagangan Dalam Negeri, Koperasi dan Kepenggunaan Datuk Seri Ismail Sabri tersenyum mendengar initiatif mengurangkan gula yang diamalkan pengeluar minuman ringan itu yang sudah dikenali pengguna sejak 1883 lagi."
0.0061910734263832265,0.27790548316048663,2,cz,"Než byly u Macochy v průběhu 19. století postaveny vyhlídkové terasy, nebyla jiná možnost, než podniknout nějaký podobný krkolomný kousek, pokud jste do Macochy chtěli nahlédnout."
0.004770201217377775,0.5957624460045093,2,cz,"""Sleduje další kroky v našem vzdělávacím systému nelékařských pracovníků, kde je vytvořeno příliš mnoho specializací a je příliš malá propustnost mezi příbuznými obory,"" uvedl Heger."
0.0027330627017282142,0.3519444044292021,2,cz,"Změnit to chtějí poslanci Petr Krill (ODS), Zuzana Domesová (ČSSD) a Ondřej Liška (SZ), kteří tento týden předložili sněmovně návrh zákona o statusu poslanců Evropského parlamentu."
1.9050165301636246,-0.02240143745133506,1,my,"Lumrah ibu seperti saya menghabiskan sebahagian besar masa di dapur, maka saya perlukan suasana yang mampu mengikat minat supaya berada lebih lama di ruang itu."
1.2882858229534626,-0.016640859731788634,1,my,"Sampai bila masyarakat terpaksa dihadapkan dengan insiden keganasan ketika penamaan calon dan memaki hamun serta pelbagai fitnah semasa kempen, yang mencerminkan kerendahan budaya politik."
1.1476126518891383,-0.015450335525031021,1,my,"Antara yang memberikan sumbangan ialah penerbit filem Hajjah Ruhani Abdul Rahman, Habsah Hassan, Rubiah Suparman, Syanie Hisham, Jalaluddin Hassan, Rosyam Nor, Ziela Jalil, Deja Moss, Rahimah Rahim, Noniswara, Nash Lefthanded, Helmi Gimmick, Zaibo, Imuda, Salwa Abdul Rahman dan Yusni Jaafar."
0.13646526892521682,0.007738807814916314,1,my,"” “Kampung Sungai Bedil tau nyadika ikon kampung bukai, nambahka nya sida ari Kampung Sungai Bedil mega patut bekunsi penemu enggau orang bukai,” ku iya."
2.139266173270438,-0.029798722626836333,1,my,"``Bagaimanapun secara peribadi saya optimis mereka berkemampuan untuk memenangi lebih daripada itu melihat kepada pencapaian yang ditunjukkan sepanjang tahun ini termasuk pra Sukan SEA dan kejohanan dunia,'' katanya lagi."
0.05229698768858247,2.099070119754007,2,cz,"Někteří zaměstnanci si proto radši na dnešek vzali volno, jiní to řeší i tak, že pokud mají brzký ranní nástup do práce, tak na pracovišti raději přespí."
1.994052247521319,-0.010655245300943925,1,my,"Bayangkan pembikin filem boleh masuk ke situ dengan sebuah skrip dan keluar dengan segulung filem kerana segala kemudahan ada di situ,” kata Ida yang juga aktif menerbit drama."
1.7285491097194623,-0.023271068051700292,1,my,"Ahli politik Parti Sosialis berumur 62 tahun itu menyifatkan pertemuan selama tujuh minit dengan pekerja hotel itu, Nafissatou Diallo sebagai satu kesilapan moral dan perkara yang amat dikesalinya."
4.511922721647987,-0.05756607830434845,1,my,"Sebenarnya, banyak yang telah kita usahakan. Kemampuan kita untuk kekal sebagai sebuah masyarakat yang bersatu padu, di samping kesungguhan kita untuk menjadi sebahagian penting sebuah negara berbilang bangsa dan agama yang harmonis, adalah di antara penunjuk keindahan yang kita miliki."
0.007353708211619309,0.9456010071935589,2,cz,"Více než polovina dotázaných uvažuje o tom, že v letošním a příštím roce začne na serverech i běžných počítačích využívat výhradně operační systém Linux."
0.018930814094866407,2.4614710896433962,2,cz,"Radnice na 13 je agilní, v parku se co chvíli něco děje, takže děti nemají na rozdíl od tenagerů moc času na ničení pěkně upraveného parku."
0.009731872329917143,1.2462771191054034,2,cz,"Apoštol Pavel v tomto svém nejostřejším listě reflektuje význam Kristovy smrti a vzkříšení a dochází k závěru, že víra v Krista není vázána na dodržování Zákona, ale je otevřena všem bez rozdílu."
1.40395798819824,-0.013079088654432695,1,my,Tekanan yang diberikan itu menyebabkan ramai menjangka Syria akan menjadi sasaran selepas Iraq memandangkan AS sebelum ini menggunakan helah sama untuk menggulingkan rejim Saddam Hussein.
1.3912167662170665,-0.01262740706189186,1,my,Dengan keputusan Siti menjadi orang belakang tabir Konsert Satu Suara barangkali menimbulkan perdebatan bahawa Faizal dan Aizat diumpamakan anak emas lantas dibentangkan karpet merah oleh Siti untuk beraksi di Istana Budaya.
1.4452343049726335,-0.017504297737852097,1,my,"Mungkin orang luar nampak saya seperti ketinggalan zaman bila sanggup memasak untuk keluarga, tetapi itulah tradisi keluarga kami. Terima kasih kepada ibu kerana mengajar saya menjadi wanita yang sempurna, katanya lagi."
1.562219383667452,-0.019172816667266373,1,my,Katanya 'Endeavor' merupakan gabungan unik penyelidikan di antara PPSK USM dengan institusi perubatan USM termasuk Institut Perubatan dan Pergigian Termaju (IPPT) dan Pusat Pengajian Sains Perubatan.
0.014330917868254085,1.9207612953432471,2,cz,"Nyní ovšem dokumenty probírá insolvenční správce Josef Cupka, jenž nemá na Haška ani na sportovní svazy žádné osobní vazby. „Finančníci dostali pokyn, že se tímto mají zabývat,“ sděluje Lenka Tichá, mluvčí správce."
0.40083796989452886,-0.004189664290226664,1,my,Dulu laluan bas 116 dapat menepati jadual tetapi kini tiada jaminan daripada Rapidkl mengenai laluan bas 618 samada ia dapat mengikut jadual atau tidak.
0.07250173606729231,0.6089433625723526,2,cz,"» Celkový obrat za fiskální rok 2009–2010, který skončil ke 30. červnu, činil 2,83 miliardy eur. Byl to nárůst o 2,2 procenta oproti loňskému roku. » Téměř osmdesát procent obratu dosáhlo Miele mimo Německo."
0.0269714108771574,1.543076024671536,2,cz,"Nemocniční doktoři mají podle dohody státu s lékařskými odbory dostat od března k průměrným 48.000 měsíčně dalších 5000 až 8000 korun. Velké nemocnice daly peníze na zvýšení platů z rezerv, některé menší nemocnice na to nemají."
2.3376199644023306,-0.005017009541784708,1,my,"Antara harga saham yang merosot ialah saham syarikat penerbangan bajet, Tiger Airways, yang susut 2.1 peratus kepada $1.38 selepas Ketua Pegawai Eksekutif (CEO) Tiger Airways, Encik Tony Davis, menjual sejuta sahamnya atau 24.3 peratus daripada pemilikannya pada harga $1.42, di bawah harga Tawaran Awam Awal (IPO) pada harga $1.50."
2.12006883533099,-0.02821832883940545,1,my,"Ini termasuk beberapa pemain Muslim, yang mewakili pasukan Belanda dan Jerman, seperti Ibrahim Afellay dan Khalid Boulahrouz (Belanda) serta Sami Khedira dan Mesut Ozil (Jerman)."
0.6878524419477458,-0.005514389049934217,1,my,"Peluang ini boleh digunakan oleh anak Lin untuk mewarisi kepakaran nenek misalnya cucu perempuan boleh belajar memasak, manakala datuk pula boleh menurunkan kepandaian bertukang kepada cucu lelaki."
