x1,x2,label,lang,texts
1.8879111020812915,-0.02138228855798115,1,my,"``Tetapi dia (Rony) gagal menunjukkan prestasi yang bagus di sini, mungkin kerana masih kurang pengalaman berdepan dengan tekanan beraksi di temasya pelbagai acara seperti Sukan SEA,'' katanya."
0.011904455817500296,1.6537509831256882,2,cz,"Podnikání by se také měl vyhnout člověk, který není schopen nebo ochoten přizpůsobovat se rychle měnícím podmínkám, být stále ve střehu a hledat nové příležitosti."
0.013395120218678565,1.4945693629642078,2,cz,"Druhá záležitost je velmi rozšířená ‚jízda na babičku‘ – člověk má babičku, pro kterou zařídí parkovací kartu s označením O1 a pak s ní parkuje po Praze bez toho, že by babičku kamkoliv dovezl,“ vypočítává Vojtěch Razima u Acta non verba."
2.3919312916721536,-0.03311938333590053,1,my,"'Daripada pengalaman itu saya mendapati bekerja sebagai satu pasukan sangat penting dalam pekerjaan ini. Pengalaman itu sangat berguna kerana saya kini faham tentang pekerjaan dan keprihatinan para pekerja saya,' ujar Encik Aziz, yang mengaku beliau seorang ketua tegas tetapi adil."
1.839616493574562,-0.023261865060554745,1,my,"Mereka yang ingin merasai citarasa lain bolehlah memilih antara campuran dari bahagian Cina, Jepun, Timur Tengah dan Barat. Ini termasuk Dim Sum, Sushi, Tempura, salads dan pastas."
0.027337995232277538,2.447409222655767,2,cz,"Co se týče V. Klause (předesílám, že ho osobně nijak nemusím) je na základě ústavy ze své funkce presidenta neodpovědný, takže si může kritizovat a podepisovat co chce a to beztrestně vyjma velezrady a jeho ješitnost či narciství s tím nemá co dělat."
1.4610938819571535,-0.01690351079441659,1,my,"“Berbanding tahun lepas, jumlah peserta tahun ini agak menurun kerana beberapa faktor antaranya peningkatan sewa bot. Bagaimanapun, kita gembira kerana pertandingan ini semakin popular di kalangan kaki pancing laut dalam terutama pemancing luar negara,” katanya."
0.00952460907197503,1.2950048369813432,2,cz,"Dodnes, tedy za bezmála čtyři roky, se jí nepodařilo získat plný invalidní důchod, ale její dcera dokonce přišla o to málo, co měla před tím coby ještě „mentálně zaostalá“."
0.02080519296122636,1.639905944648736,2,cz,"František si prý Jacksonovy choreografie zamiloval už jako malý kluk, podle DVD se naučil tančit a od té doby už se prý jen zdokonaluje."
0.8600626151508387,-0.010725213144687754,1,my,"“Kami sepatutnya mengutip tiga mata (ketika menentang Birmingham) untuk membantu diri sendiri, tetapi sebaliknya kami akan melihat kepada perlawanan seterusnya sekarang,” tambah pemain pertahanan tengah England itu."
0.2874969603714693,0.017619981311486142,1,my,"Juluk ati ke bendar pengerami nya diatur kena nutup pengerami hari Hari Gawai 2010 ba tikas Rumah anak patu balu Ajibah Abol, Sri Aman sereta ngerapitka penyerakup ba pupu raban bansa nengah konsep 1 Malaysia."
2.348513501520462,-0.01251126504303468,1,my,"Saksi berkata, van itu kemudian ‘terbang’ ke atas bahagian kereta mangsa dan merosakkan bahagian cermin hadapan kereta sebelum van menggelongsor beberapa kaki di jalan raya dan melanggar bahagian tepi pacuan empat roda yang dipandu saksi kemalangan."
2.0916130771480264,-0.018011748239212737,1,my,"Adakah Saudara Anwar masih ingat pada waktu itu komennya apabila Kit Siang menawarkan kepada Gerakan untuk membentuk kerajaan Cina di Pulau Pinang selepas DAP dan Gerakan mendapat jumlah kerusi besar sementara UMNO 12 kerusi dan MCA, MIC tanpa kerusi?"
0.010445300910370332,1.3942681952916007,2,cz,"Jak se Maďarsko potýká s odchodem lékařů, popsal na Rádiu Česko spolupracovník Gregor Martin Papucsek Víc než maďarských polovina doktorů zamířila do Anglie, následují Německo, Itálie, Rakousko, Irsko nebo Švédsko a další severské země."
1.9641586966926101,-0.02266482585126882,1,my,"Di Pulau Pinang, Yang Dipertua Negeri Tun Abdul Rahman Abbas dan isteri Toh Puan Majimor Shariff menyertai ribuan umat Islam menunaikan solat sunat Aidiladha di Masjid Negeri."
0.009259803515611655,1.0714459895029902,2,cz,"Wawan se ale rozhodnul pro stejný systém, který máme v Sungai Wainu, tedy pro pravítkově rovné cestičky v kompasovém směru, které ignorují tvar terénu a představují jeho náhodné průřezy."
0.06664233529486417,0.8266335577460053,2,cz,"Než jsme se stačili rozkoukat, byl konec první třetiny,“ řekl útočník Jakub Klepiš o úseku hry, ve kterém Švýcaři dvěma góly položili základ ke svému vítězství."
0.008692241031936075,1.0621855336331256,2,cz,"""Chci, aby moje sochy byly přívětivé a třeba i trochu úsměvné. Aby to v lidech vyvolávalo dobré pocity. Myslím, že těch těžkých, drásajících děl je dost a já sám takové věci nemusím,"" přiznává Olšiak."
0.007033664983289912,0.6585249846977924,2,cz,Kdo ještě v prosinci počítal s růstem HDP na rok 2009 ve výši 4% i když i ti největší optimisté věřili v růst 2%?
0.004743557701706532,0.5736024801761458,2,cz,"Oficiálním kadeřnickým salónem je Franck Provost, oficiální plavky dodala Aquila Aqualinea, jako oficiální sekt zazáří Bohemia Sekt a dodavatelem korunek je společnost ŠENÝR Bijoux."
0.022727653701100463,2.185522550689063,2,cz,"Snaží se pomoci těm, které propouštějí z práce Projekt Aktivní padesátka Charitního sdružení Děčín je zaměřen nejen na nezaměstnané lidi, ale také na zaměstnance nad 50 let, kteří jsou nezaměstnaností ohroženi."
0.012320442083265744,1.7015432803180421,2,cz,Hlídá kavárnu Jejího odhalení se včera večer zúčastnila i autorka Barbora Daušová Václav Havel stojí od včera v pražské kavárně Slavia a usmívá se na hosty.
3.8330763461522266,-0.04077572986975814,1,my,Mohd Said berkata pusat hiburan yang bercambah dan ada yang beroperasi hingga ke pagi di bandar raya ini hanya akan meningkatkan masalah sosial di kalangan remaja tempatan memandangkan golongan itu yang ramai mengunjungi tempat tersebut berbanding pelancong asing.
0.02671916287329176,3.678165866379048,2,cz,"A to se nutně dotýká i Čechů, kteří jsou tam doma, dotýká se to jejich úspor, dotýká se to jejich sociálního zabezpečení, dotýká se to jejich kvality a standardu života."
0.00512231768196563,0.6720553299943565,2,cz,"U cesty ležely odřezky ze snědeného psa Nýřany – Rozporcovaný na talíři podle všeho skončil velký černý pes, jehož zbylé ostatky našel mladý ochránce přírody Radek Zeman ve škarpě u cesty poblíž nýřanské pily."
1.9002631096164777,-0.020753203220465026,1,my,"Ivory Coast, yang tewas di pusingan pertama pada penampilan sulung di Piala Dunia 2006, sudah terjejas teruk dengan kecederaan patah lengan kapten pasukan, Didier Drogba semasa perlawanan persediaan menentang Jepun pada 4 Jun lalu."
0.007886864427628086,1.0490949706510264,2,cz,"Stabilizujícím prvkem v systému daňového zvýhodnění zůstává skutečnost, že se nezměnily podmínky daňového zvýhodnění pro zaměstnavatele, kteří v řadě případů stále přispívají jen symbolické částky."
2.8083127710285227,-0.026921928247896073,1,my,"Menurutnya, banyak kajian yang telah dibuat ke atas pelbagai benih pokok jarak dan didapati jenis C5, C7 dan C8 adalah yang paling sesuai dengan keadaan cuaca dan muka bumi kita."
1.5902581952233776,-0.02150825184065098,1,my,"Menurut beliau, Wawasan 2020 bagi menjadikan Malaysia sebuah negara maju adalah suatu yang amat penting dalam membina ketamadunan bangsa dan percaya ia boleh dilakukan berasaskan tempoh pembinaan tamadun silam."
0.005842618063412045,0.5074985734620738,2,cz,"Ze zjištění ruských vyšetřovatelů vyplynulo, že první peníze z konta historika Andrzeje Przewoźnika prostřednictvím jeho ukradené kreditní karty vybrali jen 80 minut po havárii letadla."
0.03438075815776489,1.5551887965705546,2,cz,"Kdyz se oni se ti kluci opaleni nudi. Tak si aspon vymysleli takovou zabavu, ze napadaji bily rasisty co jim nechteji dat praci a jeste jim zavidi tech par tisic socialnich prispevku."
1.1977041760415423,-0.010696173028213879,1,my,"Kedua, Ahmad telah mencatat pergerakan purata 200 hari pasaran saham dan mendapati sejak April 2009, pasaran telah mula naik dan akan kekal naik selama lima tahun."
1.3172484266291549,-0.009239125351118656,1,my,"Dr. Mahathir yang juga Menteri Kewangan berkata, dengan itu, 90 peratus daripada kawasan luar bandar dijangka mendapat bekalan elektrik manakala 80 peratus bagi bekalan air."
0.021303308449045266,0.993841497611516,2,cz,"Jedná se o relativně novou formu využívání moderních, plně funkčních administrativních prostor a kanceláří, které jsou vám k dispozici pro vaše obchodní jednání v termínech, které požadujete, a tak dlouho, jak potřebujete."
0.012483413364190905,1.6973465531637815,2,cz,"Stačilo jen, aby se místo útoku na Sovětský svaz vydal s větinou armády směr suezký průplav a dále na blízký východ, kde měl arabské sympatizanty."
1.235935082847022,-0.016355942474496586,1,my,"Tetapi setiap penyelam perlu mempunyai pengetahuan mengenai penyakit berkaitan agar aktiviti dijalankan nanti lebih selamat dan ini akan meningkatkan disiplin diri para penyelam itu sendiri,'' katanya."
0.05912190346779456,5.579846233433626,2,cz,"* Nejdřív se musíme dohodnout na zadávacích podmínkách. Pochybuji, že to na příští schůzi stihneme. Budu požadovat, abychom si to v klidu promysleli a dopracovali se k nějakému konečnému znění. Lhůta pro přihlášky by podle mě měla být minimálně 4 až 6 týdnů. Zrušit se to může vždycky, je důležité to vypsat. Já si nepřeji, aby to pan Karmazín musel v provizoriu táhnout 4 měsíce. Favorita nemám."
0.009367334334986831,1.2348334951505813,2,cz,"U přednosti tramvaje by mohla být bezpečná vzdálenost od přechodu sto metrů, ale to by chodec poznal jen stěží a nakonec by to mohlo dopadnout úplně opačně."
2.7785101746807843,-0.026041458415441664,1,my,"KTS group yang dikuasai keluarga itu, menguasai empat akhbar, iaitu akhbar berbahasa Inggeris Borneo Post yang mempunyai edaran tertinggi di Sarawak (86,000 sehari), Utusan Borneo (bahasa Melayu dan Iban), See Hua Daily News dan Oriental Daily."
3.6125114808640304,-0.026821951286231216,1,my,"Pada 2010, Kementerian Tenaga Manusia (MOM) menyemak skim WIS dan meningkatkan jumlah wang tunai yang dibayar kepada setiap penerima WIS. Dengan kenaikan kuantum bayaran WIS itu, seorang pekerja berusia 60 tahun dan dengan pendapatan $1,000 sebulan akan menerima $800 dalam bentuk wang tunai atau kenaikan 17 peratus berbanding apa yang diterima mereka sebelum semakan itu."
0.0124088312558196,0.29189906979619845,2,cz,"Ani dluhopisové ani smíšené fondy nehrají prakticky žádnou roli, naštěstí opět zazářila letošní „hvězda“ akciových fondů, které si připsaly 200 milionů korun. Proč hvězda?"
0.021518833314344375,1.0058933574998896,2,cz,"Pro stát by to navíc nebylo výhodné, protože Vodochody by stáhly některé letecké společnosti a pražské letiště by tak bylo pod daleko větším tlakem."
0.02108464138901481,1.2752132085197647,2,cz,"Hezky zpracované stránky, na kterých vaše děti mohou soutěžit ve vědomostních soutěžích, hrát online hry, stahovat si MP3 nebo koukat na videa z pohádek."
1.5261976810824844,-0.01685454807486808,1,my,"Namun, ada pihak yang bukan sahaja tidak menghargai malah mempersoalkan tindakan polis menembak mati anggota kumpulan PCO Boy, yang cuba dikaitkan dengan sentimen kaum."
0.0077297964070629915,1.0243458730817685,2,cz,"Vzápětí se ale za záda Finů dostal Ken Andre Olimb, Komarov ve spolupráci s Niskalou ho faulovali a nařízené trestné střílení Olimb proměnil blafákem do bekhendu."
0.0032681710009364326,0.42500411530301035,2,cz,"Souhlas s jejím udělením však bude muset udělit ministerstvo vnitra, ovšem půjde spíš o to, „vyškrtnout“ některé rizikové oblasti, jako například státy s diktátorskými režimy."
1.8366637652420783,-0.02535629814631507,1,my,"""Menteri Besar, Tan Sri Abdul Khalid Ibrahim juga dilihat hanya seperti patung yang ikut telunjuk DAP dalam apa jua perkara walaupun kesannya menyusahkan rakyat,"" dakwanya dalam satu kenyataan di sini hari ini."
1.3107276097543203,-0.011464009602436846,1,my,"Timbalan Perdana Menteri yang juga Menteri Pelajaran, Tan Sri Muhyiddin Yassin berkata, subjek syarat wajib lulus itu sama sepertimata pelajaran Bahasa Malaysia sebagai syarat untuk mendapatkan sijil SPM."
1.6449974311755982,-0.020533865853225648,1,my,"Buku ADD itu kononnya didakwa oleh Pegawai Khas Hal Ehwal Politik kepada MB Kedah, Hassan Razak ditulis oleh bekas orang kuat Pas Memali di Baling yang dikenali sebagai Cikgu Non atau Zainol Ismail."
0.013787430952357954,1.351111545402982,2,cz,"Lidé za filmová představení utratili 416 milionů korun, o 93 milionů korun… Burzovní společnosti Fio letos propadl zisk na čtvrtinu Fio, burzovní společnosti v prvním čtvrtletí propadl zisk na 3,8 milionu korun oproti 15,7 milionu korun před rokem."
0.010245216127678276,0.9997038092357067,2,cz,V úterý ve 21 hod. má být na National Geographic o této havárii nějaký speciál zřejmě to jej v takové hloubce víc než obtížné.
0.6865619233273716,-0.010770582215681463,1,my,"Meskipun begitu kemampuan Mas Selamat menyembunyikan diri selama empat hari ketika ribuan pasukan keselamatan republik itu dikerah memburunya terus menjadi persoalan sehingga kini, kata sumber itu."
1.5402225976976693,-0.013286205165214332,1,my,"Menurutnya, semasa pilihan raya umum lepas, terdapat 45 daerah dan kini bertambah kepada 47, dengan daerah Serendah dipecah kepada Kampung Baru Serendah dan Bukit Beruntung kepada Taman Bunga Raya."
0.013896313770241293,0.6383671919253333,2,cz,"Následně je podle jeho slov nutné pořídit si takový firemní software, který dokáže pokud možno jednoduše sledovat provoz vozového parku a poskytovat potřebná data."
2.183716580385856,-0.02688132909643854,1,my,Ia terdiri di atas sebuah bukit dan jauh di bawah ialah sebuah kuil berumur ratusan tahun yang dikatakan dibina pada suatu malam oleh dewa Hindu.
0.011636904102729715,1.5480022893760041,2,cz,"Můžeme se dočkat, že ve školce bude teta, která bude dětem pomáhat s převlékáním, někdo může pomáhat ve školní kuchyni, někdo může před školkou posekat trávník a taky v neziskovém sektoru je nedostatek asistentů,“ odmítla rázně kritiku Kohoutová."
2.1148180285847937,-0.027652398437394508,1,my,"""Ini menunjukkan ramai orang telah dipesongkan oleh kumpulan itu. Saya bersimpati dengan mereka... jadi saya beritahu AG (Peguam Negara) tolong timbangkan representasi itu secepat mungkin,"" katanya selepas mempengerusi mesyuarat Majlis Tertinggi Umno di sini, hari ini."
0.014708911664016002,0.7663051405662248,2,cz,"Udělalo mi radost, že si mě vybrali i jako český hlas Mii Farrow, dabovala jsem všechny její filmy, které natočila s Woody Allenem – například Purpurovou růži z Káhiry nebo Hannah a její sestry."
2.9466491752775865,-0.036674967454763355,1,my,"Beliau yakin pandangan positif ekonomi Malaysia dan keadaan pasaran yang semakin pulih di pasaran stok, melabur dalam unit amanah akan menyediakan para pelabuh pulangan yang konsisten dan lumayan dalam jangka masa panjang."
1.259221790010577,-0.009211433041730645,1,my,Usaha ibu bapa sendiri mustahak kerana anak yang dibiarkan berpelesiran pada waktu lewat malam mungkin terus tidak akan pulang atau balik dengan cedera parah.
0.007367849810063934,0.992085488063957,2,cz,"Řeč je o turnajích v počítačových hrách, kde se sejde několik kamarádů, zapojí své počítače do místní sítě a hrají spolu i několik dní v kuse různé turnaje."
0.01849829556451544,1.617042221188988,2,cz,"Vyhrál Švýcar Cologna a stal se králem letošního SP Bauer Lukáš, lyžování, skiatlon Bauerův momentálně největší soupeř Švéd Daniel Rickardsson totiž na domácí půdě skončil třetí a nejlepšímu českému lyřařovi utekl na rozdíl 50 bodů."
0.01967490788472858,1.2093245480594428,2,cz,"Tehdy ""stresové testy"" mj. ukázaly, že pokud by se recese dále zhoršovala, ztráty 19 testovaných bank a finančních institucí by v letech 2009 a 2010 mohly dosáhnout celkem 600 miliard dolarů."
0.010795111833867064,0.5785339657314345,2,cz,"Poptávka po nich roste s hospodářskou krizí, zvlášť pak v drahých městech, jako je New York, která nabízejí jen málo možností pro méně majetné návštěvníky."
2.8857055604215427,-0.029734490290728752,1,my,"Saya rasa Persatuan Bola Sepak Malaysia (FAM) akan melakukan perkara yang sama (beri imbuhan),” katanya kepada pemberita selepas merasmikan Karnival Semarak 1Belia 1Malaysia di Kompleks Belia dan Sukan Kuala Lumpur di Kampung Pandan di sini semalam."
0.008967426951252003,1.1901111596029974,2,cz,"Na druhé straně tohoto příkladu vám leží kontrakt na stole – a když jej ještě dneska doručíte do Hollywoodu, budete hrát v novém Spielbergově filmu hlavní roli."
0.8132102383207864,-0.0059258187490747564,1,my,"Bagi menimbulkan kesedaran tentang perlunya memelihara burung raptor dan habitat mereka, Persatuan Pencinta Alam Malaysia menganjurkan program 'Raptor Watch' setiap tahun sejak tahun 2000."
0.23497665930580322,-0.0008575669144673055,1,my,"Osman Bojeng berasal dari Matang, Kuching memfailkan tuntutan tersebut pada 28 Februari 2006 melalui peguamnya Arip Ameran daripada Tetuan Arip, Ahmad Nizab & Associates."
0.06869596450384369,0.6175833063452267,2,cz,"Pohádku, kterou na motivy slavného příběhu o princezně Růžence zakleté zlou Vílou ostnů a odsouzené ke stoletému spánku přepracovaly Jana Galinové a Lenka Lavičková, mohou děti v sobotu zhlédnout od 15 hodin."
0.010218956322528214,1.3136443801547122,2,cz,"Sis asi myslel, ze budes delat stejny hovno jak za komunistu, ale budes se mit jako v SRN Kretén je jediné slovo které k tomu lze říct."
0.019170733431338197,1.5044419376997509,2,cz,"Na lákavou vějičku investice do „jistého“ obchodu, který měl po 90 dnech přinést zpět celý vklad plus 50 procent jako bonus, se peníze jen hrnuly."
1.275113193724252,-0.006300701004573251,1,my,Ting menarik perhatian bahawa kejayaan cemerlang skuad wushu negeri merangkul juara keseluruhan dan mendulang sebanyak 15 pingat emas adalah sebagai pemangkin untuk memburu kejuaraan pada Sukma 2012 di Pahang.
0.004016328610150303,0.4873044769431037,2,cz,"Pokud byla jízda autobusem nad očekávání příjemná nebo namarkování zboží proběhlo kvalitněji a rychleji než jindy, můžete to ocenit a nikdo vám asi nebude bránit."
0.9395649047820082,-0.01547379440882892,1,my,"Dalam sidang akhbar selepas itu, Setiausaha DAP Perak Nga Kor Ming berkata pihaknya akan menghantar surat kepada Datuk Bandar Ipoh Roshidi Hashim untuk memaklumkan tentang pembinaan semula tugu peringatan berkenaan."
1.5864812942187094,-0.018731790910497745,1,my,"Mereka telah menunggu hampir sejam untuk ketibaan nasi putih dan apabila tidak kunjung tiba, yang tidak dapat tahan berlapar akhirnya mengambil keputusan meratah lauk sahaja."
2.246873267149327,-0.020653383798820802,1,my,"Ketika itu, orang ramai yang berada di luar bangunan hospital terpaksa melarikan diri ke dalam bangunan berlindung daripada serpihan bahan letupan yang berterbangan ketika kawasan sekitarnya diserang."
0.008510941592363977,0.46790088260230794,2,cz,"Podle Federální společnosti pro pojištění vkladů (FDIC), do jejíž kompetence řešení těchto případů spadá, má Superior Bank aktiva za tři miliardy dolarů (asi 50 miliard Kč)."
1.787220308446185,-0.01284803711278707,1,my,Dalam beberapa hari kebelakangan tentera AS dan Britain menghadapi tentangan sengit di luar jangkaan daripada askar dan pasukan separuh tentera Iraq sehingga menyebabkan kemaraan mereka ke Baghdad tergendala.
0.9024335921767039,-0.012913454862796124,1,my,"Sebelum ini, Ketua Jabatan Siasatan Jenayah Sarawak SAC II Huzir Mohd menerangkan bahawa kes tersebut diklasifikasikan sebagai kes peras ugut berpandukan bukti yang terdahulu."
0.014032093912880765,1.4544025411601316,2,cz,"Západ je dnes balkanizován a pokud bychom měli v budoucnu stát proti, řekněme, Hitlerovi 21. století, nebo spíše proti islámské Francii, je nepravděpodobné, že naše muslimské komunity budou bojovat na naší straně."
0.009798463098416324,0.6584078319428499,2,cz,"Hrají T. Gibson, S. Brewsterová, S. Moore a další (40 min) více Do Hotchnerova týmu specialistů na analýzu chování přichází nový kolega, opravdu zvláštní agent David Rossi… Americký kriminální seriál (2007)."
0.006072763998253106,0.8288668718428883,2,cz,"Nebo horší verze, stát se tváří jakoby nic, pohrdání zákony všední, začne být aktivní až někdo vlivný bude potřebovat, třeba levně odkoupit torzo majetku státem nezabrané."
0.02426838011299004,2.5958689441123064,2,cz,"Právě na rostoucí obavy ohledně italských dluhopisů, ale také na zapojení soukromých investorů do druhého záchranného programu pro Řecko se má zaměřit schůzka, kterou podle zdrojů agentury Reuters na pondělní ráno svolal prezident EU Herman Van Rompuy."
0.009097784179935406,0.9104858542805119,2,cz,"Symbolem pohřešovaných dětí je modrý kvítek pomněnky v podobě odznáčku, jehož zakoupením za 30 korun přispějí dárci na aktivity Linky bezpečí, jež šestnáct let nepřetržitě a bezplatně pomáhá dětem v nesnázích."
1.1639607371271736,-0.012261409436762674,1,my,Saya memang obses dengan bulu mata jadi sebab itu saya memilih pelekat bulu mata Shu Uemura dan pembersih mekap sebab ia akan mencuci mekap saya hingga bersih.
1.000038047675512,-0.0030058472681195867,1,my,Usaha sama dengan UNEP akan membantu menjayakan pelaksanaan bangunan mampan manakala MoU dengan Majlis Perbandaran Zhaoqing bakal menyaksikan Singapura berkongsi pengalaman dan kepakaran dengan Zhaoqing.
0.022465593725362158,1.135051210514431,2,cz,"Vaše situace je relativně ojedinělá, diskuse o změně sociálního systému se tak budou patrně týkat spíše toho, jak zhodnotit osoby, které vychovávají děti a zároveň platí pojistění."
0.0006656589952597219,0.06305256671001785,2,cz,"Zelené kotrmelce v Německu a pragmatičtí Češi Pokud Němci v polovině letošního června opravdu definitivně uzavřou osm nejstarších jaderných elektráren, můj vnitřní pocit ohledně dalšího vývoje v.."
3.9457300257293646,0.07784385412532857,1,my,"Persoalannya sekarang ialah, siapakah yang harus bertanggungjawab? Pada hemat saya, melainkan bersebabkan ketentuan Tuhan yang tak dapat dielakkan, pertanggungjawaban yang penuh haruslah dipikul oleh barisan kepimpinan partiparti yang terlibat di dalam proses demokrasi di negara kita ini."
0.9609358013293433,0.006746882130657326,1,my,"Lynch, 19, berasal dari West Virginia merupakan petugas unit itu ketika diserang oleh tentera Iraq berhampiran Nasiriyah selepas tersalah jalan seawal pencerobohan tentera bersekutu ke atas negara Teluk itu sejak 20 Mac lalu."
1.756671568287442,-0.017835987528642752,1,my,"Seminar Harta Intelek yang bertemakan ""It starts with an idea"" pula akan memberi pendedahan kepada golongan pengurusan mengenai kepentingan harta intelek dalam pembangunan ekonomi negara serta kejayaan industriindustri di dalam konteks harta intelek."
0.01305750034227333,0.40150753297606334,2,cz,"Ve výběrovém řízení požaduje za hotel nejméně 25 milionů korun, tedy o 15 milionů korun méně než při posledním neúspěšném tendru z letošního jara."
1.6777617966166043,-0.003089278318367597,1,my,"SEREMBAN 8 Jun  Seramai 20 pekerja cedera ringan manakala tiga lagi dimasukkan ke hospital setelah terbabit dalam pergaduhan antara pekerja asing warga Vietnam dan Bangladesh di asrama sebuah kilang di Taman Semarak, Nilai malam tadi."
0.0070658557555900725,0.9631683445152708,2,cz,"Tazatelům u těchto otázek nejde vždy ani tolik o správnou odpověď, jako spíše o to, zda se uchazeč nenechá rozhodit, jakým způsobem uvažuje a podobně, píše Fortune."
0.0074803785317403325,1.0145210117175103,2,cz,"Žena v USA zemřela na nákazu bakterií E.coli Starší žena na severozápadě USA zemřela v důsledku nakažení bakterií E.coli. Chorobou, kterou tento mikroorganismus způsobuje, nejméně.."
0.0071440816248925796,0.9219454674874525,2,cz,"S odvoláním na zdroje uvedl list Wall Street Journal, že USA ustoupí od projektu protiraketové obrany, jehož součásti měly být v Polsku (rakety) a České republice (radar)."
0.03281589735640483,1.9470291586247381,2,cz,"""Když jsem si poprvé přečetl Liborův scénář, byl jsem si jistý, že to bude dobré,"" řekl Blesk.cz Těšínský, který věří, že to nebyla jejich poslední spolupráce."
1.7838813367479205,-0.023040798032910786,1,my,"MELAKA  Pertandingan inovasi rekacipta model Menara Taming Sari menggunakan bahan kitar semula akan diadakan di perkarangan menara itu di Bandar Hilir di sini, Selasa ini."
0.04095951846977389,0.26180566431213265,2,cz,"Jen loni bylo v Česku u 75 500 diabetiků nově zaznamenáno postižení ledvin, u 90 000 postižení očí, 2313 diabetiků zcela osleplo, více než 8000 lidí musela být amputována jedna končetina a 22 000 osob s diabetickým onemocněním zemřelo."
1.0936540981789236,-0.009079603560580799,1,my,"Gawang Malaysia yang dikawal Khairul Fahmi Che Mat diuji pasukan tuan rumah apabila pengadil Peter Daniel Green dari Australia, menghadiahkan sepakan penalti kepada Indonesia, selepas bola terkena tangan Mohd Sabre Mat Abu dalam kotak penalti."
