x1,x2,label,lang,texts
5.078280691757081e-05,0.0001449716487597278,2,xx,"Россия пообещала выделить 61,5 миллиарда фунтов на модернизацию городов и строительство инфраструктуры, однако Бубнов опасается, что изрядная часть этих денег будет разворована или уйдет на взятки."
1.1946852004392967,0.010250882974865575,1,cz,"Proto se teletext na programu ČT1 vysílá úplný, ale na programu ČT2 pouze výběr jeho nejžádanějších informací tak, aby rychlost jeho odezvy byla přijatelnější."
1.7470032636612807,-0.0457255563476817,2,xx,"“Pagkatapos nitong The Healing, paghahandaan na naman namin ‘yung TV special na ipapalabas this November. Ito ‘yung parang pagbabalik ko naman sa kanilang lahat."
10.178790809875833,-0.38586432913960017,2,xx,"Kung may pagkukulang, totoong ang solusyon ay disiplina. Pero hindi ito puwedeng magmula sa mga nasa kapangyarihan. Kung sila ang magtatakda ng mga nararapat gawin, ano pa ang saysay ng peryodismo? Mabuti pang huwag nang ituro ito sa mga pamantasan dahil ang kailangan lang gawin ng isang peryodista, kung masusunod ang pamahalaan, ay alamin kung ano ang gusto ng huli. Itapon na lang sa bintana ang mga etikal na pamantayan dahil pinapasok na sa pinto ang sensura!"
0.7731269461320529,0.04781032707977994,1,cz,"Situace se obrátí ku prospěchu majitele, když se na aukci objeví třeba jen dva vášniví sběratelé, z nichž je aspoň jeden připraven tak dlouho navyšovat, až koupí."
0.16417728668015738,0.02076609369686466,2,xx,"Tamkajšnje zdravstvene službe so sporočile, da so za nosečnice, otroke in osebe, starejše od šestdeset let, omejile cepljenje proti novi gripi s cepivom Pandremix proizvajalca GlaxoSmithKline; prav takšno cepivo je tudi v Sloveniji."
0.0003458503957436099,0.011712857728514091,2,xx,"Другой эксперт, профессор факультета политических наук Белградского университета Предраг Симич считает, что после 22 июля США значительно усилят давление на страны, не признавшие Косово."
0.07579176600601163,3.0180616758741032,2,xx,"Per a Fitch és «un període llarg», que no sembla un «estímul clar» perquè el sector privat injecti fons, especialment en unes entitats en les quals «hi ha dubtes sobre la profunditat dels possibles problemes de qualitat d'actius»."
0.07723732891142669,0.02177775542506561,1,cz,"Deklarováním republiky se splnila zásadní podmínka míru vznesená ze strany maoistů, kteří dubnové volby vyhráli a jejichž ozbrojené povstání v minulé dekádě zaplatilo životem nejméně třináct tisíc lidí."
0.3610469366809444,0.07789583158753649,1,cz,"Cílem je to, oč se snažíme od počátku naší spolupráce, aby se dostala do dobré kondice a osobní pohody a dokázala si získat zpět vážnost a důvěru veřejnosti a zejména pořadatelů kulturních akcí."
0.22787077074039483,0.033805085081941535,1,cz,"Podle něj totiž každý, kdo je povinen vydat cizí movitou věc a má ji momentálně u sebe, si může takovou věc ponechat („zadržet“) k zajištění své splatné pohledávky, kterou má proti tomu, komu by jinak byl povinen věc vydat."
0.2799355383966785,0.14084773121000263,1,cz,"Co se týká pohoštění, pro chlapy bez kusu pořádneho masa, nachlamptat se vodového boršče, no to může připravit jenom chudina, buranka a nezdvořačka, tak jak jste je všechny nazvala, Hana."
0.08177599788300245,2.614727239422346,2,xx,"En aquesta zona a les set del matí els termòmetres marcaven 1,4 graus negatius, segons dades de l'estació del Servei Meteorològic de Catalunya a Vallfogona de Balaguer."
0.6159099511065009,-0.001854467227641234,1,cz,"Reakce trhů na předčasné zveřejnění výsledků by měla být v zásadě stejná, jako by byla, kdyby ke zveřejnění výsledků došlo v předem očekávaném čase,“ říká například Kamil Bednář – makléř z BH Securities."
0.09978748911559376,0.008182846791312117,1,cz,"Chystá také repatriaci rezerv ze zahraničí Řecko, eurozóna, zlato, dluhová krize Zadlužené země, které budou v budoucnu potřebovat záchranné půjčky, by za ně měly ručit svými zlatými rezervami nebo podílem ve státních firmách."
0.12896843838591246,0.017961121044939975,1,cz,"Hrají J. Spader, C. Bergenová, W. Shatner a další (42 min) (Premiéra) Vdovec Pierre má pět dospělých dcer, z nichž každá je jiná, a to nejen věkem, ale i povahou… Francouzský seriál (2008)."
0.080501978633943,2.8505282426273406,2,xx,"En aquest ple els 135 diputats ocuparan per primer cop els escons i s'escolliran els membres de la nova mesa del Parlament, que presidirà Núria de Gispert."
5.066317947203874,-0.16267225625649928,2,xx,Kailangan lang ng LTO na magsagawa ng information drive para ipaunawa sa publiko na mas mainam ang bagong driver’s license dahil sa security features na taglay nito ‘di gaya ng plastic na madaling mapeke.
0.15830638191354193,0.03282438041673988,1,cz,"Například teplé počasí bez srážek z loňského roku zemědělci prokleli, pro stavaře to však byl jeden z plusů, které se šťastně sešly a umožnily růst tohoto oboru po dlouhou dobu nevídaný."
1.2552950607385385,0.018639670130028707,1,cz,"Na gurmánské ""srandaakci"" bylo možné potkat i kuriózní postavičky. Třeba i starého pána, který se z Ameriky z nějakého prapodivného důvodu odstěhoval do Podivína na jižní Moravu. Tam učí angličtinu. Ve státě Iova prý podle místních vlastnil hotel, který získal Michelinskou hvězdu. A takovou akci, jako soutěž ve vaření guláše, ho nenechala chladnou."
2.8678481584926842e-06,1.7795735707113833e-05,2,xx,"Технологией проведения кесарева сечения, разработанной в ЦГБ № 7, уже активно интересуются врачи со всей страны – они приезжают в уральскую столицу, чтобы пройти обучение и внедрить этот метод в других больницах России, а также ближнего зарубежья."
0.10252207703632,3.388332484516481,2,xx,"Els dos actors es situen a la meitat de la classificació, en els números 9 i 11, i s'han guanyat la seva posició gràcies a l'elegància de les indumentàries."
0.060333680690143734,2.3651496031661363,2,xx,"Impuls al centre urbà Els principals objectius del consistori són incrementar la qualitat del barri com a centre urbà en diferents aspectes, com ara l’atractiu residencial, el seu impuls com a centre comercial i la cohesió social."
0.30604973953098236,0.049125053978044786,1,cz,"Při středeční stávce je nenahradí autobusy, a tak si lidi, kteří spoje PR využívají třeba k cestě do práce, budou muset vymyslet jiný způsob dopravy nebo si vzít dovolenou."
0.18232601388335398,3.4399772797863504,2,xx,"El càstig final va ser excessiu. Mai hi ha llicència per la decisió en el Reial Madrid però si saltes al camp després d'una exhibició golejadora del Barcelona, amb el torn de paraula, ha d'exhibir el seu potencial."
0.23610128692157467,0.04507074099895986,1,cz,"Hrají J. Canela, G. Espinová, M. Varoni a další (42 min) (Premiéra) Nejlepší jsou cyklisti (Climb Every Mountain Biker) Kartářka Belle předpověděla, že si buď do roka vezme některého ze svých bývalých, nebo se nikdy neprovdá."
3.1661311739468974,-0.10615577488214403,2,xx,"Kinilala ang dalawang sundalo na sina PFC. Dunhill Aragon, at PfC. Henry Caunga, na parehong miyembro ng 68th IB ng Philippine Army (PA), parehong pinagtataga at tinadtad ng bala."
2.2860995563858966,-0.05021899065487703,2,xx,"""I’ve promised to win and bring home a medal from here to Sir MVP (Manny V. Pangilinan) and all those who had supported me in the last World Championships,” sabi ni Albania na natalo sa first round ng World Boxing sa Barbados."
0.08754282319296405,2.695375553022511,2,xx,"Perquè no es tracta només de sortir de la crisi, sinó de decidir quina societat, quines ciutats i pobles, quin país i fins i tot quin món volem per al futur."
0.20027291958202675,0.052156334578187864,1,cz,"“ O kuchyni z časů, kdy se psalo c. a k. Počátek 20. století, tzv. belle epoque, jehož symbolem se stala Vídeň s operetní slávou valčíků, honosných promenád a lidových zábav v Prátru, je i dobou věhlasu kuchyně rakouské monarchie."
1.1870234201845216,-0.01178572200609331,1,cz,"Lidé za filmová představení utratili 416 milionů korun, o 93 milionů korun… Burzovní společnosti Fio letos propadl zisk na čtvrtinu Fio, burzovní společnosti v prvním čtvrtletí propadl zisk na 3,8 milionu korun oproti 15,7 milionu korun před rokem."
3.972789406407696e-05,0.0001415737993748852,2,xx,"Комментируя российским журналистам сложившуюся ситуацию, он обратил внимание на то, что поставки газа в Белоруссию и поставки газа в Европу никак между собой не связаны."
0.03961483433996107,0.002363474320133839,1,cz,"Americký výrobce čtyřkolek a sněžných skútrů, fi rma BRP, má ve svém výrobním programu již několik let zajímavou tříkolku, kterou používá ke své činnosti třeba i pražská městská policie."
0.0468052094522653,0.004449666496441803,1,cz,"Podle zdroje blízkého vyšetřování patří hlava Antonu Kulikovovi, který býval ředitelem letiště Čkalovskij, jednoho z hlavních vojenských letišť v moskevském regionu za doby Sovětského svazu."
3.37565142066401,-0.0989832567822786,2,xx,Mahigit sa isang dosena ang grupo ni Perez at binihag nito noong Disyembre 10 ang mga sibilyan matapos na makatunog na sila’y aarestuhin dahil sa iba’t ibang kasong kinasasangkutan.
0.6746944529618443,0.011819538855794244,1,cz,"Jistě, je to trochu nadsázka, vždyť „zdraví“ firmy (její prosperita, rozvoj, pevné místo na trhu) nezajišťují jen zaměstnanci, ale do hry vstupuje i řada dalších faktorů."
0.7693740660615922,0.1833107810372829,1,cz,"Režie Les Mayfield Středoškolák Dave (Sean Astin) se celé čtyři roky na studiích protloukal jak se dalo, ale stejně se mu nepodařilo být nějak výjimečný."
0.11222170093496624,0.026330269756731934,1,cz,"Šestnáct procent dotázaných se přiznalo, že v posledních dvanácti měsících dalo někomu úplatek, z toho devět procent respondentů dalo úplatek pouze jednou a sedm procent víckrát."
0.074850699229482,0.00892849412536876,2,xx,"Zelo smo zadovoljni z obiskom resnih kupcev, ki so nam že s podpisom nekaj pogodb poplačali naš trud in vložek v obisk tega sejma."
0.7346367428047887,0.024150758777559414,2,xx,"Seveda smo idejo, da bi si izborili prostor na palubi RC 44, kaj hitro pozabili, kajti pravično bi bilo, da bi zajadrali vsi, vendar bi potem morala posadka podaljšati bivanje pri nas za kakšen teden."
0.6426986143056489,0.006546895357606654,1,cz,"""Je pravda, že u Pardubického a Olomouckého kraje, které vykázaly nejvyšší meziroční růst firemních bankrotů, byl i nadprůměrný podíl fyzických osob podnikatelů na firemních bankrotech."
0.18302002426822314,0.03587771177189882,1,cz,"Hlavní město ovšem přece jen nabízí limitované možnosti (problém je především v nedostatku vhodných parcel), proto se podle Cogganse investoři začínají poohlížet také v jiných regionech a totéž podle něj platí i pro developery."
0.2736514557970566,0.07932690976858985,1,cz,"František si prý Jacksonovy choreografie zamiloval už jako malý kluk, podle DVD se naučil tančit a od té doby už se prý jen zdokonaluje."
0.258272923219243,2.315621867710906,2,xx,"«Si hi ha dos cotxes n'hi ha d'haver quatre, i si hi ha tres agents n'han de ser sis», va posar com a exemple el portaveu del sindicat vinculat a la policia catalana."
0.6512428554292251,0.01149169461681698,1,cz,"Označit příspěvek jako nevhodný Brusel vede boj s kouřením směšně, řekl Klaus a otevřel linku na cigarety já si o svém prezidentovi čtu rád."
3.9207799869914504,-0.10253388528414104,2,xx,"Ayon kay NCRPO Director Chief Supt. Alan Purisima, na inatasan na niya ang limang district director sa Metro Manila na magsagawa ng foot patrol upang mapalawig ang police visibility sa pagbabalik eskwela bukas."
0.03528821022288459,0.002573352524511515,1,cz,"V USA jižv posledních třech měsících loňského roku ceny nemovitostí ve 20sledovaných velkoměstech meziročně klesaly o 18,2 procenta, v některýchoblastech ale propad překročil i 30 procent."
2.2863956041114603e-05,6.250598884522707e-05,2,xx,"Задержание банды, причастной к ряду резонансных убийств на территории Красноярского края, произошло еще в минувший четверг, но обнародовать эту информацию в правоохранительных органах решили только в понедельник."
0.09218858442343177,3.2128260966367854,2,xx,"El ciclista texà mantenia una bona relació amb el llavors alcalde de la ciutat, l'ara conseller d'Obres Públiques Joaquim Nadal, a qui avisava amb antelació de les seves arribades a la ciutat."
0.06722209469191637,2.4353707482121143,2,xx,"Finalment, el passat 21 de desembre, durant un altre control preventiu d'alcoholèmia establert al mateix punt viari, un conductor va fer cas omís de les indicacions dels agents perquè s'aturés, accelerant i fugint del lloc."
1.9077843953197855,-0.08244374098615455,2,xx,"Ayon kay Sen. Panfilo Lacson, meron aniyang jurisprudence sa mga kasong administratibo kung saan mababalewala ang reklamo o iniimbestigahang eskandalo at katiwalian laban sa isang tao kapag nahalal ito."
7.008934001387424,-0.24459066156550086,2,xx,"Sa report ng Disease Surveillance Report ng National Epidemiology Center (NEC) ng DOH umabot na umano sa 3,410 ang leptospirosis cases sa bansa simula Enero hanggang Agosto 2012 na mataas ng 106.54% kumpara sa 1,651 kaso na naitala sa kahalintulad na petsa noong taong 2011."
0.012834485286826508,0.01720258466412294,2,xx,"Если парламент примет решение о самороспуске, то в 2011 году пройдут выборы 49 депутатов единой палаты, 28 из которых будут избираться по партийным спискам, а 21 – по одномандатным округам."
9.497975899255477,-0.362143019670045,2,xx,"Paliwanag pa ni Africa, hindi tamang pagsamahin o isuma ang “nalikhang” trabaho sa dalawang taong ito. Seasonal kasi ang karakter ng labor market ng ekonomiya, ayon kay Africa. Ibig sabihin, pansamantala lamang ang nalikhang trabaho para sa maraming manggagawa. At pagkatapos ng takdang panahon, muling mawawalan ng trabaho ang mga manggagawang ito. Sa susunod na taon, maaaring makakuha muli sila ng seasonal na trabaho. Kaya lumaki ang bilang ng gobyerno ni Aquino, naulit kasi ang pagbilang sa kanilang may “bagong trabaho” bawat season."
0.6974359794379393,0.03638562251690521,1,cz,"Laxně, ale donekonečna se snaží nazpět zmocnit světa, což v jeho v případě znamená dostat se na stůl, ovládnout kolečkové brusle, nebo přednést naturální básničku."
0.5684663377201331,-0.006802222762960248,1,cz,"Pokud ani přesto dlužník svůj dluh neuhradí, inkasní společnosti vrací takovou pohledávku zpět věřiteli,“ sdělila Právu Jana Tatýrková z M. B. A. Finance, největší tuzemské inkasní společnosti zaměřené na retailové pohledávky."
0.25605136081085966,0.04962928435146491,1,cz,"Úterý 6. 9. 2011, svátek má Boleslav Jak se žije s devadesátikilovým čuníkem Cesira je trochu neobvyklý domácí mazlíček. Tohoto vietnamského černého čuníka si před čtyřmi lety pořídila rodina Squicciarini z obce Lecco."
5.820835742486969,-0.22747566742746733,2,xx,"Ibig sabihin, hindi na maghahalal nang direkta ang taumbayan ng mamumuno sa bansa dahil ang magiging pinuno ng Pilipinas sa ilalim ng parliamentary government ay ‘prime minister’ na at ito ay ihahalal ng mismong mga kongresista mula sa kanilang hanay."
0.569545380102518,-0.00318931242389091,1,cz,"Hrají A. Alda, J. Farr, L. Switová a další Vidím tě ve svých snech (Home Improvement) Tim Allen vám poradí s každým problémem v domácnosti, na zahradě nebo v garáži.."
0.04280726136400618,0.0036800433454337233,1,cz,"Do funkce jej dosadil ministr Jan Kubice, který s ním spolupracoval již v době svého působení v čele Útvaru pro odhalování organizovaného zločinu (ÚOOZ)."
0.2739814486821095,0.03997716955573949,1,cz,"A když jsem psala posledně, že si Dobeš vzal toho kluka aby udělal před volbama dojem, tak mě některý pipky málem uklovaly, jakej že je Dobeš skvělej člověk Tak pozor."
0.6459517853591346,0.017279771260104534,1,cz,"Na domácí scéně pořad mapuje jak zajímavé počiny v oblasti country, bluegrassu, folku a dalších příbuzných žánrů, tak i projekty, které se svým autorům, jemně řečeno, příliš nepovedly."
0.07939055923887534,0.007964743784734928,1,cz,"Označit příspěvek jako nevhodný Stavitelé, co staví u nás, jsou renomovaní z eurozóny V Evropě není evidentně nikdo, kdo by u nás stavěl za nižší ceny."
0.097052251552879,2.962262536778931,2,xx,No ho és de les normes de les autoritats dictades per a enfortir la solvència de les caixes perquè puguin anar als mercats a buscar liquiditat i donar crèdit.
0.1189382709267197,3.819817433545285,2,xx,"Les millores en els tres túnels suposen una inversió de 2,8 milions d'euros i inclouen treballs de sanejament i renovació del ferm, la senyalització i els sistemes de drenatge, així com altres elements de seguretat viària."
0.13801296717869752,0.018005339529021475,1,cz,"Naproti tomu u vysoce kvalitních kancelářských prostor čekáme, že ceny pronájmů půjdou ještě mírně nahoru, poptávka po nich je a jejich nabídka není až tak široká."
0.09128117788193063,0.023864540486984737,1,cz,"Budeme potřebovat přístup ke zmrazeným bankovním kontům bývalých prominentů, budeme muset zajistit péči pro mnoho zraněných Libyjců, budeme potřebovat jídlo a musíme se také postarat o rodiny obětí."
0.08065209792682708,0.006399049641616555,1,cz,"Vláda v současné době připravuje prorodinný soubor opatření, který by zvýšil možnost umístit děti do školek či zajistit alternativní hlídání metodou sousedské výpomoci, aby matky mohly bez větších problémů nastoupit do práce."
0.5670816744023817,0.05566812232922777,1,cz,"Příjmy stouply o čtvrtinu na 2,76 miliardy dolaru, protože více lidí využívalo služeb PayPal i eBay.com. Tržby internetových obchodů, které zahrnují mimo jiné stránky eBay."
0.6458037229413444,0.005967554218322253,1,cz,"Josef hraje závodně šipky, ČR reprezentoval i na MS ve Španělsku, trénuje fotbalové mužstvo dorostu Podlesí a říká o sobě, že je manuálně docela zručný."
6.987579566235143e-05,0.00013998148459527706,2,xx,"В Ладакхе, который является крупным туристическим центром, отрезанными от мира оказались, по разным оценкам, от пяти до шести тысяч туристов, среди которых есть и иностранцы."
0.09318550056467927,2.992139175096938,2,xx,"En els quadres es poden veure figures femenines, però també n’hi ha de masculines i personatges de la mitologia nòrdica com elfs i, fins i tot, personatges de circ."
0.07411703954300111,0.021793908333886763,1,cz,"Výtěžek z dražby korunky vítězné babičky bude věnován Laboratoři experimentální medicíny Olomouc, která se zabývá výzkumem a vývojem nových protinádorových látek a diagnostikou nádorového onemocnění."
5.787486884391015,-0.18258543783780481,2,xx,"“Sa diyos lamang ako magpapagamit,” madamdamin pang sagot ni Lt. Gen. Delfin Bangit sa mga hinalang itinalaga siyang bagong hepe ng AFP para sa balak ni Pangulong Arroyo na makapanatili sa puwesto nang lampas sa kanyang termino. Kilala si Bangit bilang “loyalista” ni Arroyo, at bahagi ng Class ’78 ng Philippine Military Academy kung saan honorary member ang pangulo."
0.6241725714103756,0.0005395429188126439,1,cz,"Po smrti nejbližších vystal obrovský problém. Rodina byla v tak špatné finanční situaci, že neměli ani na pohřeb. S pomocí příbuzných a TV Markíza však potřebné peníze získali. Maminku a brášku pochovali 6. listopadu."
0.6083070181193574,-0.0005467319176028207,1,cz,"Americká ekonomika vytvořila nejméně pracovních míst od loňského září Americká Sněmovna reprezentantů schválila rozpočet na obranu ve výši 649 miliard dolarů (zhruba 11 bilionů korun) pro fiskální rok 2012, jenž začíná 1. října."
6.088809067697489,-0.20780977464239764,2,xx,Dahil na rin umano sa pagsasalita ni Corona ng mga bagay laban kay Aquino ay hindi na ito dapat pang makihalo sa desisyong ilalabas ng SC sa kasong may kaugnayan ang Punong Ehekutibo sa kadahilanang halata na ang pagiging bias at prejudice nito.
1.1172730930247583,-0.01363209864062579,1,cz,"""Na opravy chodníků a silnic jsou vyčleněny čtyři milióny korun. Další tři milióny korun zbyly ze zimní údržby a budou rovněž využity na opravy."
0.03523932537967372,1.5288934200065576,2,xx,"Aquest cop, a diferència d'altre dies, les gironines varen saber patir i, tot i tornar a perdre la lluita pel rebot clarament, l'encert en atac els va permetre controlar el partit fins a arribar als moments decisius."
0.1056596437937944,0.024122366474113602,1,cz,"“ Když začala podnikat, psal se rok 1999, do tří let od startu přebrala její dílna výrobu veškeré kolekce Free Voogue v oblasti plavek a spodního prádla."
0.7155072847927729,0.026291994607777033,1,cz,"Pořad Na nože! je profilován v první řadě jako „zábavný pořad“, prakticky paralelně se „soutěží o hledání nejlepšího (šéf)kuchaře“, ve druhé řadě jako „reality show“, i když ne „v reálném čase“."
1.145701344451267,-0.01073404214258068,2,xx,"Podelitev priznanj jadralcem in modna revija (Ljubljana, 13. maj 2006) Na petkovi svečani večerni prireditvi na osrednjem prizorišču Internautice so podelili pokale in nagrade najboljšim jadralcem regate Internautica Nokia Cup 2006."
0.0776845908720917,2.5235619570361765,2,xx,"Amb el títol 'Altri Paesaggi', l'editorial italiana Franco Angeli, de Milà, acaba de traduir el llibre de Joan Nogué 'Entre Paisajes', publicat l'any passat a Àmbit Editorial (Barcelona)."
0.09860259465980241,3.857092643639983,2,xx,"Empleats del sector turístic egipci van dir que la parella, que havia visitat Egipte el novembre, havia reservat per al seu casament, que es faria el 7 de desembre, un temple i diverses suites d'hotels de luxe."
0.1470146193247199,0.022668784746188105,1,cz,"Stát si zakotvil do legislativy parametry vodní cesty, ratifikoval mezinárodní úmluvu AGN, takže jsme předpokládali, že i ostatní podmínky umožní státu realizaci potřebných investic."
0.49900717935805083,0.09750863193091716,1,cz,"Řidičovým pocitům také prospělo opuštění pevného středu volantu, který sice zlepšoval bezpečnost, ale ovládání jinak spíše komplikoval. Místa je vpředu hojný dostatek u obou verzí, specialitou pětidveřové je obří čelní okno, sahající až nad hlavy posádky. Lze jej zastínit výsuvnou roletkou, nebo se kochat panoramaty, ať už přírodními, či městskými. Nedocenitelné to je také při stání hned pod semafory. Vzadu se dá také překvapivě dobře sedět, avšak pod střechou je poněkud stísněně."
0.08328458305362396,0.02104109320719123,1,cz,"Nebezpečí, horší než to, které zasáhlo v pátek 22. července 2011 Norsko a jež znovu ostře odsuzujeme, hrozí v první řadě nám, antifašistům a pokrokářům, v konečném důsledku ale i velké části světové společnosti."
1.1147747332903386,-0.011954941228094448,1,cz,"A právě toho mnozí řidiči zneužívají a své kolegy přivádějí do někdy složitých situací, protože co uděláte, když na křižovatce přeskočí zelená na žlutou?"
0.4015155889556013,0.06622670177944259,2,xx,"Javorška so zaprli za dolga leta, ves čas sem mislil, da so ga v zaporu zlomili in je zato ovajal, a se je odkrilo, da je špijoniral že prej, takoj po vojni tudi med našimi izseljenci v Franciji."
0.6383572741490019,0.019058297770604,1,cz,"Zadlužení státu neospravedlnitelně roste MARKÉTA ŠICHTAŘOVÁ hlavní ekonomka Volksbank V loňském roce se státní dluh České republiky podle ministerstva financí zvýšil téměř o 100 miliard korun na 493,2 miliardy."
0.15638604783913831,2.5062785348147805,2,xx,"""No estic massa nerviós, encara que sí és cert que quan et pares a pensar en la situació et sorgeixen alguns nervis, però en general per ara estem contents del nostre rendiment i demà veurem si el nostre rendiment pot millorar"", ha explicat Márquez."
0.05762146105038942,2.564606642769422,2,xx,"En aquest sentit la directiva considera que “l’equip està bastant compensat”, tot i que és conscient que el que s’anomena “home gol no hi és”."
