x1,x2,label,lang,texts
4.455733244157333e-05,0.00012807691151054253,2,xx,"Растущие протестные действия граждан по стране, а также результаты муниципальных и региональных выборов говорят о том, что ""Единая Россия"" и действующая власть во главе с Владимиром Путиным начинают сдавать свои позиции."
1.7635779932293443,0.0013306236851628505,1,cz,"Radka HOLEČKOVÁ, odborná poradkyně, společnost Marca CZ Na to také existuje speciální odstraňovač, který je na, na dehet, mazivo a vosk, najdete ho také ve speciálních drogeriích a obsahuje vlastně alkalická rozpouštědla."
0.15583861958449693,4.966458472095543,2,xx,"Calzada va ser, ara fa dos anys, un dels principals promotors de la Fundació Príncep de Girona, conjuntament amb la Caixa, la Cambra de Comerç de Girona i la Fundació Dalí."
0.15225897505638966,2.056721985261106,2,xx,Però el ciutadà també té dret a saber si estaria disposat a comprar un cotxe de segona mà a la persona que es postula a ser president.
1.9193393807989836,0.022957106167925057,2,xx,"Če vas bo rekreacija na trim stezi po začetnih postajah že nekoliko utrudila in si boste zaželeli počitka, si tega lahko privoščite na polovici steze na klopeh za počitek,« pravi Kramar."
0.03941567367160143,0.0027725930623616413,1,cz,Soud však při přezkoumávání žádosti ÚOHS o zásah do obydlí nesmí přezkoumávat otázku nezbytnosti takového zásahu a nesmí ani požadovat nahlédnutí do spisu ÚOHS.
2.0937176013660563,-0.07310752429581856,2,xx,"Tinangka pang isalba ng mga doktor ng Jose Reyes Memorial Medical Center ang biktimang si Alejandro Lascano, 48, subalit binawian din ito ng buhay."
1.3021979401755521,0.027795883275894585,1,cz,"Z tohoto pohledu se dívá většina veřejnostii na kauzu Vítkov a necítí nenávist vůči žhářům, věřícím, že na bordel všeho druhu včetně nakažlivého moru je nejúčinnější oheň, což je potvrzeno dějinami i zákony přírody."
0.12717494055952094,0.01381939565429874,1,cz,"Někdy odhalí tělo ve dvou metrech, někdy je za nepříznivých podmínek nenajdou ani 30 centimetrů pod zemí,"" tvrdí Martin Vondrášek, který nyní vede pražskou policii."
0.12890001830425693,0.017505566077901404,1,cz,"Mravně nedeformovaná Marvanová, lítající v tom jak nudle v bandě, tak skvělým způsobem předvedla politickou zmatenost současného českého občana, který zoufale tápe a opravdu, ale opravdu neví, která cesta je pro něj ta pravá."
0.7777982991634709,0.04719653362407681,1,cz,"Dobrý den, chtěl bych se zeptat jestli je vhodná doba na nákup zlata, také by mě zajímalo co se stane s penězi v bankách např(ČS)když nastane bankrot Řecka?"
0.2260444382076347,0.0439498509845298,1,cz,"Proti Liškově nominaci se nepřímo vyslovil Vladimír Koníček (KSČM). Uvedl, že klub zelených má čtyři členy a pět míst ve výborech. Je to nad rámec poměrného zastoupení, jak stanoví volební řád, podotkl komunistický poslanec."
0.07348711611246132,0.008310940079212634,1,cz,"Skutečnosti, že do stěn s výmalbou nelze nic připevňovat, využili autoři pro volbu samonosného výstavního nábytku, který jen minimálně ovlivňuje celkové vnímání původních interiérů."
1.4062771704003034,0.06267485519303606,1,cz,"Poocházel od hubeného pána s batohem na zádech, který vešel, bloudil po místnosti, nechal se vyhodit od okýnka pro Thajce, byl to očividně smrdutý Evropan, pak se pokusil předběhnout frontu, taky byl zapuzen, tak se postavil na konec a tam úporně smrděl."
7.434037056709186,-0.2919079870520044,2,xx,"Nagmula sa mauunlad na kapitalistang bansa ang 80% ng karbon sa ating atmospera. Pinakamalaki ang kontribusyon ng Estados Unidos sa carbon emissions, na bumubuo sa 23% ng carbon emissions sa daigdig at 42% naman o halos kalahati ng carbon emissions ng mauunlad na bansa."
0.2182045701963239,0.22959903798990572,2,xx,"V zakon pa bi dodali še en člen, ki bi občinskim redarjem dopustil zadržanje osebe, ki bi jo zalotili pri prekršku in ki bi se lahko kazni zaradi različnih razlogov izognila."
0.20853460130081694,0.041688206524053875,1,cz,"Hokejka je v mém případě velmi praktická věc, mám tak opěrný bod,“ směje se dvaašedesátiletý člen hokejového týmu HC Olymp, jehož kapitánem je kolega z divadla Martin Dejdar."
0.6561974907639645,0.016721890607454337,1,cz,Nový tablet od Sony má dva displeje a umí ovládat televizor Společnost Sony by se ráda v letošním roce stala dvojkou na trhu s počítačovými tablety.
0.1545193591695259,0.021665196632533194,1,cz,"Pokud to ovšem vezmu jako celek, mohu také říci, že to dopadne dobře, když tuto společnou měnu budeme společně obhospodařovat a sledovat vývoj tohoto nástroje a přizpůsobit tomu další kroky, aby fungoval."
0.0032127218903237995,0.008007688012934125,2,xx,"Один из крупнейших нефтетрейдеров, компания Gunvor (осуществляет около 40% российского экспорта нефти), совладельцем которой является Тимченко, намерена в четверг выйти на газовый рынок Европы и рассчитывает стать одним из основных трейдеров."
0.37021112304268355,0.0408427832217829,2,xx,"Od 10. februarja, ko je odstopil dotedanji odgovorni urednik Ali Žerdin, je to vlogo opravljala vršilka dolžnosti Suzana Rankov, ki pa po neuradnih informacijah ni med prijavljenimi kandidati."
0.7172273785931114,0.06641463052228938,2,xx,"“This year, I’m turning 45 years old. 45 is a milestone in anyone’s life, ‘di ba? So, instead of having a party, instead of having a big shindig, I’ll just spend the day with my family. Pupunta lang kami ng Singapore. Ganu’n lang, no frills,” dayalog ni Ogie."
0.7923670841941409,0.04889341973525532,2,xx,"Evroskupina se bo po načrtih ponovno sestala v ponedeljek v Luksemburgu na rednem zasedanju, a po nekaterih navedbah naj bi se ministri zbrali že v nedeljo. S tem naj bi bilo zagotovljenega resnično dovolj časa za sprejetje odločitev."
0.9896122619210717,-0.00865935528421686,2,xx,"“Friends pa rin naman kami ni Felix. Wala namang nagbago sa pagkakaibigan namin. Hindi lang kami nagkikita talaga kasi pareho naman kaming busy,” ngiti pa ni Glaiza."
3.1157884207649804,0.5480996759403096,2,xx,"Kung nakainom si JM de Guzman ng tubig na may mga lumulutang na ebs, si Joross Gamboa ay muntik nang nakakain ng ebs na nahigaan niya."
0.12721184673898212,0.016462194473853668,1,cz,"Toto jsou hlavní důvody, pro které jsme vnímáni jako seriozní, sebevědomá a spolehlivá strana, která je vždy za všech okolností připravena k rovnocennému dialogu, uzavírá Belej."
0.15069882943915267,0.021464867886685775,1,cz,"Samozřejmostí je stabilizační systém ESP, brzdový asistent, u citroënu poprvé užitá mlhová světla s corner funkcí a nově je také k dispozici služba eTouch pro případ nehody nebo poruchy."
0.17112122242426894,0.045027750381351504,1,cz,"Pořád jsem čekala kdy se v Prostřenu objeví někdo z těchto končin Valašska a ukáže hostům něco, co by se dalo nazvat krajovým jídlem."
0.11588153833944714,0.01694980440594873,2,xx,"Samosvoja predelava Nirvanine skladbe Territorial Pissings ob 20. obletnici izdaje albuma Nevermind je bil sicer edini, a hkrati dovolj intriganten zvočni zapis za relativno velika pričakovanja, ki so jih fantje s tem prvencem večinoma tudi izpolnili."
3.109112823563037,-0.07801697240045925,2,xx,"Nasa kustodya ng pulis­ya ang suspek na si Rafael Villabrosa Jr., 35, driver ng trak na may plakang GPH 165 at resi­dente ng Bgy."
5.4359109970312325e-06,5.127998778694724e-06,2,xx,"Траурное богослужение проходит в Мариацком костеле (базилика Святой Марии) в центре Кракова в память о трагически погибших в авиакатастрофе под Смоленском президенте Польши Лехе Качиньском и его супруге Марии, передает корреспондент РИА Новости."
0.6083762172804854,0.016487512914116466,2,xx,"1. da mora minimalna plača pokrivati vse nujne življenjske stroške odrasle delovno aktivne osebe, pri čemer nismo upoštevali na primer izdatkov za alkohol in tobak;"
3.7120847923581652,-0.13406999909119652,2,xx,Isang patunay nito ang pagbitbit ng mga congressman ng paper bag na hinihinalang naglalaman ng pera habang papalabas ang mga ito sa Malacañang matapos silang ipatawag ni Arroyo.
1.1929522679777533,-0.04202185455812545,2,xx,"Napanalunan din nito ang KDJM Juvenile Fillies Stakes noong Oktubre 25 sa San Lazaro Leisure Park kung saan tinalo niya sina Ice Storm, My Heart’s Delight at Read To Rumble."
0.12760602502480595,3.833898720409722,2,xx,"La Fira de primavera obrirà les seves portes al públic en general demà a les deu del matí, on hi haurà instal·lada una mostra de les quatre races bovines anteriorment esmentades i també mitja dotzena d’exemplars de la raça cavall pirinenc català."
0.16097947367948573,0.03592369808742082,2,xx,"Đoković je sezono 2010 končal z velikim zmagoslavjem v Davisovem pokalu in četudi je Hopmanov pokal veliko manj pomembno tekmovanje, bi bila nova lovorika vsekakor lep začetek 2011."
0.6068463378152834,-0.00037554814577159593,1,cz,"Dokonce více jak polovina žen prý pere na špatné programy a tak navíc i prádlo někdy musí vyprat dvakrát za sebou, aby bylo skutečně čisté."
0.08037375880146166,3.1965323233124083,2,xx,"Ens comprometem, doncs, com a empresa a la millora d’aquestes incidències ja que el nostre principal objectiu és deixar satisfet el client tant en la venda del producte com en la postvenda."
0.11667544581027474,0.016101750087235574,2,xx,"MOL prek razpisa išče zasebnega investitorja za rekonstrukcijo in izgradnjo Centra Rog v obsegu 9.000 kvadratnih metrov površin, trinivojskih garaž s 578 parkirnimi mesti ter hotela oziroma stanovanjske zgradbe s površino 5.380 kvadratnih metrov. Ocenjen strošek investicije je 39 milijonov evrov."
0.5878883299121356,-0.003316947133495501,1,cz,"Estonský Jaak nám připravil velké překvapení Aby některý z čápů letěl zpátky na hnízdiště po zcela jiné trase než do zimoviště, jsme ještě nezaznamenali."
2.3409268000078946e-05,8.984022879292687e-05,2,xx,"Судья Алексей Иванов на личном приеме исковое заявление Медведева не принял и рекомендовал обратиться к адвокатам, а именно в коллегию адвокатов «Кельт», реклама которой висела при входе в здание."
7.296370741048995e-05,0.0001885545241958613,2,xx,"Романов за три дня до голосования был снят судом с предвыборной гонки по жалобе Коряковой, так как у Романова в списках подписей избирателей, по мнению судей, обнаружились недостоверные сведения."
0.18577172606124231,0.03340023257970995,1,cz,"Ekonomové odhadují, že základní úrok bude v USA rekordně nízko asi po zbytek tohoto roku, i když ještě před projevem se množily hlasy, že k růstu základních sazeb dojde již ve 3.čtvrtletí letošního roku."
0.12072483386038681,3.9586139234140676,2,xx,"Com a exemple d'una ""mala forma de fer política"", Pujol va esmentar la polèmica del Palau de la Música, en què ""algú"" ha pensat aprofitar la situació tirant la culpa a CiU."
1.1250181189131319,0.09292877119172316,1,cz,"Když si nevypneš Caps Lock, tak si tu za blbce Pokud je Domenicco bohatý tak,jak dává na odiv, tak si myslím, že by pro něj neměl být problém se postavit k všci jako chlap."
0.07139457743977556,2.6688547804807468,2,xx,"A canvi, els alcaldes van oferir als empresaris mesures de suport, assessorament i agilitat en els tràmits burocràtics, com ara les llicències d'obres i activitats, a més d'altres facilitats com el pagament de les quotes en diversos terminis."
0.12263756073456922,0.02762884847504307,1,cz,"Důkazem toho, že škola neslouží jen ke vzdělávání dětí, bylo mezinárodní sportovní setkání učitelů, které se konalo v pozdních odpoledních hodinách 30. 5. 2005."
0.1795028032014327,0.04660948442163834,1,cz,"Před oknem celnice se táhly nekonečné fronty a směny se přitom snažily odvést co nejméně práce, aby toho nechaly co nejvíc těm, kdo přijdou po nich."
0.04387491088833845,1.7436599521156153,2,xx,"L'accident es va produir a dos quarts d'una del migdia quan un treballador que realitzava funcions de cristalleria va caure des d'un setè pis, uns quinze metres."
0.8017684668796937,0.028694833329013607,1,cz,"Líto mi je 25000 dětí co na Světě denně umřou hladem nebo rodiny, které nějaký grázl zabije někoho blízkého a pak je za 5 let venku Co to tady starý Bém čochtá, že kašna byla v dezolátním stavu?"
0.1828997130378076,0.03251031421750857,2,xx,"Protesti naj bi po napovedih študentov pred sedežem policije v Atenah potekali tudi v ponedeljek, v četrtek pa naj bi se vrnili pred parlament, še piše AFP."
0.27409653048174654,0.03959496253724857,2,xx,"V njem je duplina in v njej stara knjiga z načrti za igrače in predmete, ki si jih Mulc že od nekdaj želi izdelati."
2.175965491243277,-0.06132549111544984,2,xx,Naiwang kaalyado ni Arroyo ang grupo ni Department of Environment and Natural Resources (DENR) Sec. Lito Atienza kung saan maging sa Kamara ay nahati rin sa dalawa ang lapian.
4.117940500063697,-0.10864804051035422,2,xx,"May dance number daw si Iwa para sa birthday ni Ehra Madrigal at ang sabi raw sa kanya, ang production na ang bahala sa costume na isusuot niya."
1.1758491403359015,-0.0040972234096098336,1,cz,"Nemocniční doktoři mají podle dohody státu s lékařskými odbory dostat od března k průměrným 48.000 měsíčně dalších 5000 až 8000 korun. Velké nemocnice daly peníze na zvýšení platů z rezerv, některé menší nemocnice na to nemají."
1.1892759307322425,0.007997898583659582,1,cz,"Od poloviny dubna, kdy prezident USA a Francie společně s britským premiérem ve společném prohlášení plukovníka definitivně odepsali, šlo všechno ráz na ráz a snahy šéfa OSN či Africké unie o příměří a Kaddáfího odchod se dostaly na ved lejší kolej."
0.21235325583084247,0.050077365080886616,1,cz,"Pokud se ten hnůj nevykydá, tak nás čeká dříve nebo později stejný osud jako Recko, které se prostě za dané situace nemůže státnímu bankrotu vyhnout."
0.09507805386023087,0.02405556651300117,1,cz,Běloruský režim omilostnil devět politických vězňů Polsko a Litva se omluvily za únik dat o běloruských disidentech Běloruský prezident Lukašenko nechal zablokovat sociální sítě Běloruský režim slábne.
0.03931666878608551,0.0073234639859396915,1,cz,"Změnit to chtějí poslanci Petr Krill (ODS), Zuzana Domesová (ČSSD) a Ondřej Liška (SZ), kteří tento týden předložili sněmovně návrh zákona o statusu poslanců Evropského parlamentu."
5.659880063775409,0.4482042738965896,2,xx,Idinagdag pa ni De Villa na ang dapat na maluklok sa Kongreso ay ang mga sectoral group na tunay na kumakatawan sa mga maliliit na tao at walang boses sa lipunan.
0.8066947071203211,0.1884497826068978,1,cz,"On možná jen porcoval kotlety a ujela mu ruka No je to morbidní,ale foto kde byla po 1. bandáži by neškodilo no já myslím creku,že to žádná léčba není,jen přežívání na umělé výživě,jak lidi v komatu!"
2.7228731898548455,-0.12019732171533633,2,xx,"Comptrollership ng pulis at militar, ibigay sa sibilyan Dapat sa isang sibil­yan umano ipahawak ang comptrollership sa Philippine National Police (PNP) at Armed Forces of the Philippines (AFP)."
0.6438089152051306,0.006503338540207663,1,cz,"Tedy nikoli to, co nařizovala vyhláška 137, že každá provozovna, až po ten poslední stánek s buřty na plovárně, měla mít zavedený plný systém bodů."
0.10564836661419301,0.014611529630881233,1,cz,"Z bleskového průzkumu agentury STEM pro Českou televizi vyplývá, že podíl příznivců předsedů ODS a ČSSD Mirka Topolánka a Jiřího Paroubka je nyní přibližně stejný."
0.004083706102431696,0.00014692025330548166,2,xx,"Правоохранители выяснили, что, начиная с 2008 года, злоумышленники незаконно лишали родительских прав малообеспеченных матерей, а после продавали детей третьим лица по цене от $3 до 10 тысяч."
1.8283572383581816,0.08759612091166541,2,xx,Ang pakiusap ko lang po makasuhan sana dahil maraming paglabag ang nasabing repacking ng asukal dito sa Ba­rangay Kaypian San Jose Del Monte Bulacan.
0.1385363070126036,0.029404211915727358,1,cz,"A protože kolovaly již před zasedáním zastupitelstva informace o tom, že o prodeji rozhoduje nejvyšší nabídka, obávali se nájemníci, že družstvo Průkopník v soutěži neobstojí."
3.333445761323853,-0.0679682761794457,2,xx,"Binatikos din ni Perlas ang maagang pagkilala sa mandato ni Sen. Benigno “Noynoy” Aquino III, gayong hindi pa tapos ang bilangan at maaaring humabol pa ang kasunod nito sa karera na si dating pangulong Joseph Estrada."
0.17857961985635734,0.04749974624498259,1,cz,"Naštěstí paní majitelka znala mé rodiče a já od ní dostal takovou celoživotní smlouvu, že dnes se se mnou museli dohodnout i noví majitelé."
4.854803480355271,-0.06298391762099086,2,xx,"Bukod kay Sumagao, positibo ring kinilala ng driver na si Alcantara at testigong si Estrelita Ramos ang isa pang nadakip na suspek na si Virgilio Redito, 35, ng Payatas B Kanlaon St., Group 2, Quezon City at kumpare ni Sumagao na kabilang sa mga suspek."
0.18082373186686326,5.914307914039894,2,xx,"Té assumida la tasca de ""fomentar"" les noves creacions per al culte i expressió de la fe cristiana i, alhora, ""assessora"" els responsables de les entitats de la diòcesi, cosa que aboca a una major interrelació entre la fe i la cultura."
5.685977166636453,-0.18709038172972972,2,xx,"Patay sa hagupit ni Basyang 65 na Halos dumoble pa ang bilang ng mga narekober na patay at nawawala sa nagdaang bagyong Bas­yang simula kahapon kung saan mula sa 39 noong Biyernes ay pumalo na sa 87, ayon sa National Disaster Coordinating Council (NDCC)."
0.08949357538080516,0.020564264242719392,1,cz,"Takze, ja budu ta 3. Hele mladej, kdysi jeden moudry clovek prohlasil, ze je treba oddelit zrno od plevele a ty jsi jen jedna cast toho plevele."
0.6447429675729367,0.004791347753070139,1,cz,"Symbolem pohřešovaných dětí je modrý kvítek pomněnky v podobě odznáčku, jehož zakoupením za 30 korun přispějí dárci na aktivity Linky bezpečí, jež šestnáct let nepřetržitě a bezplatně pomáhá dětem v nesnázích."
0.5777576098456623,0.05978097351098573,2,xx,"Rusija je sicer v zvezi s tem v sredo izjavila, da bo preučila ""konstruktivne predloge"" za končanje prelivanja krvi, vendar pa nasprotuje tako uporabi sile kot sankcijam. Sirijo medtem vsem diplomatskim prizadevanjem navkljub še naprej pretresa nasilje. Visoka komisarka ZN za človekove pravice Navi Pillay je decembra v nastopu pred VS ZN poudarila, da je prelivanje krvi v Siriji zahtevalo že več kot 5000 žrtev, od takrat pa novih podatkov ni navedla."
0.19422418391934837,0.03725708410961109,1,cz,"Ozeleněná bezúdržbová střecha s teplomilnými rostlinami jako jsou například rozchodníky přispívá ke zlepšení životního prostředí v celém areálu. Střecha má přesah, který plní funkci slunolamu. Tím se zlepšila kvalita prostředí v místnostech orientovaných k jihu, kde bylo až dosud v létě vedro. Díky slunolamu proniká nízké zimní slunce do budovy a pomáhá ji vyhřívat, zatímco v létě je sluneční záření odstíněno."
0.06422617323443701,0.004900350483216511,1,cz,Naprosto souhlasím s tímto textem který vystihuje věrohodně situaci po roce 89.Kdyby dnes Karel Kryl žil napsal by daleko ostřejší a ještě pravdivější verzi této písně.
3.721183318405129e-05,0.00010627315048736567,2,xx,"Как говорят многие из тех, кто знал молодых людей (или бандитов) до их «ухода в тайгу», все они были обижены сотрудниками милиции из своего родного Кировского района Приморского края."
0.07528040487662817,2.5574797349725142,2,xx,"• Celebrarem l'última etapa a La Molina, l'estació degana, amb la garantia d'unes pistes magnífiques, l’alè dels afeccionats a la neu i el lliurament final de premis."
0.09713337855073362,0.024249291015065455,1,cz,"Z údajné bomby se ale vyklubal modlitební předmět útok, New York, bomba, Shahzad Faisal Shahzad, podezřelý z pokusu o bombový atentát v New Yorku, po zatčení spolupracuje s úřady a poskytl vyšetřovatelům cenné informace."
0.1052365544594838,2.741072503605102,2,xx,Joan Naspleda substitueix Josep Maria Marquès a l'Arxiu Diocesà Joan Naspleda i Arxer ha estat nomenat pel bisbe de Girona nou director de l'Arxiu Diocesà i també nou director de la Biblioteca Diocesana del Seminari.
0.6234663891068795,0.0031971458058001564,1,cz,"Při všem respektu k základnímu výzkumu je třeba posílit mnohem výrazněji podporu výzkumu aplikovaného, který přinese zvyšování technologické úrovně výrobků a jejich lepší uplatnění na trhu."
0.16673336900037708,0.035120677157300294,1,cz,"Vaše situace je relativně ojedinělá, diskuse o změně sociálního systému se tak budou patrně týkat spíše toho, jak zhodnotit osoby, které vychovávají děti a zároveň platí pojistění."
0.20318763379443475,0.02421519383936068,2,xx,"Kot poudarja Sodišče EU, evropsko pravo predpostavlja, da so pogodbe o zaposlitvi za nedoločen čas prevladujoča oblika delovnih razmerij. Zato državam članicam nalaga sprejetje ukrepov za preprečevanje zlorab, ki izhajajo iz veriženja pogodb o zaposlitvi za določen čas. Med temi ukrepi pa države lahko med drugim določijo objektivne razloge, ki upravičujejo obnovitev takih pogodb."
0.5481371233112511,-0.0073741726523061085,1,cz,"Věstonická venuše slaví 86. narozeniny Přesně před 86 lety objevil v popelišti na sídlišti lovců mamutů mezi Dolními Věstonicemi a Pavlovem tým archeologa Karla Absolona sošku kyprých tvarů, slavnou Věstonickou venuši."
0.6525531836112715,0.010647590515049028,1,cz,"Umělé maso by mohlo naopak svět nakrmit, protože podle propočtů, které provedli výzkumníci na univerzitě v Utrechtu, je možné z jednoho vzorku kmenových buněk získat během dvou měsíců 50 tisíc tun masa."
4.037830312063417,-0.11654008388343867,2,xx,Pinayuhan naman ni Muntinlupa Rep. Ruffy Bia­zon si Judge Reyes na huwag manahimik sa anumang pananakot at pressure na matatanggap nito sa paghawak sa kaso ng mga Ampatuan kaugnay ng Maguindanao massacre.
0.7724044007674955,0.026697664212091056,1,cz,"Zatím je ale na stole varianta, že by žáci měli mít možnost si jako třetí povinný maturitní předmět zvolit mezi matematikou a společenskovědním základem."
0.05324728255794157,0.005182587716170125,1,cz,"Celý život pracuji jako autorizovaný projektant, i teď v důchodu, a tak mohu porovnat kvalitu staveb a vybavenost bytů zhruba od poloviny 60. let do dneška."
0.26186537954838845,0.04863256181750876,1,cz,"Dodnes je velkou neznámou, jak je možné, že vedoucí pracovníci banky o tomto zisku nevěděli, a spekuluje se, že Kervielovy praktiky kvůli jejich abnormální ziskovosti, skrytě tolerovali."
0.6217329673744132,0.014675725368315497,1,cz,"Z těsta vytvoříme malé tortilly se zvednutým okrajem, které usmažíme a pak plníme fazolovou kaší, kterou předtím ještě na sádle a cibuli znovu opečeme."
0.566154806513365,-0.005721580599851076,1,cz,"Podklady o podniku předá vystavovatel realizační agentuře v předstihu jednoho až dvou měsíců, aby mohly být informace prezentovány na serverech veletržních správ a při přípravě průvodce expozicí."
4.11753430862242,-0.15459606908157655,2,xx,Tanging tubig lamang ang laman ng tiyan ng mga nabanggit dahil hindi na sila kumain ng tanghalian bilang pakikisimpatiya sa Morong 43 na ilang araw nang nagsasagawa ng hunger strike.
0.7439620387195289,0.030534163165410057,1,cz,"Zároveň je pro nás cena také výzvou do budoucna a já věřím, že se nám příští rok podaří posunout na stupeň vítěze,“ říká obchodní ředitelka společnosti Andrea Vojáčková."
0.09996735372812826,0.024420200315799202,1,cz,"Společenský oděv není předepsán (hradní server o této akci nic neví), ale nejspíše se nebude jednat o ples maškarní, tak žádné tepláky a adidasky."
0.22257624232449458,0.04493270131539356,1,cz,"Já to nevím. Jako zodpovědný politik budu říkat jen věci, které vím. Já vím, že pan Škárka se intenzivně schází s panem Jurečkem. (Roman Jurečko je šedá eminence plzeňské ODS – pozn. red.)"
3.565984603667558,-0.11071832569875088,2,xx,"“Napakaraming reklamo ang pumapasok sa a­ming website na nagsasabi na hindi daw naman sinusunod ng mga higher education institution ang memorandum ng CHED,” pahayag ni Palatino."
