x1,x2,label,lang,texts
7.83105107862874,0.24898702467497918,2,xx,"Noong isang taon, sana’y kaharap nila ang Boston ngunit hindi ito ang nangyari. Ang Cleveland at Orlando ang nagharap sa Eastern Conference Finals. Nagwagi ang Orlando, sa disgusto ng ilan na gustong makita ang paghaharap ni James at Bryant. Ngunit ito ang Orlando na tumalo sa Boston. “Puwede na siguro sila”, kaya nagapi ng LA. ang Magic."
0.6239770793124826,0.015343528113433591,1,cz,Tunely v úplné rovině aneb jak šikovně prostavět co nejvíce peněz Doporučujeme V Bzenecké Doubravě na jižní Moravě se chystá stavba dvou dálničních tunelů v absolutní rovině.
0.06269158418081558,2.396392729924194,2,xx,"Aquesta es la primera vegada que han entrat a robar a l'estanc de Bordils, però segons van comentar, fa dues setmanes van entrar en un bar i en una fleca del poble."
0.16470747338147812,0.018438865812208934,1,cz,"Ten provoznímu personálu prostřednictvím tisku oznámil, že mu pro příští rok sebere dalších 700 milionů korun. To by znamenalo, že těmto zaměstnancům klesne mzda ještě o pět procent."
0.09538633620503147,3.68422193417645,2,xx,"El titular hel·lè de Finances, que havia mantingut diferències amb Papandreu sobre la conveniència de convocar aquesta consulta, va subratllar que ""és positiu enviar un missatge als socis (comunitaris) que no es durà a terme un referèndum""."
0.0006624748856076095,0.002987182247693102,2,xx,"Операционные доходы до создания резервов на возможные потери снизились на 6,5%, операционные доходы после создания резервов на возможные потери увеличились в 1,9 раза, операционные расходы возросли на 14,8%."
6.72423133660459,-0.30848702629353525,2,xx,"Sa kabuuan ng pagtitipon, tinalakay ng mga delegado ang mga isyung kinakaharap ng mga mamamayan ng daigdig tulad ng migrasyon, karapatang pantao, karapatan sa paggawa, pangangamkam ng lupa sa mga magsasaka, karapatan ng kababaihan, kabataan, katutubong mamamayan, propesyunal, gayundin ang usapin ng sining, kultura at midya."
0.7281037087667114,0.027881469891291574,1,cz,"Když Řepková před rokem zjistila, že jí Erbová svádí manžela, byla vzteky bez sebe. „Jsi lhářka, intrikářka a zlatokopka,“ vzkázala tehdy Vlaďce, s níž má stále nevyřízené účty. Jestli se na Letné ve čtvrtek potkají, může to být pořádné vzrůšo."
0.22038301736486401,0.05229779691258499,2,xx,"In če me sprašujete, kako sem se odločal, vam odgovarjam, da sem se odločal po isti formuli, ki so jo tedaj uporabljali tudi komunisti."
0.04002364029553408,0.0024097269033440693,1,cz,"ODS a ČSSD kontrolovala firma zadluženého Babáka Auditorská společnost Bene Factum, ve které má poslanec VV Michal Babák údajně 15 procent akcií, v minulých letech kontrolovala účetnictví.."
3.745158151860458,-0.12401422527914661,2,xx,Kaya’t umaapela si Palatino sa komisyon na bigyan pa ng pagkakataon ang mga kabataan lalo’t dalawang linggo aniyang naudlot ang pagpapare­histro dahil sa pananalasa ng bagyong ‘Ondoy’ at ‘Pepeng’.
0.10469955638555797,0.03082088768635723,1,cz,"Kromě areálu, který letos za 707 milionů korun vydražila finanční skupina J&T, skladových zásob a strojů po ní zbylo 19 českých ochranných známek, 46 zahraničních a dvě mezinárodní použitelné ve 22 zemích, třeba v Rakousku nebo Číně."
0.9619282612795458,0.05887250655239598,2,xx,"Kot kaže, na svetu ni pristojnega organa, ki bi mu uspelo omejiti neželeno pošto, in celo filtri, s katerimi zmanjšamo število sporočil v poštnem nabiralniku, so uporabni le deloma, saj se mnoga nenaročena sporočila vseeno prebijejo skoznje. Včasih pa se mi zdi, da gre največ energije v nič, ko ročno odpiram in brišem neželena sporočila."
0.1061463336531733,0.018287328399001133,1,cz,"V mladších žácích si nejlépe vedl Zima Tomáš z Roudnice když s časem 83,90 zvítězil nad Mikulášem Zapletalem z Kralup a Vojtěchem Hegerem z Hradce."
6.337523277284125e-05,0.00019086751788396615,2,xx,"В советское время цензоры просто не нашли их, так как музей был закрыт с 1945 по 1955 год. Также на экспозиции можно найти атрибуты и будущей переписи населения России, которая пройдет в октябре нынешнего года."
0.14712704482729,0.028764114354796082,1,cz,"US Tresuries poklesly potom, co FED ohlásil, že by měl začít s prodejem aktiv, aby se zbavil dluhových cenných papírů, které nakupil v rámci podpůrných balíčků."
1.1084533295898025e-05,4.2742710937289025e-05,2,xx,"Я хочу обратить внимание, что мы осуждаем отрицание Холокоста, но при этом миримся с преступным сокрытием или искажением правды об ответственности СССР за убийство польских офицеров и массовые этнические чистки."
0.10803461656891201,3.752429107390122,2,xx,Convergència ha denunciat que el darrer cap de setmana prop de 100 vehicles van fer cas omís del ban de prohibició que l´Ajuntament havia repartit entre els cotxes mal aparcats la setmana anterior.
2.3950312254789607e-05,5.700081157615554e-05,2,xx,"Масляные пятна до сих пор плавают в море вблизи курортов Хургады ­ – отдыхающие отмываются бензином Уральцам, которые собрались в ближайшее время на отдых в Хургаду, следует быть осторожнее."
0.909442644763745,0.05204274962041164,1,cz,"Podle vládou aktualizované verze Konvergenčního programu, který je základním dokumentem země pro přijetí eura, by měl deficit veřejných financí postupně klesat pod tři procenta hrubého domácího produktu v roce 2014. To by podle ministra financí Eduarda Janoty znamenalo přijetí eura v roce 2017. ""Ale ty kroky lze i urychlit a dostat se pod tři procenta již v roce 2013, to ale bude záležet na další vládě,"" uvedl v pondělí Janota."
0.0008627780746770277,5.4493863345902474e-05,2,xx,"Торговые сети, напомним, оспаривали данную норму, утверждая, что на уровне муниципалитетов даже один супермаркет может превысить пороговое значение в 25 процентов, заблокировав развитие сети."
0.7996555959234769,0.02530172209411562,2,xx,"Oglaševanje nezdrave hrane je pereč problem na globalni ravni, saj prispeva k rasti števila ljudi s preveliko telesno težo. Svetovna zdravstvena organizacija je zato z namenom, da bi omejila negativne posledice oglaševanja teh izdelkov v sodelovanju s svetovno potrošniško organizacijo in mednarodno delovno skupino za boj proti debelosti pripravila priporočila za oglaševanje hrane in brezalkoholnih pijač otrokom."
0.04205078564278372,2.0256561534262345,2,xx,"A més, emplaça ""el Conseller Castells, que també està calladet, a explicar exactament quins números va deixar en el sí del Govern i fins a quin punt no va poder contenir el desgavell intern""."
0.10153358680335142,3.368809038544097,2,xx,"Segons aquests, els dies feiners dels mesos d’estiu, la UBS de Can Picafort hauria de disposar d’un metge fins a les nou del vespre. Fins ara, només n’hi ha fins a les sis de l’horabaixa."
2.3014580251797576e-05,6.67511129539827e-05,2,xx,"Проект ""Народные рейды"" был направлен на выявление и предотвращение правонарушений в сфере розничной продажи алкогольной и табачной продукции, а также профилактику употребления алкоголя несовершеннолетними."
0.6860349828611033,0.012397692167410792,1,cz,Jeho cena na mezinárodním trhu je podle Knížáka minimálně 100 miliónů korun. Národní galerie chtěla loni od firmy Interpoint obraz koupit a jako kontaktní osoba za majitele při jednáních s ministerstvem kultury fungoval právě Třeštík.
0.7435750284474465,0.030815239855793916,1,cz,"Více Je vidět, že jste skočili na lep přednímu komunistickému pohlavárovi, který využije všechno k tomu, aby se o něm psalo za jakoukoliv cenu."
0.06494478835785993,2.4415625311048617,2,xx,"Segons el seu parer, la pujada de l'IVA que hi va haver el juliol no s'ha traslladat totalment als preus i encara s'està repartint progressivament cada mes."
0.187119525262678,0.028864904885659425,1,cz,"Následně je podle jeho slov nutné pořídit si takový firemní software, který dokáže pokud možno jednoduše sledovat provoz vozového parku a poskytovat potřebná data."
0.23813356848057485,0.08251888743340102,1,cz,"Tato píseň se vždy zpívala u zapálené hranice dříví, která se musela vždy hlídat, aby jiskry, které z ní lítaly, něco nezapálily a pan učitel u té hranice zpíval s dětmi a rozcházeli se, až když hranice dohořívala."
0.7046346015406022,0.01948160339355104,1,cz,"Tamním obyvatelům už došla trpělivost a dvakrát za sebou silnici zablokovali, aby upozornili na to, že je potřeba urychleně vést hlavní tah silnice 1/11 jinudy."
0.6048876297420198,-0.002400111980933169,1,cz,"Ta by měla od Nového roku na základě koaličních dohod kompletně převzít pravomoci současné inspekce a vyšetřovat trestnou činnost policistů, ale nově také celníků, vězeňských dozorců a příslušníků dalších ozbrojených sborů."
0.06581818738515054,0.009362847598654463,1,cz,"Pokud byla jízda autobusem nad očekávání příjemná nebo namarkování zboží proběhlo kvalitněji a rychleji než jindy, můžete to ocenit a nikdo vám asi nebude bránit."
0.2889651642413751,0.03992223608157789,2,xx,"Da je medijska podoba v Sloveniji danes celo slabša kot leta 1991, je ocenila Eva Irgl (SDS). Po njenem mediji o javnem mnenju v Sloveniji ne poročajo, ampak ga ustvarjajo. Predlagatelji so sicer v zahtevi za sklic seje predlagali nekoliko drugačne sklepe, a je koalicija predlagane sklepe zavrnila in namesto njih sprejela svoje."
1.141391711800643,-0.0033099876899805726,2,xx,"Zunanji ministri EU so pred dnevi ostro obsodili napad na britansko veleposlaništvo v Teheranu kot tudi predhodno odločitev iranskih oblasti, da diplomatske odnose z Veliko Britanijo znižajo na raven odpravnikov poslov oz. da iz države izženejo britanskega veleposlanika."
0.29938206107645887,0.04542377559883218,2,xx,"Tu in tam je slišati razposajen otroški smeh ali izsiljevanje s predirnim jokom, zvečer pa se vse umiri in je slišati le enakomerno gibanje morja."
0.7712015431154404,0.04693276711389468,1,cz,"Nemá důvod Finsko se nechce účastnit na záchranném balíčku pro Řecko Většina Finů je proti tomu, aby se Finsko zúčastňovalo druhého záchranného balíčku pro Řecko."
0.164492741625175,0.0342735883902518,1,cz,"Dodnes, tedy za bezmála čtyři roky, se jí nepodařilo získat plný invalidní důchod, ale její dcera dokonce přišla o to málo, co měla před tím coby ještě „mentálně zaostalá“."
1.109855303731237,-0.013110109589663308,1,cz,"Na druhé straně tohoto příkladu vám leží kontrakt na stole – a když jej ještě dneska doručíte do Hollywoodu, budete hrát v novém Spielbergově filmu hlavní roli."
1.1794613152897095,-0.00568730237702301,1,cz,"Například Měšťanský pivovar v Poličce ročně odvede na spotřební dani 13 milionů korun. Kdyby měl ještě vázat část prostředků na účtu kvůli zajištění této spotřební daně, výrazně by mu to narušilo hospodaření."
0.10156220871954946,0.027287284573743218,1,cz,"V současnosti se používá pět základních typů palivových článků, a to membránové (PEMFC), s tavenými karbonáty (MCFC), s pevným oxidem (SOFC), s kyselinou fosforečnou (PAFC) a alkalické (AFC)."
1.1246995165133633,-0.010731099611476115,2,xx,"Današnji Novi list medtem spominja na glasne negativne odzive številnega občinstva ob odpiranju Arene Zagreb, ki so bili namenjeni slovenskemu delegatu na prijateljski rokometni tekmi med Hrvaško in Rusijo."
0.502832056655708,0.07355130703477615,2,xx,"Gorbačov razpad dejansko obžaluje. Sovjetsko zvezo je poskušal reformirati in jo preoblikovati v demokratično družbo, a mu ni uspelo. Takoj ko je odprl okno svobodi, se je začel proces, ki ga ni bilo mogoče ustaviti."
2.5261675643792914,-0.06903503783864647,2,xx,"“Pinagsabihan na siyang itigil ang pagsusugal niya pero matigas ang ulo niya. Palibhasa may edad na kaya mahirap nang baguhin. Mahirap nang mapagsabihan,” litanya pa ng source namin."
0.20274637710805357,0.04946800576008681,1,cz,"Téhle nemilované zelenině se říká buď růžičková nebo bruselská kapusta podle belgického hlavního města, v jehož okolí se prý pěstovala už před sedmi sty lety. Vyšlechtěna z divokých brukví však byla dřív, snad už za antického Říma."
0.5584605460789237,-0.006358232146505132,1,cz,Tato nová dohoda navazuje na velmi dobrou dlouholetou tradici spolupráce a garantuje divákům České televize možnost sledovat letní i zimní olmypijské hry také v příštích čtyřech letech.
0.6657678113513171,0.01928000002953575,1,cz,"Jednou mi na Svazarmu (tehdejší polovojenská organizace řídící u nás mimo jiné motoristický sport – pozn. redakce) řekli, že jsem moc mladý a do ciziny se ještě najezdím."
0.10321455899787309,0.03001032580989913,1,cz,"Uvidíte drobná, nejen jazyková faux pas, romantické, ale i perné chvilky a jak zahraniční dovolená prověřila vztahy (Premiéra) více Evu, Honzu a Jana čeká poslední fáze seznamování – zahraniční dovolená, kterou stráví už jen se dvěma protějšky."
0.10526367981492832,2.3679272318309965,2,xx,"Al cap de pocs dies els bombers, amb aquella seva espectacular escala, varen retirar la bandera, complint ordres superiors molt concretes i amb el to de donar exemplaritat i contundència."
0.717779627274869,0.021002058050661524,2,xx,"Alpinist Miha Kajzelj, ki ga je načrtoval, je namreč za bivak prejel nagrado Trend 2010, namenjeno strokovnemu vrednotenju in promoviranju vrhunskih dosežkov slovenskih ustvarjalcev na področju sodobne vizualne kulture."
3.2550275148119783e-06,3.8686091981833054e-05,2,xx,"Организаторы попытались в рамках одной площадки объединить экспонаты цифрового искусства, выступления ведущих продюссеров известных лейблов и не только, лекции, небольшой рынок дизайнерской продукции и кино. Лекции Оказались довольно разноплановыми."
0.09526561788215818,3.1902298829587434,2,xx,"Això, fins arribar a la frivolitat que el llibre de Francesc Homs Dret a decidir hagi de tenir com a subtítol «Estació Concert» per poder explicar tot aquest seguit de jocs malabars polítics."
0.7254951997912252,0.027740022068946137,1,cz,"O podobě amerických primárek se dozvíte více zde V Michiganu budou hlasovat především republikáni, protože demokraté potrestali svou michiganskou organizaci za to, že posunula dopředu termín primárek ve snaze upoutat na stát pozornost."
0.5722148476240567,-0.0005059116860467544,1,cz,"Dále byla na výročním zasedání této organizace v květnu 2010 ČR uznána jak země prostá slintavky a kulhavky, moru skotu a jako země s kontrolovaným rizikem BSE."
0.12348969112570131,4.405094831422433,2,xx,"Tot i que la cessió de l'espai parroquial es revisarà tres mesos després de l'inici de les misses ortodoxes, Grifell apunta que ""fins ara, tot va com una bassa d'oli"", i tot fa preveure que la cessió continuarà."
0.14291353258237027,4.335724404137337,2,xx,"I ara, hi ha un mur indigne de ciment, de més de deu metres, a deu pams de la paret sud de la casa."
0.7462207081599405,0.04114496784870449,1,cz,"Podle běloruského opozičního serveru Naviny.by nelze vyloučit, že se skandál rozšíří i na některé další evropské státy, které se angažují v podpoře běloruského disentu."
0.07465142311755793,2.792791486812718,2,xx,"L'operació policial va concloure amb la detenció de sis persones, que els investigadors asseguren que formaven part del ""braç econòmic"" dels Casalese, la més poderosa família camorrista."
0.08404691882434706,0.16726701086201748,2,xx,"Izkupiček prireditve v nordijski hoji (okoli 1100 evrov) so namenili prav cepljenju cerkljanskih otrok proti klopnemu meningitisu, del pa tudi šolskemu skladu domače OŠ Davorina Jenka."
0.7579057996577565,0.023832079647482945,2,xx,"Od starega studia so se poslovili pompozno, tako da so izpod podlakti voditeljev odnesli mizo, na kateri so leta sloneli Popovi komolci, potem pa še za kamerami, verjetno namerno, razbili steklo."
0.1514166810455251,0.03144399214646283,2,xx,"V skladu s staro tradicijo bo nebo nad Moskvo v nedeljo brez oblačka. Bojna letala bodo po potrebi kot vedno s pomočjo kemikalij poskrbela, da se bodo oblaki razblinili še pred rusko prestolnico. Poleg osrednje proslave v Moskvi bodo slovesnosti pripravili tudi v 71 drugih ruskih mestih in ukrajinskem Sevastopolu."
0.005835565513215066,0.008130421312862901,2,xx,"По данным комитета по физической культуре и спорту Мурманской области, необходимость строительства новых спортивных центров обусловлена в первую очередь с тем, что Мурманск обеспечен спортивными залами лишь на 35% от общероссийского норматива."
0.09558700269626634,3.1170789358073674,2,xx,"Un èxit, 'que en part és atribuïble a ell', i això s'ha de reconèixer, segons Mas, més tenint en compte que el seu director de campanya fins ara 'ha rebut molts cops durant molts anys'."
0.32781731760057037,0.0509040227941488,1,cz,"Asi je to důkaz, že to dělají dobře Označit příspěvek jako nevhodný A navíc, pokud k tomuto trestnému činu, tak si jeden z nich nechal věc po tři roky pro sebe."
0.623929001057971,-0.0013643417943129032,1,cz,"Schéma jsem vymyslel za 5 tisíc dolarů Schéma jsem vymyslel za 5 tisíc dolarů Praha/Burlington, 15. 2. 2001 Český matematik Dalibor Fronček, profesor na University of Vermont v USA,.."
0.05479055003891237,0.003910159439577435,1,cz,"Nezbývá než ve dvou pěšky vyrazit do krajiny stínu, strašného Mordoru, aby do ohně v Puklinách osudu hodili Prsten a tím zachránili celou Středozem."
4.6307505909774775e-05,0.00013467582285076794,2,xx,"РИА «Новости» со ссылкой на собственные источники в правоохранительных органах также сообщает о том, что милиционер был пьян, шатался из стороны в сторону и грозился всех уволить."
1.61389344670062e-05,4.2651553504561584e-05,2,xx,"Хун Лэй, официальный представитель МИДа Китая, главного союзника КНДР в регионе, объявил об «обеспокоенности» Пекина событиями в Желтом море, заявив, что обе стороны «должны делать больше, чтобы способствовать делу мира»."
0.7804706259804484,0.036282535473813965,1,cz,"Lobbují za čistší byznys v Česku Je dobré na to pamatovat, když se člověk rozhoduje, zda pro tu společnost má něco udělat, nebo zda má cenu odrbávat daně."
8.013441759898542e-05,0.00019439199089560141,2,xx,Президиум правительства на заседании в понедельник в числе прочего будет рассматривать итоги программы субсидирования авиаперевозок с Дальнего Востока за прошлый год и планы на этот год. Программа действует с 1 апреля по 31 октября текущего года.
8.794401347347899e-05,0.00026752153413876295,2,xx,"В своей книге Леннарт рассказывает, как они с Кампрадом передвигались по Москве на метро. Как были бы удивлены люди, узнай они, что старичок, сидящий на противоположной скамейке, входит в десятку богатейших людей мира."
0.25895854040863125,9.967217711002087,2,xx,"Quant al perfil de la persona que es troba a l'atur, cal apuntar que el 79% és nascuda a l'Estat, mentre que el restant 21% és estrangera; com també que el 54% són homes i el 46%, dones. L'informe apunta, així mateix, que la majoria de desocupats pertanyen a la restauració, el comerç i els hotels (66%), mentre que un 22% són del sector de la construcció. Tan sols un 6% dels aturats són obrers de la indústria, i un magre 1% són agricultors."
3.115929702272326e-05,8.473329529690432e-05,2,xx,"Еще 5% от общего количества платных услуг — предоставление информации и разъяснений, столько же приходится на взимание платы за выполнение органами власти своих прямых функциональных обязанностей, которые они определили как услуги."
0.08113562588894331,3.509252119512166,2,xx,"Les assemblees demòcrates d'Iowa tenen unes regles complicades, una de les quals és que el candidat que no supera el quinze per cent dels vots en el primer recompte ja no es pot presentar al segon recompte i els seus seguidors trien un altre candidat."
0.0003723299824775459,0.01180208869449752,2,xx,"Первый проект резолюции по Косово Белград направил в ГА ООН после того, как Международный суд 22 июля постановил, что декларация о независимости Косово не нарушает нормы международного права."
0.9248086555749228,0.06920621154720262,1,cz,"Není divu, konají se zde oblíbené farmářské trhy. Ke koupi je vše, co by na takovém trhu mělo být. To ovšem kazí fakt, že přibližně polovina budov v areálu je nevyužitá. Navíc se zde nachází například herna či nevěstinec, které rozhodně kazí dobrý dojem."
0.050350194776931284,0.005933629889726947,1,cz,"Čtyřicet nejzajímavějších žateckých nálezů přibližuje Petr Holodňák veřejnosti formou krátkých příběhů, které nabízejí skutečně barvitý obrázek toho, jak také může v praxi vypadat práce archeologa a co všechno a jakým způsobem lze v zemi objevit."
0.2554808247214022,0.03799455080737196,2,xx,"Indijska zveza pilotov (NVG) zahteva vrnitev delovnega mesta dvema pilotoma, ki sta bila odpuščena. Zveza je z letalsko družbo že nekaj časa v pogajanjih in je že zagrozila s stavko, če strani ne bosta dosegli dogovora. Pogajanja so bila sicer napovedana za 14. september."
0.6894001774459256,0.020252727461186226,1,cz,"Richard HINDLS, rektor Vysoké školy ekonomické v Praze Já jsem 10 let nebyl potom ve škole, ale celou dobu jsem učil, měl jsem externí úvazek, nějaké hodiny na dohodu, jak se tomu dneska říká, takže jsem vlastně nikdy učit nepřestal."
0.10114636788946829,1.642729216250576,2,xx,"L’Ajuntament del Palau d’Anglesola ha aprovat el pressupost per l’exercici 2013, d’1.427.000 euros, un cop ha finalitzat el termini d’al·legacions, sense que se n’hagi presentat cap."
3.6292403062557193,-0.08104259776989285,2,xx,Klinaro ni Pardo sa Inquirer/Libre na naipaliwanag na ni Salud ang nangyari ngunit humihingi siya ng malawak paliwanag upang hindi na lumaki ang gulo.
0.5786784189860459,-0.0043677434484655445,1,cz,"Spolu s primátorem Berlína Klausem Wowereitem proto apelovala na obyvatele, aby byli ostražití, a za informace vedoucí k dopadení pachatelů žhářských útoků slíbila finanční odměnu."
1.0891996848756276,-0.015168349540735392,1,cz,Google nabídne telefonování zdarma přes účet na Gmailu Google umožní v brzké době uživatelům služby Gmail volat zdarma prostřednictvím jejich účtu na běžné telefonní linky.
0.0010378550928580208,0.00012965055386591028,2,xx,"ТАЛЛИН (ЭСТОНИЯ) * Состоится церемония вручения наград Европейской киноакадемии (European Film Award), на которую номинирован российский кинооператор Павел Костомаров за фильм Алексея Попогребского ""Как я провел этим летом""."
0.677754652425297,0.023310433804619415,1,cz,"Z některého z venkovních bazénů se můžete kochat pohledem na zasněžené hory přírodního parku Nockberge, sauny bývají prázdné a do restaurace je vstup v plavkách."
0.30271286877696013,0.055474268101060265,1,cz,"Lidé, kteří mají zahradu, se tak nezřídka rozhodnou pro koupi bazénu, který si lze pořídit už za méně, než je průměrný plat u nás."
