x1,x2,label,lang,texts
5.1014210321118885,-1.7679569064419094,1,es-AR,El proyecto para levantar el Edificio Tecnológico dentro de la Siberia está estancado por demoras relacionadas con el uso las tierras. Es que el espacio que la Municipalidad y el Polo están pidiendo pertenece a la Universidad Nacional de Rosario.
8.356316321628857,-0.7972300645555596,1,es-AR,"* El aumento de la tarifa por la mayor profundización no asusta a los usuarios, ya que saben que se compensará con el ahorro de flete que generará la posibilidad de que los buques salgan más cargados por los puertos del interior. Es más, hay muy buena opinión de los usuarios de a calidad del servicio prestado por Hidrovía SA, algo poco usual en las concesiones."
4.233697851892127,-0.6683407270294955,1,es-AR,"Montenegro, en respuesta, se quejó porque ""al único cliente que se le deja de dar servicio de adicionales es a la Ciudad de Buenos Aires"" y remarcó que esto no sucedió, por ejemplo, ""con el supermercado Coto""."
2.395088441746791,-1.698451604164049,2,es-ES,"Una lámina de agua recubre el cristal, teóricamente para protegerlo, si bien realmente lo único que consigue el fluido es impedir aún más que se vea algo del yacimiento arqueológico."
5.525654190828101,-1.9285973250443502,2,es-ES,"En segundo lugar quedó el Tea Party, el movimiento estadounidense de corte conservador y que tiene entre sus exponentes a la ex candidata a la vicepresidencia Sarah Palin. Terceró quedó Assange, quien sin embargo había sido elegido como persona del año por los lectores de la revista. A este respecto, Stengel ha subrayado que ""Assange ganó nuestro sondeo por un amplio margen, pero, por supuesto, en segundo lugar quedó Lady Gaga. Nosotros tomamos todo eso en cuenta""."
4.7785188605730395,-0.7527017302581267,2,es-ES,Mas no es imposible que Sharón intente aferrarse al cargo de primer ministro conformando una ajustada mayoría con el apoyo de los ultraderechistas. Sharón pondría sus esperanzas en un ataque norteamericano sobre Irak que provocaría una innegociable unificación de todas las fuerzas políticas israelíes en torno al primer ministro e incluso podría provocar la vuelta laborista al gabinete.
7.2873657426014145,-1.1205209126666453,1,es-AR,"En la entrevista, donde detalla el desmoronamiento de su matrimonio, Marianne afirmó que el ex presidente de la Cámara de Representantes trató de llegar a un acuerdo matrimonial que le permitiera mantener a su amante mientras seguía casado con ella. La tercera en discordia era Callista Bisek, una asistente que se convirtió en la tercera esposa del ex legislador."
5.059429494309794,0.43875563078663654,1,es-AR,"El mercado esperaba que se crearan 150,000 plazas desde la cifra original de diciembre de 200,000 y que la tasa de desempleo se mantuviera en 8.5%, de acuerdo con Reuters."
3.0620348709557788,-2.3311183324685114,1,es-AR,"Sin embargo, el buen trabajo de contención del conjunto dirigido por Frank Kudelka no tuvo correspondencia en el plano ofensivo, por lo que Agustín Orion no tuvo demasiados problemas para conservar su invicto en el Clausura (llegó a 33 partidos oficiales sin derrotas)."
6.375939747649684,-1.5583971959664067,2,es-ES,"Según los informes, «se da una situación mayoritaria de locales donde se permite fumar, ya que sólo entre un 15 y un 20% de establecimientos lo prohíbe». Además, añaden que en «los locales de más de 100 metros que pueden habilitar una superficie para fumar que no exceda el 30% del local no se cumple siempre la ley»."
4.903995125071823,0.013008721779727407,1,es-AR,"El ex marido de Jennifer Lopez ya había colgado previamente en Facebook una foto suya con la joven de 24 años, en la que ambos aparecían besándose y abrazándose. ""Gracias"", escribió entonces el cantante de 42 años bajo la fotografía."
5.432240282027935,-3.541138197208799,1,es-AR,"Alfredo Sáenz resumió el modelo Santander en filiales que cuentan con una fuerte presencia local en los mercados en que está presente, que son financieramente autónomas pero tienen una fuerte integración operativa con el grupo. “Tenemos un modelo de negocio que nos permite tener más valor que la suma de las partes”."
3.7897386092616427,-1.2325383550114977,2,es-ES,"Además, García aseguró que la Comunidad «ejercitará en el momento procesal oportuno las acciones judiciales que correspondan para exigir el cumplimiento íntegro de las obligaciones legales en materia de financiación autonómica»."
5.099198599160023,0.49208829656557007,2,es-ES,"«En la India ya hay varios hospitales que utilizan este tipo de medicina que busca los desequilibros. A través de los pulsos, la lengua y los ojos y te dicen cómo tienes los órganos y los cinco elementos, fuego, agua, tierra, metal y madera», explica Josefa Nieto, presidenta de la asociación Amigos del Tibet."
6.807673913167025,1.1829627812841452,2,es-ES,"La participación de la escudería Prodrive en el campeonato del mundo de Fórmula Uno debería haberse anunciado oficialmente a mediados de julio, coincidiendo con la disputa del Gran Premio de Gran Bretaña, pero hasta que no se aclare ese concepto de constructor y concursante no tendrá el proyecto la luz verde definitiva."
4.946003076089428,-0.0033324799052173327,1,es-AR,"La cita será el próximo 4 de diciembre, desde las 23, el Centro de Convenciones del complejo, en donde Ventura aprovechará para festejar los 9 años de la revista en el mercado, con una mega fiesta."
3.6787797438096046,-0.4628272021803782,2,es-ES,"A última hora de ayer su estado era estable, salvo complicaciones, por lo que permanecía ingresado en espera de comprobar su evolución. Fuentes del centro hospitalario han señalado que gracias a las costillas la herida producida por la radial no afectó a ningún órgano vital."
8.200785994290996,3.02460782820917,2,es-ES,"Este plan sistemático configura para Garzón la ""posible existencia de una acción concertada para la ejecución de una multiplicidad de delitos de torturas contra las personas privadas de libertad en Guantánamo y otras prisiones, entre ellos Bagram (Afganistán) que adquiere casi un nivel oficial y que, por ende, genera una responsabilidad penal en las diferentes estructuras de ejecución, mando y diseño y autorización de ese plan sistemático de tortura""."
3.669782805334101,0.18205225565898303,1,es-AR,"Con respecto a la forma de pago, el 98% usa la tarjeta de crédito, aunque viene creciendo el pago en efectivo contra reembolso y se mantiene estancada la transferencia bancaria."
8.014001994218034,-4.488922131559096,2,es-ES,"Fuera del ámbito económico, el barómetro constata que el terrorismo sigue siendo un fenómeno que sigue preocupando a los españoles, pero menos que antes del verano. Ahora ocupa el cuarto lugar, mencionado por el 18,6% de los encuestados, 2,3 puntos menos que en julio, cuando figuraba en quinto puesto de la relación. Lo mismo ha sucedido con la vivienda, que ahora inquieta al 18,4% de los ciudadanos, cuando en el anterior barómetro esta cifra era del 21,5%."
4.706122654985671,-1.6437218593039291,1,es-AR,"La misteriosa desaparición durante tres días y la presunción de que se haya ido voluntariamente o por problemas psíquicos generó malestar en el gobierno rionegrino. El flamante gobernador, Alberto Weretilneck, consideró que ""no debe seguir siendo intendente"" y planteó que la Legislatura de Catriel debería analizar su continuidad."
5.173728397761933,-0.7793493639031788,2,es-ES,"Cuando se establezcan normas específicas para ámbitos concretos, si como consecuencia de actuaciones de urbanización legalmente desarrolladas en un entorno próximo, el ámbito concreto al que se refirieran los criterios de protección del paisaje hubiera perdido las condiciones recogidas en el apartado 1°, los ayuntamientos deberán promover la modificación del planeamiento para adecuarlo a esa nueva realidad física.»"
4.617793223369944,0.2535631325080007,1,es-AR,"""La causa de Malvinas ya es regional y global porque hay depredación de nuestros recursos naturales, como el petróleo y la pesca, y esto puede llevar a un verdadero caos ecológico"" y analizó que ""las grandes batallas del siglo XXI se van a dar sobre los grandes recursos naturales de los países en desarrollo""."
5.0377085843855065,-0.8679666229184706,1,es-AR,"Para los republicanos, la reforma sanitaria supone ""un desastre económico y fiscal de proporciones sin precedentes"", según el representante David Dreier, para quien ""se agota el tiempo para deshacer los daños causados"" por la reforma, parte de la cual ya ha entrado en vigor, y que se irá implantando progresivamente durante los próximos cuatro o cinco años."
5.016453526293817,-0.01793248468217746,1,es-AR,"Ambas transacciones, que se enmarcan en el plan estratégico de la petrolera para equilibrar su cartera de activos, se firmaron a un precio de 42,4 dólares por acción, lo que le otorga un valor a YPF de casi US$ 17.000 millones."
6.681720735657471,-0.6575929836816705,2,es-ES,"Permanecerá, además, en el recuerdo la obra y la persona de Eduardo Chillida, el escultor vasco que también nos dejó en 2002. La obra del artista donostiarra, caracterizada por su introducción de espacios abiertos, perdurará con El peine de los vientos, que se abre al mar de San Sebastián."
4.419564304272408,-0.4074301132473024,1,es-AR,"El protagonista de `Braveheart', que tiene siete hijos más con su ex mujer Robin, ha pasado últimamente más tiempo con su bebé después de que su exnovia retirara los cargos por malos tratos en un intento de firmar la paz."
7.6551353006724785,2.083516305618852,1,es-AR,"Grecia, abrumada por el peso de su deuda soberana y por la subida de los intereses, tuvo que recurrir a la ayuda financiera del Fondo Monetario Internacional (FMI) y de la zona euro en mayo pasado, pero tiene la intención de volver a los mercados de obligaciones a largo plazo en 2011, tras adoptar un drástico plan de austeridad."
7.653161784960064,0.08213831943265319,1,es-AR,"También se mostró crítica su futura compañera de bloque, Laura Weskamp. “Vemos que hay mayores privilegios para los sectores altos y se deja de lado a los medios y bajos”, manifestó teniendo en cuenta que el grueso de los proyectos de este tipo se concentran en Puerto Norte y se traduce en apertura de calles, pavimentaciones, luminarias y mejoras general en la infraestructura de ese sólo lugar."
8.74825422640648,-1.2709011837221287,1,es-AR,"Después de que el gobernador electo, Antonio Bonfatti, anunciara ayer el gabinete que lo acompañará en la próxima gestión, el futuro ministro de Producción, Carlos Fascendini, tuvo el primer contacto con la prensa en la Cuarta Conferencia Industrial de la Provincia de Santa Fe organizada por Fisfe en Esperanza. “Jugamos un papel importante en Argentina y por eso merecemos mayor atención para generar mejores condiciones de productividad respecto a quienes están en otras latitudes y tienen mayores beneficios”, aseguró."
5.608882165684917,-4.1037009325011224,2,es-ES,"Los sindicalistas, que niegan que la medida vaya a conllevar pérdidas económicas o laborales a la hostelería, piden a los empresarios que se impliquen en los planes de deshabituación del tabaquismo, que regulen las sanciones por fumar y también que, en el sector agrícola, se replantee una reconversión laboral para quienes se dedican al cultivo del tabaco en España."
8.243554729053935,2.298812137973736,2,es-ES,"La cantidad fijada por el Ayuntamiento de Valladolid es la mayor de las que aplican buena parte de los municipios del alfoz y la provincia. Aunque la crisis económica sacude los ingresos de las arcas municipales, no todos los Consistorios aplican el cobro de estos precios por la prestación del servicio y uso de dependencias locales."
7.621543553729527,0.9560056834016779,2,es-ES,"El paro tiene dos componentes básicos. Uno de ellos es el aumento de la población activa, es decir, el aumento de la población que se incorpora al mercado laboral en busca de un empleo. El otro componente es la destrucción de puestos de trabajo por unas u otras razones."
8.976124985174557,-1.741523131817164,2,es-ES,"Clinton destacó lo importante de dar ayuda a los damnificados de Haití y también explicó el programa durante una entrevista que le hicieron el cadena de televisión ""ESPN"". ""La situación en Haití es desastrosa"", destacó Clinton, que ha viajado a través del país devastado por el terremoto que ha dejado cerca de 100.000 muertos y cerca de un millón de heridos. El ex presidente estadounidense destacó que era ""imprescindible"" que todos colaborasen en la reconstrucción y ayuda al pueblo haitiano."
3.019712751366846,-0.05679398683381164,2,es-ES,"Los impulsores del proyecto, germinado en los años ochenta durante una charla entre amigos, decidieron que su intención primaría proteger esa especial forma de hacer humor de los autores gallegos, por eso contactaron con distintos artistas para solicitar su ayuda."
2.4926986172522088,0.48744401822519035,2,es-ES,"La afición del Racing, además, vivirá un intenso duelo ante el Atlético de Madrid (colchonero.com) si bien, no se podrá descuidar ante Osasuna (somosrojillos.com.com) y Sporting de Gijón (puxamolinon.com)."
6.067725671018877,-0.10885399692880238,2,es-ES,"El presupuesto del proyecto Trenta IV es de 208.397 euros, de los que 132.935 son financiados por la Unión Europea y 75.461 por el Ayuntamiento. Los interesados pueden ponerse en contacto con la Agencia de Desarrollo, Villaflorida (calle de Magallanes, número 30) o en el teléfono 942 20 30 30."
8.241237324959314,2.388900455504832,1,es-AR,"Pecam también viene haciéndose fuerte en la obra pública. Recientemente, se ocupó de la recuperación edilicia y arquitectónica del Molino Franchino, la obra cultural impulsada por la ministra María de los Ángeles González, que fue días atrás inaugurada en la ciudad de Santa Fe. Pero además estuvo a cargo de obras municipales y provinciales, como centros de salud, obras de infraestructura vial, eléctrica e hidráulica, y 700 viviendas sociales en toda la provincia."
5.450879053351684,0.0823507324971957,2,es-ES,"Ángel Rivera ha detallado que a partir del jueves la masa de aire polar afectará al tercio norte en materia de precipitaciones, ya que la cota de nieve bajará allí hasta los 500 metros, por lo que se han activado avisos de nivel amarillo (riesgo) y naranja (riesgo importante) por nevadas."
2.527010965965297,0.14816507947975488,1,es-AR,"Por cada 100 puntos acumulados en el día, los socios de WIN recibirán un cupón para participar. Si todavía no te asociaste a WIN, pedí tu tarjeta para comenzar a jugar e incrementar tus chances de ganar!"
2.3915415788494805,-0.9290290979310734,1,es-AR,"Cuando era ministra de Defensa Garré respaldó al almirante Jorge Godoy por aquel escándalo en Trelew hasta que, recién en diciembre pasado cuando fue procesado por la Justicia, se lo pasó a retiro."
3.729542559123488,-5.314534746898823,1,es-AR,"El empresario rosarino del rubro turístico, Gabriel Gambini Lo Valvo, estaba acostumbrado a que cada vez que llegaba a San Pablo o a Curitiba un coche lo estuviera esperando para trasladarlo directamente al lugar al que debía concurrir. Teniendo en cuenta el creciente perfil turístico que fue adquiriendo Rosario en el último tiempo, se le ocurrió que este sistema podía replicarlo acá, adaptándolo a las cualidades locales."
9.40455432358687,2.3426169129068377,1,es-AR,"En términos generales, sorprendió la ausencia total de J. Edgar, de Clint Eastwood, que no nominaran a Las aventuras de Tintín como mejor filme animado, la ausencia de Steven Spielberg como mejor director por Caballo de guerra , la poca atención a Damas en guerra (a la comedia le sigue costando en los premios); y la inesperadamente alta repercusión de El topo, El árbol de la vida y Tan fuerte y tan cerca ."
8.75271926264634,0.5489873375623306,2,es-ES,"Diferentes conceptos han agrupado este año a los 'Ego' de la pasarela Cibeles. Entre ellos ha destacado Urkía, que ha creado una 'Selva de asfalto' en un concepto de safari creando una colección urbana que combina piezas oversize y su represión con prendas más ajustadas. Por su parte Montolo se ha inspirado en algunas películas mexicanas para crear referencias iconográficas interpretadas en claves de humor, utilizando piel y punto tricot, una vez más la estrella de la colección, y a la que se suman linos y viscosas de acabados ligeramente brillantes."
6.839391067825078,2.305089479317316,2,es-ES,"El embajador de Venezuela en España, Isaías Rodríguez, ha acusado a la Policía Nacional de haberle ""maltratado de forma verbal"" en el control de pasajeros del aeropuerto de Barajas a su regreso esta mañana de Caracas y retenido el pasaporte de forma indebida durante quince minutos."
9.588988431596901,-3.338837282455516,2,es-ES,"Su tortura acabó el pasado sábado, cuando Pedro José, un policía local en segunda actividad, que había hecho unos días atrás sus averiguaciones después de que algún «confidente» le hablara de que en la calle La Sierra había una 'inquilina' muy especial. «Utilicé los contactos que tengo y cuando tuve la certeza de que estaba en esa casa, no me lo pensé. Fui y conminé a un rumano que la vigilaba a que me la entregara», relata el policía local, quien actuó desarmado porque carece del permiso de la Alcaldía para llevar pistola."
8.095376670003878,-0.8193483595388341,2,es-ES,"Tanto para el Partido Popular (PP) como para Izquierda Unida (IU), el retraso de la edad de jubilación es una auténtica «barbaridad». El diputado del PP Tomás Burgos remarcó que se trata de la iniciativa «más dura e impopular de todas cuantas se han aprobado en relación con nuestro sistema de pensiones». «Creemos que no conseguirá convencer a los grupos políticos ni a los sindicatos para que se apruebe la propuesta», añadió."
1.821539414322748,0.993702807170491,1,es-AR,"Actualmente, Funescoop, cuenta con 40 empleados “destinados a cumplir con todos las demandas de los asociados, brindando atención personal a cada uno de ellos”."
7.257964198553042,-0.01534784142935309,1,es-AR,"El Consejo Directivo de la UAR confirmó a Rosario y Mendoza como sedes de uno de los partidos que disputarán Los Pumas durante el año próximo. Ambas ciudades, a través de sus Uniones provinciales y el apoyo gubernamental, cumplieron con los requisitos planteados por la UAR para albergar alguno de los partidos que disputará el seleccionado Mayor en 2012."
2.609536588370841,-1.415593173735615,1,es-AR,"Desde entonces, Washington utilizó en cinco oportunidades su voto negativo contra créditos que la Argentina negoció en el BID, que, de todos modos, fueron aprobados."
9.209665530650788,2.549494565659685,2,es-ES,"Mientras la Policía Nacional está tomando declaración a personas cercanas al entorno de Carmen R.J., ha trascendido que la pareja habría protagonizado previamente algunos episodios de violencia machista, extremo que habría motivado incluso la apertura de diligencias judiciales, si bien este extremo estaría aún por confirmar. El supuesto autor del crimen, de cualquier manera, tiene sobre sus espaldas al menos medidas cautelares en el ámbito de la Comunidad Europea por motivos de extranjería y probablemente algún antecedente relacionado con algunos de estos episodios de violencia sexista."
1.7920877084249727,-1.2134594150941582,2,es-ES,"Tras una petición del Gobierno marroquí, las centrales sindicales marroquíes han decidido aplazar la huelga que habían convocado para este lunes en las empresas españolas instaladas en Marruecos."
13.998119954720215,-0.8961545253880638,2,es-ES,"El paro aumentó en 18.000 personas en Málaga en 2007, con lo que el número total de desempleados se situó en 88.500 y la tasa de paro alcanzó el 12,28 por ciento, según los datos de la Encuesta de Población Activa (EPA), difundida por el Instituto Nacional de Estadística. En el cuarto trimestre del año, la tasa de paro se incrementó en la provincia 1,94 puntos en relación al mismo periodo de 2006. Mientras, la tasa de actividad se situó en un 57,22 por ciento y el número de ocupados en 632.500 personas."
9.24639346923865,-1.182456766051901,2,es-ES,"El órgano de la parroquia Santa María ha vuelto a sonar en 2010. Tras más de dos años de arduo y exigente trabajo, coordinado por el experto francés Denis Lacorre, el magnífico instrumento original de 1885 acaba de 'inaugurarse'. Atrás ha quedado una reforma que ha costado 420.000 euros, y que ha sido sufragada por la Diputación al 50%, por la Kutxa y el Ayuntamiento en un 25%, mientras que el 25% restante se ha ido cubriendo con aportaciones de particulares."
7.58967331876704,0.5928104961217034,2,es-ES,"El hallazgo se produjo sobre las seis y media de la tarde en un arroyo situado en el paraje de Venta Baja, dentro del término municipal de la mencionada localidad axárquica. Los obreros estaban trabajando en la limpieza del cauce cuando descubrieron lo que parecía ser parte de la pierna de una persona."
8.07732272705587,-1.4743033021201886,2,es-ES,"El Unicaja se la juega el miércoles (sin televisión, 21.00). Es decimosegundo, con seis victorias y seis derrotas, y recibe al Lagun Aro casi con la obligación de ganar. No hacerlo le cerraría prácticamente la puerta de la Copa del Rey. Sería la segunda temporada consecutiva en la que el conjunto andaluz, uno de los grandes, no está presente en la fiesta del baloncesto ACB. Algo que no se puede permitir."
9.955738626132861,1.3752469767210678,1,es-AR,"La presidente Cristina Kirchner se reunió ayer en Nueva York con los directivos de las firmas norteamericanas Exxon Mobile y AES, que le anunciaron inversiones por más de 800 millones de dólares. El vicepresidente de Exxon Mobile, Mark Albers, reveló que la petrolera invertirá 400 millones de dólares para ampliar la producción de combustibles en el país en un ocho por ciento para 2015, precisó el ministro de Planificación, Julio de Vido."
9.270850775631379,-1.617031007899303,2,es-ES,"El gerente de la Compañía Española de Petróleos S.A. (CEPSA) en Panamá recibió al menos un balazo por parte de dos individuos que se dieron a la fuga en el automóvil del empresario español, según testigos oculares. La Policía panameña investiga el móvil del asesinato, que podría tratarse de un hecho de violencia común. Según los testigos, un automóvil interceptó a Machín cuando iba a abordar su propio vehículo todoterreno, con el que los agresores huyeron tras dejarlo herido en la calle."
5.86599875739443,-0.08935121234791571,2,es-ES,"Con estos nuevos datos, la recuperación de la muralla histórica de Gandia tendrá algunos cambios ya que también se descubrió que el muro protector de cal aparece y desaparece en distintos puntos de la ciudad por lo que será más difícil su recuperación."
10.91302995251844,2.0991255047242605,2,es-ES,"Esta política de Ares, sin embargo, no evitó que se produjesen roces con algunos mandos con una vinculación nacionalista evidente. El caso más significativo fue el del jefe territorial de Guipúzcoa, que fue cesado por pérdida de confianza de los responsables de la cúpula de Interior. Su destitución coincidió con la filtración de documentos internos de la gestión de la Ertzaintza, lo que causó un fuerte malestar en los responsables del departamento."
5.744979539417046,1.6696060557829309,2,es-ES,"Alfonso Mendoza ha explicado que los socialistas pidieron una licencia de apertura para la oficina electoral de la candidata socialista, Elena Martín, pero posteriormente han hecho una reestructuración del interior y han eliminado algunos elementos como una escalera de caracol que daba acceso a un almacén. Para acometer estos cambios, según ha dicho, era necesario disponer de licencia de obra."
4.551585284891037,0.1690515172075732,1,es-AR,"Muchos de sus recuerdos, como las veces que jugó con el revólver de su madre después de la escuela y pensó en pegarse un tiro, fueron reprimidos y la actriz los recuperó cuando hizo terapia en 2006."
10.578828486617878,1.8830921181673408,2,es-ES,"Entretanto, el resto de británicos se desparramó por la ciudad. A muchos se les pudo ver de compras, es otra tradición entre los anglosajones proveerse de tabaco y bebidas alcohólicas en Santander. Cada uno aprovechó el tiempo de estancia en tierra a su manera. Muchos apurando pinchos de tortilla y de jamón y tomando cañas. También otros ingleses aprovecharon la visita para hacer deporte aprovechando las bicicletas que el Ayuntamiento tiene situadas en diversos lugares de la ciudad. Hasta hubo más de uno que a golpe de pedal llegó hasta Cabo Mayor."
7.889356598650413,0.4086103684690169,2,es-ES,"Por último, la portavoz de los independientes, Uxue Barkos, señaló ayer tarde que son escépticos ante la posibilidad de que Batasuna dé los pasos que se le reclaman para antes de la cita electoral de mayo, por lo que abogan, de momento, por rechazar su proposición. También se agarran al argumento de que podría «fragmentar» Nafarroa Bai."
10.19920786951659,-2.0890354753193208,1,es-AR,"“La idea fuerza de este proyecto es que se trata de un concepto nuevo en Rosario, el del condo hotel, que en Argentina tiene los casos del Faena y del St. Regine, en Buenos Aires”, dijo González. En este sentido, afirmó que la Torre Shopping será como vivir en un 5 estrellas, y diferenció el emprendimiento de los otros condo hoteles de la ciudad en que el de Aldic tendrá mayor cantidad de amenidades."
