x1,x2,label,lang,texts
5.696960312657926,1.4201574969832094,1,es-AR,"Ayer, en el recinto de operaciones de la Bolsa de Comercio de Rosario la soja en condición disponible (spot) cotizó a $1.250 abierto para todos. Operadores con más volumen para ofrecer lograron $1.270 y hubo rumores no confirmados de que alguno llegó a vender $1.290."
5.866697545880355,-2.0443658625417807,1,es-AR,"Aunque no se dio un parte médico oficial este mediodía, la madre de Sebastián Arias habló ante los medios que esperaban en la puerta del hospital público por alguna información. No pudo decir mucho. Sólo se limitó a decir que esperan “la evolución de las próximas 48 horas” y que, en cuanto se pueda, el niño será trasladado a la Clínica Santa Lucía."
9.99972325854693,-2.051450378412556,1,es-AR,"Indicó también que “se percibe en la actitud de los participantes no solo el compromiso, sino las ganas, y es para repicar en otros lugares y que se imite, tenemos que aprender a copiar lo bueno, potenciando las Pymes con los productores involucrados y que coincide con el plan de trabajo que se lleva adelante desde la Subsecretaría de Lechería de la Nación, con proyectos de capacitación y de trabajo, articulados con las instituciones del proyecto nacional que también están apoyando este Clúster”."
6.33810707848134,-0.47825901628531325,1,es-AR,"La reunión, que duró más de cuatro horas, se celebró a puertas cerradas y sólo se permitió el acceso de la prensa al discurso inaugural de Patiño, quien señaló que la Unasur ""no podía permanecer indiferente ante un problema tan importante"" y destacó que el gobierno venezolano había hecho un pedido ""para buscar caminos de entendimiento entre los dos países hermanos""."
5.624621009985489,-2.215759875383595,1,es-AR,"En lo que respecta al cotejo del equipo de Boedo, en el arranque, el conjunto mendocino se paró mejor en el terreno, y complicó la salida de San Lorenzo. Incluso tuvo un par de situaciones como para ponerse en ventaja que no supo aprovechar."
10.767603139019004,1.6593892393490635,2,es-ES,Cuando hablamos de desarrollo sostenible hablamos de producción de energía con mínimo impacto ambiental. De acuerdo que tenemos que ser respetuosos con el entorno pero también debemos tener la posibilidad de pulsar el interruptor de la luz y que la cosa funcione. A estas alturas del partido nadie puede pensar que estas multinacionales de la energía pueden llevar a cabo un proyecto que perjudique sus intereses y los de todos los ciudadanos. Solo desde posturas fundamentalistas y demagógicas se les puede acusar de 'delincuentes ecológicos'.
11.488007795507162,0.5158272951671088,1,es-AR,"El “Laboratorio Pedagógico” se basa en una concepción contemporánea en la producción de materiales de enseñanza con el objetivo de mejorar los resultados de los aprendizajes y en una primera etapa se implementa en 83 establecimientos secundarios de la provincia de Santa Fe, cuyos docentes reciben capacitación intensiva en el manejo de las tecnologías de la información y la comunicación (TIC’s) para su aplicación en el trabajo en el aula."
6.889919358770196,-2.9137219872214786,1,es-AR,"Sin embargo, advirtió que si el gobierno porteño no avanza en asumir su responsabilidad sobre el servicio “la semana que viene, en tranquilidad como siempre lo hemos hecho, vamos a decirle al país y a los ciudadanos de Buenos Aires cuál va a ser la política a seguir con el subte”. También sostuvo que “el proceso de transferencia es mucho más sencillo de lo que la gente supone”."
2.504211330524272,-0.13520182724259522,2,es-ES,"Mariano Rajoy trabajará con su equipo para seguir convenciendo desencantados del PSOE y pescar, de esta manera, en un caladero de votos al que hasta ahora no habían tenido acceso."
13.292136805960638,2.4047999378082925,1,es-AR,"Es claro que Isoca Bolillera es una plaga que se debe mantener en niveles bajo de población inicial al momento de realizar la aplicación. En la campaña actual los valores de eficiencia de control logrados fueron del 50%, promedio de 180 lotes analizados, los mismos valores fueron alcanzados en la campaña 08/09. Estos resultados consolidan la hipótesis de que la isoca bolillera debe ser manejada con poblaciones iniciales bajas independientemente de la fenología del cultivo. El valor que se sugiere es de 1,9 Isoca Bolillera por metro cuadrado para la sugerencia de aplicación de insecticidas."
9.059516408659157,3.2625939514875038,2,es-ES,"La morosidad de los créditos concedidos a familias y empresas por los bancos, las cajas de ahorro, las cooperativas de crédito y los establecimientos financieros de crédito no da tregua. En octubre, y tras un ligero respiro en septiembre, los préstamos calificados como dudosos según los criterios del Banco de España representaban ya un 4,99% del total, la tasa más alta desde el mes de agosto de 1996, cuando alcanzó idéntico nivel. Un año antes, esa proporción de contratos impagados era tan solo del 2,92%."
3.411199561077305,-0.4426501383631772,2,es-ES,"1. En educación habría que optimizar los recursos. Por ejemplo, hay varios centros de profesores y recursos en la Región, cuando sería suficiente y menos costoso centralizar sus servicios en un Instituto de Formación del Profesorado."
6.124693958419609,-1.7212173989097377,2,es-ES,"El gol del Yeclano fue de estrategia tras un saque desde la banda. Juan Carlos peinó el balón hacia atrás, lega Tonete y este a la media vuelta bate a Pepelu. A cinco minutos de terminar el partido los de Sandroni se volcaron en busca del empate, obligando al Jumilla a defender en su área, no permitiendo que sus numerosos atacantes recibieran ningún balón en buenas condiciones para el remate."
4.331378916952341,0.18680591909905875,2,es-ES,"El Teatre Flumen de Valencia pondrá en escena durante las Navidades los musicales 'Pegados' y 'Pinocho' con el fin de ofrecer una oferta de ocio cultural a los aficionados a este género, ha informado la sala en un comunicado."
11.068838241760684,3.5952544844475307,1,es-AR,"La serie de ataques es un indicio evidente de la degradación acelerada de la situación política de un país clave en Oriente Medio y que se encamina a una guerra civil sin cuartel. Ayer, al margen del atentado en Damasco, otros 17 civiles fallecieron por los disparos de las fuerzas de seguridad cuando miles de personas volvieron a salir a la calle para reclamar la ayuda de la ONU y frenar la sangrienta represión del régimen . Según ese organismo mundial, la represión interna se ha cobrado 5.000 muertes desde marzo último, cuando comenzaron las protestas."
6.503101866915936,0.7092659815959339,2,es-ES,"""El Gobierno español no ha movido ni un dedo todavía. Si no es irresponsabilidad, le está costando resituarse"", ha dicho Moreno, que le ha exigido ""pasos"" relacionados con ""el cese de las humillaciones a los familiares de los presos"" de ETA , la excarcelación de los reclusos enfermos y el fin de la dispersión."
5.950910405882668,-0.9376020294570453,1,es-AR,"El empresario destacó la necesidad de reestructurar el ferrocarril Belgrano Cargas, y consideró “fundamental” realizar este proyecto. Además sostuvo que se debe finalizar con la construcción de los acueductos en toda la provincia, ya que hay localidades que “sufren la carencia de contar con agua potable”."
5.8980898445312375,0.7837200837306049,2,es-ES,"Aparte de las fotos que él ha hecho, ha adquirido otras muchas antiguas en rastros, en anticuarios y a coleccionistas. Otras se las han dado y algunas las ha encontrado tiradas en la calle. Entre placas de cristal, diapositivas, postales y latas de películas tiene más de millón y medio de imágenes. «En mi casa no cabe nada»."
6.0920782926989245,-2.286517655662533,2,es-ES,"""La crisis que padece el sector de la hostelería en Torre del Mar es importante, y todos están esperando la noche de San Juan y el comienzo del verano para hacer caja"", señaló Checa, que considera que repartir las sardinas gratis durante esta celebración ""evita que la gente las consuma en los chiringuitos""."
6.424665743037982,-3.7012773036045625,2,es-ES,"Fue idea de dos directores del grupo. Y la verdad, cuando me lo dijeron, me levanté de la mesa diciendo ‘pero estamos locos, ¿o qué?’. Pensaba que todas las cofradías se nos podían echar encima con el respeto que hay hacia la Semana Santa en esta ciudad. Pero cuando me explicaron que no había que meterse con nadie, sino que nos centraríamos en lo mal que cantamos, me gustó la idea."
1.9780127173597686,0.9524785641888377,1,es-AR,"Para hoy se esperaban las declaraciones de los editores de los diarios Daily Telegraph, Tony Gallagher; Financial Times, Lionel Barber, y The Independent, Chris Blackhurst."
8.684718115265031,1.9592843570022387,1,es-AR,"Lifschitz también se refirió a los espacios públicos como parte integrante de la obra pública. “También el espacio público es uno de los objetos más importantes de la obra pública y también aquí hemos tenido una experiencia importante en Rosario con la transformación de esos espacios, los tradicionales, y también con la recuperación y construcción de nuevos espacios públicos de calidad, abiertos, democráticos y convocantes que han servido para jerarquizar los espacios urbanos y para promover la inversión privada”, evaluó el jefe comunal."
6.112411208594745,0.3599959776637409,2,es-ES,"El Ayuntamiento de Madrid informó ayer de que el número de heridos en accidentes de motocicletas en la capital se reducirá este año entre un 20 y un 25%, según apuntan los datos obtenidos hasta el pasado 21 de noviembre."
8.344013278319174,0.5375850655177197,2,es-ES,"La misma empresa demoscópica había informado en mayo de que Rousseff estaba apenas dos puntos por encima de Serra, un porcentaje que coincidía con el margen de error de la investigación. Por lo tanto, se los consideraba empatados. Ahora, la candidata le saca diez de ventaja a su oponente antes de que la campaña se instale en televisión."
5.031871736826166,-0.30540120476525795,1,es-AR,"La retirada de la empresa con sede en Colorado no tomará por sorpresa a ninguno de los 250 telemarketers y supervisores que aún cumplen horario en el edificio de calle Brown al 2500. En rigor, fueron los propios empleados quienes dieron fuerza al rumor, alentados por varios elementos."
3.5937429210947642,-0.6452609053482932,2,es-ES,"Preguntado si acudirá el presidente del PP de Alicante y de la Diputación provincial, José Joaquín Ripoll, ha señalado que no sabe si podrá asistir debido a que tiene actos previstos en la Diputación."
4.476236577905745,-0.28519475338617073,1,es-AR,"Si bien llegaron separados al restaurante, los actores se retiraron juntos aunque escondiéndose en los asientos traseros de un coche, detrás de un chofer y en un auto que se dirigió directo hasta la mansión de Aniston en Beverly Hills."
7.534309976643609,-2.557581721373137,1,es-AR,"Al examinar cuál será el comportamiento a futuro de ese metal, el informe recomienda recordar que “el oro tenía una función trascendental en nuestro sistema económico. En el metal precioso residían el valor y el poder de las monedas, que armonizaban su cotización de precios y evolución según un sistema muy práctico que tenía que ver con las reservas de oro de cada país”."
5.8795217422534325,-2.6787496859113737,2,es-ES,"Entonces lo entiendo todo. La prensa no tiene razón. No estamos en guerra, ni falta que hace. Esta especie de bronca continua es una ilusión, una imagen grotesca que proyectan los medios, pero no es real. Por el amor de Dios, que no os pase como a mí, que meriendo paellas de orfidales todos los días. En ocasiones veo Truebas, sí, pero mis amigos me ponen en mi sitio. No nos dejemos engañar."
4.786384173337676,0.77585429578636,2,es-ES,"Los insultos y los gritos han acaparado hoy el protagonismo en el juicio desarrollado contra cinco miembros del conocido como ""clan de los Monchines"", acusados de injurias y desórdenes públicos cometidos contra una abogada en una vista por tráfico de drogas contra miembros de esta familia."
2.3295565576344655,0.04217801533683232,2,es-ES,"El torneo se jugó por el sistema suizo de ocho rondas, es decir, partidas de 25 minutos por jugador a tiempo finish, disputándose18 enfrentamientos."
8.440944316284778,-0.7912454280777498,2,es-ES,"El programa de música, ocio y cultura de Canal 6 presentará asimismo a Abdón Alcaraz, quien armado de su inseparable piano, narrará las aventuras que le han ido aconteciendo desde que hace cinco años marchase de Murcia para instalarse en Madrid, donde ha conseguido un merecido prestigio en el ámbito del jazz. Abdón, quien además forma parte del grupo de Benjamín Escoriza (Radio Tarifa), se encuentra en la capital del Segura para cerrar el ciclo de su primer trabajo, Con alma, y embarcarse en su nuevo proyecto, cuyo título será Un mar menor."
6.173025135290692,0.30915659187982836,2,es-ES,"La selección española de baloncesto se ejercitó por primera vez en Madrid después de un día de descanso, con las novedades de Marc Gasol y Rudy Fernández, que trabajaron con el resto del grupo una vez recuperados de las lesiones que les impidieron disputar el último partido amistoso."
1.8462426380121426,-1.851711155344969,1,es-AR,Zac habría sentido calor mientras realizaba este trabajo por lo que habría decidido quitarse la camisa. Pero en algún momento y sin darse cuenta se hizo una herida que comenzó a picarle mucho y a producirle ronchas por todo su cuerpo.
9.018807793859951,3.0711536500848,1,es-AR,"Las nuevas cotizaciones se remitieron a la Comisión de Asesoramiento citada, la cual expuso que Boldt SA había efectuado la cotización más conveniente económicamente para las elecciones primarias, abiertas, obligatorias y simultáneas del 22 de mayo, por 12.100.000 pesos contra 12.370.505 de Artes Gráficas del Litoral SA y 17.195.000 de Ramón Chozas SA. Mientras que la firma Artes Gráficas del Litoral SA había efectuado la cotización más conveniente económicamente para las elecciones generales del 24 de julio en 11.035.208 contra 11.750.000 pesos de Boldt SA y 17.195.000 pesos de Ramón Chozas SA."
4.668635199421691,-2.952763079468034,1,es-AR,"“En el transcurso de la jornada hubo muy pocos negocios. En ese contexto, se destacaron los cupones atados al crecimiento del Producto Interno Bruto (PIB). El TVPA (en dólares) saltó 3,13%, el TVPP (en pesos) creció 3,15% mientras que el TVPY (regido por la ley extranjera) ganó 3,29%”, precisó."
2.9512415796014526,-0.5580701840491186,1,es-AR,"La mandataria destacó la reducción de desempleo del 7,3 por ciento en el último trimestre y proyectó para el 2020 una desocupación del 5 por ciento."
8.115188968741926,3.135777923604549,1,es-AR,"Docentes de SUTEBA y los profesores de UDA finalizaron hoy un ""masivo paro"" de 48 horas, mientras la jefa de la FEB, Mirta Petrocini, gremio que encabeza una huelga de tres días, evaluó que alcanza entre un ""90 y 100 por ciento"" de adhesión, al igual que la medida de fuerza de Udocba."
10.413415961052486,0.5661208569783714,2,es-ES,"Al parecer el coro madrileño recibió, con gran sorpresa, el pasado 15 de abril una carta remitida por la Orquesta Sinfónica de Madrid, de la que depende, informándole que suprimía sus servicios durante los meses de abril, mayo y junio, ya que la Fundación Teatro Real había contratado a otra agrupación. Dicha agrupación, Intermezzo, es la que se hará cargo de las dieciocho representaciones de la ópera verdiana. «Es una empresa de cantantes, que hacen refuerzos, no es un coro», aseguraba ayer la misma fuente."
6.229024891007688,1.677229081844432,1,es-AR,"Ayer, poco antes del mediodía, tres asaltantes armados –con el apoyo de un cuarto hombre que hacía de chofer– entraron a un banco de la localidad bonaerense de Munro (partido de Vicente López) y en pocos minutos lograron escapar con un botín de 200.000 pesos en efectivo."
5.7809523022655975,-0.6490632314589699,2,es-ES,"Lomana salió adelante, vendió su preciosa casa de Fuenterrabía y empezó a acudir a cenas y reuniones del brazo de buenos amigos como el joyero Arsenio Díaz, quien desgraciadamente murió hace pocas semanas cuando fue encontrado sin vida en una zanja de la calle Serrano tras la noche de moda que organizó «Vogue». Dicen que fue un infarto y también que hay amigos abogados que están investigando."
4.565304351987041,-0.7535727100247767,2,es-ES,"En 2002 fue consejero especial de la ONU y posteriormente nombrado ministros de Finanzas. En 2005, Ghani fundó el Instituto de Efectividad del Estado, en Estados Unidos, que busca promover gobiernos efectivos. El candidato reside normalmente en Estados Unidos."
4.201331927638197,-2.0650230668274805,2,es-ES,"""Es intolerable que el Gobierno central pretenda que el Ayuntamiento asuma los 10 millones de euros que supone el 80% de la actuación en superficie cuando es su competencia"", ha añadido."
8.346277748506973,0.04935208278433962,2,es-ES,"La primera acusación contra Jurdan Martitegi se remonta al 12 de febrero de 1998, cuando se presentó en la Audiencia Nacional ante Baltasar Garzón, ya que estaba siendo buscado por la Ertzaintza por su presunta participación en actos de violencia callejera. Quedó en libertad, pero poco después fue acusado de tomar parte en un ataque con 'cócteles molotov' contra la comisaría de la Policía autónoma vasca en Amorebieta, cargo del que resultó absuelto."
4.859034832012551,2.343994417638028,2,es-ES,"La inauguración será a las 20 horas y permanecerá abierta desde hoy hasta el 22 de noviembre en horario de martes a sábado de 11 a 13 horas y de 17 a 20.30 horas, los domingos de 11 a 13 horas y los lunes cerrado."
4.008172336139627,-2.686451753582018,2,es-ES,"Asimismo señala que ""el guapo atleta, según fuentes cercanas a su entorno, decidió tener el niño porque dijeron que tiene millones, una gran carrera, pero no un hijo"", además de revelar que será la madre del futbolista del Real Madrid, Dolores Aveiro, la persona que cuidará del bebé."
2.6860886612284154,-0.5278486719035713,1,es-AR,"En un documento suscripto además por representantes del gobierno nacional, se hace hincapié específicamente al caso de la petrolera YPF que tiene por accionista principal a la española Repsol."
5.340306381997842,1.0228881313324552,1,es-AR,"A través de este convenio, el club español tendrá la prioridad de contratar a los jugadores surgidos de las divisiones inferiores del Xeneize. Por su parte, Boca tendrá a su disposición la estructura y los recursos humanos del Barcelona para instruir a sus entrenadores, quienes se capacitarán para instruir a los juveniles. Para esto, los catalanes les cederán su proyecto formativo del predio La Candela."
7.045140647282549,0.18284230072981594,2,es-ES,"Por su parte, el Halifax Bank of Scotland (HBOS) y el Lloyds TSB, que hace una semana acordó la compra del primero, han optado por una solución mixta que mezcla los fondos públicos con la búsqueda de capital entre inversores privados y recibirán entre los dos otros 17.000 millones de libras (21.418 millones de euros), 11.500 millones de libras el HBOS y 5.500 millones de libras el Lloyds TSB."
1.5349223277753807,-1.337373078130616,2,es-ES,"Esta variedad crece y madura siguiendo la técnica del embolsado, procedimiento único en el mundo que le otorga su color característico y su sabor."
6.564486074122993,1.2412761961789087,1,es-AR,"Arquitectura, diseño, literatura y pasión por la camiseta auriazul. El estudio de los hermanos Giandoménico combinó el conjunto de sus pasiones y se decidió a construir el apart hotel de alta gama Roberta Rosa de Fontana suites que, a través del juego de palabras en su nombre, rinde homenaje al escritor rosarino de mayor popularidad."
6.468742790214597,-1.1985626154589784,2,es-ES,"Hay veces, como por ejemplo en el caso de Xavi Hernández y sus problemas en el tendón de Aquiles, en las que no llegamos a ser consicentes de lo duro que es convertirse y ejercer de deportista de élite y el riesgo que corren estos jóvenes atletas cuando compiten al máximo nivel."
7.1039571785191455,3.595310917115563,1,es-AR,"La presidenta de la Agrupación de Familiares de Detenidos Desaparecidos, Lorena Pizarro, aprobó la decisión de Piñera pero advirtió sobre la posibilidad de que el anunciado análisis de cada caso sea usado como subterfugio para beneficiar a algunos violadores de derechos humanos."
9.465012306137773,-4.7415683297776585,2,es-ES,"El alcalde , Alejandro Soler, recibió ayer al nuevo director administrativo de la ONCE en la provincia, Salvador Galvañ, y al delegado en Elche, Bernardo Presas. En la reunión se llegó a un acuerdo en el que se prevé una permuta municipal en la que la ONCE adquiriría un terreno para ampliar la lavandería y el consistorio se quedaría con las actuales instalaciones en Altabix. Soler destacó que el hecho de generar más empleo «es siempre una buena noticia». La empresa Flisa ocupa actualmente a 80 personas, que podrían pasar a tener 130 o 140."
3.6448407525028745,-1.0666294961548761,1,es-AR,"A diferencia de otros atractivos argentinos, como el esquí, el golf o la Ruta del Vino, que suelen promocionarse como productos turísticos, el del Che es un programa, aclara Conca, porque reúne un conjunto de experiencias y apunta a lo educativo y cultural, y no tanto a lo comercial."
6.959287802775012,-2.2526149437420333,1,es-AR,"El hombre en cuestión es Eduardo Braga. “No es ni médico ni fisioterapeuta. Es un especialista que trabaja con hierbas y acupuntura y que en Portugal es conocido como Manos de Oro”, explica el importante diario español. Además, precisa que es hombre de confianza de Mourinho y no se relaciona con la prensa, por lo cual se entiende que nunca haya salido a la luz, hasta hoy, este tratamiento alternativo de Di María."
3.940008495653872,-2.6805929551281364,1,es-AR,"Al prometer no terminar la guerra aérea hasta que Gaddafi deje el poder, los líderes de Estados Unidos, Francia y el Reino Unido han aumentado las apuestas. Ellos han descartado enviar tropas en terrestres, pero aún está por verse si sólo el poder aéreo será suficiente para derrocar a un líder que se ha aferrado al poder por 41 años."
5.271687210680623,0.11526883214104874,1,es-AR,"Rupert Murdoch, dueño de la cadena Fox, quiere conquistar a los hispanos en Estados Unidos, y para ello, la empresa de medios hizo una alianza con el grupo colombiano RCN para lanzar un nuevo canal de televisión en español en la Unión Americana, anunciaron el lunes ambas empresas."
5.444606126105545,-0.14038880247554614,2,es-ES,"Una maleta que llegó en un vuelo procedente de Moscú despertó en 1994 las sospechas de la policía en el aeropuerto de Múnich. El examen de su contenido causó escalofríos. Su propietario, un ciudadano colombiano, viajaba con una carga nuclear."
5.590069350182789,3.7940436771359267,1,es-AR,"A mediados de 2009 Alak fue nombrado ministro de Justicia y la gerencia general pasó a manos de Mariano Recalde , hijo del diputado moyanista Héctor Recalde y fundador de la agrupación La Cámpora. Recalde fue nombrado además como presidente del directorio de Aerolíneas y de Austral."
7.999085521093813,0.31421686765480017,2,es-ES,"Con una hija de dos años, sin formación académica y tras doce meses de búsqueda de trabajo sin éxito, esta joven santanderina necesitaba encontrar la calma necesaria para empezar desde cero. Por eso acudió a los servicios sociales del Ayuntamiento de Santander. Itziar no lo sabía, pero en ese momento se estaba poniendo en marcha un proyecto, llamado 'Enlace', que parecía diseñado para ella. El objetivo de este plan, gestado por el Consistorio y la asociación Nuevo Futuro, es ofrecer viviendas a madres o mujeres embarazadas sin recursos económicos de forma temporal hasta que salgan adelante."
4.1249084534141005,0.38222789796046686,1,es-AR,"En 1913, ""Mademoiselle"" abrió su primera tienda en Deauville, en la que presentó prendas deportivas de algodón liviano. ""Les he dado auténticos brazos, auténticas piernas, movimientos sinceros y la capacidad de reír y de comer sin sentirse mal por eso"", decía Coco Chanel."
7.347779181265477,1.5928261346578494,2,es-ES,"Quizá porque las cosas no pintaban demasiado bien, ninguno de los cabezas de lista acudió a la reunión del comité nacional que debía aprobar su designación, además de la del resto de candidatos. El 71,1% de apoyos es 10 puntos inferior al apoyo que obtuvo Ignasi Pla en septiembre para rechazar la convocatoria de un congreso extraordinario."
3.87225082847291,0.19109105421233633,2,es-ES,El Alto Comisionado de la ONU para los Refugiados (ACNUR) recordó hoy que Tailandia se ha comprometido a respetar el principio de no obligar a nadie a retornar a una situación de peligro.
4.864160626429247,0.5561552520350984,1,es-AR,"Las precipitaciones de los últimos días tienen una enorme significación para el agro y para la economía nacional. Llegaron demasiado tarde como para asegurar la cosecha de 110 millones de toneladas, como se había presupuestado para el 2012. Pero los granos se corrieron del borde del abismo."
7.273151901263032,0.11353235842348057,2,es-ES,"La consulta interservicios quedó bloqueada nueve meses antes, en enero, cuando el propio comisario europeo de Medio Ambiente, Stavros Dimas decidió frenar el proyecto de dictamen de sus servicios favorable a la construcción del puerto industrial, que debía ser adoptado poco después por el Colegio de Comisarios, motivado por las nuevas informaciones que había recibido, en particular, respecto a la alternativa del puerto de Santa Cruz."
