x1,x2,label,lang,texts
9.21688393166731,1.3119406861181884,2,es-ES,"Le pudo la desesperación. Un hombre de 45 años se lanzó ayer por la ventana de un patio de luces para huir del incendio que arrasó su casa de Canals. La víctima sufrió graves quemaduras en la cabeza, en la cara y en el cuello. Fue evacuado con un helicóptero al Hospital La Fe y su padre, un anciano de 82 años, también resultó herido con quemaduras e intoxicación por inhalación de humo."
4.4688453032531115,1.8458857285493182,1,es-AR,"“El club nos acercó la propuesta. Estamos evaluando cómo trabajar y cómo encarar la parte comunicacional para mejorar la imagen de la institución”, le contó Luis Nazer, titular de la agencia de comunicación, a punto biz."
3.535573382157638,-0.4374616195376857,1,es-AR,"La firma del mismo permite que los vecinos de los 38 municipios del consorcio puedan ingresar con un descuento del 50 % en la entrada, con la sola presentación del DNI."
6.8602643395685226,-1.4283875954787273,2,es-ES,"Un centenar de vecinos delRincón de Villanueva, en Beniaján, se concentraron ayer tarde en protesta porque la nueva avenida de Beniaján deja aisladas unas 120 casas o, lo que es lo mismo, a unos 300 vecinos. Así lo manifestó Antonio Martínez, portavoz de los afectados, que añade que «también se ven afectados los que viven en varios carriles como Los Corbalanes, Los Sernas, Restituo y la orilla del río»."
5.066031034132463,0.5040298973760305,2,es-ES,"El último fichaje de la Real Balompédica Linense, Domingo Ferrer, tuvo sus primeros minutos como jugador albinegro durante la última cita de los suyos ante el Sanluqueño, partido que supuso la segunda derrota en casa de la temporada."
4.34293756168734,1.6294359121342825,1,es-AR,"Con esta sentencia, Bringas Aguiar continuará detenido en la cárcel de Bouwer, a unos 13 kilómetros de la capital cordobesa, donde se encuentra desde el 25 de noviembre de 2010."
4.158706338669453,-0.006059465601884768,1,es-AR,"Esta mañana se realizó un acto que formalizó el nombramiento de Ana Brunet como presidenta del directorio del Enapro, después de la salida obligada del cargo de Pablo Ferrés, desvinculado por diferencias con el gobernador Hermes Binner."
8.018431863569326,1.3884174736453545,2,es-ES,"La actual normativa, que vino precedida asimismo de una suspensión provisional de licencias, sólo autoriza la apertura de establecimientos de tres, cuatro y cinco estrellas, siempre y cuando estos se ubiquen en fincas que el 1 de enero del 2005 no tenían uso residencial. Antes, en el año 2000, Ciutat Vella ya había vetado con carácter general los hoteles de menos de tres estrellas."
10.365869805388922,2.903563473760074,1,es-AR,"El mercado de capitales en Argentina no tiene gran desarrollo y las empresas carecen de conocimientos de las herramientas a las que pueden acceder. Para cambiar el estado de situación, el Mercado de Valores de Rosario desplega una menú de herramientas en busca de que se amplié la participación de empresas de la región, sobre todo vinculadas al agro."
4.950464724445715,2.7847263519412015,2,es-ES,La organización la lleva a cabo la Asociación de Informadores de Elche y está patrocinado por la CAM y la concejalía de Deportes del Ayuntamiento de Elche.
4.214479084872193,-0.7135634400055845,2,es-ES,"Pese a que Dani, figuraba como dueño, comenta que poco ha trabajado en él. «Al principio lo llevaba mi ama, ya que tras venir de la mili trabajé 20 años en Matutano y posterior, del 1995 a 1997, lo hice de repartidor de paquetería»."
7.2447788397538,-2.2641440104708246,2,es-ES,"Los concejales y el personal del grupo no han dudado en adquirir el libro y donarlo a Cultura para que enriquezca los fondos de la ciudad. Pero el ejemplar no ha llegado solo a Gandia. Los miembros del PP han cedido también a la ciudad una lámina del siglo XVIII en la que aparece el patrón de Gandia rezando, pero dijeron el coste de las obras"
4.663167664162346,-0.5319297825935978,1,es-AR,Una nueva ley de fomento a las Mipymes es una herramienta necesaria para que el Estado pueda generar y aplicar políticas integrales y segmentadas para este vasto sector que proporciona la mayor cantidad de empleos en el país y abarca más del 90% de las empresas.
5.8023980133754876,-1.140344061091957,2,es-ES,"Las mujeres que se incorporan al mercado laboral lo hacen para quedarse el mayor tiempo posible. La tasa de empleo en las personas de edad avanzada (entre 55 y 64 años, según las instituciones europeas) se ha mantenido más o menos estable en los últimos años, y la de actividad ha crecido, en ambos casos gracias a que las mujeres trabajan cada vez más años."
5.9124857228154,0.3218113999949384,1,es-AR,"En el marco de la exposición internacional “Franquicias y Negocios 2011”, que se está llevando adelante en Costa Salguero de Buenos Aires, se hicieron presente alrededor de 40 empresas con el propósito de generar contactos, afianzar relaciones comerciales, lanzar nuevos productos y de ese modo probar y testear el mercado."
8.755513119958781,3.393706271570038,2,es-ES,"La Comisión Europea ha afirmado, tras el cierre de tres nuevos capítulos de las negociaciones de adhesión, que Croacia podrá ser miembro de la UE a finales de 2012 si mantiene el ritmo de reformas y no se atasca el proceso de ratificación de su candidatura por parte de los Veintisiete."
7.018629902167529,-4.34330627675245,2,es-ES,"En este sentido, González lamentó que la mejora del servicio para los viajeros que toman el tren en Málaga y la optimización de la jornada laboral que persigue este cambio perjudique a los que parten desde Antequera, que ya no contarán con ese servicio tan temprano sino que se verán obligados a tomar el de las 9,30 horas, que llega a Madrid a las doce del mediodía."
3.2699482769254438,0.4007166792413848,1,es-AR,"El hecho fue desmentido ayer por el presidente del Consejo Supremo Electoral (CSE), Roberto Rivas, con la presentación de evidencias y la entrega de todos los documentos, cuyo retraso"
2.636960368648095,-2.834714859919827,2,es-ES,"«Te sientes muy mal porque has intentado abrazar a alguien y te sientes rechazado. Nosotros vamos con toda la buena voluntad del mundo, pero nos dicen que no quieren abrazarnos. Eso lo hacen sobre todo los hombre jóvenes; mientras que los ancianos son los que más se prestan a que les abracemos», sonreía Cristina Gil."
3.541028775827805,1.0318212987918034,1,es-AR,Los compradores deben tener cuidado con los productos ofrecidos a precios muy inferiores a los de los competidores. Los estafadores cibernéticos usan sitios de subastas y sitios Web falsos para ofrecer negocios demasiado buenos para ser reales con el objetivo de robarle su dinero e información.
9.079522951294717,-2.6425402121330674,2,es-ES,"El técnico del Algeciras, Pablo Sánchez, quería ver el empate desde el lado positivo «en lugar de haber perdido puntos hay que sentir que se han ganado dos», asegurando que «fue peor la sensación de la pasada jornada, frente al Sanluqueño, sobre todo por el penalti que fallamos en el último instante». Si Sanchez calificó de anécdota el hecho de estar de líder, tampoco le importa mucho haber perdido esta privilegiada situación. «Lo importante es seguir sumando hasta conseguir los puntos necesarios para la salvación, después podremos ver otras cosas», indicó."
3.944428082701668,-5.7125458685961625,2,es-ES,"Visiblemente contrariado se mostraba, en cambio, Cristiano Ronaldo quien abandonó el estadio sin realizar declaraciones. Mientras, el meta Eduardo aseguraba sentirse “frustrado” porque el primer gol que encajaba en este Mundial fuera, precisamente, el que ha impedido continuar a su equipo hasta cuartos; mientras que destacaba que el equipo quizá hubiera merecido “algo más”, visto lo visto sobre el campo."
4.268259254055257,0.458874280583669,1,es-AR,"La ceremonia contó con la presencia de un chamán que unió dos brazaletes de algodón rojos en las muñecas de los enamorados y bendijo su compromiso, según el diario español ABC.es."
2.3338825075352854,1.5865898499256985,1,es-AR,"Además de los titulares, de Pezzella y de Vella, también se concentrarán Leandro Chichizola, Leandro González Pirez, Aguirre, Daniel Villalva, Rogelio Funes Mori y David Trezeguet."
2.310080072481742,0.26959844797784227,1,es-AR,"El dúo formado por Marie Fredriksson y Per Gessle continúa presentando su último disco, Charm school, aunque sólo tocan, habitualmente, dos o tres de los temas de ese trabajo. El resto, a puro hit."
3.6978171555496018,-3.697691103439444,1,es-AR,"“Que pobre hombre, y no para ehhh. Menos mal que me arrastraba en las canchas jajaja, me vino a buscar Boca, jajaja, salí campeón jajajajajaja”, se descargó el central del Boca campeón en la red social Twitter (@Flacoschiavi). ""Voy a jugar Libertadores jajajajaja. Esa que nunca vas a jugar porque en la B no se juega, ¿no? Jajajaja y por suerte tengo muchos amigos"", agregó."
3.490854626633717,-1.488557321830405,2,es-ES,El jefe de Área de Atención Urbana se mostró muy seguro en las aproximadamente dos horas que duró su comparecencia. Aunque se negó a contestar a las preguntas que le formuló el abogado del denunciante.
5.907058829312598,0.43661272365545434,1,es-AR,"Sin embargo, trascendió que en los últimos días el magistrado mantuvo una reunión con la ministra de Seguridad de la Nación, Nilda Garré, y con el jefe de la Policía bonaerense, Hugo Matzkin, para coordinar el operativo de desalojo."
7.877761117896885,-1.6336478278532527,2,es-ES,"La última sesión de control al Gobierno se ha convertido en el marco para un nuevo enfrentamiento entre Ejecutivo y PP a cuenta de las víctimas del terrorismo. El diputado 'popular' Alejandro Ballestero ha acusado a los socialistas de ""humillar"" al colectivo, y especialmente a la AVT, y Rubalcaba le ha respondido llamándole ""meritorio"" y asegurando que el PP se ha dedicado en los últimos cuatro años a ""utilizar"" el dolor de los que han sufrido la lacra del terrorismo."
2.063068211435857,1.1517804283702469,1,es-AR,"Benedicto XVI, de 84 años, concelebra la misa con los cardenales Jean Lous Tauran y Raffaele Farina. Al rito asisten decenas de purpurados, obispos y sacerdotes."
6.555016470298259,0.771481168052507,2,es-ES,"Benedicto XVI comenzará mañana el año 2011 con una misa en la Basílica de San Pedro con motivo de la Jornada Mundial de la Paz, que la Iglesia católica celebra cada uno de enero, en esta ocasión bajo el lema ""Libertad religiosa, vía para la paz""."
3.16216993268139,-0.4392773928910494,2,es-ES,"Pero no sólo está sufriendo robos de ganado, también le han sustraído radiadores de tractores, aspersores y baterías, hechos que tiene todos denunciados en la Guardia Civil, según los documentos a los que ha accedido Efe."
4.479674266342692,-0.9671845615541235,2,es-ES,"Un grupo de personas se concentró, con pancartas, pitos y cacerolas, ante la puerta de la corporación; habían decidido la protesta el día anterior, a causa del accidente que sufrió un camión, que cayó del puente al río Segura el martes."
3.1166181276495806,1.1974939644232947,1,es-AR,"El proyecto minero denominado Conga significaría entre 800 a 1,000 M de dólares de ingresos, en regalías y canon minero para la región peruana de Cajamarca."
6.110949498119524,0.19259036760988618,2,es-ES,"Ahora la duda reside en si llegará para el Camp Nou en Liga, partido programado para el 2 de enero. En principio, una lesión como la de Reina vienen a suponer un par de semanas de baja y las cuentas no salen. Eso sí, se trata del portero titular del Levante y intentará recuperarlo por todos los medios."
3.646761505867874,-0.6581417309947798,2,es-ES,"En Nueva Zelanda, el Año Nuevo ha sido recibido con fuegos artificiales por miles de personas que han salido a las calles de Wellington y Auckland para ver el mayor espectáculo pirotécnico desde la llegada del Milenio, según dijeron las autoridades."
8.14129523250662,-2.2721889686809145,2,es-ES,"En el norte, también hay preocupación en Limbé y en Pilate, donde se han presentado ""muchos casos"" de la mortal enfermedad, ha manifestado el director general de MSPP. Sin embargo, en los primeros focos de cólera detectados en Artibonite y en el este no se han registrado muertos en los últimos días, ha subrayado. En todas las regiones donde los casos se han multiplicado ""hay problemas de higiene"", ha agregado, y ha llamado a ""reforzar la sensibilización"" para enfrentar un ""problema nacional""."
7.692602230931458,2.4121312119507867,2,es-ES,"Así pues no fue la Guardia Civil, sino agentes de la Policía Local de Santa Pola alertados por el 112 los encargados de interceptar a los 'sin papeles'. Entre sus ocupantes había una mujer embarazada y dos menores. Tras las pruebas óseas se determinó que dos de los indocumentados tenían 17 años. La Benemérita acudió con su patrullera del Servicio Marítimo para remolcar la embarcación, de tipo Zodiac y cinco metros de eslora."
7.417323801513099,0.318551898516394,1,es-AR,"La postura argentina es una reforma en la arquitectura financiera internacional con mayor participación del poder de voto de los emergentes en organismos como el FMI y el impulso de un nuevo mecanismo de resolución de deuda soberana, ante el vacío legal internacional en la materia, que aprovechan los fondos buitres."
4.9436916578434715,0.40812684507460695,2,es-ES,"Pero los informes de los especialistas de la cárcel de Villabona (Asturias) son bien distintos. Dicen que el preso sufre un «trastorno facticio», es decir, que finge o simula una serie de síntomas, en este caso sicóticos, para conseguir alguna ventaja."
2.681639811688396,-1.7696863827010496,2,es-ES,"Respecto a las citas más inmediatas, señalar que Feria Hábitat reunirá en los pabellones la oferta integral del hábitat que incluye mueble, decoración, iluminación, textil para el hogar, descanso, tapizado, contract, oficina e innovaciones tecnológicas para la casa del futuro ."
3.752027134220385,0.560120954481454,1,es-AR,"Con canciones como ""Good Vibrations,"" ''I Get Around"" y ""California Girls"", el quinteto encarnó la fantasía de la vida playera en la costa del Pacífico. Sus álbumes, sobre todo ""Pet Sounds"", tuvieron gran influencia sobre los roqueros de su generación y las siguientes."
6.358066109204364,1.6871623355373382,1,es-AR,"Finalmente, Delfino comentó que la SRA volverá a la carga contra los molineros en la próxima reunión del consejo directivo de la Bolsa de Cereales de Buenos Aires. Allí el tema estará más caliente porque tiene asiento la Federación Argentina de la Industria Molinera (FAIM)."
5.910359327558018,0.9414684949772427,1,es-AR,"El Instituto de Gerencia y Abastecimiento (ISM por sus siglas en inglés), dijo que el índice de la actividad fabril de la Unión Americana se elevó a 54.1 desde el 53.1 de diciembre de 2011."
2.5803892122136762,-1.2325107222828389,2,es-ES,"Si se excluye el factor variable de los salarios, es decir, las pagas extraordinarias y los atrasos, el coste salarial ordinario del primer trimestre aumentó el 4,2% en tasa interanual."
3.7882036888483097,0.1992874761487423,2,es-ES,"AI pidió al gobierno del presidente Felipe Calderón que se establezca un equipo de trabajo de autoridades federales del más alto nivel para coordinar acciones encaminadas a proteger a los migrantes y sancionar a los responsables de los abusos que sufren, como extorsiones, asaltos, secuestros y violación sexual."
6.325841521370099,0.5320842935603297,2,es-ES,"En Sanidad, se ha aprobado la prorroga de los contratos para el suministro de talonarios de recetas y para el asesoramiento técnico y veterinario en los aspectos relacionados con el bienestar y salud en animales de experimentación, por importe de 239.092 euros."
3.899387996404528,-2.098699633299875,2,es-ES,"La coincidencia de todos en que la mejora en los accesos ha reportado beneficios a sus ayuntamientos (con algún matiz), agota una charla que se reconduce hacia el transporte y, más concretamente, hacia el uso del ferrocarril."
7.292605709025902,-2.993808454382518,2,es-ES,"CAM se desmarcó así de los otros tres socios, del contrato que habían consensuado para su integración en un Sistema Institucional de Protección (SIP) ""porque no quieren que Cajastur la dirija, pese a que ese era el acuerdo alcanzado el 26 mayo, el que se llevó al Banco de España y el que sirvió para aprobar las ayudas del FROB"", aseguran fuentes financieras de Cajastur."
4.78982762808863,-0.5390732993815289,1,es-AR,"Si bien la información no fue confirmada desde la producción del reality show de talentos, se conoció que están intentando buscar a alguien con un perfil similar, luego de haber conseguido en la temporada pasada el mayor rating en la historia del programa."
3.6269656551946015,0.020795646784874795,1,es-AR,"El regreso, en tanto, está estipulado para la mañana del jueves 13 de agosto, nuevamente con escala en Madrid, por lo cual la delegación arribaría al aeropuerto internacional de Ezeiza ese mismo día a las 20.15."
1.4202853496880745,-0.155392582783508,1,es-AR,"En Repomoda, Carla Di Sí, creadora de lentes originales y vanguardistas, da claves para aprender a elegir el anteojo ideal para cada rostro y personalidad."
2.6626241510463866,1.257347068607441,1,es-AR,"Tres delincuentes armados asaltaron hoy el Centro Universitario de Idiomas del barrio porteño de Caballito, donde robaron dinero y objetos de valor y habrían violado a una empleada del lugar."
4.623465776677552,-0.5464549314944221,2,es-ES,"Acabó su intervención diciendo, que puede ser la última que hace como concejal, con una poesía, recordando otras ediciones y la importancia que tiene la muestra, los días 17, 18 y 19 de este mes en la Plaza de Toros."
5.688179197969166,-1.2594251620045962,1,es-AR,"Más allá de todo esto la CD quiere complacer a Gareca y es por eso que continuarán en la búsqueda de un delantero de área. El uruguayo Rodrigo Mora (Benfica) era otra alternativa, pero se iría a Peñarol. La idea es que se quede Guillermo Franco y poder incorporar otro delantero importante debido a las competiciones que se avecinan. Se verá."
5.587990679916469,-0.9591315298391151,2,es-ES,"Irlanda del Norte se situó como líder del Grupo 3 después de vencer a Polonia. Warren Feeney, Jonny Evans y en propia puerta Michal Zewlakow anotaron para los locales. Ireneusz Jelen y Marek Saganowski obtuvieron los del conjunto de Leo Benhakker. Y beneficiada provisionalmente por el descanso de Eslovaquia, que no jugó y que tiene dos encuentros menos que el cuadro de Nigel Worthington."
5.024949842745677,-0.1674725095788656,2,es-ES,"Ayer no falló nadie, algo que supo reconocer el respetable con una fuerte ovación, dados los tiempos de crisis que corren. Tampoco faltó Francisco Herrero 'el Topino', que, tras dos años de mandato, volvió a recoger la vara de alcalde de fiesta."
9.361342504689368,-2.8024048060634112,2,es-ES,"Hace apenas unos meses, en febrero concretamente, y a raíz de lo que estaban haciendo otros municipios gobernados también por el PP, como Castellón o Granada, 'La Verdad' preguntaba al alcalde y al concejal responsable de Sanidad y Servicios Sociales, Fulgencio Cervantes, si estaban pensando en elaborar una ordenanza para prohibir la prostitución. La respuesta de Cámara fue que «en el municipio no hay un clamor social que demande la regulación de la prostitución» y añadió que «no es un problema ahora mismo en la ciudad, ya que sólo se han dado situaciones puntuales»."
4.202087712494734,-0.022056266306319888,1,es-AR,"En el suelo quedaron más de cien heridos y al menos tres muertos, dos jóvenes de 15 y 17 años y una mujer de 75. El asaltante, según informaciones policiales, se pegó entonces un tiro en la cabeza con un revólver."
1.9678144493030085,1.1148514386659674,1,es-AR,"A lo largo de su carrera compartió escenarios con importantes figuras de la música como Noel Nicola, Joan Manuel Serrat, Chico Buarque, Mercedes Sosa, Soledad Bravo, Daniel Viglietti, Pete Seeger, Roy Brown, Pedro Guerra, Beth Carvalho y Liuba María Hevia."
3.178658270026268,-2.0162547478316273,2,es-ES,"Por otro lado, el presidente de Google, Eric Schmidt, confirmó el lunes que la compañía está trabajando en un tablet que estará basado en su sistema operativo para móviles y tendrá soporte Flash."
8.820173304564596,1.970296520805499,2,es-ES,"Con esta víctima medio centenar de mujeres han fallecido a manos de sus parejas o ex parejas en lo que va de año, seis de ellas en este mes de septiembre, frente a las 55 mujeres que perecieron en todo 2009. Trece de las víctima de este año fueron asesinadas en Andalucía, la comunidad con la cifra más alta en este tipo de crímenes."
2.3829923506578803,-1.0715476856195476,2,es-ES,"Analizar los impactos de las actuaciones que se están llevando a cabo y cómo hacer las cosas para conseguir alcanzar un futuro sostenible, es «una labor prioritaria en esta materia», según el Ayuntamiento."
4.725800149927357,2.097058562981827,2,es-ES,Durante la temporada de 2001 fue elegido como Jugador Más Valioso (MVP) de la liga y luego llevó a los Sixers a las finales de la NBA que perdieron frente a Los Ángeles Lakers de Shaquille O'Neal y Kobe Bryant.
3.210586368564202,-0.982236839895184,2,es-ES,"Si Henrique termina en Santander, algo que puede conocerse hoy mismo, su llegada puede determinar la salida de Oriol, un futbolista que ya ha dicho que prefiere cambiar de aires a no jugar."
2.7289040942101517,-0.8282450516143123,1,es-AR,"En la categoría de película en idioma extranjero figuraba la mexicana ""Biutiful"", mientras que su protagonista el español Javier Bardem estaba nominado como mejor actor."
5.3695360643990355,0.11531968329004552,2,es-ES,"En estos días de frío, lluvia y nieve, lo más importante es salir abrigado a la calle, de pies a cabeza. Si no estás dispuesta a renunciar a un look perfecto incluso en los días más húmedos, estás de suerte. ´Pretty Ballerinas´ ha sacada una línea de bailarinas y botas perfectas para combatir el frío y el agua sin dejar a un lado el estilo."
3.8690559471349655,-1.8834793892180424,2,es-ES,"Los agentes se trasladaron hasta los cuatro establecimientos, en los que finalmente no hubo ningún problema, ya que, según señalaron las mismas fuentes, la gente “es muy razonable” y las posibles infracciones se producen todavía por despiste y no deliberadamente. Aunque no se formalizó ninguna denuncia, los hosteleros permanecían alerta para evitar las posibles sanciones a causa del incumplimiento de esta normativa."
7.869193410051351,3.998326714352695,1,es-AR,"Los errores del Gobierno se multiplican. Nilda Garré culpa a una víctima de la masacre de Once, Lucas Menghini, de la inoperancia de sus subordinados. Juan Pablo Schiavi da ""vergüenza ajena"". Julio De Vido dice que no se protegerá a nadie, haciéndose cargo de las sospechas de protección a los Cirigliano y de la consiguiente corrupción."
5.982493660805469,-0.7290248537564437,1,es-AR,"Los líderes dijeron en un comunicado que las votaciones legislativas en Grecia ""sentaron las bases para la creación de los principales parámetros de un nuevo programa apoyado en forma conjunta con por los miembros de la zona del euro y el FMI, en línea con las prácticas actuales""."
9.017318620322788,2.5444952988805998,2,es-ES,"Fue en el mes de mayo, cuando los cicloturistas mendarotarras se desplazaron hasta Asturias para tomar parte en la Clásica de los Lagos de Enol. Un mes más tarde, a finales de junio, se realizó la excursión a Jaca, en donde recorrieron íntegramente la ruta de la archifamosa prueba cicloturista Quebrantahuesos. En esta prueba ningún cicloturista de Mendaro tuvo la oportunidad de participar."
5.749251427220352,-1.6524394041421402,1,es-AR,"El 20 de septiembre de 2010, un joven de 18 años cayó de un tren en Ezpeleta. El chico murió días después y su novia, que iba con él, denunció entonces que había sido arrojado del vagón en un forcejeo con tres ladrones que le habían robado el celular."
3.9071131947400697,-0.019957356293682116,1,es-AR,"Para el jefe de ministros, el ex presidente ""no entiende nada de economía ni de Relaciones Exteriores"" y aseguró que ""aún defiende la Obediencia Debida y el Punto Final y le fascinan las políticas clientelistas""."
3.737525675297761,-0.08843508090275944,2,es-ES,"Posteriormente se dieron a la fuga. Las mujeres se encuentran en perfecto estado de salud pues en ningún momento sufrieron agresión alguna por parte de los atracadores, salvo el nerviosismo causado por la dramática situación."
3.6418787346635364,-2.166412744925766,1,es-AR,"David Beckham, por su parte, reveló que el fanatismo de sus hijos por Bieber es tal, que desean que su futura hermana que nacerá el próximo mes de julio se llame ""Justine Bieber Beckham""."
6.383418687188866,3.0808104785339626e-05,1,es-AR,"En primer término, el atacante rosarino recibió la distinción de deportista distinguido de manos de Zamarini, en representación del Concejo Municipal. Cabe mencionar que el decreto se había votado por unanimidad en el mes de junio a partir de un proyecto del edil Manuel Sciutto."
6.0388141087385945,-0.44664432541078686,2,es-ES,"El concejal socialista Francisco Carsí recordó ayer que el artículo 36 de la nueva ordenanza de Tráfico prohíbe el tránsito de bicicletas por los jardines públicos salvo en tramos señalizados al efecto. «Sin zonas delimitadas para los ciclistas, las vías y caminos de las zonas verdes son utilizadas indistintamente por transeúntes y ciclistas con las molestias que ello supone para unos y otros», advirtió."
