x1,x2,label,lang,texts
3.289637456009361,0.6899313421381247,1,es-AR,"Es que la visita a la región es también un gesto de respaldo a la candidatura a gobernador de Agustín Rossi, candidato a gobernador del Frente Santa Fe para Todos."
3.9337072759779663,-1.990257341269908,1,es-AR,"La realización del encuentro generó mucha expectativa en los referentes locales, y ayer había más de 150 empresarios y profesionales inscriptos, número que superó las expectativas y motivó a que se cambie el salón Circular por uno más grande en la Bolsa dónde realizar el evento."
3.5663413346922006,-0.8935655728291618,1,es-AR,"Además, sostuvo que eran ""deplorables"" las condiciones del ómnibus escolar y ejemplificó que se desplazaba con ruedas ""prácticamente lisas"", al tiempo que responsabilizó al ""poder político de Campana"" por la realización del viaje de los estudiantes."
2.0487631504310064,-0.37951934642408974,2,es-ES,"Para este encuentro se podrán adquirir las entradas desde las 19.30 horas en el estadio, aunque tendrán pase gratuito los menores de 12 años y los socios 'premium'."
7.904451002066556,2.3812731128109963,2,es-ES,"Para pedir esta ayuda económica se deberá presentar la solicitud, acompañada del DNI del solicitante o el NIF de la comunidad de propietarios, el número de cuenta para el ingreso de la ayuda, una factura original de la adaptación y una declaración de estar al corriente con Hacienda y con la Seguridad Social."
10.188567556495684,0.11864397827659474,2,es-ES,"Nestlé, que cuenta con factoría en Cantabria, considera el agua como un recurso de incalculable valor y promueve su uso racional en toda la cadena de valor, que va desde la agricultura hasta el consumo doméstico, pasando por sus procesos de fabricación sobre los que tiene control directo. La compañía lleva a cabo una labor continuada con el objetivo de reducir el consumo de agua un 15% de cara al año 2012 y asegurar la recuperación de las aguas residuales generadas por su actividad."
5.679709806165063,1.0649941741198832,1,es-AR,"Por estas horas, 250 empresarios argentinos llevados de la mano por Guillermo Moreno, secretario de Comercio Interior, se aprestan a aterrizar en Luanda, capital de Angola, adonde mantendrán agotadoras reuniones con sus pares. El destino parece insólito, pero para sorpresa de muchos son varios los hombres de negocios que ya han probado suerte en ese mercado."
5.886845821557493,0.697111938385115,2,es-ES,"Para el líder de la oposición, lo que desgasta a Zapatero también es «presentar unos Presupuestos Generales del Estado que son un torpedo en la línea de flotación de la competitividad y la generación de empleo»."
4.7562462614541445,2.965774827977978,1,es-AR,"Por otra parte, Manuel Galindo, presidente de la subcomisión de Rugby de Alto Rendimiento, viajó ayer rumbo a Europa para juntarse con Agustín Pichot y poder definir la situación contractual de los jugadores argentinos con sus distintos equipos de Francia e Inglaterra."
8.738063624605777,2.372314653379295,1,es-AR,"En Sudamérica, la encuesta revela que el 34 % de los empleadores de la región tiene problemas para cubrir puestos de trabajo debido a la falta de talento disponible en sus mercados. Así, los empleadores de la región que más dificultad tienen para conseguir a las personas correctas para cubrir puestos de trabajo son los de Brasil (64%), Argentina (53%), México (43%) y Perú (42%)."
1.396107083212716,0.08183001395649817,2,es-ES,Los Beatles llevaron a cabo en ellos un 90 por ciento de sus grabaciones y dieron además ese nombre a su ultimo álbum.
4.209950479963892,-4.100684945286132,1,es-AR,"El que avanzó sin transpirar fue el suizo Roger Federer. Es que su rival, el alemán Andreas Beck se retiró del torneo debido a problemas en la espalda. El número tres del mundo se medirá en la próxima instancia contra el croata Ivo Karlovic, vencedor del argentino Carlos Berlocq."
6.472369844000726,2.948870728605978,1,es-AR,"El vicepresidente del Comité permanente de la Asamblea Popular de China, Jiang Shusheng, ratificó el apoyo de su país al reclamo nacional de soberanía de las Islas Malvinas y resaltó la ""necesidad"" de reanudar las negociaciones entre Argentina y Gran Bretaña para encontrar una ""solución pacífica"" a la disputa."
5.173358503750853,-0.7388100184610055,1,es-AR,"Tras dar su primer paso con éxito en el ATP 250 de Sydney, Juan Martín Del Potro buscaba esta madrugada su pase a semifinales ante el chipriota Marcos Baghdatis. Y en la previa del Abierto de Australia, el tandilense comentó que “llegar a la segunda semana sería un buen inicio de año”."
1.5655433643351688,-1.627715344305625,1,es-AR,"El mallorquín se quedó con los cuatro primeros cruces tras vencer al tandilense en Miami, Roland Garros y Queen`s, en 2007, y luego en Indian Wells 2009."
5.960755398060791,-2.2963384323710154,2,es-ES,"Tampoco se quedaron en el tintero asuntos como la continuidad de los alumnos en el deporte tras las Escuelas, la formación de verdaderos grupos humanos que han perdurado en el tiempo o la promoción que han supuesto las escuelas para los deportes en Valencia."
4.393629379454471,-1.2945662072816637,2,es-ES,"Se procede al embargo de la vivienda o la cuenta bancaria en el caso de que, habiendo dictado anteriormente la sentencia que le obliga a pagar, sigue sin hacerlo o sin explicar a que se debe esa demora."
4.904747246228616,0.8106571466144282,2,es-ES,"Mientras tanto, la oficina del Fiscal de la Corte Penal internacional ha advertido este jueves que estaba ""vigilando"" la situación en Costa de Marfil por la escalada de violencia en las últimas horas."
11.130054333497228,2.1618307020050884,2,es-ES,"El concurso, dotado de premios en metálico, tiene un presupuesto de 20.000 euros, de los cuales 8.000 destinados a premiar las mejores reses de cada una de las secciones de las que consta el certamen, dicinueve en total. Está considerado como uno de los mejores morfológicos de carácter regional de cuantos se celebran en Cantabria durante la temporada. Nació hace quince años por iniciativa precisamente de Angel Duque, a más en cada edición, aunque el año pasado quedó en blanco, no se celebró."
3.0989962536863516,-2.040224244357435,1,es-AR,"Guelaguetza es una palabra en lengua zapoteca que significa ofrenda o presente. En una forma amplia, es un acto generoso de dar, cuando la ocasión se presenta, y que siempre será correspondido por aquel que recibió."
7.409978696940496,0.07484329931757844,1,es-AR,"En una audiencia con el secretario de Transporte de la Nación, el Ing. Schiavi nos manifestó que el Estado estaría dispuesto a apoyar. Después se cuenta con una financiación importante del Banco Mundial de alrededor de u$s 500M. Con esto apuntamos a que el plan tenga todas las características de un sistema de transporte moderno."
5.013371973104905,-2.108534452394687,2,es-ES,"Cavendish hace historia en la prueba española, ya que por primera vez el comienzo fue una contrarreloj por equipos disputada a últimas horas del día y por ser el primero en enfundarse la camiseta roja que distingue al primero en la general y sustituye a la dorada de las últimas ediciones."
3.4396437644946998,-0.14061752741862074,2,es-ES,"No, no, es una de las posibles, pero no es la única, ¿no? Yo creo que esto lo tendremos encima de la mesa en los próximos meses."
6.597675914020725,-1.4416649270671353,2,es-ES,"Cámara ha añadido que el convenio del Real Murcia, que también fue puesto en tela de juicio, siguió el mismo camino. Y respecto a la denuncia en el Tribunal de Cuentas, tras dos años de diligencias, ""se resolvió que los procedimientos se habían hecho de acuerdo con la legalidad""."
3.8897080571236913,1.4011196941816733,2,es-ES,Actualmente en obras de promotores de La Línea «es duro ver que traigan contratas de fuera sólo porque son más baratas al pagarles menos de lo estipulado a sus trabajadores».
2.775308693869301,-1.1684649103019809,2,es-ES,"Un festival literario y multicultural que este año se desarrollará con menos presupuesto y con los autores del cono sur empujando a los nórdicos, tan de moda en los últimos tiempos. Como advirtió su director, Paco Ignacio Taibo, se trata del único certamen literario del verano «sin escritores nórdicos ni vampiros enamorados»."
2.975797554772947,1.6921405673928842,1,es-AR,"A días del estreno de una nueva emisión cinematográfica de la saga de vampiros ""Crepúsculo"", los exitosos protagonistas del film ya tienen su biografía."
4.837503511280516,-0.6218026835127233,2,es-ES,"Otras, dijo la concejala, se encuentran «al inicio del proceso y todavía en la fase de 'congelación' emocional». En cualquier caso, se les abre la posibilidad de iniciar o continuar con un tratamiento individualizado, gracias a la colaboración que el Ayuntamiento mantiene con Cavas."
6.667619896388686,1.6450946179321961,2,es-ES,"De hecho, la iniciativa llega un día después del acuerdo entre PSOE y PP para modificar la ley electoral y posibilitar la expulsión de electos que considere que contravienen la Ley de Partidos, incluso después de los comicios. El Gobierno y los populares reaccionaron ayer manteniendo su postura de exigir más hechos a Batasuna."
3.991741651940459,-0.12205128342322362,1,es-AR,"Con el objetivo de continuar entregando a sus clientes la mejor experiencia de viaje, este nuevo sistema permitirá que desde sus teléfonos celulares, los pasajeros accedan a servicios claves que facilitarán el comienzo de sus viajes."
2.9937488570655932,0.05176093693548808,1,es-AR,"""Contrariamente a cualquier información errónea, Shakira no actuará ni nunca fue contratada para realizar un concierto para el presidente o el gobierno checheno"", indicó un mensaje de Twitter de la cantante colombiana, confirmado como auténtico por su portavoz Shoshanna Stone."
3.429370728433297,-3.2740045915002733,1,es-AR,"Si hacemos conclusiones y recomendaciones. Las recomendaciones es para darle identidad de lo que se registra, esto no significa que nosotros no hagamos mención el anterior estaba bien, también tuvo sus problemas el anterior pero debe ser un indice que debe capotar con mayor rigidez, los cambios que le ocurren."
8.01201213713049,0.7289686032901919,2,es-ES,"Los decretos del Gobierno valenciano recuerdan que la ley de Presupuestos de la Generalitat para el ejercicio 2010 establece que la Generalitat podrá prestar avales durante ese ejercicio para las operaciones de crédito que concierten las entidades o empresas públicas hasta un límite de 650 millones de euros, y que los avales autorizados en estos decretos están dentro de ese límite."
5.772951967800435,-1.1259469159288271,1,es-AR,"A partir del 2 de mayo, quienes ingresen en las sucursales del NBSF encontrarán expendedores de bolsas precintadas, de color oscuro y dotadas de un mecanismo que impide su apertura durante el tiempo en que se permanezca dentro del recinto, las que estarán destinadas a guardar en su interior los teléfonos celulares."
7.854480230479577,0.8265628198015107,1,es-AR,"""Este pequeño movimiento que hay en los precios marca una buena tendencia, que esperemos se siga consolidando con el correr de los meses. Hay casos en los que algunas industrias, producto de la caída de la producción ya pagan 1,40 $/litro"", dijo a Infocampo.com.ar, Alejandro Leveratto, presidente de la Cámara de Productores Lecheros de Córdoba (Caprolec)."
3.762410747331161,0.5419994492419443,2,es-ES,"Dentro de las simulaciones de delito las más frecuentes son las relacionadas con telefonía móvil, aparatos como viodeoconsolas portátiles y tarjetas de crédito cuyo contrato generalmente conlleva un seguro que no cubre la pérdida pero sí el robo con violencia o intimidación."
2.6085831125275707,-0.2760192295775026,2,es-ES,"Cuando la pérdida de peso es del 25% al 30% o si los pacientes tiene escasa motivación, trastornos psiquiátricos asociados o problemas en el entorno familiar, se suele recurrir a la hospitalización."
3.3077065008666113,-1.3036321648495113,2,es-ES,"Juan José Cortés, padre de la niña ha pedido a ""quien la tenga, que la devuelva, que no pasa nada"", ni tendrá represalias por su parte, al tiempo que ha asegurado ""no tener rencillas con nadie""."
8.122191217911514,-1.332979063366304,1,es-AR,"Pasada la última navidad Miguel se encontró con Mauricio y Macri le dijo que le serviría mucho al partido que, más alla de todo el aporte de su incorporación al PRO Santa Fe, Miguel encabece este proyecto de cara a las elecciones de 2011. Obviamente Miguel se sorprendió, se puso muy contento pero explicó que tiene compromisos laborales asumidos y dijo que se iba a tomar un tiempito para contestar. Mas allá de una candidatura o no, Miguel del Sel está comprometido a apoyar la candidatura quien compita en Santa Fe y a Macri en la Nación."
2.0485602127691966,-0.7267088785441816,2,es-ES,"El escolta estrella de los Lakers también aportó ocho asistencias para ser el líder del equipo en ese apartado, capturó siete rebotes y recuperó un balón."
7.331698292427889,-2.408492197805628,1,es-AR,"""No existe un 'Plan B para reemplazará a Brasil. Nuestra mayor preocupación pasa por lo que debe hacer Brasil para recibir a todo le gente que desea presenciar la Copa del 2014"", enfatizó el dirigente, quien destacó que la FIFA debería haber recibido documentación de Brasil en 2007 y que aún no llegó, que sólo San Pablo y Río de Janeiro poseen buena infraestructura hotelera, y que en la sede de Manaos no hay buena capacidad de hospedaje."
2.3201939970626415,-0.9507854998555695,1,es-AR,Este nuevo cruce se produjo luego de que el día anterior la presidenta Cristina Kirchner pronunciara un duro discurso contra contra el Reino Unido y su primer ministro David Cameron.
10.068091613072461,2.6457567442603653,1,es-AR,"Las empresa de cobro de servicios Pronto Pago empezó hace poco a operar en Venado Tuerto ofreciendo a los ciudadanos de esa localidad la posibilidad de abonar la factura de la TGI y agilizar el trámite. La llegada de la empresa con sede en Junín fue vista con buenos ojos por los concejales ya que desde el cuerpo deliberativo habían propuesto el ingreso de este tipo de empresas para abonar impuestos, tasas y servicios."
6.089219292792816,1.5599838705783875,2,es-ES,"Así, tras recibir de la Comunidad información sobre las medidas compensatorias diseñadas y aplicadas para cumplir la Directiva Hábitat en cinco proyectos la Comisión Europea pidió en febrero de 2008 a los responsables regionales un análisis más amplio y detallado sobre los impactos de Novo Carthago en la Red Natura 2000. Ésta es un catálogo de sitios cuya biodiversidad debe ser preservada frente a las actividades humanas."
9.100127596015135,-1.2968647399283246,2,es-ES,"Sin embargo, la información sobre el presunto uso privado de los fondos y medios públicos por parte del director del CNI siguió apareciendo, entre otras, noticias que apuntaban que se estaba sirviendo de su posición para colocar a familiares o amigos en el CNI, a agentes para limpiar su piscina o incluso que el centro compraba la cosecha de patatas de un familiar. También se conoció que estaba utilizando la prueba del polígrafo con algunos agentes del CNI para tratar de averiguar quién estaba realizando las filtraciones a la prensa."
5.077641137220976,-3.287787877370138,1,es-AR,"El empresario consideró que ""sería bueno que estemos en un clima de diálogo (con la CGT) teniendo en cuenta que en poco tiempo comienzan las negociaciones paritarias"", aunque esperanzado confió en que ""el pico de tensión entre Moyano y Cristina ""se resuelva rápido""."
4.350103952712994,0.35579400250029625,2,es-ES,"Según el protocolo de accesibilidad universal de los servicios ferroviarios, las estaciones Adif permitirán en 2012 ""la plena autonomía en el acceso a los servicios ferroviarios al 90% de los viajeros"", han anunciado las citadas fuentes."
5.606832931486204,2.1640276780931003,2,es-ES,"Por tanto a partir de la próxima semana, coincidiendo con el comienzo del mes de julio, serán muchas las tiendas que luzcan pegatinas y carteles de la campaña de abonos 2009/10 de la Balona."
5.283646673332047,-2.6544022305904633,2,es-ES,"El titular de Interior aprovechó la redada para insistir en que el alto el fuego decretado por ETA no modificará «ni un ápice» la política antiterrorista desplegada en los últimos años por el Gobierno, «y así será hasta que la banda «abandone definitivamente la violencia»."
11.148223929046306,0.12443767441714323,2,es-ES,"Por otro lado, el sondeo revela que el 20% de los encuestados no pedirá este nuevo año un aumento de sueldo pero sí que cuentan con la expectativa de la subida que se produce normalmente cada año. Sin embargo, más del 42% de los trabajadores españoles parece haber adoptado una postura con la coyuntura económica actual y no pedirá ese aumento ""tan esperado"" por el simple hecho de ser conscientes de la situación por la que atraviesan la mayoría de las empresas hoy en España."
4.393385687888763,-0.6787561262146408,2,es-ES,"Por todo ello, hicieron hincapié en que ""se evidencia que ninguna intervención directa ni indirecta tuvo José Luis Ulibarri Cormenzana en la concesión de licencias de TDT a diversas sociedades participadas entonces minoritariamente por Mediamed Comunicación Digital, tal y como se ha indicado en algunos medios de comunicación""."
3.318808851912202,0.09990368511411414,1,es-AR,En la reunión se dialogó sobre la necesidad de ambas administraciones para llevar adelante estrategias en común con el objeto de realizar eventos culturales y deportivos.
4.862587190263576,-1.3777182296663775,2,es-ES,"La primera década del siglo XXI nos dice claramente que la televisión está dejando de ser el medio rey, con la información y el entretenimiento transmutados en el mundo multipantalla y en el canal de nueva configuración denominado 'yo'."
5.124294318198474,0.35175314802302116,2,es-ES,10. La escuela es una parte de la educación. Pero ni siquiera la más importante. Saramago aún no ha olvidado la figura de un padre violento como tampoco el testimonio silencioso de unos abuelos que con su ejemplo le enseñaron el camino.
7.703318802565173,-2.2696779439817933,2,es-ES,"Está claro que Sienna Miller y Jude Law quieren recuperar el tiempo perdido. Tras terminar su relación en 2006, la pareja se ha querido dar una segunda oportunidad y se han dado cuenta de que no pueden vivir el uno sin el otro. El periódico británico Daily Mail ya anunciaba el pasado mes de mayo una futura boda de la pareja, que según parece, y teniendo en cuenta las últimas noticias de la prensa internacional, tiene previsto celebrarse este mismo verano."
3.7879599059358537,-1.3224966233563047,2,es-ES,"El tanto visitante abrió heridas recientes, pero los futbolistas blanquiazules se resistieron a dejar el terreno de juego de esa manera. Tres minutos más tarde, casi al límite del descanso, lograron igualar. Envió José Luis un centro al área y Kijera, en una acción poco afortunada, marcó en su portería. No era el gol soñado, pero sirvió igualmente para hacer justicia."
6.342901045521309,1.7839560865771438,1,es-AR,"El traslado dependerá de su estado y podría concretarse en una semana. Si “está bien su evolución de la cirugía, de lo que es la traqueotomía y la vía central, podríamos hablar de una semana"" de un posible traslado a la Argentina, pero antes deberán ""estabilizarlo"", remarcó Ferreyra."
5.565950147898709,-0.8945084617046938,1,es-AR,"Para cerrar con muchas sonrisas y con ganas de seguir demostrando todo su potencial, el talentoso jugador ex Argentinos, Independiente y Boca en nuestro medio y otros equipos en el exterior, expresó palabras de elogio para su actual entrenador, Ricardo Gareca. “El técnico nos da una idea de juego que nos permite sentirnos muy cómodos dentro del campo de juego y eso es algo fundamental en un equipo”, finalizó."
3.320224971690355,-0.5578886698095643,2,es-ES,"La Corte Suprema determinó ayer que sólo habrá un resultado oficial después de que el Alto Tribunal se pronuncie sobre las peticiones presentadas por los opositores de Musharraf, quienes consideran anticonstitucional su candidatura."
4.8774152380254545,-1.7698417279657883,1,es-AR,"Y un tema aparte merece la cuestión sobre que no es apto para todos los bolsillos. En el mundo actual cada vez son más las marcas que se especializan en este sector adinerado de la población, y empieza a vislumbrarse el consumidor dispuesto a desembolsar 300 euros por un simple traje de baño."
3.1200077901787657,-2.3949870847994563,2,es-ES,"""El problema que tenemos es que hay grupos poderosos porque tienen secuestrados a los ciudadanos, que pueden ser los controladores o los conductores de Metro, que pueden paralizar una ciudad y tomar como rehenes a los ciudadanos. Eso no puede ser"", ha afirmado."
4.815543818265725,-3.6381365090351636,2,es-ES,"Así, al Oeste se creará un sector destinado a parque. Al Este, se ubicará, con un esquema de franjas muy definido, el área netamente urbano en el que se distribuirán casi todos los edificios residenciales y comerciales. En esa zona también se concretarán los equipamientos. Todo ese área edificada se dividirá en dos por un parque más urbano que abarca la actual charca y su entorno."
7.0248320309062935,2.8878821353248343,1,es-AR,"“Siempre fuimos una colonia y aprendimos de nuestros colonizadores cosas buenas y malas. Desde Europa (donde vivo) veo la creciente ola de odio hacia la civilización que están preginando desde las autoridades. Esa película ya la vimos. Vieja receta. Ese es el enemigo, únete a mi y yo te `protegeré para combatirlo. Chavez, Castro, Uribe...(los hay de los dos lados) Está de moda ser antiinglés de nuevo? LA moda pasa de moda”, concluyó."
9.631484185362007,1.087318388356705,1,es-AR,"El diario The Guardian retoma las palabras de Waters a un periodista chileno en un artículo que es, este mediodía, el segundo más leído del popular portal. La nota pone énfasis en la sensación de Waters de ""vergúenza por el pasado colonial"" de Gran Bretaña y reseña que un disco de Pink Floyd de comienzos de los 80, The Final Cut, contenía conceptualmente un alegato antibelicista inspirado por el conflicto de 1982."
11.51981778123813,3.4499396616959386,2,es-ES,"El plazo de solicitudes comenzó el pasado 4 de noviembre y permanecerá abierto hasta el próximo 2 de febrero. La elevada cifra de solicitudes presentadas en este primer mes ""denota el amplio grado de aceptación entre las familias y comercios de la Región de Murcia de este programa, del que se está celebrando su cuarta edición"", indicó el director general de Telecomunicaciones y Sociedad de la Información, Diego Pedro García, en comunicado de prensa."
4.065010595958946,0.68831164414167,2,es-ES,"Sin embargo, Candela ha acusado a sus socios de gobierno de ""haber intentado buscar aliados conservadores para sacar adelante el presupuesto"", una situación que ""se vio paliada por la sensatez y la responsabilidad"" de los socialistas."
5.568954155229607,-1.402788231530864,1,es-AR,"No cualquiera es capaz de elegir un buen vino. Para eso hay que tener paladar y saber percibir su aroma para apreciar su consistencia, temperatura, volumen, entre otras tantas características que diferencian a uno de otro y que definen cuál es el mejor para cada comida, momento y lugar. Y así como hay especialistas que se encargan de recomendar al consumidor qué vino llevar, también hay quien explica las propiedades de otros productos y sugieren cuál es mejor utilizar en cada ocasión."
7.6937138989282134,3.0686715395813606,1,es-AR,La automotriz arrancó el año con el anuncio de una inversión de 90 millones de pesos para expandir la capacidad instalada del Complejo Chevrolet de Alvear. La movida generó 500 nuevos puestos de trabajo y un incremento en las compras a proveedores locales del orden de los 170 millones de pesos.
4.018966547106227,-2.648921226682307,1,es-AR,"En el anuncio también se informó que el hijo fue bautizado Moroccan Scott Cannon, debido a que Scott es el segundo nombre de Cannon, al igual que el de su abuela."
5.347016611429234,0.4769027022984041,2,es-ES,"De esta forma, Miley Cyrus despide el año igual que lo comenzó, con continuas salidas de tono y ganándose, cada día más, el desprecio de los padres de aquellos niños que, en un principio, adoraban su serie de televisión."
9.092681016733632,2.2936173302418337,2,es-ES,"La asociación es la más numerosa de cuantos colectivos conviven en toda la comarca. Y, desde luego, la que más presencia tiene en los hogares de Los Corrales. De hecho, entre socios y colaboradores, especialmente familiares mayores de miembros en activo, la cifra se acerca a las 3.000 personas implicadas, de una forma u otra, en la organización de la fiesta."
4.672318175791867,-3.1674580870694675,2,es-ES,"En esta línearecordó que desde las Corts se instó al Gobierno a convocar una reunión con las autonomías en materia hídrica, ya que la política del agua, que es una «política de Estado la tiene que llevar adelante el presidente del Gobierno». «Mientras eso no sea así, esto no tiene arreglo»."
4.753468247012762,-0.06129112410496749,2,es-ES,"Sin embargo, según la sede de la Alianza Atlántica en Bruselas, la mayor parte participan en unos ejercicios que ya estaban previstos de antemano. Mientras que el resto de embarcaciones transportan ayuda humanitaria a Georgia."
