x1,x2,label,lang,texts
2.8399306366062267,-0.0010070802665624425,2,mk,"Пред околу два месеци, Грос во интервју за овој медиум рекол дека ќе се обиде да најде дополнителни информации за смртта на Трајковски преку негови пријатели и врски во Париз, Вашингтон и Брисел."
0.00037855519034244106,1.8885165825016612,1,my,Katanya dakwaan Malaysia sudah menjadi negara polis adalah sesuatu yang tidak wajar malah ia secara tidak langsung telah mencemarkan kewibawaan bidang kepolisan di negara ini.
4.1172926717782055,-0.00021210074801156803,2,mk,Ратко Младиќ нема куќа на негово име во Македонија Новаковски му купи уште десет дена на Бранко Ратко Младиќ има куќа на Скопска Црна Гора На 29 страници опишан теророт во Жолтата куќа Брокерска куќа Нови Триглав од Скопје Статијата е прочитана 722 пати.
3.5459250232550654,0.039219263168368365,2,mk,"За време на пребаруваоето на најмалку 47 места во Софија, Пловдив, ПазарYик, Стара Загора и Хасково, полицијата заплени 55.000 евра во вид на фалсификувани банкноти од 50, 100 200 и 500 евра."
3.06731168552681,-0.0031852672796437624,2,mk,"Претпријатијата ќе можат да се регистрираат дури и онлајн во блиска иднина. „Виндоу пријавата ќе биде на располагање низ цела Албанија, што ќе им овозможи на бизнисите да се регистрираат локално."
0.0003617480620329229,1.4353377398557454,1,my,"Di Kapit, PRS akan bertanding di tiga kerusi iaitu N 56 Baleh (Masing), N 54 Pelagus (Stanley Nyitar) dan N 57 Belaga (Liwan Lagang)."
0.00032673744395267563,1.2848835194582648,1,my,Saya memang obses dengan bulu mata jadi sebab itu saya memilih pelekat bulu mata Shu Uemura dan pembersih mekap sebab ia akan mencuci mekap saya hingga bersih.
0.00045649161329302076,1.5344638224226055,1,my,"Beliau berkata dalam konteks Asean, Malaysia telah menandatangani FTA dengan banyak ekonomi baru berkembang, dan negara ini mencapai perdagangan bernilai RM1.17 trilion tahun lepas."
1.2002721399082192,0.000914487924121676,2,mk,"Предлогот беше објавен по состанокот во јули во Софија помеѓу македонскиот министер за одбрана Владо Бучковски и неговиот бугарски колега, Николај Свинаров."
1.5252273388660764,0.006435439608054932,2,mk,"Коментарите кои не се во контекст на веста ќе бидат отстранети. ovde George Bush aaii se cukala 90 saati nov engleski rekord E bogami svaka cast, ova ne e lesno da se pravi!"
2.1429116872373815,-0.002649224171977138,2,mk,"Изразувајќи жалење што на Караџиќ му беше дозволено да ја избегнува правдата повеќе од една деценија, претседателката на Хрватската народна партија, Весна Пусиќ, ги пофали српските власти."
1.3600988201816857,-0.0015502196027962164,2,mk,"Другите марки што ќе бидат видени за време на Олимпијадата преку транспарентите, билордите, знамиоата и другите расположиви површини, ги вклучуваат ""Џон Ханкок"", ""Кодак"", ""Мек Доналдс"", ""Панасоник"", ""Самсунг"", ""Шлумбергер"", ""Спортс Илустрејтед/Тајм"", ""Своч"", ВИЗА и ""Зирокс""."
4.711415440851186,-0.006882228929861356,2,mk,Истражувачите нашле дека слични намалувања на нивото на болка учесниците почувствувале при вербално одвлекување на вниманието со зборови на асоцијација иако Јунгер нагласува дека таков вид на дистракција стимулира различен дел на мозокот.
0.00025778205434549573,1.0485754683607886,1,my,"Namun, masih belum dapat disahkan sama ada Araujo yang merupakan teman wanita pemain gitar kumpulan Rolling Stones, Ronnie Wood itu akan membintangi Bond 23."
1.3998971475891957,0.00255177740807072,2,mk,"Покрај тоа, поголемиот дел од нив се деца инфицирани преку заразена крв за трансфузии во периодот од 1988 до 1991 година."
2.654766524977772,0.0005871526177244002,2,mk,"Оваа сума, се вели во соопштението објавено во петокот (26-ти март), е издвоена од средствата собрани за реконструкција на Православната црква во Тирана."
0.00037639719201176813,1.428984179834332,1,my,"RCZ bersaing dalam segmen sport coupe yang niche dan kami yakin ia akan diterima baik, kata Ketua Pegawai Eksekutif Nasim, SM Nasarudin SM Nasimuddin."
3.631010632916997,-0.001077080038409468,2,mk,"„Бараме сите студенти кои имаат 48 поени во претходната академска година да бидат целосно изземени од плаќање школарина, и цената за запишувањето на универзитетот да не биде повисока од три [месечни] минимални плати во Србија [околу 450 евра]“, рече за SETimes студент кој се идентификуваше како Воислав Д."
0.007544919154127517,2.2284857015072452,1,my,"Kali ini, para pelumba akan berentap lagi untuk pusingan keempat yang juga terakhir di Kuching dalam tiga kategori perlumbaan iaitu kategori A (13 pusingan), kategori B (12 pusingan) dan ‘Daichi One Make Race’ (10 pusingan)."
1.1970694395690153,-5.359914839435532e-05,2,mk,"Вакви примери има многу, во кои има многу визии и опции -- понекогаш диктирани од различни интереси -- и не може да се постигне договор."
0.00042126676386006114,1.699925761514847,1,my,"Seluar dalam yang dapat menyokong kerandut zakar perlu dipakai untuk membantu melegakan kesakitan. Saudara juga mungkin dapat melihat sedikit kebengkakan pada kerandut zakar. Namun, bengkak ini akan hilang dalam masa beberapa hari."
5.020831779120031e-05,0.15869687581462433,1,my,Kontroversi pemilihan Hadiah Nobel KENAPA gerangan Hadiah Keamanan Nobel kadang kala mencetuskan kontroversi berpanjangan seperti berlaku kini setelah Liu Xiaobo dari China dipilih menerimanya.
0.0005199503459700792,2.1657954566903532,1,my,"“Saya berasal dari kampung dan apabila berjaya memasuki universiti di Lembah Klang, saya alami kejutan budaya. Suasana di bandar cukup mengujakan, apatah lagi dihidangkan dengan pelbagai hiburan yang melalaikan."
0.006880328155334594,1.5435257672920093,1,my,"Semuanya berkemungkinan berlaku apabila lebih 3,000 penonton yang gagal mendapatkan tiket untuk Konsert Double Trouble pada 1 Mei lalu terpaksa berputih mata menunggu di luar pagar tempat berlangsungnya konsert ini."
1.9592677222255597,-0.0009018363412448203,2,mk,"Истовремено, кустосите и експертите за ирачкото богатство ги обвиниле американските сили дека извршиле ""злосторство на столетието"", бидејќи не ги заштитиле од пљачкосување и разурнување експонатите во музеите и древните археолошки наоѓалишта."
2.9347576921936387,0.0024592417591795604,2,mk,Ирското отфрлање на Лисабонскиот договор го оневозможува проширувањето на ЕУ на повеќе од 28 членки. Во моментов ЕУ има 27 членки.
0.0003007039441749973,1.0155783288793248,1,my,"Dalam pertandingan ini juga, Abdul Subar disenaraikan memenangi tempat ketiga bagi pusingan keseluruhan (Grand Slam) dan mendapat bot getah tajaan Universal Fitness & Leisure Sdn Bhd."
1.895780613494488,-0.0027520823888182687,2,mk,Долго време. Мислам дека силите на Балканот нема да бидат таму толку долго бидејќи очекувам чекори кон повеќе разговори и поголемо зближуваое на луfето.
0.0005386623764064062,1.863343958698163,1,my,"Teknologi itu dibawa dengan kerjasama syarikat Airspan, Amerika Syarikat dan dipantau oleh syarikat pengukuran teknologi dunia, Agilent Technologies untuk laporan dan transformasi serta kelajuan dengan penggunaan VSAT."
2.925967070743202,-0.002829082119048743,2,mk,"Покрај ова, сопственикот на ФК Аргес се смета дека наредил подмитување на четворица судии од првата лига, заради местење на резултатите од натпреварите помеѓу октомври и декември минатата година."
0.0005144072806840724,1.9015625943437942,1,my,"Mangsa juga hanya dibekalkan dengan sebuku roti untuk setiap dua minggu dan terpaksa minum air paip dalam bilik kecil yang dilengkapi tandas. Malah, mereka turut dijadikan seperti hamba apabila dirotan jika cuba merayu, membuat bising atau meninggikan suara."
2.707282175884194,-0.0017587343499405588,2,mk,"Одлуката на ЕУ им оди во прилог на партиите што не сакаат Србија да пристапи во ЕУ, според претседателот Борис Тадиќ. [Ројтерс]"
1.864345550684518,0.0023109345262721888,2,mk,Романски хакери ја компромитираа базата на податоци на американското трговско претпријатие TJX и продадоа над 40 милиони податоци за неговите клиенти.
1.1043850606475705,0.0006178752135637411,2,mk,Првите 2 недели до еден месец ќе ги мине во приемното одделение каде стручен тим ке одлучува во кое одделение ќе ја отслужува казната.
3.6870991278420955,-0.005396178279419139,2,mk,"Освен тоа, инфрацрвените камери над екранот ги следат и движењата на рацете, така што објектите на екранот со помош на соодветен софтвер можат да се движат без допирање на екранот."
2.962166368550309,-2.1931840193019417e-05,2,mk,"Кандидатурата на Турција за членство во ЕУ, најверојатно, уште повеќе ќе се искомликува по општите избори во Германија на 18-ти септември."
1.5530194789708647,-0.0006106944538507025,2,mk,"Тој изрази жалење што сепак се регистрирани одредени инциденти, но нагласи оти тие мораат целосно да се истражат, а вмешаните во нив соодветно да се казнат."
5.185996177799236e-06,0.02288880378918662,1,my,Bhd Dato’ Hj Othman b Abd Razak Datin Habsah bte Yusoff Kisham @ Khairul b Dato Hj Othman Khazila bt Dato’ Hj Othman Mustafa Trading Sdn.
2.558941483555315,-0.0012249447314442133,2,mk,"Во врска со овој проблем, фабриката за производи од риба и конзервирање „Рибарство“ планира серија проекти кои имаат за цел зголемување на капацитетот за десетпати."
2.0708460956280437,0.03505046786885306,2,mk,"ДПА во Првата изборната единица добила 10.904 гласови или 5,2 отсто, во Втората 11.214 или 5,5 отсто, во Третата 1.413 или 0,6 отсто, во Петтата 8.341 или 4,4 отсто и во Шестата 31.823 гласови или 16,8 проценти."
0.0008267545769583132,2.960309817042873,1,my,"“Bagi projek menaiktaraf tapak pelupusan sampah di Jalan Seng Ling di Sibu telah disiapkan pada September tahun ini sementara projek di Kemunyang dan Bekenu dalam proses dan dijangka siap menjelang hujung tahun,” tegasnya."
0.00034052076830272485,1.3405534235386511,1,my,Tekanan yang diberikan itu menyebabkan ramai menjangka Syria akan menjadi sasaran selepas Iraq memandangkan AS sebelum ini menggunakan helah sama untuk menggulingkan rejim Saddam Hussein.
0.0004901143266619615,1.8372528345372254,1,my,Timbalan Menteri di Jabatan Perdana Menteri Senator Datuk T. Murugiah berkata lawatan berkala seperti itu adalah bertujuan meningkatkan keberkesanan jaringan keselamatan bagi membanteras sebarang aktiviti jenayah termasuk penyeludupan manusia dan senjata api ke negara ini.
0.00012832901195312797,0.4952121949581072,1,my,"Jumaat lalu, Pejabat Mufti mengeluarkan irsyad atau risalah petunjuk mengenai tanggungjawab sosial masyarakat Islam setempat dalam menghadapi wabak flu H1N1. Ia telah dibaca sewaktu solat Jumaat minggu lalu."
0.00030491118556590503,1.3035880768927302,1,my,"""Pada suatu masa, Barbie terlalu bernilai memandangkan ia hanya dihasilkan untuk tujuan eksport. Lagipun, kami tidak mampu untuk memiliki patung yang kosnya lebih tinggi daripada gaji kami,"" kata Chou."
4.816710091059498,-0.004726419908848961,2,mk,Гаспром сака да купи 30% од сопственоста на Милан Медиумите од Италија повторно говорат за продажба на акции на Милан и се верува дека Силвио Берлускони е подготвен да му дозволи на Гаспром влез во клубот.
0.0004411759015017554,1.8590890816008807,1,my,"Seorang pemain piano profesional, beliau mendapat pendidikan awal di Sekolah Rendah Chi Hwa dan Sekolah Menengah Tiong Hwa di Sandakan sebelum melanjutkan pengajian di Sekolah St Brandon, Clevedon, United Kingdom."
4.037448416515346,-0.005641546567876494,2,mk,"Една можна мерка за намалување на депресијацијата на домашната валута е зголемувањето на референтната каматна стапка на НБС, рече Дејан Јововиќ, советник на српската Стопанска комора."
0.0005417530711722599,2.0068044706333144,1,my,"Antara tahun 1997 hingga Mac 2002, terdapat sebanyak 1,371 kes sumbang mahram, dengan 907 kes melibatkan mereka yang ada pertalian darah, dan 464 kes melibatkan mereka yang tiada pertalian darah."
0.00018515208081780872,0.6227011225597096,1,my,"Dengan Chelsea bertandang ke United pada 3 April, Ancelotti sedar pasukannya perlu memenangi kesemua baki tujuh perlawanan liga untuk memenangi kejuaraan liga pertama sejak 2006."
0.000503549495380575,2.1235856180586867,1,my,"""Justeru tawaran menjadi duta produk Safi Balqis yang datang ini bertepatan dengan masanya. Jika tiada tawaran iklan saya berhajat untuk mengubah imej kewanitaan bermula tahun depan,"" katanya ketika ditemui di Majlis Perlancaran Duta Terbaru Safi Balqis, di sini, Rabu."
1.8947356576876508,0.008931431602661462,2,mk,"Меѓународната организација за човекови права „Амнести интернешнал“ во средата (14-ти декември) ги повика босанските власти да ги решат долготрајните проблеми со човаковите права, поврзани со конфликтот во периодот 1992-1995 година, кога десетици илјадници луѓе загинаа, а милиони други беа раселени."
0.0004623398157102462,1.727535645069832,1,my,Pemilihan beliau sebagai pengerusi pilihan raya kecil DUN Galas dilihat tidak banyak membantu calon BN sekiranya apa yang dilaungkan selama ini oleh pemimpin UMNO dan BN sudah dipraktikkan.
6.386998445893247e-05,0.18599247727985452,1,my,"Bekau kaban Parti Rakyat Sarawak (PRS), Larry Sng, ti nadai parti diatu tang mengkang nyadi Menteri Muda ba Opis Kepala Menteri,sama bela bisi datai ngulu pengerami nya."
2.5132275954597696,0.02449787962260419,2,mk,"Од нив повеќе од 19.000 босански Срби, вклучувајќи и припадници на армијата, Министерството за одбрана и Министерството за внатрешни работи, се вели дека учествувале во убиствата."
1.9538032111538428,-0.0017746339350970023,2,mk,"Од секторот за внатрешни работи информираа дека биле повикани неколкумина осомничени, но жртвите не можеле да го препознаат напаѓачот, оти критичната ноќ двата инциденти се случиле на темни места."
0.008008989871464941,0.8025656174223681,1,my,"Artis Malaysia iaitu Alif Satar One In A Million, Daniel Lee Malaysian Idol dan Hou Ren Astro Talent Quest 2008 turut menjayakan persembahan pembuka konsert ini."
0.0002833142914175106,1.1461984445789744,1,my,Bahkan AS pun akan menghadapi masalah juga kerana mungkin ramalan Biro Penyiasatan Persekutuan (FBI) bahawa serangan keganasan yang lain akan berlaku ke atasnya menjadi kenyataan.
1.864002344886264,-0.0016192545149427496,2,mk,"Иако земјотресите со толкав интензитет можат да предизвикаат помали оштетувања на објектите, од српскиот сеизмолошки завод се уште немаат податоци за повредени или нанесени материјални штети."
3.025313273347238,-0.0020803613919980137,2,mk,"„Ова е мешавина на заговори и незаконски активности во Брчко, бидејќи најважните функции во градот ги држат членовите на СНСД и СДА, кои работат заедно зад сцената“, рече за SETimes еден жител, барајќи да остане анонимен."
0.005732938257237997,1.3135773169065257,1,my,Novel ini ditulis oleh Allahyarham Ibrahim Omar bekas wartawan dan pengelola di ruangan sastera Mingguan Malaysia serta Utusan Zaman semasa allahyarham berusia 25 tahun.
0.000514964017954897,1.8128606163509875,1,my,"Menurut Lai, tempat dan jadual telah dibincangkan serta memberitahu bahawa pihak media akan turut mengambil bahagian dalam mempromosikan kempen tersebut dalam dwibahasa, iaitu bahasa Inggeris, bahasa Melayu dan Mandarin."
2.5744367135026236,0.0006341851846796787,2,mk,"Но, тројца од другите шест кандидати, имаат шанса да завршат на второ место и да продолжат во вториот круг на 29-ти октомври."
2.017968159576787,-0.0026269328633003416,2,mk,"Како што кризата ескалира, и има повеќе насилни протести, [полицијата] не сака професионални сведоци на нивото на систематско насилство што го користи против демонстрантите, без оглед колку се мирни.“"
0.0004920828623910753,1.637288544488038,1,my,'' Jepun dan Korea Selatan secara automatik layak ke pusingan akhir Piala Dunia 2002 sebagai penganjur bersama dan Velappan mahu Asia mempunyai empat lagi wakil pada kejohanan itu.
4.1398895217217015,-0.005506812920685719,2,mk,"Постои цврст и добро основан емпириски однос помеfу употребата на електрична енергија и севкупната екномска активност; со споредуваое на официјалните бројки со оние предвидени со потрошувачката на електрична енергија, возможно е да се добие барем груба проценка за големината на неофицијалната или неформалната економија."
0.0003282551257183311,1.1449943985580846,1,my,"Menteri Penerangan, Tan Sri Khalil Yaakob berkata misi kumpulan itu akan tetap diteruskan walaupun terdapat ancaman serangan daripada tentera Amerika Syarikat dan sekutunya terhadap pejabat media asing."
0.00823927375233624,1.7250382691087454,1,my,"Beliau berkata demikian semasa berucap pada Majlis Penyampaian Hadiah Pelajar Cemerlang Yayasan Sarawak 2010 Bahagian Sibu, yang berlangsung di Dewan Centenary Mill Hill De La Salle, SMK Sacred Heart di sini, semalam."
1.9990346047897745,0.0028642139376590233,2,mk,"Најмалку шест жртви во невреме во Турција Шест лица загинаа во силното невреме во Турција, од нив четворица настрадале кога врз нив паднало минаре од една џамија, јавија денеска турските медиуми."
0.0003116538740271876,0.9634674899074681,1,my,"Pada majlis berkenaan, Mursyidul Am PAS, Datuk Nik Aziz Nik Mat mengumumkan Timbalan Yang Dipertua PAS Kawasan Gua Musang, Dr Zulkefli Mohamad, 44, sebagai calon PAS bagi pilihan raya kecil DUN Galas."
2.411060432415452,-0.0012515889046876623,2,mk,Стравот од социјалната ерозија е доволна причина пред неполна недела медицинскиот персонал на еден час да ја прекине работата објавувајќи ги решенијата за излез од оваа како што ја нарекоа криза во бело.
0.9147077198389756,0.005067854452085774,2,mk,"За филмот „The Hurt Locker“, Кетрин Бигалоу ја доби наградата за најдобра режија, и таа е прва жена која е наградена со ова признание."
0.0003918122703906545,1.4662793494340824,1,my,"Sementara itu, kapten pasukan bola sepak negara Norhafiz Zamani Misbah berkata beliau serta rakan sepasukannya bersedia menggalas cabaran tersebut dan akan memberikan fokus terbaik dalam perlawanan pertama menentang Kyrgystan."
0.0002240061642241214,0.7408403090708178,1,my,"Pada tahun 1977, kerajaan Sri Lanka pernah tumbang dalam pilihan raya apabila rakyat tidak dapat menahan kemarahan akibat lonjakan harga makanan selepas bekalan kelapa menyusut teruk."
0.0002121127119763041,0.8178488411044111,1,my,"Perdana menteri berkenaan memberitahu, arahan pembebasan Ruby dilakukan bagi mengelak ketegangan diplomatik kerana beliau percaya gadis itu ialah cucu Presiden Mesir ketika itu, Hosni Mubarak."
1.6001106669905771,0.002130875818492532,2,mk,Тој исплатил 117 милиони германски марки во текот на следните шест месеци и 74 милиони германски марки во март 1998 година.
0.0005147399290465745,1.959693702347342,1,my,Reka bentuk luarannya yang maskulin itu diserlahkan lagi dengan ciri Hill Descent Control dan Hill Launch Assit demi memastikannya berupaya mengharung apa jua permukaan jalan yang sukar.
0.0004859708087335639,1.9249660771688215,1,my,"Rancangan mengadakan 'Mata di Langit' itu adalah susulan kerjasama dalam melakukan operasi rondaan terselaras dari udara di Selat Melaka oleh Indonesia, Malaysia, Singapura dan Thailand."
1.81169292098381,-0.0014979169877779306,2,mk,"Тоа првенствено нема да биде случај со малите и средните претпријатија, кои се носители на производството и растот во другите држави“, објасни таа."
2.44231088525698,-0.0015354367823965777,2,mk,"Во февруари 2005 година, осум држави од Централна и Источна Европа започнаа амбициозна десетгодишна иницијатива за подобрување на статусот на Ромите."
6.270120436779559,-0.0063730091633535995,2,mk,"""Моја цел е да воведам и да ја понудам најдобра пракса за командата и улогата на персоналот, со цел да се обучат офицери кои ќе бидат во сосројба целосно и продуктивно да учествуваат во операциите за поддршка на меfународниот мир"", рече бригадниот генерал на Данската армија, Хенинг Броекман-Ларсен, назначен за командант на ПСОТЦ."
