x1,x2,label,lang,texts
2.318795052834025,-0.00272012495662157,2,mk,"Главната обвинителка на Меѓународниот кривичен трибунал за поранешна Југославија (МКТЈ), Карла дел Понте, сака Белрад да екстрадира неколку обвинети -- од кои главен е генералот на босанските Срби, Ратко Младиќ."
1.9509047149279424,-0.0020395077340032686,2,mk,"Оваа балканска земја, со своите етнички и културни врски со Косово, нема намера да има улога во процесот на преговорите, иако е подготвена да помогне."
2.1939870048786534,0.024220361979662278,2,mk,Македонија меѓу топ туристичките дестинации за 2010 Македонија е една од најдобрите топ дестинации во светот за да се посети во 2010 според “Њујорк Тајмс Травел”.
2.2909412121223136,-0.0008120680545293929,2,mk,"Во однос на интеграцијата во Европската Унија, целта за почнување преговори не е поврзана со датум, туку со „што е можно побрзо“ како фраза."
0.00047021100656265754,2.1455440430474115,1,my,"Kita tidak menolak kapitalis kerana kita percaya bahawa modal juga perlu untuk membangunkan negara dan kita juga tidak menolak socialism yang menekankan keadilan bagi masyarakat, tapi tidak bagi keseluruhannya."
4.2548285274288755,0.002824617361682739,2,mk,"„Молдавија надмина серија обесхрабрувачки економски и политички предизвици за да ги одржи овие избори; нивниот успех е важен, не само за Молдавија, туку и за регионот во целина“, рече сенаторот Џон Кери (демократ). „На 28-ти ноември јас се надевам дека народот во Молдавија ќе има избори од највисоки демократски стандарди кои ќе резултираат со влада способна да продолжи со неопходните реформи.“"
0.0006255685423441643,2.2662875084755703,1,my,"Ia diwarnai dengan aksi penuh berahi dalam filem Hollywood dan Bollywood; gosip tentang artis berpacaran; kisah artis kahwin artis dan kemudian bercerai; dan perkembangan sensasi dalam dunia hiburan, seperti kerelaan aktres Joanne Peh berbogel dalam filem mendatang."
0.001684578410618033,0.9913904900740795,1,my,"PENSYARAH bidang psikologi John Tan Liang Joo, yang sepatutnya mula menjalani hukuman penjara 15 hari kerana menghina mahkamah Khamis lalu, akan memulakan hukumannya hari ini."
0.0005958594494562782,2.2487562596066253,1,my,"Beliau mengulas saranan supaya kempen Kami Prihatin yang dilancarkan Utusan Malaysia bersama Kementerian Pembangunan Wanita, Keluarga dan Masyarakat, Karyawan dan Astro diperluaskan ke IPT kerana usaha itu memerlukan sokongan ahli akademik serta semua lapisan masyarakat."
2.029287958483757,0.00038469020769560077,2,mk,"Двете големи вежби во февруари и во март, исто така, ќе помогнат во идентификуваоето на евентуалните пропусти и слаби точки пред Игрите."
2.6137765987864716,0.0011166030920517031,2,mk,"Во околу 99 отсто од случаите, дури и оние во судовите што не се на јужната граница, националноста е променета од албанска во грчка."
2.074513028109807,-0.002236222695203138,2,mk,"На форумот присуствуваа претставници на јавните институции за набавки од Maкедонија, Турција, Албанија, Косово, Црна Гора, Србија, Босна и Херцеговина и Хрватска."
4.315092204230048,0.0025038327593520397,2,mk,"Aлбанија ги зајакнува контактите со дипломати во Брисел, во обид за забрзување на кандидатурата за интеграција на земјата во ЕУ, објави во саботата (25-ти јули) Министерството за надворешни работи."
0.004407158658072979,1.0803186324281258,1,my,"Beliau memberitahu, pembinaan kelas sementara itu membabitkan empat blok bangunan diperbuat daripada fiber komposit yang mempunyai lapan buah bilik kelas, tambahan kepada 12 bilik kelas sekarang."
3.1058000452379413,0.0013544684388145335,2,mk,"Македонскиот Уставен суд на 12-ти април го укина законот со кој им се даваше специјален статус и привилегии на пратениците, донесувајќи одлука дека парламентарниците не треба да се третираат поразлично од другите граѓани, кога станува збор за пензиите, платите и другите бенефиции."
1.4934526862338742,-0.0013771393706658197,2,mk,"Неколку редови понатаму Владата открива дека се плаши дека приходите ќе се намалат до 2015 година, ако збирањето на придонесите продолжи по сегашните правила."
0.0005300635921577803,2.4161624688476,1,my,"“Tetapi apa yang berlaku sekarang adalah partinya kalah beberapa kerusi senat kerana tidak mampu membawa perubahan yang dijanjikan,” katanya sambil menambah tidak mustahil Obama boleh kalah dalam pertandingan kerusi presiden yang akan datang."
0.004470942167324211,0.29374994185224756,1,my,"Osman Bojeng berasal dari Matang, Kuching memfailkan tuntutan tersebut pada 28 Februari 2006 melalui peguamnya Arip Ameran daripada Tetuan Arip, Ahmad Nizab & Associates."
1.5627220837050497,-0.0012013510203985598,2,mk,"Бидејќи Велика Британија е главен учесник во дебатата околу буџетот, можеби една аналогија со спасувањето на руската подморница може да биде инспирација."
0.0004577076370222929,1.7850956543521554,1,my,"Macam dalam filem Cun!, ada Bedah Tonggek dan Eton Gebu. Di dalam Stanza Cinta, ada gadis berperawakan macam lelaki, Auni dan penjaga asrama 'kaki bomoh', Cik Ainon 'Sengal'."
3.0105642814151854,0.021318848101975013,2,mk,"Отако Анкара го изготви својот прв интернет закон во 2007 година, бројот на страниците што се блокирани се зголеми од 433 во годината по забраната, на 6.000 страници денес."
0.0009788903917317966,1.2824261179977043,1,my,Sabtu lalu Zulkifli membuat laporan polis terhadap Khalid kerana didakwa mengeluarkan kenyataan memperlekeh dan menghina agama Islam termasuk mengatakan Enakmen Ugama Islam (Kawalan Perkembangan di Kalangan Orang Islam) Negeri Selangor 1988 sebagai ketinggalan.
0.00011109667582981928,0.45290412150514353,1,my,"""Kami telah menghantar surat bantahan kepada pihak berkuasa, termasuklah Menteri Besar Selangor, Tan Sri Abdul Khalid Ibrahim, namun masih belum ada maklum balas diterima."
0.0005941009485541953,2.30893144160482,1,my,"Apa yang menarik kumpulan doktor itu bukan sahaja menjalankan kajian, penyelidikan serta aktiviti menyelam, malah mengadakan projek komuniti masyarakat dengan menghulurkan bantuan dalam bentuk barangan makanan kepada penduduk yang tinggal di Pulau Mabul."
2.4119007576156366,0.009454118374895461,2,mk,"Како членка на ЕУ, Турција претходно вети дека ќе учествува со бригада во „Главна цел 2010“, воена цел определена со безбедносната и одбранбената стратегија на ЕУ."
0.0011601268005969226,1.352453954424635,1,my,"Chang Keong berkata, dalam serbuan itu, polis merampas 66 keping DVD lucah, 117 DVD cetak rompak, wang tunai RM200, tiga buku rekod jual beli barang dan satu salinan pendaftaran syarikat dengan Suruhanjaya Syarikat Malaysia (SSM)."
3.7127104259411796,-0.005257418091442752,2,mk,"Тој меѓу другото потсетил, дека Македонија има нерешен проблем со Косово околу границата, изразувајќи уверување дека идниот конечниот статус на Косово, нема да биде на штета на територијалниот интегритет на Македонија."
1.5734528099306113,-0.0021146441072180332,2,mk,"„Приштинските власти отсекогаш изразувале подготвеност и решителност за бескомпромисна борба против нарко-шверцот“, рече Млоја, додавајќи дека овие власти можеле да му го кажат тоа и на самиот Иванов."
2.8919577918722186,-0.0027732162367437203,2,mk,"Владата соопшти дека ќе ги објави предложените решенија за сите проблеми поврзани со Олимпијадата по состанокот на Караманлис со претседателот на Меfународниот олимписки комитет, Жак Рож, кој в сабота ќе пристигне во Атина."
4.353774195845337,-0.0033516881643209924,2,mk,"Не стивнуваат сомневањата околу учеството во подготовката на заложиничката драма во руската престолнина, од страна на одредени амеркански гарнитури, по налог на ЦИА, со која се сакало постигнување на некои ефекти."
2.1316062417761565,-0.002904402886377492,2,mk,"Многу е важно да се знае дека Косово ќе има посилна економија ... спроведување на стандардите, почитување на човековите права“, вели Певќели."
1.4425064467173143,0.000891191493150996,2,mk,"Граѓанското движенје „Разбуди се“ ја демантира веста дека нивната организација е дел од денешните протести во Тирана, како што беше навестено во неколку медиуми."
0.00043916579428974085,1.7443837029033762,1,my,Namun kelesuan di peringkat bahagian yang sudah berakhir menyebabkan tumpuan kini kepada pemilihan pada peringkat pusat. Semakin hari semakin menarik perhatian walaupun 'pergolakan' parti politik kini diambil alih oleh rakan MIC dalam komponen Barisan Nasional (BN) iaitu Parti Progresif Penduduk (PPP).
6.793655765485964,-0.006499730013068671,2,mk,"„Оваа иницијатива на локалните власти во Баја Маре е длабоко дискриминаторска и како последица го има понижувањето и гетоизацијата на Ромите, со тоа што ги подвргнува на деградирачки третман“, велат претставниците на Романи крис, Здружението за еднакви шанси и Амнести интернешнал во отворено писмо. „Усвојувањето политики за интеграција на Ромите од страна на романската влада останува само бирократска илузија“, ако ваквите проекти се спроведат, заклучуваат трите невладини организации."
1.670251906652762,-0.0016356803252808934,2,mk,"Меѓународната заедница нема да дозволи да биде загрозен суверенитетот и територијалниот интегритет на Босна и Херцеговина, ниту сега ниту во иднина.“"
0.8760491517581964,-0.0009569722096944361,2,mk,"Минатата недела фирмата ""Вени, види, вици"" повторно почна да го гради ""Езерце"" надвор од дозволените граници, кои ги предвидува договорот кој го имаат склучено со Општина Центар."
2.0021318752064037,-0.0016039429495634879,2,mk,"Во врска со синот Емил и ќерката Марина, Ава не сака да открива детали, бидејќи нејзините деца отсекогаш сакале да излезат од сенката на нивниот популарен татко."
2.4923277216171567,-0.0017563263033909466,2,mk,"Зборуваше за некои тектонски плочи, додека Спилберг ги превртуваше очите и се извинуваше затоа што „неговиот пријател не сака да замолчи“, изјави за списанието „Сан“ актерот кој глуми во филмот на Лукас „Green Hornet“."
3.543684919641929,-0.0020523022459819035,2,mk,"Бугарското Национално претпријатие за електрична енергија (НЕЦ) ќе започне разговори со два кандидата за изградба на втора електроцентрала во земјата -- чешкото претпријатие Шкода и руското Атомекспортстрој -- објави генералниот менаџер на НЕЦ, Љубомир Велков на 18-ти април."
4.043819603948112,0.0003834449404311287,2,mk,"Италијанскиот романсиер и филозоф Умберто Еко -- со својот пријател, писателот Клаудио Магрис -- се појави изминатиот викенд како специјален гостин на литературната работилница за време на 12-тото издание на Истарскиот саем на книгата, во Пула, Хрватска."
3.2643173222451756,-0.0016833601443228914,2,mk,Maкедонскиот премиер Никола Груевски во неделата (7-ми септември) рече дека неговата земја не може да добие датум за почеток на разговорите за пристап во ЕУ додека не биде решен спорот за името со Грција.
3.265495084588187,-0.0018730667771710667,2,mk,Конгресмените побара од Обама Македонија во ноември да добие покана за НАТО Барак Обама да се заложи и да издејствува Македонија да стане членка на НАТО во ноември.
1.2564913467629621,0.0002053123341007346,2,mk,"Во рок од само два месеци третман со лекот кој го придвижува клучниот ензим,кај глувците се појавиле нови клетки кои се речиси сосема подмладени."
4.468384858270208,-0.0015601039434285278,2,mk,"„Властите во Босна и Херцеговина имаат одговорност да создадат најдобри услови за реинтегрирање на раселените лица во нивните заедници од пред војната“, рече Дакворти. „Тоа значи создавање на безбедна средина во која ќе нема етничка дискриминација и во која бегалците ќе можат целосно да ги уживаат своите права."
0.0004726823119511949,1.844711013672416,1,my,"""Saya rasa kami masih memiliki asas pengalaman yang telah berada di sini sejak empat atau lima tahun lalu dan memenangi banyak kejuaraan secara konsistennya,"" kata Ferdinand."
0.00035881128607592337,1.3851042617809095,1,my,"Walaupun dilihat hasrat itu seperti tidak kesampaian, Jamal masih berharap agar ideanya bersama Datuk Sosilawati dapat diteruskan, dan beliau akan menemui anak Datuk Sosilawati untuk berbincang."
1.5964929274632662,-0.002354116040347401,2,mk,"„Успеав да го организирам својот живот некако со мојата пензија, но сега морам да ги прераспределам моите трошоци, решение што многу тешко ќе можам да го најдам“, рече за SETimes пензионерот Хисен Кику."
0.0006846183899309491,2.8616550360877637,1,my,"Sesi dialog yang diadakan di pejabat Persatuan Nelayan Sarawak di Jalan Suarah semalam, antara lain menyentuh mengenai pembayaran insentif dan elaun sara diri nelayan serta penstrukturan semula aktiviti jualan minyak diesel bersubsidi di Sibu dan Sarikei."
0.00039768653729475005,1.6217689778558049,1,my,"Penjual tiket bas Ekspres Plus Liner Sdn Bhd, yang hanya mahu di kenali sebagai Siti pula berkata orang ramai tidak perlu risau kerana walaupun tiket telah habis dijual, biasanya bas tambahan akan disediakan."
0.0002524504503081558,0.8868310897230625,1,my,"Bagi saya, memanglah senggugut satu kebiasaan pada wanita tetapi sekiranya senggugut mengganggu persekolahan dan pembelajaran atau pekerjaan seseorang perempuan, maka ia satu masalah perubatan."
0.0005415010317645608,2.1133337683829683,1,my,"Ketika itu, orang ramai yang berada di luar bangunan hospital terpaksa melarikan diri ke dalam bangunan berlindung daripada serpihan bahan letupan yang berterbangan ketika kawasan sekitarnya diserang."
0.0007452620406840705,2.774825711975787,1,my,"Jadi, mereka kena cetuskan sesuatu dan berharap akan berlaku sesuatu supaya boleh menuduh kerajaan zalim kepada rakyat, katanya pada sidang akhbar selepas merasmikan Festival Gasing dan Tamu Besar Sipitang 2011 dan Esplanad Sipitang di sini, hari ini."
0.0005316250060763313,2.120888435018559,1,my,"Beliau yang juga ahli Majlis Tertinggi menambah, perjuangan UMNO untuk memberi kemakmuran dan kesejahteraan kepada rakyat amat dituntut oleh agama kerana tanpa pembangunan, umat Islam tidak akan dapat menjalankan ibadat dengan sempurna."
0.0005433448425305392,1.9242831847465407,1,my,Sebenarnya ini adalah kali pertama dalam sejarah orang Melayu sejak sebelum kesultanan Melayu Melaka yang orang Melayu sedar akan Kemelayuan mereka dan bersatu sebagai orang Melayu.
0.0004175409296959217,1.73171374417107,1,my,"Bukan sekadar mengatasi sasaran, malah pasukan itu juga berjaya menamatkan penantian yang lama untuk menjuarai acara perseorangan dan berpasukan lelaki serta memperoleh pingat perak untuk acara beregu wanita."
2.087861371715338,-0.00046547342493238485,2,mk,"Министерот за финансии, Бедри Хамза, вели дека Косово главно не е под влијание на фискалните турбуленции во еврозоната поради неговата ограничена интеграција во глобалните пазари. [Лаура Хасани/SETimes]"
2.6609284897710204,-0.00177681176518388,2,mk,"Истата беше предизвикана во времето кога Милошевиќ беше на власт во Белград и пред сé, таму има паралелни безбедносни структури и други служби кои имаат намера да спроведуваат еден вид контрола на северот."
5.6228510483920235,-0.005447210480877883,2,mk,"Експлозијата на Бит пазар се случи само неколку часа по состанокот на Националниот совет за безбедност на Македонија, на кој се разговараше за ситуацијата во селото Кондово, каде што полицијата не патролира веќе неколку месеци поради заканите на силно вооружената криминална група предводена од Агим Красниќи."
2.158356847468875,0.00947478042967368,2,mk,Од натпреварувачки аспект организаторите успеаја да донесат натпреварувачи од седум земји и тоа во една завидна бројка од 60 натпреварувачи што претставува одличен успех имајќи ја предвид целокупната ситуација во нашата земја во изминативе години.
1.116289319874026,-0.000160709994621441,2,mk,"Обвинението и одлуката за казна [во Нирнберг] не запираа само со оние обвинети и изведени пред суд, туку ги обвини и ги нарече криминалци НСДП, СС и Гестапо."
0.0005955686879726263,2.31141558474601,1,my,Program RTW menumpukan pemulihan fizikal dan vokasional menerusi konsep pengurusan kes yang disediakan Perkeso secara percuma untuk pekerja yang mencarum sekali gus membolehkan mereka kembali semula bekerja secara selamat dan secepat mungkin.
3.986477618466193,-0.0013078038090336471,2,mk,"Се очекува најголемата нафтена рафинерија во Грција ""Хеленик петролеум"" да ги заврши преговорите со австриската ""Ватек хидро"" за изградба на 390-мегаватна електрана во Солун, се вели во објавата на фирмата од 9 април."
3.8076882331433692,-0.005020431362510318,2,mk,"Наводно, групата планирала да ја нападне Американската амбасада и други странски згради, како одмазда за убиството на 2-ри мај на водачот на Ал каеда, Осама бин Ладен, од страна на американските сили."
0.002286993418023558,2.2002615491480486,1,my,Persatuan Pengguna Islam Malaysia (PPIM) yang turut menyambut baik ganjaran tersebut berkata potongan 50 peratus bayaran lesen penjaja dan peniaga kecil akan membuka peluang lebih besar dalam mereka mengukuhkan perniagaan di ibu kota ketika ekonomi semakin mencabar sekarang.
4.137415062446777,-0.0019728462981690236,2,mk,"Договорот е прв чекор напред кон спроведувањето на договорот за купување осум автобуси во вредност од 580 милиони американски долари од Ербас, потпишан во 1998 година за време на режимот на Слободан Милошевиќ."
0.005669530740874937,1.044225360341234,1,my,"Malangnya, kata beliau, meskipun perintah injunksi itu telah dikeluarkan sejak 25 Mei lalu, namun sub kontraktor terbabit tetap berdegil malah keadaan menjadi lebih teruk apabila bekalan air ke kawasan itu sengaja dipotong Ramadan lalu."
0.000691325323809434,2.762384871277444,1,my,"Ucapan ditujukan khas buat keluarga tercinta di Setapak, KL dan Bagan Datoh, Perak, warga pendidik di MRSM Kuantan, SM Sains Selangor dan Intec UiTM, rakan rakan seperjuangan dan kenalan di Malaysia."
0.00029348266901579027,1.2558177954977052,1,my,Teori Saddam berada di Moscow itu hanya salah satu daripada banyak spekulasi tetapi ia diperkuat dengan laporan sebuah akhbar Rusia bahawa arkib rahsia Saddam juga telah dibawa ke Moscow.
0.0005639935716906611,2.2554350526076834,1,my,"Sementara itu sumber perisikan Britain yang mempercayai bahawa Saddam terselamat berkata, Saddam mungkin meninggalkan bangunan terbabit dengan menggunakan jalan yang sama semasa beliau tiba di situ pada Isnin lalu."
0.00020198458574484162,0.7186072702427072,1,my,"Hadir sama Pengarah MITI Sabariah Mohd Sofian, Ketua Pusat Sokongan Halal Global HDC Rohaizad Hassan, Pengarah Unit Pembangunan Usahawan Jabatan Ketua Menteri Sutin Sahmat, Ketua Hakim Syarie Muhammad Ali Sheriff dan Ketua Pegawai Esekutif (HDC) Datuk Seri Jamil Bidin."
2.7362144657000447,-0.002354524292980217,2,mk,"„Убеден сум дека бугарскиот претседател Георги Парванов и грчкиот премиер Костас Караманлис ќе се согласат со мене дека треба да го споделиме искуството на нашите земји со цел да ги забрзаме процесите во земјите од Западен Балкан“, бугарската агенција „Фокус“ го цитираше Башеску."
