x1,x2,label,lang,texts
2.7479265930233936,-0.0014864227441459589,2,mk,"Вака премиерот Бучковски го објаснува отворањето на досието Тиквеш, во кое неговиот советник Јаневски е посочен дека учествувал во криминални зделки и фалсификати за купување на винарската визба."
0.0005939605402949029,2.49842271141558,1,my,"Menyedari motosikal itu tidak berada di depan rumah, abang pemiliknya terus memberitahu ahli keluarga yang lain mengenainya dan bergegas menghubungi rakanrakannya yang lain untuk keluar mencari motosikal tersebut."
5.793019469179372,-0.0029359845720560813,2,mk,"„Регионалната политика е еден од клучните предуслови за приклучување на Балканот кон ЕУ“, рече претседателот Бранко Црвенковски на самитот одржан во Мамаја, Романија, минатата година. „Македонија секогаш била свесна за интересот, било да потпишува договори за слободна трговија со соседите и да создава услови за уште послободна трговија со стока и услуги, или во т.н Јадранска повелба каде ги одредивме заедничките регионални приоритети за членство во НАТО заедно со Албанија и Хрватска“."
1.5821978359576985,-0.002014232069101459,2,mk,"Тој додаде дека Македонија е подготвена за фер решение, кое сепак на ниту еден начин нема да го поткопува македонскиот нацонален и културен идедентиет."
3.164376198983041,0.00038044374730146794,2,mk,"„Нема преговори со Ратко Младиќ“, Љајиќ, кој, исто така, го води и советот на Србија и Црна Гора за соработка со МКТЈ, рече во интервјуто за понеделничното (25-ти јули) издание на белградскиот весник Блиц. „Државата не знае каде е тој“, додаде Љајиќ."
2.1066802266902647,-0.0012362031724901447,2,mk,"„Според доказите до кои е дојдено досега, осомничените биле вклучени долго време во шверц со различни видови акцизна стока, претежно цигари, правејќи проневера кон БиХ и нејзиниот буџет за милионски суми“, рече за SETimes портпаролот на обвинителството, Борис Грубешиќ."
4.189902519897893,-0.003992310488062321,2,mk,"Апарат го мери квалитетот на воздух во Скопје Скопјани ќе можат да го следат квалитетот на амбиенталниот воздух во градот, на новиот дисплеј поставен на улица „Македонија“."
0.00023520740671822895,1.165621377901512,1,my,"“Untuk lembangan Sarawak, kita sudah membentuk sebuah jawatankuasa yang diterajui oleh saya bersama Datuk Amar Abang Johari Tun Abang Openg…saya berharap dapat mengadakan mesyuarat secepat mungkin berkaitan pelaksanaan pembangunan tersebut,” katanya."
1.5808297989025863,-0.0008199818188110006,2,mk,"Грчката влада генерално ги почитува човековите права на своите граѓани, објави американскиот Стејт департмент во својот годишен извештај за човековите права."
1.9612627100022442,-0.0009018016653798311,2,mk,"Опозицијата, зад која стои поранешниот Премиер Таксин Шинаватра, тврди дека Веџаџива, кој е роден во Велика Британија, е избран за Премиер на незаконски начин со поддршка од армијата."
0.0004605802991361829,1.9304103890774755,1,my,Jadi saya minta nazir masjid dan jawatankuasa surau seluruh negeri itu supaya melaksanakan titah Sultan Selangor yang melarang keras supaya institusi Islam itu tidak dijadikan sebagai medan untuk berpolitik.
0.0006781765681733112,0.8255091785671758,1,my,"Tahun ini, saluran HISTORY (AETN All Asia Networks) di Astro 555 akan menyiarkan sebuah dokumentari istimewa selama sejam berjudul ‘In Memory of The Highland Towers Disaster’."
2.6384251089637165,0.00014724789252282063,2,mk,"Досега Смилевски открил и публикувал стотина македонските еротски песни за кој вели дека на Бадник се пееле во Велес, Кавадарци, Охрид, Струга како и во Костур, во Егејска Македонија."
0.0030750510053859643,1.4640514349123015,1,my,"Kedua, Ahmad telah mencatat pergerakan purata 200 hari pasaran saham dan mendapati sejak April 2009, pasaran telah mula naik dan akan kekal naik selama lima tahun."
0.000575451248645019,1.715092865566447,1,my,"'Beliau memang ada melabur dalam emas... itu pelaburan jangka panjangnya. Ia tiada kaitan langsung dengan kes ini. Cerita Wati bawa jongkong emas, wang tunai RM4 juta ketika hilang di Banting, itu semua cerita karut."
0.0004090397782489178,1.4975691413482004,1,my,"“Saya terpaksa menerima rawatan di kem pembalakan Kumpulan Samling pada hari kejadian sebelum dihantar ke Miri untuk menerima rawatan susulan kerana cuaca buruk dan angin kencang,” katanya."
1.0162120248771311,0.004336162744272783,2,mk,"Докторката Красимира Димитрова од градот Русе, психијатар по професија, родила девојчиња, Мери и Жаклин, тешки 500 и 900 грама во болница во градот Плевен."
0.0011027568414348917,0.7388414354125048,1,my,"Menurutnya lagi, sokongan moral ibu bapa turut memainkan peranan penting dalam memastikan matlamat 40 peratus daripada setiap kohort pelajar Melayu/Islam melanjutkan pelajaran ke institusi pengajian tinggi dalam masa sedekad, dapat dicapai."
0.0006399085012779422,2.4290966791337842,1,my,Korea Utara sebelum ini telah menghentikan dialog dengan Korea Selatan dan mengancam akan melenyapkan negara jiran itu sehingga menjadi abu ekoran dasar Encik Lee yang menghentikan bantuan kemanusiaan tanpa syarat kepada negara komunis itu.
0.0006809435081656947,2.794374114976587,1,my,Tujuan persidangan ini diadakan adalah untuk merealisasikan road map yang digubal oleh Washington dan konconya.Road map yang mempunyai 3 peringkat ini bermatlamatkan untuk mewujudkan negara Palestin yang merdeka.
3.60059111355959,-0.002188520666791596,2,mk,"Во друг инцидент во близина на железничката станица Ѓорче Петров биле поставени камења на пругата по која сообраќал воз, но за среќа препреката била на време забележана од машиновозачот."
2.8398281682373607,-0.0015639265924413182,2,mk,"Во ситуација кога власта ги исполнува условите на опозицијата еден по еден и постојано ги повикува нивните пратеници да се вратат во Собранието, не може да биде одговорна за евентуален бојкот."
0.007460985893710749,0.9336064352762351,1,my,"Pengerusi PTPTN, Datuk Ismail Mohamed Said sebelum ini dilaporkan berkata, hampir 600,000 peminjam tidak layak menukar skim konvensional kepada ujrah kerana terlibat dengan tindakan saman, melanggar perjanjian terdahulu atau sudah menyelesaikan keseluruhan pinjaman."
0.00036830429123289535,1.4211065623375325,1,my,"Catat 42 rekod baru, 1 rekod Asia SUKAN SEA XXI yang berakhir semalam bukan sahaja menyaksikan Malaysia muncul juara keseluruhan buat pertama kali sejak 1959 tetapi turut mencatatkan 42 rekod baru dan satu rekod Asia."
0.00027436971640716704,1.0025056402979113,1,my,"Timbalan Pengerusi Parti Rakyat Bersatu Sarawak (SUPP) Cawangan Bintulu, Johnny Phang berkata, semua anggota parti komponen BN perlu mengadakan perbincangan dan hadir dengan semangat setiakawan sekiranya ingin memastikan BN terus kukuh."
0.002786515850923308,2.185143830429346,1,my,"Kawasan pameran seluas 1,500 meter persegi itu juga akan mengetengahkan kisah pahlawan legenda yang hasil daya inovasi, kepakaran teknologi dan kreativiti budayanya memberikan beliau reputasi sebagai salah seorang pemimpin agung dunia yang paling disalah tanggap."
2.846591439168639,-0.002537359001760037,2,mk,"Археолошките власти во Грција й дадоа на актерката номинирана за Оскар и драматург, Ниа Вардалос, дозвола да ги снима сцените за нејзиниот нов филм на Акрополот."
2.6430487468231894,-0.0023476004287699723,2,mk,Политичарите во српската Влада велат дека третманот што го добил Лазаревиќ -- што им е ветен и на тројцата други пензионирани генерали кои ги бара Хашкиот трибунал -- претставува најефикасен начин за обезбедување на нивно предавање.
0.0004332323477786139,1.811994389991449,1,my,"Ini kerana katanya, polisi membuli yang melampaui batasan kedaulatan negara oleh kuasa besar telah dialami sendiri oleh Vanuatu hingga menyebabkan sistem percukaian dan politik republik itu terjejas."
3.478427718812739,-0.00271666511693041,2,mk,Исто така се наведува и дека Тачи не се плаши од гласањето за новиот состав на владата туку од гласањето за предложените кандидати за претседател на Косово.
4.295798163972591,-0.003101407882176458,2,mk,"Зекири се сомнева во капацитетот на Реџепи да ги обедини спротивставените струји, поради делувањето на неговите претходни позиции за време на деведесеттите, кога не беше познат како миротворец, туку како еден од оние што е вмешан во конфликти."
2.503428748276651,1.2391411702676556e-05,2,mk,"Благодарение на двојниот полициски систем во земјата, криминалците во Босна и Херцеговина честопати можат да избегнат апсење само со преминување од еден ентитет во друг."
1.9843755106605052,-0.003043603584486519,2,mk,Оваа НВО смета дека најниското ниво на независност кое комисијата би требало да го обезбеди и под кое не треба да се оди е таа да функционира како собраниско тело.
0.001402009170729664,1.6093925001914449,1,my,Dengan kejadian 11 September itu AS menuding jari kepada Osama bin Laden bagi menghalalkan tindakannya menyerang bumi Afghanistan yang kononnya untuk memerdekakan negara itu daripada kerajaan Taliban.
0.008492513069016714,2.20296706373215,1,my,"Bagi Fizo, tahun 2010 dan 2011 merupakan tahun paling sibuk sepanjang penglibatannya sebagai anak seni. Ini kerana buat pertama kalinya, dia terlibat dengan pementasan teater berjudul Siti Di Alam Fantasi yang turut memenuhi jadual hariannya."
2.3462196669312023,-0.00044203661378596664,2,mk,"Доколку Лабус остане сам, веројатно ќе биде ставен на страна во неговата партија, во која поголеми овластувања ќе добие министерот за финансии од Г17, Млаѓан Динкиќ, кој е поблизок до Коштуница."
3.4539563119530223,-0.002464556433853841,2,mk,Али Ахмети мора по секоја цена да влезе во новата македонска власт за да се оправда улогата на т.н. меѓународна заедница и за да не може утре никој да и најде раска во матеницата.
0.00035259151767030124,1.3181361112856516,1,my,"Noraseela Khalid terus menjadi harapan mengekalkan emas acara 400 m lari berpagar wanita yang dimenangi di Brunei dua tahun lalu, selain Malek Tobias dalam acara dekatlon."
1.6360804151177952,-0.0009901859147977059,2,mk,"Се разбира, има уште многу што мора да се направи, но не изгледа дека има сериозни дилеми во Црна Гора каква држава сакаат граѓаните да биде таа."
2.1206413353506415,-0.0010868190099917892,2,mk,"Македонија доби официјален кандидатски статус во ЕУ минатата година, но сé уште нема добиено датум за почеток на разговорите за пристап со Брисел."
1.2885343452186317,-0.00013730793681647417,2,mk,"Следниот пат ако бидат нападнати американски интереси, од некоја адреса од Јемен, САД можеби ќе мораат сами да делуваат, вели Кристофер Боусек, експерт од фондацијата Карнеги за меѓународен мир."
0.0005266189328666001,2.2048488267545916,1,my,Kita telah rangkumkan semua nama ini untuk dikesan dan alasan utama ialah kegiatan mereka selama ini tidak terbatas sama ada di Malaysia mahupun di Indonesia.
0.0003644384771311675,1.3072143520654922,1,my,"Bagi mendayakan kembali pelaburan swasta, Najib berkata Yayasan Amanah Hartanah Bumiputera akan memberi peluang kepada pemilikan Bumiputera dalam sektor hartanah komersil utama di bandar utama dalam negara."
2.5844227557627883,0.0035610872372277653,2,mk,"По отцепувањето на Словенија и Хрватска од Федерална Република Југославија (ФРЈ) во 1990-та и 1991-та година, Босна и Херцеговина (БиХ) одржа референдум за независност на 29-ти февруари и 1-ви март 1992-та година."
0.006002022734022828,0.9718229988578243,1,my,"Gomez, 18, pula memakai gaun panjang merah rekaan D&G bagi menampakkan mereka kelihatan sedondon dengan koordinasi merah tersebut selain menyarung kasut tumit tinggi Brian Atwood, tas tangan kecil Judith Leiber dan barang kemas dari Lorraine Schwartz."
4.353981413589442,-0.0007244258026641421,2,mk,Алијансата истакна дека сега БиХ мора да го имплементира Законот за одбрана за да биде поканета да се приклучи кон Програмата за партнерство за мир (ПфП) на самитот кој ќе се одржи во Истанбул во јуни 2004-та година.
4.314465912528833,-0.004082584337596615,2,mk,"За време на итната владина седница, заменик премиерот Намик Докле повика на итни мерки за помош на погодените од невремето и повторно вклучување на струјата во областите каде што беше прекината."
3.3186216664689905,-0.003570073135509571,2,mk,"Макис Фокас, директор на Службата за подготовка на храна, вели дека од голема корист за Грција ќе биде тоа што влијателните лица -- спортистите, тренерите, новинарите, дипломатите, високите гости и Олимпиското семејство -- ќе можат да се запознат со грчките производи преку оброците."
0.0005444003666825541,2.0482129414225465,1,my,"Tanpa pegangan agama kukuh, kita mudah terpedaya dan diperguna, malah secara langsung akan memudaratkan kita terjerumus ke dalam pelbagai gejala negatif yang bakal memudaratkan diri dan perkhidmatan khasnya."
0.011812058581831939,2.0619483345136884,1,my,"Seramai 150 ahli Puteri UMNO dan Kelab UMNO Luar Negara akan berhenti di 10 perhentian di sepanjang Lebuh Raya Utara Selatan dari Kuala Lumpur ke Melaka bagi mengedarkan 20,000 poster Sharlinie kepada orang ramai."
1.9194214325344185,0.0029588976706309143,2,mk,"Поради големината на претставата -- хор од 100 члена, 15 солисти и 35 танчери од Албанија и од странство -- настанот е еден од најголемите во Албанија годинава."
0.001559135210655576,2.6959223167240722,1,my,"Suami Rashidah, Sahrom Saji, 40, yang tidur di tingkat atas rumah itu turun untuk memeriksa bunyi bising di tingkat bawah tetapi naik semula ke atas bila seorang daripada perompak itu nampak beliau dan mengejarnya."
3.5235213213063754,-0.00414519673854563,2,mk,"Покрај тоа, неодамнешната контроверзност во врска со увозот на рускиот гас ја нагласи важноста на зголемувањето на енергетската независност на Европа.“"
0.00033450812206183917,1.1892415458016086,1,my,"Beliau turut mencadangkan supaya pihak berkenaan mencari jalan terbaik bagi menyediakan kemudahan tempat berehat, bekalan air dan elektrik serta jalan masuk lebih tersusun ke kawasan tanah perkuburan berkenaan supaya ia dapat digunakan secepat mungkin."
0.0014896377759414283,2.1684436764846744,1,my,Kementerian itu berkata langkah liberalisasi yang telah diumumkan pada bulan April 2009 dijangka menggiatkan usaha penggabungan dan meningkatkan lagi usaha sama strategik antara syarikat insurans tempatan dan asing.
0.0006329411838601383,2.2295737128784627,1,my,"Selepas bertukar tangan dan ditinggalkan selama beberapa tahun (tiada rekod sah mengenainya), Rumah Suffolk diambil alih oleh gereja mazhab Methodist yang menggunakannya sebagai sekolah lelaki Methodist. Pada awal 1970, keusangan teruk pada rumah tersebut menyebabkan pelajar lelaki sekolah itu terpaksa mencari bangunan alternatif, manakala rumah tersebut dipulangkan kepada kerajaan negeri."
0.00021527701968649738,0.9047234229725133,1,my,"“Kami sepatutnya mengutip tiga mata (ketika menentang Birmingham) untuk membantu diri sendiri, tetapi sebaliknya kami akan melihat kepada perlawanan seterusnya sekarang,” tambah pemain pertahanan tengah England itu."
0.00020831030350497768,0.8441216598130598,1,my,"Beri kepercayaan kepada Datin Linda Tsen Thau Lin meneruskan tugas membela rakyat,” katanya pada majlis Mesra Rakyat Bersama Penduduk Kampung Tronglit di Pulau Timbang, dekat sini semalam."
0.0003580928314796982,1.349327397290262,1,my,"“Kami mengambil perhatian serius perkara ini kerana kami perlu bertindak cepat bagi menangani sebarang bentuk kebakaran yang berlaku antaranya sampai ke tempat kejadian dengan cepat melalui pemantauan Petunjuk Prestasi Utama (KPI) apabila talian kecemasan dihubungi,” katanya kelmarin."
0.0003711447257907474,1.412388946993279,1,my,Ini sudah pasti akan dijadikan alasan yang lebih kukuh kepada kumpulan terbabit untuk mengambil tindak balas sama ada secara sah mahupun dengan cara kekerasan.
0.0005654055466741255,1.8618573534560154,1,my,"Petugas Pusat Kawalan PLUS trafik berkata, jumlah kenderaan di lebuh raya itu juga bertambah dari Kawasan Rehat Seremban menuju ke Nilai, dari Kawasan Rehat Sungai Perak menuju ke Terowong Menora dan sesak dari Bidor ke Slim River, Perak."
0.0004130350851897255,1.5399548859029153,1,my,"Pengurus pasukan wushu Sarawak, William Kong berkata pihak Persekutuan Wushu dan Tarian Naga Sarawak (WFS) ternyata amat berbangga dengan anugerah yang diterima Ling sebagai penyuntik semangat kepada para atletnya."
0.00024223201843381198,0.8747637625245376,1,my,"""Banyak bekas pelumba dan pelumba Formula 1 sekarang memulakan kerjaya mereka dengan memandu go kart, termasuk juara dunia tujuh kali Micheal Schumacher, Ayrton Senna, Alain Prost, Fernando Alonso,"" katanya."
0.002344113100553778,1.6250286507367309,1,my,"Abang Johari menarik perhatian, untuk fasa pertama sebanyak 150 rumah RMM telah siap dibina di sini dan setakat ini seramai 300 orang (penduduk) telah memohon untuk mendapatkannya."
0.0003177239605942641,1.202920890828024,1,my,"Parreira, jurulatih yang membawa Brazil menjuarai Piala Dunia 94 hanya menyuruh anak buahnya menjalani latihan pemanas badan dan gembira mereka bebas dari sebarang kecederaan."
2.1222933675609115,-0.0027150893698090818,2,mk,Останува да чекаат од надлежните служби да ги информираат кога ќе биде дефектот саниран и ќе биде безбедно да се вратат на своите работни места.
2.156660702181793,-0.002277659210328694,2,mk,Високиот претставник на Европската унија за заедничка надворешна и безбедносна политика Хавиер Солана за денешните преговори за Косово истакна дека мора да бидат конструктивни и флексибилни.
2.5940005253870213,-0.002243329646656571,2,mk,Тој посочи дека во време на криза е добро да се прават помали трошоци и да се штеди и оти не е добро да се зголемуваат даноците.
0.00042909304120521564,1.4751617875804632,1,my,"Selain berpeluang mendengar ceramah dan bertemu arkitek ternama Jepun, Tadao Ando; Paul Andreu (Perancis) serta Chua Ka Seng dari Singapura, hasil reka bentuk pelajar terbabit akan dipamer dan dipertandingkan untuk meraih Anugerah Pelajar APSDA."
2.603216224480897,-0.0017412021905092389,2,mk,"Првиот тренер на Кире, кога првпат во Загреб ја почна интернационалната кариера, Лино Червар, а сега е кормилар на Металург, сакаше да го види најдобриот светски десен бек во Автокоманда."
0.0014620194423294603,1.6637168462718064,1,my,"Seorang lagi pengusaha bendang garam Abdul Kadir Nik, 60, berkata, garam dari air laut dipercayai boleh menjadi penawar terutama untuk penyakit kulit. Beliau yang merupakan generasi kedua pengusaha bendang garam itu juga yakin perusahaan itu mampu bertahan."
2.790849111202676,-0.0027793089125364386,2,mk,"Во листата на обвинети се вклучени лидерот на Српската радикална партија Воислав Шешеs, високи официјални лица и голем број членови на српското подземје."
0.014638953167489727,0.4188272212671461,1,my,"Bagi kayu bergergaji sebanyak 72,029 meter padu dieksport untuk tahun 2010 berbanding 104,166 meter padu (2009) manakala papan lapis pula 226,200 meter padu berbanding 375,214 meter padu (2009)."
2.394742035437916,0.0020152252983818963,2,mk,"Тој потврди дека подготовките се веќе подолго време во тек, потсетувајќи дека повеќе членови од британското кралско семејство престојувале во Даблин, но дека кралицата која често доаѓа во Северна Ирска никогаш не биле во Ирска."
0.0004542490181902158,1.361422572473493,1,my,"Ekonomi Singapura dijangka tumbuh sebanyak 3 peratus tahun ini dan di bawah kadar potensinya sebanyak 4 hingga 6 peratus tahun depan, menurut Penguasa Kewangan Singapura (MAS) semalam."
2.1035355674639993,-0.0014751488655409344,2,mk,"При тоа, Коњановски нагласил дека Македонија е партнер на кој може да му се верува, и оти е голем придонесувач за мирот во Авганистан."
0.0003555271378364315,1.3075179448389784,1,my,"""Fasiliti kelab sangat bagus dan para pemain lain juga cukup mesra. Cuma corak latihan berbeza sedikit dan pasukan ini banyak bermain one touch football."
1.9123445818191929,-0.0002172652710957487,2,mk,"Грчкиот министер за образование, Еврипидис Стилианидис, во петокот (1-ви февруари) ја отвори првата изложба на детски и тинејџерски книги во Атина."
0.00243251638535102,1.3339792324551394,1,my,"Annuar percaya melalui pendekatan bersepadu yang dilakukan itu, isu sokongan masyarakat Melayu akan dapat diselesaikan dalam masa dua tahun sebelum menghadapi pilihan raya 2004."
