x1,x2,label,lang,texts
0.007813529270631211,1.1807028426091524,1,sk,"""Vítame preto záväzky členských krajín G20 na podporenie dopytu a vyrovnanie rastu, posilnenie našich verejných financií a posilnenie a stransparentnenie našich finančných systémov,"" uvádza sa ďalej."
0.010493214457663592,1.0129925772271804,1,sk,"Aj preto hráči ako Steven Gerrard či Wayne Rooney, od ktorých sme všetci určite čakali oveľa viac, sa nedokázali presadiť ani v zápase s Alžírskom či USA."
1.3139988103873252,-0.0036880057192003783,2,my,"Dali yakin lebih 2,000 pengundi Orang Asli akan setia bersama BN berikutan pengaruh Anggota Parlimen Gua Musang Tengku Razaleigh Hamzah yang dilantik sebagai Pengarah Jentera BN bagi pilihan raya kecil itu."
1.1472208710698455,-0.009576621159360156,2,my,"Selain berpeluang mendengar ceramah dan bertemu arkitek ternama Jepun, Tadao Ando; Paul Andreu (Perancis) serta Chua Ka Seng dari Singapura, hasil reka bentuk pelajar terbabit akan dipamer dan dipertandingkan untuk meraih Anugerah Pelajar APSDA."
2.7152116156945416,-0.02232917171561177,2,my,"Kawan penulis dari Denmark, Bent Rasmussen yang dari tadi berdiam diri mencelah. Emosi yang ditunjukkan secara luaran oleh manusia banyak bergantung di mana mereka tinggal. Di Denmark, dalam setahun, mungkin hanya sekali saya melihat orang melepaskan kemarahan secara terbuka."
0.6408837661234722,-0.005742494578674552,2,my,"Katanya, meskipun ia merupakan satu cabaran besar namun kerajaan Barisan Nasional (BN) sudah berjaya satu demi satu menyesuaikan prinsip tersebut dalam pentadbiran kerajaan tanpa mengenepikan kepentingan manamana pihak."
0.021208849514398446,2.2741087853267046,1,sk,"Irina a Stas sa tak mohli ocitnúť medzi záujemcami, ktorí si nejaké obligácie už kúpili a na kúpu bytu im chýbajú ďalšie, na ktoré už nasporili peniaze, ale mesto pozastavilo ich predaj."
0.00296603176109017,0.4056999578729455,1,sk,"Jeho premožiteľ Španiel Nadal patrí spolu s Nalbandianom a Caňasom do elitnej trojčlennej skupiny mušketierov, ktorí s ním za posledné štyri roky dokázali vyhrať viac než len jednu bitku."
0.006109249904671092,0.3944303481779466,1,sk,"Ruský veľvyslanec v Indii Alexander Kadakin zdôraznil, že Moskva si vysoko cení Adámkovej dlhodobú činnosť v oblasti ochrany neoceniteľného intelektuálneho a umeleckého dedičstva jedinečnej ruskej rodiny Roerichovcov."
2.138164109647415,-0.018879501896234177,2,my,"“Kita kemungkinan akan bertanding pada Sukma seterusnya, iaitu dua tahun dari sekarang dan kita akan mengenal pasti ahli bina badan yang berpotensi dan mampu meraih pingat,” kata Presiden PBBS, Dato Wee Hong Seng semalam."
0.0161296337092345,2.429452039834355,1,sk,Na severe Taiwanu sa v roku 1978 začalo s výstavbou malého dovolenkového mestečka pre bohatých. Po viacerých vážnych nehodách boli práce zastavené ešte pred dokončením. Svoju rolu zohral aj nedostatok financií a malý záujem o bývanie na tomto unikátnom mieste.
1.8128443187993464,-0.009715987963720777,2,my,"Menurut Cho Har, dengan laluan baru ini juga akan memudahkan pelancong untuk berkunjung ke Batu Caves memandangkan di situ terletaknya tempat ibadat penganut agama Hindu yang terkenal."
0.9493467730041021,-0.007507682402645159,2,my,"Sejak kali pertama menerima penilaian keselamatan itu pada Ogos 1997, Sheikh Leghaei mengemukakan kesnya kepada beberapa badan termasuk Tribunal Semakan Imigresen, Mahkamah Tinggi dan Mahkamah Persekutuan."
0.0010702517062486344,0.1393889007936146,1,sk,"Spomínané štyri kľúčové kauzy vďaka systematickým aktivitám členov občianskeho združenia Za krajšiu Žilinu znamenali koniec éry arogantného štýlu vládnutia, ktorá dostala výstižný prívlastok „slotalita“."
0.0481248057929154,6.8658154109497325,1,sk,"V záujme ochrany kapitalizmu pred oligarchiou. Marketingoví stratégovia firmy sa tvária, že sú štandardným kapitálovým investorom, ktorý zveľaďuje súkromný biznis. No biznis Penty na Slovensku už dlho je o hľadaní ciest k politikom. To umožňuje nielen vstupovať do regulovaného biznisu, ale najmä spolupodieľať sa na regulácii. Až tá totiž skutočne zhodnocuje tento typ biznisu. Neplatí pritom, že to, čo je dobré pre investora, musí byť dobré aj pre štát a jeho obyvateľov. Preto keď sa politici tvária, že si Pentu nevšimli, je to vždy podozrivé a môže to byť nebezpečné."
0.004136342509556681,0.6239156531021557,1,sk,"Zákaz, ktorý navrhujeme, by dal spotrebiteľom istotu, že nechtiac nekupujú produkty obsahujúce kožušinu mačiek alebo psov,"" odôvodnil návrh komisie komisár pre zdravie a ochranu spotrebiteľa Markos Kyprianu."
0.006732079254937221,1.0177746434085553,1,sk,"Nechce byť len pre generáciu divákov, ktorá tie socialistické časy žila, ale aj pre mladých, pretože vypovedá o dospievaní, ktoré je v každej dobe podobé."
0.013210767241617292,0.613692570572733,1,sk,"Dieter Becker zo spoločnosti Globale Head of Automotive pri KPMG odhaduje, že časom zo 40 až 45 miliónov automobilov možno bude elektromobilov okolo milióna, teda menej ako 2,5 %."
1.7802379039518434,-0.009376788435181097,2,my,"“Menyedari keperluan rakyat dan industri yang semakin meningkat, KLBW meluluskan peruntukan sebanyak RM472 juta bagi membina 31 loji air baharu di Sarawak mulai tahun ini."
6.5421982021850225,-0.05771436384891738,2,my,"Minggu ini, laporan muka hadapan Mingguan mStar menyajikan laporan yang agak berlainan sedikit mengenai sambutan raya. Kami memaparkan tiga kisah menarik bagaimana mereka yang tidak mempunyai kampung halaman (orang bandar) beraya tanpa mengamalkan budaya pulang ke kampung yang menjadi amalan berjuta warga kota setiap kali tibanya musim raya, kisah kedua mengenai mereka yang hendak pulang beraya tetapi tidak dapat berbuat demikian kerana komitmen kerja dan peristiwa ketiga ialah bagaimana terdapatnya segelintir keluarga dan individu yang memilih untuk menyambut hari raya dengan pergi bercuti di luar negara."
1.3601889966405483,-0.010261013940746883,2,my,Tambahan pula negara seperti China yang banyak membeli Bil Perbendaharaan Amerika Syarikat merasa bimbang mengenai penurunan nilai dolar dan menyarankan penggunaan mata wang alternatif untuk perdagangan.
0.015380818392637918,2.311213117163788,1,sk,"""Študenti počas praxe opravujú autá a minimálne finančné prostriedky, ktoré dostanú ako odmenu za opravu auta, idú naspäť na tento odbor, aby sa napomohlo vzdelanie ďalším študentom aj na rozvoj celej automechanickej dielne,"" vysvetlila Lacková."
2.06559174432827,-0.011848547919213057,2,my,"Menurut Abdul Rahim, sumbangan itu adalah kutipan daripada tabung yang diwujudkan oleh UMNO cawangan yang berjaya mengumpulkan sebanyak RM500, Kumpulan Yassin Wanita UMNO cawangan (RM500) dan Masjid Taman Angsamas (RM1,000)."
0.0295957872066638,3.4192453839366843,1,sk,"""Na druhej strane samotná skutočnosť, že sa SMK rozštiepila, nie je ešte medzi maďarskými voličmi vyjasnená a zrejme to, že sa nevedeli rozhodnúť, kam sa pridať, spôsobilo, že účasť vo voľbách bola nižšia,"" uzavrel sociológ."
0.015389485792852183,1.7375247107333027,1,sk,"Kríza je nespravodlivá a môžu za ňu chamtivci. Takto „rieši“ súčasnú situáciu obyčajný človek. Podnikatelia túto možnosť úteku od reality nemajú – po riešenia musia načrieť hlbšie. Nastalo obdobie rizikového manažmentu a vytvárania vankúšov proti stratám, ktoré podniky ešte minulý rok nečakali. Neefektívne šetrenie však nepomôže. Netreba si vystrieľať všetky zbrane a v rámci úsporných opatrení zhasínať aj svetlo na konci tunela."
2.057968759415316,-0.011352236867282846,2,my,"Rancang mereka juga, album ini bakal dilancarkan pada bulan hadapan di Hard Rock Cafe, Pulau Pinang sebelum diikuti siri jelajah Malaysia, khas untuk merapati kembali peminat yang sudah tiga tahun mereka tinggalkan tanpa material baru."
1.633364623359171,-0.01282030845586703,2,my,Menteri Belia dan Sukan Datuk Ahmad Shabery Cheek ketika ditanya Bernama di Jakarta berkata penyokong Malaysia tetap ada namun dijangka tidak seramai penyokong Indonesia semasa perlawanan di Bukit Jalil.
0.006077762273700997,0.534227094183286,1,sk,O vaznosti stavu pacienta sa cez vysielacku dozvedela i letecka zachranna sluzba z Banskej Bystrice a tak ponukla spolupracu Rychlej zdravotnickej pomoci z Brezna.
2.291664365066058,-0.019541442938973835,2,my,"""Jika projek itu menjejaskan teruk alam sekitar, keduadua pemaju dan perunding mungkin menghadapi tindakan tegas termasuk denda dan hukuman penjara mandatori,"" katanya pada sidang akhbar selepas lawatan Perdana Menteri Datuk Seri Abdullah Ahmad Badawi ke kemneterian itu di sini hari ini."
1.3257574404156,-0.011129611283176074,2,my,"Timbalan Perdana Menteri yang juga Menteri Pelajaran, Tan Sri Muhyiddin Yassin berkata, subjek syarat wajib lulus itu sama sepertimata pelajaran Bahasa Malaysia sebagai syarat untuk mendapatkan sijil SPM."
1.4297726328852078,0.004741221149512288,2,my,Pada tahun itu tentunya tidak ada sesiapa boleh sangka akan berlaku Peristiwa 11 September pada tahun 2001 di mana WTC runtuh apabila dirempuh oleh kapal terbang penumpang Amerika.
0.00518162534213986,0.7711838301325316,1,sk,"Podobne je to aj v ďalších väčších mestách, napríklad v Prešove sú dva takéto autobusy, ktoré spájajú dve najväčšie sídliská, v Košiciach jeden autobus."
0.016447618337258323,2.469036545964735,1,sk,"V súčasnej fáze pred výberom sa oficiálne nevyjadrili, no už vzhľadom na inštalované kapacity je jasné, že nové kontrakty pre Bratislavu by sa im hodili."
0.008748115607150534,1.3245639197698171,1,sk,"Dodal, že vyhľadávajú spomínaných ľudí na prešovských uliciach, pomáhajú ich mobilizovať, motivovať, aby zmenili život, umiestňujú ich do charitatívnych zariadení a do Nocľahárne Archa."
0.02416509361539651,0.75529827483006,1,sk,"Po smrti amerického prezidenta Franklina D. Roosevelta v roku 1945 sa spustila vlna falošných správ, podľa ktorých malo za záhadných okolností zahynúť viac než 10 prominentov vrátane Charlieho Chaplina a Franka Sinatru."
0.01632621445443864,2.4257990676728625,1,sk,"Prekvapivý vstup Itery na postsovietsky plynárenský trh sa dáva do súvislosti s nástupom Alexandra Puškina do najvyššieho vedenia Gazpromu, kde je zodpovedný práve za obchodnú činnosť ruského koncernu na území SNŠ."
1.9967359458195313,-0.015276768984665061,2,my,``Selama lebih 55 tahun UMNO berbakti kepada bangsa Melayu dan rakyat seluruhnya tetapi sayangnya pembangunan yang kita laksanakan tidak diberi pengiktirafan kerana rakyat sering dikaburi dan diadu domba.
0.012435354163420897,1.8952871093237196,1,sk,"Na písanie mailov alebo kratších textov však stačí aj softvérová klávesnica, na ktorej možno písať nielen klasickým spôsobom, ale možno využiť aj funkciu Swype."
0.011305107332383884,1.5378310658748424,1,sk,"Keď Slováci prejavia dostatočný záujem o tento druh umenia na takejto profesionálnej a umeleckej úrovni a budú disponovať dostatočným ekonomickým potenciálom, je možné, že Cirque du Soleil raz rozbalí svoj stan aj tu."
1.938189847289889,-0.016926951533020602,2,my,"Atas kelebihannya yang boleh berbahasa Cina, Nubhan telah merakamkan lagu Ai Mei Cuo untuk dimuatkan dalam album sulungnya yang bakal muncul pada pertengahan Februari ini."
3.149727103455405,-0.02656681152445059,2,my,Demokrasi di negara ini semakin berkembang dalam 54 tahun merdeka. Kita juga didedahkan mengenai kebebasan dan hak rakyat. Kerajaan pada saya berjaya membentuk masyarakat berbudaya apatah lagi dalam isu pembelajaran yang saya rasa ketika ini di tahap memberangsangkan.
0.00849206275735352,0.7231455752302557,1,sk,"Dvadsaťštyri spevákov bojujúcich o titul Česko Slovenskej SuperStar sa v pondelok o ôsmej hodine večer stretlo v prezidentskom apartmáne Leoša Mareša, aby si spolu s ním a jeho moderátorskou kolegyňou Adelou Banášovou pozreli diel s názvom Dlhá cesta."
0.009711467310251536,0.9164797052128267,1,sk,"Jeho účastníci mali možnosť sledovať ukážky práce špeciálnych útvarov pri kontrole a zaisťovaní podozrivých osôb, pozrieť si techniku na zisťovanie pašovaných látok, vozidlá a podobne."
2.747366846761974,-0.024059593337137048,2,my,"Antara yang paling popular dan mendapat perhatian ialah Presiden Cuba, Fidel Castro, yang tidak pernah lepas daripada lensa kamera jurugambar yang meliputi sidang kali ini."
1.2640866506711028,-0.008616596124694842,2,my,"Johor yang menduduki tangga ketiga Liga Perdana musim lalu bakal beraksi pada saingan Liga Super 2010 tetapi berikutan masalah tunggakan gaji, kebanyakan pemain musim lalu telah 'angkat kaki' meninggalkan skuad Jengking itu."
0.002092177078671568,0.313663358157659,1,sk,"Spotrebiteľ vníma značku najmä ako záruku kvality výrobku, súbor funkčných a emocionálnych benefitov, čosi, čo poskytuje istotu pri rozhodovaní a prispieva k tvorbe jeho imidžu."
1.5470837365583403,-0.0069866988167014,2,my,"Untuk mengetahui kisah selanjutnya, pastikan anda tidak ketinggalan untuk menyaksikan siri Kala Hati ini, setiap Selasa hingga Khamis, jam 10.30malam di slot Samarinda, hanya di TV3!"
0.009290137254019495,1.365114737948937,1,sk,"Na dodrziavanie kvality a informacnych povinnosti sa zamerali v sestdesiatich styroch prevadzkovych jednotkach, kde pre zistene nedostatky pozastavili tristostyridsatpat druhov tovaru za 1 597 286 korun."
1.0728786523680809,-0.005433035405574281,2,my,"Bayi malang tersebut, Muhamad Iman Mohd. Sonel meninggal dunia pada pukul 3.25 petang Jumaat lalu selepas mengalami pendarahan serius di kepala akibat dipercayai dihentak dengan kuat selain ada kesan lebam pada matanya."
2.120730043549146,-0.018167153329864506,2,my,"Mengenai laporan awal cadangan rekabentuk projek pembangunan pusat penempatan Digital Mix Stage Dolby System, Rais berharap pusat itu akan menaikkan taraf filem negara dan penggiat filem akan memanfaatkan peralatan yang akan disediakan di Finas."
1.2621003951688174,-0.005182324357646022,2,my,"Beliau berkata dalam konteks Asean, Malaysia telah menandatangani FTA dengan banyak ekonomi baru berkembang, dan negara ini mencapai perdagangan bernilai RM1.17 trilion tahun lepas."
1.705648318806875,-0.014862230690035911,2,my,"Tetapi realitinya, semua tahu, sebahagian Melayu yang menyokong DAP adalah atas tiket sokongan mereka kepada PAS, bukannya teruja kepada DAP, seperti yang cuba dikelirukan."
1.8967639107750225,-0.008704710555948302,2,my,Pada masa ini Timor Leste masih lagi memegang status pemerhati dalam NAM dan lembaran sejarah baru akan dilakarkan pada 25 Februari ini apabila negara itu dijadualkan menjadi anggota pergerakan itu secara rasmi.
0.033154009644640645,5.040186526726378,1,sk,"SMK uvažuje, že pôjde samostatne do volieb do orgánov vyšších územných celkov. Ako pre agentúru SITA uviedol člen republikového predsedníctva SMK Štefan Zachariáš, definitívne rozhodnutie zatiaľ nepadlo. „Počkáme na okresné konferencie, ktoré sa budú konať začiatkom septembra a na nich sa budú kreovať kandidáti na poslancov a potom rada rozhodne, či postavíme svojho kandidáta na župana alebo pôjdeme do koalície s nejakou stranou a podporíme jej kandidáta,“ povedal Zachariáš."
1.2896237963596924,-0.01078789849321551,2,my,"Kelmarin, para penggubal dasar Indonesia menggesa pemerintah supaya menghentikan penghantaran pekerja warga negara itu ke luar negara tanpa perjanjian yang menjamin hak asasi asas mereka."
0.022594775206879244,2.8551214427742853,1,sk,"Na ďalší rok si tento kúsok zopakoval, keď na Everest vystúpil opäť na jar i na jeseň, tentoraz však tradičnou cestou Číňanov zo severnej strany."
0.005867611699228935,0.9136682043320609,1,sk,"Povedal, že z normalizácie svojich vzťahov by zožali úrodu Maďarsko aj Slovensko a že vzájomná spolupráca by vzala politiku z rúk extrémistov v oboch krajinách."
1.1456997777500966,0.00011352445861174224,2,my,"Pengerusi masjid itu, Datuk Idris Shaari Mat Aris berkata, pada tahun ini masjid itu memasak 15 periuk bubur lambuk sehari berbanding 12 periuk pada tahun lepas."
0.03071891524807969,2.9938459935240957,1,sk,"Pri príprave chleba sa na prvý pohľad zdalo, že výsledky sú v porovnaní s konvenčným pečením identické. Bochník pripravený tradičnou cestou bol však mokrejší a na druhý deň bola jeho kvalita znateľne nižšia ako pri tom, ktorý sme pripravili v špeciálnom režime. Pre tých, čo si život bez pizze, osúchov a domácecho chleba nevedia predstaviť ide o praktickú funkciu."
0.8374822224931525,-0.006863563153145811,2,my,"Ketika wakil lelaki menghampiri juru andam untuk meminta izin pasangan mempelai disandingkan di atas pelamin, sudah menjadi lazimnya, syarat 'buka kipas' untuk mak andam harus disediakan."
0.0037156040226721133,0.5466531116969009,1,sk,"Pre geneticky modifikované plodiny (GMO) je už od polovice devädesiatych rokov v spore Európska únia s triádou veľkých svetových pestovateľov – USA, Kanadou a Argentínou."
0.007031758977187453,0.6636863262156607,1,sk,"Chvalabohu, nedožila sa tak dcérinho neautorizovaného životopisu z pera najväčšieho klebetníka všetkých čias Andrewa Mortona, ktorý už predtým šokoval svet monografiami princeznej Diany či Madonny."
0.0168694196533336,1.4944927680949278,1,sk,"Pre niekoľkých ľudí, o ktorých som bola presvedčená, že majú talent a že ich stačí iba s niekým zoznámiť alebo niekam posunúť, sa mi podarilo otvoriť bránu do mediálneho sveta."
1.5439273445376616,-0.01406310756448932,2,my,“Perkara penting adalah memiliki secukupnya motivasi untuk sentiasa memperbaiki diri setiap masa dan inilah apa yang telah berlaku kepada diri saya sepanjang karier tenis saya.
1.919644959308566,-0.017237804282505344,2,my,"SETIAP kali hujan turun, Kapten Hasbul Azlie Zainul Abidin dan 12 anggotanya akan bersiap sedia untuk meninggalkan penempatan mereka dan bergerak ke tempat yang lebih tinggi."
0.004928790094210897,0.7338701998807714,1,sk,"Podľa Lýdie Výbornej z komunikačného odboru Sociálnej poisťovne majú nárok na vianočný príspevok všetci tí, ktorých úhrn súm poberaných dôchodkov nepresiahne vládou stanovenú maximálnu sumu."
1.0294276009537913,0.0042422326848722556,2,my,"MINGGU lalu, filem lakonannya bersama Alex Pettyfer, I Am Number Four, berada pada tangga teratas carta pecah panggung negara ini. Tentunya ia perkembangan cukup membanggakan buat pelakon berusia 24 tahun terbabit, mengenangkan hakikat dia bukanlah bintang besar dalam industri perfileman sebelum ini."
0.5811216095808053,-0.004944172119556604,2,my,"""Jadi prestasi tidak boleh lagi naik turun kerana jika Selangor mahu mencipta sejarah meraih kejuaraan hatrik Liga Super, kita kena mula jarakkan diri bermula dari sekarang,"" kata Hamidin ketika dihubungi Kosmo! semalam."
1.7808555211272776,-0.01195027197779683,2,my,"'Sejauh ini kami percaya usaha global yang diumum untuk mengurangkan (kesan itu) belum mencukupi... lebih banyak perlu dilakukan,' kata beliau semasa menyampaikan ucapan selepas sidang itu bersama Perdana Menteri China, Encik Wen Jiabao, and Presiden EU, Encik Jose Manuel Barroso."
0.023914173502184593,1.5757846265537807,1,sk,"Jazda mestom trvá asi 15 minút a záujemca zaplatí za osobu 50 Sk (1,65 eur) bez ohľadu na to, či sa vezie sám, vo dvojici alebo s rodinou."
0.03228588881395327,3.5553715073874335,1,sk,Stanovisko k clanku Hor sa na kone Dna 24. septembra sme sa na zaklade pozvanky Krajskeho uradu v Banskej Bystrici zucastnili na tratovej porade k zostave cestovneho poriadku ZSR na obdobie 2000/2001.
0.007780925202127727,1.1581762249211822,1,sk,"V letohrádku Dardanely ožívajú historické klávesové nástroje ukážkami hry na pozitívoch, klavichordoch, klavíroch či stolových klavíroch. Sviatočnú atmosféru umocňujú šermiari zo skupiny Páni Spiša. Netradičné vstupné v podobe päťkorunovej pohľadnice pre školákov a dôchodcov, pätnásťkorunového katalógu pre dospelých by malo umožniť návštevu expozícií mnohým záujemcom."
1.6506990849782428,-0.011928292804285012,2,my,"Penasihat DAP, Lim Kit Siang turut mendendangkan lagu lama dengan dakwaan kononnya kekayaan sumber asli Sarawak seperti kayu balak dan petroleum lebih menguntungkan pihak tertentu di negeri ini, manakala rakyatnya tidak menikmati kekayaan itu."
1.3194526664951798,-0.011801302640871269,2,my,"RCZ bersaing dalam segmen sport coupe yang niche dan kami yakin ia akan diterima baik, kata Ketua Pegawai Eksekutif Nasim, SM Nasarudin SM Nasimuddin."
0.006400955621389869,0.9884198410429407,1,sk,"Pohľad padne na posúvač času – interaktívnu hračku, akési zásuvky, s ktorými možno ľubovoľne manipulovať – sú v nich dokumenty, fotografie, obrázky, ale aj časti dobového oblečenia."
0.011918378502166005,1.79971762172247,1,sk,"Tam sa hľadá jediný poisťovateľ aj pre veľké objemy poistenia, pričom spolupoistenie – teda rozloženie rizika na viacero spoločne pôsobiacich poisťovní –nie je spravidla možné."
1.6751461573028634,-0.009213798144602983,2,my,"Pasukan itu gagal memperolehi sebarang pingat pada Sukan SEA Brunei pada 1999 tetapi dalam temasya sebelumnya iaitu pada 1997 di Jakarta, mereka memperolehi pingat perak selepas tewas kepada Filipina dalam perlawanan akhir."
1.8982913551214327,-0.017083841755893673,2,my,"Jika dibandingkan kejayaan dan populariti yang dimiliki aktor berusia 28 tahun itu dengan aktor seangkatan dengannya, langkah Remy dilihat lebih jauh dan lebih lincah."
1.7747852766824541,-0.012559215551158145,2,my,"Tambah Fatini, dia menjangkakan pementasan kedua Natrah yang bakal berlangsung pada 25 November hingga 5 Disember ini menggunakan skrip lama yang telah diperbetulkan berdasarkan cerita sebenar ketika pementasan pertama dahulu."
0.010983258314820377,0.5979774165327473,1,sk,"Toto však nie sú tak výnosné aktivity, aby RAG priniesli 200 miliónov mariek, ktoré musí od tohto roku každoročne vkladať do financovania ťažby uhlia."
0.004886305229943513,0.19303754178407426,1,sk,"Xavi v mladosti takmer skončil v Reale Madrid Meno Xaviho Hernándeza si futbaloví nadšenci automaticky spájajú s FC Barcelona, nechýbalo však veľa a jeden.."
0.008558747055903142,1.3020347683290456,1,sk,"Slota reprezentuje aj celú vládu, ktorú táto parlamentná koalícia drží pri živote, každého jednotlivého jej člena, ktorý vo vláde visiacej aj na Slotovej ľubovôli, napriek všetkému čo stvára, zostáva sedieť."
0.0025600990346029517,0.3602138478853754,1,sk,"K dispozícii nebude Čarnoká, ktorá má problémy s achilovkou, ostatné sú zdravotne v poriadku a pripravené urobiť maximum pre vytúžený postup,"" prezradil po prvom utorňajšom tréningu tréner Košičaniek Vladimír Karnay."
0.013387284019718832,1.2280490493372838,1,sk,"Cize aj ked dnes je Northwest sucastou Delty (kde NW=Delta North, DL=Delta South), tak ja neviem povedat, ako sa vyformuje firemna kultura, ktora vznikne spojenim Delta North a Delta South a tak neviem povedat, ci s nimi budem spokojny."
1.1489100399651764,-0.010123130696138079,2,my,"“Salah satu perkara yang sukar dicapai adalah untuk mendorong lebih ramai masyarakat Cina menyertai sektor kerajaan, namun saya faham ia perlu memakan sedikit masa."
0.00888991878165759,0.4618102591837811,1,sk,Okrem toho vo štvrtok v Nitre otvorili 6. ročník výstavy techniky pre tvorbu a ochranu životného prostredia Enviro 2001 a 5. ročník predajnej výstavy pre záhradníctvo a priateľov bonsajov a kvetov Gardenia 2001 a Bonsai 2001.
0.004328848901016998,0.6488559531568309,1,sk,V Grandhoteli v Starom Smokovci vymenil majiteľ Július Rezeš v polovici minulého roka vedenie a angažoval košického špecialistu na reštrukturalizáciu firemných procesov Ma­riána Rigana.
0.017479149307818822,1.4172578579057789,1,sk,"Politický chaos pred voľbami v roku 2001 vyniesol postkomunistov k triumfálnemu víťazstvu a postsolidárne strany uvrhol do bezvýznamnosti – AWS, ktorej sa stal Buzek v roku 1999 predsedom, sa nedostala ani do parlamentu."
1.1641685141721867,-0.007463826992134629,2,my,"Program yang dikenali sebagai skim ""bekerja sambil belajar"" atau ""earn while you learn"" itu adalah satu langkah inovatif bagi mengatasi masalah kekurangan tenaga mahir dalam bidang animasi."
1.8827194090574466,-0.014969032347814881,2,my,"Lumrah ibu seperti saya menghabiskan sebahagian besar masa di dapur, maka saya perlukan suasana yang mampu mengikat minat supaya berada lebih lama di ruang itu."
2.093692900214467,-0.013035292713073694,2,my,"Ia boleh dilihat pada jeriji yang diletakkan pada kedudukan baru, reka bentuk tiang D dan penekan pintu belakang. Bentuk hudnya pula membolehkan pandangan yang jelas ke bahagian sisi kenderaan."
0.01873376450071021,1.1430057311494068,1,sk,"Najstaršia dcéra herečky Veroniky Žilkovej (48) modelka Agáta Hanychová (25) sa objavila na nedávnej akcii hudobnej televízie Musiq 1 v našom hlavnom meste, no ostala svojej povesti poriadne dlžná."
0.017310067268457022,1.1670380737486656,1,sk,"A cenzúra bola na literárne spracované reportáže o ľudských príbehoch o čosi mäkšia, a tak sa zrazu otvorili isté možnosti písať autentickejšie a pravdivejšie."
1.9289109323974765,-0.016102904450480373,2,my,"Mengenai mangsa yang enggan berpindah, Shahanim berkata Pasukan Sukarelawan Puteri juga akan cuba memujuk mereka yang terlibat supaya berpindah jika keadaan terlalu bahaya untuk mereka."
1.5151615144833126,-0.014152248591163406,2,my,"Dengan semboyan Glory, Gold dan Gospel atau Kegemilangan, Emas dan Injil, dalam erti kata lain, kekuasaan, kekayaan dan penyebaran agama, bala tentera Portugis sampai ke Nusantara."
