x1,x2,label,lang,texts
0.7978735254696668,-0.0016962162898432893,2,my,"Presiden Pas, Datuk Seri Abdul Hadi Awang berkata, pihaknya sudah mempunyai senarai pendek calon tersebut tetapi ia akan hanya diumum pada 16 Januari ini."
0.011824547394238999,1.7789369337642407,1,sk,"Teoreticke vyucovanie aj nadalej zostava v budove na Mladeznickej ulici (pri plavarni) a prakticke vyucovanie postupne presunu do priestorov spojenej skoly, to znamena, ze nic sa nerusi, len ich zastresi ina skola."
0.0002986690407123776,0.04616788354934492,1,sk,"“Europoslanci prijali správu o účinnosti financovania EÚ v oblasti vyraďovania jadrových elektrární v nových členských štátoch, pričom skritizovali prípady nedodržiavania pôvodne stanovených termínov, nedostatku koordinácie a možného míňania.."
0.007665879630506407,1.1752503049818868,1,sk,"Na tomto mieste treba azda pripomenúť, že koncepcia ""Veľkého Slovenska"" vychádzala z romantickej predstavy Veľkej Moravy ako prvého slovenského štátu. Jeho obyvatelia boli pôvodne Slováci (rečou dnešných nacionalistov ""Starí Slováci""), ktorých neskôr násilne počeštili..."
0.01356408972519063,1.5576358767345222,1,sk,"Títo jednotlivci v prednej línii sa tak mimovoľne stali ochrancami firemnej značky, sú to skutoční ústrední pracovníci, istotne poslední, ktorých by sa mala spoločnosť zbaviť, ak má len trochu citu pre vec."
0.5730680086219438,0.007380018118518366,2,my,Program begulai enggau bala rayat ke diatur Opis Pemansang Mensia Mayuh (KEMAS) Parlimen Lubok Antu tu udah mujur endar diatur ba Rumah Dancon anak Jandong di Kampung Bua ditu.
0.47341727373628045,0.0011302690097348613,2,my,"SELEPAS Adrea Guardini, semalam giliran pelumba pasukan Skil Shimano Cycling (SKS), Marcel Kittel pula untuk menjadi pemenang peringkat pada Kejohanan Lumba Basikal Le Tour de Langkawi (LTdL) 2011."
2.6753015120364814,0.09211152293642233,2,my,"Si mati yang diuruskan tidak hanya sendirian tanpa waris, malah ada juga yang tidak diketahui identiti menyebabkan pengkebumian mereka dilakukan di kawasan lapang seperti di tanah perkuburan Jalan Karak."
0.01891382844069627,1.730554032833228,1,sk,"Svedčí o tom decembrové referendum, ale aj 3,2 mil. žobrákov a 100 tisíc hladujúcich detí, na milión osôb, ktoré po vyplatení režijných poplatkov žijú z 3 200 forintov (500 SK) na osobu a mesiac."
0.00903120885592246,1.1537413542566006,1,sk,"Zima zaplnila košické azylové zariadenia a na Kukučínovej ulici našli prechodnú strechu nad hlavou i dve matky s deťmi, hoci tu sa pôvodne s ubytovaním týchto skupín nerátalo."
0.013888134817501438,1.5490727884310767,1,sk,"„Je zarážajúce, že si pán Vetrák vybral agenta ŠtB, pre ktorej praktiky museli stovky Slovákov emigrovať zo socialistického Československa na Západ. A im má úrad pomáhať,“ povedal minister vnútra Daniel Lipšic z KDH."
0.03086717576654718,1.132530472143429,1,sk,"“Poviem príklad, ak niekto vydá 50 000 učebníc a treba urobiť dotlač napríklad 200 tých istých učebníc, je nezmysel pripravovať na to výberové konanie."
0.014423041472266102,1.407385895768131,1,sk,Staršia a menšia časť obchodného domu Dunaj SNP poskytuje na šiestich podlažiach zhruba 1700 m2 predajných plôch a postavili ju pred 60 rokmi. V 80. rokoch minulého storočia vedľa nej postavili ďalšiu modernejšiu budovu so 4800 štvorcovými metrami predajnej plochy. Novšia časť sa spočiatku nazývala Dom odievania. V 90. rokoch ju prepojili so staršou časťou.
1.0798279329249565,-0.009349162317163425,2,my,Semalam dalam portal online Berita Harian dipetik sebagai berkata Perdana Menteri memberi jaminan akan mengumumkan tempoh peralihan kuasa kepimpinan Sarawak apabila tiba masa yang sesuai.
0.021999958695630012,2.5696506019333856,1,sk,"Stáva sa jej poslucháčom alebo divákom a ešte sa pri tom dozvie, že robí správne, že tak to má byť, že tak to je ono.."
3.488716337930382,-0.029620371610655272,2,my,"Sebaliknya, istilah 'biadab' yang membawa makna 'tidak ada budi bahasa, tidak beradat' (Kamus Dewan, 1970) berkemungkinan akan dapat lebih memenangi simpati dan sokongan sosial orang ramai. Ia juga membawa makna negatif yang lebih berat ke atas pihak yang dikenakan dengan istilah itu."
0.014914327494277988,1.2485092313674038,1,sk,"Po ich ukončení pribudne k súčasným 32 400 m2 obchodnej plochy ďalších 16 300 m2 a parkovacie kapacity sa rozšíria o 600 miest. Celkový počet prevádzok obchodov a služieb stúpne o 55. V susedstve Optimy, ktorú Meinl kúpil pred pár rokmi od developera TK Development za približne dve miliardy korún, stavia svoj trojpodlažný obchodný dom Kika, ktorý by mal byť otvorený podľa agentúry v júni tohto roku."
0.02260589754428102,2.874404727684284,1,sk,"A asi každý reálne zmýšľajúci človek musí byť pripravený na to, že si na istú dobu sadne na istú stoličku a po čase je potrebné z úplne prirodzených dôvodov ju zmeniť."
0.006176686042748183,0.9470857733335846,1,sk,"Okrem povinnosti, ktore mal urobit a robil ich na 1000% robil aj vedecku cinnost, ktoru nezavazne podaval ludom z vedenia fo forme studii, postrehov."
0.011452241485162199,0.5135318632905658,1,sk,"2009 / bujak pani trend mam fakt rad, dobre clanky, ale obcas by nezaskodilo precitat si po sebe clanok pred tym ako ho uverejnite.."
0.007708173547865497,1.1575850735896087,1,sk,"Kozmická sonda Mars Odyssey je v bezpečnostnom režime Kozmickú sondu Mars Odyssey uviedli do bezpečnostného režimu, keď porucha počítača zabránila prenosu dát z dvoch terénnych vozidiel na povrchu Marsu."
0.014635737199624126,2.256400803550492,1,sk,"Zakladateľ spoločnosti SpaceX Elon Musk musí byť spokojný. Miliardár Musk, autor internetového platobného systému PayPal, totiž pred štartom vedel, že pri prvom štarte zlyhajú až dve tretiny rakiet. Na druhej strane Musk vie, že v boji o lukratívne zákazky NASA a americkej vlády nie je sám. Záujem majú aj také mená ako Boeing alebo Lockheed Martin."
1.2326722589080024,-0.010865971350531224,2,my,"Pengurus Kanan Operasi PBSB, Asnor Ali berkata, peningkatan itu dijangka berlaku pada dua atau tiga hari menjelang Hari Raya Aidilfitri dan PBSB telah menyediakan pelbagai langkah serta tip keselamatan bagi mengelakkan kesulitan kepada pengguna."
0.019135977099320866,2.5173840925860858,1,sk,"BRNO. Aj po prehratom dueli so Švédskom fanúšikovia aplaudovali. Jeho jeho meno vyvolávali tak dlho, až sa vrátil z kabíny na ľad a opäť im zamával. ""Boli fantastickí. Je vidieť, že diváci v Brne hokeji rozumejú a majú ho radi,"" povedal Jágr po poslednom zápase Českých hier pre portál iDnes.cz."
2.4278713644332077,-0.018140100731216555,2,my,"Tiga perlumbaan pertama di Bahrain, Australia dan Malaysia telah menyaksiakn tiga pemenang berbeza dengan rakan sepasukan Massa, Fernando Alonso menang di Bahrain, Button menang di Australia sementara Sebastian Vettel dari Red Bull menang di Malaysia."
0.014823011568141461,2.232708476496211,1,sk,"Na prvý pohľad nič nenasvedčuje tomu, že by sa mal stroj na peniaze z amerického Redmondu v dohľadnom čase čo i len spomaliť, nieto ešte zastaviť."
1.5261114555925663,-0.013237734126084848,2,my,"Pada masa yang sama, Menteri Pertahanan, Robert Hill berkata, enam pakar perisikan tentera udara akan dihantar ke Teluk bagi membantu tentera bersekutu menilai pertempuran dan kerosakan."
2.0375564775766524,-0.011780047357342189,2,my,Cara ini mungkin lebih berkesan untuk digunakan bagi menyelesaikan masalah pembuangan bayi kerana pihak berkuasa boleh mengesan dan mengenal pasti identiti ibu bayi termasuk bapa kepada bayi yang tidak berdosa itu melalui pengenalan DNA.
1.4214758645816996,-0.011937102291330952,2,my,"“Saya terpaksa menerima rawatan di kem pembalakan Kumpulan Samling pada hari kejadian sebelum dihantar ke Miri untuk menerima rawatan susulan kerana cuaca buruk dan angin kencang,” katanya."
0.014889473065134847,1.6924804546220331,1,sk,"Ľudia si všímajú splátkový kalendár, referencie developera, aj to, koľko v ktorej fáze výstavby chce od budúceho majiteľa bytu, pýtajú sa na povesť stavebnej firmy."
4.068033026233673,-0.036225087150232725,2,my,"Jalur ini juga menggambarkan satu haluan yang lurus, hala tuju yang sama dan arah yang sama yang dipegang oleh rakyat negara ini dalam menuju kegemilangan bangsa dan negara."
0.013966954508456902,1.433676823144882,1,sk,"Akcie ČEZ a pražský benchmark © 2010 TREND Holding, spol. s r.o. Späť na začiatok článku Diskusia (0 reakcií ) Pre pridanie príspevku do diskusie sa musíte najskôr prihlásiť."
0.013446442667080854,1.9974445812363602,1,sk,"Prispôsobila sa vo všetkom Problémy vo vzťahu riešila Dara Rolins už pred dvoma rokmi v zime, keď sa Matěj namiesto spoločnej dovolenky s ňou a Laurou vyparil na tri týždne do Indie."
2.9107637874749632,-0.023814117191478214,2,my,"Zakat pendapatan mencatat kutipan tertinggi iaitu lebih RM4.61 juta, katanya kepada pemberita selepas majlis penyerahan zakat perniagaan oleh agensi korporat yang diterima Yang Dipertua Negeri Melaka Tun Mohd Khalil Yaakob di pejabatnya di Ayer Keroh di Melaka, Selasa lepas."
0.024301756886687398,2.6127539869148864,1,sk,"Start na historickom Karlovom moste Vo stvrtok 22. marca sa Miroslav Haninec zucastnil na Trnavskej polhodinke na drahe, kde spomedzi 70 pretekarov v kategorii do 40 rokov zvitazil a zabehol 9 kilometrov."
1.2732519645628204,-0.011158101266046045,2,my,"Parreira, jurulatih yang membawa Brazil menjuarai Piala Dunia 94 hanya menyuruh anak buahnya menjalani latihan pemanas badan dan gembira mereka bebas dari sebarang kecederaan."
1.1869087539394891,-0.007167965329852193,2,my,"Sekembalinya ke tanah air, Among tidak membuang masa dan mengikuti pelbagai kursus termasuk anjuran Pusat Pembangunan Usahawan Malaysia (Medec), Lembaga Pertubuhan Peladang (LPP) dan Jabatan Perikanan Malaysia."
0.015168552245968954,0.5861447446265164,1,sk,HC Slovan pri žrebe v druhom koši s Zürichom a Eisbärenom Už v piatok 25. apríla sa v sídle Medzinárodnej hokejovej federácie (IIHF) v Zürichu uskutoční žrebovanie základných skupín premiérového ročníka hokejovej Ligy majstrov.
1.0798037000281027,0.005617122524651851,2,my,Pelumba berusia 22 tahun itu berkata dua acara kegemarannya iaitu keirin dan pecut 200 meter akan menjadi taruhannya untuk merealisasikan impian dua emas terbabit.
0.008537183332215207,0.7374115452430138,1,sk,"""Z niektorých videozáznamov, ktoré sme videli, sa zdá, akoby prebiehala koordinácia medzi našou políciou a čínskymi mužmi v čiernych oblekoch, preto si tie zápisy pýtame,"" vysvetlil Fedor."
1.6172706843672537,-0.014840273527832484,2,my,"Beliau berkata, rakyat perlu menjadikan isu itu sebagai panduan dalam menilai kejujuran kerajaan Pas dan BN membantu rakyat kerana sememangnya mudah untuk berjanji tetapi sejauh mana janji itu mampu ditunaikan perlu juga diberi perhatian."
0.0029319909786612733,0.416395945451759,1,sk,"Rozpočet festivalu je takmer 1,6 milióna korún a prispela naň Stredoeurópska iniciatíva, Vyšehradský fond a mesto Košice, ktoré ""odpustilo"" zahraničným účastníkom daň za ubytovanie."
2.0075331316694194,-0.01613111697737505,2,my,Katanya dakwaan Malaysia sudah menjadi negara polis adalah sesuatu yang tidak wajar malah ia secara tidak langsung telah mencemarkan kewibawaan bidang kepolisan di negara ini.
0.002571396344639182,0.09818004174804561,1,sk,"""Toto rozhodnutie dáva priestor politickej intervencii a zničeniu nezávislosti sudcov,"" uvádza vo svojom štvrtkovom stanovisku 21 popredných sudcov vrátane predsedu najvyššieho súdu Andrása Baku."
0.8686251731463543,-0.0028629828462344957,2,my,"Laman web tersebut kini dilawati lebih sejuta kali manakala pelajar Universiti Stanford di AS itu turut mendapat tawaran kerja daripada firma enjin carian Internet, Google."
0.0011915703019089272,0.1519715212774684,1,sk,"Z hľadiska náročnosti terénu a hodnoty územia prirovnal súčasný požiar k tomu, ktorý vypukol v druhej polovici októbra v roku 2000 v lokalite Tri kopce v Slovenskom raji."
0.3583579208360454,-0.00309738519614736,2,my,"""Kami telah menghantar surat bantahan kepada pihak berkuasa, termasuklah Menteri Besar Selangor, Tan Sri Abdul Khalid Ibrahim, namun masih belum ada maklum balas diterima."
0.5698025097444946,-0.004312826807347316,2,my,Anak buah saya ( Nur Atikah Awaluddin) telah kehilangan ibunya ketika berusia 4 tahun kemudian pada usianya 13 tahun ayahnya pula telah meninggal dunia.
0.010548046158806716,1.2588631475004977,1,sk,"Aj keď ich zistenia zverejnené v časopise Addiction nedokazujú, že to tak musí byť, môže to však mať dôležitý význam pre prevenciu užívania drog a alkoholu mladistvými, uviedli autori štúdie."
0.010379167804712496,1.5771115508266698,1,sk,"Bez štatistiky je aj Česko, v Maďarsku sú dostupné údaje iba v súvislosti so zásahom do práva na ochranu osobnosti, kam spadajú aj spory o rovnakom zaobchádzaní."
0.003558843595605236,0.4639076544155281,1,sk,"Zákon hovorí, že ak notári alebo exekútori pri svojej činnosti urobia chybu a spôsobia tým škodu, zaplatí ju v prvom momente štát – presnejšie Ministerstvo spravodlivosti SR."
1.947424718819765,-0.016372999416640083,2,my,"Selain merubah Taman Tasik Perdana kepada sebuah Taman Botanik dan mewujudkan Pusat Pelancongan Malaysia contohnya, kawasan pinggiran sungai akan diindahkan sebagai Taman Rekreasi seperti yang telah dilaksanakan di Sungai Melaka, katanya."
0.7831457222390642,0.0020148317644193415,2,my,"Pengerusi PTPTN, Datuk Ismail Mohamed Said sebelum ini dilaporkan berkata, hampir 600,000 peminjam tidak layak menukar skim konvensional kepada ujrah kerana terlibat dengan tindakan saman, melanggar perjanjian terdahulu atau sudah menyelesaikan keseluruhan pinjaman."
0.011818014402239342,1.7023301741957537,1,sk,"Ak má človek podozrenie, že organizácia spracúva jeho osobné údaje bez výslovného súhlasu alebo inak ako na základe zákona, môže sa voči takémuto konaniu ohradiť a požadovať likvidáciu údajov."
1.9766022215731953,-0.015931515196848284,2,my,Beliau berkata tempoh mengundi ialah dari pukul 8 pagi hingga pukul 5 petang di 12 pusat mengundi termasuk enam di kawasan Dewan Undangan Negeri (DUN) Karamunting dan DUN Sekong serta sebuah di Pulau Timbang.
0.01817281646939617,1.1965626846898203,1,sk,"Anna Vojvodová, Istebné Ja som sa pred týždňom vrátila z Austrálie, kde som bola jeden a pol roka, takže som o tom ešte nepočula, ale ak priznajú svoj majetok ľudia, mala by tak urobiť aj cirkev."
1.9574540181997047,-0.01699295871057767,2,my,"Beliau yang juga ahli Majlis Tertinggi menambah, perjuangan UMNO untuk memberi kemakmuran dan kesejahteraan kepada rakyat amat dituntut oleh agama kerana tanpa pembangunan, umat Islam tidak akan dapat menjalankan ibadat dengan sempurna."
2.3115973196361312,-0.017513197413821176,2,my,"Festival tersebut umpama hadiah daripada Kumpulan Utusan kepada warga pendidik yang telah banyak menabur jasa mendidik anak bangsa. Apa yang membanggakan, program tersebut menerima sambutan yang menggalakkan daripada pengunjung."
0.008647089114040928,0.6828816739069382,1,sk,"Experti v Budapešti medzičasom skúmajú neočakávanú ponuku švédskej strany požičať maďarskej vláde na päť rokov 24 použitých stíhačiek typu Gripen štvrtej generácie, plne kompatibilných s výzbrojou NATO."
0.011862689046600287,1.4876873103957224,1,sk,"Okrem neho zahynuli ďalší štyria ľudia, medzi nimi aj bin Ládinov syn či žena, ktorú použili ako ľudský štít. Z amerických jednotiek, ktoré sa zmocnili tela, sa nikto nezranil. Akcia trvala 40 minút."
2.1313824986634127,-0.018049917292134617,2,my,"Kita tidak menolak kapitalis kerana kita percaya bahawa modal juga perlu untuk membangunkan negara dan kita juga tidak menolak socialism yang menekankan keadilan bagi masyarakat, tapi tidak bagi keseluruhannya."
0.013989249944942855,2.1127958795631114,1,sk,"Podľa nich nebol na Slovensku v dobrých časoch plne využitý potenciál na konsolidáciu, záväzky vyplývajúce z Paktu stability a rastu sú nedostatočné a sklony k deficitnému hospodáreniu majú všetky vlády bez ohľadu na orientáciu."
0.014758204239639994,0.10428083625695836,1,sk,"Najväčší medziročný pokles zaznamenalo Lotyšsko (18,6 %), za ním nasledovali Estónsko (15,1 %), Litva (11,8 %), Slovinsko (9 %), Írsko (8,4 %) a Nemecko (6,9 %)."
0.009814907510373918,0.8133009832692479,1,sk,2009 / Pavol Rábara O slobodu slova v Taliansku sa zaujíma už aj Medzinárodný tlačový inštitút Štátna televízia „odpísala“ stotisícovú demonštráciu za nezávislé médiá.
2.06872934689767,-0.01748469131608827,2,my,"Seperti dalam masyarakat lain, malam menjelang kedatangan Gawai, merupakan waktu untuk seluruh anggota keluarga berhimpun bagi menikmati hidangan istimewa. Selepas itu, bermulalah perayaan ini apabila penduduk rumah panjang berkumpul di ruai utama (serambi, yang menjadi pusat acara sambutan)."
2.5963463253703094,-0.022592296717439172,2,my,"Beliau berkata, antara isu nasional yang perlu ditangani di Wilayah Persekutuan ialah mengenai sokongan masyarakat pertengahan Melayu dan golongan muda yang tidak lagi bersimpati dengan perjuangan UMNO."
1.4333057621899565,-0.011413546305070505,2,my,"Ahmad Lai menambah, pengguna jalan raya bukan sahaja perlu memikirkan keselamatan dirinya sendiri tetapi juga keselamatan penduduk kampung, terutamanya pejalan kaki yang sering berulang alik di jalan raya berkenaan."
0.015606173675629437,2.4048966395184683,1,sk,"Súčasťou celkového dojmu z lokality nie je len príjazd, ale aj statická doprava, teda parkovanie. Dlhé diely sú známe najmä stovkami áut, lemujúcimi dlhú stúpajúcu cestu pomedzi novopostavené bytovky a staré paneláky. Koráliky áut na lákavosti nepridávajú. „Záujem o Dlhé diely ochabuje,“ hovorí šéfka spoločnosti Bond Reality Daniela Rážová a dodáva, že okrem dopravných problémov je to najmä pre neustály stavebný ruch."
0.0069208788967869755,1.0671512763687407,1,sk,"Štát porušil svoju povinnosť Ako dodal hovorca rezortu spravodlivosti, ESĽP dospel k záveru, že vnútroštátne orgány porušili svoju povinnosť uskutočniť primerané opatrenia na ochranu zdravia Šarišského počas policajného zadržania."
1.3610674315245683,0.014659473075171292,2,my,"Namun begitu, perlawanan kali ini disambut penuh emosi oleh jurulatih Maghribi, Henri Michel, bekas jurulatih antarabangsa Perancis, yang menamatkan karier bola sepaknya di sini."
1.761844592982513,-0.011546533759793073,2,my,Masih ada baki empat lagi perlumbaan dalam saingan musim ini. Saya hanya ketiggalan 20 mata dibelakang Webber dan ia bukanlah perbezaan yang ketara tetapi tetap sukar untuk diatasi.
0.004254877864538757,0.6087664058254588,1,sk,"Misia OSN v Etiópii a Eritrei (UNMEE) vznikla v roku 2000 po krátkej pohraničnej vojne, ktorá sa skončila dohodou o prímerí dosiahnutou v Alžíri."
1.7387025378808418,-0.013003622178160815,2,my,"Beberapa jam sebelum hilang pada 9 Januari lalu ketika dalam perjalanan pulang bermain bersama kakaknya, Sharliena, 8, dari padang permainan tidak jauh dari rumah mereka di Taman Medan di sini, Sharlinie juga meminta dibelikan telefon bimbit mainan."
0.02795266773744515,1.9767130782187867,1,sk,"Air Sarko One, ako ho Francúzi hneď prekrstili, bude mať okrem iného apartmán s manželskou posteľou či špeciálne filtre, aby prezident mohol na palube fajčiť cigary. Pôvodne si Sarkozy objednal aj veľkú vaňu, tú mu však z bezpečnostných dôvodov nepovolili. Pri turbulenciách by sa vraj mohla vyliať voda a spôsobovať skraty v citlivej elektronike."
0.009396420607829543,1.4412483857620935,1,sk,"Pripomínal mi ostrostrelca, ktorý vystrelí posledný šíp, pričom je presvedčený, že trafil a preto zo strany svojej potenciálnej obete so žiadnym protiútokom nepočíta, nanajvýš s tým, že sa vzdá."
0.014377340899749236,0.9899629098220561,1,sk,"Ešte na konci minulého roka, 30. decembra, zvolala cirkev v Madride masové zhromaždenie „Stretnutie rodiny“, ktoré si vládnuci socialisti oprávnene vysvetlili ako protivládnu demonštráciu."
0.014902589066698448,1.282105632746981,1,sk,"Podľa anglického denníka Financial Times problém nebol ani tak v charaktere kontaktov Wolfowitza s Rizovou. Skôr prekážal fakt, že prezident podrobne rozpísal, koľko má zarábať jeho milenka, a pridal aj vzorec, podľa ktorého sa má zvyšovať jej príjem v budúcnosti."
0.7176931136019037,-0.005950806174588878,2,my,"Katanya pada majlis pelancaran produknya itu, dia sememangnya meminati bidang kecantikan sejak menceburi dunia hiburan. Malah, bergelar seorang artis membuatkannya lebih peka dalam aspek kecantikan diri."
0.012766040849945932,1.9197783803419155,1,sk,"Ide o finančné prostriedky, ktoré sa prostredníctvom Štátnej plavebnej správy odvádzajú priamo do štátneho rozpočtu, ale nič z nich sa nevracia na rozvoj vodnej dopravy,“ hovorí riaditeľ riečnej divízie Jaroslav Pakan."
0.007766174910412441,1.1606596462286995,1,sk,"Podarilo sa im nájsť v Nemecku v Kolíne nad Rýnom, kliniku, ktorá sa venuje podobným príznakom a boli by ochotní Ivetku vyšetriť, odobrať rôzne vzorky, krvi, tkaniva aby podstúpila terapiu."
0.9027097201709854,-0.008318226101008805,2,my,"Ramai mengaitkan pemilihan Linda Tsen, 54, sebagai taktik meraih simpati pengundi untuk berpihak kepada BN, tetapi seperti ditegaskan Musa, persepsi umum dan kriteria diambil kira sebelum calon ditentukan adalah dua perkara berbeza."
2.0045233778038978,-0.01755113135043353,2,my,Reka bentuk luarannya yang maskulin itu diserlahkan lagi dengan ciri Hill Descent Control dan Hill Launch Assit demi memastikannya berupaya mengharung apa jua permukaan jalan yang sukar.
0.005916214881923124,0.6670878034747546,1,sk,"My chceme, aby koalícia stabilne dovládla, jasne sme však dali najavo voči vlastným aj voči ministrom SNS a HZDS, že musia konať v súlade so zákonom."
0.48325327648076355,0.0021121044760619165,2,my,"Dalam kejadian pukul 11.30 pagi, penduduk Kampung Gual Pasung Hantu gempar apabila sembilan helai sejadah dilihat seperti orang sedang solat berjemaah dalam keadaan duduk antara dua sujud."
1.4835553831899548,-0.012909786258554717,2,my,"” Pemandu bas warga tempatan juga mati dalam serangan itu sementara pemain pertahanan, Serge Akakpo dan penjaga gol Kodjovi Obilale adalah antara pemain yang cedera."
0.013001256088478042,1.4063796577120895,1,sk,"Štrbské Pleso má najlepšie podmienky na kúpeľnú liečbu v celých Vysokých Tatrách a preto je smutnou iróniou, že z bývalých takmer 800 lôžok určených pre kúpeľný cestovný ruch dnes nefunguje ani jedno jediné."
0.01422892779359561,1.0879462510986548,1,sk,"S reštrukturalizáciou dlhov štátov eurozóny sa neráta Vyhlásila to francúzska ministerka hospodárstva Christine Lagardeová a poprela, že by reštrukturalizácia bola v hre, pokiaľ ide o dlhy Grécka alebo iných členských krajín."
0.004945380340793252,0.74807347983149,1,sk,"1. Zvýšená konkurencia najmä zo strany nových výrobcov obalových materiálov v krajinách strednej a východnej Európy diktuje požiadavky na vysokú kvalitu, krátke dodacie lehoty a dlhé lehoty splatnosti."
0.01823195641543388,2.5694432458089613,1,sk,"Cirkev budovu vysúdila ako reštituovaný majetok, od toho, čo sa stane so školou, ktorá v nej sídlila, však dáva ruky preč. Podľa stanoviska, ktoré poskytol hovorca tlačovej kancelárie Konferencie biskupov Slovenska Jozef Haľko, ďalšie fungovanie školy bude závisieť od dohody s novým vlastníkom. Tým je podľa zistenia Rady školy firma INUQ, ktorá má však úplne iný predmet činnosti a ťažko predpokladať, že v budove na lukratívnom mieste v centre mesta ponechá školu."
0.005177047436892729,0.7611377669053927,1,sk,"Okrem toho, z agentúrnych správ by mohla vyplývať pomerne bizarná vec, a síce, že znakom súčasného kresťanského myslenia je masové obviňovanie Židov vinných za smrť Ježiša."
0.20744419149743287,0.007312357603369262,2,my,Dr Chan mansutka penemu iya lalu madahka palan nya patut nyendiaka sebuah bilun engkabang kena ngambi tauka nganjung orang ke sakit ari pelilih menua bukai laban palan tu enda jauh ari palan penyangkai bilun menua Kuching.
1.1466254505268658,-0.007412113354793419,2,my,Pengarah SPR Sarawak Datuk Takun Sunggah berkata pilihan raya kecil Sibu akan menggunakan senarai daftar pemilih tahun 2009 yang dikemas kini pada 9 April lepas.
0.005496923996697214,0.8277657971701107,1,sk,"Prvé reakcie lídrov Fideszu po oznámení predbežných výsledkov síce tiež išli týmto smerom, je však otázne, či im to aj vlastní voliči opäť zhltnú."
0.011542267416504862,0.6806726804604781,1,sk,"Hostiteľom bola nemecká univerzita Gyulu Andrássyho, pozývateľom Nadácia Svätého Vojtecha, témou vedeckej konferencie zasa pôsobenie spoločných kultúrnych hodnôt a spoločnej viery na vzájomné vzťahy."
0.9434122883626256,-0.0038650464625812615,2,my,"Beliau turut mencadangkan supaya pihak berkenaan mencari jalan terbaik bagi menyediakan kemudahan tempat berehat, bekalan air dan elektrik serta jalan masuk lebih tersusun ke kawasan tanah perkuburan berkenaan supaya ia dapat digunakan secepat mungkin."
0.6212580703241398,-0.003651339923951352,2,my,"Dengan Chelsea bertandang ke United pada 3 April, Ancelotti sedar pasukannya perlu memenangi kesemua baki tujuh perlawanan liga untuk memenangi kejuaraan liga pertama sejak 2006."
