x1,x2,label,lang,texts
0.008874603785121381,1.2027507135251603,1,sk,"Podľa neho, ak by bol vtedy vybraný privatizačný poradca, ktorý skončil vo výberovom konaní na druhom mieste, Slovensko by za poskytnutie jeho služieb zaplatilo 18 mil. USD."
0.007841324176249456,1.1484667626267122,1,sk,"Zveril by patriarcha a džentlmen ako Warren Buffett skutočne budúcnosť firmy, ktorú formuje na svoj obraz od roku 1965, do železných rúk svojho plukovníka D. Sokola?"
0.024537945777967588,3.20737543834711,1,sk,"Spoločne so svojimi zverencami vie, že tieto smelé ciele naplnia iba poctivou prípravou a zodpovednými výkonmi v majstrovských dueloch. A robia všetko preto, aby získavali ďalšie body a víťazstvá. Do jarnej časti súťaže chcú vstupovať z popredných priečok tabuľky. Hnacou silou je im aj divácka podpora. Na domáce ihrisko si síce doposiaľ našlo cestu len niekoľko desiatok divákov, tréner Milan Boška je však presvedčený, že sa to zmení."
0.008067095993169291,1.0852150238967706,1,sk,"Pred novinármi to dnes uviedol člen Akreditačnej komisie (AK) Milan Kupkovič s tým, že proces schvaľovania oprávnenia vykonávať štátne skúšky trvá najmenej tri zasadnutia AK a tie sa konajú približne každé dva mesiace."
0.8242936907493869,-0.0013657064784993308,2,my,"“Apabila beliau mula menjaringkan gol, segala kebisingan ini akan hilang. Ia hanya menunggu masa. Datang ke kelab baru, beliau memerlukan masa untuk menyesuaikan diri.” — AFP"
1.5124821627131448,-0.00749969619887018,2,my,"Shakila yang baru tiba ke sini, empat hari lalu ketika ditemui memberitahu, keadaan di Jalalabad terlalu bahaya kerana tentera Amerika Syarikat (AS) hampir setiap malam melancarkan serangan sehingga banyak rumah penduduk musnah."
1.5135887787220723,-0.013256312483294206,2,my,""" Tan turut memberitahu kementerian sedang menyiasat empat syarikat membungkus semula yang disyaki cuba menjual minyak masak keluar negara berikutan harga minyak dunia yang sedang melambung tinggi."
0.006110838793382449,0.9192452309535326,1,sk,"Tie najstaršie už budú pomaly ako mamičky vstepovať svojim dcéram pohybovú prípravu, ktorú dostali od pána Procházku a prezentovali ju spolu s dychovou hudbou na vystúpeniach."
0.28612156592603966,-0.002515686410654262,2,my,"Pihak AESB mendakwa kenyataan Iwan tempoh hari berat sebelah, tapi apabila Astro melarang pihak pengurusan membuat sebarang kenyataan media menjawab dakwaan berkenaan, memanglah akan jadi berat sebelah."
1.4562701797039772,-0.012522469063407895,2,my,"""Pada ketika ini mereka (pembangkang) sewajarnya memikirkan cara untuk memecat Anwar (Datuk Seri Anwar Ibrahim) sebagai Ketua Pembangkang apabila pendedahan mengenai skandal video seks yang dikaitkan dengannya telah memasuki fasa kedua,"" jelasnya."
0.008151019493679315,1.2183365422705088,1,sk,"Slovenská verejnosť by podľa Greenpeace mala vedieť, že za plánovanou výstavbou ropovodu nie je len záujem rakúskej firmy OMV, ale aj slovenskej spoločnosti Transpetrol, ktorú kontroluje štát prostredníctvom Ministerstva hospodárstva SR."
1.8815321725077299,-0.015780694140150292,2,my,"Di Pulau Pinang, Yang Dipertua Negeri Tun Abdul Rahman Abbas dan isteri Toh Puan Majimor Shariff menyertai ribuan umat Islam menunaikan solat sunat Aidiladha di Masjid Negeri."
1.973289710445021,-0.01632083249927577,2,my,"Pemandu sebuah lagi kereta, Syed Azmi Syed Hamid, 54 berasal dari Jitra, Kedah, turut mengalami kecederaan di kepala dan dirawat di hospital yang sama."
0.003791803144009361,0.5601945937667901,1,sk,"Výbor tiež vytvorí zoznam osôb a firiem, ktoré sa angažujú v raketových, jadrových a iných programoch zbraní hromadného ničenia KĽDR, vrátane prostredníctvom nelegálnych aktivít."
1.1634094037003275,-0.010771527051666526,2,my,NSP dijangka menampilkan empat calon Melayu dalam usaha parti tersebut menawan empat kawasan undi perwakilan kumpulan (GRC) dan empat kawasan undi perseorangan (SMC) dalam pilihan raya umum kali ini.
1.6002517518268955,-0.012566324365904435,2,my,JAS Melaka telah menghantar contoh bahan dari kilang terbabit kepada Jabatan Kimia di Bukit Katil pada Isnin lepas untuk ujian bagi mengesahkan sama ada wujud persamaan bahan kimia di kilang dengan tempat kejadian.
0.5590727190786573,-0.004205527922254456,2,my,Julia seterusnya membuat laporan polis sebelum nekad membuat tuntutan cerai kerana sudah tidak tahan menempuh kehidupan bersama pelakon terbabit sejak empat tahun mereka berkahwin.
0.020461206887358727,1.058038478497513,1,sk,"Bush prezidentoval počas dvoch vojen, aj iracká, aj afganská bola súčasťou vojny proti terorizmu, ktorá sa naplno začala po útokoch z 11. septembra 2001."
1.7556659286596086,-0.015364372889876153,2,my,"``Tidak lama selepas berehat sehari, tentera bersekutu menyerang stesen utama Iraq dan pusat telekomunikasi utama dan satelit komunikasi bagi menjejaskan kemampuan pemerintahan rejim itu mengawal negaranya,'' kata seorang pegawai AS di Washington."
0.01451402978489283,2.1297572312605304,1,sk,"Podľa Simona totiž MP na základe aktivity Záhumenského odsúhlasilo dodatok k usmerneniu, podľa ktorého sa okrem iných firiem zvýšia dotácie aj firme Agrocontract Mikuláš na pestovanie tabaku o 4,4 mil. Sk."
0.007233384936985846,1.0927391114317138,1,sk,"Iveta Radičová ich rozdelila do dvoch oblastí, a to pomoc tým, ktorí o prácu prišli a pomoc na udržanie práce a tvorbu nových pracovných miest."
0.00919704671336701,0.8414140320515808,1,sk,"Projekt sa uskutocnil v dvoch etapach, v ktorych si ucitelia okrem prace s internetom, osvojili aj pracu v programoch MS Word, MS Excel, ci MS Powerpoint."
2.0046090428727275,-0.01396166443532854,2,my,"Namun, itu semua hanya merupakan imej yang ingin ditonjolkan. Romey Helven, pemuda berusia 25 tahun, tidak pernah menjadikannya sebagai satu isu tetapi bakat beliau yang ingin cuba diketengahkan."
0.009410868711440482,1.3975769688851958,1,sk,"Za problémy východniarov môže predovšetkým neschopnosť samosprávy dohodnúť sa s developermi na pravidlách, ktoré by dokázali sami rešpektovať a zároveň boli v súlade s podmienkami čerpania eurofondov."
0.015604585728056893,1.930466537788789,1,sk,"Otázka by však mohla znieť i tak, prečo sa výskumným laboratóriám v connecticutskom Grotone dlho nedarí vyvinúť špičkový a jedinečný produkt, ktorým by dokázali nahradzovať súčasné. Nemuseli by potom kupovať predražených konkurentov. Pfizer dlhodobo nie je schopný sám vytvoriť exkluzívny produkt, hoci má v sektore najvyššie výdavky na výskum."
0.2457973913248199,0.0005047150548766635,2,my,"PELAKON cantik, Sushmita Sen kembali dengan status solo sekali gus menambah bilangan bekas kekasihnya. Terbaru, nama Wasim Akrim tersenarai sebagai salah seorang bekas buah hati Sushmita."
1.6847270427308902,-0.015517795434695503,2,my,"“Jadi rakyat perlu terus menyokong kerajaan BN yang mampu memperuntukkan wang berbilion ringgit untuk membangun dan menaik taraf hidup rakyat negara ini terutama Sarawak,” katanya."
0.011941072925327291,1.0446650939660191,1,sk,"V ňom ste rovnosť ľudí prirovnal k zákonnej možnosti získať vodičský preukaz, teda že je tu skupina občanov ktorá VP nemôže získať pre svoj vek, handicap alebo neznalosť, napriek tomu sú si pred zákonom rovní."
1.78701924335287,-0.01640727069883357,2,my,"Mereka yang ingin merasai citarasa lain bolehlah memilih antara campuran dari bahagian Cina, Jepun, Timur Tengah dan Barat. Ini termasuk Dim Sum, Sushi, Tempura, salads dan pastas."
0.18068992002052528,0.06102566272600302,2,my,"Lumur dua enggau lumur tiga pulai ngagai menyadi Era ak Dorina enggau menyadi Winnie ak Sangin mega nembiak sekula datai ari SK Ulu Paku, Undop ti mega udah ngemai sebuah mangkuk enggau perais ke bukai."
0.0075043167799078965,1.0885586779270249,1,sk,"""Jej rozhodnutím sa spätne upravuje povinnosť výrobcu a predajcu pre obdobie od januára do konca septembra tohto roka, čo komora považuje za veľmi zvláštny a nebezpečný precedens,"" uviedol hovorca SPPK Stanislav Nemec."
0.027969208151452304,1.3812077257137545,1,sk,"” Bajnai, ktorý sa má so svojím slovenským kolegom Robertom Ficom stretnúť 10. septembra, uviedol, že je veľmi potrebné rokovať o tom, ako uvoľniť napätie vytvorené „úplne zbytočne” Slovenskom, ktoré prijalo zákon o štátnom jazyku."
0.7064004584303024,-0.006031928545563027,2,my,"Selain ijazah sarjana, beliau juga memiliki Diploma Teknologi Bio dari Politeknik Singapura (SP) dan ijazah Sarjana Muda Sains (Biologi) dari Universiti Nasional Singapura (NUS)."
2.7624755796891205,-0.01493910365022401,2,my,"KTS group yang dikuasai keluarga itu, menguasai empat akhbar, iaitu akhbar berbahasa Inggeris Borneo Post yang mempunyai edaran tertinggi di Sarawak (86,000 sehari), Utusan Borneo (bahasa Melayu dan Iban), See Hua Daily News dan Oriental Daily."
0.01841188555010568,0.7470685182373072,1,sk,"Napriklad ak by EU bola v sucasnosti spickova vyskumna VS, pri ostatnych podmienkach nezmenenych tak nie len pre slovenskeho studenta by to malo minimalne dve zasadne vyhody."
1.8206615234962502,-0.015324304581122454,2,my,"""Saya rasa kami masih memiliki asas pengalaman yang telah berada di sini sejak empat atau lima tahun lalu dan memenangi banyak kejuaraan secara konsistennya,"" kata Ferdinand."
2.393958534566548,-0.02146253191706937,2,my,Jalaludin memegang watak IOP ASP Kamarul yang menyiasat satu kes pembunuhan seorang wanita yang bermotifkan dendam dan benci menerusi episod pertama siri tersebut yang berjudul 'Isteri Kedua'.
0.024742273989810114,0.9000914669855583,1,sk,"Ešte menej je to v troch severských krajinách (Nórsko, Švédsko, Fínsko), kde rozdiel v daňovom zaťažení podľa rodinného statusu je nižší ako 10 %."
1.6904310947419263,-0.014222014945481014,2,my,"Sementara itu, seorang lagi penduduk yang enggan namanya disiarkan turut melahirkan kebimbangan sama berikutan kewujudan pusat berkenaan telah menjadi tarikan kepada orang luar terutama warga asing Indonesia untuk berkunjung ke kawasan kampung mereka."
0.009645157261275784,1.4482196982907742,1,sk,"Okrem toho pozornosť venujú aj ceste R4 na sever od Prešova pri Svidníku, ktorá mala byť odovzdaná minulý rok, ale stále nie je v zodpovedajúcom stave."
0.009537620703934838,1.439614777172236,1,sk,"V budúcom akademickom roku plánuje fakulta prijať 650 študentov, pričom ich väčšiu časť bez prijímacej skúšky. Podľa Sováka sa to týka najmä chémie, fyziky a čiastočne aj matematiky. Prijímacie skúšky ešte ostávajú z biológie a geografie a hlavne v medziodborovom štúdiu prírodovedných predmetov, kombinovaných s filozofiou a psychológiou, čo je novinkou v študijných programoch."
1.7399936758169767,-0.015179146426712115,2,my,"Salahuddin yang juga anggota Parlimen Kubang Kerian berkata mereka (orang luar) tidak perlu campurtangan, dan biarlah rakyat Malaysia sendiri berjuang untuk keadilan jika berlaku ketidakadilan."
0.4666853426701867,-0.0037893433200040173,2,my,"Berkat dapat izin sebelum mengail PETUA kaki pancing Terengganu, Alwi Ali, 52, iaitu pastikan setiap kali keluar rumah untuk memancing ialah beritahu isteri atau keluarga, begitu juga majikan."
0.028735423998921147,1.4903805783477302,1,sk,Jej herecké majstrovstvo si STV pripomenie v nedeľu 31. januára o 15.50 h na Dvojke uvedením filmu Pomsta starej dámy alebo na každého raz dôjde.
0.01669464904541428,1.9646484182102661,1,sk,"""Je to majestátne neskutočné zviera, teším sa, keď znova prídem na Suchý vrch a budem si môcť zajazdiť, teraz je toho času naozaj málo."
0.00967853976244559,0.918126458058249,1,sk,"Bol si vynikajúci otec a hlava rodiny,“ spínala ruky k nebesám manželka Jána Popluhára Cecília, keď sme otvorili dvere na ich dome v Bernolákove."
0.012198310596751026,1.852807262801619,1,sk,"My sme chceli v rámci oficiálnych konzultácií vyjasniť, ako sa na to pozerajú jednotlivé vlády, ako môže maďarská vláda pomáhať takýmto snahám, keď s nimi súhlasí aj väčšinový národ i vláda danej krajiny."
1.3055560211196289,-0.010453042908489103,2,my,"Di Kapit, PRS akan bertanding di tiga kerusi iaitu N 56 Baleh (Masing), N 54 Pelagus (Stanley Nyitar) dan N 57 Belaga (Liwan Lagang)."
0.006431572327752417,0.9358823243933728,1,sk,"Oddelenie nemá podľa Pavla Hermana z Občianskeho združenia Zdravie deťom, ktoré sponzorský dar nemocnici odovzdalo, doposiaľ dostatok takýchto prístrojov. ""Nie je možné zabezpečiť taký počet zdravotných sestier, aby sledovali jedna ku jednej nedonosencov, preto bude prístroj pre nich veľkou pomocou,"" uviedol pre TASR Herman."
1.2144378908592923,-0.0039470017149543105,2,my,"Kumpulan pertama kapal pengangkut berkenaan tidak dijangka tiba di Kuwait sebelum hujung minggu ini, manakala seluruh pasukan itu dijangka menyeberangi sempadan ke Iraq hanya seawal 10 April."
0.017275105917541056,0.8070618260197501,1,sk,"Recesistická skupina „Interbluetken Group, a. s.“, ktorá „sa tiež považuje za nástupcu firmy Interblue Group a deklaruje záujem o lacné slovenské emisie“ prilákala len za prvé tri hodiny svojej existencie 200 ľudí."
2.314768449304432,-0.019723562055470337,2,my,"Apa yang menarik kumpulan doktor itu bukan sahaja menjalankan kajian, penyelidikan serta aktiviti menyelam, malah mengadakan projek komuniti masyarakat dengan menghulurkan bantuan dalam bentuk barangan makanan kepada penduduk yang tinggal di Pulau Mabul."
0.008944038391261193,1.3275096153715047,1,sk,"Pri pohľade na rozvoj biotechnológií alebo prvých aplikácií nanotechnológií v medicíne sa núka otázka, či v dohľadnom čase nebudeme schopní spomaliť, zastaviť alebo zvrátiť proces starnutia."
0.004692814287800258,0.6871536404698817,1,sk,Diskusia (2 príspevkov) Ty čo sa pokladáš za anjela strážneho Ty máš len jednu malú ranku a my všetci sme ju vyčítali z Tvojho textu!
2.384569981883387,-0.02056783874016955,2,my,Konvensyen Geneva mengatakan negara penakluk tidak boleh menggunakan hasil pendapatan negara yang ditakluk untuk pembangunan semula tetapi hanya untuk sesuatu yang bermanfaat kepada rakyat negara itu sendiri.
2.1510499235505276,-0.01906415528491994,2,my,"``Pandangan yang diperoleh daripada bahagian dipertimbangkan dan diambil kira segala aspek yang ada hubung kait dengan masa depan parti,'' katanya kepada pemberita selepas menerima kunjungan hormat rakan sejawatnya daripada Republik Czech, Pavel Mertlik."
2.0357292385598664,-0.017030544934976025,2,my,"Setelah tamat bon lima tahun dengan Persatuan Muhammdiyah Singapura yang membiayai kos pendidikannya itu, beliau membuat keputusan kembali ke universiti yang sama bulan ini."
0.007295339508688129,1.0969848918696143,1,sk,"V Japonsku miera štandardizovanej nezamestnanosti v septembri medzimesačne vzrástla o 0,2 percentuálneho bodu na 4 % a medziročne sa znížila o 0,2 percentuálneho bodu."
1.410082032153409,-0.012759100402079384,2,my,"Pengurus pasukan wushu Sarawak, William Kong berkata pihak Persekutuan Wushu dan Tarian Naga Sarawak (WFS) ternyata amat berbangga dengan anugerah yang diterima Ling sebagai penyuntik semangat kepada para atletnya."
3.977152988586686,-0.03333607215244309,2,my,Mohd Said berkata pusat hiburan yang bercambah dan ada yang beroperasi hingga ke pagi di bandar raya ini hanya akan meningkatkan masalah sosial di kalangan remaja tempatan memandangkan golongan itu yang ramai mengunjungi tempat tersebut berbanding pelancong asing.
1.3158182056366872,-0.011333118158672141,2,my,"Namun mereka gagal meneruskan rentak awal apabila juara Eropah lima kali itu kehilangan seorang pemain sebaik sahaja Babbel dibuang padang kerana menolak Luisao, yang membangkitkan kemarahan Babbel kerana satu kekasaran ke atas Fernando Torres."
0.004887175783306849,0.7448999309009013,1,sk,"Poslancov som oboznamil aj s obsahom listu hlavneho skolskeho inspektora o cinnostiach, ktore mesto vykonava v ramci udalosti, ktore sa v poslednom obdobi stali v gymnaziu."
1.5815025736322044,-0.0100303413168266,2,my,"SEMPENA sambutan Hari Ibu yang jatuh pada semalam iaitu 11 Mei, pelakon kacak Hans Isaac sempat berkongsi cerita tentang cara beliau meraikan ibunya bersama adik beradiknya yang lain."
0.00048809964351940343,0.07393601935236398,1,sk,""" Este kaplnka nebola postavena a Ondrej Cupka a jeho spolocnici uz kupili velky obraz Jezisa Krista s Janom Krstitelom v rieke Jordan a ine vybavenie."
0.01030453786926626,0.8472119570208538,1,sk,Séria prípravných duelov bude hustým sitom pre hráčov Žiliny Hráči Mestského hokejového klubu (MsHK) Garmin Žilina vykorčuľovali v pondelok o 11.00 h prvýkrát na ľadovú plochu svojej domovskej Garmin arény.
0.01161510760545128,1.730045629868598,1,sk,"Podľa Pavla Bojňanského zo Sekcie informatizácie spoločnosti SAV „je táto čiastka dostatočne vysoká, na druhej strane sa budeme snažiť hľadať aj ďalšie zdroje v štátnom rozpočte."
0.013013782522393316,1.3306843100576802,1,sk,Letectvo Veľkej Británie dopravilo na Slovensko asi 1650 kilogramov zdravotníckeho a spojovacieho materiálu a americké letectvo dopravilo na povstalecké územie asi 24 ton vojenského materiálu.
2.6095759854231946,-0.022886288384935918,2,my,Perhimpunan aman yang diadakan di hadapan kolej tersebut adalah disebabkan terdapat calon yang tidak sah mendiami kolej tersebut dan dipercayai wujud campur tangan dari orang berpengaruh dalam proses perjalanan pilihan raya kampus.
0.007306256269468074,1.069667674182437,1,sk,"Až vlani som zatúžil po tichšom prostredí a presťahoval som sa do mesta Grand Forks v Severnej Dakote, kde je našťastie iba jedna nemocnica."
0.014096013142554492,1.555079883075529,1,sk,"Na dôkladnú ochranu by mali dbať aj tínedžeri, koža dozrieva až okolo 18. roku života, dovtedy je zvlášť citlivá. Okrem prevencie spálenia by si mali pravidelne kontrolovať pokožku celého tela."
1.4593245774451924,-0.011965585957570168,2,my,"'Beliau memang ada melabur dalam emas... itu pelaburan jangka panjangnya. Ia tiada kaitan langsung dengan kes ini. Cerita Wati bawa jongkong emas, wang tunai RM4 juta ketika hilang di Banting, itu semua cerita karut."
2.1680192878045212,-0.017443814569826264,2,my,Ia terdiri di atas sebuah bukit dan jauh di bawah ialah sebuah kuil berumur ratusan tahun yang dikatakan dibina pada suatu malam oleh dewa Hindu.
0.006148694702551385,0.16121086976948548,1,sk,"S nádejou budem dúfať vo vľúdne prijatie filmu,“ hovorí Jan Hřebejk, ktorý hlavné mužské postavy vo filme zveril trojici slovenských hercov Martinovi Hubovi, Ladislavovi Chudíkovi a Milanovi Mikulčíkovi."
1.9134735516479255,-0.01704723667758111,2,my,Kelas selama sehari itu akan diadakan pada pertengahan bulan depan untuk membolehkan kaum wanita membuat sabun sendiri berdasarkan keperluan keluarga. Contohnya sabun bunga lavender untuk menenangkan dan menyegarkan kulit badan selain daripada baunya yang harum.
0.006940124501444535,1.0523072583091742,1,sk,"Teraz už bývalý dlhoročný hráč Denveru strelil v zápase proti Milwaukee 27 bodov a preukázal, že mužstvo má teraz popri Stoudemirovi druhého vynikajúceho strelca, čo sa prejavilo najmä po vyfaulovaní jeho podkošového kolegu."
0.005548768037624424,0.8394661112583696,1,sk,"Účastníci podujatia sa v štyroch sekciách venujú problematike hydrológie vodných tokov a nádrží, diskutujú o kvalite vôd, prevencii povodní i katastrôf súvisiacich so zamorením vodných tokov, ako aj zdravotníckych aspektoch vodného hospodárstva."
0.01142817192411676,1.3230854090284532,1,sk,"Vo vede sa totiz pracuje istou metodologiou, ktora je dizajnovana tak, aby prinasala take poznanie, ktore sa s najvacsou moznou (znamou) mierou pravdepodobnosti priblizuje k realite."
0.007200353683064491,1.0826593306350363,1,sk,"Takže B mužstvo sa tvorilo počas celej súťaže a sformovalo sa vlastne až v septembri, keď v jesennom prestupovom čase prišiel z Veličnej tvorca hry Roman Sučák."
0.002196748672736287,0.33793728605317586,1,sk,"Samostatné sekcie boli poskytnuté aj samotnej STV, videoarchívu, spravodajstvu a sekciám Jednotky a Dvojky, ktoré potvrdzujú záujem STV deklarovať rovnocennosť a samostatnosť týchto dvoch kanálov."
0.010344383775190485,1.5439296135540936,1,sk,"Svoj nápad o internetovom predaji postavil s firmou ShopGuru.cz úspešne na nohy a za Atlantikom zaobstaráva rozličný tovar, najmä však elektroniku, ktorý dováža a predáva v Česku a na Slovensku."
0.004717165373233763,0.7288401746001313,1,sk,"Keď sme však prišli k rieke, uvideli sme, že dané tabule informovali o zákaze lovu žiab, čo je miestna špecialita,“ priblížil nám námestovský dobrodruh zážitky z cesty."
0.002062456470467467,0.2988191328563591,1,sk,"S láskou spomína manželka a synovia s rodinami Mal som vás všetkých rád a chcel som ešte žiť, ale prišla tá chvíľa, keď musel som vás opustiť."
0.01229099852246251,1.8729737750673328,1,sk,"Pred časom sa mi ozvali z televízie, že by chceli pripraviť nejakú reláciu pro príležitosti mojich šesťdesiatín s tým, že hudobné aranžmány by mal na starosti Petr Malásek."
0.025292308680623144,1.2927868596845185,1,sk,"Černovská tragédia z roku 1907, keď polícia strieľala do davu a zomrelo 15 ľudí, aj keď sa nedá oddeliť od mocenských pomerov doby, bola len do malej miery súčasťou národnostnej politiky."
0.037794754347289475,2.1316336554245465,1,sk,V objekte mestskej trznice na namesti v Brezne sarapatil ktosi v drevenom predajnom stanku majitela K. J. Stalo sa to v noci z 21. na 22. aprila a zlodej si odtial odniesol rozny textilny tovar za 100 000 korun.
0.01139213774300122,1.7456909613627405,1,sk,"Európska dvojka easyJet štartoval síce s heslom letenka za cenu džínsov, no tvrdí, že je výhodné lietať aj na hlavné letiská a niekoľkokrát denne, aby oslovil aj silnú biznis klientelu z klasických aerolínií."
0.007821430235286473,1.180610030824754,1,sk,"V Novej Bani zije relativne silna komunita mladych ludi, ktorym na meste naozaj zalezi a ktori nastastie nebudu vzdy drzat hubu a krok, ale dokazu sa vyjadrit."
0.012634220055544598,1.9216213109424976,1,sk,"Prístav na Bodrogu v dedinke Ladmovce je jediný ekonomicky využiteľný prístav na východnom Slovensku a napriek tomu, že bol vybudovaný asi pred pätnástimi rokmi, nebol doteraz komerčne využívaný."
2.199890090254365,-0.01615672649426407,2,my,"Kawasan pameran seluas 1,500 meter persegi itu juga akan mengetengahkan kisah pahlawan legenda yang hasil daya inovasi, kepakaran teknologi dan kreativiti budayanya memberikan beliau reputasi sebagai salah seorang pemimpin agung dunia yang paling disalah tanggap."
0.01142770718816368,1.709556967645996,1,sk,"Tuzite po pokoji a samote, v pritomnosti ludi sa citite vycerpany, preto sa radsej vyhnite akejkolvek diskusii na temy, ktore nie su vasou silnou strankou."
0.47477275665499985,-0.0017534666668397117,2,my,Susulan kes Khamis lepas telah membawa kepada tangkapan kedua apabila polis berjaya memberkas dua lelaki selepas mereka dipercayai cuba mengedar ganja seberat 376 gram.
0.00548114098996849,0.5258890095827894,1,sk,"Nezisková organizácia Oáza – nádej pre nový život v Bernátovciach pri spaľovni prevádzkuje útulok s trvalou kapacitou 40 miest, ktorá je v zimných mesiacoch dočasne zvýšená."
0.00507818628371852,0.2575683241622808,1,sk,2005 / číslo 36 Kotva II už otvorená V prvý septembrový deň otvorilo svoje brány zariadenie dočasného bývanie pre ľudí v núdzi Kotva II.
1.204626305494795,-0.010449769620894304,2,my,Seramai 38 artis dan penggiat seni menerima tawaran dari Universiti Utara Malaysia (UUM) untuk menyambung pelajaran secara luar kampus peringkat Ijazah Sarjana Muda.UUM menawarkan dua bidang pengajian iaitu Komunikasi dan Pengurusan Hal Ehwal Antarabangsa.
3.7892257562111675,-0.02550783153674625,2,my,"Setelah berjaya ditarik keluar, beliau yang turut menerima 10 jahitan di dagu, bertanya di mana kakaknya yang juga turut dirawat di hospital itu, tetapi abang iparnya memberitahu bahawa beliau selamat dan hanya calarcalar di badan."
0.009079668685910999,0.8233814486080684,1,sk,"V tomto roku očakávame prírastok v podobe Rádia Prešov a otvorená je aj existencia ružomberského Rádia Ruža, ktoré si už našlo frekvenciu, ale zatiaľ nepožiadalo o licenciu."
1.7593786831482585,-0.01631290554885365,2,my,"Sehubungan itu, Pemuda MCA menggesa Kementerian Pengajian Tinggi membuat pembetulan secepat mungkin dan menjemput pengkaji sejarah yang berbilang kaum untuk memeriksa isi kandungan dan fakta sejarah."
0.00770740005351188,1.163495536628021,1,sk,"Pani profesorka Kissová sa zvlášť zmienila o výhodách štúdia slovenčiny, vyzdvihla čoraz väčšiu potrebu znalosti jazykov stredoeurópskych národov, ktorú vyžadujú na trhu práce popri svetových jazykoch."
1.5378566114421837,-0.012833960037681587,2,my,"""Pada suatu masa, Barbie terlalu bernilai memandangkan ia hanya dihasilkan untuk tujuan eksport. Lagipun, kami tidak mampu untuk memiliki patung yang kosnya lebih tinggi daripada gaji kami,"" kata Chou."
0.0206297289341572,2.550459083683578,1,sk,"Mení sa minimálna mzda aj výška preddavkov na zdravotné poistenie Minimálna mesačná mzda, ktorú môžu platiť zamestnávatelia svojim zamestnancom, sa od dnešného dňa zvyšuje na 295,50 eura (8902,23 Sk)."
0.011774698218913112,1.7703335745619735,1,sk,"Ale ten úžasný pocit o pol hodiny neskôr, keď sa posledný člen výpravy odopína z lana a my sa objímame, že sme to zvládli, stojí za to."
