x1,x2,label,lang,texts
0.01757241665691294,1.2216316209994083,1,sk,"USD Medzi zmluvami je aj predbežná dohoda medzi ruskou firmou Gazprom, ktorá má monopol na export plynu, a spoločnosťou China National Petroleum Corp o dodávkach plynu."
1.7581178328138216,-0.01511565645519589,2,my,"Sebagai anak Johor, kerana kecemerlangan akademik dan kepimpinan rendah serta menengah, saya memperolehi biasiswa Dato' Onn semasa menuntut di English College dan Sekolah Agama Rakyat di Johor."
0.006324178609693099,0.9467344149813481,1,sk,"No a pre našich bol asi väčší šok, keď som v puberte začala na internete opisovať svoje sexuálne príhody a vydala knižku o sexuálnom živote."
0.01666326958567608,1.9138359068799486,1,sk,"Okrem toho vinit za rozpad svojich troch manzelstiev svokry a podobne s tym, ze on sam nikdy za nic nemoze a chyby zasadne nerobi, je fakt len na smiech a poklopanie si na celo."
0.006372978513142572,0.9143605341793137,1,sk,"""Andrej musí doriešiť nejaké technické záležitosti v klube, absolvovať lekársku prehliadku, jeho príchod do Európy sa dorieši v najbližších dňoch,"" povedal pre szlh.sk generálny manažér Peter Bondra."
0.01283377133758858,0.9348567736833379,1,sk,"Na svojom konte má viac ako 60 filmov, medzi jeho najznámejšie snímky patria I soliti ignoti (1958), Moji priatelia (1975) alebo La grande guerra (1959)."
0.006123924947305448,0.3732687501320068,1,sk,"Gyurcsány si dal tajným hlasovaním v parlamente potvrdiť súhlas s rozsiahlymi ekonomickými reformami, akými je zníženie obrovského rozpočtového deficitu a transformácia neefektívneho verejného sektora."
2.141399909509812,-0.014933658629299946,2,my,"Setelah anda menentukan misalnya 10 pasaran berpotensi bagi produk/khidmat anda, langkah selanjutnya ialah melakukan pemantauan pasaran untuk menentukan sekitaran politik (pengawalaturan pemerintah) , ekonomi (kuasa membeli pengguna dan kos operasi), sosial (makroekonomi yang boleh menjejas keperluan pengguna dan saiz pasaran) dan teknologi (PEST)."
1.496594548096252,-0.013486971470326401,2,my,"Borang penamaan calon yang pertama diterima oleh pihak pengurus pilihan raya daripada calon BN pada jam 9.05 pagi, dicadangkan oleh Apong Midok dan disokong oleh Voon Boo Shin."
0.007579736421433078,1.152175440015226,1,sk,"""Chcel by som zdôrazniť, že portugalská vláda a Portugalsko nepožiada o žiadnu pomoc alebo finančnú podporu z jednoduchého dôvodu, že to nie je potrebné,"" vyhlásil Socrates."
0.01705789585527627,2.0409753532983435,1,sk,"Pán Rozboril, prečo ste si to neoverili na sociálnom úrade, prečo ste nespomenuli, že pani Matejová dostáva finančný príspevok na pohonné hmoty, aby mohla chodiť do nemocnice."
0.009340177098729948,1.4027833702421924,1,sk,"Nepríjemným prekvapením však bolo, keď deň pred dnešným pohrebom (teda včera) prišiel Cigánskym diablom mail od detí zosnulého huslistu, aby sa na pohreb neunúvali."
2.9493214114465554,-0.02516686546701428,2,my,"Ini merupakan satu penghargaan yang tinggi terhadap diri saya selepas menerima gelaran selaku Pemain Paling Berharga Belanda.Memandangkan kami mempunyai barisan pemain yang mantap kali ini, saya sudah tidak sabar untuk beraksi pada Piala Dunia di Afrika Selatan nanti, jelas Sneijder."
0.013021942104667387,1.9310594399160481,1,sk,"Ľudia podľa neho ostávajú aj v dedinách. Obce poskytujú obyvateľom pozemky na nové domy za symbolickú sumu. Z mesta na vidiek odchádzajú skôr bohatí ľudia. „Chudobnejší zasa idú do mesta za robotou,“ tvrdí M. Bačík."
1.4382982171677547,-0.011321614300789686,2,my,"Di bawah bimbingan ketua jurulatih asing pertama, Marius Johan Ooft dari Belanda, Jepun meraih Piala Asia 1992 untuk kali pertama di Hiroshima sekali gus mencipta kejayaan dengan pengenalan liga profesional pertama, tahun berikutnya."
1.0153845370371317,0.0011760380721571114,2,my,"Pembabitan Ahmad Nazri selama 10 tahun sebagai Pengarang Kumpulan mencetuskan kelahiran akhbar tabloid sukan, Jaguh pada 8 Ogos 1989 yang mempunyai 16 muka surat."
2.8589069720319396,-0.008619561294373457,2,my,"Mengikut tuduhan pertama, Mude dan Bahrin didakwa dengan niat bersama meminta suapan RM5,000 daripada Mohd Nasir Idris melalui Norizam Raibul sebagai dorongan tidak mengambil tindakan ke atas Mohd Nasir, Shahizan Che Azlan dan Che Syahid Che Azlan yang disyaki memiliki barangan curi pada jam 4.45 petang, di pejabat Jabatan Siasatan Jenayah (JSJ) Ibu Pejabat Polis Daerah (IPD) Kota Bharu, Jalan Sultan Ibrahim, pada 20 Ogos 2008."
1.841072974857449,-0.012099395680307622,2,my,"Mangsa juga hanya dibekalkan dengan sebuku roti untuk setiap dua minggu dan terpaksa minum air paip dalam bilik kecil yang dilengkapi tandas. Malah, mereka turut dijadikan seperti hamba apabila dirotan jika cuba merayu, membuat bising atau meninggikan suara."
0.00243629295021758,0.3498402499047962,1,sk,"Hoci prva pisomna zmienka je datovana rokom 1622, uz v roku 1607 sem stat presidlil sedem talianskych rodin, aby palenim uhlia zabezpecovali prevadzku zeleziarne v Hronci."
0.010125714340609883,0.9751242744682947,1,sk,"Dochodcovia si nan zaspominali na Mikulasskom stretnuti, pri druznej besede hovorili o zvykoch a obycajoch dodrziavanych v obci, ktore su pre dnesnu mladu generaciu takmer nezname."
0.4996926092659888,0.006359094161199063,2,my,"“Bagi tahun 2011, SEDC akan meneruskan pembangunan projek baru seperti penambahan Kampung Budaya Sarawak, Pemanjangan Fasa Kedua Tebingan Kuching, Medan Niaga Damai serta menaik taraf Damai Golf and Country Club,” katanya."
0.010571623308645462,1.6011753941779223,1,sk,"Intel ako príklad uvádza desktopové procesory s kódovým označením Lynnfield, ktoré patria do rodiny Intel Core. V závislosti na prevedení ich bude možné nájsť v segmente Core i5 ako aj v Core i7. Mobilné procesory Clarksfield budú patriť do najvyššej triedy Core i7."
0.02734426006146414,1.7144337432471242,1,sk,"Program organizácie Habitat for Humanity je otvorený pre všetkých sociálne slabších Američanov, ktorí sa okrem iného musia zúčastniť kurzu o hospodárení s vlastnými prostriedkami, otvoriť si bankový účet a osobne sa zapojiť do výstavby vlastného domu."
0.047557644609269256,2.951140277367222,1,sk,"Akcia oficiálne trvala do druhej hodiny a kto chcel, mohol sa potom presunúť na after párty do Budha baru na Medenej ulici, alebo napríklad do spriateleného klubu Spojka o kúsok ďalej na Prešernovu."
0.0045839688756379535,0.693027069629176,1,sk,"Partner vášho portfólia Články autora / Lukáš Kočišek Fun Radio bude od septembra prízvukovať, že je „fun“ Fun Radio od septembra z dôvodu ďalšieho posilňovania značky podstúpi kompletný renaming svojich relácií."
2.4234177307664577,-0.019802761734372714,2,my,"""Kita tidak mendapat maklumat mengenai penangguhan itu, jadi kita akan teruskan operasi terminal seperti yang telah diarahkan oleh kerajaan iaitu 1 Jan ini,"" katanya selepas lawatan media ke terminal itu di sini, Khamis."
0.02841113033428724,3.7849701915099554,1,sk,"Spomeňme ešte dve dôležité tlačidlá – jedným sa kompletne vypína stabilizačný systém VDC a druhé s nápisom WET slúži na aktivovanie režimu pre jazdu v daždi. Ako ste si určite domysleli, jeho úlohou je krotiť výkon a pomáhať vodičovi udržať auto na ceste. Robí to spôsobom, že motor nepustí cez 3000 otáčok 1/min a systém VDC preladí do veľmi konzervatívneho režimu. V športovom režime VDC vodičovi naopak dáva trochu voľnosti a dovolí mu aj malý „oversteer“. Zasahuje až keď dochádza k výraznejšiemu pretočeniu zadnej časti auta."
3.0811906948916805,-0.0275694268304861,2,my,Tujuan persidangan ini diadakan adalah untuk merealisasikan road map yang digubal oleh Washington dan konconya.Road map yang mempunyai 3 peringkat ini bermatlamatkan untuk mewujudkan negara Palestin yang merdeka.
1.537188379826687,-0.013231707478495449,2,my,"Malah Pengerusi Ketua Staf Bersama AS, Jeneral Richard Myers mengatakan adalah silap sekiranya ada yang menganggap perang ini akan berlaku dengan cepat dan mudah."
2.3307639629583257,-0.02053446922956629,2,my,Anggota Parlimen Rembau itu berkata isu berkenaan amat sensitif dan begitu menyakitkan berikutan masih ramai lagi rakyat negara ini yang masih punya ingatan utuh terhadap zaman komunis yang begitu ganas. BERNAMA
0.010093474732729086,0.6254886772786884,1,sk,"Študijná skupina číslo 16 Medzinárodnej telekomunikačnej únie (MTÚ), technického štandardizačného orgánu Organizácie Spojených národov so sídlom vo švajčiarskej Ženeve, sa technológiou 56K zaoberá od marca 1997."
1.439759292106925,-0.012413305710663401,2,my,Tekanan yang diberikan itu menyebabkan ramai menjangka Syria akan menjadi sasaran selepas Iraq memandangkan AS sebelum ini menggunakan helah sama untuk menggulingkan rejim Saddam Hussein.
0.9142930434996431,-0.0008065132445051306,2,my,"Malangnya, kata beliau, meskipun perintah injunksi itu telah dikeluarkan sejak 25 Mei lalu, namun sub kontraktor terbabit tetap berdegil malah keadaan menjadi lebih teruk apabila bekalan air ke kawasan itu sengaja dipotong Ramadan lalu."
0.0006926057492136676,0.09621319886419566,1,sk,"S láskou a úctou spomínajú mama, sestra, dcéry a vnučka Alicka „Bez teba hviezdy nesvietia, len bolesť padá z neba, kamkoľvek nám oči padnú, vidíme len teba."
0.010146463638540135,1.524915729316199,1,sk,"Už pri nacvičovaní prvého súťažného tanca mu dala jasne najavo, že na parkete velí ona a je úplne jedno o koľko je Roman starší a skúsenejší."
0.007472760675250476,1.1203167709138997,1,sk,"Kto by bol tušil, že s Adyho knihou môžu byť nejaké problémy aj bezmála šesť desaťročí po jeho smrti, keď ich ľudia vyrobili dokonca ponad hranice, ktoré za jeho života nejestvovali."
0.0005444283516012546,0.07410130324696465,1,sk,Irán hrá zásadnú úlohu v irackých záležitostiach a má moc ovplyvňovať politický osud svojho suseda prostredníctvom svojich hlbokých vzťahov s hlavnými šiitskými frakciami v Iraku.
2.2444138460947087,-0.01831861431702878,2,my,"Tidak lengkap rasanya kunjungan ke Jogjakarta jika tidak sampai ke Candi Borobudur. Walaupun hakikatnya ia terletak dalam wilayah lain, candi ini ibarat ikon pelaris yang kuat memanggil pelancong yang sampai ke Jawa Tengah."
0.00395335072652495,0.584356652673591,1,sk,"O mimoškolskú činnosť žiakov sa stará organizácia s názvom Nezbedníci (Gézengúzok), ktorá v záujme užitočného využívania voľného času ponúka hlavne športové programy, alebo remeselnícke dielne."
0.004254252324728058,0.6379343031885681,1,sk,AZZZ nie je spokojná s návrhom novely Zákonníka práce Asociácia zamestnávateľských zväzov a združení SR (AZZZ) nie je spokojná s výsledkom pondelkového rokovania tripartity o zmenách v Zákonníku práce.
2.4915577404077704,-0.021084171014469577,2,my,"Garcia, yang memenangi pingat perak pada Kejohanan Dunia di Seville tahun lalu, pernah melakukan catatan peribadinya 13.07s tahun lalu dan menyedari bahawa dia perlu menyamai catatan itu jika berhasrat untuk memenangi pingat emas hari ini."
0.0072197817998898225,1.1176345110093253,1,sk,"Stratégiu preto vedci postavili na tom, že keď dokážu vylučovať IL2 blízko tumorov, rakovinové bunky tým nadobudnú štatút hrozby, čo v ich okolí spustí imunitnú reakciu."
0.027382422040454595,0.7018300063167262,1,sk,Dalsiu noc – z nedele na pondelok 19. marca ktosi poskodil sklenu vypln autobusu nezistenym predmetom priamo v areali SAD v Brezne a pripravil tento podnik o 30 000 korun.
0.019194627632866352,2.31856193669938,1,sk,"A popri tom všetkom si predstavuje, ako na ten svah od terasy zaseje trávu, ako z tých tehál postaví krajší plot a ako sa na tej šmykľavke spustí jeho dieťa."
0.007746883880233445,0.44902548483501337,1,sk,"2007 / Radoslav Augustín Špeciálne K veci, prosím prepadlo Poisťovňa šťastia je pre Markízu naozaj zárukou dobrých čísel, posledné tri epizódy neklesli pod 38 % podiel."
0.8885034641984375,-0.003962687427751581,2,my,"Seorang lagi daripada 60 peserta kursus sarjana muda tersebut, Cik Nor Azleen Suhardjono, mampu membuktikan bahawa latar belakang keluarga yang serba kekurangan bukan penghalang mengejar kejayaan."
0.0015148842425726952,0.2025304745070179,1,sk,"Podľa komerčného riaditeľa firmy Mariána Šinkoviča slabšia kúpyschopnosť obyvateľstva v minulom roku AB Kozmetiku skôr zvýhodnila, pretože zákazníci uprednostňovali jej výrobky pred drahšími zahraničnými."
1.4210592576061043,-0.012025631603734049,2,my,"Seorang lagi penduduk, P Arumugam, 59, yakin calon BN pada pilihan raya kecil kali ini mampu menyelesaikan masalah sebahagian besar penduduk yang tidak memiliki geran tanah."
0.008772486277874837,1.338264809054717,1,sk,"Mimochodom, ide o priam až zanedbateľný zlomok z rozpočtu (priznám sa, že presné čísla neviem, ale určite to nie je veľa), vďaka čomu máme garanciu podpory umeleckej a kultúrnej zložky spoločnosti."
2.777551597155222,-0.0177138998443662,2,my,"Kebetulan pertemuan ini berlangsung ketika Chef Wan baru saja pulang dari seberang setelah menghadiri upacara penganugerahan pingat kebesaran Ahli Mangku Negoro Pakubuwono dari Susuhunan Mangku Negoro Pakubuwono yang ke 9 di Istana Karaton, Surakarta Hadiningrat di Jawa yang berlangsung pada 26 Julai."
0.8435474602858504,0.01970591385012028,2,my,"Perdana Menteri, Datuk Seri Najib Tun Razak juga mengumumkan peruntukan RM10 juta untuk Tabung Pembangunan Bola Sepak bagi meningkatkan kualiti sukan nombor satu negara itu sehingga ke peringkat akar umbi."
0.01221619377702433,1.5920197750840035,1,sk,"Lenže to, ako sa Merkelovej podarilo odtiahnuť od Helmuta Kohla, je dnes sen, ktorý sa zjavuje Ivete Radičovej a nočná mora, ktorá máta Mikuláša Dzurindu."
0.015182736713833783,2.3210337676655137,1,sk,"Cameron aj Sarkozy zároveň upozornili na súvislosť situácie v Líbyi a Sýrii. Sarkozy vyhlásil, že venuje svoju cestu do Líbye všetkým, ktorí veria v slobodnú Sýriu. ""Je to chvíľa, kedy sa arabská jar môže stať arabským letom a vidíme postup demokracie v ostatných krajinách,"" uviedol Cameron."
1.2596432020794643,-0.009753167724523542,2,my,Sukuk Global dapat langganan lebih AS$6 bilion SUKUK Global Malaysia dikenali sebagai ‘Emas’ yang dilancarkan pada 19 Mei lalu mendapat sambutan memberangsangkan dengan menyaksikan saiz terbitannya ditingkatkan kepada AS$1.
2.6795864427679654,-0.02315206929116502,2,my,"“Tetapi apa yang berlaku sekarang adalah partinya kalah beberapa kerusi senat kerana tidak mampu membawa perubahan yang dijanjikan,” katanya sambil menambah tidak mustahil Obama boleh kalah dalam pertandingan kerusi presiden yang akan datang."
0.004624739652976722,0.6683119528411647,1,sk,"""Za nejakých sto dní bude euro v našich vreckách, stane sa našimi peniazmi,"" povedal pri príležitosti uvedenia novej meny prezident ECB Willem E. Duisenberg."
1.2789240621991038,-0.011069371407360645,2,my,"“Untuk lembangan Sarawak, kita sudah membentuk sebuah jawatankuasa yang diterajui oleh saya bersama Datuk Amar Abang Johari Tun Abang Openg…saya berharap dapat mengadakan mesyuarat secepat mungkin berkaitan pelaksanaan pembangunan tersebut,” katanya."
1.525996907169248,-0.009801029535856293,2,my,"Tidak dinafikan, di awal perjalanan program Mentor musim ketiga ini, kredibiliti Mas Idayu yang dipilih sebagai salah seorang mentor pernah 'dipertikaikan' oleh sesetengah pihak."
0.008802020794304923,1.3244254261702844,1,sk,"Získala ju však vo februári trojica koaličných poslancov, ktorí v novele o priestupkoch presadili, aby poslanci, ktorí sa stanú účastníkmi dopravnej nehody, nemohli beztrestne odmietnuť skúšku na alkohol."
0.012746758056159033,1.9388599193075815,1,sk,"“Ukázalo sa, že medzi hoteliermi a majiteľmi reštaurácií je záujem o prezentáciu svojej práce, ale aj o to druhé – chuť pozrieť sa pod pokrievku konkurencie."
0.011341209309091946,1.7348549242066325,1,sk,"Finančný riaditeľ spoločnosti Milan Čajka uvádza, že cieľom je najmä diverzifikácia obchodného portfólia, keďže Tesla sa v minulých rokoch orientovala najmä na niekoľko koncernov z oblasti telekomunikácií."
0.9512488370693777,0.04051356870359774,2,my,"Bapa mentua Mek Ani, Tuan Soh yang juga penghulu kampung, cuba mengambil kesempatan mencabul Mek Ani. Bersama kawan baiknya, Wan Yoh, Mek Ani berpindah ke kampung lain memulakan penghidupan baru."
1.8500995870334893,-0.01567645184716949,2,my,"“Sehubungan itu, kita menggesa kerajaan khususnya Jabatan Perhutanan memudahkan prosedur yang ada bagi menggalakkan rakyat tempatan melabur di negeri sendiri seterusnya meningkatkan pengeluaran produk ini,” katanya kepada Utusan Borneo semalam."
1.6454266401447806,-0.014004530069725518,2,my,Dalam beberapa hari kebelakangan tentera AS dan Britain menghadapi tentangan sengit di luar jangkaan daripada askar dan pasukan separuh tentera Iraq sehingga menyebabkan kemaraan mereka ke Baghdad tergendala.
0.013574144956874807,1.454819486971067,1,sk,"Schusterov lekár sa z kómy už nepreberie Primár František Fabián, ktorý v roku 2000 operoval Rudolfa Schustera, za čo si od bývalého ministra zdravotníctva Tibora Šagáta „vyslúžil“ trestné oznámenie, sa z kómy už nepreberie."
0.8174029121245825,-0.004939343210239604,2,my,"Tahun ini, saluran HISTORY (AETN All Asia Networks) di Astro 555 akan menyiarkan sebuah dokumentari istimewa selama sejam berjudul ‘In Memory of The Highland Towers Disaster’."
1.1333266194042462,-0.010501078957341214,2,my,"Antara yang memberikan sumbangan ialah penerbit filem Hajjah Ruhani Abdul Rahman, Habsah Hassan, Rubiah Suparman, Syanie Hisham, Jalaluddin Hassan, Rosyam Nor, Ziela Jalil, Deja Moss, Rahimah Rahim, Noniswara, Nash Lefthanded, Helmi Gimmick, Zaibo, Imuda, Salwa Abdul Rahman dan Yusni Jaafar."
0.011308486619838487,1.1402606426558093,1,sk,"Markušovi Matičiari neveria, predsedom je Tkáč Vo vašom prehliadači chýba flash player, ktorý treba k prehratiu videa kliknite a nainštalujte si ho Ďalšie videá nájdete na tv."
1.3978526509365827,-0.009172026467455867,2,my,"Katanya pihaknya menerima emel berhubung caj RM5 kepada setiap kontena mulai 2 Jan ini daripada MCDA dua minggu lepas dan selepas bermesyuarat, kesemua 30 anggota AMH tidak bersetuju dengan perkara itu."
2.52214111555277,-0.019507778614999968,2,my,Lelaki dan wanita Arab sudah lama menjadikan Lubnan sebagai pusat mereka menjalani pembedahan kosmetik tetapi menjarakkan diri selepas pergolakan politik dan keganasan selama empat tahun antara 2005 dan 2008 yang menggegarkan negara itu.
0.008366627763857375,1.2492465134306088,1,sk,"Manažéri firiem, ktoré sa uchádzali o výstavbu prvých osem kilometrov diaľnice Mengusovce – Jánovce, našli po sviatkoch na stole rozhodnutie úradu obsahujúce dôkazy kartelového postupu."
1.882278548212372,-0.014883065139173526,2,my,"Antara tawaran yang besar termasuklah pembabitannya dalam filem Inggeris, Prince Of The City, berlakon di samping aktor Michael Madsen, yang popular dari filem Hollywood, Kill Bill."
0.012288312210402155,1.8549685326446506,1,sk,"Okrem liečivých účinkov – pomáha pri zápaloch priedušiek, odstraňuje plynatosť a lieči koliku, sa používa aj na dochutenie chleba, syrov, kapusty, polievok a známy je aj rascový likér."
2.1958099628576924,-0.008764305343088918,2,my,"Bagaimanapun, menurut sepasukan pakar gempa bumi yang berada di situ, gegaran pada 2009 tidak memberi kesan dalam mengurangkan ketegangan yang sudah terbina selama 200 tahun."
1.9782081975556662,-0.016147647993719812,2,my,Aksi cemerlang mereka sepanjang siri perlawanan persahabatan skuad Olimpik di Slovakia ketika ini telah menarik minat kelab yang menjadi lokasi pangkalan skuad negara sepanjang sebulan di sana.
0.010500845598043564,0.8822958890319497,1,sk,"Kým bežne sa zo 100 kg hrozna získa 70 litrov muštu, Dal Forno získava pre Valpolicella 32 litrov muštu a pre Amarone len 16 litrov."
0.009252880575223204,1.378846780329717,1,sk,"Voľný verš Imricha Fuhla charakterizuje dikcia hovorového slovenského jazyka a funkčné presahy, ktoré sa viažu na významy básnických obrazov a figúr rozložených do dvoch alebo viacerých riadkov."
0.012452743077244945,1.3353088838460438,1,sk,"Už vtedy, keď som mal možnosť ako predjazdec absolvovať trať etáp ešte na suchom podklade, som si uvedomil, že chlapcov čaká jedna z najťažších súťaží."
1.5180538455955357,-0.012078194848983339,2,my,"Merujuk kepada PRS, Taib berkata beliau tidak menjangka sebarang masalah dalam parti komponen BN paling muda itu akan bertambah buruk, ekoran pelantikan semula Dr Masing pada Persidangan Tiga Tahun sekali (TDC) di Sibu semalam."
2.7376135651085565,-0.020515203813589497,2,my,"PROGRAM yang dikategorikan realiti sudah terlalu banyak diterbitkan di Malaysia dan inovasi ini akan terus berlaku dari semasa ke semasa, bergantung kepada evolusi yang dikembangkan daripada penerbitan terdahulu."
3.3822817228114452,-0.02479895609836254,2,my,"“Konsep negara berkebajikan PAS pasti seperti yang mereka laksanakan di Kelantan. Apa yang PAS sudah laksanakan di negeri itu selepas memerintah selama 20 tahun? Kenyataan itu cukup melampau dan bukan berlandaskan niat baik,” katanya."
0.007987285349786924,1.1859112773660494,1,sk,"Spoznáme aj obetavého doktora Rotha, ktorý dokáže zachrániť takmer zázrakom dieťa pred udusením a po rokoch sa vracia do rodiska už iba ako memento vyvraždenej židovskej rodiny."
0.022443984106013625,1.54936765076491,1,sk,"Bankový úver na prvú linku už MPC splatilo, na konci minulého roku ešte evidovali dlhodobý záväzok 20,5 mil. Sk za poslednú veľkú investíciu firmy."
0.009287437471085194,1.399833186843289,1,sk,"Napokon mnohí ešte máme v živej pamäti minuloročný atak na obchodné centrá Carrefour na Slovensku, ktoré nakupujúci vzali doslova útokom v takzvanom výpredaji storočia."
1.6421423249671678,-0.013381069424358471,2,my,"Auditorium ini dibina bersambung dengan laluan pejalan kaki dan kedai komersial di aras bawah tanah, sekali gus mengurangkan kehadiran kenderaan di kawasan tersebut khususnya semasa sesuatu majlis berlangsung."
1.3659687801692235,-0.01167595814241347,2,my,"“Sehubungan itu, sekiranya mereka (pelumba) berhasrat untuk menjadikan sukan permotoran ini sebagai kerjaya, maka mereka perlu memiliki lesen AAM untuk bertanding ke peringkat lebih tinggi,” katanya kepada pemberita semalam."
1.2141295858016674,-0.010324963487659718,2,my,"Komander keselamatan Taliban bagi wilayah Khost, Qari Niamatullah Sabri memberitahu akhbar The News bahawa mereka telah ditahan di Khost, Gardez dan bandar utama wilayah Paktia kerana menunjukkan sokongan kepada Zahir Shah."
0.0161208738612071,0.6562888801784623,1,sk,"Popradskí cestári vysypali na cesty v okresoch Poprad, Kežmarok a Levoča 4290 ton soli, 20 908 ton inertného materiálu a 182 ton ekologickej soli."
0.645347094306776,-0.004833092965611204,2,my,"MALAYSIA sekali lagi dipilih menjadi hos Kelayakan Piala Dunia Asia Omega Mission Hills di Kelab Golf Seri Selangor, Kota Damansara, Petaling Jaya, 3 hingga 6 Ogos depan."
0.008773729118537334,1.334251821235997,1,sk,"Masters v zjazdovom lyzovani Minuly tyzden sa v svajciarskom lyziarskom stredisku Scoul konali majstrovstva sveta Masters v disciplinach SG, OSL a SL, na ktorych nechybala aj slovenska vyprava."
0.8986214999125303,-0.002359313390819624,2,my,"Menurut beliau, secara logiknya kenaikan harga gula sebanyak 25 sen sekilogram mulai semalam merupakan pelarasan harga yang diumumkan kerajaan bagi mengurangkan subsidi barangan terbabit."
0.010103025481124546,0.8589250694722939,1,sk,"Inak, ak by aj miestne nepríslušný súd predsa vo veci začal konať a nepostúpil by vec príslušnému súdu a keby ste túto jeho nepríslušnosť ani vy nenamietli pri prvom úkone, ktorý vám patrí, tento nedostatok by bol odstránený, teda zhojený."
0.5840344929602873,-0.0053022682940828784,2,my,"Majlis semalam turut disertai Anggota Parlimen bagi GRC Nee Soon seperti Profesor Madya Muhammad Faishal Ibrahim, Dr Lim Wee Kiak, Cik Lee Bee Wah dan Encik Patrick Tay."
1.2373893077514642,-0.004705846533213737,2,my,"'Saya akan berada di Italy selama dua bulan setengah,' kata Tohari sambil menarik perhatian bahawa beliau bersama Fandi akan tetap dengan FAA sekalipun mempunyai tugas baru itu."
0.6801266419961327,-0.005024977096603196,2,my,"Video Musa yakin sokongan pengundi Cina MUSA berbual dengan Presiden Persatuan Hokkien, Datuk Seri Koh Kin Chee (kiri) ketika meninjau Kuil Seng Ong Dian di Tanah Merah, Sandakan, semalam."
0.0047021656768652,0.7133262853458374,1,sk,"V Kanade rastú nové domy Počet začatých stavieb domov v Kanade v januári vzrástol o 5,8 %, pričom sa zväčšil počet novostavieb jednogeneračných domov aj viacbytových.."
0.030603146038557766,1.9403593578623448,1,sk,"SARIO namieta, že nečinné nie je. Slovami Anny Hulmanovej zo sekcie štrukturálnych fondov agentúry, za obdobie rokov 2004 až 2007 zrealizovali štyri výzvy Operačného programu Priemysel a služby. V revitalizačnom projekte bolo zahrnutých šesť lokalít v hodnote vyše 24 miliónov eur. Podpora sa týkala zväčša menších miest po celom Slovensku. V roku 2008 pribudlo v podobnom programe ďalších 23 miliónov eur. V jeho druhej fáze je alokovaných ďalších 50 miliónov eur, dopĺňa."
1.7516135056677467,-0.015721125580869175,2,my,Pemilihan beliau sebagai pengerusi pilihan raya kecil DUN Galas dilihat tidak banyak membantu calon BN sekiranya apa yang dilaungkan selama ini oleh pemimpin UMNO dan BN sudah dipraktikkan.
