x1,x2,label,lang,texts
0.14539312678014774,1.4307219908740532,2,id,"""Kondisi tersebut akan membuat perekonomian menjadi semakin berat, apalagi saat ini para pelaku usaha pun dibebani dengan kenaikan upah minimum kota kabupaten (UMK), tentunya itupun menjadi salah satu faktor yang perlu dipertimbangkan,"" jelasnya."
0.0166274117585156,1.9959783862239047,2,id,"Mungkin ada yang salah, saat bantuan pemerintah pusat dikucurkan ke Papua melalui program Unit Percepatan Pembangunan Papua dan Papua Barat (UP4B) yang dampaknya tidak signifikan."
1.3593875241346298,0.02880465871505474,1,pt-PT,"Segundo o jornal, os investigadores desconfiam que pessoas que têm residência fiscal em Itália estão a usar o IOR como uma “cortina” para esconder diversos crimes, como fraude e evasão fiscal."
3.258271455797012,-0.05927491985848088,1,pt-PT,"Em declarações ao «barlavento», já depois do término da manifestação, por volta das 20h00, o líder da Comissão de Utentes da Via do Infante, entidade organizadora do protesto, disse terem aderido à ação «centenas de automobilistas»."
0.009001063554293321,1.0099476751857959,2,id,"Ditambahkan anggota Komisi II lainnya, Ruby Handoko alias Akok, hingga saat ini tapal batas SRL belum juga selesai dikerjakan. Termasuk kewajiban lainnya seperti tanaman kehidupan dan sebagainya."
0.031045560863573757,3.732980383664877,2,id,"Anwar mengakui Pemprop NTT dan pemerintah pusat sudah tepat menetapkan tiga bandara di NTT untuk terus dikembangkan memenuhi standar penerbangan nasional dan internasional. Ketiga bandara itu, yakni El Tari di Kupang, Tambolaka di Sumba Barat Daya dan Mbay di Nagekeo."
0.01352187398377515,0.3851376540696403,2,id,"Presdir PT Nojorono Stefanus JJ Batihalim mengatakan, metode gasing merupakan salah satu langkah awal untuk membuka cakrawala baru dunia pendidikan, bahwa pelajaran matematika sesungguhnya menyenangkan."
0.014398235409156735,1.7435708092175994,2,id,Sanggau – Kepala Dinas Pendidikan Pemuda dan Olahraga (Dikpora) Kabupaten Sanggau Drs Yohanes Kiteng menegaskan tidak ada tunjangan bagi guru yang berada di wilayah perbatasan.
3.254197719775972,0.017445209197355552,1,pt-PT,"«A resolução aprovada pela ONU não fala apenas da zona de exclusão aérea, também diz que podem ser tomadas as medidas necessárias para proteger a população civil e isso não inclui a entrada de forças terrestres na Líbia, mas inclui ataques aéreos a forças terrestres que estejam a ameaçar forças civis líbias», explicou o general Loureiro dos Santos."
1.9420806304244125,-0.03321656929176859,1,pt-PT,"Segundo o arguido, os conflitos que emergiram da separação da antiga Jugoslávia constituíram uma consequência natural de sérvios, croatas e muçulmanos lutarem por território."
0.019209120903454547,0.9061970439182753,2,id,"Jika sebelumnya produksi sawit secara nasional masih di bawah 25 juta ton per tahun, maka pemerintah bisa mendorong menjadi 30 juta ton per tahun."
1.9396478539277744,-0.0020166940778016318,1,pt-PT,"Em 2010, a situação económica melhorará mas a economia não deverá abandonar a recessão, segundo as previsões do executivo, que antecipam uma contracção de 0,3 por cento este ano."
1.4433578436621324,-0.0027805809930982178,1,pt-PT,"» Ana Gil, professora há 28 anos, actualmente na escola primária n.º 31, no Lumiar, defende que os alunos devem estar a par do que se passa no mundo."
3.787075969956746,-0.05222756410035826,1,pt-PT,"Quando, há uma dezena de anos, se realizou o referendo sobre a regionalização, muitos temeram que o resultado negativo que se verificou fosse o fim de qualquer reforma do Estado ou, pelo menos, o seu adiamento sine die. Como se vê, não se enganaram os que assim pensavam. Entretanto, o Mundo não esperou e mudou. E mudou muito."
3.5848591149210445,-0.05824399418877619,1,pt-PT,"""A prestação da casa está ainda a níveis de 2009, vai aumentar mais"", disse António de Sousa num almoço na Associação Comercial de Lisboa, acrescentando que ""não é normal"" a taxa directora da zona euro estar fixada nos 1,25%."
1.8161592610324009,-0.030313866777534105,1,pt-PT,Novas regras nas prestações sociais querem combater défice Limite máximo do subsídio de desemprego não pode ultrapassar os 75% do salário líquido que o trabalhador auferia.
2.09210273384229,0.03889100797594317,1,pt-PT,"É isso que acontece também, muitas vezes, com estes “habitantes do campo”, desejosos de lá morar pelo sonho urbano do rústico, mas a quem não foram dadas as ferramentas necessárias para o manter."
0.018951861937884864,2.4972229236521013,2,id,"""Kalau ada nelayan atau masyarakat pesisir yang saat ini sukses, itu memang karena pekerjaan nelayan adalah pekerjaan turun temurun. Ditambah lagi adanya kemudahan untuk mendapatkan modal usaha, tetapi bukan karena ada Gemala. Mungkin pemerintah saat ini perlu ada model percepatan Gemala di NTT,"" kata Rusydi."
2.1732338862836476,-0.03136525301555463,1,pt-PT,"Acredito que, por isso, estas decisões não são mais do que remendos, que duram até que os envolvidos voltem a abrir feridas e regressem ao tribunal a pedir mais compressas."
9.034441957302427,-0.1281008684574858,1,pt-PT,"A linha de orientação aponta para peças posteriores ao 25 de Abril, com uma cada vez maior aposta na arte contemporânea, inclusive vídeos. A filosofia de compras é de duas ou três obras de cada autor, ampliando assim o leque de artistas. Atualmente, a coleção terá mais de cem autores, sobretudo jovens, o investimento fundamental de Miguel Amado. ""O fim desta coleção é ela mesma, ou seja, não visa o retorno financeiro, mas sim o retorno cultural. A nossa vocação não é criar valor financeiro, mas o desenvolvimento de carreiras"", explica o comissário e crítico de arte."
0.013277876431569262,1.464122531513209,2,id,"Kami berharap, bronjong yang sudah ambruk ini segera dibongkar dan dikerjakan kembali sebelum arus air sungai menghancurkan bagian bronjong lainnya hingga membahayakan pemukiman kami,"" tegas mereka."
0.7819065059626155,-0.006646821388422543,1,pt-PT,"A segunda, a saúde, não se poderá nem será desejável condicionar face ao avanço tecnológico, a todos os níveis, porque o que será desejável é contrariar a centralização."
1.5944920475017228,-0.024766851202098896,1,pt-PT,"A primeira parte foi bastante viva e emotiva, altura em que se marcaram os dois golos, enquanto a segunda foi fraca e sem grandes motivos de interesse."
0.015781651795402116,0.856966807582669,2,id,"Peningkatan produksi ayam, katanya, juga berimplikasi terhadap kenaikan produksi pakan pada tahun ini yaitu menjadi 12,3 juta ton dibandingkan dengan tahun lalu 11,3 juta ton."
0.015048741369032847,2.0825598182233507,2,id,"Sehingga, hampir bisa dipastikan kalaupun akan dibahas, hal tersebut tidak mungkin dilakukan dalam waktu dekat. Artinya penerimaan RUU ini harus dalam sidang rapat resmi. Kalau banyak fraksi yang kontra maka akan ditolak. ""Begitu ditolak saya kira tidak akan ada perbaikan. Tidak ada waktu lagi,” tegas Muzamil."
0.6939573936155536,-0.007687842603545672,1,pt-PT,"Aliás, recuso atacar ou tampouco criticar aqueles que semana a semana se manifestam pela escrita, porque cada um assume o seu percurso, a sua vida."
1.6612469809537764,-0.02092564478078904,1,pt-PT,"Em 2008, os piratas atacaram mais de 130 navios mercantes ao largo da Somália, o dobro dos ataques registados no ano anterior, segundo a Organização Marítima Internacional."
2.1855932927145507,0.005251814687166102,1,pt-PT,"""A República das Bananas tem, de certa forma, um bocado de autocracia exactamente para defender a coesão da colecção e dos artistas a convidar."
2.7101851986650876,-0.0004256799617487661,1,pt-PT,"""Para recomendar algo, um utilizador precisa apenas de clicar na opção +1 num resultado ou num anúncio que considere útil. Esses +1's passarão a aparecer nos resultados de pesquisa do Google"", refere a empresa, em comunicado."
0.011121633494878913,1.212795010985063,2,id,"Sementara, analis International Data Corporation (IDC) Bob O'Donnell mengatakan harus ada penjelasan tentang perbedaan tablet Surface Windows RT berprosesor ARM dan tablet Windows 8 berprosesor x86 yang diusung Intel."
2.546859157953134,0.010905211892767728,1,pt-PT,"Ainda assim, a presidente da confederação sublinha que ""os pais continuam a ser os grandes educadores"" e, por isso, devem estar atentos para evitar que os filhos sejam vítimas de qualquer abuso profissional."
0.14066780034411328,0.803592020422003,2,id,"""Untuk karnal, selain diikuti pelar PAUD hingga SMA, kita juga menyertakan peserta dari umum,"" katanya seraya menambahkan, pihak panitia menyediakan tropi untuk para juara lomba, baik gerak jalan maupun karnaval."
6.387134251941883,-0.03591548744002844,1,pt-PT,"E por isso, já há quem avise que as mudanças necessárias para se evitarem a eclosão de novas crises semelhantes podem já estar em causa. Nas últimas semanas, um pouco por todo o mundo, surgiram alertas de vários quadrantes. Esta semana, em declarações à agência Bloomberg, Raghuram Rajan, antigo economista chefe do FMI, disse que “como temos uma retoma, lidar com os verdadeiros problemas vai ser mais difícil”, enquanto Stephen Ceccheti, do Banco Internacional de Pagamentos, revelou estar “muito preocupado que a recuperação apareça e a vontade de efectivamente reparar o sistema desapareça”."
0.011310320471650277,1.4182704967903228,2,id,"Selain penukaran langsung di loket Bank Indonesia, Dwi mengatakan masyarakat juga bisa menggunakan pelayanan mobil kas keliling yang beroperasi secara bergilir ke delapan kabupaten/kota."
3.013880980995258,-0.033896535289684,1,pt-PT,"A julgar por aquilo que habitual acontecer com tudo que faz e/ou diz o Presidente do Governo Regional da Madeira, é que no Continente e nos Açores apenas os órgãos de comunicação social falaram vagamente no assunto e mais ninguém ligou patavina!.."
0.020853045968678607,1.3652082158086714,2,id,Dia menambahkan pertunjukan angklung menjadi bagian dari Festival Indonesai 2011 yang menampilkan tema perayaan multibudaya dengan menghadirkan lebih dari 300 ragam etnis dari Tanah Air.
2.8073421279254847,-0.05468771535373433,1,pt-PT,"A judoca nunca falhou uma ida ao pódio, tem três medalhas de ouro e outras tantas de bronze, e só em 2008, nos Europeus de Lisboa não competiu, devido a lesão."
4.3872151264831025,-0.0801689872068224,1,pt-PT,"Um dos especialistas nacionais da vida e obra de Manuel Teixeira Gomes, que foi o sétimo presidente da Primeira República Portuguesa, é o escritor Hélder Macedo que, em declarações à Lusa, define o autor algarvio como um homem com ""três vidas"". Duas vidas de escritor e uma vida de político, explicou."
2.4007641535030135,0.016759265926086998,1,pt-PT,"Se um líder espiritual fosse designado, por exemplo, por Honestíssimo Intelectual da Esquerda Renascida (HIER), seria um senhor de camisa Lacoste, que estudara Antropologia na Sorbonne e viajaria por todo o mundo para ouvir os fiéis (hear)."
3.021936744948394,-0.05216137503776511,1,pt-PT,"Há duas semanas, o responsável do planeamento e finanças da Endiama, Alberto Fancony, afirmou que a produção angolana não deverá ir além dos sete milhões de quilates, contra os 8,9 milhões de quilates do ano passado."
8.605387640850806,-0.1481636827130318,1,pt-PT,"A decisão surge na sequência de uma deliberação da Comissão Nacional de Proteção de Dados (CNPD), de 24 de março, segundo a qual o Instituto Nacional de Estatística (INE) fica impedido de “registar nas bases de dados as informações que já tiverem sido recolhidas” através de formulários em papel, sendo ainda obrigado a “eliminar todos os dados já recolhidos através da Internet”."
0.5924691707943488,0.047779699106725616,1,pt-PT,"Esta indecisão sobre com quem vai ficar a protagonista é essencial no enredo, mas não tem o suspense necessário para prender o espectador neste ponto."
0.02330370320682869,1.966491472225156,2,id,Hari Raya Idul Adha 1433 H yang jatuh pada Jumat (26/10) dimanfaat ribuan masyarakat yang sebagian pelajar dan mahasiswa untuk mudik ke kampung halaman mereka.
0.02371425857239624,2.685454093890604,2,id,"Hanya saja, hidup di jazirah Twitter dan Facebook, saya sering sedih ketika banyak orang begitu mudah merasa dirinya ”nabi” atau ”rasul” dan menganggap status di akunnya adalah firman yang paling benar."
0.0084861098684823,1.0414184221825933,2,id,"Kepala Polres Kota Jayapura Ajun Komisaris Besar Alfred Papare menyatakan, penyebab terbakarnya mobil itu belum diketahui. Polisi juga belum mengetahui apa yang menyebabkan kematian korban. Polisi membawa korban ke RS Bhayangkara."
2.133163440138624,-0.03185525267858491,1,pt-PT,"O principal argumento é que o novo regime deveria integrar todos os médicos, independentemente do vínculo laboral, ou seja, que o novo regime também deveria ser aplicado aos médicos com contratos individuais de trabalho."
0.017874718856688215,0.9289469526628852,2,id,"Helikopter tersebut dipiloti Shri Krishnan, seorang warga negara Selandia Baru dengan membawa penumpang dua orang yaitu Adrianus Amba Sangka dan Iyan Timisela, keduanya merupakan karyawan PT Pangansari Utama."
0.16411994933213586,1.3221545253077467,2,id,"Selain itu, DPC Demokrat Manado dan DPD juga diminta konsisten melaksanakan Surat Edaran (SE) DPP No 33 yang isinya melarang adanya pergantian PAC hingga pelaksanaan muscab digelar."
2.8501086673335294,-0.00915615241885997,1,pt-PT,"As cinzas de Kurt Cobain foram, aparentemente, roubadas. De acordo com o jornal News of the Worlds, os restos mortais do líder dos Nirvana foram levados da casa da sua viúva, Courtney Love, em Los Angeles."
0.1477744692272829,1.4522949245544199,2,id,"Setelah lima bulan menjadi pasien dukun Edi dan tidak ada perubahan nasib, para korban yang baru merasa ditipu akhirnya melapor ke Polsek waru Doyong."
0.15759398926318952,1.4109014360493517,2,id,"Dalam kunjungannya kali ini, Foke, sapaan akrab Fauzi Bowo, menyerahkan secara simbolik sebanyak 1.035 kartu Jaminan Kesehatan Daerah (Jamkesda) untuk para nelayan, dengan rincian wilayah Kalibaru 414 kartu, Kamal Muara 54 kartu, Lagoa 18 kartu, Marunda 187 kartu, Cilincing 174 kartu, Pluit 106 kartu, dan Penjaringan 82 kartu."
1.7148601061068742,0.007105608170413895,1,pt-PT,"Quanto as previsões da abstenção já reveladas pelas televisões, entre os 47% e os 54%, Miguel relvas lembrou que estes números já se verificaram em outras eleições, mas que devem levar todos a reflectir porque são tão altos."
3.1023433049032616,-0.006110727584419965,1,pt-PT,"O presidente executivo Owen Van Natta ainda não adiantou quais dos 15 países onde a MySpace opera irão ver os seus escritórios encerrados. No entanto, tal como Portugal, as delegações no Japão e na China também não serão afectadas pelas medidas de contenção de custos daquela que é uma das redes sociais mais famosas a nível mundial."
1.3047577003050668,-0.014272107507208923,1,pt-PT,"José Mensurado, antigo jornalista da televisão, na altura com 29 anos, conduziu a emissão que mostrou a Portugal o maior passo da história da Humanidade."
1.9920176011840882,-0.03305549264244984,1,pt-PT,O que se passa neste país é realmente e cada vez mais a atribuição de poder demasiado às Entidades Patronais que enriquecem estupidamente às custas da propiedade intelectual e física dos trabalhadores.
1.2161017361051387,0.13366883797583345,1,pt-PT,Talvez mesmo fazer desta matéria o tema central para um Novo Contrato Social que assuma para o País um caminho partilhado e defina os instrumentos para o construir.
0.03356047391886731,2.240238427269714,2,id,"Kebanyakan orang berpikir ini adalah sebuah transaksi anas, dan sekarang tidak, tidak ada yang tahu di mana bagian terbawahnya,"" kata Lou Kerner dari Social Internet Fund."
0.011425192089808613,0.6909478078795247,2,id,"Dia mengaku sempat mendapat kabar jenazah anaknya akan diterbangkan dari Mabes Polri hari ini, namun setelah dikonfirmasi ke Maber Polri ternyata diperoleh kepastian baru beso (rabu) tapi waktu pastinya belum tahu."
0.013440024750188179,1.5773826510997344,2,id,"Menurut sejumlah warga, korban awalnya sedang buang air besar di pinggir sungai. Diduga, ia terpeleset hingga tercebur ke dalam sungai dan akhirnya ditemukan dalam keadaan sudah tidak bernyawa."
0.013857865446400663,1.324668656328223,2,id,"Saham dibantu oleh berita yang menyatakan bahwa perubahan baru lahir dalam industri perumahan, dengan rumah baru melompat 9,3 persen pada November ke tingkat terbaik sejak April 2010, ketika pajak kredit pemerintah berakhir mendorong penjualan."
0.020974372093974927,2.6668720507736032,2,id,"Coba kita flashback lagi, jumlah makalah yang harus kita buat, laporan yang harus kita susun, praktikum yang harus kita jalani, proses menunggu dosen untuk bimbingan atau sekadar minta tanda tangan, belum lagi ujian pendadaran, dan sebagainya."
0.01119071894122992,1.4157652658887672,2,id,"Banyak negara besar bisa saja melakukan kerja sama multilateral di berbagai bidang. Namun, secara bersamaan, mereka juga bersaing menguasai pangsa pasar, memperebutkan sumber strategis bagi keamanan pangan dan energi, pengaruh politik, serta kemajuan teknologi."
1.0673834407658003,0.04111544360958733,1,pt-PT,"Fundamentando o Tribunal que o pai era casado, tinha uma situação familiar estável, possuía melhores rendimento e uma casa com mais condições para os menores."
2.966938557250056,0.015657049895161486,1,pt-PT,do terrorismo mas sim por causa da queda do dolar americano só para resumir isto muito breve esses países do petrólio querem vender petrólio nao em dolares mas sim em outras moedas que tem valor como rupios e euros mas os EUA NAO QUEREM foi por causa disso que eles invadiram os iraquianos começaram a entrar na bancarrota
0.02522132099283608,2.9432311228164005,2,id,"JAKARTA – Angelina Sondakh, tidak berkutik dan berkilah lagi atas kasus yang menimpa dirinya terkait kasus korupsi Hambalang dan pengadaan sarana dan prasarana di sejumlah perguruan tinggi negeri (PTN) seperti selama ini."
2.81168612172579,-0.054580600104755975,1,pt-PT,"O Barómetro Academia do Turismo recebeu 72 respostas entre um universo de 136 presidentes e administradores de entidades turísticas e hoteleiras, gestores de entidades públicas ligadas ao turismo e académicos especializados na área."
4.968804840223861,-0.09813067104039094,1,pt-PT,"Desde que o programa de compras de obrigações foi lançado, em maio, o BCE já comprou obrigações de países no valor 69 mil milhões de euros, o que ajudou a aliviar alguma tensão nos mercados de títulos soberanos."
0.02520820829410613,1.7601247493247352,2,id,JAKARTA – Keluhan terhadap kenaikan tarif kapal penumpang di Pelabuhan Muara Angke yang hendak memanfaatkan penyeberangan ke Pulau Seribu ternyata juga dialami oleh pasangan Rojeni (35) dan Ayu (21).
0.008014248389733235,0.8510969335382649,2,id,"Keempat, SBY belum menyetujui adanya upaya revisi rencana UU KPK. ""Pemikiran dan rencana revisi UU KPK sepanjang menguatkan KPK dimungkinkan saja. Tapi saya pikir kurang tepat sekarang ini,"" terangnya."
0.013654736129177551,1.5744640162896242,2,id,"Kasus flu burung, menurut Kalla, bukan berasal dari Indonesia melainkan dari luar, sehingga yang dibutuhkan Indonesia saat ini adalah keterpedulian masyarakat internasional dalam bentuk kerjasama guna mencegah penyebaran flu burung ke Indonesia."
0.009825157893753876,0.8582641844819854,2,id,"Mahkamah Konstitusi telah menyatakan pemungutan suara dengan model elektronik tetap konstitusional selama tidak melanggar asas pemilu yakni langsung, umum, bebas, rahasia, jujur, dan adil."
2.074860318677162,-0.021030100891604765,1,pt-PT,"O segundo álbum de estúdio dos Klaxons está a ser produzido por Ross Robinson (Korn, The Cure, Slipknot), depois de várias sessões falhadas com James Ford, Tony Visconti e Focus. O novo trabalho deverá chegar às lojas até ao final deste ano."
1.1913634036850853,-0.006536052910602484,1,pt-PT,"O português carimbou a passagem à segunda ronda ao cabo de uma hora e 26 minutos, tendo agora pela frente o espanhol Fernando Verdasco, actual 15.º jogador do ranking mundial."
6.376131872597325,-0.02151515496047608,1,pt-PT,"Para além de resgates gerados por necessidade das famílias, há também saídas motivadas pela procura de maiores rentabilidades. Actualmente, apesar dos níveis igualmente baixos, os tradicionais depósitos a prazo, nos prazos mais curtos, conseguem oferecer taxas de remuneração superiores. É o caso dos depósitos a três meses, onde o nível de remuneração médio praticado pelos bancos está acima dos Certificados de Aforro. Os depósitos com prazos mais longos, salvo para montantes elevados, oferecem taxas de juro mais baixas."
3.2945864516828234,-0.007517901148360919,1,pt-PT,"O problema é que esta abordagem informal não só caiu em saco roto, como também foi direccionada para o membros do gabinete de Relações Internacionais do PSD que estavam com a anterior direcção de Luís Filipe Menezes."
0.013741437350722677,1.6759645092657744,2,id,"Gerbang pintu utara bangsal Sewokoprojo, tepatnya dihalaman Kantor Inspektorat Daerah, selalu sebagian terbuka dan menjadi jalan tembus masyarakat tinggal di Padukuhan Purbosari Desa Wonosari yang hendak memanfaatkan tempat ibadah masjid Sewokoprojo."
0.17363329805277733,3.888266764425698,2,id,"Pada saat 15 orang perampok masuk halaman depan menggunakan tiga unit mobil. Pemilik rumah yang juga pemilik Yayasan Pendidikan Assuryaniyah itu tengah terlelap di kamar utama dan satu orang anaknya juga tertidur di kamar lainnya. Sementara, para keponakan tengah menonton sepak bola di televisi dan sebagian pekerja rumah tengah terlelap."
0.013530370594984725,1.34909722425339,2,id,"Peristiwa seperti itulah yang terjadi dengan mesin ATM Bank BTN di depan kampus Sekolah Tinggi Ilmu Kesehatan (Stikes) Harapan Bangsa Jalan Raden Patah, Desa Ledug, Kecamatan Kembaran, Banyumas, Senin (26/3) dinihari."
0.005696542986621369,0.6751825801017017,2,id,"Sebaliknya, kalau penggambaran unsur romantisme terlalu vulgar justru akan menunjukkan betapa kotornya, betapa joroknya dan betapa menjijikkan atau menggambarkan rendahnya kualitas sebuah karya sastra."
0.020575066556021985,2.415944344470369,2,id,"Kasubdin Pariwisata Dinas Perhubungan dan Pariwisata Bangka Belitung, Nadirsyah, menyatakan, delegasi bisa memberikan promosi efektif tentang Bangka Belitung dari apa yang mereka saksikan dan pelayanan yang mereka dapatkan selama pertemuan."
0.018835896908728274,2.284051929987366,2,id,"Jamnas Honda Supra merupakan salah satu kegiatan yang menunjukkan komitmen perusahaan dalam menemani dan mewujudkan mimpi di setiap aktifitas, termasuk menjalin persaudaraan yang kuat antar pecinta motor Honda Supra."
0.010207815206586932,1.2190222943081503,2,id,"American Depositary Receipts (ADR) Sumitomo Mitsui Financial Group Inc dan Mitsubishi UFJ Financial Group Inc, dua kreditur terbesar Jepang berdasarkan nilai pasar, turun 1,8% dari harga saham penutupan di Tokyo kemarin."
2.741251411118515,-0.03959248956099075,1,pt-PT,"Aqueles que hoje participarem na ""obra de arte colectiva"" organizada pela UMAR usarão uma peça de roupa roxa, a cor das feministas, a mesma com que a organização pretende ver pintado, no futuro, o caminho feito pelas activistas precursoras."
3.4288785596645757,-0.057523788857830015,1,pt-PT,"O dirigente do BE, partido que apoia a candidatura de Manuel Alegre à Presidência da República, intervinha na Assembleia da República, que discute hoje dois diplomas do Bloco de Esquerda relativos à nacionalização do BPN."
1.977851733966534,-0.02102585684837069,1,pt-PT,"O grupo espanhol refere ainda ter havido uma descida no valor do crédito mal parado, que se situava em 3,42 por cento no final de Setembro."
0.04166696789885011,3.4812025783877214,2,id,"Genre Hybrid Westerns sebagaimana film Cowboys & Aliens sejatinya bukan sesuatu yang baru, karena film seperti Wild Wild West, Jonah Hex, dan The Warrior's Way telah mengawalinya. Tapi, Cowboys & Aliens diklaim memiliki kelebihan, karena mampu menghadirkan aliens di era koboi. Meski banyak kritik miring juga di arahkan kepada film ini, karena dinilai terlalu memaksakan cerita, yang sebenarnya sangat tidak nyambung."
0.01924622421758475,2.4067586428431076,2,id,"Dimana idol ini sistem yang berlaku adalah sms dari pemirsa, setelah sebelumnya juri yang berkompeten di bidang ini telah menyaring sejumlah peserta untuk kemudian dipilih oleh masyarakat."
0.02540289050423351,3.0347913262946564,2,id,"Sementara penyempurnaan di bagian interiornya menawarkan perlengkapan yang lebih baik seperti sistem pengatur suhu kabin yang kini sudah menjadi perangkat standar pada varian Active, velek berbahan alloy dan pengukur putaran mesin plus Peugeot Vonnect Bluetooth dan USB sebagai kelengkapan standar pada varian Allure."
2.7235819585684244,0.026373292103446064,1,pt-PT,"Sobre o fundo para os despedimentos, Arménio Carlos disse que o que lhes foi transmitido por José Sócrates é que as entidades patronais terão a tarefa de o criar e serão responsáveis pelo financiamento e ajuda a algumas empresas que querem despedir."
3.3231445230715906,-0.052865270926830056,1,pt-PT,"“Não tivemos qualquer contacto directo com o navio, mas a informação que obtivemos indica que a embarcação estava, a 12 ou 13 de Agosto, a cerca de 400 milhas de Cabo Verde”."
2.6329705482166803,-0.038424942483854294,1,pt-PT,"Nesta fase do processo já temos um líquido com 21% de álcool, que irá ser novamente destilado num dos alambiques mais pequenos, chamados de spirit still."
