x1,x2,label,lang,texts
2.5877557459007376,-0.0006695085672776953,1,pt-PT,"E é pois razão mais do que evidente para o sugerirmos como estadia nesta região, enquanto usufrui de um dos vários programas de Ecoturismo e actividades outdoor disponíveis."
0.024498093359857313,2.066036415219179,2,id,"Untuk urusan kesehatan dilaksanakan Dinas Kesehatan Aceh, Rumah Sakit Umum dr Zainoel Abidin, Rumah Sakit Jiwa dan Rumah Sakit Ibu dan Anak dengan alokasi Rp712,20 miliar dan realisasinya Rp664,09 miliar."
4.0990707869045275,-0.021574198869934332,1,pt-PT,"A EDP anulou a realização de prévia de sondagens arqueológicas e levantamentos arquitectónicos da zona que será inundada com a barragem do Baixo Sabor, adiando estes trabalhos para a fase de obra, noticia o jornal Público. A intenção, refere o diário, será evitar o atraso do início da construção da estrutura."
0.01877073834274839,2.060865494768953,2,id,"Santoso Edy Wibowo, Staf Ahli Bidang Teknologi dan Energi Kementerian Perhubungan mengatakan Jepang dan Indonesia telah mengadakan pertemuan di bidang perhubungan dan transportasi sebanyak 3 kali."
0.009065005782180762,0.9925535131054185,2,id,"Pesisnya, Embung Batok itu bisa difungsikankan mengairi beberapa komoditi pertanian buah sejak Januari 2012, tapi sampai sekarang, tak satu pun lahan pertaian yang terairi, karena air tadah hujan sudah tinggal genangan."
0.6466597980901756,-0.006981856676128543,1,pt-PT,"Este aumento terá impacto, terá reflexos, mas não terá um impacto muito grande a nível dos preços em Cabo Verde"", disse José Maria Neves, questionado pela Agência Lusa."
0.030636329958475705,2.383854122046063,2,id,"Dalam reli Italia, Hirvonen mengungguli Evgeny Novikov yang berada di posisi kedua dengan selisih waktu 1 menit 20,6 detik, dan pereli Estonia Ott Tanak yang menduduki posisi ketiga berselisih waktu 2.21,1."
0.04292408404009824,2.802354800160888,2,id,"Veri mengatakan, imbauan penghentian aktivitas eksplorasi tambang emas yang direkomendasikan DPRD ke Pemkab Sumtim dilakukan sekitar tahun 2008. Saat ini, katanya, terjadi aksi penolakan eksplorasi tambang oleh warga di sekitar lokasi. Dan, hasil dari aksi protes warga itu terhadap PT FR merupakan isi rekomendasi dewan. Namun dalam perjalanan, Pemkab Sumtim tidak mengindahkan rekomendasi DPRD."
0.8391496865098635,0.04251223847432468,1,pt-PT,"Ou ainda, se o objectivo é denunciar corrompidos e corruptores… É que se o objectivo for este último, então meus senhores, teremos definitivamente “pano para mangas” (ou não)."
0.015251221784366581,1.1111498842440615,2,id,"Menurut dia, dari produksi 247 juta ton itu, porsi domestik mencapai 23,5 persen atau 58 juta ton dan ekspor 182 juta ton atau 73,7 persen."
0.015353757861069676,1.1171523862294066,2,id,Nazaruddin menjelaskan bahwa dia menyerahkan bukti pesan singkat melalui Blackberry Messanger (BBM) dari Wila yang mengatakan uang dari proyek pembangkit listrik sudah diserahkan kepada Anas Urbaningrum sekitar hampir Rp 80 miliar.
0.010826595512472583,0.9266630586181086,2,id,"""Saat juru mudi menghidupkan mesin kapal terjadi ledakan keras dari bagian mesin diikuti percikan api. Api menyambar seluruh kapal,"" kata Pelaksana Harian (Plh) Kepala Administratur Pelabuhan (Adpel) Tenau Kupang, Suparman, di ruang kerjanya, Senin (8/10/2012)."
4.294145709403762,-0.0072216372417160555,1,pt-PT,"Prejuízo da Vista Alegre sobe para 21,7 milhões no 3º trimestre Os prejuízos da Vista Alegre subiram cerca de 8 milhões de euros no terceiro trimestre deste ano face ao mesmo período de 2008, ascendendo a 21,7 milhões de euros, anunciou hoje a empresa."
0.013175096361309752,1.1177132565959835,2,id,"Barang bukti lain adalah delapan unit ponton, sembilan unit tongkang, 10 tugboat, 248 unit kapal, 909 truk, dan 138 unit alat berat, namun dalam kasus ini polisi tidak berhasil meringkus tersangka utamanya."
0.015169749719927711,1.7337323472867991,2,id,"Bulan ini bangsa Indonesia merayakan hari ulang tahun kemerdekaan ke 63. Sebuah moment untuk mengenang lahirnya sebuah bangsa yang dicapai dengan pengorbanan, bukan hanya jiwa dan raga."
1.453113859373479,0.0019388735737447447,1,pt-PT,"«Tudo leva a crer, tal como depreendo das declarações do presidente da REFER quando visitou as obras em Famalicão, que o nome da estação não será alterado», apontou Carlos Valente."
0.018895287167360737,1.4401850369519908,2,id,"''Sesungguhnya Allah menjadikan Adam pada hari Jumat, diturunkan di bumi pada hari Jumat, dia bertobat kepada Allah atas dosanya memakan buah khuldi pada hari Jumat dan wafat pun pada hari Jumat.'"
1.0717814376347707,-0.009675206957770625,1,pt-PT,"Porém, é difícil contabilizar quantas pessoas existem empregadas no sector da solidariedade e da segurança social e que estejam interessadas em fazer parte desta associação»."
0.01431357834514403,1.567135885110281,2,id,"Berawal dari tendangan Martin Kelly ke arah gawang yang mampu diblok Howard, langsung disambut dengan tendangan lambung yang masuk ke pojok kanan gawang Everton oleh Steven Gerrard."
0.02535215882192648,1.7551266832018837,2,id,"""Pabrik baru Kawasaki yang menelan investasi Rp600 miliar telah memasuki tahap konstruksi pada tahun ini. Diperkirakan pada Januari 2014, pabrik tersebut sudah mulai beroperasi,"" kata Direktur PT KMI, Mitsuhiko Okada, pada acara konferensi pers di Jakarta Motor Cycle Show 2012, Rabu."
2.278172177634437,0.07719352399444136,1,pt-PT,"Portugal tem 10 semanas para pedir a intervenção do Fundo de Solidariedade da União Europeia, criado para acorrer a casos de ""grandes catástrofes naturais""."
0.15341615855069618,2.4683949053368934,2,id,"Dikatakan Kapolres Suastra, saat ini pihaknya berupaya mendatangkan para saksi yang melihat dan menyaksikan kejadian di Pulau Kawe, yang dilaporkan masyarakat setempat, diprovokasi orang luar Papua Barat."
2.782217452378135,-0.04798024918679122,1,pt-PT,"Unidade dos cristãos A propósito da Semana de Oração pela Unidade dos Cristãos, que ontem começou, o Arcebispo de Braga disse que «vivemos num mundo plural no aspecto religioso."
0.010791881254124029,1.3348448839192804,2,id,"Anggota Dewan Pembina Partai Demokrat Syarief Hasan meyakini masyarakat bisa membedakan posisi Hartati sebagai pengusaha dan keanggotaannya di Partai Demokrat, terkait dengan penahanan pengusaha tersebut oleh KPK."
2.35783550911032,-0.038033432861133754,1,pt-PT,Deixou ainda uma palavra ao trabalho realizado nos últimos 2 anos no Departamentos de Mulheres Socialistas e referindo que a sala com centenas de apoiantes é bem a prova desse trabalho.
0.14630723368431894,1.3262167429097877,2,id,Para pemain nantinya dilatih selama tiga bulan di Banda Aceh dan jika dana memungkinkan maka selanjutnya mereka dikirim berlatih ke Spanyol selama tiga tahun hingga menjelang PON XIX/2016.
0.012367009027352636,1.4057161005178653,2,id,Kesempatan berlaga di ajang ''ASEAN University Games'' didapatkan mahasiswa UNY setelah memenangi berbagai kejuaraan di Pekan Olahraga Mahasiswa Tingkat Nasional (Pomnas) 2010 di Palembang.
0.8592756112794888,-0.009839435108712123,1,pt-PT,"O deputado do PCP Honório Novo, por sua vez, frisou que a simples suspensão não resolverá o problema das empresas, defendendo a sua ""eliminação ad eternum""."
0.006944546373157868,0.683632623167542,2,id,"“Akh! Terserah kamu saja. Aku sebenarnya juga mau jadi suami kamu. Jika seandainya saja aku belum tunangan,” Edo mulai kesal dengan sikap acuh Mawar. Mawar tersenyum kembali, ”Tapi.. apakah kamu mencintai aku? Atau semua itu kamu lakukan karena kasihan kepadaku?”"
0.018887460958679762,1.0784776374814249,2,id,"Dia memperkirakan panjang antrean mencapai 20 kilometer lebih. Apalagi antrean sampai ke kawasan Simpang Martabak. Selain karena adanya truk terguling, Hotler menilai kemacetan juga terjadi karena adanya aktivitas pelebaran jalan yang tengah berlangsung."
0.009289854338500785,1.1561779929561034,2,id,"Manoj menambahkan ada kemungkinan duet itu. ''Kalau kami lihat di setiap konser SRK selalu menarik penonton untuk naik ke panggung. Kemungkinan besar banyak surprise diciptakan dalam konser SRK,'' kata Manoj."
0.016453904014087892,2.1970663356893216,2,id,"Saya amati masih banyak masyarakat yang membuang sampah rumah tangganya di bantaran sungai bahkan masih banyak sampah yang bertumpuk di pinggir jalan, inikan sumber penyakit,’’ keluhnya."
0.022645697112640167,2.76503406030647,2,id,"Apabila ada orang yang mengambil mobil saya dengan karcis yang sama, maka bukan kesalahan saya dan ini menjadi tanggung jawab pihak yang punya titipan."
0.02797203825394839,1.9307911053903861,2,id,"Dalam kesempatan itu diserahkan bantuan kerja sama Hipmi Kota dan Dinas Sosial Pemuda dan Olahraga (Dinsospora) Jateng berupa dua paket mesin jahit, mesin obras dan mesin pemotong kain."
0.003746808845786375,0.4754664236479046,2,id,"“Apa bila hasil uji laboratorium tidak memenuhi standar baku mutu sesuai Keputusan Menteri Lingkungan Hidup Nomor 202 Tahun 2004, maka izin pelepasan air sisa proses tidak akan dikeluarkan,” ucapnya."
0.019594005778700383,2.0793160142551144,2,id,"""Kami akan melakukan kunjungan kerja ke Jepang dan Korea yang sekaligus mencari cara untuk mengembangkan industri kreatif di dalam negeri,"" katanya kepada Bisnis, Rabu (19/9/2012)."
0.01341004659400209,1.7741180577937758,2,id,"Keterlibatan keduanya dalam Olimpiade menimbulkan berbagai reaksi di masyarakat. Bahkan di situs jejaring sosial Twitter keduanya memicu berbagai reaksi. Termasuk hash tag yang menggambarkan mereka sebagai ""pelacur Olimpiade""."
0.011057087475801586,1.3001667999258024,2,id,"Untuk itu, diharap instansi yang memberikan izin pendirian tiang reklame diduga ""liar"" itu begitu juga perusahaan advertising untuk mendapatkan keuntungan jangan sampai mengorbankan pihak lain."
0.01851909953110766,1.7224013178771815,2,id,"Selain dua tipe terbaru stand Volkswagen di arena IIMS juga menghadirkan beberapa model yang lain seperti VW Polo, Golf, GTI, Tauran TSI, The New Panel Van, Caravelle, dan Toureg."
2.1948990378636184,0.06478502657611249,1,pt-PT,"Além disso, reduziu para três anos o prazo da eficácia das garantias bancárias das empresas que efectuaram obras para a administração regional, reduzindo, assim, os custos financeiros decorrentes da realização de obras públicas."
0.1084832531090907,2.42250696357842,2,id,"mengancam ge�na�ngan air di badan jalan. Tepat�nya di Kampung Padangtaeh, Nagari Ampingparak, Keca�matan Sutera. Ruas jalan yang hanya berjarak 20 meter dari laut yang berhutan nipah ini, sering digenangi air pasang,� katanya."
2.5138050742303935,-0.040207479986021324,1,pt-PT,"O presidente da associação do sector afirmou que ""o parque automóvel português é dos mais renovados da Europa"", o que ""também tem a ver com a actividade de inspecção automóvel""."
2.327784483255431,-0.010823894111599144,1,pt-PT,"Esta previsão de retoma ""modesta"" e ""frágil"" resulta da forte aceleração do comércio mundial, que deverá estimular as exportações europeias. Este é igualmente o indicador que está na base no modesto crescimento em Portugal."
0.013321234053782835,1.2140897448750665,2,id,"""Gropyokan merupakan tindakan efektif dalam mengurangi populasi tikus, sebab dari ratusan hektar persawahan, hanya 20 hektare yang kini masih bertahan. Itupun terancam gagal panen kalau tidak dilakukan gerakan massal untuk pembasmian tikus,"" ungkapnya."
1.194245557509818,-0.008970915672424293,1,pt-PT,Home » Maria José Encarnação Navegando por entradas marcadas com “Maria José Encarnação” Assembleia municipal de Silves com novas instalações “Declaro aberta esta sessão.
4.603256951599638,-0.07894582415173677,1,pt-PT,«Unlawful Killing» é um filme sobre a morte da princesa Diana de Gales que está a gerar controvérsia por causa de uma fotografia que mostrará Diana ainda com vida após o acidente de carro em Paris que terminou com a sua morte. E vai agora fazer a sua estreia em Cannes.
0.14560896875987048,1.5252165073595771,2,id,"Pantaun Pos Kupang.Com, di TPS 10 Kelurahan Oebobo, dari 219 pemilih yang terdaftar dalam DPTyang menggunakan hak pilihnya hanya 160 orang sedangkan sisanya 59 tidak memilih."
2.4146236734863935,-0.03374426650541437,1,pt-PT,"Apesar de os Governos do G20 terem prometido não aplicar medidas proteccionistas, este tipo de políticas é particularmente sentido no comércio com os países vizinhos."
0.011418478876456396,1.5061150880476868,2,id,"Secara terpisah, Direktur Eksekutif Reforminer Institute Pri Agung Rakhmanto menilai gejolak yang terjadi di Mesir saat ini belum akan langsung memberikan dampak terhadap perkembangan harga minyak dunia."
3.286628034491841,-0.061925137984449236,1,pt-PT,"O presidente do IGEPE, Hipólito Hamela, diz que a decisão de o Estado moçambicano se retirar das empresas visa ""melhorar a capacidade de controlo das participações estatais, bem como das empresas participadas pelo Estado, de modo a serem mais lucrativas""."
0.01263156294407599,1.4349715419167024,2,id,Dirut Industri Perikanan Sukadana (IPS) Bambang Kisworo menjelaskan pendirian pabrik baru tersebut dilakukan untuk memenuhi permintaan ekspor dan konsumsi dalam negeri yang terus meningkat.
0.03269329887698146,3.452918589000363,2,id,"""Hal yang menjadi tekanan di sini adalah obat tradisional atau jamu tidak mengobati sakit, tetapi untuk mencegah seseorang jatuh dari sakit. Dari 100 persen penduduk, 10 persennya sakit. Pertanyaannya bagaimana menjaga yang sehat itu, yang 80 persennya. Ini sesuai dengan imbauan WHO,"" ucap Dani."
0.041849184350634894,2.891636407261066,2,id,"Selain itu, proses penanggulangan juga mendapatkan dukungan dari aparat keamanan dan pemerintah daerah setempat. Api dinyatakan padam total pada Rabu pukul 13.30 WIB. Tim Pertamina dan Elnusa selanjutnya melakukan penanganan di sekitar lokasi untuk melokalisir minyak dan melakukan penyedotan dengan mobil penyedot."
0.015435854925836788,1.8850935410761354,2,id,"Kemudian redefinisi tujuan pembangunan sosial yang baru pasca MDG's, untuk mendorong kemajuan sosial, pengentasan kemiskinan, peningkatan partisipasi masyarakat di dalam pembangunan, keadilan sosial dan kebebasan."
0.01605710892291541,1.3432845567491611,2,id,"Yusrin juga mengaku sudah membicarakan soal pengusutan penyebab kematian Putri kepada Nurulhayati, mantan istrinya yang kini berada di Malaysia. “Dia setuju penyebab kematian Putri harus diungkap, apa pun konsekuensinya,” kata Yusrin."
1.5058152010891648,-0.0192640242931345,1,pt-PT,"Homenagem a “figura incontestável da terra” A Biblioteca Municipal Maria Natércia Ruivo representa a homenagem que a autarquia quer fazer a Natércia Ruivo Gouveia, falecida em Março de 2005."
0.018493664817528385,1.335452870918765,2,id,"Sementara itu, Sail Morotai diisi dengan sejumlah kegiatan antara lain lomba yacht yang diikuti 124 yacht dari 14 negara dengan jumlah peserta 337 orang."
0.017273310869682295,0.4975749624274575,2,id,"Dia menolak menyebut omsetnya, tetapi diakui mendekati keberangkatan calon jamaah haji, penjualan naik hampir 100 persen. Harga jual rendang dalam kemasan itu mulai Rp25.000 hingga Rp50.000 per kotak."
1.9011058030770842,0.036974902441877316,1,pt-PT,"Os concertos na sala principal do Teatro Virgínia têm o preço de 5 euros, ficando apenas 15 euros, no caso do bilhete para todos os espectáculos."
0.1459056739376599,1.599504697080238,2,id,"Diharapkan, dengan menggunakan kartu kontrol, para pengguna mitan bersubsidi di daerah ini akan ketahuan secara pasti guna menghindari kelangkaan mitan di kawasan ini,"" tutur Ahmad."
0.011318515140070108,0.6723830792554685,2,id,"Pasal 54 RUU Kamnas menyebutkan, pengawasan terhadap penyelenggaraan sistem keamanan nasional dilakukan secara berlapis melalui mekanisme pengawasan melekat, pengawasan eksekutif, pengawasan legislatif, pengawasan publik dan pengawasan penggunaaan kuasa khusus."
3.5386188130701433,0.009896038697985823,1,pt-PT,"Os seguranças à porta, o corrupio de descapotáveis, a luz natural filtrada por obras de arte não dirão muito aos habitues do alojamento de luxo, mas preconizam uma mudança na hotelaria algarvia e são já um ensaio para as seis estrelas."
1.6152222784036687,0.0003231235982018181,1,pt-PT,"Estabilizar as alterações introduzidas na Saúde e noutros sectores, permitindo eventuais correcções no que a prática demonstre ter sido menos conseguido, será por certo um bom ponto de partida."
1.7818316965866505,-0.008956338909198397,1,pt-PT,"“Uma vez que as portagens constituem receita das Administrações Públicas, os activos integrados nestes contratos são considerados investimento das Administrações Públicas, afectando em consequência a respectiva necessidade de financiamento”, ou seja, o défice público, explica o INE."
5.343245162629522,-0.08218219531188681,1,pt-PT,"Começamos por Malta, e começámos em bolandas com o episódio fumegante do vulcão islandês. Tive metade do tempo de gravação que era suposto,e na primeira vez que fazia televisão. É preciso que se veja que o andarilho o mais perto que andara da TV havia sido enquanto actor terciário de telenovelas e figurante tartamudo de séries Z. Dali"
0.009968341235403258,1.3206730174769936,2,id,"Untuk menjaga keutuhan wilayah NKRI (Negara Kesatuan Republik Indonesia) terutama di wilayah udara, TNI Angkatan Udara akan membangun pangkalan perang atau Lanud tipe C di kota Tarakan, Kalimantan Timur."
2.5205232604134356,-0.04607681357949861,1,pt-PT,"O presidente da CNIS, que representa cerca de 2700 instituições do país, admite recorrer aos tribunais caso os acordos de cooperação sejam “ilegitimamente cessados”."
0.021204220229575632,2.8377182487501966,2,id,"Jiro yang dianggap suhu sushi oleh sesama koki juga memiliki murid. Ia melatih Shiro, seorang koki yang membuka restoran sushi di Seatle. Ada pula Taiichi yang kini membuka pula toko sushi di Jepang."
0.007628133074360345,0.9968387524373281,2,id,"""Ia akan senang itu berlalu, karena ia tahu bahwa ia akan dibebaskan,"" kata pengacaranya, Neal Puckett, kepada Radio Publik Nasional (NPR) menjelang pengadilan tentara di markas Pendleton, California."
0.009853184332097073,0.8395924711371986,2,id,"Beban pokok penjualan juga tercatat naik 38,74% menjadi Rp5,53 triliun dari Rp3,98 triliun. hal ini mengakibatkan laba kotor perseroan naik signifikan 68,84% menjadi Rp705,76 miliar dari Rp417,99 miliar."
0.015717512038544802,0.9459064571122432,2,id,"Wajah kiper 21 tahun ini telah terlihat penuh dengan cambang ditambah jenggot panjang, jika benar memnuhi janjinya hingga beberapa bulan mendatang, kiper asal Spanyol ini kemungkinan akan semakin terlihat tua dengan jenggot panjangnya."
0.02186916511130002,2.282747564712823,2,id,"Syaratnya adalah Sumantri meminta seorang pelayan untuk menemani Sumantri dan mengurus seluruh kebutuhannya, maka si lelaki tua itu menyetujui syarat itu dan lelaki tua itu segera pulang kerumahnya dan membawa anaknya Mawar untuk melayani Sumantri."
0.009105302860530212,1.0886146573471192,2,id,"Perlu diketahui, Hartati didakwa menyuap Bupati Buol Amran Batalipu terkait kepengurusan izin usaha perkebunan dan hak guna usaha lahan kelapa sawit di Buol, Sulawesi Tengah."
0.016932706431592857,2.078595947541456,2,id,Ratusan orang Suriah menyelamatkan diri dari kerusuhan di negara mereka setiap hari dan diterima oleh pemerintah Jordania serta kelompok bantuan yang belakangan memindahkan mereka ke kamp pengungsi atau tempat penampungan lain.
0.019728354965519543,2.613456164890154,2,id,"""Hubungan antarpemeluk agama di Indonesia cukup bagus. Bahkan, kita di sini ada FKUB (Forum Kerukunan Umat Beragama),'' katanya. ''Ini berbeda jauh dengan Myanmar. Komunitas Muslim yang minoritas di Rohingya itu tidak diterima.''"
1.633913276131247,-0.011954924811441463,1,pt-PT,"Na área da música, a temporada 2008/09 do CCB tem previstos três concertos de Maria João Pires, um concerto ""carta branca"" com Camané, e peças encomendadas aos compositores Alexandre Delgado e António Pinho Vargas."
0.015111563117049132,1.8389829179012178,2,id,"Beberapa di antaranya adalah kenaikan harga fasilitas ekonomi, pemutusan hubungan kerja (PHK), terhentinya kegiatan ekonomi sebagian masyarakat, dan konflik karena pembagian subsidi langsung yang dianggap tidak adil."
2.67488388251531,-0.0474280058964921,1,pt-PT,"Não há nada mais fácil do que nos tornarmos presas fáceis do desalento, da depressão, da ansiedade e de tantas outras coisas que nos fazem dar a maior das felicidades às farmácias e laboratórios nacionais."
0.010217434554242106,1.2238265410100078,2,id,"Patrialis mengungkapkan hal itu saat meresmikan Kantor Wilayah Kementerian Hukum dan HAM (Kanwil Kemenkumham), Kalimantan Selatan (Kalsel) sebagai LHRC, di Gedung Mahligai Pancasila, Banjarmasin, Sabtu (23/7)."
3.1208456552791146,-0.006319818300774318,1,pt-PT,"Sem entrar na questão tão polémica (que só ela dava para um artigo) da preservação do património nacional – quantos de nós não conhecem um monumento, pelo menos, em estado de avançada degradação?"
2.0768925617998684,0.054108165739267605,1,pt-PT,"O jantar do PS de Ílhavo ficou marcado, também, pela estreia nas lídes partidárias do gestor Paulo Nordeste (presidente da PT Inovação), que aceitou ser mandatário distrital para as eleições europeias."
1.1602709431926788,0.015464189016711717,1,pt-PT,"Em abril, o cientista tinha já advertido que se os extraterrestres existissem, os homens deveriam evitar qualquer contato com eles, porque as consequências poderiam ser devastadoras."
0.8711818096271026,0.09186313009614722,1,pt-PT,Aura Miguel com agências Utilize este espaço para ler os comentários dos outros utilizadores e para deixar os seus comentários relativos a esta notícia.
0.01789458216954013,2.0517208704974172,2,id,"Rusli optimistis seluruh pembangunan penunjang pesta olahraga tersebut akan selesai Agustus dan sudah bisa dipakai. Anggaran untuk PON ini, katanya, berasal dari cadangan APBD provinsi, kabupaten/kota, serta dari pemerintah pusat dan berbagai kementerian terkait."
2.4278231589757278,0.11289700126611688,1,pt-PT,"As receitas revertem para a construção do Berço, Centro de Dia, sede do Agrupamento de Escuteiros, salas para a Catequese e nova igreja paroquial, com oitocentos lugares sentados."
0.016629442278392855,1.9980227131210506,2,id,"Saking senangnya menyelamatkan binatang yang sakit atau terbuang, rumahnya sekarang sudah seperti sebuah rumah penampungan binatang, tapi memang tidak semua binatang bisa dipeliharanya di rumah karena terlalu besar dan berbahaya."
0.8721640694355719,-0.012228459737073013,1,pt-PT,"José Sócrates sublinhou o «grande desenvolvimento» da ligação entre Portugal e Venezuela nos últimos três anos, afirmando que «honra a amizade histórica» entre os dois governos."
0.02218666248692215,1.8080134563995598,2,id,"Menurut Nuril, bosnya itu tidak punya kartu kredit atau semacamnya. Nazar lebih suka membawa uang cash. Alasannya, kalau ingin sesuatu bisa langsung dibeli secara tunai. Berapa yang dibawa"" ""Dalam bentuk rupiah Rp 20 juta dan USD 10 ribu (sekitar Rp 90 juta),"" paparnya."
1.0892259521176684,-0.015412886570470762,1,pt-PT,"A sexta maior fortuna portuguesa pertence a Alexandre Soares dos Santos, da Sociedade F. Manuel dos Santos, que também subiu três posições na lista dos mais ricos."
2.204298180660448,-0.019400302824050066,1,pt-PT,"Por tudo isto seria bem melhor que o “We” se transformasse em “You”, já que, pelo menos neste “You”, todos os americanos e não americanos se sentiriam incluídos e responsabilizados em abordar os problemas que afectam o mundo, sem criar outros mais graves."
1.694991485137188,-0.03330102486605538,1,pt-PT,"A medida é igualmente dirigida a outras empresas importadoras, nomeadamente de tomate, batata, cebola e arroz de terceira qualidade (produto cujo preço também baixou na terça feira)."
0.06799675871300158,1.689006768674113,2,id,"""Mengingat situasi keamanan di Tunis dan Khartoum, Departemen Luar Negeri AS telah memerintahkan kepergian semua anggota keluarga dan personel tak penting dari kedua pos."
1.7735486258281494,-0.019891827137727157,1,pt-PT,"Ainda no sector da banca, o BPI surge em quarto nas valorizações, com uma subida de 2,22 por cento, a valer 1,425 euros por acção."
0.5025846470036505,0.04087456822568424,1,pt-PT,"A historiadora apelou a mais verbas para estes arquivos, bem como a um maior apoio aos jovens historiadores, a quem também dedicou o prémio."
2.3886862687297468,0.007764010561565926,1,pt-PT,"Foi o galês Ernest Jones que, em 1907, teve a ideia de organizar um encontro internacional para pôr em contacto os especialistas que em vários países mostravam interesse pela psicanálise."
1.9353136490997191,-0.02912327543358356,1,pt-PT,"«Tendo em conta a conjuntura portuguesa, o que fazia falta não era uma animação genuinamente lusitana, como os espectáculos ""Conquistador"" ou ""Variações"", mas algo capaz de ser apreendido por todos», explica Assis Ferreira."
0.017418547598840796,1.4874973900565434,2,id,"Menurut dia, secara prinsip koperasi mempunyai tujuan yang bagus dalam mengangkat perekonomian masyarakat sehingga jika muncul koperasi yang berpraktek rentenir bisa jadi disebabkan karena oknum pengurusnya."
1.831874035379283,-0.0253395066426329,1,pt-PT,"O local inicialmente previsto era a Lagoa das Sete Cidades, mas, por razões de natureza técnica, acabou por ser mudado, o que motivou algumas críticas, especialmente por não ser um espaço natural."
0.029388453202763717,3.5649774066008946,2,id,"Tjong A Fie juga dikenal sebagai pedagang yang baik oleh orang Eropa dan dari kebajikannya itu akhirnya memiliki usaha perkebunan teh di Bandar Baroe, perkebunan kelapa di Sumatera Barat, memiliki pertambangan di Sawah Luntoh, Bukit Tinggi dan lainnya."
