x1,x2,label,lang,texts
0.29421264471174047,2.074979509106902,2,sk,Spotová cena sa v súčasnosti pohybuje v cenovom pásme ohraničenom rezistenciou na úrovni 327 USD za tr. uncu a hranicou podpory na úrovni 322 USD za tr. uncu.
1.659778947192965,-0.4685811876547321,1,pt-BR,"Pesou, preponderantemente, o fato de estar presa e não poder estarproduzindo seu próprio alimento, junto de seus três filhos e domarido, Miguel Serpa, também detido."
0.15258137481362247,1.0552715572933584,2,sk,"Bush bude žiadať navýšenie armádneho rozpočtu Prezident Spojených štátov amerických George W. Bush bude v pondelok od Kongresu žiadať navýšenie rozpočtu pre armádu vo fiškálnom roku 2009 na 140,7 mld."
1.1342899335951055,-0.008988990418799898,1,pt-BR,"Muitos dos nossos sonhos, dos amores passageiros, ou mesmo dos que duram até hoje, mas que nasceram embalados em seus salões, bebedeiras juvenis, brigas sem armas, amizades eternas.."
0.8860414805380844,-0.03238871399580545,1,pt-BR,"Conforme informou Sidnei Gonçalves, um dos proprietários da empresa, a Flight Level preocupada com a problemática ambiental que assola o planeta desenvolveu a campanha ""Preservação.."
1.9986458609408546,2.073171678325478,1,pt-BR,"Na manhã desta segunda (28), Ana Maria Braga gravou uma entrevista com a presidente Dilma Rousseff para o “Mais Você” que vai ao ar nesta terça (1). O encontro aconteceu no estúdio do programa no Projac, na zona oeste do Rio."
0.016857542668235883,0.41123377655846727,2,sk,"“ O tom, kam až siahala moc strany a ako vyzeral vzťah medzi Komunistickou stranou Slovenska (KSS) a jej matkou svedčí aj Kádrový poriadok Ústredného výboru Komunistickej strany Slovenska z roku 1984."
0.30180054548964763,2.2596435757845406,2,sk,"Až po 49 rokoch si jedna zo smutných fotografií našla cestu na verejnosť v knihe ""Exquisite Corpse"" (Jedinečná mŕtvola), ktorá sa snaží ponúknuť najucelenejší pohľad na smrť hviezdy filmu Niekto to rád horúce."
2.2382032664104754,-0.44729064051952616,1,pt-BR,"Além de assistir o filme incontáveis vezes, tinha toda a trilha sonora em seu escritório de Salvador, que costumava escutar durante as reuniões, com o som baixo."
0.013037685559860426,0.3904019512515618,2,sk,"Zákaz, ktorý navrhujeme, by dal spotrebiteľom istotu, že nechtiac nekupujú produkty obsahujúce kožušinu mačiek alebo psov,"" odôvodnil návrh komisie komisár pre zdravie a ochranu spotrebiteľa Markos Kyprianu."
1.181666421267764,-0.2205386438635573,1,pt-BR,"Nessa sua administração Sr. Murilo, pelo menos mostre à população que a incompetência de alguns setores ainda é tolerável, mas a safadeza precisa ser punida exemplarmente."
0.30071515703784096,0.4024770989036934,2,sk,"Jeho premožiteľ Španiel Nadal patrí spolu s Nalbandianom a Caňasom do elitnej trojčlennej skupiny mušketierov, ktorí s ním za posledné štyri roky dokázali vyhrať viac než len jednu bitku."
0.301838620979151,0.45389604094614194,2,sk,"Podľa neho sú takéto akcie nevhodné a majú úplne opačný účinok. „Dávame do rúk zbrane rôznym neonacistom, politickým stranám, ktoré sú zamerané proti komunite gayov,“ dodal Horján."
0.17212197585920821,1.8851985337077481,2,sk,"A to je realita, (aj) kvôli ktorej je také dôležité udržanie sa vlády, ktorá, ak už radikálne neškrtá, tak aspoň šíri o sebe taký obraz na finančných trhoch."
1.6339284879767546,0.4500803735891961,1,pt-BR,"Mas, um minuto depois, a zaga vacilou, Patrick se infiltrou pelo meio e tocou na saída de André, para fazer para o Furacão e diminuir um pouco a festa paulista."
1.2662597534924789,0.7529664205321944,1,pt-BR,"Um forte abraço a minha família que mora no Sítio Vertentes, e que tanto amo e me dar forças para vencer na vida cada vez mais e mais."
0.6629602515602067,0.7153918725260616,1,pt-BR,"Quando está calor, a avenida da raia ferve O calor era insuportável, Sol rachando o coco na avenida da raia, a pressão caiu, senti tontura."
0.02713822669818385,0.6311004490832118,2,sk,"Keď ich v roku 1990 po rozhodnutí Najvyššieho súdu ČSFR prepustili z väzenia, žili normálny sporiadaný život ďalších 16 rokov a snažili sa o obnovu procesu."
0.26359699017296107,1.3428801757221653,2,sk,"Ide tu teda o uvedomenie si filozofického rozmeru bytia, čo sa síce dá veľmi ľahko vysloviť, no oveľa zložitejšie naplniť konkrétnym obsahom, založeným na hodnoverných a presvedčivých faktoch."
2.982887965982313,0.44429644941869645,1,pt-BR,"Os jogadores Diego e Tiago vem do Unoesc, de São Miguel do Oeste, Santa Catarina; Paulinho foi contratado ao Toledo, do Paraná; e Duda veio do Unisul, também de Santa Catarina."
4.825314279397249,-1.1849437444767328,1,pt-BR,"Além disso, a prefeitura já está recebendo currículos e propostas de empresas de consultoria que querem se candidatar para a licitação que prevê a elaboração de um plano estratégico de desenvolvimento econômico de Passo Fundo."
0.015158190741405758,0.1539070354646878,2,sk,"Hra írskeho dramatika Sebastiana Barryho The Pride of Parnell Street bola napísaná pre kampaň Amnesty International „Stop násiliu proti ženám“, hra Klamem? od holandskej autorky Laury van Dolronovej zasa inšpirovaná dokumentárnym filmom Paperclips."
0.15044820291436697,1.2101518652039431,2,sk,"Slota reprezentuje aj celú vládu, ktorú táto parlamentná koalícia drží pri živote, každého jednotlivého jej člena, ktorý vo vláde visiacej aj na Slotovej ľubovôli, napriek všetkému čo stvára, zostáva sedieť."
1.5888980238269694,0.4208480617151492,1,pt-BR,"Os adversários do Bari reclamaram com Maniero, do Venezia, que havia dito a Tuta, durante o jogo, que o empate era um bom resultado."
0.3014483849439311,0.4071231571602146,2,sk,"Kov mám rada kvôli jeho vlastnostiam. Rada využívam fyzikálne vlastnosti materiálu, tieto chcem posilniť, alebo naopak, zaradiť ich do celkom iného kontextu, a tým im dať význam."
2.511318263806654,0.4510357085568342,1,pt-BR,"Não sou isso ou aquilo, sou simplesmente o que sou, alguém que já se apegou, porém hoje não se apega a nenhum conjunto específico de crenças, mas que, na realidade, sabe apenas o que experimentou."
0.014294139466833753,0.49396623455320643,2,sk,"K tomu možno ešte pripísať aj to, že kompetentné osobnosti ani tesne pred odoslaním žiadosti o registráciu novej organizácie neboli ochotné zmeniť slovenský názov, ktorý nebol presným prekladom názvu maďarského."
6.108097382983149,0.525293850887486,1,pt-BR,"O governo de Pernambuco decretou hoje luto oficial de três dias em memória das vítimas do acidente aéreo que deixou 16 mortos nesta manhã, na região metropolitana do Recife. Em entrevista à emissoras de rádio locais, o governador Eduardo Campos disse que o governo oferecerá apoio aos parentes dos passageiros do bimotor. ""É um momento de pesar. Aproveito para transmitir às famílias das vítimas os meus sentimentos"", disse. A lista com os nomes das vítimas deve ser divulgada nesta tarde."
1.1233047045583515,0.009050592923351768,1,pt-BR,"O goleiro Muriel voltou a demonstrar habilidade contra o Vasco. Nos dois gols sofridos pelo Inter, o hamburguense fez grandes defesas no primeiro lance, mas a zaga foi lenta para afastar os rebotes, que deram a vantagem ao time carioca em São Januário."
0.13917475678631322,0.8061065124992589,2,sk,"Tieto lokality doplni dobudovanie sedemdesiatich garazi pripravenych v druhej etape vystavby na Mazornikove medzi Cestou osloboditelov a Budovatelskou ulicou, ktore postavi firma Stavohron, s.r.o., Ing."
0.0227567600062434,0.6554281517696756,2,sk,"Projekt sa uskutocnil v dvoch etapach, v ktorych si ucitelia okrem prace s internetom, osvojili aj pracu v programoch MS Word, MS Excel, ci MS Powerpoint."
3.3006070831445187,-0.7222177220690631,1,pt-BR,"“A Prefeitura está finalizando o Programa de Aquisição de Alimentos (PAA), que poderá receber recursos dos governos federal e estadual, como forma de incentivo ao produtor e para criar um ambiente sustentável para o Agronegócio”, informou."
4.521625416299494,-0.747018985560337,1,pt-BR,"Até o momento a Polícia não chegou ao local. Apesar da grande movimentação de funcionários no interior da loja e de pó de gesso espalhado pelo chão, a assessoria de comunicação do shopping nega que um assalto tenha ocorrido."
0.42309248881151507,2.6252073454900584,2,sk,"Komisia však upozornila, že na dosiahnutie tohto cieľa bude musieť Maďarsko uskutočniť dodatočné úsporné opatrenia, pričom na zníženie deficitu na úroveň 2,9 percenta HDP v roku 2006 bude musieť urobiť dôležité a zásadné úpravy."
3.016151144832695,0.22810350026063367,1,pt-BR,"Apesar disso, os quatro nadadores perderam resultados, prêmios e medalhas do Troféu Maria Lenk. “Os quatro atletas declinaram do direito de realização da amostra B. Eles definiram com precisão como o diurético entrou no organismo, restando comprovado que não houve aumento dos seus desempenhos, fato que não ocorreu nesta competição”, explica a CBDA."
0.03001642891383305,0.6538653039199889,2,sk,"Kým bežne sa zo 100 kg hrozna získa 70 litrov muštu, Dal Forno získava pre Valpolicella 32 litrov muštu a pre Amarone len 16 litrov."
9.009022928237119,0.789833897457926,1,pt-BR,"Para buscar alternativas de financiamentos voltados para o microcrédito, visando ampliar a criação de novas agências do Banco do Povo nos municípios, o secretário de Estado do Desenvolvimento Econômico e Social (Sedes), Edson Vicente, acompanhado do assessor especial da Sedes, Aníbal Martins e dos dirigentes do Banco do Povo, Manoel Serra e Arnaldo Campos, reuniu com os representantes do Banco Nacional do Desenvolvimento Econômico e Social (BNDES), Dalmo Fugita, e Angelo Fuchs, respectivamente gerente e chefe do Departamento de Economia Solidária, para tratar da disponibilidade de recursos financeiros. O encontro aconteceu no BNDES, Rio de Janeiro."
0.5820665906976611,2.134230472863575,2,sk,"Ľudia podľa neho ostávajú aj v dedinách. Obce poskytujú obyvateľom pozemky na nové domy za symbolickú sumu. Z mesta na vidiek odchádzajú skôr bohatí ľudia. „Chudobnejší zasa idú do mesta za robotou,“ tvrdí M. Bačík."
0.14881511594032848,1.1650341135816615,2,sk,"Rozdielne odpovede na tieto otázky ukazujú, že v ére detí kvetov a sexuálnej revolúcie bolo konzervatívne Taliansko ešte stále poznačené nielen hospodárskymi, ale aj morálnymi rozdielmi medzi bohatých severom a chudobným juhom."
0.31142149146763287,0.6831470902112378,2,sk,O nové kultúrne preukazy prejavilo záujem 500 subjektov Do projektu nových kultúrnych poukazov z dielne Ministerstva kultúry SR sa k dnešnému dňu zaregistrovalo 500 subjektov.
0.16839320631670793,1.7719946478121826,2,sk,"My sme chceli v rámci oficiálnych konzultácií vyjasniť, ako sa na to pozerajú jednotlivé vlády, ako môže maďarská vláda pomáhať takýmto snahám, keď s nimi súhlasí aj väčšinový národ i vláda danej krajiny."
0.16615150109098542,1.5995372169568431,2,sk,"Ľudia si všímajú splátkový kalendár, referencie developera, aj to, koľko v ktorej fáze výstavby chce od budúceho majiteľa bytu, pýtajú sa na povesť stavebnej firmy."
0.016018012465975114,0.45365114687769253,2,sk,Veď práve tohto leta predstavitelia Nesvád a Malého Kereša sa vzájomne navštívili a podpísali zmluvu o vzájomnej spolupráci a priateľstve Nesvád a Malého Kereša.
2.0708496173493804,-0.4331599480561071,1,pt-BR,"Art. 10. Poderá ser dispensada a exigência de visto, prevista no artigo anterior, ao turista nacional de país que dispense ao brasileiro idêntico tratamento."
0.14577714226173494,1.055676018311748,2,sk,"Estónsko a Maďarsko pripravujú zintenzívnenie vzájomnej obchodnej výmeny a cestovného ruchu, ako aj zjednodušenie vízového režimu a posilnenie spolupráce vo vojenskej oblasti, odznelo na tlačovej konferencii oboch štátnikov."
0.30083820912367587,0.42189565513512306,2,sk,"NASA a jej partneri z Európy, Ruska a Japonska by chceli ISS udržať v prevádzke minimálne do roku 2020, najväčší optimisti hovoria dokonca o roku 2027."
0.021156384561864444,0.5690252861223613,2,sk,"Pri jeho údajnom predošlom pokuse v roku 2004 prišli o život desiatky ľudí, keď sa terčom série bombových útokov stali veľvyslanectvá Spojených štátov amerických a Izraela."
0.003464372996536513,0.08644887476597403,2,sk,"Chcú pokračovanie rozhovorov Demonštranti chcú prinútiť palestínsku samosprávu prezidenta Abbása a Hamas, aby pokračovali v zablokovaných zmierovacích rozhovoroch a ukončili rozkol Gazy so Západným brehom."
1.229863758497855,0.48285261134201457,1,pt-BR,"Aos 11, Edmar deu um bom drible no zagueiro pernambucano e tocou para Júnior Amorim, mas o goleiro Marcelo foi mais rápido e tirou a bola dos pés do atacante do Galo."
3.5561312373450438,-0.13774351392727965,1,pt-BR,"De acordo com o médico, o assunto é realmente preocupante e entrou na pauta de discussões da Sociedade Brasileira de Pneumologia há cerca de cinco anos."
2.839292761971247,-0.7398954146743723,1,pt-BR,"A partir da próxima semana, equipes da Secretaria de Saúde de São Paulo estarão mobilizadas num mutirão de vacinação contra o vírus H1N1, responsável pela chamada gripe suína."
2.173978174000779,-0.48192219783881085,1,pt-BR,"Durante a reunião foi acertado também a forma autorizada de amontoar lixo nas esquinas, que devem ocorrer por curtos espaços de tempo e não por horas como muitas vezes acontece."
1.9321744902143159,-0.21342393613101512,1,pt-BR,"Enquanto o limite máximo salarial do governo estadual é de R$ 1.433,70 (20 horas), a Prefeitura de Santa Filomena se propõe a pagar R$ 1.521,18."
1.839009512009607,-0.19542037895770792,1,pt-BR,"Autor de várias publicações sobre saúde e educação, no Brasil e no exterior, Jairo Werner diz temer que a sociedade veja a questão da droga apenas como uma luta contra os bandidos."
2.6161307193903416,-0.3129508469680067,1,pt-BR,"Apenas algumas horas após o vazamento de uma versão em desenvolvimento do novo Windows 8, já podemos ter uma boa ideia de como está ficando o mais recente sistema da Microsoft."
0.8901325843447099,1.0105143451225134,1,pt-BR,"""O papel do bom professor é educar com amor, pois quem trabalha dessa maneira cativa seus educandos e fica gravado para sempre na memória dos alunos"", disse."
2.212583673991799,0.9166301037852912,1,pt-BR,"Vamos aguardar o andamento desse lamentável caso que poderá ser tipificado como seqüestro, uma vez que as criancinhas foram levadas sem o consentimento da mãe, que diz que era muito maltratada e espancada pelo amásio lá na terra do Evo Morales."
1.1758527496740712,0.19102423174530628,1,pt-BR,A primeira agremiação a se apresentar será a Unidos da Major Gama; logo depois será a vez da Unidos da Vila Mamona; voltando à elite do samba A Pesada será a terceira a desfilar.
0.3039912672898956,2.4164410461621215,2,sk,"Dodnes neviem, kto sú jej autori, viem však, že ignorovali prírodu a na jej úkor sa začali baviť so samosprávami a biznismeni, ktorí môžu dať aj na volebnú kampaň."
0.42198737723703456,2.554906294110052,2,sk,"Ostatné ženy, ktoré nezískali nárok na materskú dávku ako zamestnankyne alebo SZČO, majú mať od januára na podanie prihlášky na platenie dôchodkového poistenia štátom 45 dní odo dňa pôrodu."
0.15686269784872914,1.3704893731718857,2,sk,"Herec Ján Króner, s ktorým sa stretávate na obrazovkách televízie Markíza v Ordinácii v ružovej záhrade, v úlohe lekára už nakrútil mnoho filmov, inscenácií, aj seriálov."
0.18547781470952596,2.087325507622236,2,sk,Chcel by som aby si moja mamka s ockom trochu odychli niekde kde ju klud lebo ocko skoro nikdy neje doma a cely den robi v Bratislave keby sa to nejako dalo zariadit tak prosim ta ozvi sa my na 0918561644.
1.022729104091584,1.5906559974707433,2,sk,"Potom sme jabĺčka balili do novinového papiera a ukladali do debničiek, aby takto starostlivo uložené prezimovali, kým ich postupne nevynosíme z komory do školy na desiatu."
0.15967253511062254,1.1780162124734113,2,sk,"Prívrženci seriálov si prídu na svoje aj pri štvrtej sérii seriálu Poisťovňa šťastia vysielanej od 8. septembra, či pri rumunskej telenovele Cigánske srdce, ktorá predstaví divákom príbeh o láske 29. septembra 2008."
0.14492203433479087,0.9566074940285411,2,sk,"Dochodcovia si nan zaspominali na Mikulasskom stretnuti, pri druznej besede hovorili o zvykoch a obycajoch dodrziavanych v obci, ktore su pre dnesnu mladu generaciu takmer nezname."
3.1438686880087734,-0.5849111137546514,1,pt-BR,"Quanto ao processo de paz, Lula disse que ele interessa a todo o mundo porque permite que haja desenvolvimento econômico. ""Interessa a Israel, interessa à Palestina, interessa à Jordânia, interessa aos Estados Unidos, interessa ao Irã, interessa à Síria, interessa a todo mundo, porque somente a paz é que pode permitir que haja desenvolvimento econômico, distribuição de renda e justiça social."""
1.699832415017385,1.5395536769846943,1,pt-BR,"Três homens, ainda não identificados, foram mortos a tiros, por volta das 4 horas deste sábado, 30, na Rua Audálio Gonçalves dos Santos, na Vila União, região do Capão Redondo, zona sul de São Paulo."
2.5138022612416084,-0.5342036789261166,1,pt-BR,"A expectativa da entidade é que o comércio da Capital tenha um aumento de 10% nas vendas, chegando a uma movimentação financeira de R$ 1,2 bilhão."
3.250215818355733,1.5458102669147795,1,pt-BR,"A cidade do Rio de Janeiro registrou hoje a tarde mais fria do ano. Na Vila Militar, em Realengo, na zona oeste, os termômetros marcaram 18,6ºC. Anteriormente, a menor máxima havia sido registrada no dia 28 de maio, em Marambaia, com 21,9ºC."
0.2811647076537184,1.7109060479545146,2,sk,"Svoj nápad o internetovom predaji postavil s firmou ShopGuru.cz úspešne na nohy a za Atlantikom zaobstaráva rozličný tovar, najmä však elektroniku, ktorý dováža a predáva v Česku a na Slovensku."
1.9763299216498842,-0.04411948549228004,1,pt-BR,O motivo é que os aeroportos brasileiros receberão três milhões de passageiros a mais em dezembro deste ano com uma infraestrutura igual a do ano passado.
1.920401976432372,-0.4591681691322664,1,pt-BR,"Em Campinas, a Ponte Preta encerrou o jejum de quatro jogos sem vitórias, ao bater o Duque de Caxias por 4 a 1, no Moisés Lucarelli."
2.128740733336123,0.9781183624157669,1,pt-BR,"MINO–Eu desconfio que o Giulio Andreotti do mesmo partido do Moro o mandou matar atraves das brigadas vermelhas que na verdade eram coligadas a mafia, e nada tinham de vermelho."
1.4453583703608166,-0.28195975635635395,1,pt-BR,"Para realizar um orçamento não é exigido ter conhecimentos de finanças, só é preciso papel, lápis, muita disciplina e rigor para apontar todos os gatos."
1.5824925744919192,1.2568613334209493,1,pt-BR,"Na minha opinião o conceito de direita está associado ao liberalismo Politico e Econômico, como aquele que fundamenta os segmentos políticos na Europa e EUA."
1.663671012808459,-0.03906860396520857,1,pt-BR,"Parte do restante será direcionada para repasses aos municípios (R$ 54,5 milhões) e parte será repassada ao Fundo de Manutenção e Desenvolvimento da Educação Básica – Fundeb (R$ 31,2 milhões)."
4.46182184839848,-1.1534029387839346,1,pt-BR,"Além da trilha sonora de Queensryche e Whitesnake, seu processo de reabilitação é auxiliado por aulas de música e reavaliações periódicas com a equipe multidisciplinar da Rede Sarah de Hospitais de Reabilitação."
0.16742993243200954,1.676047480977607,2,sk,"Tieto myšlienky mi napádajú najmä na ulici, keď vidím starých či chorých ľudí, ktorí často potrebujú pomoc, aj keď o ňu nežiadajú, a postoj tých ostatných zdravých, ktorým ani nenapadne, aby sa opýtali, či nejakú pomoc potrebujú."
0.15368047536499108,1.213863987555945,2,sk,Počas podobnej likvidácie dlhej jenovej derivátovej pozície na prelome rokov sa jen oslabil k doláru v priebehu niekoľkých týždňov o viac než deväť percent.
3.573683534077407,-0.4948054547407994,1,pt-BR,"Com esse dinheiro, muita gente sonha com uma bela casa ou um apartamento de luxo, mas não se for num bairro nobre do Rio de Janeiro, onde será erguido um prédio com apartamentos de dois quartos e 92 metros quadrados."
0.015357526744577505,0.32427110869846715,2,sk,"Strávil som mimo bazénov štyri roky, ale potreboval som to,“ vysvetľoval s 5 zlatými, 3 striebornými a 1 bronzovou medailou zo Sydney 2000 a Atén 2004 najúspešnejší austrálsky olympionik všetkých čias."
0.012591650474466087,0.35404564987463594,2,sk,"Pri výbere partnerov si však zakladatelia musia byť vedomí, že nie všetci majú rovnaké vzdelanie v tejto oblasti, rovnaké skúsenosti, zručnosti a schopnosti v riadení, v plánovaní a podobne."
1.4283635252366458,0.10187448213692171,1,pt-BR,"O que me deixa muito contente com o bazar é que as pessoas com menor poder aquisitivo também poderão comprar no bazar porque há produtos com preços bastante acessíveis, selecionados com muito carinho”."
0.005373851798511671,0.1817054032685165,2,sk,Štefan Kassay predseda dozornej rady I.D.C. Holdingu a.s. Ďalšie novinky Okrem dizajnu čokoládových figúrok Figaro Trnava predstavuje aj praktické balenie 6 ks čokoládových vajíčok.
0.5408675590277652,0.3847069637957226,2,sk,Vinceti teraz so skupinou vedcov a historikov študujú dokumenty a porovnávajú referencie medzi presunmi da Vinciho a jeho možnými modelkami. S menom zobrazenej ženy by mohli prísť do niekoľkých týždňov.
1.1740696766695675,0.8782170803738047,1,pt-BR,"As mudanças deixaram o Palmeiras mais aceso no jogo, mas o time ainda esbarrava na marcação dos goianos, que defendiam com os 11 jogadores no seu campo."
0.4449528038361463,3.237765365354767,2,sk,"Investičný zámer firmy formálne potvrdzuje Memorandum o porozumení, ktoré dnes na Ministerstve hospodárstva (MH) SR podpísali zástupcovia švédskej spoločnosti a minister hospodárstva Pavol Rusko. Investor by mal v iniciačnej fáze výroby vytvoriť 125 nových pracovných miest. Zameria sa na výrobu hygienických výrobkov na báze papiera, buničiny a plastov. Pôjde najmä o produkciu hygienických vložiek a výrobkov pre každodennú hygienu a hygienické výrobky pre pacientov trpiacich ľahkou a ťažšou inkontinenciou."
3.2369227816202564,0.32257988187735215,1,pt-BR,"Assim, as pessoas na faixa etária de 18 a 29 anos constituíam 59,6% do total de presos, embora representassem apenas 32,5% da população com mais de 18 anos""."
2.4206392466528563,0.3262229177611848,1,pt-BR,"Para o professor Wellington Cortes, na prova de português os alunos também devem seguir o método de fazer primeiro as questões mais fáceis e depois seguir para as dificeis, assim terão mais segurança."
4.031759170490414,-0.7751777338722635,1,pt-BR,"Além de integrar e ser herdeiro de um grupo político forte e organizado que tem dominado a situação em São José do Rio Pardo, Lupercinho tem a seu favor o controle de parte de mídia."
0.05505138748625744,1.670804111481367,2,sk,"Rozhodne stojí zato pripomenúť si, že úver Aténam poskytne aj Slovensko a slovenský daňový poplatník by sa tak mal pýtať, akú má záruku, že sa jeho dane vrátia späť domov aj s patričným úrokom."
0.022441539747709873,0.3772824921087307,2,sk,ST. PAUL. Najvyššie draftovaným slovenským hokejistom je pre rok 2011 podľa očakávania útočník St. Johnu Sea Dogs Tomáš Jurčo. Čerstvého držiteľa v zámorí ceneného Memorial Cupu si vybral Detroit Red Wings v 2. kole z celkovo 35. miesta.
1.9976344746504924,-0.2964215935448512,1,pt-BR,"E, com certeza, esses poucos terão, no futuro, seu retorno em termos de lucratividade, mostrando que estão certos em não desistir agora, mesmo com um cenário extremamente adverso."
3.0131515910176745,0.18637474461108378,1,pt-BR,Outra solicitação é uma área de 85 mil metros quadrados fora do Morumbi para os convidados dos patrocinadores oficiais do evento e para os turistas que usarão os serviços da operadora oficial da Fifa.
4.082322720659525,-0.12068998934274126,1,pt-BR,"Um plano backup para cortar o déficit federal e evitar uma moratória (default) do governo dos EUA parece estar ganhando espaço, em meio à pressão para que algo seja feito. Duas agências de rating (classificação de risco) disseram nesta semana que podem rebaixar a classificação da dívida do governo dos EUA se houver default."
0.022782105871815613,0.6768854803383173,2,sk,"Štrajkujúci odborári tvrdia, že ich v Žiline zastrašovali Podľa odborárov prestať štrajkovať donútili vodičov dispečeri SAD Žilina, ktorí sa im vyhrážali stiahnutím z linky."
6.368165390701765,-0.6394579999479356,1,pt-BR,"Para Padovani, além da questão sazonal, os sinais de acomodação da economia nacional já estão sendo vistos e isso também será benéfico para a inflação, apesar das expectativas de resultados do IPCA um pouco maiores para os próximos meses. ""Os sinais de acomodação ainda não são muito claros, mas já existem. Não temos mais aqueles incentivos fiscais do passado e foi feito um aperto monetário. Acredito que essa normalização de política monetária também está trazendo efeitos para a inflação."""
