x1,x2,label,lang,texts
0.18016227541355082,2.0844685974634305,2,sk,"Vnímam ich ako priamejšie, spontánnejšie, netvária sa, že všetko na svete im je už jasné, a dokážu sa tešiť z maličkostí,“ hovorí s úsmevom magistra Hlivová."
0.006607034589106268,0.21202667001889516,2,sk,"Spotrebiteľ vníma značku najmä ako záruku kvality výrobku, súbor funkčných a emocionálnych benefitov, čosi, čo poskytuje istotu pri rozhodovaní a prispieva k tvorbe jeho imidžu."
2.5848787666815456,1.105915565137208,1,pt-BR,"A abertura será às 17h30 no anfiteatro das Faculdades Magsul com uma palestra sobre Psicologia do Esporte, com a Psicóloga Carla Maria Schneider. As demais aulas teóricas, práticas e palestras serão ministradas pelo Professor Marlos da Cruz Montes. As aulas teóricas serão realizadas nas Faculdades Magsul e as práticas, na pista de Atletismo do 11º RC Mec."
0.03536892208843336,0.9851134670584885,2,sk,"Zakladajúci členovia sa rozutekali po svete a trvalo štyri roky, kým sa dvom z nich zacnelo po muzike a spolu s jedným novým nahrali prelomový album Trávnice (G."
0.018372492349057034,0.07088245528994327,2,sk,"Najväčší medziročný pokles zaznamenalo Lotyšsko (18,6 %), za ním nasledovali Estónsko (15,1 %), Litva (11,8 %), Slovinsko (9 %), Írsko (8,4 %) a Nemecko (6,9 %)."
0.024415953582563755,0.6667774160556392,2,sk,"Recesistická skupina „Interbluetken Group, a. s.“, ktorá „sa tiež považuje za nástupcu firmy Interblue Group a deklaruje záujem o lacné slovenské emisie“ prilákala len za prvé tri hodiny svojej existencie 200 ľudí."
3.14871368734769,-0.8992520698264005,1,pt-BR,"Portanto, os vereadores ""Cal"" (de Pindamonhangaba) e Alexandre Villela (de Taubaté) são legítimos líderes comunitários e regionais, pois abraçaram bandeiras de interesses de muitas cidades."
0.28038526346687465,1.6579578227776564,2,sk,"Agresívny muž napadol policajtov, skončil na psychiatrii Popradský policajný vyšetrovateľ obvinil pre prečin útoku na verejného činiteľa 36 ročného muža z Levoče, ktorý v pondelok v Levoči napadol policajtov."
1.3362691233068644,-0.01883606793763309,1,pt-BR,"“Recomendamos sempre olhar o nível do óleo a cada 500 km ou antes de viagens longas”, indica Carlos Henrique Ferreira, assessor técnico da Fiat."
0.009898786639713785,0.2887272496683081,2,sk,"Zákon hovorí, že ak notári alebo exekútori pri svojej činnosti urobia chybu a spôsobia tým škodu, zaplatí ju v prvom momente štát – presnejšie Ministerstvo spravodlivosti SR."
2.929112642089128,0.9997028725498416,1,pt-BR,"Na primeira, em 88, ele tomou posse no dia 1º de janeiro e em seguida teve de enfrentar uma catástrofe que ficou na história da cidade."
2.3035278763426934,-0.10092397811229419,1,pt-BR,“Realizamos um verdadeiro esforço para regularizar a situação do Estado junto a órgãos como a Receita Federal e Ministério da Fazenda e nos adequando ao que determina da Lei de Responsabilidade Fiscal.
0.6328346942770213,-0.006536452421819881,1,pt-BR,"O saneamento volta às discussões quando das cheias desordenadas, dos esgotos a céu aberto, e chegam aos prefeitos que não fazem porque obra enterrada não dá voto."
1.760366657603288,0.23635522899149924,1,pt-BR,"Ações para a quebra de contratos foram levadas a todas as cortes do país, mas estas se recusavam a tomar conhecimento das transações do jogo."
0.2787632165767127,1.6362289876213731,2,sk,"Vo vyšetrovaní nepredviedli na výsluch žiadnych svedkov okrem priamych aktérov potýčky, pričom priebeh incidentu na mieste mohlo v prospech nebohého dosvedčiť päť ďalších svedkov, tvrdia Ľudia proti rasizmu."
2.1548545830041848,-0.24168733680765064,1,pt-BR,"O MPF, então, interpôs recurso extraordinário dirigido ao STF sob o argumento de que a exigência do diploma específico violava o direito à liberdade de expressão."
1.5144349743801557,-0.2686701731814632,1,pt-BR,""" Dunga começou a amenizar as críticas ao seu trabalho a partir da goleada sobre Portugal por 6x2, no amistoso disputado em novembro de 2008."
0.19052743435548183,2.282767660923173,2,sk,"Pokiaľ je ochorenie v štádiu, že je lokalizované a nachádza sa na takom mieste v tele, kde sa dá vyoperovať, tak je základom liečby operačný zákrok."
2.1746756768185023,1.0831149661063733,1,pt-BR,"« Prefeito de Macapá controla ônibus na cidade, afirma PF TSE alerta para mensagem falsa na internet pedindo atualização de dados » Voce pode pular para o fim e deixar mensagem."
2.5762574317358777,-0.5535636995488558,1,pt-BR,"Além disso, desde que descobriu que frutas e verduras são mais em conta em mercados de bairro, deixou de comprar esses itens nas grandes redes."
0.14600035664803537,1.0597591265186903,2,sk,"Ako informovala hovorkyňa UniCredit Bank Zuzana Ďuďáková, úver je určený na financovane energeticky úsporných projektov a projektov v oblasti rozvoja obnoviteľných zdrojov energie prostredníctvom programu Slovseff."
0.5878600520246989,2.317556081465341,2,sk,"Neviem, kde otec zohnal plechy na obidve okna do ulice a zavesil ich na okenny ram tak, aby v pripade prilisnej zvedavosti sa bezproblemovo dali odchylit."
4.352506538804966,0.07695744321117173,1,pt-BR,"A Apae de Passo Fundo, por intermédio de sua presidente, Silvia Portillo, e de sua diretora da comunicação, Tais Rizzotto, convida a coluna para o lançamento do calendário 2011 Apae, no dia 1º de dezembro, às 18h, na sede da entidade."
0.5801043882891783,3.9303926148645516,2,sk,Stanovisko k clanku Hor sa na kone Dna 24. septembra sme sa na zaklade pozvanky Krajskeho uradu v Banskej Bystrici zucastnili na tratovej porade k zostave cestovneho poriadku ZSR na obdobie 2000/2001.
0.03877026322575317,1.102841648316752,2,sk,"Vedel som, že niekoho hľadajú a dozvedel som sa to od ľudí zo spoločnosti Salomon vo Francúzsku, s ktorými je v kontakte Daniel, lebo Nasťa používa ich topánky."
3.6002094638752746,-0.9202953341707588,1,pt-BR,"Vejam o histórico de professores desde o curso secundário e veremos que toda esta denúncia de perseguição a alunos, de falsidade ideológica e abuso de altoridade é muito comum nos profissionais da educação."
0.14536714996590092,1.0224989636263386,2,sk,"Súboj na barokové rapiere však ukázal, že členovia tejto skupiny dokonale zvládajú šermiarske umenie, ktoré trénujú podľa zachovalých historických zdrojov s presným krokovaním i technikou obrany a útoku."
0.04060890155054032,0.07721842748572065,2,sk,"Dna 25. novembra uplynie jedenast rokov odvtedy, co nas opustil nas dobry otec, stary a prastary otec So zialom v srdci spominaju deti s rodinami."
0.276286719967788,1.5682090030218816,2,sk,Letectvo Veľkej Británie dopravilo na Slovensko asi 1650 kilogramov zdravotníckeho a spojovacieho materiálu a americké letectvo dopravilo na povstalecké územie asi 24 ton vojenského materiálu.
0.00333897152393215,0.09409609261489198,2,sk,"Táto hlása ideu maďarských gárd, ktoré sú úzko prepojené a vyobrazením symbolov navzájom kooperujú,” informovala zástupkyňa hovorkyne Krajského riaditeľstva Policajného zboru v Košiciach Jana Mésarová."
6.6419681996028075,-1.488422450648124,1,pt-BR,"Processos de pessoas que dizem não ter conseguido participar da eleição foram iniciados no Estado da Virgínia. Um juiz se recusou a estender o horário de votação e também a enviar urnas eletrônicas para redutos de maioria negra em algumas áreas. O grupo de direitos civis National Association for the Advancement of Colored People pedia essas mudanças em um processo federal, argumentando que algumas zonas em que se concentram minorias teriam comparecimento recorde e seriam prejudicadas pela falta de urnas eletrônicas."
0.15127039912491935,1.2419197521636194,2,sk,"Pri výtvarných riešeniach dôležitosť dostáva plachta, ktorá je na javisku ľahko manipulovateľná a ako scénografický metaznak pulzuje s dejom, zároveň je symbolom zmätku v duši hlavnej protagonistky."
0.15368533258848507,1.2383894739007044,2,sk,"V prvej časti vystúpili miestni žiaci, členovia slovenského krúžku, so slovenskými básňami a piesňami a žiaci z Čabačudu, ktorí sa predstavili hrou na citare."
0.005943210055996936,0.14089201801731768,2,sk,Deň kultúrneho dedičstva v Novom Meste pod Šiatrom V druhej polovici septembra pod záštitou Európskej únie v rámci Dňa kultúrnych pamiatok v školách po celom Maďarsku poriadali Dni kultúrneho dedičstva.
0.8961592468899581,0.21424391330043796,1,pt-BR,"“A dragagem é fundamental para evitar ou reduzir os problemas causados pelas cheias do rio”, ressalta o coordenador da Defesa Civil municipal, Edvan Nunes."
1.610454197664464,-0.21739253468695802,1,pt-BR,"” Para exemplificar como as transações futuras funcionam, Abrão analisa um exemplo prático que ocorreu este ano, quando a soja atingiu patamares de U$ 23,00 a saca no mercado futuro."
3.2927522742079147,-0.7460373716381552,1,pt-BR,"” Luiz Inácio Lula da Silva “Você, de esquerdista que não entende nada de economia, e eu, de fanático que não tem nenhum interesse pela agenda social."
0.1658153424257411,1.6630203894412052,2,sk,"„Spoliehať sa na turistov môžeme len počas letnej sezóny. V zime sú Slnečné jazerá prázdne, hotely žijú zo svadieb, je to úplne iný režim ako v lete."
1.9588054000157074,-0.536644410329751,1,pt-BR,"Rubico Carvalho é também um grande criador de corte e faz a engorda de 12 mil animais em várias fazendas, espalhadas por São Paulo, Goiás e Mato Grosso."
3.2057572059954773,-0.5947101385838062,1,pt-BR,A Câmara Municipal de Magé (RJ) entrou com um mandado de segurança no TSE (Tribunal Superior Eleitoral) para tentar suspender as eleições suplementares marcadas para o dia 17 de julho no município.
1.2921369544916903,-0.018375800728507738,1,pt-BR,A Veiculação da imagem a que eu me referia foi em referencia das fotos das três crianças que estavam sendo colocadas junto com a informação.
0.020549538495966385,0.6156353552862186,2,sk,"V Kanade rastú nové domy Počet začatých stavieb domov v Kanade v januári vzrástol o 5,8 %, pričom sa zväčšil počet novostavieb jednogeneračných domov aj viacbytových.."
0.010813815528443401,0.3165137825209926,2,sk,"Nezisková organizácia Oáza – nádej pre nový život v Bernátovciach pri spaľovni prevádzkuje útulok s trvalou kapacitou 40 miest, ktorá je v zimných mesiacoch dočasne zvýšená."
0.29989552659572966,0.37553029296631196,2,sk,(4) Zamestnancovi po skončení odbornej prípravy zamestnávateľ poskytne za čas odbornej prípravy náhradu mzdy v sume jeho priemerného zárobku najneskôr do konca nasledujúceho kalendárneho mesiaca.
2.3920217488084417,-0.04717786155641685,1,pt-BR,"""Estamos cobrando que se publique imediatamente o relatório técnico descritivo dos Alpes para que se encaminhe para a publicação do decreto de desapropriação em Brasília"", diz."
2.061710582902952,-0.08813458997314226,1,pt-BR,"Apesar de não se ter ainda um valor estimado, já é certo que o Governo do Estado, através da Agecopa, será responsável pelo pagamento das desapropriações."
1.7465317248738963,0.7052229395679555,1,pt-BR,"Os pais poderão avaliar o material enviado para os alunos e dar um retorno na reunião com os professores da creche, que será marcada posteriormente pelo presidente da SAT, Aurélio Camilo."
0.7809800795188094,0.26705872976894524,1,pt-BR,"Praticante do esporte há seis anos, Celso sempre esteve integrado no meio através dos encontros e competições realizadas pelos clubes e sociedades simpatizantes da prática."
3.632433954769019,-0.8638608099602438,1,pt-BR,"Se este programa por si só é alienante e pobre, se propor a discutir sobre ele em um jornal de cunho institucional é no mínimo chamar a gente de burro de fato e de direito."
0.15303223200888127,0.8303016557936157,2,sk,"Vo svojom piatom štarte v letnej sezóne oslávil stredajšie narodenie syna Georgija zlepšením svojho tohtosezónneho maxima z mítingu vo francúzskom Montreuile o 14 cm na 17,18 cm."
8.34532461090306,-1.6629955479279357,1,pt-BR,"A Defensoria Pública de São Paulo, em parceria com a Secretaria Especial de Políticas para as Mulheres da Presidência da República, realiza a partir deste mês um mutirão de atendimento a todas as mulheres presas – provisórias e definitivas – nos estabelecimentos prisionais do Estado de São Paulo. Os atendimentos começam em outubro e a estimativa é de que, em um ano de trabalho, as 11 mil mulheres hoje encarceradas tenham recebido a visita de Defensores Públicos, que prestarão assistência jurídica integral e gratuita."
2.3903589295232326,0.0003569713445429122,1,pt-BR,"As fotos deste rio em meio a Rua 1508 que ilustra esta matéria foram tiradas no último dia 05 de janeiro deste ano. Moradores desta localidade pedem encarecidamente por ajuda, pois não suportam mais tamanho descaso do poder público que já acontece há vários anos."
2.90700912225161,-0.4749248030534278,1,pt-BR,"“No mais tardar em abril, com esses recursos garantidos, a empresa deverá concluir a obra para fazer as ações para gerar emprego e renda, o objetivo que o governo Lula espera de um projeto de irrigação”, disse o diretor."
2.764922575991454,-0.2053509720561377,1,pt-BR,"Escrito a partir do expertise da autora, que há mais de 30 anos atua no mercado de fitness e wellness e tem como alunos alguns dos principais empresários brasileiros, o livro oferece uma abordagem inovadora."
0.15200659863296742,1.0242575344698237,2,sk,Druhou súčasťou zóny je rezidenčný areál plánovaný na 15 hektároch. Tu chce developer vybudovať infraštruktúru pre individuálnu výstavbu rodinných domov. Predbežný termín štartu výstavby sietí znie leto 2011.
3.038981556778795,-0.33702051918485393,1,pt-BR,"Ele considera que, ao preservar a natureza, o produtor não está apenas cumprindo uma obrigação, mas prestando um serviço para toda sociedade, além de renunciar à renda que derivaria do uso agrícola de tais áreas."
0.15963228871810747,1.3780215511879976,2,sk,"Jediný rozdiel medzi týmito dvoma dámami je v tom, že kým Victoria verejne priznala silikóny, Erika stále trvá na verzii, že za jej o dve čísla väčšie prsia môžu zázračné výživové doplnky."
0.01487394952533436,0.43610975207982877,2,sk,"Duálne zobrazovanie cenoviek by malo predísť aj všeobecne očakávanému efektu zaokrúhľovania cien nahor, teda aspoň pre tých, ktorí poznajú dnešné ceny a budú ich vedieť porovnať s tými potom (hoci tiež uvedenými v korunách)."
0.14559928475851464,1.024594317157748,2,sk,Mikuláš Č. pred senátom Okresného súdu v Prešove čelí obžalobe zo spáchania šiestich vrážd a spolu so svojím exšvagrom Jozefom M. aj obvineniu so spoluúčasti na usmrtení podnikateľa Mariána Karcela.
1.0762060432929497,0.22455551698403814,1,pt-BR,"O problema é que esse berrante maior do mundo é muito pesado, faço muito esforço para manter o instrumento firme no pulso, mas vale a pena, o toque dele é muito alto, uma sonoridade fantástica."
2.580778208584182,-0.5028862247426431,1,pt-BR,"O segredo está em encarar as personagens e as histórias vividas por elas como ensinamentos para a nossa própria vida, analisando o que elas fazem de positivo ou de negativo e tomando isso como exemplo a ser seguido ou a ser descartado."
0.8820703929788795,0.022738977104618564,1,pt-BR,"A internet, que a princípio deveria ser usada como canal para facilitar a comunicação e aproximar as pessoas, sofreu forte descaracterização com os crimes cibernéticos."
5.011302124583944,-0.3710999508301282,1,pt-BR,"Esta decisão implicará na perda para a atleta de índice já conquistado para os Jogos Olímpicos de Londres 2012 e perda de participação no 14º Campeonato Mundial dos Esportes Aquáticos da FINA, de 17 a 31 de julho, em Xangai."""
0.14378049482695715,0.9031834484889042,2,sk,"Na druhej strane o podniky so zahraničnou účasťou, kde zahraničný partner vyžaduje napríklad v oblasti kontroly človeka so znalosťami systému a noriem domovskej krajiny i jazyka."
0.2962086359466385,2.1383580587578948,2,sk,"Komisia poverila Európsku agentúru pre bezpečnosť letectva, aby uskutočnila sériu misií technickej pomoci na podporu príslušných orgánov v niekoľkých štátoch v ich úsilí zvýšiť bezpečnosť a reagovať na niektoré obavy týkajúce sa bezpečnosti."
0.2754267190639285,1.5432235547545756,2,sk,"Dve hodiny trvalo 25 mužom z Oravy a Liptova, kým transportovali mŕtveho Čecha na nosidlách z výšky takmer 2 000 m na Ťatliakovu chatu."
2.0330320340566974,0.6531002642585589,1,pt-BR,"Em seguida, ainda no lado externo da Igreja, aconteceu o hasteamento da bandeira do Vaticano e do Brasil ao som, respectivamente, da Marcha Pontifícia (hino papal) e do hino nacional executados pela Corporação Musical Maestro Francisco Paulo Russo."
2.6678238163717984,-0.2313344631875872,1,pt-BR,"Porem, houve o grande erro do governo cubano de não investir numa política mais agressiva de industrialização (é verdade que isto foi muito dificultado pelo bloqueio dos EUA), usando sua estrutura educacional para promover o desenvolvimento tecnológico."
1.7477031279231068,-0.2713501195299057,1,pt-BR,"A audiência continuou com muitos ataques aos direitos indígenas, e uma discriminação muitas vezes disfarçada de boas intenções, afirmando que não existe luta contra os verdadeiros povos da floresta."
0.0226473444419777,0.5959236994433958,2,sk,"Dvadsaťštyri spevákov bojujúcich o titul Česko Slovenskej SuperStar sa v pondelok o ôsmej hodine večer stretlo v prezidentskom apartmáne Leoša Mareša, aby si spolu s ním a jeho moderátorskou kolegyňou Adelou Banášovou pozreli diel s názvom Dlhá cesta."
0.9327127958798396,-0.21399124948146586,1,pt-BR,"Doenças hepáticas, ingestão de corpos estranhos, pancreatite, cistite, piometra, problemas neurológicos com síndrome vestibular, tumores e várias outras patologias também podem estar associadas à disfunção."
0.16872970654220423,1.6588591618587534,2,sk,"Ulice Madridu zaplnili tisíce homosexuálov V španielskej metropole Madrid sa v sobotu zhromaždili státisíce gejov, lesieb a ich priaznivcov, ktorí sa zúčastnili na tradičnom sprievode v uliciach mesta."
0.3012005854990088,2.3674928658873875,2,sk,"Bolt už je zdravý, teší sa na tréning Svetový rekordér v šprintoch na 100, 200 a 4 x 100 metrov Usain Bolt je zdravotne stopercentne v poriadku a už začal s prípravou.."
3.9123903309320616,0.02829110094623732,1,pt-BR,"Itamar Gonçalves, diretor da ONG Childhood Brasil, sugere que as fabricantes e operadoras de celulares promovam alguma campanha para alertar os clientes ""teen"" sobre os riscos da troca de mensagens íntimas e da exposição de imagens na rede."
3.2863850550577665,-0.8971867768141041,1,pt-BR,"“A construção desse campus é uma transformação de 180 graus para o município”, destacou a secretária de Educação de Garopaba, Maria Nadir de Araújo Souza."
5.5002179484285225,-1.2613843708777015,1,pt-BR,"Os ambientes de coworking contam com diversas posições de trabalho em área aberta e coletiva, além de sofás, cozinha e balcão. “A pessoa não precisa gastar tempo para calcular gastos de IPTU, água, luz, transtornos com encanador e tantos outros. E, assim, os custos acabam caindo para todo mundo, além de não desperdiçar tempo que pode ser dedicado integralmente ao trabalho”, enumera Pegorer."
0.937984580960222,0.42386430972216044,1,pt-BR,"""Vamos ver durante a semana como será o desempenho do Leonardo e definiremos mais pra frente se ele poderá ou não participar do jogo"", disse Giuntini."
0.9538350361222536,0.0895095292100066,1,pt-BR,"Eu me lembro que, aqui no Palácio (dos Bandeirantes), nós condecoramos todos aqueles que ganharam prêmios nas Olimpíadas, ganharam medalhas nas Olimpíadas e no Pan nessa área."
0.16178802823538319,1.5056576495865015,2,sk,"Drahá reklama neposkytuje potrebné informácie, pre koho je v stručnosti pomoc určená a hlavne na koho sa môžu podnikatelia obrátiť keď majú záujem o takýto druh pomoci."
0.1464598125896404,0.9851874742898035,2,sk,"Bol si vynikajúci otec a hlava rodiny,“ spínala ruky k nebesám manželka Jána Popluhára Cecília, keď sme otvorili dvere na ich dome v Bernolákove."
3.2088014645999374,-0.4763584597060751,1,pt-BR,"O presidente do Comitê de Ações Emergenciais, Luiz Eduardo Peixoto, comandou as ações da Comdep, Secretaria de Obras e Defesa Civil, que estavam de prontidão."
1.1688279951120937,0.2368986219367823,1,pt-BR,"Para se ter uma ideia do potencial dele, o político teve, há 12 anos, mais votos que Weslian Roriz (440 mil) no último domingo."
0.8847373828714786,2.6441218858757316,2,sk,"Prekvapivý vstup Itery na postsovietsky plynárenský trh sa dáva do súvislosti s nástupom Alexandra Puškina do najvyššieho vedenia Gazpromu, kde je zodpovedný práve za obchodnú činnosť ruského koncernu na území SNŠ."
2.528320123714355,-0.6002000928827618,1,pt-BR,"O interessante, era que apesar da irreverência ao participar de um desfile de carnaval sem tocar nenhuma música, não se fazia nenhum protesto, era realmente um bloco diferente o “Purgatório”."
2.5728616190007494,0.8886697317125117,1,pt-BR,"É curador da Feira do Livro de Jaraguá do Sul e do Festival Literário do Mar, cronista fixo dos jornais A notícia e O Correio do Povo, onde escreve aos sábados."
0.009293371593603198,0.26022917804710144,2,sk,"Gyurcsány si dal tajným hlasovaním v parlamente potvrdiť súhlas s rozsiahlymi ekonomickými reformami, akými je zníženie obrovského rozpočtového deficitu a transformácia neefektívneho verejného sektora."
1.4235561466673483,-0.03436113701994696,1,pt-BR,"Começando pelo goleiro, não entendi porque o Renan Rocha perdeu a posição para o Márcio, mesmo sabendo que o Renan não foi até agora perfeito, posso afirmar que ele inspira mais confiança que o outro goleiro."
2.704678498430152,-0.46470604093251094,1,pt-BR,"Mas se Poliana Okimoto ficou sem o troféu de melhor esportista feminina de 2009, seu técnico e marido, Ricardo Cintra, conquistou o título de melhor treinador do ano."
0.055814737425895496,1.8069785473510318,2,sk,"„Napriek predpokladom, geofyzikálny prieskum ešte nie je ukončený nejaký čas zaberá obstaranie respektíve zazmluvnenie. Prvé výsledky z neho budú až v septembri. To je to, čo sme očakávali, že bude koncom júla. Geologická štúdia je druhá vec, tú máme spracovanú od jari. Práve jej základe sme prijali predbežné opatrenia kvôli bezpečnosti ako napríklad semafory. Plus špecifikoval sa rozsah geofyzikálneho prieskumu,“ povedala hovorkyňa Regionálnych ciest Bratislava Mária Rajtová."
5.21333400683134,0.2661633892334423,1,pt-BR,"A Secretaria Municipal de Obras, através da coordenadoria municipal de estradas rurais, foi questionada sobre 26 quilômetros dentro do Joana D’arc. De acordo com a coordenadora Regina Maria, “a prefeitura está fazendo além do conveniado com o Incra desde 2005. Já cumprimos com a maioria do que foi determinado pelo convênio, e mesmo assim, recebemos parcialmente os recursos via Incra para a execução dos serviços, mas até o final do ano vamos terminar nossa parte”, explicou."
0.019445794618795247,0.4762677377337371,2,sk,"Počas nakrúcania akčnej komédie Mr. and Mrs. Smith (2005) si získala nielen medzinárodnú slávu, ale aj životnú lásku Brada Pitta (44), s ktorým si stihla adoptovať už 3 deti a porodiť mu dcérku Shiloh (2) a dvojičky Knoxa Leona a Vivienne Marchelina."
1.6086456732197747,-0.07745357957056861,1,pt-BR,"Esta decisão estratégica, levou a International Paper a realizar um plano de transformação por meio do qual desinvestiu em determinados negócios para concentrar esforços nos segmentos escolhidos."
0.007132942959763475,0.23318013914607952,2,sk,"Pomoc ľuďom v sociálnej núdzi a osobám bez strechy nad hlavou je jedným z hlavných cieľov projektu Cesta k domovu, ktorý realizuje Gréckokatolícka diecézna charita."
2.124714659759611,-0.23207550620503575,1,pt-BR,"O objetivo de Cassol, segundo expôs aos presentes à reunião, é eleger o empresário quebrado, Denis Baú, presidente do Sindicato das Indústrias da Construção Civil de Porto Velho."
2.013955335834761,0.41488139642394223,1,pt-BR,"Antes do anúncio dos resultados, analistas estrangeiros haviam pedido calma e as escolas do país já estavam fechadas em consequência do temor de incidentes."
1.470817051907485,-0.19359316121227382,1,pt-BR,"Segundo a Infraero, mesmo com o cancelamento dos voos, não havia aglomerações nos balcões de embarque como as registradas nos primeiros dias da erupção."
5.770248742055416,0.3708132286029101,1,pt-BR,"Há cerca de dez dias, outro arrombamento foi detectado no local, com uma ocorrência registrada na delegacia do Meio Ambiente da Polícia Civil. A fechadura da porta foi trocada e de lá para cá, os atuais servidores começaram a reforçar a porta, com a colocação de uma mesa e uma cadeira auxiliando no travamento da porta. De nada adiantou. A mesa e a cadeira ficaram destruídas pelo invasor do local."
4.03006755111769,0.2531311522388563,1,pt-BR,"O governo municipal alega queda na arrecadação como fator que impede a administração de conceder um aumento maior, temendo comprometer as contas públicas, já que já existe um comprometimento de 49% do orçamento com gastos com pagamento de pessoal."
1.1984480910692066,1.0495089993572815,1,pt-BR,No mesmo dia eles foram recebidos para um almoço no Restaurante Parque dos Pinheiros e com o jantar na sede do grupo Nei Tempi Del Filó.
