x1,x2,label,lang,texts
0.024071883753450932,0.8116108576045896,2,sk,"Je faktom, že ich Leonard to bude mať v živote oveľa ľahšie ako ostatné deti, samozrejme k vôli tomu, že má tak známych rodičov."
0.00586897189668783,0.19225183118232114,2,sk,"V obnovenej komárňanskej bašte založia Galériu národov V apríli začnú v Komárne rekonštruovať Baštu V., ktorá je súčasťou národnej kultúrnej pamiatky Pevnostný systém Komárna."
0.022948788862213413,0.7243721988458012,2,sk,"Myslím si, že kultúra môže byť tou cestou, ktorá môže národy, ale aj národnosti zbližovať, a účelom tejto konferencie je určite zblížiť,“ povedal pre TASR Tóth."
2.629655453766503,-0.23011322077476457,1,pt-BR,"Segundo Ricardo, o piscicultor da região que estiver interessado em fornecer a produção para o frigorífico pode entrar em contato com a Associação, que funciona junto com a Sociedade Rural dos Campos Gerais, no Centro Agropecuário de Ponta Grossa."
0.016561863259316075,0.46028003944114865,2,sk,"Priemyselná produkcia v Maďarsku poklesla v septembri oproti augustu o 5,3 %, pričom v porovnaní s rovnakým mesiacom minulého roku sa znížila o 4,4 %."
0.007685191039736836,0.12698802387122962,2,sk,Napriek všetkým deklarovaným a medializovaným dobrým úmyslom početných rečníkov zabezpečiť kontinuitu Kjótskeho protokolu po roku 2012 nezostal americký prístup k ochrane životného prostredia úplne izolovaný.
0.1419177703789458,0.9167363398380929,2,sk,"Dobu, v ktorej Galandovci ako rytieri na bielych koňoch povstali proti valu šedi, formalizmu a lži socialistického realizmu a nakoniec víťazne prerazili cestu slobodnému modernému maliarstvu u nás."
0.3151244069126052,2.615746306875469,2,sk,"V stredu sa budú oči divákov upierať aj na Španiela Fernanda Torresa, ktorý sa v januári upísal Chelsea z konkurenčného FC Liverpool za astronomických 50 miliónov britských libier a odvtedy stále čaká na premiérový gól."
1.9639775343165073,-0.3779921578771207,1,pt-BR,"Carro furtado é encontrado em chamas Os PMs Sérgio e Paulino no início da tarde de domingo, se dirigiram até próximo ao Aterro Sanitário onde um motorista localizou dois carros, um deles em chamas."
0.1750319778528365,1.7659917681290134,2,sk,"""Rozhodnutie by malo padnúť v utorok (23. 8.),"" povedal minister financií Aleksander Grad. ""Súčasná situácia na trhoch je nestabilná a ak by som sa mal rozhodnúť dnes, tak by som navrhoval pozastavenie procesu (privatizácie),"" dodal."
1.9883246158244035,-0.5296342819677664,1,pt-BR,"Hoje o sistema eleitoral alimenta a divisão dentro de um partido, ele alimenta disputa entre os membros de um mesmo partido, por conta dessa falsa lista aberta apresentada à sociedade."
0.16548664673621888,1.571628638780912,2,sk,"Kríza je nespravodlivá a môžu za ňu chamtivci. Takto „rieši“ súčasnú situáciu obyčajný človek. Podnikatelia túto možnosť úteku od reality nemajú – po riešenia musia načrieť hlbšie. Nastalo obdobie rizikového manažmentu a vytvárania vankúšov proti stratám, ktoré podniky ešte minulý rok nečakali. Neefektívne šetrenie však nepomôže. Netreba si vystrieľať všetky zbrane a v rámci úsporných opatrení zhasínať aj svetlo na konci tunela."
2.9982989164675686,0.017628246488498506,1,pt-BR,"Roubo pode chegar a R$ 43 milhões em BH 14h17 A quantia levada por uma quadrilha de uma empresa de valores de Belo Horizonte na manhã deste sábado (4), pode chegar a R$ 43 milhões, segundo informações divulgadas por pessoas ligadas à investigação."
1.84163812404059,0.5223918415585365,1,pt-BR,"Na Escola Estadual João Ramalho, por exemplo, chegamos a informar a dois policiais militares que havíamos presenciados essa ilegalidade no local, e ouvimos a seguinte explicação de um dos soldados da Polícia Militar."
0.17606955558805235,1.8905768556799711,2,sk,"Keď prišla domov tak nám povedala, že toto som dostala pre vás, aby ste sa hrali, ale nechám si to ja, lebo vy ste na hranie už veľkí."
0.1517072115108842,1.1914348294432335,2,sk,"Markíza túto reláciu odkukala zo zahraničia a zmutovala ju na takú trápnu reality show, kde dôležité je asi len šokovať diváka či už v dobrom alebo zlom."
0.0157210447441483,0.5176506664801167,2,sk,"Súd rozhoduje aj o žiadostiach zrušiť určitú časť európskej legislatívy, ako aj vo veciach škody, ktorú spôsobili pri výkone svojej práce európske inštitúcie, prípadne ich zamestnanci."
0.17894748350617642,2.0042232117289336,2,sk,"Zajac zdôraznil, že nejde o návrh novely zákonov, ale len o ideu, na základe ktorej, ak ju koalícia prijme, by sa mohli novelizovať zákony o STV a SRo a zároveň by sa nimi zrušili rady oboch médií."
1.3112539826670218,3.458334997206652,2,sk,"Akcia oficiálne trvala do druhej hodiny a kto chcel, mohol sa potom presunúť na after párty do Budha baru na Medenej ulici, alebo napríklad do spriateleného klubu Spojka o kúsok ďalej na Prešernovu."
0.022387084227467713,0.6208096982141024,2,sk,"Poslancov som oboznamil aj s obsahom listu hlavneho skolskeho inspektora o cinnostiach, ktore mesto vykonava v ramci udalosti, ktore sa v poslednom obdobi stali v gymnaziu."
2.667608988495104,-0.24799979658852173,1,pt-BR,"Cada um de nós, quando casa, leva para o casamento valores, vícios e histórias de família que nem sempre combinam com os do parceiro."
0.6215032711812009,1.4099219675634285,2,sk,"Politický chaos pred voľbami v roku 2001 vyniesol postkomunistov k triumfálnemu víťazstvu a postsolidárne strany uvrhol do bezvýznamnosti – AWS, ktorej sa stal Buzek v roku 1999 predsedom, sa nedostala ani do parlamentu."
1.241106140857099,0.9139256836310253,1,pt-BR,"Na mensagem, Obama justifica a posição da Casa Branca favorável à realização das eleições em Honduras sem que o presidente deposto Manuel Zelaya tenha reassumido o comando do país."
0.8022867853704346,0.06694116199496872,1,pt-BR,"As primeiras ocorrências da doença foram registradas no México. Os Estados Unidos, o Canadá, a Espanha e o Reino Unido também já têm casos confirmados. Somente no México, já foram confirmadas 20 mortes pelo vírus."
0.024209018786826724,0.7214858957634297,2,sk,"""Možno aj preto NBS dôkladne zvažuje každý krok, a preto sa môže zdať, že pristupujeme zdanlivo neskoro k ráznejším krokom voči nebankovým finančným subjektom."
1.1935716085822299,0.9058204321346631,1,pt-BR,"Na região central o voto dos candidatos foi bem disputado, sendo que em um colégio eleitoral do centro Myriam alcançou 1.187 votos e Vito teve 1.886, pouca a diferença."
0.5559969120123945,3.232331861250574,2,sk,"Na ďalší rok si tento kúsok zopakoval, keď na Everest vystúpil opäť na jar i na jeseň, tentoraz však tradičnou cestou Číňanov zo severnej strany."
0.02574654928037482,0.7765477067570179,2,sk,"Prejaviť by sa už mali aj výsledky súvisiace s reštrukturalizáciou úverov po vstupe zahraničného partnera, ktoré kvôli vyšším poplatkom bankám jednorazovo zvýšili finančné náklady."
0.940009929807742,-0.06708059004958496,1,pt-BR,"Motorista preso em flagrante por danificar viatura da PM O motorista Edenilson Teixeira, 28 anos, foi preso em flagrante no domingo à noite por dano ao patrimônio."
0.023194091575948473,0.7189268801413146,2,sk,"Účastníci podujatia sa v štyroch sekciách venujú problematike hydrológie vodných tokov a nádrží, diskutujú o kvalite vôd, prevencii povodní i katastrôf súvisiacich so zamorením vodných tokov, ako aj zdravotníckych aspektoch vodného hospodárstva."
0.04389551138274676,1.265835467997017,2,sk,"Okrem neho zahynuli ďalší štyria ľudia, medzi nimi aj bin Ládinov syn či žena, ktorú použili ako ľudský štít. Z amerických jednotiek, ktoré sa zmocnili tela, sa nikto nezranil. Akcia trvala 40 minút."
0.1467911623260891,0.9442972865826746,2,sk,"Z nedávneho vyjadrenia bývalého českého ministra životného prostredia Martina Bursíka vyplynulo, že Česko získalo z predaja každej tony povoleniek na vypúšťanie oxidu uhličitého asi desať eur (zhruba 300 Sk)."
2.19129936006444,-0.45301105245344214,1,pt-BR,Nosso sistema de saúde é caro demais; nossas escolas falham para muitos; e cada dia traz novas evidências de que os modos como usamos a energia reforçam nossos adversários e ameaçam nosso planeta.
4.508071100827645,-0.19085832003899794,1,pt-BR,"Na época o projeto foi retirado da pauta de votação para uma análise mais completa por parte dos vereadores, e conseqüentemente a reparação de possíveis irregularidades por falta de apresentação de documentos, que comprovassem a regularidade da empresa."
0.004794078444903808,0.08773208959303355,2,sk,"Pracovnici Inspektoratu Slovenskej obchodnej inspekcie pre Banskobystricky kraj v 48. a 49. tyzdni dovedna skontrolovali 132 prevadzkovych jednotiek, v ktorych vykonali 72 kontrolnych nakupov."
0.044537665890445416,0.9370941758249614,2,sk,"Dcérka sa narodila 14. septembra a mala sa volať Carolina, otec však spod zeme poslal žene odkaz, aby dala dievčatku meno Esperanza, čiže „Nádej“."
1.826455496047173,-0.3167118939354068,1,pt-BR,"Escolha um nome para a sua empresa pela Numerologia Quando selecionamos o nome de uma empresa, estamos criando, não apenas uma imagem, mas também as tendências que atuarão nela."
0.29628762803076886,2.2124118583865426,2,sk,"Novozavedené opatrenia zahŕňajú neustále monitorovanie morského pobrežia na člnoch, ako aj rozmiestnenie pozorovacích veží pozdĺž pobrežia, na ktorých sa budú mať služby profesionálni potápači vybavení ďalekohľadmi."
0.16640688904646014,1.695793343205386,2,sk,"Ako informoval dnes hlavný organizátor a košický jazzman Gejza Szabados, stretne sa na nich špička hlavne slovenského jazzu, ako je Ľuboš Šrámek Quintet, Radovan Tariška a Ondro Krajňák, česká jazzová scéna zastúpená Danom Bártom, či vynikajúci poľskí a americkí hudobníci zo Steve Logan Tria."
0.04060467784047583,1.1468756748320246,2,sk,"Aj pred zápasom so Spartou som sa pozeral, kam sa môžeme posunúť smerom hore,"" uviedol v rozhovore pre oficiálnu stránku ""zošívaných"" slovenský futbalista Karol Kisel."
0.4398705477752188,1.2728445477549812,2,sk,""" Na druhú stranu nový chicagský štvrtý útok nie je vôbec do počtu, keďže produktivita jeho členov výrazne prevyšuje klasické &quotudržiavacie"" formácie umožňujúce krátky oddych pre elitných útočníkov."
0.1435029184139676,0.9807691686730833,2,sk,"Gang Róberta O. zavraždil Estóka zato, že im konkuroval Vraždu Jozefa Estóka, ktorú má na svedomí podľa obžaloby zločinecká skupina Róberta O., pripravovali páchatelia niekoľko týždňov."
2.225642948380203,0.29593824200274443,1,pt-BR,"É uma família ali com seus genros, madrinhas e outros agregados que convivem a longo prazo numa casa de fazenda próxima de São Petersburgo, na Rússia."
1.9280812660248483,-0.23778926166142825,1,pt-BR,"Ela já foi chamada também de imprensa sadia, porque se alimentava muito bem com o dinheiro que recebia dos grandes anunciantes, em especial estrangeiros, para manipular as informações."
5.79926579157204,-0.24723589610168134,1,pt-BR,"É possível e recomendável que o controle de pragas nas lavouras, como nematóides, seja feito de forma sustentável, sem agredir o solo e garantindo vida longa à terra cultivada. Este é o tema principal da palestra do engenheiro e doutor em agronomia pela Universidade Estadual Paulista, Jaime Maia dos Santos, neste sábado (12), de 7h30 às 12h30, durante a 13ª Passarela da Soja, na fazenda Maria Gabriela, de Célio Zution, no distrito de Roda Velha, em São Desidério."
0.153033542253923,1.090789512145284,2,sk,"Lumet, ktorý si počas svojej kariéry vyslúžil päť nominácií na Oscara, získal v roku 2005 od americkej Akadémie filmových umení a vied čestnú cenu za celoživotné dielo."
1.5833576719807072,1.9386458526980548,1,pt-BR,"Seu estilo na indumentária sempre que saísse à rua, o que acontecia diariamente na busca, junto a agência dos correios, do Correio do Povo."
3.5852079654777125,-0.43867620206932606,1,pt-BR,"De acordo com o comando do 1º Distrito Naval, depois de constatado o desaparecimento, foi solicitado que os navios mercantes da área estivessem prontos para possível resgate de náufragos."
0.009673693214062523,0.12407371479878321,2,sk,"V podstate celý nárast predpisu totiž spôsobilo administratívne zvýšenie sadzieb v zákonnom poistení motorových vozidiel, príjmy v ostatných poistných druhoch rástli pomalšie ako s 17.06."
2.032877962446829,-0.08742679019768351,1,pt-BR,"O combate à homofobia Embora provoquem choque casos como o da agressão aos jovens da Paulista, o fato é que a violência cotidiana contra homossexuais só poderá ser superada com uma mudança cultural, que não vai se dar da noite para o dia."
0.15303311020795787,0.981326450448008,2,sk,Personálna politika na súdoch by však už mala byť záležitosťou predsedu Súdnej rady – napríklad má mať výlučnú právomoc navrhovať mená predsedov nižších súdov.
0.17286902319964173,1.7474143915138736,2,sk,"Aby sa prezentovala ako technologický líder, aby ľudia, ktorí v nej pracujú, boli na ňu hrdí, aby aj okolie vnímalo firmu ako dobrého partnera."
1.494260176433498,0.27722630599887865,1,pt-BR,"Pelo que foi mostrado no evento, a estação do frio também será caracterizada pelas cores mais sóbrias (preto, azul Bic e vermelho fechado) com pinceladas que remetem ao nosso verão, também vai ter laranja, roxo, lilás, pink e mais cores vivas."
1.417265029454809,-0.03658230874968875,1,pt-BR,"Segundo a Polícia Rodoviária Federal, a mãe estaria conduzindo o Peugeot com placas de Francisco Beltrão e teria perdido o controle do automóvel ao tentar ultrapassar um caminhão cegonha."
2.3498867016910756,-0.4338196472177267,1,pt-BR,"No entanto, o fato de ela ter sido a vítima no episódiobárbaro da Uniban não nos poupa de também criticar a falta denoção da moça."
1.6428238642779496,-0.013627116922983098,1,pt-BR,"De acordo com o estudo do Ipea, 75,7% dos brasileiros conhecem a lei, 19,6% já ouviram falar da legislação, e apenas 4,5% não conhecem."
5.111952738890617,0.03211325986019907,1,pt-BR,"Em parceria com o Governo do Estado, os jovens que integram o projeto recebem uma ajuda de custo de R$ 60,00 por mês para estudarem e para participarem dos programas de desenvolvimento social na Secretaria Municipal de Assistência da cidade."
1.444145405994338,0.4151193200349149,1,pt-BR,"Barra do Garças O que mais me surpreende é ver esses ignorantes acusando Daltinho do que não sabe e ainda defendendo quem tanto prejudicou uma classe trabalhadora, ganhando dinheiro fácil."
1.8980082024373643,-0.33053272910725984,1,pt-BR,"Já a terceirização dos concursos não resolve o problema da suspeição de fraude em concurso público, já que nenhuma medida será tomada em relação aos concursos realizados."
0.2855911855630659,1.756755750922556,2,sk,"A ked hladas rovnake pripady na Slovensku, tak zrataj, kolko ich bude za rok, vzhaldom na 5 milionovu populaciu, v porovnani so skoro 60 krat vacsou populaciou."
3.1195131729934045,-0.6755601970246954,1,pt-BR,"Ao todo, o valor dos lotes de 2 a 8 passa de quatro bilhões de reais, sendo que 2,28 bilhões correspondem aos lotes 3 e 7. A licitação foi aberta em 2008, no governo José Serra (PSDB)."
0.021081618830419934,0.5736387227795569,2,sk,"Ale každý, kto si spomenie, ako vyzerali americká a britská ekonomika pred Reaganom a Thatcherovou, a kto pozná zmeny, ktoré zaviedli, si musí uvedomiť, že svet nemožno vrátiť späť."
2.046854854023361,-0.4563443865714113,1,pt-BR,"Invadiram uma casa no Alto da Brava e prenderam Pedro Cerqueira Madalena, conhecido como Pedrão ou Gordo, acusado pela policia de ser traficante de drogas."
2.9088454004580213,-0.708679493687759,1,pt-BR,"Em tese, porém, Demóstenes pode estar bem à frente, pois a soma da margem de erro com o índice de intenção de voto dá ao senador pefelista 11,5%."
0.6368037783372325,-0.06208531698025681,1,pt-BR,"Há 140 anos, em 1871, um incêndio destruiu Chicago, matou 300 pessoas, queimou 18 mil prédios e deixou 90 mil desabrigados (a cidade, então, já tinha 300 mil habitantes). Mas a catástrofe abriu caminho para a moderna arquitetura."
3.9910306079655644,-0.49687092256195553,1,pt-BR,"O músico, capa de vários cadernos de cultura do País, já foi muito chamado de sambista, mas isso nunca o limitou a usar em sua banda guitarras, pianos elétricos e bateria, cheia de levadas quebradas ao estilo do rock inglês."
0.1793730559437024,2.0537187463628155,2,sk,"Šóšovou, lebo to čo ona predvádza sa neda pozetať a jej slovenčina to je hrôza, či v Markíze stačí sa na niekoho lepiť, alebo biť partnera."
0.030726728834468465,0.747696378438273,2,sk,"Trvalo to síce krátko, ale je to pravda,“ priznáva Salma v rozhovore pre španielsky časopis V. Začiatky však mala pre svoj pôvod ťažšie ako jej americké kolegyne."
0.1728716664202916,1.8038423862467934,2,sk,"&quotZdravotný stav Roberta Kubicu je dobrý, nevyskytli sa žiadne pooperačné infekcie a jeho vitálne funkcie sú normálne,"" uvádza sa v správe nemocnice na severe Talianska."
0.7929813808406349,4.927576261833102,2,sk,"Belopotocká počas prezentácie povedala, že nápad vydať túto Bibliu dostala po tom, ako sa jej na veľtrhu dostala do rúk talianska Biblia Sacra / Svätá Biblia s Dalího ilustráciami z roku 1967. Slovenské vydanie obsahuje 105 reprodukcií biblických výjavov od tohto surrealistického majstra. Aj keď o zviazanie a zdobenie Biblie Dalí sa postarala nemecká spoločnosť Richard Mayer Buchbinderei, ilustrácie naskenovali najmodernejšou technológiou pracovníci Tlačiarní Banská Bystrica. ""Gro roboty sa odviedlo na Slovensku a na to som pyšná,"" dodala riaditeľka."
2.90783936710399,1.1016581027173646,1,pt-BR,"Eleitores que votam na escola Coronel Almeida serão transferidos Os 1.512 eleitores mogianos que votam nas cinco seções da Escola Estadual Coronel Benedito de Almeida, na rua Doutor Paulo Frontin, no centro de Mogi,.."
0.013157310447936908,0.3371533056015779,2,sk,"Patrím k tým, čo si pozrú dobrý koncert alebo predstavenie aj v televízii, neodradí ma ani nižšia a plochejšia kvalita zvuku a obrazu, ani menej citlivá réžia záznamu."
0.024772877560843915,0.7302191723669127,2,sk,"Podľa generálneho riaditeľa AG Banky Petra Jaďuďa sa však počíta s obsadením dvoch miest v orgánoch spoločnosti zástupcami Fondu národného majetku SR, ktorý je v súčasnosti rozhodujúcim akcionárom Nafty."
1.5006686286266973,-0.08580942845977059,1,pt-BR,"O outro jovem, que não quis se identificar, disse que votou em Lula, se sente traído e que vai anular o voto daqui para frente."
4.3674574981881715,-0.26293396101507055,1,pt-BR,"Também participaram da cerimônia um total de 21 bispos, mais de cem padres e familiares do bispo, vindos de diversas cidades do Rio Grande do Sul e de Santa Catarina."
0.010359257611856399,0.23589469742824323,2,sk,Euro pre všetky štáty Spoločná európska mena euro bude musieť byť podľa najnovšej dohody zástupcov európskych vlád označovaná rovnako vo všetkých členských krajinách Európskej únie (EÚ).
2.094997982071881,0.6611059549171021,1,pt-BR,"Da mesma forma, orientamos que, em caso de fogo à beira do asfalto, os motoristas parem, chamem nossa ajuda e não adentrem na fumaça""."
4.370016839850355,0.43137528989742074,1,pt-BR,"""Aquilo que dizem ser defeito pode virar virtude"", afirma o deputado João Paulo Cunha (SP). ""Tudo depende da forma como uma característica é tratada."" Integrante do Grupo de Trabalho Eleitoral do PT, Cunha contou que o estereótipo de ""durona"", colado em Dilma, será apresentado na propaganda eleitoral como capacidade de comando e gerenciamento."
2.202059412154622,-0.21868588133633804,1,pt-BR,"Para o negócio se concretizar, os detentores de pelo menos 51 por cento das ações ordinárias da Sadia deverão repassar os papéis com direito a voto que detêm para a HFF."
2.781700093655861,0.4023530763688416,1,pt-BR,"Ficou recomendado que os torcedores do Coritiba deverão utilizar os ônibus até às 13h, para que a partir das 14h a torcida do Atlético possa se encaminhar ao estádio Arena da Baixada. Segundo o Tenente Machado, a Polícia Militar estará presente em todos os terminais da cidade, junto com a Guarda Municipal."
3.682157637210431,0.35427861427027013,1,pt-BR,"Em Arapiraca, o ASA tenta se recompor da goleada sofrida em Campinas, para a Ponte Preta, por 5 a 0. O Americana, que vem de um empate, como mandante mas em jogo neutro, diante do Duque de Caxias (1 a 1), pretende surpreender para recuperar a vitória desperdiçada na estreia."
0.025448984122714718,0.664336453027793,2,sk,"Ak chce, potom sa tam objavujú veľmi zaujímavé, nové momenty, ktoré si po prvom prečítaní ani nemusíte všimnúť,"" hovorí o Malých manželských zločinoch Lasica."
1.5899343594523736,0.40860299828380797,1,pt-BR,"Antes, em 2000 obteve 589 votos e na última eleição, em 5 de outubro deste ano obteve 1.854 votos, mas não conseguiu se reeleger por não alcançar o quociente necessário."
3.353174143216441,-0.3492945576060868,1,pt-BR,"Ele assegurou que sua proposta foi precedida de ampla participação popular e citou vários lugares em que esteve para discutir o projeto. “O próprio Sérgio Leitão, que aqui está, foi ouvido durante as audiências públicas e foi ouvido em Brasília também, durante os trabalhos da Comissão Especial da Câmara dos Deputados. A SOS Mata Atlântica foi ouvida. Todo mundo foi ouvido.”"
1.6872814931330489,-0.4611165293669479,1,pt-BR,"Conforme acordo firmado durante as eleições municipais de 2008, o prefeito de Capitão, Jari Hunhoff (PP), entregará o cargo ao seu vice, César Beneduzzi (PDT)."
0.026682462151097132,0.7904986315534392,2,sk,"S reštrukturalizáciou dlhov štátov eurozóny sa neráta Vyhlásila to francúzska ministerka hospodárstva Christine Lagardeová a poprela, že by reštrukturalizácia bola v hre, pokiaľ ide o dlhy Grécka alebo iných členských krajín."
8.00721264317511,-0.9707180120230258,1,pt-BR,"Um dos maiores prazeres de Angélica é viajar. Seja a trabalho, seja ao lado da família. Garota propaganda de uma marca de malas de viagens, a apresentadora contou que na hora de sair da cidade faz questão de levar uma mala de mão. “Sempre que viajo, levo uma mala grande com tudo e uma pequena comigo, com um casaco, remédio, essas coisas que podem ser úteis durante o voo”, revelou."
2.470494046077228,-0.4881414656317431,1,pt-BR,"Neste pleito, ele pediu registro para concorrer a deputado estadual, mas foi barrado pela Justiça Eleitoral por causa da reprovação de suas contas ainda da campanha de 2008, quando se reelegeu vereador."
3.223694241271295,0.48706023491374456,1,pt-BR,"A necessidade da mãe também colaborar na garantia da renda mínima familiar, faz com que as famílias procurem, desde os primeiros meses de vida do seu filho, os Centros de Educação Infantil."
0.1578026791591482,1.3531033177639937,2,sk,"Získala ju však vo februári trojica koaličných poslancov, ktorí v novele o priestupkoch presadili, aby poslanci, ktorí sa stanú účastníkmi dopravnej nehody, nemohli beztrestne odmietnuť skúšku na alkohol."
4.322711856951264,0.5460280336974808,1,pt-BR,"De acordo com o superintendente do Aeroporto de Maringá, Marcos Valêncio, o piloto do monomotor teria pedido informações à torre de controle do aeroporto sobre como as condições climáticas na cidade de Paranavaí."
4.065970129448954,-0.9228668380032196,1,pt-BR,"3. Acreditamos que a troca de combustível nuclear é instrumental para iniciar a cooperação em diferentes áreas, especialmente no que diz respeito à cooperação nuclear pacífica, incluindo construção de usinas nucleares e de reatores de pesquisa."
1.4247173719450845,-0.2914491235406353,1,pt-BR,"“Nós já estudamos a lei diversas vezes, e nossa intenção, ao convocar esta Audiência Pública, era justamente abrir o leque de questões a partir da participação da sociedade”, disse o vereador João Fraga (PP)."
4.2936901377776895,-0.7940393899095083,1,pt-BR,"Multidões de combatentes rebeldes entraram no vilarejo através de um posto de controle abandonado pelo governo, disparando ao alto em comemoração e gritando ""Allah hu akbar!"", ou ""Deus é grande!"" Forças leais ao líder líbio Muamar Kadafi aparentavam ter se retirado às pressas do local, e segundo o jornalista, barracas estavam derrubadas, alimentos parcialmente comidos, e uma van e uma estação de energia foram incendiadas."
0.31465990094258095,0.81268070729686,2,sk,"""Tesco bude môcť vďaka tejto transakcii vstúpiť do rýchlo sa rozvíjajúceho segmentu maloobchodného trhu s obchodmi s predajnou plochou menšou ako 200 metrov štvorcových,"" uviedol Clark."
1.7352198650861788,-0.46486856583873537,1,pt-BR,"E eles, os politicos, sabem disso e nos mantem de cabeca baixa, mendigando o pao de cada dia, sem educacao, sem saude, sem atitude, sem trabalho,etc."
0.9933616753224656,-0.102662996820266,1,pt-BR,"Seja como for, mantenha um bom relacionamento com seus clientes e tenha como foco atender às necessidades e interesses deles, pois mais vale um sorriso constante que um único arrependimento."
