x1,x2,label,lang,texts
0.1696821882248566,1.729997543947307,2,sk,"Otázka by však mohla znieť i tak, prečo sa výskumným laboratóriám v connecticutskom Grotone dlho nedarí vyvinúť špičkový a jedinečný produkt, ktorým by dokázali nahradzovať súčasné. Nemuseli by potom kupovať predražených konkurentov. Pfizer dlhodobo nie je schopný sám vytvoriť exkluzívny produkt, hoci má v sektore najvyššie výdavky na výskum."
0.15951190298371873,1.4245225003199007,2,sk,"Predviedli sme sa v dobrom svetle proti Arménsku a Andorre, takže môžeme na týchto výsledkoch stavať aj v nasledujúcich dueloch proti Rusku a Slovensku,"" povedal kouč Írska Giovanni Trapattoni."
1.818781105557731,0.5300145040489034,1,pt-BR,"Por fim, Abilio Diniz informa que não desistiu de fazer mudanças no grupo, embora não deixe claro se insistirá na fusão com o Carrefour ou se buscará outras alternativas."
0.951932218182869,0.20670601614118866,1,pt-BR,"""A Itália nunca é favorita para uma Copa do Mundo e isto ajuda. Olhe a nossa história. Nós já fomos campeões quatro vezes e perdemos uma para o Brasil nos pênaltis (1994)"", comentou o treinador italiano."
0.023965226469759644,0.707696410777214,2,sk,"GB, F, D) by konecne mohla zatiahnutt s USA za jeden povraz, kedze rusky medved nikdy nespi a ktovie, s kym vsetkym je ochotny spriahnut sa.."
0.5240352207185739,-0.037653557048950154,1,pt-BR,"Se isto chegou a ocorrer, a população certamente não percebeu, pois os preços antes 'impactados' pela CPMF não tiveram qualquer redução com o final dela!"
0.022430584365882664,0.41773957469894996,2,sk,"Napriek tomu, že ide o deklaráciu, ktorá by mala niečo zahladiť a zmieriť, tak takto postavený ideový zámer iba privoláva konfrontáciu a napätie,"" povedal pre agentúru SITA."
0.019772543505431815,0.617403425807777,2,sk,"Nezabúdajme, boli to roky tej najtvrdšej diktatúry proletariátu, keď celý život v krajine usmerňovala strana a bez jej súhlasu sa prakticky nič nemohlo udiať."
0.011539082293637249,0.38799766797261603,2,sk,"Ako v utorok informoval hovorca Asociácie českých cestovných kancelárií a agentúr (AČCKA) Tomio Okamura, Slovensko je pre Čechov jasnou jednotkou pri výbere relaxačných pobytov v termálnych kúpeľoch a aquaparkoch."
0.28487076694900987,1.8361056254498835,2,sk,"Mobilné telefóny, občianske preukazy, bankomatové karty a slnečné okuliare sme roztriedili, označili, odfotili a nahodili na webovú stránku www.pohodafestival.sk. Teraz je na rade oblečenie, ruksaky a stany, ktoré sme museli najskôr vysušiť."
2.5427471426533232,-0.2396186337892298,1,pt-BR,"De sábado até a véspera do Natal, houve 34 mortes só nas BRs que cortam Minas, de acordo com balanço parcial da Polícia Rodoviária Federal (PRF)."
1.909613438169827,0.41678476543126614,1,pt-BR,"“Entretanto, tudo tem limite, ao pronunciar em discurso que teve grande repercussão que o autor teve participação ou mandou assassinar seis pessoas no bairro Estrutural, sai do que é normal e adentra a esfera do ato ilícito”, concluiu."
0.034370111429267436,1.0979759829475166,2,sk,"Property manažér IICG Luboš Rumian hovorí, že dôvodom je stály záujem nájomníkov o priestory v Avione, najmä z kategórie obchodníkov s módou. Tej má byť venovaná nielen nová fáza, ale aj priestory, ktoré vytvorí ďalšia investícia – prestavba časti existujúceho hypermarketu Hypernova. Ten sa má o zmenšiť a uvoľnenú plochu rozdelí IICG 15 novým nájomníkom."
0.009728002855411484,0.30131988037467033,2,sk,"Eurovea je i v stredoeurópskom ponímaní hodnotená veľmi vysoko, tvrdí Miroslav Barnáš, riaditeľ slovenského zastúpenia King Sturge. Podľa jeho slov kancelárske priestory ocenia predovšetkým právnické, farmaceutické a poradenské firmy a spoločnosti pôsobiace v oblasti telekomunikácií a informačných technológií."
0.015159265069465817,0.31089604609706917,2,sk,"S láskou spomína manželka a synovia s rodinami Mal som vás všetkých rád a chcel som ešte žiť, ale prišla tá chvíľa, keď musel som vás opustiť."
0.18348761265025842,2.119997339099683,2,sk,"""Stále sa pokúšame spočítať ich, ale odhadujem, že ich bolo šesť až sedem,"" povedal Crocker. Podľa neho boli vystrelené zo vzdialenosti najmenej 800 metrov, čo je znepokojujúce, ale nešlo o útok. Crocker tiež uviedol, že za takmer 20 hodín trvajúcim útokom stojí sieť Hakkání s väzbami na hnutie Taliban."
1.5059964420919874,-0.24122396086325995,1,pt-BR,"Pouco antes de embarcar, tentou, sem sucesso, alterar o destino para São Paulo, para onde sua irmã fora levada às pressas para fazer uma cirurgia."
2.1784001800764776,-0.4563378647630774,1,pt-BR,"Única exceção está no Posto São Judas Tadeu, que ontem à noite vendia o litro de álcool a R$ 1,18 (ainda muito acima de preços praticados em outras cidades)."
0.1430844100792947,0.919900627377574,2,sk,"Za kanadský tím zaznamenal gól a asistenciu kapitán Jarome Iginla, ktorý tak doviedol svoj tím k prvému víťazstvu z posledných šiestich zápasov na domácom ľade."
1.5120485346630435,-0.029694165630502083,1,pt-BR,"Segundo a família da vítima, meses antes do crime, Jordan teria contado aos primos sobre uma suposta intenção de matar a madrasta por ciúmes."
2.3133398631009703,-0.525033698714903,1,pt-BR,"É uma droga muito poderosa que gera alta dependência em seus usuários, pois seu efeito é extremamente intenso e rápido, começando de dez a quinze segundos após o uso, e não perdurando por mais de quinze minutos."
2.107309867447549,-0.42886429117653546,1,pt-BR,"Lula, com todas as suas dificuldades, trouxe para o poder a experiência de chefe sindical e de sua política, e mobilizou a nação para alguns objetivos."
0.006584283276505422,0.19839344819742066,2,sk,"Tento pohyb pôsobí ako bunková masáž, ktorá podporuje krvný obeh, otvára krvné cievy a odstraňuje ich nepriechodnosť, zlepšuje odtok lymfy a posilňuje bunkové membrány."
0.5866801673923612,-0.09173825386640082,1,pt-BR,"Pelo previsto, os governantes não poderão, a seu bel prazer, ficar colocando estátuas e outros monstrengos, em praça pública, se isso não for adequado a ela."
0.9063878182923484,0.1346823683304226,1,pt-BR,"NS do Livramento É Wilson Santos fez uma boa escolha, porque o ex Prefeito Nezinho sera um bom administrador para Sanecap, fé em Deus e tudo dará certo."
1.6641869928619233,0.7621603541473048,1,pt-BR,"O velório do baluarte será na quadra da Nenê de Vila Matilde (Rua Júlio Rinaldi, 01, Vila Salete) e está previsto para o início desta tarde."
1.0101944011587207,0.9777977521172332,1,pt-BR,"Porque quando fazemos a experiência com o Senhor, fazemos a experiência com o amor, ou seja, passamos a viver uma vida na qual se torna impossível a não vivência do amor concreto."
2.8037423296113695,-0.007129859508417359,1,pt-BR,"Hoje, a Secretaria de Recursos Humanos, do Ministério do Planejamento, possui uma comissão especial que julga os processos de retorno à administração pública desses funcionários demitidos no governo Collor."
0.0449945371479616,1.2434257050982145,2,sk,"Schusterov lekár sa z kómy už nepreberie Primár František Fabián, ktorý v roku 2000 operoval Rudolfa Schustera, za čo si od bývalého ministra zdravotníctva Tibora Šagáta „vyslúžil“ trestné oznámenie, sa z kómy už nepreberie."
3.237164980755705,-0.060939555801685016,1,pt-BR,O Dia do Silêncio é originário dos Estados Unidos e tem a intenção de “fazer o mínimo de barulho possível” em memória daqueles que sofreram e dos que morreram em razão do preconceito.
1.0522875537399385,0.004353476113769201,1,pt-BR,"A intenção dos brasileiros era que a reunião entre os comandos dos dois órgãos ocorressem nesta semana, mas tudo indica que isso não vai acontecer."
1.8835526771231408,0.7781205092690752,1,pt-BR,"Na última medição, ocorrida no dia 16.02, o nível do rio registrava 7,92 metros, sendo que, o limite da cota de alerta é correspondente a 8,5 metros."
0.6255021879537884,-0.02603290367199318,1,pt-BR,"""O objetivo é essencialmente pedagógico"", considerou Mireille, acrescentando que a meta dos legisladores ao aprovar a lei contra a pirataria não era punir as pessoas."
1.7958551092863924,-0.06732263174710515,1,pt-BR,"Alem do tal D’Alema com otimismo pregar um GOLPE “encontrar um remédio jurídico” (rasgar a constituição brasileira, que determina as atribuições de cada poder)."
1.6022258831503442,-0.2339755734867422,1,pt-BR,"Dessa forma, os direitos econômicos de André Santos ficam divididos em 40% para a Turbo Sports, 37,5% para o Corinthians e 22,5% para o Grupo Sonda."
0.02076868110126235,0.6097873645217715,2,sk,"Inak, ak by aj miestne nepríslušný súd predsa vo veci začal konať a nepostúpil by vec príslušnému súdu a keby ste túto jeho nepríslušnosť ani vy nenamietli pri prvom úkone, ktorý vám patrí, tento nedostatok by bol odstránený, teda zhojený."
0.025160352572285535,0.6127585442675072,2,sk,"Kaczynski sa v roku 2005 stal tretím demokraticky zvoleným prezidentom od pádu komunizmu v roku 1989, po známom lídrovi nezávislých odborov Solidarita Lechovi Walesovi a Aleksandrovi Kwasniewskom."
0.021071621460560595,0.6259540092176298,2,sk,"Ešte menej je to v troch severských krajinách (Nórsko, Švédsko, Fínsko), kde rozdiel v daňovom zaťažení podľa rodinného statusu je nižší ako 10 %."
0.9563875495195966,0.49484876456043864,1,pt-BR,"A entrevista coletiva do técnico Celso Roth também deu alguns indícios sobre o time do Grêmio para o jogo contra o Coritiba, domingo, no Olímpico."
3.287739715884606,2.395194472368322,1,pt-BR,"No dia do acidente, Paes havia se recusado a fazer o teste do bafômetro e o exame de sangue no Instituto Médico Legal (IML), mas passou por exame clínico na Polícia Civil, cujo resultado serve apenas para punições administrativas. Após o acidente, ele foi ouvido na delegacia de Santa Luzia, também na Grande Belo Horizonte."
4.631138725926381,-1.1413223073932184,1,pt-BR,"Apenas para o senhor ter uma idéia, os impostos pagos nas três esferas de governo (federal, estadual e municipal), alcançou a marca de mais de R$ 1 trilhão, em 2009, de acordo com o IBPT (Instituto Brasileiro de Planejamento Tributário)."
2.1248059315145387,-0.3726206263166019,1,pt-BR,"A estruturação da Defensoria Pública é necessária para que o cidadão, que não tem condições de pagar um advogado, possa ter um melhor atendimento."
0.14043913910123734,0.8461683170192936,2,sk,V Dubnici spoločnosť postaví počas prvých šiestich mesiacov tohto roka novú halu s rozlohou 3 800 štvorcových metrov na produkciu interiérových modulov a dverových obkladov.
3.3007627297893847,-0.7046771655207964,1,pt-BR,"Sem verbas concretas para melhorar a competitividade e a infraestrutura dos portos paranaenses, o aumento de recursos vai depender de movimentos e pressões estaduais junto à União. O secretário estadual de Infraestrutura e Logística, José Richa Filho, admite que não há mais verbas destinadas ao Paraná para obras maiores."
1.9719584738146463,-0.09528966999487823,1,pt-BR,"A proposta é de que haja um caminhão do Município que colete o lixo reciclável em toda a cidade, nas residências, prédios, condomínios, lojas e indústrias."
3.1310691463124405,1.1268318584850605,1,pt-BR,"Defendemos a tese de que na escola devemos ensinar a história do município, estado e do Brasil, para que se resgate a história do país em que vivemos."
0.028870997870752153,0.8361233416336199,2,sk,"Ako je známe, podľa uzatvorenej dohody sa za 40 percent hodnoty plynu dodaného prostredníctvom Slovrusgasu bude platiť ruskej strane protidodávkami slovenských tovarov,"" dodal R. Václavík."
3.637806527380717,1.32037965983573,1,pt-BR,"Quando a partida seguia para um empate, as inglesas contaram com a estrela de Clark, que entrou no time na etapa final para garantir a primeira vitória da equipe na quinta edição do Mundial. Aos 36 minutos, a atacante chutou forte para cravar o placar de 2 a 1."
2.7740817282062133,-0.28231357593358336,1,pt-BR,"Em 2010, a alta de preços medida pelo IPCA chegou a 5,91%, acima do centro da meta prevista para o ano, que foi de 4,5%."
0.7325902618869597,2.989705905673127,2,sk,"Start na historickom Karlovom moste Vo stvrtok 22. marca sa Miroslav Haninec zucastnil na Trnavskej polhodinke na drahe, kde spomedzi 70 pretekarov v kategorii do 40 rokov zvitazil a zabehol 9 kilometrov."
0.006481631569563942,0.08901841317842395,2,sk,"E. Pospíšilová, bývalá programátorka v Novej Dubnici, začula v rozhlase rozhovor o barterovaní v zahraničí, našla muža, ktorý o tom hovoril, a zháňala ďalšie informácie."
0.007435228009399595,0.09294574048161237,2,sk,"Napríklad svetová jednotka The Carlyle Group podľa rebríčka magazínu Private Equity International spravuje 89 miliárd dolárov, má 1 200 investorov a aktivity v 68 krajinách."
0.9506502872879948,0.20291741302895003,1,pt-BR,"Para testar a nova interface, basta acessar as configurações do Gmail e a aba ""Temas"" e escolher um dos dois layouts disponíveis para teste, ""Preview"" ou ""Preview (Dense)""."
2.8539163953894535,1.2943109304265452,1,pt-BR,"O remédio brasileiro será oferecido na rede pública de saúde assim que acabar o atual estoque do governo, ainda com os medicamentos produzidos na Suíça, com o nome de Rochagan."
1.860434406003647,1.3328094873090632,1,pt-BR,"Avancemos de modo a preparar as crianças para caminhar com os luminares, proclamando Tua presença na cura dos enfermos e na unção dos olhos para ver a Luz Vivente!"
1.061838304985766,-0.20979583336616617,1,pt-BR,"Se você não viu, vale a pena assistir, o filme é de 1992 e bandas como Soundgarden, Pearl Jam e Alice in Chains fazem pontas no longa."
2.277754530887558,0.17578369782403583,1,pt-BR,"O Banco de Portugal revogou a autorização para o exercício da atividade do Banco Privado Português, o que acarreta a dissolução e liquidação do banco, informa a entidade em comunicado."
0.07505507090454916,0.12008873547915037,2,sk,"Sk bankových úverov a ďalších výpomocí, ktoré však nedokázali splácať a popri nových úveroch a nových rozloženiach splátok úrokov zadlženosť SE rástla a stále rastie."
2.800802964655122,-0.722316926636597,1,pt-BR,"Frente a esse impasse, vem o anúncio de um corte orçamentário da ordem de 50 bilhões de reais para tentar desatar o primeiro nó."
1.5858846466660899,-0.27470564669639036,1,pt-BR,Guaraciaba convidou os vereadores a participarem de um requerimento ao Executivo pedindo informações sobre medidas que já teriam sido tomadas para combater a doença.
0.16449315297865685,1.5308852740692622,2,sk,"Predstavitelia nemeckého softvérového výrobcu si naopak myslia, že konkurenčné prostredie sa ani po spojení PeopleSoftu a JDE veľmi nezmení, takže vplyv na pozíciu ich firmy nebude veľký."
1.1650877876647066,0.46124757311094833,1,pt-BR,"No entanto, a comoção da morte do amado Pasolini, mesmo após ter feito “Saló – O Le 120 Giornate di Sodoma”, foi grande, mesmo tendo se desligado há anos do Partido Comunista Italiano."
0.15505184452066562,1.273036163119641,2,sk,"Manažéri firiem, ktoré sa uchádzali o výstavbu prvých osem kilometrov diaľnice Mengusovce – Jánovce, našli po sviatkoch na stole rozhodnutie úradu obsahujúce dôkazy kartelového postupu."
1.2960642585362083,0.561937775597713,1,pt-BR,"Comportamentos similares foram verificados quanto ao número de empregados a serem contratadores, com 51,2 pontos, e na demanda por seus produtos, com 51,9 pontos."
4.134587299275432,-0.47855806689428454,1,pt-BR,"É o primeiro acordo formal do PNBL com uma operadora, que vai fornecer conexão com velocidade de até 1 mbps (megabit por segundo) por R$ 35 mensais, com um mínimo de 20% dessa velocidade garantido. Início da venda para o consumidor final nas quatro primeiras cidades é até setembro de 2011."
0.44950084498018883,1.6533327739117785,2,sk,"Je hviezdou nielen jazzovej, klasickej a worldmusic scény, ale je zároveň aj prvým hudobníkom, ktorý akordeón ako hudobný nástroj priniesol na významné jazzové festivaly a do noblesných koncertných sál."
0.3119174114398688,0.7675548170307029,2,sk,"Národnú či politickú slobodu, spravodlivý demokratický systém bolo potrebné vybojovať a tým, čo sa do tohto boja zapojili, patrí podľa Gašparoviča česť a sláva."
2.2635487479751313,-0.43319406145837097,1,pt-BR,"Há quem aposte que o ninho tucano anda preocupado com a ascendência de Vanderlan Cardoso nas pesquisas, sobretudo depois de informações das qualitativas e, por isto os ataques ao cabo eleitoral dele, Alcides Rodrigues."
0.4296508920809898,2.8643811791129856,2,sk,"A asi každý reálne zmýšľajúci človek musí byť pripravený na to, že si na istú dobu sadne na istú stoličku a po čase je potrebné z úplne prirodzených dôvodov ju zmeniť."
3.063477311878556,1.6982307075469263,1,pt-BR,"Além de Jaboticatubas, há Encomenda das Almas nos distritos de São José da Serra, São Sebastião do Campinho e na comunidade quilombola Mato do Tição, todos na Serra do Cipó."
0.15585947603732223,1.3038052944681173,2,sk,"Každý z nás je odsúdený k tomu, aby existoval mimo bezpečia hotovej a danej podstaty, človek je odsúdený byť slobodný, a preto si musí voliť svoj postoj v každej situácii, tvrdil Sartre na začiatku svojej kariéry."
2.6031306629819677,-0.27089786938155536,1,pt-BR,"Quando esse trabalho for concluído, o Governo do Estado vai fazer uma licitação para que uma empresa implante a pista de pouso, terminal de passageiros, entre outros serviços."
0.003925955618989575,0.12817694431447352,2,sk,"Samozrejme, firmy, čo už mali drvivú väčšinu výnosov i nákladov v eurách, nemusia poklesy v domácej mene spôsobené jej výrazným zhodnotením v predchádzajúcich rokoch trápiť."
2.5935355853594637,0.0557635366629348,1,pt-BR,"Mas, ao aplicar a técnica de detecção de mentira, uma eficiente ferramenta investigativa, o auditor ou o investigador aumenta a eficiência na detecção de ações e procedimentos impróprios."
7.3790537861177805,-1.089464886153474,1,pt-BR,"A quantia de R$ 300 milhões será cortada do orçamento do Estado por meio de ações e obras de diversas secretarias. Mas o secretário Chefe da Casa Civil, Eder Moraes, que fez o pronunciamento em nome de Silval Barbosa, garantiu que os recursos da Saúde, Educação, Segurança e as obras da matriz de responsabilidade da Fifa não vão sofrer nenhum tipo de corte."
0.8814751840643595,0.7930898056190041,1,pt-BR,"Com o triunfo nesta 16ª rodada, o time santista vai para as três últimas rodadas dependendo apenas das suas forças para obter uma vaga na semifinal."
0.006095490100207814,0.17650886862303036,2,sk,"Hlavnými dôvodmi nevyužívania internetu u tých, ktorí by ho mali záujem využívať, sú absencia prístupu doň (63 %), respektíve k počítaču (57,1 %) a chýbajúce technické znalosti (57,3 %)."
0.29987196929897775,2.2935687677422747,2,sk,"Citoval bývalého predsedu menšinového úradu Antala Heizera, ktorý na prvej podobnej konferencii v roku 2006 povedal, že sa začal proces, ktorý nemožno vrátiť späť a ktorý kladie nevídanú zodpovednosť na celoštátne samosprávy."
0.14044032940200984,0.8527814988968344,2,sk,"1. Zvýšená konkurencia najmä zo strany nových výrobcov obalových materiálov v krajinách strednej a východnej Európy diktuje požiadavky na vysokú kvalitu, krátke dodacie lehoty a dlhé lehoty splatnosti."
2.630166073984153,-0.25253057908907023,1,pt-BR,"Em carta aberta à população, os funcionários dizem que a situação dos servidores do MTE ""é de completo descaso, penúria e precariedade, com salários irrisórios e condições degradantes de trabalho""."
1.670845498084403,0.44561371187557886,1,pt-BR,"Nessa compra, o efeito da substituição tributária foi grande porque dos R$ 420,11 consumidos, R$ 180,27 (ou 42,91% do valor da nota) correspondiam a produtos que estão no regime do ICMS antecipado."
1.681978865728405,-0.061202222998079335,1,pt-BR,"Tarcísio Botacin, que é professor, descreveu o que também conhece da realidade e que no entanto não há um trabalho para converter a situação."
0.14465465357565022,1.0113150290910355,2,sk,"Pohľad padne na posúvač času – interaktívnu hračku, akési zásuvky, s ktorými možno ľubovoľne manipulovať – sú v nich dokumenty, fotografie, obrázky, ale aj časti dobového oblečenia."
2.049657922989633,-0.32874102084590606,1,pt-BR,"Um fato extremamente lamentável, mas que sirva de exemplo para quem for beber e depois pensar em dirigir, mesmo que o acidente envolvendo a jovem não tenha sido necessariamente causado por essa combinação."
0.1641444800032558,1.4694443123620369,2,sk,"Merjavý tvrdí, že nahrávky obsahujú poradu, na ktorej sa hovorilo o tom, ""kam a koľko peňazí išlo z prostriedkov firmy KAME"", či debata s pracovníčkou Štátneho fondu rozvoja bývania, kde ona popisuje schvaľovanie financovania výstavby bytov."
1.788919284193224,-0.2369140257837132,1,pt-BR,"Como nao li nenhuma sentença, espero que este site, sério que é, publique algo que comprove as acusações, assim é possível emitir ponto de vista."
1.5642830720074257,0.15662981998535672,1,pt-BR,"E está nas mãos do Secretário, se ele achar que Penedo merece receber esse evento, nós daremos a contra partida que será toda a conjunção da área física e da areia."
2.1881945371643154,1.450575800465486,1,pt-BR,"Na primeira entrevista que concedeu à televisão, na manhã da quarta, 22, ela declarou que foi o presente mais importante que já recebeu em todos os aniversários que já viveu."
2.2222362486050615,0.29437605283702933,1,pt-BR,"Recentemente, na rodovia Fernão Dias, um jovem foi surpreendido com uma mala cheia de dinheiro por policiais, quando estava num ônibus, e foi detido como suspeito de crime."
1.9295336767478366,-0.006388969451010561,1,pt-BR,"Da mesma forma, do outro lado, uma dobradinha com Dilma Rousseff e Ciro Gomes seria de balançar qualquer roseira, ainda que dela nem se cogite."
1.5734166523627842,-0.03167700455709917,1,pt-BR,"Preparadíssima Adriana coordena movimento feminino para eleger Wilson Coordenadora do movimento ""Mato Grosso Mulher 45"", a arquiteta Adriana Bussiki participa ativamente da campanha de seu marido, candidato ao Palácio Paiaguás, Wilson Santos (PSDB)."
0.1653287227861763,1.6296932252325727,2,sk,"Pred časom sa mi ozvali z televízie, že by chceli pripraviť nejakú reláciu pro príležitosti mojich šesťdesiatín s tým, že hudobné aranžmány by mal na starosti Petr Malásek."
0.3122825236993723,2.6427600590608127,2,sk,"Väcšine študentov prospejú dodatočné konzultácie so špecialistom na dyslexiu. Tieto konzultácie sa pritom nedotýkajú predmetu/ obsahu študentovho štúdia, ale sa zameriavajú na všeobecnejšie otázky ako sú alternatívne študijné zručnosti a stratégie opakovania, organizovanie pracovnej zátaže a zvládanie stresu."
0.9017165118685808,0.014060534304033423,1,pt-BR,"Os acontecimentos que se seguem levaram Johnny, cujo nome verdadeiro é Jesse James Hollywood, a se tornar o mais jovem traficante a entrar para a lista dos procurados pelo FBI."
1.249783107424476,-0.06576776094888472,1,pt-BR,"Fico Muito Feliz em ver que nem tudo esta perdido, que temos pessoas, da melhor qualidade, escrevendo com toda liberdade, “Graças a Deus”, neste país Maravilhoso, hoje é Possível!"
4.970728663196612,-1.2084033891741728,1,pt-BR,"Em 1996, um teste realizado com amostras de bigode e cabelo de Brahe, obtidos durante uma exumação de 1901, mostrou que havia níveis elevados de mercúrio, o que leva a uma teoria de envenenamento e assassinato."
1.1367076818131128,1.0758525108671961,1,pt-BR,"Vendas no varejo caem 0,2% na zona do euro As vendas no varejo nos 16 países que utilizam o euro como moeda caíram pelo segundo mês seguido, in.."
0.051649668084297135,1.5061805738338927,2,sk,"Vyskúšal som si to, ale domov sme sa nevrátili ako milionári,“„Podľa toho, ako je Amerika ospevovaná, tak po návšteve Los Angeles si myslím, že my máme doma Ameriku."
1.6342524726286283,-0.44663240530002757,1,pt-BR,"Segundo as farmacêuticas Ana Cristina (gerente) e Roseli Martins, a FP atende a qualquer tipo de receita, seja de órgãos públicos, entidades filantrópicas ou particulares e convênios."
3.387456302588444,-0.5342479482589259,1,pt-BR,O Ministério da Saúde anunciou hoje o cronograma de imunização contra a gripe suína (H1N1) e investimentos contra a segunda onda da doença. Serão 83 milhões de doses da vacina. A estimativa do governo é imunizar 62 milhões de brasileiros.
1.3439656103487787,0.18675429549885716,1,pt-BR,"Alan Schoeninger entra para história da entidade como o primeiro representante do Democratas a assumir a União Catarinense dos Estudantes, ainda que por um curto período."
2.3407967208782345,-0.22122826977225551,1,pt-BR,"O líder do DEM no Senado, senador José Agripino Maia, já se manifestou favorável à formulação de um elenco de proposições partidárias para ser apresentado à presidente Dilma Rousseff."
1.3127641289649634,-0.2610617904008103,1,pt-BR,"Os acidentes de trabalho podem aumentar, pois o assediador pode levar ao trabalhador ansiedade e insegurança, assim provocar acidentes ocupacionais que devem ser comunicados."
1.9277984289779093,-0.0634255380811524,1,pt-BR,"Mano Menezes, técnico do Corinthians, foi sugerido por Andrés Sanchez, chefe da delegação brasileira e presidente corintiano que hoje em dia é quase o melhor amigo de Teixeira."
